,company,headline,date,overall_rating,author_position,pros,cons
244,First Republic Bank,OK,2020-05-15,3.0,California,Lots of nice people work there.,Management often seems a bit unrealistic.
245,First Republic Bank,Good experience.,2020-05-17,4.0,Director,"Compensation,benefits. Quality teams to work with.",Fragmented technology systems. Conflicted management at times.
246,First Republic Bank,Not your typical bank,2019-09-19,5.0,Quality Control Specialist,Great pay & benefits. Subsidized cafe serves decent food and can save a lot of money if you're not one to pack lunches everyday. Hard work is recognized and the bonus structure is better than most companies.,Some favoritism and office politics sensed amongst upper management.
247,First Republic Bank,A great place to learn and do fulfilling work,2015-01-12,5.0,Data Manager,"I have been here for 4+ years. FRB is ""not just another bank"" -  it is a very successful, greatly respected full service financial firm that has retained many positive qualities of a start-up or a family business.
1. Our attention to customers and clients is off the chart
2. Very, very flat organization - I can approach anyone with an idea or a contribution
3. Cafe - from Wolfgang Puck
4. Pay for performance
5. You get your birthday off (I don't know of any other finance firm that offers something like that)
6. I get to work every day with very smart, very committed, very focused people","1. The pain associated with growth - we have grown explosively since we became independent in 2010
2. Management can trend too conservative sometimes, but I see it improving - they are becoming more open minded and aware what they need to do to be a competitive employer"
248,First Republic Bank,One of the best companies I have had the pleasure to work for!,2019-09-09,5.0,Associate I,"Company Cafe, lunches, quarterly bonuses",Company should provide advanced training for more complex issues.
249,First Republic Bank,Great Company!,2019-11-10,5.0,Preferred Banker,They treat their employees like their clients - go above and beyond for them!,None really to complain about.
250,First Republic Bank,"More loan processor than underwriter, and not by choice",2016-07-06,3.0,Senior Loan Specialist/Credit Analyst,"- Well compensated, with competitive salary and comprehensive benefits package
- Growing company with a strong business model: Community bank but for the affluent
- Worked with experienced, intelligent credit managers, relationship managers, and line staff - though I did not like all of them personally, I grew to respect just about everyone I worked with at FRB.","- Leadership caters to relationship managers above everyone else; definitely feels like a hierarchy in which everyone is in service to the sales people. As a result, quite a few of the RMs are high-maintenance egomaniacs. 
- Lack of management support: regional sales director could not control the RMs under her; support staff were overworked and castigated for not meeting deadlines and/or making errors. 
- Poor approach to training new employees: I witnessed managers and line staff either refuse to train others or else train others (me) poorly. It felt like my manager and coworker jealously guarded knowledge because they feared training others would threaten their job security. 
- Although one of the company's values is ""have fun"", the pressure to underwrite and process a high volume of complex transactions on a regular basis - with little to no management support at times - limits one's ability to do so."
251,First Republic Bank,Great place to work,2019-10-24,5.0,Director of Talent Acquisition,"Team members, benefits, growing company and solid culture",I have been here almost a year and haven't found one.
252,First Republic Bank,FRB Life,2019-07-29,1.0,Data Analyst,"Good colleagues, cafe food is healthy and subsidized, and the work is rewarding by allowing you to expand your skills and take on more projects.","Pay and benefits are way  below market rates for comparable data analyst and data scientist roles. 

The Bank is currently ""consolidating"" (downsizing), so managers will use analysts for a project of the analyst's expertise then let them go.  

Career progress and promotions are limited, they would rather hire new people than retrain/repurpose current employees.

Managers will assign multiple simultaneous projects without a realistic understanding of the project time commitment."
253,First Republic Bank,Great Culture,2019-11-04,5.0,Preferred Banker,"Good Pay, subsided cafeteria, good culture",Very busy and demanding work load
254,First Republic Bank,Typical finance culture,2020-02-01,4.0,Commissioning Engineer,"Nice people, friendly environment, perks",Long hours and management that expects a lot out of you. They need FRB to be everything you live and breathe. Lots of politics.
255,First Republic Bank,I really like this company,2019-10-23,5.0,Analyst,great culture and employee events,not a clear organizational structure
256,First Republic Bank,a great opportunity if you don't mind hard work and higher stress,2019-12-16,4.0,Loan Specialist,Good people that care about you and the company is generous- however team to team is very different,"high stress and high reward, do not take errors lightly"
257,First Republic Bank,Good place,2020-02-14,4.0,Relationship Manager,High end clients with good taste,High pressure environment with interesting tactics
258,First Republic Bank,Great benefits / ok management,2019-09-09,5.0,Client Service Associate,Great benefits so they can keep you here,Management could be better. There is a lot of organization and sometimes no follow-through.
259,First Republic Bank,Decent company,2020-02-14,4.0,Systems Engineer,Good benefits and some work life balance,"Lots of red tape, but it is a bank."
260,First Republic Bank,Great people make the stressful days worth it,2020-01-16,4.0,Preferred Banker,"- Amazing co-workers
- Great benefits
- Never bored","- Long hours
- Difficult work/life balance"
261,First Republic Bank,Associate Review,2020-01-13,4.0,Associate,FRB had good pay and gave access to a lot of learning experiences.,Work-life balance was tough and a focal point of employees
262,First Republic Bank,lay back and political banking,2020-01-13,2.0,Data Analyst,"cafe is good, benefits are good",super political and boring work
263,First Republic Bank,Amazing Company,2019-08-25,5.0,Customer Service Representative,"Team environment 
Socials 
Growth Opportunity","None, the company was great"
264,First Republic Bank,Culture,2019-07-11,5.0,Analyst,Everyone at the company seems to have the right culture and willingness to help.,I don’t have anything bad to say about the company.
265,First Republic Bank,Pros and Cons,2019-11-27,3.0,Data Scientist,"Great location, employee banking promotions, and reasonable work load.","Business operations are very slow, and culture is hierarchical."
266,First Republic Bank,"Poor management, bad processes, lack of collaboration, few opportunities and awful communication.",2013-10-23,2.0,Anonymous Employee,"The compensation is ""okay"". It's not at the bottom but definitely not at the top. Especially since this bank produces more revenue per employee than most other firms. 

If you work at a corporate office, you have the advantage of goingto eagle cafe. You can get a solid breakfast and lunch for a fairly cheap price (especially in SF). 

Some of the people here are fun to work with it.","I will admit, when I first started at FRB I was so excited because I had always wanted to work here, that it casted a huge shade over all that was wrong with the workplace. I was told we were in transition and working towards the better so the environment would be less toxic. 3 years later, guess what? I still get that exact same message. 

Before I started here, even one of my trusted recruiters told me to reconsider. There is a high turnover rate, which is also a bad sign. There are rutheless management practices. I've seen people get fired for consistantly meeting all expectations. 

More than anything, is the quote that I and a few of my colleagues received from our VP in a skip level meeting, 

""I have no intention of doing any internal promotions. If we have hire level positions open, we'll just hire experienced staff to come in. If you want a hire position, you'll move on to another company. That's just corporate culture."""
267,First Republic Bank,"Never a Dull Moment: High Growth, Fast Paced, Meritocracy",2014-09-09,5.0,Anonymous Employee,"The people.  I am fortunate to work with some truly amazing people who are incredibly smart and experienced and who have high standards for themselves, work hard, enjoy what they do and know how to have fun.  I get to work with people who have a passion for service, enjoy doing the right thing and have a desire to help others.

The culture. There is a shared belief in the importance in and value of collaboration, the team, responsibility, trust, empowerment and accountability. 

The pace.  One of our values is quite literally reflective of how we operate: move fast, move forward. This creates a work day filled with a lot of activity and I enjoy being busy, having a lot to do and working in a fast paced environment.","If you are looking for a job or a company that is focused on a 9 to 5 work day, this is not the place for you."
268,First Republic Bank,They will lie to you in the interview to fill roles with high turnover,2019-06-12,2.0,Consumer Services Associate,"Great pay, great benefits, friendly coworkers, very beautiful office space and facilities, wonderful products.","Absolute lies in my interview. THIS IS A CALL CENTER FOR RESETTING PASSWORDS - NO FINANCIAL EXPERIENCE - NO WILL HIRE YOU UPWARD AFTER YOU TAKE THIS ROLE. You WILL work every weekend, you WILL work random shifts, you WILL be held responsible for your managers' mistakes, you will NOT get most holidays off, you will NOT get training and promotions as promised, and you will NOT be allowed to get promoted internally (except if you have nepotistic connections)."
269,First Republic Bank,A great company with huge flaws,2015-10-29,3.0,Anonymous Employee,"First Republic has a good reputation as being a high net worth customer bank. The business units value their customers, which is really smart. First Republic has good benefits. They have a subsidized café run by Wolfgang Puck for employees, which is very nice. Jim Herbert is a great CEO and leader, but he’s only one guy.","Certain executives push their employees beyond their limits, making it difficult to manage work/life balance. Non-sales departments are VERY short staffed. Inefficient operational processes cause middle management burn-out. Support staff worked to death while sales people get bonuses and preferential treatments. Nepotism and favoritism is rampant especially among senior management. Loyalty is expected of employees but not reciprocated. No true HR functions, HR’s true purpose is to protect the company and senior management, not the employees. Managers are allowed to hire/ fire and promote based on cronyism rather than merit."
