,company,headline,date,overall_rating,author_position,pros,cons
68,First Republic Bank,Review,2021-12-27,4.0,UC Analyst,Good culture of commutation between departments.,No big on IT & supporting there IT folks.
69,First Republic Bank,Great Culture and Work Environment,2021-10-24,5.0,Currently Unemployed,"Great Culture
Very Smart Colleagues
Paid well",No major cons - sometimes hard to learn as the internship was partly remote
70,First Republic Bank,Client Centric,2021-11-05,5.0,IT Service Management,Great company and people focused,Culture eats process for lunch.
71,First Republic Bank,Excellent Employer,2021-10-14,5.0,Senior Recruiter,"The collaborative culture is world class. In addition, the organization is people oriented, client focused and entrepreneurial.","Technology is a bit lacking, but teams are working to improve this"
72,First Republic Bank,Good Culture company,2021-09-20,5.0,Credit Analyst,First Republic Bank has a strong culture and the CEO definitely cares about the well-being of his employees,"Relatively to the rest of the silicon valley, FRB's compensation structure is not the most competitive"
73,First Republic Bank,Best executive team in the business,2021-06-21,5.0,Finance Director,"First Republic is a special company that genuinely believes that their people are the reason for the bank’s tremendous success.

Jim Herbert, the Bank’s founder, is the second-longest running CEO in the S&P500, behind only Warren Buffet. Despite his success, he is still very humble and kind.

Gaye Erkan, the Bank’s President (and apparent front-runner to become the next CEO) is awesome. She truly cares about the employees and leading a responsible business. She would, without a doubt, make a be an amazing CEO when Jim decides to retire.","First Republic is a fast-paced, entrepreneurial company which may not be for everyone."
74,First Republic Bank,Toxic Work Environment,2021-12-04,2.0,Investment Associate,Onboarding manager was great. Many of the partners were wonderful.,Team structure and commission based business model creates a toxic and ethically dangerous work environment.
75,First Republic Bank,"""Empowerment"" is not a thing here.",2021-09-09,2.0,Specialist,"-Good benefits, medical, dental, commuter, fitness, etc. 
-Decent pay.","If you're not willing to be a pet of your manager, you're not going anywhere. Only the ones who praise their managers on a daily basis will move along in the company. Managers pretend to know what is going on with the daily duties, but this is far from the truth."
76,First Republic Bank,A Great Place to Work and Grow,2021-09-10,5.0,Credit Analyst,Managment wants to see you excel and progress in your career. They will put in the effort if you do.,None to note. Some long hours every once in a while but nothing too overwhelming.
77,First Republic Bank,Review,2021-11-09,3.0,Senior Data Analyst,"Good benefits
Diversity inclusion
Cafeteria is good","- No work life balance . Management keeps saying everyone to have a work life balance but it’s just words. Expected to work 50- 60+ hrs every week. - No replacement when someone leaves. 
- No proper mentor for career growth."
78,First Republic Bank,Amazing place to work,2021-09-21,5.0,Senior Preferred Banker,Awesome mentors. Can do attitude. Not at all siloed. Lots of mobility opportunities. Incredible benefits.,"A little bit of Kool aid drinking, but I accept it."
79,First Republic Bank,Treats its employees well,2021-07-26,4.0,Senior Program Manager,"- The company treats its employees very well with exceptional benefits and special gifts such as a summer beach bag in the summer or hot chocolate in the winter
- Colleagues are generally very nice and collaborative
- The compensation is great...above a certain level
- The Cafe is very good value and has excellent food","- No clear career path
- Promotions seem to be based on personal reputation rather than actual results, and how you gain that reputation is very oblique
- People are hesitant to provide honest feedback; it's more important to be nice"
80,First Republic Bank,Review,2021-10-06,5.0,Associate Director,The bank provides great benefits,Not too many cons per say
81,First Republic Bank,Good pay and excelled benefits. Team culture is outstanding.,2021-08-02,5.0,Consumer Services Associate,"The bank has a client focused culture, which is great IMO. Comp and benefits are very nice. The SF cafes are super affordable but the food is very high quality.",Only one or two departments in the bank work weekends - I happen to be in one of them. Commuting into the city can get challenging and expensive.
82,First Republic Bank,"Great culture, best bank",2021-09-23,5.0,Senior Associate,"- culture
- flat organisation 
- tech savvy 
- growing business",- salary is not the best
83,First Republic Bank,Great place to work - improve work/life balance post pandemic,2021-07-20,4.0,Anonymous Employee,"Great teams and great people, opportunity to move up and try new areas of interest. Great place to both start and continue a career.","The fact they want people to be back in the office most if not full-time beginning September is a slap in the face to all of those that took the time to submit the exec team feedback over the last year and a half. If people wanted to be back in office, there would be MUCH larger numbers already returning as it is already optional. So why aren't there people in office now then (June/July), outside of the depts that are required to be in office? There'd be no need to bribe people (offering free lunches, etc.) that departments are trying to do. It's appalling after all of this past year and a half the exec team is still turning their heads to the fact people -- especially the millennial employees -- have expressed not wanting to go back, or at least having a say in how much they return. Taking the choice away from employees will only continue to make them leave. Is it really worth losing amazing employees? The bank will become much less attractive when recruiting and being unable to offer the flexibility that other companies across the nation will offer. There has to be tradeoff and incentive for our employees to stay. Just trying to express how many many many people feel they cannot voice to our exec team."
84,First Republic Bank,Amazing culture and company,2021-07-27,5.0,Administrative Assistant,"Very supportive, upbeat and diverse work environment. FRB really invests in their employees and provides them with opportunities for growth and to be successful. 10/10 recommend working here.",No complaints about this company as its truly an amazing place to work. Lots of benefits and opportunities to grow. They really value their employees.
85,First Republic Bank,Company cares about employees,2021-11-06,4.0,Associate,I feel this company cares about their employees. They offer different types of benefits to help their employees make through difficult times.,Salary is not very competitive.
86,First Republic Bank,digital specialist,2021-09-11,5.0,Digital Specialist,good culture and incentive system,need newer technology offerings for clients and employees
87,First Republic Bank,Good,2021-09-11,5.0,Quantitative Analyst,A good place to work if you have a good manager,"Not everyone has RSU, unlike big tech companies."
88,First Republic Bank,Awesome Company,2021-07-28,5.0,Anonymous Employee,great benefits great culture. Very professional and upscale. Lots of room for advancement as well. I loved working for thos company,i cant not say that there were any cons about working here except the fact that some times we would have to deal with rude cliemts but that os everywhere you go.
89,First Republic Bank,Great Career Experience,2021-10-01,4.0,Prefer Not to Say,"The company is all about treating their clients well-in turn, they treat you well. Lots of autonomy when it comes to making the right decisions for them.","Some opportunities for growth can be limited, especially on the retail side-not a deal breaker. Be clear on your career path and the company will help you grow."
90,First Republic Bank,Be weary (please replace this with previous submission),2021-09-01,2.0,Risk Manager,Onsite cafe that offers variety of options,"The reviews about the risk management department and the chief risk officer are true. This department is run by fear and favoritism. NOT SURE WHY THIS HAS BEEN ALLOWED FOR SO LONG. Smart ones have left, those left behind are looking to get out."
91,First Republic Bank,na,2021-11-11,3.0,Third Party Risk Manager,"remote contract
met some very nice people",I would rather not say
92,First Republic Bank,Great Company to work,2021-08-09,5.0,Digital Analytics Manager,"Company Culture and Leadership is amazing, the core leadership cares for employees","Internal Politics, Technology Delays, teams work in silos and cause a lot of dependencies and unnecessary bureaucracy"
93,First Republic Bank,"Great culture, fast-growing company",2021-06-24,5.0,Director,"Great culture, people really care about each other. Especially for a Bank, very entrepreneurial with minimal bureaucracy. The Bank is growing fast, which is exciting and motivating. Jim and Gaye are inspirational leaders with a strong vision for the company. They go above and beyond to take care of employees, especially during the pandemic.",Work/life balance can be challenging.
94,First Republic Bank,Best Place to Retire,2021-07-14,5.0,Relationship Analyst,"ESPP
Subsidized Kitchen, 
free coffee, 
beer Friday
$3600 student loan/529 subsidy
$150/ quarter stipend,
$1500/year HSA account subsidy
new phone reimbursement every 3 years
great company culture","no structure for career advancement
depends on the team, may have no bonus"
95,First Republic Bank,Loved it!,2021-07-31,5.0,Digital Banking Specialist,Loved everything about the company and the role! Great place to work!,No cons that I can think of at this time! It was great!
96,First Republic Bank,Great place to work at,2021-07-13,5.0,Front End Developer,"Great benefits. 
Breakfast, lunch available with only around $3 of payment. 
People are extremely nice!",It really depends on which team you are at. My team didn't use most updated technologies due to application uses.
97,First Republic Bank,"Wonderful benefits, great co-workers, terrible everything else",2021-10-01,3.0,Consumer Services Associate,"amazing benefits, the company really knows how to take care of its employees!","terrible management that plays favorites, terrible work/life balance"
98,First Republic Bank,great,2021-08-03,5.0,Junior Data Steward,good environment and the food is good,slow work sometimes and horrible commute for some
99,First Republic Bank,Good company,2021-10-07,4.0,Coordinator,I guess Good salary and benefits,"Tough work life balance sometimes , leadership is so so"
100,First Republic Bank,Fine Place To Work,2021-10-09,3.0,Client Service Associate,Benefits are consistent to competing firms,Leadership structure can be disfunctional
101,First Republic Bank,Great place to be,2021-06-28,5.0,Banker,"- really cares about employees
- interesting client base
- a lot of autonomy in work style",- generally understaffed which can make it difficult to move up because you become essential to a certain function
102,First Republic Bank,Great company with amazing benefits,2021-05-11,5.0,Operations Associate,"I enjoyed my pay and benefits. Also outside of a few, people were generally friendly and the culture was welcoming. Company is growing as well so there's a good amount of opportunities.",Work/life balance was pretty poor though prior to the remote environment. You spend a lot of time in the office. I can't speak for how it is in 2021.
103,First Republic Bank,Credit Analyst,2021-07-27,5.0,Credit Analyst,Company has great benefits and culture,Nothing comes to mind for cons
104,First Republic Bank,Awesome company,2021-07-15,5.0,Director of Talent Acquisition,"Culture, benefits, people and leadership",Long hours :) but I love what I do
105,First Republic Bank,Benefits,2021-09-18,4.0,Data Architect,Great place to work for. Good People and good team.,Very dynamic environment and professionalism is required
106,First Republic Bank,Excellent benefits,2021-06-17,5.0,Client Service Associate,I was able to pay off the remainder of my student loans via the Gradifi program.,"Depending on your department, it is difficult to get clear milestones to promotion."
107,First Republic Bank,Specialist,2021-07-15,5.0,Anonymous Employee,"growing firm, great focus on service for their clients",bi-coastal teams and long hours
108,First Republic Bank,Has Potential To Be Far Better,2021-08-10,3.0,Client Service Associate,"-Great Pay and Benefits
-Knowledgable co-workers
-People willing to help you when possible
-Ability to learn of different careers and paths","-Lack of formal training program
-A lot of extra work due to inefficient processes and technology
-Lack of work/life balance 
- Good culture, but it is still corporate in many ways"
109,First Republic Bank,Great company culture and overall fantastic place to work,2021-03-09,5.0,Digital Banker,"They practice what they preach, aka they take the company values very seriously and integrate them into day-to-day work. 
Great pay and solid benefits
Awesome company culture - full of like-minded folks, yet there's enough diversity so that it doesn't feel one-note. Everyone here works hard but knows how to have fun.
Lots of ability for career advancement and managers seem to be interested to help you grow within the company and pursue your interests",Poor work-life balance. Long hours and stressful days.
110,First Republic Bank,Great company but your experience may vary significantly,2020-05-26,2.0,IT Staff,"Money is good and benefits are outstanding.  I really mean that.  The benefits here are beyond any expectations I would have had. .   

The technology stack is really forward looking and you can directly influence that.  That's not something you can say at most companies of this size.  Working here is a chance to really affect outcomes at the ground floor.    The building blocks are there for this to be the absolute best place to work period.","Highly siloed teams.   Working cross team is more akin to working between unrelated companies.     Decisions are made by managers many levels above and there are no thoughts for how it affects those below.   The decision is made and the decree is sent.    The banking lines of business (clients, money, investments) and lines of the business that are not directly client connected work very differently.   Consider that when reading reviews.     

Your success here is highly dependent on your silo and your managers political pull.   If you have the wrong manager you're not going anywhere.   All titles are not equal.  Just because they appear to be peers doesn't mean they have similar influence.   Appearance matters over everything.  You have to be a cheerleader at all times or your career is done.   No one wants feedback that isn't how great they are doing."
111,First Republic Bank,Collateral Valuations,2021-06-28,5.0,Production Associate,"Flexible Work Hours
Good Base Pay
Good Benefits",Little Supervision for new employees
112,First Republic Bank,Progressive,2021-06-14,5.0,Mailroom Clerk,"Teamwork, great benefits, employee cafeteria",None that I can think of
113,First Republic Bank,Great place!,2021-06-12,5.0,Anonymous Employee,Best people in banking. Good food and offices.,A little old fashioned at times
114,First Republic Bank,Great Place to work,2021-06-07,5.0,Account Executive,Great place to work. Highly recommend,There are no cons of note.
115,First Republic Bank,+,2021-06-11,5.0,Senior Director,"+ culture, opportunities, growth, team, entrepreneurship","no cons, great environment and company"
116,First Republic Bank,Work life balance,2021-07-22,3.0,Senior Risk Analyst,"Great Cafe
Good mentorship program
People willing to help at various levels
Decent benefits",lack of diversity at different levels of management
117,First Republic Bank,No growth,2021-03-04,4.0,Compliance Specialist,"The executive management is amazing, Great benefits and a humble bank. CEO is wonderful, the same with the entire upper management team.","Hard to advance and direct manager does not have any experience in managing. Suggest for HR to check in on managers as some are not fair and play a lot of favoritism, others that are qualified have to work harder to show skills while those with no experience get away with everything and do so little."
118,First Republic Bank,Great culture,2021-05-05,5.0,Client Relationship Analyst,Great to collaborate with colleagues. Company values employees and want to make sure we’re taken care of.,Technology needs serious improvements and people work around the clock
119,First Republic Bank,Watch out! Mass Employee Exodus,2021-07-14,1.0,Analyst,Lots of solid employee benefits. Company is incurring significant growth.,Departments are understaffed and everyone is overworked. Employees are expected to come back to the office 100% as if the pandemic never happened. Most people that I know have started looking for other jobs since most companies offer remote work and can offer better work/life balance.
120,First Republic Bank,Associate,2021-07-13,3.0,Associate,"Good people, pay, benefits, and culture","A lot of politics influencing management and hiring. Many have kids, family members, connections of clients that will get promoted before someone who has no ties."
121,First Republic Bank,Tools,2021-07-27,4.0,Manager,Great place to work and great work culture. Good management. Good customer focused work culture and environment.,Not too many cons to think of and elaborate per se as required by this.
122,First Republic Bank,great company,2021-08-04,4.0,Relationship Banker,benefits and company culture are great. Teamwork and customer service are top priority,Some offices depending on the manager can be micro managey
123,First Republic Bank,Great benefits and culture,2021-05-18,5.0,Lending Specialist,Great benefits and pay. Lots of extra perks.,Long hours are not required but expected by management.
124,First Republic Bank,Best culture,2021-05-21,5.0,Associate,Everyone is supportive and helpful with a common goal of success.,None I can think of!
125,First Republic Bank,Great place to work!,2021-05-20,5.0,Recruiting Coordinator,Very great culture and friendly environment.,Onboarding can be an issue at times.
126,First Republic Bank,Good Company Culture,2021-07-27,3.0,Client Service Associate,"Good company culture, friendly coworkers, decent benefits, overall a mostly positive experience.",The pay isn't great comparatively and the food in the cafeteria sucks.
127,First Republic Bank,Great Place to Work!,2021-05-17,5.0,Associate,"Culture, people and benefits are a plus!",I don't think there are any.
128,First Republic Bank,Very Mediocre,2021-07-30,3.0,Client Service Associate,"Relaxed environment
People are very nice
Discounted cafe
Work life balance is great","Limited opportunity for growth
Many tasks become mundane
Slow paced for a bank"
129,First Republic Bank,Great company,2021-04-24,5.0,Anonymous Employee,Great company to work for. Great work life balance. Executive management does everything to take care of the employees. Great benefits and great culture.,Nothing I can think of
130,First Republic Bank,Return to Office,2021-06-26,3.0,Anonymous Employee,"Collaborative culture, generous and caring during Covid, trying hard to increase diversity","No flexibility or hybrid model in returning to the office, everyone is expected back 5 days a week, no remote options"
131,First Republic Bank,"Good place to gain some experience, not a long term opportunity due to leadership",2020-04-21,3.0,"Director, Product Management","If you're experienced, competent, secure and nimble enough to navigate the mire of politics here, you can create a decent career path to launch into your next level position. There are a few amazing people & teams here, if you can break in. Perks, benefits, training and development have greatly improved over the last 5 years.","Politics and leadership competencies are devastating to talented newcomers; the lack of experienced, empowering leaders is the biggest con... and unfortunately there are a lot of cons in leadership positions. That is to say, many who are in charge here have never seen a bigger or more successful company, and sadly FRB looks to pull other mediocre managers from bigger banks with the broken logic that they will help secure their next 3-5 years - i.e. no innovation or progressive improvements happening in technology or in capability maturity. Also means they are ripe for pillaging by any or all major consulting & staffing firms."
132,First Republic Bank,"Has its Quirks, but Overall Great Workplace that (Mostly) Gets the Big Tickets Right!",2021-02-22,5.0,Anonymous Employee,"Excellent Pay and Reliable Bonus
Great Benefits, especially financial perks like employee mortgage rates, 529 contributions, employee-stock purchase plan, 401k matching, etc. 
Improving Attitudes Toward Flexible Working Arrangements
Constant Growth
Well-Defined Culture and Client-Centric Focus",Technology lags behind large FIs and competitors
133,First Republic Bank,Really good experience,2021-05-01,5.0,Assistant Branch Manager,It's in a very friendly and professional environment,I can't find any inconveniences
134,First Republic Bank,Great company,2021-04-07,5.0,CSA,Learn a lot fast. Great starting role which will eventually lead to becoming a great relationship manager,No cons at the moment besides busy schedule
135,First Republic Bank,Lending,2021-04-17,5.0,Lending,Great place to work and love the culture,Depends on what department you are working for
136,First Republic Bank,Great company,2021-07-13,4.0,Commercial Loan Servicing Specialist,has onsite lunch cafe with a new daily items,no option for flexible schedule
137,First Republic Bank,Great company,2021-04-03,5.0,Finance,"Career growth, great culture and benefits, work from home, taking great care of their employees (especially during the pandemic)",I cannot think of any
138,First Republic Bank,Consumer Service Associate,2021-04-21,5.0,Consumer Service Associate,Culture is great and supportive,N/a not many cons working here
139,First Republic Bank,Good,2021-07-15,4.0,Personal Banking Associate (PBA),Always a supportive environment and good pay,sometimes a challenging work life balance
140,First Republic Bank,Consumer Services Representative,2021-07-13,3.0,Consumer Service Representative,"Pay, Benefits, Co-workers,Cafeteria, Next to bart
Bonuses","Management, Growth ,Advancement, Customer entitlement 
Micro management"
141,First Republic Bank,Generally a good place to work,2021-07-05,4.0,Financial Analyst,Culture and career growth opportunity,Not a great work/life balance
142,First Republic Bank,CSA client role,2021-07-07,3.0,CSA Lowes,Good people that cared about employees,Bad management that did not optimize workflow
143,First Republic Bank,WAA,2021-04-13,5.0,Wealth Advisor Associate,Great Company to work for,None that I can attest too
144,First Republic Bank,Would not recommend,2021-06-23,1.0,Anonymous Employee,"While some employees may be paid well, that is not the case across the board. There is work to do around benchmarking around all roles.","Incoming leadership is a huge area of concern. There's a lot of confusion around what the work expectations are, what hours are required, and general work-life balance."
145,First Republic Bank,Busy but no overtime,2021-04-01,5.0,Client Service Associate,"Good work life balance, benefits.","Like any other finance job, tight deadlines, some pressure."
146,First Republic Bank,Amazing,2021-04-07,5.0,Preferred Banker,Great place and key core values,"None at all, it’s an amazing place"
147,First Republic Bank,Good Pay with Hard Work,2021-06-23,4.0,Senior Associate,The company pays a decent salary.,"Expects you to work 24 hours, 7 days a week."
148,First Republic Bank,"Great company, lack of work life balance",2021-03-19,3.0,Administrative,"Pay, benefits, leadership, colleagues, the company does try to support its workforce in diversity and inclusion.","Very demanding and high expectations are difficult to meet with volume and available resources (man/woman power)
Prior to COVID, very rigid and unfair WFH policy."
149,First Republic Bank,Excellent culture and pay,2021-04-02,5.0,Preferred Banking Office Manager,Quality people and great products/brand,So far I don't have any complaints
150,First Republic Bank,"Bad Pay, inexperienced managers",2021-06-29,1.0,Onboarding Specialist,I got to quit this awful job,Worked 7 days a week. Had to beg for Saturday or Sunday off to do Laundry. Our manager openly stated she got the job because of her rich parents. Big yikes overall
151,First Republic Bank,Don't regret a thing,2021-03-02,5.0,Associate,Everyone is super friendly. Definitely not like any other bank,Needs to catch up to the present and keep pushing the boundaries of what technology we use
152,First Republic Bank,Excellent Growth and Culture,2021-03-23,5.0,Specialist,"Culture, leadership, and development are excellent.",I can't think of any cons.
153,First Republic Bank,Associate,2021-06-10,4.0,Associate,"Great pay 
great benefits
very helpful management",work hours can range anywhere fro 5am to 9pm
154,First Republic Bank,"Great culture, smart people, leaders care",2021-01-22,5.0,Executive Assistant,The culture is fantastic and while there is plenty of work to do they emphasize that having fun is also important.,"Sometimes there is so much going on it can be stressful, but I think that's just work in general!"
155,First Republic Bank,FRB,2021-03-18,5.0,Currently Unemployed And Seeking Work,"Very Professional Company, In House Cafe","Too Conservative, Very Strict Environment"
156,First Republic Bank,"Pays well, work hard",2021-06-09,4.0,Director,Good pay and benefits. Collaborative environment.,"""Not a 9-to-5 mentality."" Firedrill culture."
