,company,headline,date,overall_rating,author_position,pros,cons
117,Angel One,"It was good and the staff was really cooperative. Angel broking was franchise taken by IFS, Bikaner",2021-09-03,5.0,Relationship Manager,"Intellectual Challenge, New skill development, New people, Work-Life Balance",Screen Time a bit too much
118,Angel One,The WORST place to work,2021-08-29,1.0,Associate Customer Service,Salary on time and no pros tbh,It's been month and it's as equivalent as hell here. No proper communication between employees and managers. Only 10% of the training was provided and pushed us on the actual work. Struggling to survive here
119,Angel One,2 years wasted. I want give negative rating.,2021-08-24,1.0,Deputy Manger-Projects,Dont join this company there are many opportunities out there where you can look forward.,"All cons no pros.
The lower management or managers are idiots.
They have changed the notice period to 2 months. The hr is amazing they don't support the employees. 
They changed the notice period to 2 months. how one can try to move when this kind of hr's make rules which is useless.
Salary Increment is shocking they give you peanuts and nothing else.
Let me elaborate increment cycle you get increment but you will get that in the next cycle till then be in the company. 
The upper management looks good but I don't know their true real face might be they are also involved to harass the lower ends.
The managers are illiterate yes it's true they don't care what a person is going through. They just want their targets achieved."
120,Angel One,Good,2021-08-23,4.0,Finance Associate,Good experience Great learning Exciting,Too much work No time balance
121,Angel One,Compensation is pathetic,2021-08-18,1.0,Account Executive,"Increment given is very bad, they should increase percentage for employees",Flexible working hours is a good part. Also work from anywhere
122,Angel One,Senior Automation Test Engineer,2021-08-16,4.0,Digital QA,"1.You will get free learning courses.
2. Management is good.
3. Every sat sun is off there also you will get almost every bank holiday.","1.No such cons are there.
2.If you are joining as QA sometimes your working hours will get extended.
3.There is no comp off type facility."
123,Angel One,Ok,2021-08-11,3.0,Equity Dealer,No pros to mention here,Excess Work Pressure. In work
124,Angel One,25 years celebration of AngelBroking now AngelOne,2021-08-08,5.0,Manager,"The event was so well planned felt like watching some celebrity show on TV. Really enjoyed the event it was perfectly executed. The host was so nice well mannered and humble for sometime didn't even realized he wasn't from our company and is simply hosting the event. These event actually make all the angelites feels special and really important. The team worked really hard to make this event such a big hit and successful.
Last but not the least the gift hampers that was send to each employee was so so beautiful and thoughtful. 
I feel so so happy to be a part of such an amazing organization.
Thank you Subhash sir for everything.",Nothing every thing was well executed and beautiful. Really appreciate the efforts of the entire team and people behind the entire event.
125,Angel One,Awesome Experience with Angel,2021-08-07,5.0,Assistant Manager,"It's great to be a part of Angel Broking, Great Team & Great Learning Experience. My 2years 7 months journey had been good.",Noting as such so far. Team is very supportive and also my seniors. Got nothing to mention any such cons.
126,Angel One,The best ever work life experience with AngelOne!,2021-08-06,5.0,Corporate Trainer,"Every day something new to learn, meeting new people, sharing knowledge, protractive & seamless digital platform, teamwork, very supportive colleagues, very supportive and innovative management, creative leadership, the vision of the organization, freedom to work, and freedom to share creative and innovative ideas and management is also very open for accepting the change, speed & collaboration, handsome remuneration and time to time gifts, vouchers, and Work from Home",Organizations should not completely dependent on digital platforms. Somehow I believe that complete digitalization may increase the risks and also impact and job opportunities for the future.
127,Angel One,Good & Smooth Experience,2021-08-06,5.0,AVP-Operations,I had a smooth & good experience while watching it online. Since start i did not face any issue or streaming issue.,"Since i was watching it on Android TV, i found it difficult to put answers. It would be of help if we could could also put voice based inputs"
128,Angel One,Angel Broking is now AngelONE,2021-08-06,5.0,Team Lead,keep pacing with time and improving day by day in all aspects,"Due to work from home, social life is getting impacted"
129,Angel One,Good company to grow and learn,2021-08-06,5.0,Business Analyst,"Domain is very good.
Exposure is good.
Company policies are good.
Compensation is good too.
HRs make sure to engage the employees in various activities.","As such not much issues.
Processes need to be streamlined.
Please increase the work from home assets reimbursement amount.

BTW good job AngelOne"
130,Angel One,Amazing virtual event,2021-08-06,5.0,Deputy Manager,Best event so far which helps to understand the company portfolio and future commitment best and had Amazing experience love it,"Nothing as of now I see negative in the company, over all best experiences I had with the company looking forward to get more experience"
131,Angel One,AM-IT,2021-08-06,4.0,Assistant Manager,"Good Environment, Supporting Team, Quality Work",nothing we find in company.
132,Angel One,I am happy with the AngelOne,2021-08-06,5.0,Customer Experience Associate,I am happy with the AngelOne as there is no pressure and friendly behaviour.,"Clients are not totally happy with the angel as there is a technical glitch, or many problems"
133,Angel One,Angel one,2021-08-06,5.0,Associate Senior Executive,One of the greatest and to be the largest broking house of the decade,Some time there are technical glitch
134,Angel One,U can become master of this industry if you really want to become,2021-08-06,5.0,Assistant Vice President Risk Management,"Company gives the platform to the employees who ready to work with innovative idea's.
Also working environment is very positive","Need to concentrate accountability of roles , Reporting should be tighten , SOP on every process to be review periodically"
135,Angel One,Risk surveillance & Dealing,2021-08-06,5.0,Office Manager,Familyer to working the job,"my carrier 2009 /2010 market was falled. 
but no isuue at all to Angel Broking and staff"
136,Angel One,Great Place to Work and Some Downside Improvement,2021-08-06,5.0,Commodity Research,"Best Place to Work, 2 years ago we are working in office but right now we are work from anywhere.
And still all Angelite co-ordination same or maybe improve, except HR Department.","I think from my side downside specially Issue in ABMA.
Now we are Fintech firm, so not except Issue in App, rarely once in a 4-6 months ok.
2nd part from my side Salary Increment."
137,Angel One,Employee friendly company to work with.,2021-08-06,4.0,Business Analyst,"Good employee policies
Permanent work from anywhere
Good management
Fast tracked promotions
Good work being acknowledged",The only con is that the notice period is 3 months.
138,Angel One,Support Executive Mail Process,2021-08-06,5.0,Senior Associate Customer Experience (NON VOICE),"No partiality, I'm having world's best team leader(Vrushali Babras). Supports our ideas. Provides all sufficient required materials for making work from home more efficient.",Work was much efficient with previous incentives slab as we was properly rewarded with our outstanding performance. Now the daily incentives has been stopped.
139,Angel One,Head Of Technology & Operations,2021-08-06,5.0,Head of Technology & Operations,"1: Respect to Employees
2: Excellent and Manager and leadership team
3: Excellent HR, Finance, Admin, Legal Teams
4: Flexibility and empowerment
5: Positive environment in Office (HO)
5: My Healthy team","WFH is making us not to visit sweet office
Missing Leadership teams and colleagues due to WFH"
140,Angel One,"Best workplace rightfully, as advertised",2021-08-06,5.0,Management Trainee,"Work from anywhere
Great work culture
Supportive peer group
Flexible work hours
Good salary and perks","There is no variable component to the salary such as joining bonus, everything else is great otherwise."
141,Angel One,Mumbai Team always support,2021-08-06,5.0,Costumer Service Representative,Salary always on time that's why I love,Some time application and servor not working properly
142,Angel One,Good Company,2021-08-05,3.0,Database Engineer,Explore to Technology and Learn Stock Market,Poor Management and No work life balance
143,Angel One,Good,2021-08-05,4.0,Senior Equity Trader,Now competitor to all serviced and Discount brokers.,Not getting satisfied on salary part
144,Angel One,Product Analyst Intern,2021-08-02,5.0,Analyst,"Flexible hours 
Open to work creatively
Lively work environment",None I can think of
145,Angel One,good as a starter job,2021-07-31,3.0,Equity Trader,"get to learn about market and other financial products , etc ...location is convenient and head office has subsidised food","need to have strong selling skills of insurance , mutual funds , portfolio mgmt services otherwise get ready to do overtime"
146,Angel One,Good place to work,2021-07-30,5.0,Relationship Manager/Equity Dealer,Good management and senior are friendly,Technical issues are the most
147,Angel One,Good place to work,2021-07-30,5.0,Data Scientist,"Relaxed work env, work life balance. Open door policy, could reach out to higher mgmt whenever needed. Pay is decent for deserving candidates.",Not much. Not open for research and new proposals. Seniors with years of exp at the firm tends to believe more on their knowledge rather then new proposals from emp.
148,Angel One,Good,2021-07-24,3.0,Equity Dealer,Punctuality Brand Value Experience incentives,Not familiar work life balance
149,Angel One,Manager IT,2021-07-21,4.0,Manager,Angel Broking is nice comapany,We get nothing cons here
150,Angel One,About Angel,2021-07-16,3.0,CHIEF MANAGER,"Work from Anywhere
Work life balance
Peer learning","Less growth opportunities
No fixed formula for increments. It depends on Head"
151,Angel One,Core developer of ARQ engine,2021-07-02,4.0,Senior Executive,Great opportunity to experiment and execute ideas,"Low sharing of ideas and codes, making people redo of work for non expressive or like to work in silos, hope it changed with new CEO."
152,Angel One,Good company,2021-07-01,5.0,Customer Support Executive,Best corporate office and we'll maintained staff with good salary,Salary is less atleast company provide good package
153,Angel One,ANGEL BROKING LTD BEST PLACE TO WORK,2021-07-01,5.0,Assistant Manager,"Angel Broking Ltd is Best place to work for an Employees , works as team work to achieve its Goals , seems to be number one company in coming future as per 
digitization . solve every issues being friendly with colleagues and with our seniors",Management decisions are sometimes not reachable to every level of employees Not every level of employee get chance to know about what our company is upto
154,Angel One,Poor Accounts and Finance Department,2021-06-29,3.0,CHIEF MANAGER,Brand is known in General,"Politics, Poor Employee Management, No Policies"
155,Angel One,review,2021-06-29,5.0,Financial Advisor,company is good at innovation and growth,no salary increment to the employees
156,Angel One,Long working hours,2021-06-24,1.0,Anonymous Employee,"Hardworking co-workers, wonderful and helpful teams, humble employees","Long working hours, senior management doesn't care, too much pressure on people working from home"
157,Angel One,"Over all management was very good, no lines and easily got it.",2021-06-17,5.0,Zonal Sales Head,"change with the time. management is good, easy to sell products, innovative products, Changed in Angel One.",Bonus and salaries are very less then other peer companies.
158,Angel One,"The working culture was good, and management was supporting.",2021-06-17,5.0,Anonymous Employee,"The working culture was good, and management was supporting.",The salary was not good.
159,Angel One,good working environment,2021-06-16,4.0,Software Developer,"1. flexible shift timing
2. good working environment","1. alternate working Saturdays
2. sometimes long working hours."
160,Angel One,Angel Broking,2021-06-16,5.0,Deputy Manager,It takes care of every situations of its employee,I don't have any issues with angel broking
161,Angel One,On Getting Vaccinated,2021-06-16,5.0,Branch Manager,properly managed by the HR Team,it should be on Saturday or Sunday
162,Angel One,na,2021-06-16,5.0,Senior Quality Analyst,Care for their employees.Good managment,Review need to be taken at least after 3mnt
163,Angel One,Seamless and amazing process,2021-06-16,5.0,Team Manager,"Amazing environment to work with , we had seamless process of vaccination drive on 16/6/2021","As of now nothing , it’s been the best company so far to work with"
164,Angel One,Good serivce,2021-06-16,4.0,Manager,Great Place to work with Angel broking,There is no cons for write
165,Angel One,I have been working at perficient full time,2021-06-16,5.0,Survelliance Operator,Company understands work-life balance actually respects that,no company is perfect ..updating technology
166,Angel One,Great company to work for !!,2021-06-16,4.0,Deputy Manager,"Good company to work for ! They provide great perks for the employees, like providing timely reimbursements of expenses for our WFH initiatives ! Also held a vaccination drive wherein all Mumbai employees were vaccinated.",a few more trips / team diners in the Post pandemic world would be awesome !
167,Angel One,Nice Company to work with,2021-06-16,5.0,Manager,"Good and positive work environment 
Flexi timing
arranging all the necessary employment activity 
supportive in all employment aspects
Work with highly motivated team",as such there is no cons for working here
168,Angel One,operating Mutual Fund Process,2021-06-16,5.0,Operations Manager,Good working culture & Good people.,Team is doing their responsibility as owned Job.
169,Angel One,Vaccination Drive,2021-06-16,5.0,Customer Service Manager,"Good Co-operation 
Overall process was managed with proper team management.(Security Guards, Doctors, Nurse, Employees)",No cons was there till now
170,Angel One,System administrator - Technology,2021-06-16,5.0,Deputy Manager,Angel Broking always caring about the employees,Angel Broking need to think about old employees about their benefits schemes
171,Angel One,Very good company,2021-06-16,5.0,Manager,They take care of you and your family as well,There is no cons in organization
172,Angel One,good,2021-06-16,5.0,Risk Management,Good management And given good knowledge,There is no Down side all are the perfect
173,Angel One,Best Experience on Vaccination Drive,2021-06-16,5.0,Advisor,There are many reasons why Angel Broking is best for the Employees.. In current situation everyone is battling to get vaccinated against Covid19...and our company come forward to help us with the vaccination,No Downside noticed till now
174,Angel One,Former employee,2021-06-14,3.0,Senior Relationship Manager,Giving chance to freshers to get a start in the career,"Low salary compare to other companies with a similar facility

Managent issues"
175,Angel One,Best work Place,2021-06-14,5.0,Digital Acquisition Executive,"Its Really , great place to work , i just completed 1 Year here , my experience is Amazing, Flexible schedule, Best things is , we can work from anywhere !",Still nothing i faced at angel broking
176,Angel One,Best place to work,2021-06-14,5.0,Senior Executive,Best place to work with the organization like angel broking,best company to work with
177,Angel One,Good company to work,2021-06-12,3.0,Deputy Manager,"Understanding colleagues, good work culture",Too much work delay inter team
178,Angel One,Good place to work,2021-06-11,5.0,Financial Analyst,"Good company many things to learn
Work from anywhere culture",Not much career growth opportunities.
179,Angel One,Gr8 insight,2021-06-11,5.0,Deputy Vice President,wonderful applicability showcased for each scenario,audience were novice hence required to start with beginning could have connected more
180,Angel One,B2C & B2B customer acquisition,2021-06-11,5.0,Vice President,Work from Anywhere policy is awesome,None as the organization is very employer friendly.
181,Angel One,Right place for healthy feature,2021-06-10,5.0,Branch Manager,Angel give space to grow,Not Applicable for me as previously work as well from 2007 to 2015
182,Angel One,Sales department,2021-06-06,3.0,Senior Executive Corporate Sales,"Work from anywhere
Gud team work 
Can talk with any team directly if having any concern","Target which we can't complete
It will be changing every month
As a sales should work more than login hours
Will make to work on week off"
183,Angel One,Wonderful,2021-06-04,5.0,Sales Quality Analyst,Lots of career opportunity with rising Brand Angel broking,I did not find any cons
184,Angel One,Best session,2021-06-04,5.0,BDM Manager,"1.Planning to start Mutual fund & long term client can be beneficial.
2.Subscription fees is very less so many clients can take advantage.","just suggestion , Buy recommendation should be less than 10 from 15 stocks"
185,Angel One,Excellent place for product managers,2021-06-04,5.0,Product Manager,"Interesting products and problems to solve
Updated Evolving and tech stack
Knowledgeable peers
Friendly culture 
Co-operative eco-system
Permanent Work From home policy
Objective (OKR) driven work principles
Responsive HR
Great employee benefit policies

I will stop here. 

TLDR: If you are a PM, Angel Broking is the perfect place to join",Found none so far since joining
186,Angel One,A good company to work with,2021-06-04,4.0,Assistant Manager,"Diversified fields to work.
Continuous encouragement to build new skillset
Permanent WFH
Work life balance 
Good leave polices",Seen nothing as of now
187,Angel One,Underrated underdog,2021-06-04,5.0,CHIEF MANAGER,"One of the best firms to work for, excellent people, ability to take risks, forums to speak out and real digital-native culture",Haven't come across any yet
188,Angel One,Great Company,2021-06-01,5.0,Product Lead,People Friendly and Work From Home,None None None None None
189,Angel One,"B2B ,B2C",2021-06-01,2.0,Client Relationship Manager,For only 1 month salary that too in full pressurized,"Never join in south team as BDM,RMetc"
190,Angel One,Friendly environment and Positive Attitude,2021-05-28,4.0,SRE-NOC,"Work from anywhere culture
A positive attitude of Managers
Internal Team support
Friendly office environment even we feel through WFH","Some amount needs to allow for IT courses or exam certification.
Issue High configurations laptop to SRE ."
191,Angel One,Sustainable Growth,2021-05-28,5.0,Manager,"Great place to work, employee friendly",Nothing that I know of
192,Angel One,progressiv,2021-05-28,5.0,Deputy Manager,DUE TO CHANGING TRENDS COMPANY IS ADAPTING NEW MODES TO UPDATE WITH MARKET,"Due to updation, sum time holding not reflecting in app or app not working"
193,Angel One,Great place to work,2021-05-28,4.0,Assistant Manager,"It's a good place to work, with new policies of work from home has been really great. Good work life balance",Nothing I can think of as of now
194,Angel One,Fair and Transparent work policies,2021-05-28,4.0,Sales Trainer,Freedom to work from every where with defined work culture,frequent team meetings and engagement is missing
195,Angel One,Sales & Distributions,2021-05-28,5.0,Deputy Manager,Very supportive team and working culture. Co. treats employees like family. Co. always recognize employees strength and always work on there weakness. Right place to work.,Never seen and nothing to share.
196,Angel One,Best place to work,2021-05-28,5.0,Manager,Working with Angelities is a great experience who includes the closeness of work which we interact with many departments and sales teams. In which we can learn more and share the ideas to smooth flow of work. It is my personal experience which we got a good results. Good guide to new Joinees and shine to on role employees.,Nothing to say about it
197,Angel One,Awesome company,2021-05-28,5.0,Anonymous Employee,"Good work culture, good management",Nothing na na na na
198,Angel One,Angel Broking,2021-05-28,5.0,TELESALES Representative,"My Experience In Angelbroking Is 7star .
Seniors Are Very Helpful.
Leaders Are Very Helpful.
Scope Open For All... Anyone Can Grab It.
HR And Management Are Very Supportive.
I Am Very Proud To Be Here","No Cons To Say.
In My Experience There Is No Cons."
199,Angel One,Best place to work,2021-05-28,5.0,Sales Executive,On time salary work from home,Every year 10 to 15% appraisal
200,Angel One,Overall a great learning Experience at Angel,2021-05-28,4.0,Senior Manager,"-good work environment 
-permanent work from home culture 
-get to work with big teams of more than 15-20 members 
-sat sun off for tech team
-good salary increment than most of companies
-yearly performance incentives
-hr activities (currently virtual)
-scope of learning new technologies","--though sat sun off many times need to work on sat/sun
--often have to work for more than 9 hours (drawback of wfh)
--lot of noise and disturbance while working have to provide lot of support
--too many calls in a day from various departments
--lack of proper processes"
201,Angel One,great place to work,2021-05-28,5.0,Senior Associate,best place to learn and friendly work environment,No downwards in angel broking ltd
202,Angel One,Best company to work,2021-05-28,5.0,Senior Software Engineer,"Best work culture , Don't think join immediately",Not found ay negative about company yest
203,Angel One,work,2021-05-25,1.0,CRM Manager,hmmmmm....... nothing more to say about angel its good for earning money,they gave you so much work rather than actual working time
204,Angel One,Digital department,2021-05-24,4.0,Assistant Manager,Work life balance and great learning,Nothing I can think off
205,Angel One,Good HR policies and company that promotes innovation,2021-05-22,4.0,Anonymous Employee,"Work from home
Great innovation culture
Leader in Fintech",Some teams have bad work culture which needs to be improved. Check team culture before joining
206,Angel One,Great Place to work,2021-05-21,5.0,Talent Acquisition Specialist,"Flexible working hours, appreciation, work from anywhere, no door policy",work-life balance can be improved.
207,Angel One,Int HR meet,2021-05-21,5.0,Anonymous Employee,"Fab culture
Fab team
Agile
Work life Balance",no reason to comment on
208,Angel One,Good HR team,2021-05-21,4.0,Specialist Learning and development,Very good fun loving hr team,No cons as of now
209,Angel One,Working in Feedback process.,2021-05-21,4.0,Senior Associate,"Good work environment , people are nice to work with.","Currently nothing as con , just need more employee egangemnt prog to be helf"
210,Angel One,angel broking is a stock brokrage frim its a best platform for beginners who invest in stock market,2021-05-19,5.0,Back Office Executive,good company in stock brokerage firm,the application is easy to use every stock traders
211,Angel One,"Corporate Politics, No good bonus and No increment",2021-05-17,2.0,AVP-Sales,"Flexible working hour, Work from Home","Too much meeting, no bunus, no annual increment"
212,Angel One,It is quite enthusiastic,2021-05-17,4.0,Marketing Assistant,It’s a great company with a coordinated staff,I don’t have such experience
213,Angel One,Respect and recognition for good talent,2021-05-17,5.0,Product Manager,"Great managers, relaxed working environment, good culture",No cons everything's very good
214,Angel One,Great place to work,2021-05-17,5.0,Deputy Manager,"Supportive team and management, great compay",no cons in the company
215,Angel One,Fraud Survillance,2021-05-16,5.0,Senior Executive,"Good culture, Great management system",there is no downword in angel
216,Angel One,Great Place to Work - Best Place to make your career,2021-05-16,5.0,National Sales Head,You can have a great & long term growth Career. Always Appreciate for all Achievements. Focus is always to train regularly on current profile but will also work on training you to get ready for next Role. Priority always given to Internal Employee for Growth is the DNA. Open work culture & you are accessible to all in the system & can reach them anytime for any Support. The Organisation gives a great Platform to all so that each department can accomplish their Task smoothly.,Its been 5+ Years with Organisation & I have worked with many great organisation but I had the best Career & great Manager in this organisation
217,Angel One,This is very good company for the finance domain professionals.,2021-05-16,4.0,Deputy Manager,HR policies are superb. Staffs & managements are more supportive.,There is no scope for learning new technology related skills.
218,Angel One,Angel broking / Our work place,2021-05-15,5.0,Assistant Manager,"Work From home, working together, open ideas sharing company.",As a employee all working good for us.
219,Angel One,Excellect,2021-05-14,5.0,Client Onboarding,Very Friendly work atmosphere & supportive.,When I was at Thane Branch of Angel Broking. There were many time i few low because there am facing lot of issues.
