,company,headline,date,overall_rating,author_position,pros,cons
452,Angel One,"Its a big trap sales job, with unlimited pressure.",2018-02-24,1.0,Customer Relationship Executive,1. Nothing positive to say,"1. Placing useless cold calls. 
2. During the interview and job offer, the work time is 9.30-6.30  with off on Sunday, Later they will force you to work Sundays and even on public holidays and the time schedule also changes. 
3. Especially they hire for offline sales jobs, never go for these jobs as they have put target which won't happen and incentives are only after the target achieved."
453,Angel One,Wonderful workplace for exploring your true potential .. Great place to work,2018-02-17,5.0,Assistant Vice President,"In this digital era where whose financial domain is digitally transforming ,   i found Angel Broking as a good workplace to explore true potential of your creativity & innovations. Having policy in place to work from home , Work on Whatever(W.O.W) , flexible work hours making Angel as great place to work.",yet to explore this space...
454,Angel One,Senior Financial Analyst,2018-02-06,4.0,Senior Financial Analyst,Honest with work and show dedication towards work.,Fast learner need to control on speed.
455,Angel One,Good organization for learning,2018-01-30,4.0,Account Manager,Very good company for learning,No cons at all in company
456,Angel One,Equity dealing is all about punching orders on behalf of your clients & solving their queries.,2018-01-22,2.0,,"Team leaders are very helpful, you will get opportunity to learn all basic financial terms. After market hours you have to sell financial products like insurance & mutual fund.","Too much pressure, your performance will be judged by the number of sales you do. Working environment is very strict."
457,Angel One,understanding,2018-01-16,2.0,Relationship Manager,learning place is good here,low salary as per metro city
458,Angel One,Boring Place,2018-01-07,3.0,Anonymous Employee,Friendly Environment and neat office.,Everything Else. Very unproffesional company
459,Angel One,Relationship Manager,2018-01-05,4.0,Relationship Manager,Training is of 10 days and they teach all basics about the market. Colleagues and Managers are friendly. Full transparency in Management.,I don't think they have any
460,Angel One,Executive,2017-12-01,3.0,Equity Dealer,Nice place to work in broking firm,Less salary as per industry standards
461,Angel One,Feedback,2017-11-15,1.0,Anonymous Employee,Good to enter in trade,"1. No Proper guidance
2. No Proper training [i don't mean there should be spoon feeding]
3. No proper behaviour [Language, attitude, specially VP - should get Human Behavioural Training]
4. Should have proper planned interview structure.
5. Expectations are high and Politics is number 1"
462,Angel One,Equity dealer,2017-10-30,1.0,Equity Dealer,You get to learn about the stock market,"Sales is the core business, you're entering into a sales job, so be prepared while taking the job. It's not as before, selling Li, mutual funds & opening accounts are the main goal, trading is just a side business. Your kyc targets would be same as the sales person and there would be immense pressure on you'll to complete that task"
463,Angel One,Awesome,2017-10-23,4.0,Anonymous Employee,"Work friendly, good incentives, best","stress, less holidays, high expectation"
464,Angel One,Equity Dealer,2017-10-13,1.0,Equity Dealer,Get to learn basics  of the stock market,"You'll feel like a salesperson rather than an equity dealer, Selling Mutual funds & Insurance, Opening accounts of your family & friends would be the main goal, even if you don't want to due to the pressure. And if you're unable  to do that, they will make you sit long hours not even considering how far you stay, and expect you on time the next day, No work life balance whatsoever"
465,Angel One,Sales,2017-10-10,3.0,Chhattisgarh,"Incentive structure is good, CPP is good, supportive colleague","Lack of infrastructure, behavior of senior Management is not good,"
466,Angel One,Daily,2017-10-08,4.0,Equity Advisor,I want to grow my career in the share market only...,It is my subject related work..i am hapy to work
467,Angel One,Use of abusive language with employee,2017-10-08,2.0,Dealer,"pay salary on time,Human resource staff is very supportive,clean office","No proper training to employees,long working hours,target pressure,unrealistic targets,pressure to open new accounts daily"
468,Angel One,Title,2017-10-06,3.0,Anonymous Employee,You can learn about financial markets,"very less salary
no other benefits"
469,Angel One,waste of time and career,2017-09-29,1.0,Relationship Manager,"work culture , free ,no learning",no respect towards employees and worst management system
470,Angel One,Executive,2017-09-14,4.0,Senior Sales Executive,One of the best companies  to work with but management is biased with old vs new emp,Management issues senior and top management are not supported best for dealers
471,Angel One,Angel broking,2017-09-09,5.0,Assistant Branch Manager,I am working in stock market and this is my profession so I can do it and regularly,Buy out of the money options for making the brokerage.
472,Angel One,average work environment,2017-09-07,4.0,Anonymous Employee,work time is good when compared to other industries,too much of stress in job
473,Angel One,"Very good company,provide great e
xposer",2017-09-04,5.0,,"Provide salary properly and gud incentive structure.
As online dealer got very gud appreciation,infrastructure including everything to work is best in industry,software they uses r best.",Very aggressive working culture for employee which also takes a toll on client because while working some time we have to adjust with client profit.
474,Angel One,Good,2017-08-29,3.0,Relationship Manager,Seniors are motivating and always ready to help. Apart from that there are no pros here given that you stay in Gurgaon,"A lot of work is bogged down on the fresher.  
The new office looks more a like a fish market"
475,Angel One,Very Bad Ethical Environment,2017-08-10,2.0,Equity Dealer,Learnt many things about Financial Markets; Salary came on time,"Don't join this place unless you are very good at lying to people and you are ready to tolerate abusive language form your seniors. Your ethics are gone, because everything is unethical at this place. Your self respect and morality will be thrashed off and you'll become typical salesman."
476,Angel One,relationship manager service,2017-08-02,3.0,Anonymous Employee,learning is the key elements,"work pressure  , overtime , forget about personal life ."
477,Angel One,Relationship Manager,2017-07-31,4.0,Anonymous Employee,"Flexible, Good Superiors, Frequent Training on Mutual Funds Insurance and equity.","Pay , Cross selling pressure,  Nothing else I can think of"
478,Angel One,Relationship Manager,2017-07-24,2.0,Anonymous Employee,Nothing to mention here. It is so bad that nothing can be described as Pro,"No Communication about Process, System and Compensation. Poor English"
479,Angel One,Overall Good Experience worked with Angel Broking Pvt. Ltd.,2017-07-12,3.0,Equity Dealer,Good works environment  & helpful  Managers !!,Very low Salary And No promotion & very high work load during JFM !
480,Angel One,Good place to bgein with,2017-07-01,3.0,Senior Executive,the firm has nice working culture and learning ground.,the management provides less opportunities to grow.
481,Angel One,Not so good a place to work,2017-06-22,3.0,Business Analyst,"-Being in Product Development, you will have immense learning opportunities
-Good Canteen, Coffee Machine, Good Infrastructure
-They make clean products and focus on User Experience","-They expect too much out of some people and nothing out of some people
-Extremely unprofessional behavior by senior people towards subordinates
- They expect too much in very little time with almost no time for analysis before making the product
-Not very accepting culture towards new joiners in Senior Management
-HODs are not very coordinated with each other and bring in their ego clashes when it comes to working together
-Inter Team coordination also very unprofessional
-Salary structure not very good"
482,Angel One,Good,2017-04-14,3.0,Anonymous Employee,"- Timely Salary
- Good Environment
- Supportive Team Members","- No Increment
- No Growth
- Management is having lavish lifestyle"
483,Angel One,Don't go..,2017-04-10,1.0,Equity Dealer,"Good for fresher..
Good supportive friend.","No future, worst  Management and don't go.
Work environment very poor."
484,Angel One,Angel Broking ltd,2017-04-05,3.0,,Co has Good Management team,Nothing specific that I know
485,Angel One,NA,2017-03-27,3.0,Anonymous Employee,Work balance and management not good.,Salary is very very bad here.
486,Angel One,Great experience helpful nature with my team,2017-03-20,3.0,Assistant Manager,I did not found any good reason for work in this place if comes any better reason in future then i will inform..,If anybody do extra work here out of kra then not received improvement and senior are using this guys.i remember apj Abdul talk don't like company like your work
487,Angel One,Average company with ok salary good for freshers,2017-03-18,3.0,Gujarat,"Good for freshers,lot of things to learn which needs to mould you overall",Offers low salary compare to other broking company
488,Angel One,Nice company to get into profile of sub broker,2017-03-01,4.0,Advisor and Sub Broker of Stock Market,Timings are good. you just need to work like a consistency. Work load is not that much but yes sometime you have to work prior to timings.,Salary is not that much as you expect after years. Actually it depends just on incentives maximum. But yes it all depends on customers.
489,Angel One,Good,2017-02-23,4.0,Anonymous Employee,Good organisation to work.best. one,Good company ..keep it up
490,Angel One,Lot of work pressure,2017-02-21,2.0,Currency Trader,"Salary comes on time
Incentives( but low salaries).
Anyone can get a job here ( even 12th pass) 
Pays for your NISM exam(only if your clear the exam)","Never Focuses on Giving good service to the clients . 
May even call employees on Sunday without any pay or compensatory Leave . 
Dealers are expected to generate brokerage, sell accounts , Insurance policies ( that are not even good) , sell any product company tells you 
Max 20 mins break
Working hours are not fixed (anything between 9-11 hours)
Etcc"
491,Angel One,Intern,2017-02-15,3.0,,"Flexible work timings
Good for students",No fixed stipend for interns
492,Angel One,Average Place to work,2017-02-15,3.0,Assistant Manager,Flexible Working Hours with friendly co-workers,"No Bonuses,No Increments,Senior Management dont know who is geeting result for company"
493,Angel One,low salary....big targets,2017-02-13,2.0,,good for freshers.....environment is good,low salary slab....big targets to achieve
494,Angel One,Good place to work ..,2017-01-21,3.0,Executive,"Manager, senior executive will guide you at your every step",Less growth opportunities but u make more money while in executive level
495,Angel One,overall satisfactory.,2017-01-20,3.0,Sales,Salary usually arrives on time.,Mangement often very is harsh.
496,Angel One,Good,2017-01-14,3.0,Manager,Good Canteen and work culture,Management to check ground level
497,Angel One,Directionless Management,2017-01-10,2.0,Marketing,"- Compensation is fine at top positions
- HR does just fine in organizing events","- Arrogant management
- No learning environment
- Something terribly wrong especially with Marketing management. Wierd CMO"
498,Angel One,Great Company to work with,2016-12-27,3.0,Business Development Executive,"salary on time
great work culture.","work pressure is  more.
managers are very rude sometimes."
499,Angel One,equity dealer,2016-12-26,3.0,,we can recieve salary intime before month end.,some pressure is there in equity dealer job.
500,Angel One,Very Hard to Work,2016-12-23,2.0,,"Nothing much .......
Hr is nice",Target based fully under pressure........workng on sundays..........no holidays
501,Angel One,Good place for fresher,2016-12-12,3.0,,Good place for freshers can learn about investments,High work pressure from higher mgmt
502,Angel One,Worst Company Management I had ever seen,2016-12-02,1.0,IT Helpdesk,Nothing is good in company  i will never recommend to anyone,Nothing new to learn. bad management they remove employee any time and also forced to resign so guys be aware don't join the company. don't play with your future  and the most worsted  thing i had ever seen is very bad increment process the management is selfish they only think about management level employees increment their increments are done very smoothly butt ground  level employees they have no increments.
503,Angel One,Good learning experience,2016-12-01,3.0,Branch Manager,"Management, over all good platform to work","politics,compensation, have a good structure."
504,Angel One,Got to learn,2016-11-07,4.0,Software Developer,"Learning Experience. 
I have faced Co-operative Human Resource",sometimes Sync is missed thorough your peers.
505,Angel One,An good company for Freshers but not for IT experience people,2016-11-05,1.0,Software Engineer,"Good Team
Friendly and helpful people
Management always recommend to implement solutions with the current cutting edge technologies and not enough training is provided.","During appraisals the junior level employees are not given that much hike and least performer is always awarded the most hike.
Late mark policy is very boring.
No software development methodologies are followed during software development which really has a bad impact on the IT career of an individual."
506,Angel One,Not good,2016-10-27,1.0,Equity Dealer,"Friendly environment, good training, you get paid for the training period as well","Too much pressure, you are made to do overtime, cross selling, sales targets and none of them are mentioned to you during your interview"
507,Angel One,Horrible Staff,2016-09-23,1.0,Equity Dealer,No pros as such in this company,Too much politics and fraud towards customers
508,Angel One,Online Marketing,2016-09-13,3.0,Anonymous Employee,Immense growth opportunities for lower level employees as the work is constantly evolving and existing resources are preferred over hiring new ones,Insufficient benefits and compensations when compared to Multi Nationals
509,Angel One,good,2016-09-12,4.0,Equity Dealer,"Good Incentive system
Friendly management","Too much pressure for Cross Selling of insurance and Mutual funds but if u have a good relation with the client, it should not be a problem"
510,Angel One,Hire to Fire,2016-09-06,2.0,Assistant Vice President,Good jump over your existing salary & a respectable position as a carrot.,Company hires to fire and that's what u need to be worried about!!
511,Angel One,Average,2016-08-21,3.0,Database Administrator,- You will have good  learning experience as fresher or 1-2 years exp.,"- No work life balance
- Salary growth for business employees is higher than technical/software employees."
512,Angel One,Feedback,2016-08-21,5.0,Advisor and Sub Broker of Stock Market,Its best broking firm. Its best for trading in equity commodity and currency segment,Angel brokings dealing team is to worse. Also Rms department executive service is too bad.
513,Angel One,Good place to work but no growth in career,2016-08-08,2.0,Operations,The company has a good work environment. It also does good festivals celebrations.,Very low salary. Even if you working overtime you wont get any apprecaition neither in words nor in money. Gurati religion people find it very easy to get promotions faster due to their good contacts.
514,Angel One,Great work environment,2016-07-23,5.0,,Good company for learning new things in depth,they are very work oriented
515,Angel One,No that Good Company,2016-07-21,3.0,,Employess are friendly.. Employee referal scheme,No Food allowance.. No Holidays for Diwali Dasara as its a trading company
516,Angel One,Relationship Manager,2016-07-16,2.0,Relationship Manager,Great platform to learn about capital market & trading,Target driven profile; huge work pressure
517,Angel One,Front Desk,2016-07-09,1.0,,good enviormnment to work.Good. Good. Good.,Work load.not bad not bad.
518,Angel One,sr. executive product developer,2016-07-07,2.0,Stock Broker,"BIG reputed house, steady growth , secure for ladies, opportunity good but late coming, good media exposour","monetary growth less, no fixed working hour, leave issues, no particular job profile, should be flexible in any timing"
519,Angel One,My journey with angel brokerage lasted for 6 years,2016-06-30,5.0,Anonymous Employee,I’ve had a great experience working here in this company. Enjoyed every bit of my work tenure.,the leave policy needs revision.
520,Angel One,Great appraisals,2016-06-14,5.0,Anonymous Employee,The appraisal and incentives policy of the company is great. It is one of the major reasons that the employees are willing to put in their best efforts here.,I did not find any cons as such.
521,Angel One,Analysis,2016-06-13,2.0,Maharashtra,"1.Its a open forum for learning.
2. Ready to take challenges.","1. Very low salary
2. Will teach office politics very well
3. No professolism"
522,Angel One,Good Place to work if you have a good boss,2016-06-11,4.0,Assistant Business Analyst,"Good Canteen,Transparent HR practices,good work life balance",Salary not competitive as per industry standards
523,Angel One,Good Work Ethics,2016-06-03,5.0,Anonymous Employee,I worked with Angel Broking for 6 months. I worked as executive and i had to assist clients about the brokerage plans of our company. The one thing which I like most Angel Broking is cooperation and guidance of senior management at every step.,The company has long working hours.
524,Angel One,Horrible work environment,2016-05-31,1.0,Anonymous Employee,There are no pros of working here,Really really less salares and too much work pressure and very ignorant and incompetitve staff
525,Angel One,Highly professional and proficient company,2016-05-27,5.0,,The Company is highly professional and competent. It is the best place for a corporate life experience.,I did not find any cons as such.
526,Angel One,Good  Experience,2016-05-25,5.0,Anonymous Employee,I worked with Angel Broking for a year. The experience of working with Angel Broking is nice as they provide training to employees at every point when required. The company also has a panel of experienced employees to guide juniors about the market.,Everything in company is satisfactory
527,Angel One,"Equity Dealer, Equity Research and Advisor, Portfolio Managing",2016-05-25,2.0,Equity Dealer,Working hours are good 8:30am to 5:30pm,"No proper management.
Misleading of HR , Wrongful commitments ETC."
528,Angel One,Great work culture and ethics,2016-05-23,5.0,Anonymous Employee,The best part about this company is its amazing working environment. I’ve been working here since the past three years. These three years of my job life have been amazing. The company ensures that the employees cultivate good work ethics to ensure that the work is carried out in perfect harmony and coordination.,I did not find any cons as such. Everything about this company is quite satisfactory.
529,Angel One,Ample of learning opportunities,2016-05-18,5.0,Anonymous Employee,I’ve been working here since the past two here. I joined this company as a fresher and got to learn a lot working here. There are a number of opportunities provided to the employees. The company ensures their over-all grooming in various fields.,I did not any cons as such
530,Angel One,company,2016-05-10,3.0,Relationship Executive,good place to work in.,nothing much to learn in
531,Angel One,Working in Branches is pathetic.,2016-05-10,1.0,Human Resources Executive,"Ok ok for starting off and gain knowledge about market.
Ok for finance graduates to get jobs.
HR ppl will find it's only recruitments they can do At branches.","Sales pressure
less salary.
High attrition.
Poor induction should be more formal. Although training programs are sometimes arranged.
No health insurance. No esic card was received till 8 months."
532,Angel One,Great HR team,2016-05-07,4.0,,Work enviroment is good. People are very cooperative.,Salary offered is quite low
533,Angel One,not bad,2016-04-18,3.0,Service Executive,To understand the stock market basic.,Employees and Clint is every thing so do your best.
534,Angel One,Good platform for fresher to learn,2016-04-14,3.0,Investment Advisor,just begin and learn stock markrt,extra work apart from job profile.
535,Angel One,Sr. RM,2016-04-13,2.0,Anonymous Employee,"good exposure of market and other financial product like FD, demat, insurace, MF etc","long working hours
no travel allowances for sales guy
7 days working
very much pressure from the seniors especially for insurance"
536,Angel One,Investment Advisor,2016-03-31,1.0,,"Location of office,
Day shift,
Nothing else as such","Very long working hours(830-630)
6-day week
Pay is VERY low
No benefits as such,
Sales Job
Conjusted Office
Asked to push other products on behalf of company
Unrealistic Targets"
537,Angel One,Equity dealer,2016-03-17,1.0,Equity Dealer,Interviews are easy and friendly work atmosphere,No formal training provided ...directly on job and targets are given and high presuure on revenue generation.
538,Angel One,Bad Working,2016-03-16,1.0,Manager,"Learning is good
Process Systems are better","Very Very Poor Salary
Bad Politics"
539,Angel One,Work pressure & No allowance for sales ppls,2016-03-06,3.0,Sales Officer,I don't see any reasons to work here.,"Heavy pressure, stressing to work after Work time also,  No allowance for sales People."
540,Angel One,Account Assistanat,2016-03-02,1.0,Assistant Store Manager,I have Working in this company last four year as a assistanat accountant. I have good knowledge of accounting field. I am working in Textile manufacuring company.,I have completed my graduation in shivaji univercity in Ichalkaranji. ( Dist Kolhapur)
541,Angel One,Angel,2016-02-28,3.0,B2C Executive,"experience, knowledge, learning, Interaction, skills","Not suitable post, Long hours, rigid, unhealthy, no scope"
542,Angel One,best place for intern to develop their personality,2016-02-25,3.0,Referral Associate,it is a best place for interns where we get exposure towards real markets and the seniors of mine are very informative and very well behaved and also very cool in nature.,i dont think right now to share any downside of this company because i am working as a intern since 1 month.
543,Angel One,Angel Broking-Review,2016-02-23,4.0,,Work Culture is good.Good Work & Family Life Balance,Very Less Increment.Newly hired people get salary than old employess with leeser experirence
544,Angel One,angel broking,2016-02-09,5.0,Operations,angel is big company .i think best for me .,angel shift  to punjab .
545,Angel One,Under paid,2016-01-21,2.0,Equity Dealer,Good working environment and good brand image,"1.Low salary 
2.Too much pressure"
546,Angel One,"Depository Participant (DP) Operations, KYC & Compliance Officer",2015-11-29,3.0,Depository Participant Operations Head and Compliance Officer,Looking for good work opportunity at a new company and better benefits.,Workplace distance / inability to travel to a location far from home
547,Angel One,"good co. to work with, however business strategy needs to be in line with values it suggests to follow",2015-11-22,3.0,Assistant Vice President,"retail focused business which has a huge potential in Indian context, simple and easy to use platform for end user, and understands customer needs.Management's vision","greater reliance on people than the  systems and procedures allows people to manipulate rules to the extent of fooling top management and promoters, posses risk of bad name, high attrition,losses which could have been avoided, manipulation , people will leave this co. because of their bosses and not because of the co. itself"
548,Angel One,salary,2015-11-10,1.0,,good working for share marketing,no proper caring and partiality is more
549,Angel One,A good learning experience. I high level work pressure and higher targets to achieve. Long working hours.,2015-11-08,3.0,,A good teaching environment. Friendly atmosphere. One comes to know about the actual picture of the markets.,"High level work pressure.
Higher targets.
Long working hours.
Low salary.
Forced to sale secondary products like Insurance. 
Beware new joinees!!"
550,Angel One,Service executive,2015-10-28,3.0,Equity Dealer,"nice training system
provide huge knowledge about industry
best salary in industry
no big target","supervisor are not educated too much
deal in other insurance product also"
551,Angel One,Good,2015-09-03,3.0,,good and cooperative environment and staff,"compensation is very low, work pressure"
552,Angel One,Good,2015-08-25,3.0,Human Resources Manager,Good to compare through all the companies,lots of hurdle while between the search
553,Angel One,50-50,2015-07-26,2.0,Equity & Commodity Dealer,Good place to work and learn,less interaction with employee and their need.
554,Angel One,stock broking,2015-06-19,3.0,Equity Investment Advisor,one who are intrested to make career in to stock broking industry best place to work,poor work environment no proper management
555,Angel One,Good company,2015-06-11,5.0,Anonymous Employee,Very good company to work.nice working environment and friendly management.,They are providing less salary as compared to other company in industry.
556,Angel One,HR,2015-05-30,2.0,Relationship Executive,"there are no good reason , bad management, no respond for employess need. thats why i left","bad management, less salary, politics and Groupism, favouring some employes over others,"
