,company,headline,date,overall_rating,author_position,pros,cons
220,Angel One,Company which provides you freedom but expects results.,2021-05-14,4.0,Deputy Vice President,"1. Offers flexibility be it with working hours, role, location or execution style
2. Open for newer ideas and always up to try it
3. Everyone in organisation is so approachable and ready to assist irrespective of designations or levels","1. Too much fixated on core product - Equity
2. Offer competitive remunerations but has lot of variability among same role"
221,Angel One,Great place to work,2021-05-14,5.0,Manager,"1. Good environment
2. Approachable management",No cons that i can think of.
222,Angel One,"there is nothing as such , it has always been a wonderful organization",2021-05-14,5.0,CHIEF MANAGER,best place to work in Indian financial market,well there is nothing as such
223,Angel One,NA,2021-05-14,4.0,Deputy Manager,Get to learn new things,Work Pressure at its peak
224,Angel One,Not at all,2021-05-14,5.0,Senior Executive,"Very good company, no pressure",Not At All Company Is very Good
225,Angel One,Jobs,2021-05-13,5.0,Graphic Designer,Its a completely awesome and friendly environment to work,Nothing I can feel any disadvantages here
226,Angel One,Equity,2021-05-11,2.0,Associate,good environment to work in.,"hardworking, task-oriented and timely delivery"
227,Angel One,Best Place to work,2021-05-06,5.0,Best Place to Work and Good Work Culture,"Open door policy
Collaborative employees
Forever work from home","Nothing as such, everything is positive"
228,Angel One,Good to start career,2021-05-06,3.0,Manager,Company is Technology upgraded and agressive.,Cost cutting at year end.
229,Angel One,Easy need concentration focus,2021-05-06,5.0,Tele Sales Executive,Good incentives if u xan work hard,No cons as they give good amount of incentive
230,Angel One,Good Work Culture,2021-05-01,2.0,Sales Executive,Provides Monthly Salary On Time,Lack of Knowledge and Training
231,Angel One,Best company,2021-04-28,5.0,Sales Manager,Very good environment and very good support,Nice place all employees are very helpful
232,Angel One,It's good place to work,2021-04-27,5.0,Customer Service Representative,Working conditions are pretty good and you can earn incentives in a lot of ways.,Sometimes the app crashes and creates hastle
233,Angel One,Work experience,2021-04-27,4.0,Assistant Manager,Very supportive in work and mentally level,less salary as per experience
234,Angel One,Flexible & Agile,2021-04-26,4.0,Associate-HR,"Ample opportunity to learn & implement, encouragement to grow","Slow financial growth, At times there is work load"
235,Angel One,Good company,2021-04-24,4.0,Relationship Manager,It is helpful for Learning sales,It is hard for Finishing targets
236,Angel One,Go For it,2021-04-24,4.0,Customer Experience Associate,"Best Perk , Work from Home",Hectic Working Hours Even On Saturday
237,Angel One,Extremely Bad Culture,2021-04-20,1.0,Product Manager,"The newly appointed CPO might change the way things are done here, but only time will tell.","This company is a classic example of Murphy's Law - All the things that can go wrong in a company will go wrong here!
Let's start with people managers - they run like headless chickens from one corner to other - no strategic objective, no long term vision, no compassion for colleagues and reportees. I've seen people being yelled at as if they are slaves of their managers.
When all these things happen, employees might think of turning to the HR department to sort things out, but HRs are the worst here. When people share their problems with HRs you never know from how many sides it will backfire. People are being mocked at when they try to suggest something out of the box. There is no regard to your roles and responsibilities, no freedom or personal space - someone might call you at 10pm or 7am anyday.
Let me tell you what will happen if you join this company: all this toxicity passed upon you by your superiors will eventually take a toll on your personal life and you'll start having health problems like short temper, High BP and your personal relations will take a toll. It is extremely important that you understand the importance of your personal life, relations and freedom and stay away from companies like this one.
I was part of the Research team, so if you plan to join that, then this review might help you take the right call."
238,Angel One,Nice,2021-04-14,3.0,Dealer,Nice place to learn about stock markets,No cons thank you very much
239,Angel One,Good place to work,2021-04-09,3.0,Anonymous Employee,Good place to work and have well reputation,Didn't got team support from team members
240,Angel One,WFH facility is best.,2021-04-06,5.0,Senior Executive/Test/QA Engineer,"1.My manager's and colleague are helpfull
2.Employee can learn many things with the I learn facility
3.Good working Environment
4.As it have tag best place to work... Is really true",Till today I don't have..
241,Angel One,A company taking giant strides towards becoming a best in class fintech,2021-04-05,5.0,Product Manager,"1. Saturdays are non-working.
2. You can work from anywhere, anytime. You've the freedom to decide your working time and location. As long as your assigned tasks are up to date, no one will question.
3. As a PM, you have a lot of control on driving the business with new initiatives. With a diverse and huge user base of a few millions, you get to learn and implement a lot of things. 4. Customer centric approach for all the new initiatives.
5. Great learning curve for someone who wants to understand the financial markets.","1. Support for production issues can become taxing at times, that's the nature of this domain.
2. Lack of transparency at the time hiring, guess that is getting better now."
242,Angel One,"I have been working at Angel Broking, for full-time",2021-04-05,5.0,Assistant Manager,"Very good excellent work culture
WorkFromAnywhere (WFH)
Remuneration
Supportive Co-Worker
Opportunity To Learn New things from LinkedIn Learning & Pluralsight",I haven't face any Cons situation since I joined
243,Angel One,Best place to work,2021-04-05,5.0,Senior Executive,"1. Good Management
2. Provide work/life balance
3. One will just enjoy the work culture here",No cons as of now
244,Angel One,Great place to work,2021-04-05,1.0,Sales Excutives,Great place to work except sales department,No work Life balance and appriciation for sales executive reset company is good
245,Angel One,BEST- learn and earn,2021-04-05,5.0,"Associate, Customer Experience",Best platform to look for job opportunities and grow with organization.,"I have no cons to mention to here, just everything is for employees and client benefits."
246,Angel One,good,2021-04-02,4.0,Equity Research Analyst,good atmosphere great support cooperative,not yet noticed any but want to switch career in equity research
247,Angel One,Good place to work,2021-04-02,4.0,Relationship Manager,"Friendly senior, flexible time, work from home, good pay, good team","No cons, no con , no con , no con , no con"
248,Angel One,Great company to have franchise,2021-04-02,5.0,Franchise Owner,Good company to have franchise,There are no cons ok.
249,Angel One,They will hire you for equity Dealer. But on offer later it will be customer service,2021-04-01,3.0,Customer Service Executive,"Good place to start career.they will provide good package. But ""NO JOB SECURITY"" But still to gain experience it's good for fresher. But they don't care about fresher just terminate them for silly mistakes.",ZERO JOB SECURITY. Direct terminate you for any mistake
250,Angel One,Good place,2021-03-26,3.0,Senior Product Manager,Interesting domain and great work.,Too many stakeholders and very slow delivery
251,Angel One,work,2021-03-24,3.0,Equity Dealer,induction and training provided by company,"lack of management, mix process"
252,Angel One,BPO,2021-03-22,2.0,Equity Dealer,Some employment benefits and understanding with subordinates,"Timings
Pay
Some freedom 
No life balance nor work balance."
253,Angel One,Salary,2021-03-22,3.0,Revenue Manager,Induction provide before go to on floor,"Process is complex, unsystematic, work life balance"
254,Angel One,c bc,2021-03-21,2.0,Relationship Manager,"Good Experience, Good work culture,","Low salary, Low growth opportunity"
255,Angel One,Great Place to work,2021-03-20,5.0,Anonymous Employee,Good Good Good Good Good,No as such ...Keep it up!
256,Angel One,Good,2021-03-18,4.0,Terminal Operator,Share market is my dream iob,Charts and fundamentals are tricky.
257,Angel One,Fast growth environment and cool policies,2021-03-15,5.0,Senior Marketing Manager,"Permanent work from home, flexible working hours, no login-log out, good salary and many internal competitions to earn rewards and promotions","No cons as such, but would appreciate if the annual bonus is transitioned into a quarterly bonus."
258,Angel One,Good place to work,2021-03-12,4.0,Technical Business Analyst,"Great culture, employee policies and vast learning opportunities",Long and irregular working hours
259,Angel One,Good career starter,2021-03-09,4.0,Currency Dealer,"- Excellent place to learn the functioning of securities markets.
- Cooperative and hard working colleagues.
- Relatively fixed working hours.
- Great exit opportunities.","- Leaves are not easy to get.
- Did not receive career growth here. No increments or promotions or department shifts in more than 2 years.
- No Saturday off.
- Payscale is poor and not according to skills or education."
260,Angel One,"Good company, good bosses and CFO",2021-03-03,4.0,Senior Manager,"WFH, Casual dress code, work life balance",Alternate Saturdays are working for some departments
261,Angel One,best place to work,2021-03-02,3.0,Senior Associate,best place to work for us,there is lack of guidance
262,Angel One,Fraud analyst,2021-02-27,4.0,Associate,Handling UAT cases until closing,Invistigation fraud case until closing and action
263,Angel One,Flexible Organization,2021-02-23,5.0,Corporate Strategy,"Management is always open to new ideas, good employee-centric policies.",No cons. It is a good place to work.
264,Angel One,Bad way od treating employees,2021-02-22,1.0,Manager,"No reason
They credited salary before time . But gave pay cuts","The subsidiary angel wellness was a horrible olace to
Work as an employee. Day starts at 9 am ends at 10 pm . The directors treat u like subhuman"
265,Angel One,Good management,2021-02-22,5.0,Analyst,Time management is very good,In my opinion not any cons
266,Angel One,Best company to work with,2021-02-15,5.0,Marketing Manager,Recognition at every step you take,Work timings and will be work from home
267,Angel One,Awesome,2021-02-15,5.0,Business Analyst,Great place to work and earn.,I didn't find any discomfort
268,Angel One,"pay less , no work life balance",2021-02-12,3.0,Equity Dealer,timely payout no more pros,"6 days working, pressure for cross selling, dont give breaks, make you work for 8:20 to 5:30"
269,Angel One,Working for the overall betterment of the processes,2021-02-10,4.0,Business Analyst,"1) Nice Work culture.
2) Helpful colleagues.
3) HR does it's best to keep the work environment positive and stress free.
4) You can go to anyone to talk to be it the upper management or the lower management.
5) Freedom to express ideas.",Increment is less than expectation
270,Angel One,Good company to be with,2021-02-10,5.0,Senior Marketing Manager,Best place to work... lifetime work from home culture has been adopted,Long work hours ocassionally sometimes
271,Angel One,Reviews,2021-02-10,1.0,Compensation and Equity Manager,"No pros, salary on time, Everything not so good","Hell life, worse, no break more than 11 hrs work"
272,Angel One,Best service provider,2021-02-05,5.0,Equity Trader,"Easy and fast problem solving technique, take regular followup if query is not solved. Provides Quality Service, Maximum Margin for trading and Less Brokerage.",Demate and other charges are very high.
273,Angel One,Full pressure in my team. Not a great Place to work. Pressure is unbearable. Pressure given for Sales of services,2021-02-05,1.0,Customer Service Representative,Salary is good and working condition is also good.,Salary is good but no one would like to be mentally harrassed by their pressure.
274,Angel One,Quite a dynamic place to work,2021-02-04,5.0,Campaign Specialist,"- Flat hierarchy
-Lots of opportunity to learn
- Tech driven and Digital","Due to nature of industry, gets a bit demanding"
275,Angel One,"Good place, permanent WFH",2021-02-03,5.0,Employer Branding Specialist,"Brilliant policies, very accomodating and new age.",Process workflows are missing for some services.
276,Angel One,Good,2021-01-30,4.0,Channel Partner,"Salary, bonus, team work, training","Sales target, pressure, stress, system"
277,Angel One,Learn how to deal with clients,2021-01-21,4.0,Channel Partner,To learn & increase self confidence,Communication with client & teach regarding software
278,Angel One,good,2021-01-18,2.0,Relationship Manager,good friends work from home opportunity,Very precise job they people
279,Angel One,Awesome experience. Good opportunity and pay scale,2021-01-15,5.0,Manager,Latest technology platform to learn,Variable pay should be more.
280,Angel One,Amazing growing company to work with,2021-01-07,4.0,Lead Product Manager,"Too much of learning for freshers, Innovative ideas, specialised tools , happy environment",Too much work but there is learning
281,Angel One,good,2021-01-06,5.0,Anonymous Employee,good company is for broking,enough staff is not avaialbe
282,Angel One,Best place to work,2020-12-29,5.0,Senior Manager IT,Lots of learning in the company.,Everything is good. No complaints.
283,Angel One,Not an employee friendly place to work,2020-12-26,2.0,Marketing,Good scope of work but no place to grow or approach your seniors,A lot of politics and sexism
284,Angel One,worst,2020-12-14,1.0,Equity Dealer,nothing is best to work here,worst company hods with attitude
285,Angel One,Good,2020-12-13,5.0,Anonymous Employee,It good to work with Angel,It doesn't have any cons
286,Angel One,Good,2020-12-07,4.0,Relationship Manager,Good company to work and salary is good,"Pressure is high , never have personal life"
287,Angel One,Idk what this means,2020-11-30,3.0,Market Analyst,Good place to work at.,Long work hours isn't as fun
288,Angel One,Most growing broking company in india,2020-11-27,2.0,Senior Sales Executive,"Digital marketing , easy to understand, proper guidance ,team building","Bad service, application issues, customer not satisfy"
289,Angel One,Think different,2020-11-22,4.0,Degital Sales Executive,Positive thinking with will not let you down,Hard work beat talent in all sutivation
290,Angel One,Ok ok,2020-11-21,2.0,Operation Manager,"Salary on time
Professional environment
Good infrastructure",Less connectivity in between dept.
291,Angel One,Good work environment,2020-11-03,3.0,Assistant Manager,Lot of exposure for work and new learnings,cost cutting and ad-hoc work environment
292,Angel One,Unethical culture. Timely salary credited this is the good part of angel broking,2020-10-29,3.0,Senior Service Executive,Best part is salary part timely credit,Office environment not so good
293,Angel One,NOthing,2020-10-28,5.0,Analyst,"full reimbursements , packages, updated logistics","NO reimbursements , small packages, no updated logistics"
294,Angel One,Executive,2020-10-27,2.0,Translation,Good and nice Ambience to work with,Higher officials are humiliated like crazy
295,Angel One,good organization,2020-10-19,3.0,Market Research Analyst,"Salary, work life balance, reputed organization","Hikes, timings, management, perks, policies"
296,Angel One,good,2020-10-05,4.0,Customer Service Representative,good company best office etc,environment is not good at all
297,Angel One,Good,2020-10-03,5.0,Relationship Manager,Good to start with working,Don't know as far as I know
298,Angel One,Best to gain share experience,2020-09-15,4.0,Executive,Knowledge about investments where one can invest,Everything was good and it was an amazing experience
299,Angel One,Influencer relationship manager,2020-09-14,4.0,Deputy Manager,"Good salary, work environment, favorable employee benefits","Target based, work pressure, high targets"
300,Angel One,marvelous,2020-09-11,5.0,Broker,hlepfull mentor for beginer employees,diffrent type of targets thats challanging
301,Angel One,good place to work,2020-09-10,5.0,Assistant Manager,"every thing is good,mainly salary will be credited within 2 days prior to every month","no cons for the management,good company"
302,Angel One,Good company but high pressure by team leader,2020-09-08,3.0,Customer Service Representative,Good for New employeebfor gain experience,Not good for experience Holder
303,Angel One,Sales B2B,2020-09-01,3.0,Senior Executive,Working in B2B process the the place is very good friendly nature.,The employee Growth & salary increment
304,Angel One,........................................,2020-08-25,4.0,Wealth Manager,provide better guidance to the customers according to their budgets,There is no work life balance
305,Angel One,na,2020-08-25,5.0,Relationship Manager,"great place to work , you will learn about sales and get knowledge of different products that can help you in future, salary on time never late.",little politics... but one should be clever as because its sales
306,Angel One,relation manager,2020-08-21,2.0,Relationship Manager,You will have good exposure for the future,Very bad atmosphere to work. Not possible
307,Angel One,Good for freshers,2020-08-20,3.0,Anonymous Employee,Make good friends with colleagues,"Too much demands, very less pay"
308,Angel One,No job secure,2020-08-20,1.0,Sales Manager,"Friendly working environment,..............Easy job... Getting good lead from Google",No job secure....worst company....they are using a employee as a tissue paper
309,Angel One,Angel Broking Pros and Cons,2020-08-20,3.0,Assistant Manager,"Good payment, benefits, and work culture",No growth after a certain amount of time as it is a product based company
310,Angel One,Great Place to Work,2020-08-12,5.0,Anonymous Employee,"Great culture & leadership, open & dynamic culture","Nothing as such, it's an awesome place to work!"
311,Angel One,ddds,2020-08-04,3.0,Analyst,it is a very awesome place,it is a very different place
312,Angel One,No recommendation to friends and others,2020-06-19,2.0,Manager,"No positive, Nil support, bad work environment",High expectations with out understanding the actual
313,Angel One,It's a good company,2020-06-19,5.0,Advisor,I can say much abut it,It's much better than last one
314,Angel One,About company and management,2020-06-16,1.0,Senior Executive,Good workplace and good collegues,"After completing one year, based on the cost-cutting reasons they asked their employee to leave their job as soon as possible. No Job security, Bad management,better do not join the company."
315,Angel One,Great place to Work,2020-06-05,5.0,H R,Great atmosphere and highly competitive team,No systematic process in place
316,Angel One,Terrible place to work,2020-04-19,1.0,Research Analyst,"Being a large broker, some good co-workers","Bad work hours
Ruthless management only chasing targets
No material benefits to employees apart from salary"
317,Angel One,Angel broking review,2020-03-01,4.0,Assistant Vice President,Freedom at work good to learn new things,Did Not find one right now
318,Angel One,Good opportunity to fresher's,2020-02-20,4.0,Sales Executive,Healthy working environment and recognition for your performance.,Lack in proper infrastructure and facilities
319,Angel One,Devilish Angel,2020-02-07,3.0,CHIEF MANAGER,Exposure Work Hours Friendly Setup,King Pauper culture food politics
320,Angel One,Equity Dealer,2020-02-05,4.0,Executive,"Best Incentive Structure

Very Chilled out office

Best place to work",The upper management needs to change
321,Angel One,Worst place to start your career,2020-01-18,2.0,Business Development Manager,They give you opportunity to start your career in bfsi,Horrible work culture and treatment of employees
322,Angel One,Nice company to work,2020-01-15,3.0,Anonymous Employee,"It's a nice company to work in.
Co employees are helpful",Not recommending it for growth.
323,Angel One,Good Company,2020-01-15,4.0,Anonymous Employee,"I have worked for more than 2 years at Angel Broking. below are reviews.
1. Nice work environment.
2. Quality work and projects.
3. Flexibility.
4.  Good Work/Life Balance",Lots of politics goes on in top level.
324,Angel One,"Dealing in Equities, Futures and Options",2020-01-01,5.0,Stock Sub Broker,"Leading Stock Broker of India,",cons of Angel Broking was too much employee turnover
325,Angel One,Relationship Manager,2019-12-25,2.0,Relationship Manager,"Gives chance to fresher 
Not much",Salary not expect with industry standard
326,Angel One,Worst Place to Work,2019-12-23,1.0,Anonymous Employee,Salary on time.  nothing else.,"Toxic workplace. 
Zero work life balance.
Extremely hierarchical.
Chamchagiri is the only way to progress.
Join only if you have no other choice."
327,Angel One,equity dealer,2019-12-18,5.0,Anonymous Employee,good company and good staff,low salary and long hrs
328,Angel One,Assistant Manager,2019-12-16,3.0,Anonymous Employee,Good in term of Holidays. You will get all the leaves as per banking rule,Not very professional. There is no guarantee of job you can be remove at any time
329,Angel One,Bad Experience,2019-12-13,1.0,Senior Manager,Salary on time that is the only Pro.,"Don’t get fooled by the name Angel in the name of the company. They are devil’s in disguise.
The entire problem starts from the top management; it is run like a family business. Anything can change any day in your profile. The head of digital marketing & head of affiliate marketing was hand in glove with all the vendors for unethical business practices. Each time there was commercials discussion with the smallest of the vendors other team members were asked to leave the room. Non performing campaigns were pushed to be continued at negative ROI. Meetings held post working hours on Saturdays to show that he is really concerned about the business.
The CMO is a physcopath & extremely unprofessional. He treats his own team as if they are his slaves. His constant effort is to discredit, throw baseless allegations, insulting and demeaning his team members. Moreover, he goes to the extent of intimidating that he can spoil your career and you will not get any jobs in the future.
Before understanding the skills of the team members he tries to show them their flaws. He will continuously attack you so that you are completely demotivated and have no choice but to leave the company. If you are very desparate and want to ruin your career then join this company and especially the marketing team."
330,Angel One,General Assistant,2019-12-10,2.0,Anonymous Employee,Great place to learn new things,Dont take the customers request to the manager
331,Angel One,Good Company for Entry and mid-level employees,2019-12-06,4.0,Senior Executive(SQL Database Administrator),Management was good when I was working,No flexible option such as work from Home available
332,Angel One,Assistant Manager,2019-11-12,3.0,Anonymous Employee,Good company to kick start your carrier,"from a long term perspective, there is no carrier growth"
333,Angel One,The experience was good to work with angel,2019-11-09,4.0,Anonymous Employee,Friendly environment to work in Bangalore,As a dealer u have lot of cross selling to do
334,Angel One,Nice Environment,2019-11-07,4.0,Anonymous Employee,Healthy And Proactive Environment. Nice,Nothing as such to tell
335,Angel One,best company for new company,2019-11-06,4.0,Equity Dealer,working enviorment is freindly like other company,salary is not good other than compettior
336,Angel One,goof,2019-10-22,3.0,Anonymous Employee,excellent superb amazing wonder full,"nothing, full nothing, no no no no"
337,Angel One,"Regressive culture, no job security,",2019-10-21,1.0,Anonymous Employee,they pay salary on time...,"Most of the department heads are outdated, incapable and super insecure about their positions.....Sycophancy is the only way to remain employed here..Even HR is very oppressive kind- they conspire with such heads making false charges..female are not safe in this company as well... such nonsense is promoted here by the HR as well ... since talented and capable people don't stay for long in this company.. vacancies will always be there but don't join.. wait for better opportunities..."
338,Angel One,good,2019-10-19,5.0,Assistant Manager,Good learning experience great place to work,"treat employees good , great place to work"
339,Angel One,Job work,2019-10-06,4.0,Anonymous Employee,Nice exposure regarding the stock markets,Unable to handle too much pressure in the office
340,Angel One,Assistant Manager Client Acquisition and Sales,2019-09-23,4.0,Assistant Manager,Growth and  Recognition with good incentives.,High Sales Pressure and No Recreational Activities
341,Angel One,Assistant Manager,2019-09-23,3.0,Anonymous Employee,"1. Open to development in new technologies
2. Have ample time to learn and experiment","Beware of office politics and favouritism.
Layoffs are real and totally depends on market conditions."
