,company,headline,date,overall_rating,author_position,pros,cons
0,Angel One,aa,2022-04-05,3.0,Sales Executive,"good company for freshers
good company for freshers",no worklife balance still good for freshers
1,Angel One,God company,2022-03-28,5.0,Anonymous Employee,"Very good product
Good Company policies
Good learning",Extra working hours that degrade work life balance sometimes
2,Angel One,Golang Engineer,2022-03-27,4.0,Deputy Manager,Good company to work in,Work pressure is huge here
3,Angel One,"Very poor Management, looks everyone joined with reference only",2022-03-20,3.0,SRE Engineer,Previous management is good had quality work.,All Walmart people captured Angel one management now. No technical experience. Zero management skill. Their goal is set to fire old employees and hire their friends from Walmart. More than 90% of new hiring came from Walmart in the last 3 months. Now just Walmart lobby is there and you can not question them.
4,Angel One,Good,2022-03-15,3.0,Executive,Good company to work at,Salary hike not so good
5,Angel One,Good,2022-03-11,5.0,Trader,Good company and environment is good,Not bad at all thats it
6,Angel One,Great Place to Work,2022-03-10,5.0,Graphic Designer,"Permanent work from home.
Friendly work environment","Work Pressure.
Frequent Urgency of work."
7,Angel One,sales executive,2022-03-03,3.0,Telecaller Executive,get industry knowledge of brokerages,heavy pressure at work time.
8,Angel One,Good job,2022-03-02,5.0,Research Analyst,solid management with great career prospects,the working hours were a bit long
9,Angel One,my experience very nice in this company,2022-03-02,5.0,Software Engineer,higher then previous company in delhi,there is on issue to cons
10,Angel One,Best place to work with friendly teams,2022-02-28,5.0,Software Development Engineer (SDE) II,"Flexible environment, freedom to take care in case something important other than office work comes up.

Great work culture with amazing team members and environment.

Great work life balance.

Great diversity.",Not of anything that I can think of now.
11,Angel One,Good,2022-02-24,4.0,Anonymous Employee,It was good experience with the interviewer,I don't have much negative points
12,Angel One,"Company is good, work culture also good",2022-02-22,5.0,Anonymous Employee,"Company is good , even canteen food is also good","So much politics, management is not good"
13,Angel One,Good,2022-02-19,5.0,Product Manager,Friendly and productive work culture,No cons found till now
14,Angel One,Good,2022-02-19,5.0,Sales Representative,Timely salary credit every month,Target oriented work load every month
15,Angel One,Great Company to work with - 1 Year of Experience Review,2022-02-18,5.0,Senior Quality Analyst,"Great Work Culture,
Saturday Sunday Holiday,
Each one is Supportive, 
You can directly contact any person in the Organization,
compensation is given for working during weekends or at night,
All communication is carried on SLACK,
Most of the meetings are pre-planned,
Weekly YOGA, Dance session is scheduled for","Mid-Night major changes Deployment Activities are planned. So need to test all applications during the weekend after 1 AM to 3 to 4 AM.
and sometimes minor changes deployment is done on Saturday morning."
16,Angel One,Nice place to work,2022-02-17,5.0,Creative Specialist,"Nice place to work, supportive people, and a friendly environment, and also there are lots of learning opportunities.",No I don't find any dislike about working with
17,Angel One,Nice,2022-02-14,4.0,Operation Executive,Best company in broking industries,Mis Management in operation in company
18,Angel One,Angel One is a #greatplacetowork,2022-02-14,4.0,Lead ORM Manager,"There is an open door policy and we have full opportunity to brainstorm, learn grow and improvise. The place I currently working at is a save and productive work place. The company really cares about the safety of their employees. They provide us all the necessary trainings whenever required.",Needs a hybrid work model
19,Angel One,Good learning opportunities,2022-02-14,5.0,Data Analyst,"Learning opportunities were good
Friendly colleague",Can't think of any as of now
20,Angel One,Angelone is the best place to work,2022-02-14,5.0,Executive,Angelone best part is there is Work from Anywhere Process and the best Company to work we get some good to learn as well from Angelone.,No cons according to me
21,Angel One,Great Place to Work,2022-02-14,5.0,Deputy Manager,"Good policies, flexible work schedules, friendly & supportive management, scope to grow, constant learning opportunities, healthy work-life balance",none according to me as of now
22,Angel One,Flexible and an Amazing Place to Learn,2022-02-14,5.0,Social Media Marketing,"Work From Home
Clear objectives
Creative freedom
Offers various learning avenues",Noting at the moment - NA
23,Angel One,Great Place to work,2022-02-13,5.0,Senior Research Analyst,"AngelOne is among the best in the industry, as the organization appreciates the employees’ hard work as and when needed. Apart from appreciation, the working culture and the supporting network across and among the departments are brisk and swift. Supportive team members and a doable attitude make it the leading in the class segment.

#Breaktheoffice and #Workfromanywhere are some of the features that make it one of the best places to work.",Haven't faced yet. Will surely update if any
24,Angel One,Great Place to work,2022-02-11,5.0,CHIEF MANAGER,"Working environment
Management vision mission and adaptability
Freedom of working",Pay Scale to be matched with Fintech Industry
25,Angel One,Sanyam Sharma always been helpful throughout the year with required needs,2022-02-11,5.0,Assistant Manager Administration,"I always feel better place t work , with my team and my Administration head 
Its pleasure to have such Organisation looking every time better and better with improving with our improvement , they always find something new in me to explore my efficiency and my work and task","I feel more efficient, bonded and capable to handle all kinds for situation, received more knowledge to improve my abilities with the confidence and move on with Organisation for his and my betterment and more of productivity"
26,Angel One,Angel One - Indeed a Great Place to Work,2022-02-10,5.0,Deputy Manager Sales,"The work culture at Angel One is one thing that makes me feel grateful about this job that I have
Work From ANYWHERE - literally, the team is spread across the country, and each one of us has the liberty to get the work done from anywhere
At Marketing, we have great leaders & mentors, who are guiding & pushing us to learn and do more every day - amazing, isn't it?",There's a lot of PROS to write about :(
27,Angel One,It is always good & privileged to work with Angel One,2022-02-09,5.0,Enterprise IT,Good team environment in Angel one,All the systems should be aggregated in one domain instead work group.
28,Angel One,Great Culture and good Learning,2022-02-09,5.0,"Lead, campaigns management","- Good supportive culture
- Work from Anywhere
- Transparent Leadership aligned with clarity in goals
- Great Talent Pool, you will work with experts from particular fields",- Pay parity mapping is required for older employees
29,Angel One,Good web,2022-02-07,4.0,Software Development Engineer I,"Good compensation and benefits , good wlb",Work could be more challenging
30,Angel One,Angel one Product review,2022-02-07,4.0,Senior Product Manager,"No micromanagement, Leadership respects work life balance, Really good tech team","Pace of decision making, Too many VPs"
31,Angel One,Angelone,2022-02-04,5.0,Costomer Service Associate,Best place to work and work from anywhere,No downside in an angel
32,Angel One,Its a Good wokplace to work with.,2022-02-04,5.0,Executive Assistant,Friendly Environment. Helping Nature of Seniors.,Pay Scale and nothing more as of now
33,Angel One,Great place to work,2022-02-04,5.0,Influencer Marketing Manager,"Work from Anywhere policy
Perks and benefits
Proper Management","Absolutely nothing to say, no cons"
34,Angel One,Great linkedIn profile related,2022-02-04,5.0,Customer Service Manager (CSM),Learning lot of new things in angel one platform,not able to give all the answers to customers on the same time
35,Angel One,Great place to work,2022-02-04,5.0,Anonymous Employee,Support to learn new technologies and work from anywhere policy,I have' not experience any cons yet.
36,Angel One,Angel one,2022-02-04,5.0,Customer Service Associate,Good team and supportive seniors,N O T H I N G
37,Angel One,Great Place to work,2022-02-04,5.0,Deputy Manager Sales,"Great place to work with comfort, safety and growth",Nothing so far . . .
38,Angel One,Training was quite helpful in understanding and making our own personal branding,2022-02-04,5.0,Senior Customer Service Associate,Angel One takes much care about employees and there needs,stretching work for 12 hours without benefit which effects personal space
39,Angel One,Superb Company,2022-02-04,5.0,Campaign Manager,"Very employee centric company
Appraisal are fair
Efforts are recognized
Permanent WFH",Some old employees need to buck up and show effciency
40,Angel One,Angel One- Great place to work,2022-02-04,5.0,Lead Payroll and Benefits Specialist,"Fair and Transparent Policies
Employee Benefits 
Performance driven culture",Team Outings are very rare
41,Angel One,Good,2022-02-03,4.0,Manager,"Good environment , good learning","Work pressure, shift timings, rest all good"
42,Angel One,Equity dealer,2022-02-02,1.0,Equity Dealer,Worst place they offer letter the employee and after 7 day work will change Or position,"I am working with angel one 
The hr were not good"
43,Angel One,JOB OF MY DREAMS AT A GREAT COMPANY,2022-02-02,5.0,Digital Acquisition Executive,"-Company understands work-life balance and actually respects that
-Our clients are top name brands and we are doing incredible things that impact the way business is done across the India . That's powerful!
-Company is growing so there are opportunities that might not immediately exist
-Company provides regular communication , listen to and consider new ideas, and continually encouraging growth, both personally and professionally.",Nothing really comes to mind. I think it is great the way it is.
44,Angel One,good,2022-02-01,2.0,Relationship Manager,get sales experience and capital market,late working hours and no staff benefit
45,Angel One,delighted working with Angel one,2022-02-01,5.0,Head KYC Operations,"I get freedom to think and being part of executions of new idea and business enablers , when company achieve new millstones I get satisfactions and appreciation and share the success . It gives feeling that i am a member of this family.",right now it nothing to highlight it going on correct path.
46,Angel One,Good company,2022-01-31,3.0,Business Analyst,"1. Good work culture
2. Good work timings",1. Lot of approval process
47,Angel One,Great place to work,2022-01-28,4.0,Customer Service Executive,Supportive staff and management great learning environment.,Less salary is the only con.
48,Angel One,Sub Broker,2022-01-28,3.0,Anonymous Employee,"Brand name, easy to convince clients",very low salary n growth for RM
49,Angel One,Best working culture,2022-01-28,5.0,Senior Software Test Engineer,Given an opportunity to everyone... transperency in every process...supportive colleagues in wfh situation as well...process oriented..,Late night working hrs 3 to 4 days in a week...
50,Angel One,Salary Review Structure,2022-01-27,3.0,Commercial Finance Analyst,"Good support mgmt good , learning opportunities","Salary constaint , extra work"
51,Angel One,I working in Angel  since last 18 years....,2022-01-27,5.0,Manager Operations,"Great Co -working Environment.
Great Professional opportunity.
Continuous Companies Growth Plans, and Execution of plans.","None...no concerns.....almost completed working in Angel 19 years, Always feels like home."
52,Angel One,Really a best place to work,2022-01-27,5.0,Product Management Trainee,"I have started working in Angel some 7 months ago, and about my experience just one word- It's incredible. 
Here you will enjoy permanent work from the home facility but that's not the only thing that separates angel one from others,
Excellent Pay
Good work-life balance
ample opportunities to prove yourself
Friendly and very cooperative people
Great HR Policies
Gifts from companies on a regular basis to celebrate festivals of life
and lot more",No cons so far that i can mention
53,Angel One,Truly a Great Place to Work,2022-01-27,5.0,Anonymous Employee,"Work From Anywhere, Employee Benefits, Super friendly Team & Stakeholders lot more. 

I am not a routine job kind of person. Angel One's culture & environment has given me a platform and freedom to explore and learn new stuff every single day. 

With the goal of becoming a full stack Fin-tech platform there is a lot happening internally and it's a great place for any one to be in and build or enhance their career (be it a fresher or an experienced professional)",Nothing as of now - So far really good
54,Angel One,"Angel one is a financial services company and is primarily engaged in stock, commodity and currency broking.",2022-01-27,5.0,Assistant Manager,Great place to work &Digitech company,No any cons in the company
55,Angel One,employee friendly and futuristic,2022-01-27,5.0,Senior Manager Human Resources,"Work from home as a permanent policiy
flat hierarchy
employee centric policies
Democratic",less bonus and incre ment
56,Angel One,Sales,2022-01-27,5.0,Deputy Manager,Angel one changes time to time their work environment and forecast market situations before any one could.,IT related issues take more time to resolve.
57,Angel One,Employee Engagement,2022-01-27,5.0,Anonymous Employee,There have been lot of engagement initiatives which gives me great workplace experience in spite of being in remote working,There are none as of now.
58,Angel One,Nice Place to work,2022-01-25,4.0,Anonymous Employee,Great opportunity to learn many things.,Need to follow strict timelines.
59,Angel One,Very good organization,2022-01-24,5.0,DVP,"Excellent culture, on path to become a fintech decacorn",Incentives could be better with esops
60,Angel One,Good company to work,2022-01-23,5.0,Campaign Manager,"Work life balance is very good
Lot of learning opportunities
Pay scale is good",For some employees Saturday is not off.
61,Angel One,Customer Experience,2022-01-21,4.0,Assistant Manager,"Work from home and work flexibility 
Paid leave 
Life and health insurance","No jobs security.
Low salry.
Lot of pressure."
62,Angel One,Nil,2022-01-19,3.0,Customer Service Executive,India's top broking firm and best,Work culture is not good for employees
63,Angel One,Okay,2022-01-15,3.0,Senior Business Analyst,"Permanent wfh, goodies, low work pressure","Less growth, no employee value"
64,Angel One,Good,2022-01-12,3.0,Analyst,Good to work with company,No cons for this company
65,Angel One,Good company but not for long term relationship,2022-01-09,4.0,Senior Manager,"Every thing is good 
They give provide facility to work from anywhere that's best part of company","May be your sr.dont have industry information .

But company appoint such PPL on sr . position that's surprise for me"
66,Angel One,Good job but sales based,2022-01-08,3.0,Digital Acquisition Executive,"Environment is very pathetic, we can't work in that environment. The leads provided by company is very very cheap and they didn't even shown intrest to open an demat account","Posionous work culture, torture, pressure"
67,Angel One,Great company to learn and grow,2022-01-08,5.0,Software Developer,"- Great company to learn and grow
- Enthusiastic Work culture
- Opportunities for professional development
- Chance to work with highly professional
- Salary on time",Nothing much Just too many emails
68,Angel One,good experience,2022-01-06,5.0,Relationship Manager,"salary was good
management was good
chance to earn incentive","time structure
pressure 
target was there"
69,Angel One,Good company to work,2022-01-05,4.0,Graduate Student,"Growing organization, ample opportunity to experiment with your ideas, Good Senior management","Weak organization HR policies, Ad hoc decision making , Resistive to system changes"
70,Angel One,Best Company in financial Sector,2021-12-31,5.0,CHIEF MANAGER,Management design policy with the interest of the employee's. We do not feel as employee its more feel like group of friends need to complete the task.,Now focus is more on process than output. which could be betterment for org.
71,Angel One,Best place for work,2021-12-29,4.0,Anonymous Employee,"Flexible timing, No pressure, friendly environment",No cons found.best place for work
72,Angel One,Feedback support team,2021-12-27,4.0,Senior Associate,Great place to work compare to other organizations,Salary is low compare to others
73,Angel One,Hectic,2021-12-23,3.0,Costumer Experience Analyst,Work from hime was given,"Very hectic work , pressure job"
74,Angel One,very good job,2021-12-18,5.0,Senior Manager,it has good behavior thankyou,I like them so much
75,Angel One,Company culture,2021-12-11,5.0,Assistant Manager,"very good company for both experience and fresher , if you hardworking and optimistic then you search end here , everyone has chance to do ,
forgot politics , do your job very well , and get rewarded","no conns , but when i had worked late sitting , our VP helped me and allowed to come office late according to your times and told me finish your all daily task"
76,Angel One,Good Company to work with,2021-12-09,4.0,AVP- Technology,"I like Angel, the way they support in learning and keep moving.",There are some but one can ignore and move forward with the journey.
77,Angel One,Good,2021-12-08,5.0,Process Associate,Good environment for all work,No time management and work culture
78,Angel One,Best place to work,2021-12-03,5.0,Relationship Manager,Good environment and supportive system,no cons to specify overall
79,Angel One,Great Place to Work,2021-11-30,5.0,CHIEF MANAGER,"Friendly Environment, Team Support and main advantage of Work from Home and work from anywhere",As of did not found any cons
80,Angel One,I have learned many thing and I have achieved every month target.,2021-11-28,4.0,Assistant Manager,Best place to work  here,Dealing with cilents learning more
81,Angel One,Great Company,2021-11-24,4.0,Business Development Manager,"Team Support, incentive,work from home,work from anywhere",don't have have any cons
82,Angel One,Great place to work,2021-11-23,4.0,Test Automation Engineer,"Work environment is good.
Every sat sun off also bank holidays.",You have to available according to Indian capital market as it is trading firm.
83,Angel One,Good Company,2021-11-22,4.0,Senior Business Analyst,Great Company to work in.,Digital Transformation is still slow.
84,Angel One,Equity dealer,2021-11-22,3.0,Equity Dealer,Incentives if you can earn it through sales,"6 days a week, very bad boss, not an professional organisation to work with"
85,Angel One,Good company,2021-11-15,5.0,Sales Excutives,Good company no pressure atall,It's very nice company there is no down side of this company
86,Angel One,Working,2021-11-15,4.0,Anonymous Employee,Working is good and wfh is there,There is nothing to say
87,Angel One,worst,2021-11-11,1.0,Anonymous Employee,"nothing 
work from home
Diwali gift","many cons
worst management team
lack of support 
worst IT team"
88,Angel One,"Worst Company, Lies in Public, Pathetic",2021-11-08,1.0,Anonymous Employee,WFH is the only pro,"They lie a lot during interview and that's just the beginning. The senior management is all-male, incompetent, and the 2 managers working on product on design and tech are the worst. The officials say in replies that their policy makers are women but that is a lie too. If you work in design & tech and want to work in a product-focused company, stay away from the company. IF YOU ARE A WOMAN, AVOID THIS ORGANISATION AT ALL COSTS. There is too much bias and misogyny. They do not promote women at all. They also don't pay equally.

They also have fake ratings and reviews and have hired someone specific to work on the ratings. It's an old company with legacy redundant employees who will suck all your energy because they have not updated themselves.

The notice period is looong, the leave policy is bad, and the management is the worst. And this is just the tip of the iceberg."
89,Angel One,Managing customer portfolios etc,2021-11-03,3.0,Assistant Manager,Angel one app is one of the best app for trading and investment in Indian market.,Offline service is not good and very limited branch access.
90,Angel One,Great place yo work,2021-10-28,5.0,WMS Assistant Manager,"Friendly environment, friendly people, great place to earn incentive","Limited growth, less professional, ok to work"
91,Angel One,Product manager,2021-10-22,3.0,Manager,"Good company, helpful hr, good colleagues","No work life balance. No personal time, restrictions on leaves"
92,Angel One,Angel One,2021-10-20,4.0,Executive,"Work from anywhere.
Nice and supportive work culture.","Long working hours.
Saturday not off."
93,Angel One,Work from home is good,2021-10-19,3.0,Senior Executive,good org to work for,"monotonous coz WFH.
Otherwise good to work in your comfort zone"
94,Angel One,Bureaucratic and closed door,2021-10-18,2.0,AVP-Marketing,Few old timers were good but they have mostly left the co & have formed much better companies,Male dominant. Bureaucratic culture. Not female supportive
95,Angel One,Good for start,2021-10-15,3.0,Customer Service Executive,"Good incentives,WFH,Good for freshers and many more","Slow growth,Lots of policy, and many more"
96,Angel One,Amazing working environment,2021-10-14,5.0,Equity Research Analyst,Best place to work and learn.,Growth factor is Missing on the junior level
97,Angel One,Associate,2021-10-14,4.0,Anonymous Employee,You can expect Work life balance,There's no cons for angel one
98,Angel One,Great Place to Work,2021-10-14,5.0,Performance Marketing Specialist,"In my 6 different companies within BFSI sector this has been extreme unique experience as an employee where HR is not only actively involved with your onboarding but post onboarding with variety of engagement activities, checking with employees on mental health and working experience.. this has been splendid experience, thank you to the HR and entire Marketing team you guys rock",Nothing much just wish there could be an off-site every 6months so that employees who are working from home/anywhere are knowing their team mates and their supervisor to have the bond of working as a team
99,Angel One,Assistant Manager in KYC Dept,2021-10-14,5.0,Assistant Manager,Angel One is No one Fintech Company in Broking Industry.,No any downside of working in Angel One.
100,Angel One,Navratri function,2021-10-14,5.0,Anonymous Employee,It was so fun felt happy after many days in pandemic,There could have been more categories for gifts
101,Angel One,good screen decoration,2021-10-14,5.0,Branch Manager,good view by screen n nice celebration,some let n see issue
102,Angel One,Job review,2021-10-08,4.0,Associate,"1.WFH
2.Fixed Time
3.Timely pay scale
4.Less Burden of sales.","1.No proper growth vision.
2.Not much cons till now ."
103,Angel One,Nice place to work,2021-10-06,5.0,Relationship Manager,"On time salary
Many things to learn
Opportunity to growth",Pressure wen you don't achieve your target during month end
104,Angel One,"Call and Email auditing / Monitoring - Weekly Calibrations / RCA - QA Feedback meets, etc",2021-10-06,4.0,Quality Assurance Analyst,"Timely salary payment (No delays)
Work From Anywhere policy available for all employees
Good work environment",Less increment ratio as expected
105,Angel One,Good place to work,2021-10-05,4.0,Software Developer,Good opportunity to explore your knowledge,There no any cons from my side
106,Angel One,Digital Marketing,2021-10-03,5.0,Assistant Manager,"The team is outstanding in terms of performance,",The appraisals are not up to the mark even after the stellar performances of the company and employees.
107,Angel One,Equity Broker Profile,2021-10-03,4.0,Equity Dealer,"Employee Friendly, work from home",None as of now. Poor Management
108,Angel One,Company overview,2021-10-02,4.0,Executive,Working environment is very good,There is no as such cons
109,Angel One,Overwork their employees,2021-09-24,2.0,Sales Associate,Nothing to really look forward to,"*overtime used to work from 9 to 8 n get paid in peanuts
* used not get holidays on sundays"
110,Angel One,Worst Tech and product Leader,2021-09-24,1.0,Technology Lead,Great place to learn and contribute.,A lot of micromanagement by the CTO who does not trust anyone.
111,Angel One,very good experience,2021-09-23,4.0,Executive,"good salary for fresher 
good decorum
nice working calture 
wfh
less work presure",less knowledge growth when empoyee become experienced
112,Angel One,Great Work Culture,2021-09-22,5.0,Relationship Manager,"Timely Salary Disbursment
Workholic Culture
Employess grievence redressal
HR is Awesome","Dont work in sub broking module

Sometime Pressure is too much. Depends On the Person. ( I am performer so it does not affects me)"
113,Angel One,Good,2021-09-11,3.0,Equity Dealer Executive,Company is supporting the fresher,Company is not supported in the terms of salary
114,Angel One,Ok company.,2021-09-07,3.0,Project Manager/Lead Business Analyst,"Work from home policy, flexible hours.",Projects move slowly. Too many changes.
115,Angel One,Great learning experience,2021-09-06,4.0,User Experience Researcher,Flexibility in terms of working hours,"Not alot of interaction with other employees, during working hours"
116,Angel One,Godo Company,2021-09-06,4.0,Branch Head,"Very Structured organisation, good exposer","Don""t see any downside for this company"
