,company,headline,date,overall_rating,author_position,pros,cons
0,Bajaj Finance,Bad work environment,2022-04-10,1.0,Account Manager,"- not many that I can think of
- Pay comparable to market average","- Toxic work environment
- Using expletives at the workplace is quite common from senior management 
-CEO & senior management do not support work life balance and want employees to work on Sunday as well
- Extremely high sales targets set my mgmt., with no idea on how to achieve them"
1,Bajaj Finance,collection agent bajaj finance,2022-04-08,5.0,Collections Agent,collection experience with all time 100% location close,My working experience collection agent
2,Bajaj Finance,Corporate culture and employment benefits,2022-04-07,5.0,Assistant Manager,Job security with more income,Facing customer queries and miss communication with out
3,Bajaj Finance,Good company,2022-04-07,3.0,Manager Credit,Good company & better package but there is no work life Balance,Huge pressure & Work culture
4,Bajaj Finance,Good,2022-04-06,4.0,Senior Cluster Manager,"Incentive,Growth of company ,ceo, environment,vision",Work life and Saturday working
5,Bajaj Finance,There is a lot to learn here,2022-04-06,5.0,Assistant Manager,"● Open minded seniors 
● Progressive company
● Good exposure
● Second & third Saturdays off
● Nice internal job openings 
● Generous salaries
● Opportunities to grow within the company",None that I can think of.
6,Bajaj Finance,good to start career,2022-04-04,5.0,Associate,good company to work and learn,nothing to mention as such
7,Bajaj Finance,Abundant growth opportunities and great workplace to start your professional career,2022-04-04,5.0,AREA SALES MANAGER,"Continuous engagement with the senior management via confluences and town halls. 
● Like the work culture – open, transparent and fair.
● Growth is purely performance based – no favouritism, unfair practices or politics. 
● Place for self-motivated and charged employees – innovation and creativity flows. 
● High salaries and incentives. 
● There’s enough time to recuperate because the second & third Saturdays are off here","Fast paced environment, you are expected to catch up on your own. Can’t lose focus."
8,Bajaj Finance,Good workplace with an amazing culture and great values,2022-04-03,5.0,ASM (Area Sales Manager),"To ensure that everyone is well versed with different business departments, they give importance on inter department rotations and conduct multiple trainings from time to time.
● Strong values are upheld such as respect for all, equality, meritocracy free of favouritism & biases.
● Casual dressing, no fixed seating and approachability of the seniors make the environment calm where one can give work their 100%.
● BFL pays well for performance which is over and above the incentives",Can not think of any.
9,Bajaj Finance,Hard to survive in BFL,2022-04-03,1.0,ASM (Area Sales Manager),"Salary, opportunities, Incentives, Growth, Develoment","Over time work , No work life balance , Too much stress , Hard to survive ,"
10,Bajaj Finance,This was great experience with Bajaj Finserv Ltd. They provide awesome work cultures.,2022-04-01,5.0,Sales Executive,Everything is fine when  you are capable and love you job,there is everything is good
11,Bajaj Finance,Best place to work,2022-03-31,5.0,Assistant Collection Manager,"Transparent promotion structure, best salary structure, easy to got promoted",Not had cons to share
12,Bajaj Finance,Working here is enriching personally and professionally,2022-03-31,5.0,Business Analyst,"A lot to learn from cross cultural team activities
●	Enjoy the townhalls and confluences
●	Good salaries 
●	Great culture 
●	Transparent job openings within the organization 
●	The work can be hectic, but the second and third Saturdays are off here, so there’s enough time to take a breather",I can’t think of any.
13,Bajaj Finance,"Pay Is good, not a place for designers",2022-03-31,2.0,UI Designer,"Good Salary
Lots of incentives
Good office space","No place to show creativity
Not suitable company for designers"
14,Bajaj Finance,Merit-based organisation with good pay packages,2022-03-31,5.0,Data Analyst,"- The sort of growth chances and remuneration offered here are worth it.
- If you want to experience startup-like passion and fun with established work culture and policies, then join Bajaj without thinking twice. 
- No dress code and good bonuses. 
- Relaxed leave policy, though it you have to work two Saturdays a month!
- Creativity and versatility are highly valued. Advice to newcomers – be eager to learn from day one!
- Enough time to take a break and then get back to work as 2nd & 3rd Saturdays are off",Can not think of any.
15,Bajaj Finance,Best for youngster,2022-03-31,4.0,Manager Administration,It's carves you to adapt to the changes,None observed in my domain
16,Bajaj Finance,Most bad place to work,2022-03-31,1.0,Sales Manager,Good hike and incentives and promotion,"Work life balance is screwd up
No time for family
Working on sunday is a regular feast
No bank holidays
No fix working hours 9 - 11 at night working hours"
17,Bajaj Finance,Good Experience,2022-03-29,4.0,Salesforce Developer,"Learning wise good 
good salary",Work life balance is not good
18,Bajaj Finance,FINANCE MANAGER,2022-03-29,5.0,Finance Manager,"AMAZING CULTURE, WORK LIFE BALANCE",nothing as of now to share
19,Bajaj Finance,Fun orkplace with a good vibe and healthy culture,2022-03-28,5.0,"Manager, IT","It is easy to walk up to and speak to seniors about issues or give your opinions and suggestions as they are quite approachable.
Progressive culture where everyone is open with one another, just like a modern fintech start-up. 
Incredible prospects to grow; almost double as compared to the kind of opportunities I have been presented with in my previous companies. 
Everyone feels respected and valued here due to the unbiased work culture and ethical values instilled in the BFL employees. 
Work can get too hectic at times, but considering that the second and third Saturdays are off here, nothing is ever too difficult.","Work gets hectic at times, but to be honest that is the case everywhere."
20,Bajaj Finance,Boost your skills and mindset,2022-03-28,5.0,Cluster Manager,"Skill set
Mindset
Minute things related to business 
Data analysis
Earning","Personal time 
Family time 
Holidays
Workaholic
High pressure
Support"
21,Bajaj Finance,Overall good,2022-03-27,4.0,Assistant Sales Manager,Very active in Digitally and culture is average,Nothing is there as bad
22,Bajaj Finance,Senior Unit Manager,2022-03-24,3.0,Data Analyst,Less work in my team,No proper work culture. No much growth
23,Bajaj Finance,Good place for hustlers,2022-03-24,3.0,Anonymous Employee,"Good Pay, Growth Opportunities, Stability, Good Benefits","No work-life balance, Less creative thinking,"
24,Bajaj Finance,"Dynamic management, amazing career prospects",2022-03-24,5.0,Credit Operation,"One of the few organisations where the senior management is very active and full of youthful energy. Has helped me settle in the organisation big time. You can choose to move vertically or at least horizontally, so no scope of career stagnation. A very open and diverse office where sitting together and brainstorming past challenges is always fun and engaging. Rewarding increments, perks and compensation.",Haven't experience any so far
25,Bajaj Finance,A Great Fit for the Ambitious,2022-03-24,5.0,Assistant Products Manager,"- Pick and choose your projects with freedom 
- Something to learn every day, thanks to the dynamic nature of the workspace
- Casual dressing, relaxed office timings, though only two Saturdays are off
- Focus on personality development along with improving skills through HR programs
- Some of the smartest people I have ever worked with 
- Cool colleagues - buddy like peers, and very supportive management and seniors
Cons:","No cons, in my opinion."
26,Bajaj Finance,Freedom to experiment and work in different projects,2022-03-24,5.0,Data Analyst,"- High calibre, high tech organisation that believes in solving challenges through the best technology
- Emphasis on turning freshers into leaders right from the off 
- Work pressure is there, but you will get through it due to exciting nature of projects 
- A decent mix of good salary, better increments, and great benefits
- You can take off as per your convenience, no issues in that department","Difficult to think of a con, aside from maybe the strict deadlines."
27,Bajaj Finance,People will help you grow faster,2022-03-24,5.0,Assistant Products Manager,"- Twice as fast career growth than any other organization, and that’s down mostly to your smart seniors and helpful colleagues
- Company believes in disruption big time, so feels proud to be a part of such vision
- Energetic, young management that have brought in a fun, casual work culture along with an open-door policy
- There is a lot of work – and good work! However, the rewards and appreciation make all the hard work worth it!",No time to go into relax mode.
28,Bajaj Finance,Top notch cross-vertical opportunities,2022-03-24,5.0,Assistant Manager,"People who prize stability will love it here. Workspace is fun, even in the middle of tight deadlines and tough projects. You will rarely sit idle and get a lot of opportunity to learn and participate in the good stuff. Good horizontal as well as vertical growth, especially if you find the right mentors. Two Saturdays are off, which is decent enough to enjoy life outside work.",Nothing to write here. Nice
29,Bajaj Finance,Career opportunities are excellent,2022-03-24,5.0,Software Development Engineer (SDE),"- Flat structure and zero bureaucracy
- Good salary structure and increments
- Training is available if you want to skill up, especially your soft skills
- Work is very engaging but hectic
- Work hard, party harder culture 
- A good place to learn about new advancements in the industry","Very  competitive space, rarely room to breathe."
30,Bajaj Finance,Perfect place to get your career back on track,2022-03-24,5.0,Data Analyst,"I joined Bajaj in the middle of the pandemic. It was quite a tough time for me, both personally and professionally. However, the way my peers and the senior management have embraced me here with warmth has taken my respect for them to another level. You will get to work with some really accomplished teammates – both young and experienced. You are often encouraged to come up with your own. This has contributed to my growth and learning a lot. A dynamic workplace that continuously upgrades, updates and improves itself is surely a joy to work at.",I would say none for this.
31,Bajaj Finance,Love working with so many awesome professionals!,2022-03-24,5.0,Senior Analyst IT,"- It is the people who make the company, and there are some really talented individuals here. 
- Good experience working and learning from fellow colleagues who are more like buddies now. 
- No politics, no hierarchy, making it a very open and honest workspace. 
- Stick around for some great opportunities to work on a variety of projects.","Some days can be jam-packed with deadlines, leaving you on edge."
32,Bajaj Finance,Start-up like culture with good compensation benefits,2022-03-24,5.0,Data BI and Analytics,"- Freshers are expected to be self-starters but mentorship and guidance is always there. 
- No office politics whatsoever.   
- A dynamic workplace that will always keep you on your toes. 
- A culture of meritocracy and appreciation that guarantees great compensation and growth.","Not exactly a con, but I would say avoid this place if you are only here to make easy money and not to take up challenging projects."
33,Bajaj Finance,Growth and learning are sureshot!,2022-03-24,5.0,Data BI and Analytics,"A professional and supportive team that is always encouraging you to do your best. You never feel stuck with some really intelligent and expert mentors by your side. Fun, casual work environment with laser-sharp focus on innovation and disruption. Salaries are at par with some of the best organisations, and you get 2X increment opportunities. A rewarding workplace, indeed!","Not a place for those who shy away from the hustle
- Some days can get quite hectic"
34,Bajaj Finance,Experienced 3X growth than previous job,2022-03-24,5.0,Senior Lead,"- Quick, decent increments that happen regularly, but will depend upon your performance
- Transparent environment, right from HR policies to senior management to your seniors
- People respect your off-time, decent work-life balance
- Commitment to deliver value to the customer teaches you a lot about the industry and how to tackle different projects
- Dynamic environment which gives you the freedom to explore and experiment",No comments at all good
35,Bajaj Finance,"One of the best places to grow, learn and earn",2022-03-24,5.0,Operations Manager,"Dynamic growth, competitive salary, and an enjoyable work environment. There is little hierarchy and a good open-door policy. A lot of opportunities to work on cross-functional projects. Merit-based organisation, no favouritism. Overall, a fantastic environment for a newcomer to begin their career.",none at all no cons.
36,Bajaj Finance,Professional growth on track,2022-03-24,5.0,Sales Associate,"- Good pay packages and benefits, both for freshers and experienced professionals.
- A transparent work environment where the hierarchy is almost absent. 
- People value self-starters a lot, so a good place to build confidence and hone skills.
- You can easily grow horizontally as well as laterally, thanks to the guidance of some wonderful team mates.
- The workspace is teeming with those with an infectious passion for the industry, technology and disruption. 
- A very tech-oriented space where you will get to learn some of the most advanced skill",The work pressure can get to you some times.
37,Bajaj Finance,"Came for the salary, staying for the growth",2022-03-24,5.0,Executive,"It’s been two and a half great years working at Bajaj Finserv. Apart from the competitive pay package, I have been able to build my expertise across various functions in a short span of time. That is something unique that I have experienced at this workspace and nowhere else! The teams are great and are always eager to have fun at work. Increments, again, are as per what you deserve, which can be very high if you are a good performer. Over all, a 9/10 experience.","Wish there was a 5-day work policy, especially in the new normal. Will allow a lot of employees to unwind after hectic days on the work front."
38,Bajaj Finance,Fun work place with good policies,2022-03-24,5.0,Customer Support Lead,"Very customer centric, makes work fun. Lots of space to discuss solutions and innovations. Very supportive senior management and colleagues.","Work gets very hectic with long hours sometimes. Could do with more breaks and off days. 
Advice to management – Consider giving more off days"
39,Bajaj Finance,Couldn’t have asked for better pay!,2022-03-24,5.0,Operations Manager,"- Pay depends on your performance and experience, but is one of the best in the industry. 
- Great opportunities to enroll in proper on-the-job training programmes. 
- A very approachable and open-minded workspace with good diversity and knowledgeable mentors.


Advice to Management:
-",No any cons must check this
40,Bajaj Finance,Good salary,2022-03-24,5.0,Products Manager,"The compensation and benefits are very good. Many of my previous colleagues have also joined in for the same reason. Not an easy place to work at, but what I like about it is that you get so many opportunities to showcase your talent and skills every day. Skill training programmes are some of the best I have experienced so far. Highly recommend this place to anyone!","If you are not used to getting out of your comfort zone, you might lag behind in professional growth."
41,Bajaj Finance,fast paced workplace,2022-03-24,5.0,Applications Designer,"Very dynamic, supportive and organised. Good growth opportunities","High stress environment
Advice to management – Need more flexible deadline when working on multiple projects."
42,Bajaj Finance,high on innovation,2022-03-24,5.0,Product Manager,Management has an open doors policy. Always ready to hear out new ideas and help is available at all times. Good HR policies support us.,"could do with some structure, low on hierarchy.
Advice to management – Nothing"
43,Bajaj Finance,Focussed workplace,2022-03-24,5.0,IT Manager,Goal. You are encouraged to design and implement solutions with minimal interference. Good work is rewarded with growth and incentives.,"Multiple projects are on at all times. Gets hectic. 
Advice to management – None"
44,Bajaj Finance,Very supportive seniors,2022-03-24,5.0,Graphics Designer,Awesome place for a fresher to learn the job. Seniors encourage you to learn more skills and sign up for training sessions.,"Nothing yet. 
Advice to management – Keep supporting us."
45,Bajaj Finance,Full throttle work environmen,2022-03-24,5.0,Sales Manager,"Work is always on full gear. Not a place for slackers. Passionate, dynamic young professionals and very supportive, patient senior management. Great incentives.","Nothing.
Advice To Management – Nothing."
46,Bajaj Finance,Dynamic and fast paced work environment,2022-03-23,5.0,Product Manager,"A fast paced workspace. We are all on our toes all the time, in a good way. Lots of new products, processes, skills to learn. Free to choose your teams and to move laterally. Really happy to be at BFL.",Not the right fit for a slow learner. Expected to hit the ground running.
47,Bajaj Finance,"Fun workplace, great parties",2022-03-23,5.0,Business Loans Executive,"Work hard, party harder. This is a fun workplace. Great place for a fresher to learn the ropes of working in a professional and challenging environment. Lots of play and parties to keep us motivated. Great initiatives by HR.",Nothing I can think of .
48,Bajaj Finance,"Casual work environment, very supportive colleagues",2022-03-23,5.0,Sales Executive,Dynamic work environment. Every team is gearing to support sales with inputs and information. Love wearing casual outfits all week.,Quarterly closings can get pretty nerve-wracking.
49,Bajaj Finance,Comfortable work environment,2022-03-23,5.0,IT Manager,"Low on hierarchy. Lots of opportunities to work on multiple projects, learn new skills, implement ideas. Great support from management",Can get really hectic at times.
50,Bajaj Finance,"Great workplace, fabulous team",2022-03-23,5.0,Operations Manager,"Good place to work. High on motivation and support, wonderful work culture. Seniors and colleagues are very supportive. Everyday feels like a party.",Nothing that I can think of.
51,Bajaj Finance,Enjoy the inclusiveness and diversity of BFL,2022-03-23,5.0,Operations Manager,"The work place is like a start-up – cool progressive people doing what they do best. No unnecessary restrictions 
Fast paced and dynamic work environment 
People are passionate about what they do so you will always be motivated to do well and excel in what you do 
Good pay structure and incentive policy. If you are hard-working and diligent, sky is the limit 
Fair and performance-led company; packed with opportunities.
Engaging work, cool colleagues and a safe and modern workplace",Not a place for laid back individuals. There is cut-throat competition and sometimes you are involved in more than one project at a time.
52,Bajaj Finance,Great perks and good pay. Very inclusive workplace where everyone is valued.,2022-03-23,5.0,Product Manager,"Best learning opportunities in the industry 
Good pay, employee benefits and perks 
Dynamic workplace, everyone has something unique to offer
Feel valued here as an employee","Hectic pace, one can easily get overwhelmed especially if it is their first job"
53,Bajaj Finance,Enriching work experience and many opportunities to grow,2022-03-23,5.0,Data Analyst,"Dynamic, fast paced and open work environment. A lot of importance is given to performing well and delivering results. 
Ideal place for those who love challenges. 
Well-paid compensation and good employee benefits.",There is nothing as such
54,Bajaj Finance,Great place for starters to jumpstart their careers,2022-03-23,5.0,Tech Specialist,"If one is driven, they can grow exponentially. 
Company policies are very inclusive. The HR is swift to respond to concerns and everyone is treated justly. 
BFL has an open door policy where everyone’s suggestions are valued and considered. 
Amazing bonuses. At times 100% incentive pay-out is considered low here. 
Great exposure to learn and grow professionally.",Cannot think of any con at the moment.
55,Bajaj Finance,Very progressive company. Modern outlook and inclusive approach.,2022-03-23,5.0,UI/User Experience Specialist,"Progressive seniors that are open to change and suggestions. They are interested in helping their juniors grow rather than being stuck up. 
 People who perform well get rewarded generously. 
No discrimination, HR is fair and just. 
Start-up culture, super cool. Can dress as you want and sit where you want.",Nothing as of now !
56,Bajaj Finance,Good workplace,2022-03-23,5.0,Business Development Executive,This is a good workplace. Results are appreciated and you are encouraged to take on more responsibilities,Nothing much to say about this company
57,Bajaj Finance,"Dynamic place, work is fun",2022-03-23,5.0,Relationship Manager Corporate Business,"BFL is a great place to work if you have good people skills. Very customer centric and that makes me help corporate clients find just the right products. Fun to work, enjoy networking and socialising with clients.",None as of now here !
58,Bajaj Finance,Workplace that encourages innovation,2022-03-23,5.0,Assistant Product Manager,New ideas are always encouraged. You can take the lead in the implementation. Very supportive management. Every small success is celebrated.,Needs more people per project.
59,Bajaj Finance,Cool place to work,2022-03-23,5.0,Network Manager,"Easy-going on dress code, office space, colleagues. Work is fun.",Multiple projects and deadlines can get tough.
60,Bajaj Finance,Good place for a fresher,2022-03-23,5.0,Senior IT Executive,"Loads of learning and training programmes. Good place to start your career. Good work life balance. BFL offers both work and soft skills trainings, so you grow in the organisation.",None it's good In all respect
61,Bajaj Finance,Good work time,2022-03-23,4.0,Sales Officer,Company is good all departments work together but pressure is very high level,Company is good work pressure very high
62,Bajaj Finance,NA,2022-03-22,4.0,Business Analyst,Very good company good work area,no cons grt company to be
63,Bajaj Finance,Great Work Life Balance,2022-03-22,4.0,Manager,"Nice place to work , Ghansoli office having best infra","No Cons better , ample growth opportunities"
64,Bajaj Finance,Salary,2022-03-22,3.0,Team Lead,Good salary and quarterly bonus,No work life balance and working hours are hectic
65,Bajaj Finance,Worst Company to work with,2022-03-22,1.0,Sales Management Trainee,Not really..Just a myth to be honest,"Zero Work Life Balance
No respect for MT
Politics
Salary comparison by Rsm to demotivate you
They will hire you for a different profile and then send you to some other"
66,Bajaj Finance,Best sales experience,2022-03-21,4.0,Sales Manager,"End to end sales training.
Real time market development.
Team management and retail skills.",Work life balance. Abusive language
67,Bajaj Finance,Good place to work. Benefits and salary is good,2022-03-18,4.0,Manager,You will get good salary and other benefits.,Working culture is aggressive and sometimes it may affect your personal life
68,Bajaj Finance,Extremely toxic culture,2022-03-17,1.0,Cluster Manager,Fast growth at all levels,"Employee comes last, no direction or training"
69,Bajaj Finance,"Good Paymasters, if that's all you are looking for",2022-03-14,2.0,Senior Product Manager,"1. Good learning
2. Brilliant incentives","1. Zero work life balance
2. Gender parity is extremely poor
3. Can get monotonous if you are in the organisation for over 2 years, learning gets stunted
4. Aggressive work environment
5. A typical Indian Company, that you wouldn't want to work for if you have other expectations from work barring just earning money."
70,Bajaj Finance,Discipline works automatically,2022-03-14,5.0,Offline Marketing Manager,Gained good knowledge from bajaj finance,Working with bajaj finance is a delightful experience
71,Bajaj Finance,Good,2022-03-14,3.0,Cluster Manager,"Learning is good, no 1 nbfc",Work life balance is worst
72,Bajaj Finance,"Amazing workplace for freshers, multiple",2022-03-14,5.0,Data Analyst,"business departments.
- Lot of growth opportunities for the company employees -
these are very transparent and purely performance based.
-Easy going work culture, seniors are approachable and there
is a lot to learn from them","High paced work environment, but once you realise the kind
growth you can achieve, it becomes easier to work towards
that goal and achieve targets."
73,Bajaj Finance,Good workplace and fun culture,2022-03-14,5.0,Sale Associate,"- Seniors are approachable.
- Very open and start-up type culture.
- Amazing growth opportunities.
- Respect for all; meritocratic work environment without any
favouritism & biases.",work get challeging at times
