,company,headline,date,overall_rating,author_position,pros,cons
214,Bajaj Finance,‘Great place to grow and prosper as a professional’,2022-01-25,5.0,Sales Associate,"●	Great career opportunities.
●	Amazing mentors and leadership teams to hone your skills and guide you.
●	Multiple openings for lateral growth as well as vertical growth.
●	Transparent and welcoming work environment.",Takes time to get accustomed to the high pressure work.
215,Bajaj Finance,"Good place to grow,learn& achieve",2022-01-25,5.0,Senior Lead- IT,"Pretty dynamic environment with great emphasis on delivering results. My overall experience in one phrase - work hard & party harder. Just the perfect fit for people who love their work and want to grow professionally. They also offer good packages and remunerations, only gets better as you grow.",Quite demanding scope. Can get difficult to cope.
216,Bajaj Finance,Professionally satisfying workplace,2022-01-25,5.0,Data Analyst,"I kickstarted my professional career here about two years ago. If you’re good at what you do, there’s no looking back here. Good pay, great learning opportunities and I think this is the ideal place to start a career and grow as a professional. Challenging, yet fun with good compensation packages & benefits for employees.","Like I said, it can be challenging considering the cut-throat competition."
217,Bajaj Finance,Professionally satisfying workplace,2022-01-25,5.0,Data Analyst,"I kickstarted my professional career here about two years ago. If you’re good at what you do, there’s no looking back here. Good pay, great learning opportunities and I think this is the ideal place to start a career and grow as a professional. Challenging, yet fun with good compensation packages & benefits for employees.","Like I said, it can be challenging considering the cut-throat competition."
218,Bajaj Finance,Many learning and growth opportunities for all,2022-01-25,5.0,Relationship Manager Corporate Business,"●	Constantly evolving to bring out the best for their customers.
●	BFL is very focused on ensuring the best for their employees and conduct multiple learning opportunities for the employees to hone their skills. 
●	It is a very neat and clean work environment in terms of being devoid of dirty politics and nepotism. 
●	Very diverse and inclusive work culture that keeps innovation and motivation flowing.",●	Six-day work week (though we were intimated of it while applying).
219,Bajaj Finance,"Open minded leadership, unbiased and just",2022-01-25,5.0,Software Development Engineer (SDE),"●	Love the open door policy of this company, at first, I was hesitant to speak up and approach them but over time you realise how forthcoming and open to new ideas, the seniors are.
●	Fair treatment to all, no prejudices of any sort.
●	The kind of environment created helps everyone to stay motivated and bring out their A-game.
●	Multiple growth opportunities to grow here. A lot of exposure as well to cross functional roles, you understand the working of the company much better – very holistic outlook rather than a myopic one.","You you snooze , you lose"
220,Bajaj Finance,Sales,2022-01-25,5.0,Assistant Manager,Good Company to work with Bajaj,Nothing as of now about Bajaj
221,Bajaj Finance,I have get more rewards,2022-01-25,5.0,Sales Manager,Hard working and deliver best performance in pressure also. I give full time in market and provide helping hand to my executive and dealers,Don like to seat in office
222,Bajaj Finance,Bajaj finserv,2022-01-24,5.0,Sales Manager,If you anyone need learning + gain Bajaj is the right place for that.,"Vert hard to work, Any time company needs you, you will be available,"
223,Bajaj Finance,Salary,2022-01-24,5.0,Software Engineer,Growth and opportunity is immense,The work hours may be a bit non conventional.
224,Bajaj Finance,Culture & equites,2022-01-24,4.0,Finance,"culture, working pattern, work life balance,",no cons as such working here
225,Bajaj Finance,Good experience overall,2022-01-23,5.0,Executive,Have been working here for over a year now & one thing I can say is that there is immense growth for people who like to work hard/take their work seriously. Casual dressing but serious work - that’s the best way to describe this place.,"Might get difficult to juggle between tasks, but have patience. It only gets better."
226,Bajaj Finance,Pay scale is good but it comes at cost of your metal and physical health,2022-01-23,1.0,Manager,Pay scale is good and includes variable,Pay scale is good but it comes at cost of your metal and physical health
227,Bajaj Finance,Good,2022-01-22,5.0,Trainee Technology,It is very good to work here.,None I like to work here.
228,Bajaj Finance,Great place to learn and add to skills.,2022-01-20,5.0,Content Manager,"Challenging and motivating culture
Monthly and quarterly benefits
Rewards structure",None that I can think of
229,Bajaj Finance,.,2022-01-20,5.0,Salesforce Developer,good place to start ur career,"dint find any cons, its a good place to work"
230,Bajaj Finance,Life at Bajaj Finance,2022-01-19,4.0,Manager,"Monetary compensation, recognition of efforts, empowerment","Work load, Work life balance"
231,Bajaj Finance,Good,2022-01-19,5.0,Collateral Manager,Flexible working hours with good work environment,No personal life differentiation should be available atleast 15hrs in a day
232,Bajaj Finance,Very Good Place to work,2022-01-19,5.0,Software Architect,very good company with perks,none as such i could find
233,Bajaj Finance,Growing company,2022-01-19,4.0,Unit Manager,Learning is good at bfl,Work culture is not good
234,Bajaj Finance,Working at Bajaj Finance,2022-01-19,2.0,Marketing,"Autonomy
Growth if you are in correct function","Work life balance
Large variable part in pay
No transparency
Strategy keeps changing 
Everybody running towards business and not skillset"
235,Bajaj Finance,Classic,2022-01-19,5.0,Assistant Manager,Work culture is good in BFL,Need a 2 day week off
236,Bajaj Finance,Good work,2022-01-19,3.0,Anonymous Employee,"Salary and incentives
Flexible work schedule","Stress and work load
Work on sunday"
237,Bajaj Finance,Great culture,2022-01-18,4.0,Marketing Content Manager,Good place to learn and grow with,There is less work-life balance here
238,Bajaj Finance,Great,2022-01-17,5.0,Data Engineer,Great payment and Provisions. Great Training.,"Work-Life balance is kind of a mess. 6 days working is a bit hectic, but manageable"
239,Bajaj Finance,"Place with good growth, but no life",2022-01-16,3.0,Area Manager,Career growth is good and you can switch departments internally,"No work life balance

Employees are treated life a mere tool or machine"
240,Bajaj Finance,Good to work,2022-01-16,4.0,AREA SALES MANAGER,Key role learning in eleventh aspects,Nothing cons as of know
241,Bajaj Finance,Pathatic,2022-01-16,1.0,FOS,There's nothing like pros for this company.,"Poor management, 
Low salary, 
Too much politics, 
From employee's to customer such a pain for everyone."
242,Bajaj Finance,Okay company,2022-01-15,3.0,Senior Cluster Manager,Opportunity to earn more Incentive is available.,"In the name of agility keep doing something on PPT without clarity what to achieve.
No work life balance."
243,Bajaj Finance,Good,2022-01-15,5.0,Anonymous Employee,"Good earnings , Better Growth Opportunities","Work life balance , No Week-off"
244,Bajaj Finance,Highly paid,2022-01-13,4.0,Personal loan officer,Get highly in the industry,No week ends and holidays
245,Bajaj Finance,Good leaning opportunity but lack of work life balance,2022-01-11,3.0,Assistant Manager,"Good pay
Learning opportunities 
Claims","Work life balance 
Job pressure 
No government holidays"
246,Bajaj Finance,Decent,2022-01-11,1.0,Senior Software Engineer,"Good Pay, Competitive environment, Work oriented","Poor work life balance
Poor work culture"
247,Bajaj Finance,Collection manager,2022-01-10,4.0,Assistant Collection Manager,"Good communication, motivation,team work, support,","Work presure,targets, timing, seniors got preferred,"
248,Bajaj Finance,L&D - Credit Ops,2022-01-10,2.0,Senior Unit Manager,A fair Pay scale for employees,"No work life balance, mental stress, cultural differences"
249,Bajaj Finance,company review,2022-01-09,5.0,Sales Manager,everything is good in this company,nothing is bad in this company
250,Bajaj Finance,Good Working experience,2022-01-09,5.0,Sales,I had great work there,Good moment with colleague's and office
251,Bajaj Finance,Good company interms of earning,2022-01-09,4.0,Senior Executive,"Good earnings 
Flexible timings
Good environment","Longer working hours
Heavy Pressure
No weekly off"
252,Bajaj Finance,Good,2022-01-08,5.0,Sales Associate,Company provide salary time to time,Everything is good in this company.
253,Bajaj Finance,Handsome Pay but highly demanding job,2022-01-07,4.0,Senior Unit Manager,"> Good Pay Structure
> Higher % of increment in Appraisal 
> Growth","> No Work Life Balance
> Limited leaves
> No Comp-offs"
254,Bajaj Finance,Salary good,2022-01-06,4.0,Senior Software Engineer,"good salary only, too much workload","Saturday working, and not that much to says."
255,Bajaj Finance,salesfprce,2022-01-06,3.0,Salesforce Developer,it is great thing always here,Here i see no problem here always
256,Bajaj Finance,Excellent,2022-01-06,5.0,Manager,It's great place to work,Nothing but need to understand the strategy
257,Bajaj Finance,Iam Choosing Better Opportunities,2022-01-05,5.0,Sales Executive Officer,We get high income monthly,We Do same Process dialy
258,Bajaj Finance,Positive work environment that fosters growth and productivity,2022-01-05,5.0,Software Development Engineer (SDE),"Numerous occasions to grow and hone your current professional skills. 
With dedication and hard work, you can fast track your career and be on your way to senior leadership sooner than you realise it. Employees rise up the ladder based on their merit and merit alone. 
Fair and just senior management. 
You will experience a lot of diversity and inclusivity; employees have strong work ethics and it’s a fair organisation to be associated with.","No complaints as such, so far so good."
259,Bajaj Finance,Ok,2022-01-05,2.0,AREA SALES MANAGER,Incentives Incentives Incentives incentives incentives,"Enviroment, timings, Management, worklife balance"
260,Bajaj Finance,Lon department,2022-01-05,2.0,Office Assistant,Per Costner 200 hundred rupees,Bajaj finance bank statement statement
261,Bajaj Finance,"Fun work environment, lots to learn and do",2022-01-04,5.0,Lead Payments Technology,"Lots of learning opportunities, skills workshops, training
 Dynamic work roles giving lots of exposure
 Casual dressing, seating – not boxed in
 Approachable seniors, very patient
Very good pay based on performance (which goes over and above incentives)","Lots of challenges
 Quick learning and adaptability expected"
262,Bajaj Finance,I am Working as Assistant manager,2022-01-04,5.0,Anonymous Employee,Learn more positive things in this company,Facing some problems in covid situation
263,Bajaj Finance,Work,2022-01-04,5.0,Product Owner,Good company to work and very friendly,None as it us offering good environment
264,Bajaj Finance,"Work can get hectic, but pay-off is worth it",2022-01-04,5.0,Relationship Manager Corporate Business,"Work hard, party harder is the motto. No doubt the environment is a bit fast-paced but team-mates will help you settle in. One gets to work in diverse projects and functions, hence good opportunity to build multi-faceted experience and expertise. 6-day work weeks are not to everyone's liking but the work is so engaging, you wouldn’t even know how the engrossing nature of work means time flies by. If you're ready for a serious challenge that holds amazing rewards like industry-leading salary, awesome work culture, good hikes and other perks, then this is the place for you.","No cons, I am loving it."
265,Bajaj Finance,Good Company,2022-01-03,5.0,Senior Regional Credit Manager,All good. Motivated and helped me in learning new things,Nothing as such. All is good
266,Bajaj Finance,You will truly enjoy working here,2022-01-03,5.0,Operations Manager,"Casual dressing but passionate work – that sums up this place. If you come to work here, you will like the speed and dynamism and also will love the pay and perks.",Don’t join if you are not a people’s person.
267,Bajaj Finance,Very supportive senior management,2022-01-03,5.0,Data Analyst,"I have been with BFL for over five years and have had the privilege of gaining exposure across diverse roles. 
Approachable and fair seniors. Not a place that discriminates. 
Fair and performance-led and driven company. Brimming with opportunities.
Work is engaging, colleagues are cool, and the workplace is safe and inclusive.
Incentive policy is amazing, great pay for performance, over and above the incentives.",Cut throat competition can get hectic at times.
268,Bajaj Finance,"Great pay, lots of perks, wonderful workplace",2022-01-03,5.0,Sales Associate,"One of the best places for a fresher. Pay, learning opportunities, perks and benefits are among the best in the industry. Dynamic workplace, lots to learn and do. Ideal place to start a career and grow.","Hectic pace, can get intimidating if you are not a quick learner and passionate about work."
269,Bajaj Finance,Totally enriching work experience,2022-01-03,5.0,Database Architect,"Fast paced, dynamic, great emphasis on learning and delivering results. It’s a perfect fit for those who love challenging themselves at work.
Great compensation packages and benefits for the employees.","Great workplace, great career opportunities. Keep it going"
270,Bajaj Finance,Transparent senior management and open culture,2022-01-03,5.0,Data Analyst,"The company undertakes quite a few initiatives to bring out the best in their employees; however, one needs to be a self-starter, identify these opportunities and capitalize on them.
The company is not hierarchical in its approach; though it has been around for a while, the culture is very young and full of energy. Everyone is very open about feedback and suggestions, and they have an open-door policy.
Overall, very transparent work culture; the sessions and meet-ups with the leadership team are a great way to stay connected.","You cannot afford to have a laidback attitude here, need to be geared up at all times."
271,Bajaj Finance,Best company,2022-01-03,5.0,Sales Manager,"Culture is very suitable for abusive language users you can abuse anything , anytime to anyone no one cares 
They only cares about conversions.",Not a single cons in company
272,Bajaj Finance,bajaj finance is one of the best NBFC in NBFCs.,2022-01-01,2.0,Data Entry,"1. available an emergency loan 
2. withdraw cash form ATMs at ZERO interest
3. save big on every purchase 
4. get privileges form Bajaj Finserv along with instant approval","1. paying high rates of intrest 
2. Credit damage 
3. high Annual charge
4. other fees can quickly add up
5. overspending"
273,Bajaj Finance,I'm finance,2021-12-31,5.0,Finance,I want to work for you,I love finance i can work every day
274,Bajaj Finance,Good company,2021-12-31,5.0,Anonymous Employee,"Growth
Pay Scale
Culture 
better for those with entrepreneurial mindset",No Cons as such -
275,Bajaj Finance,Best,2021-12-30,4.0,Area Manager,Good luck with your interview go,Cheap talk too much 😂
276,Bajaj Finance,Going to work makes me excited that is saying something,2021-12-29,5.0,Manager,"I can like wear wearing casuals to work everyday at BFL &, I love being in an open workspace
Not hectic or too much work load, you feel excited to reach goals because they give great incentives for great wrk/performance
Good work-life balance",Would like an extra off per week.
277,Bajaj Finance,Good working,2021-12-29,5.0,Sales Assistant,Good work environment job place,There is lot of political
278,Bajaj Finance,Something to learn everyday,2021-12-29,5.0,Assistant Product Manager,"Latest tools of the trade
Tech and disruptive innovation-obsessed culture
Seniors are supportive and will push you to excel and develop new skills
Learning can be fun if you have an open mind and say yes to cross-function projects
Decent money, work-life balance is okay
Great incentives for good performance.
In case of death due to covid, the employee’s spouse gets employment and child education funded up to the age of 21. It also covers covid policies to take care of all medical expenses.",Nothing negative that I can thinkor bad to write about.
279,Bajaj Finance,"Fast-paced, Rewarding Culture",2021-12-29,5.0,Lead Marketing,"Good work ethics and supporting managers
Informal dress code and lovely colleagues
Unique and high paying incentive policy
Flat structure means no bureaucracy, so that’s great
Nice place for self-starters with ambition to work on big projects",6 days working can get a bit exhausting
280,Bajaj Finance,Good Company,2021-12-28,4.0,Manager,Vast opportunity to learn and switch within the organization. The vision of the organization is very ambitious and helps the employees to grow and perform at a very fast pace. Rewards and recognition are also duly given to the employees and the company offers good remuneration as well. Being the leader in the industry truly contributes to the experience.,Culture is a bit different and not too professional sometimes. One must be ready for long work hours when needed.
281,Bajaj Finance,"Transparent, start-up type open culture",2021-12-28,5.0,Senior Tech Specialist,"Been here for 8 years, no complaints till date. 
If you are looking to join BFL, be prepared to work hard and diligently – There will be immense opportunities presented to you, but your performance will determine what you are worthy of. 
Though it is legacy company, the culture is open and transparent like that of any fintech start-up. You can share your ideas openly, walk up to your seniors and discuss an issue, the HR ensures that the open-door policy is maintained in the true sense.","Six days working, though there are a few light workdays, but it would be good to have Saturday and Sunday off."
282,Bajaj Finance,Great place for self-driven professionals,2021-12-27,5.0,Database Architect,"The entire focus of the company is on growing its employees and itself. They do everything in their capacity to hone the skills of employees and prepare them for the bigger picture. 
If you want, you can grow by leaps and bounds here, regardless of the tenure at the company. 
Very supportive seniors, they are there to mentor you.","Competitive environment, while some may view this as tiring, it actually brings out the best in one."
283,Bajaj Finance,Good job location,2021-12-27,5.0,Finance/Sales,Good job location and timings,It takes more time for
284,Bajaj Finance,Nice,2021-12-27,4.0,Finance Manager,Good company this is a good job,GjB nation company and full time
285,Bajaj Finance,Work Culture,2021-12-26,3.0,Sales Manager,there is no compromise for salary and too good with incentive..,they using abuse language and work culture too pathetic
286,Bajaj Finance,Very hectic,2021-12-25,1.0,Sales Manager,Salary on time they give,Unnecessary high targets & abuse
287,Bajaj Finance,"Flexible work environment, the place to be",2021-12-25,5.0,Assistant Manager,"Flexibility to pick a role you are excited about
Every success and achievements are celebrated by the entire team
Ambition and growth are encouraged",Not for the fainthearted or for those who like a more leisurely pace. Give your best to your work and get the best from your work.
288,Bajaj Finance,One of the best NBFC to work with,2021-12-24,4.0,Sales Manager,Bajaj Finance Ltd is a pioneer in lending business.If you're looking your career in asset vertical then this is the place to be in.This company gives you career & monetary growth if you're completely dedicated & commited to you're work.,No time for personal life.As of now if you're working for liability product then there is no growth.A bit of politics which common in every organisation.
289,Bajaj Finance,"Great pay, quick growth workplace",2021-12-23,5.0,Database Administrator,"Great pay, great perks, yearly bonus makes me happy
Lots of opportunities for growth and promotion
I am encouraged to apply for positions that I am interested in
Flexible work hours
R&R is integral to BFL. They also provide opportunities like Excelsior where our family is also involved in our success","Fast paced work environment, need to catch my breath at times"
290,Bajaj Finance,Nice Organization to star your career,2021-12-23,3.0,Sales Manager,Good Coworking space and very friendly environment to work,No Cons As Such To Tell
291,Bajaj Finance,Manager,2021-12-23,3.0,Manager,Good Company to work with,Salary is less compared to other company
292,Bajaj Finance,Product manager,2021-12-23,5.0,Unit Manager,Amazing work culture in Bajaj,No such cons in Bajaj
293,Bajaj Finance,A stupid company full of imbeciles,2021-12-22,1.0,Cluster Manager,None. Such management and company should be dissolved,"1. No mental well-being.
2. Culture of using profanity across the company
3. All leadership and management is a group of undeserving imbeciles with no vision. Only profit-centric approach
4. Customers and employees are treated very badly.
5. In the name of incentives and money they make you work for 6 days which in the end makes no difference.
6. All leadership is lazy and stupid just waste time doing reviews and making people prepare ppts.
7. No innovation. No learning just living on organic numbers. 
8. List is endless...in short never ever join and refer such companies"
294,Bajaj Finance,"Growth opportunities galore, best workplace for freshers",2021-12-22,5.0,Product Manager,"Continuous engagement with the board through town halls and confluencers
Young senior management, open to new ideas and approachable
DIY approach – helps learning and innovation
Goal achievements and successes are celebrated by the whole team","Very fast paced, catch up or lose it 
Open seating can become distracting"
295,Bajaj Finance,Good,2021-12-22,4.0,Intern,"Good Work Environment
Best in growth","Lack of stability
Use of wrong words"
296,Bajaj Finance,"Like-minded, passionate people",2021-12-22,5.0,Database Architect,"If you're into tech/AI/ML, you'll have a lot of fun
Culture of innovation, creativity is rewarded and acknowledged
People on the floor are very helpful and experienced, you can easily find good mentors
Fast-tracked career growth if you perform well. They pay very well for performance (over and above incentives)
HR policies are okay, pay is good.
What I find impressive is they also offer Covid policies like covering all medical expenses. In case of death, the spouse gets employment and child education gets funded up to the age of 21. Very thoughtful policy indeed.",Work culture here is good.
297,Bajaj Finance,good,2021-12-22,5.0,Sales Exexutive,awsome working in a company,worked a very good company
298,Bajaj Finance,Good,2021-12-21,4.0,Deputy Manager,Good pay and learning gives more motivation,Na na na na na
299,Bajaj Finance,A good learning curve,2021-12-21,5.0,Product Manager,"New joinee here, decent couple of months so far. Seniors can be helpful but will push you like crazy. It's a very performance-oriented work environment where maintaining a swift TAT is critical. But I am liking it so far, especially because perks are quite good, and I have seen co-workers being rewarded with big increments. Also love their R&R policy. They provide opportunities like Excelsior that involve your family in your success.","Work - life balance can be tough initially, But it slowly falls in place. Go a bit easy on freshers. Initially, not everyone can keep pace with how dynamic everything is."
300,Bajaj Finance,Good,2021-12-21,4.0,Marketing Manager,Good work culture. Less pressure.,Good place to work. Perfect balance.
301,Bajaj Finance,No work life balance,2021-12-20,2.0,Sales Manager,"Increment 
Incentives 
Rewards & Recognition
Learning
Development","No Worklife balance
Bad politics
Explicit language
Favourism 
Poor culture
Useless HR's"
302,Bajaj Finance,N/A,2021-12-18,5.0,Senior Executive-HR,Good environment and good ppl,Bad regulations to the employees
303,Bajaj Finance,Good pay.. hectic work culture,2021-12-18,4.0,Product Manager,Best pay package. Lot of learning,Hectic work culture...no Work life balance
304,Bajaj Finance,Very good company,2021-12-18,5.0,Data Entry,"Supportive senior , friendly nature , salary on time",I am nothing to face any cons in this company
305,Bajaj Finance,Finance manager,2021-12-18,5.0,Finance Manager,Hard working tirelessly for 12 hrs.,6-7 days 12 hrs working
306,Bajaj Finance,Great place to work,2021-12-18,5.0,Debt Manager,Things are to flexible to enjoy your work and achieve milestone as per company requirements.,Sometimes you can not spare time to your personal life due to work load.
307,Bajaj Finance,Good place to work,2021-12-18,4.0,Credit Manager,Good salary and internal transfers and auto promotions,NO Work life balance and 7 days work culture
308,Bajaj Finance,Bed work culture,2021-12-18,2.0,Assistant Sales Manager,Good for growth but not for work life balance,No work life balance. No time management
309,Bajaj Finance,Work experience,2021-12-17,3.0,Regional Sales Manager,Good incentives and good salary and medical coverage,No work life balance and leave polices is not good
