,company,headline,date,overall_rating,author_position,pros,cons
551,Bajaj Finance,Work-life balance,2021-06-29,1.0,Manager,Incentive that it earns you,"Bad Behaviour of Senior Manager, Completely Disrupted Work-life balance, Lobbies, Internal Politics, No appreciation for Performance"
552,Bajaj Finance,It's good Company,2021-06-29,4.0,Branch Manager,"Team work ,Customer service,CRM, Cash management",No personal life late night work
553,Bajaj Finance,Make money not life,2021-06-27,4.0,Manager,"Well paid, newer technology used and one of the top NBFC","No work life balance, work time depends on team to team"
554,Bajaj Finance,Good working environment,2021-06-27,3.0,Anonymous Employee,Timely awards and recognitions for hardwork,Too much of work pressure
555,Bajaj Finance,Worst Job experience,2021-06-26,1.0,Sales Officer,There are no pros in Bajaj Financs jobs.,Environment is very Abusive and Unhealthy
556,Bajaj Finance,Senior Software Developer,2021-06-26,1.0,Data Analyst,"Work- Life balance, Opportunity to learn new skills","Not employee interest oriented, job profile was hanged without prior notice just before joining"
557,Bajaj Finance,Good experience,2021-06-25,4.0,Cluster Manager,High growth opportunities especially for freshers,Pay grades of entry level folk
558,Bajaj Finance,Bajaj,2021-06-24,3.0,Marketing Coordinator,"Stable job, good pay, market leader","Stress, work culture, weekends working"
559,Bajaj Finance,Credit operations,2021-06-23,5.0,Credit Manager,Home location and good salary,No holiday even govt or 2nd 4th saturday
560,Bajaj Finance,HR,2021-06-23,4.0,Human Resources Manager,"Great learning opportunity, R&R, visibility and flat structure","Work load, no work life balance, too bad culture"
561,Bajaj Finance,Not to much interesting,2021-06-22,2.0,Finance and Accounting,In the season lots of benifits,Too much work load. Over time work
562,Bajaj Finance,Good place to work. Hardcore working environment.,2021-06-22,4.0,Anonymous Employee,Great detailing and processes to work and learn,Not many. No place is perfect.
563,Bajaj Finance,Na,2021-06-22,3.0,Manager,"Good Pay, growth, open work culture","Poor Work life balance, pressure and aggressive"
564,Bajaj Finance,B2C Experience,2021-06-22,5.0,Senior Regional Sales Manager,Best company to learn and Grow faster,No as such cons for this company
565,Bajaj Finance,Great,2021-06-16,4.0,Collection Executive,Good Incentive Plans for Achieving Targets,Need to go on field
566,Bajaj Finance,About my company,2021-06-15,5.0,Sales Manager,Loan disbursement very quick and quick process,No dis advantages in bajaj
567,Bajaj Finance,Designer,2021-06-15,4.0,Graphic Designer,"Good environment, employee, Best for growing your skills","No, Its depending on you"
568,Bajaj Finance,Good,2021-06-15,4.0,Sales Manager,"Good For System Knowledge
Efficient business Model","No Cons in BFL
Work Life Balance"
569,Bajaj Finance,Freedom to work,2021-06-12,4.0,Collections Representative,Own time flexible to work friendly mangers,Low target good salary monthend leaves
570,Bajaj Finance,Ok.ok full of pressure,2021-06-12,2.0,Bajaj Finance,Pressure Pressure pressure pressures pressure,No respect less money no family life no growth nothing..zero life.. full of gali
571,Bajaj Finance,Good Grow thing Company,2021-06-12,5.0,Credit Analyst,Learn New Things to Best Platform,No leaves Sanctions Every Month
572,Bajaj Finance,NOT BAD,2021-06-11,4.0,Assistant Manager,"Agressive growth, u can be manager in 15months",Less time for personal life
573,Bajaj Finance,Superb,2021-06-10,5.0,Cluster Manager,Best superb mindblowing work nice,"None, NA, none , NA, None"
574,Bajaj Finance,Good,2021-06-10,4.0,Associate,Good Environments Good cultures things,Not any clause find here
575,Bajaj Finance,Zero work life balance,2021-06-10,1.0,Anonymous Employee,Good hike is the only thing they give.,"1. Zero work life balance
2. No appreciation
3. Blame game
4. Everything and every day is priority for them except your life.
5. Micro management"
576,Bajaj Finance,Good team.good salary,2021-06-10,4.0,Team Leader,Good salary. Good management.you can learn quickly in finance field,Pressure. Heavy work on month end
577,Bajaj Finance,Pressure Cooker,2021-06-09,1.0,Risk Analyst,There is nothing positive about this company.,Unethical HR rules during covid time. Disastrous work life balance. Abusive managers.
578,Bajaj Finance,Great place to work as well as happy life,2021-06-09,5.0,Senior Data Engineer,"Great workplace , work life balance, supported people",no holidays during the festival as its peak time but its awesome to work here
579,Bajaj Finance,Good Company for Consumer Loan,2021-06-08,5.0,Sales Officer,Good Comapany for any kind of Loan,"Good place to work, also good for any kind of loan mostly consumer loan is best product of bajaj finserv"
580,Bajaj Finance,Its a survival Job,2021-06-08,3.0,Sales Executive,Good incentive and salary in time,"Pressure is high
Off role job"
581,Bajaj Finance,"No work life balance, working hours 7.30 am-11.30pm",2021-06-06,3.0,Anonymous Employee,"Good incentives , annual contests","No work life balance , jo holidays no festivals no sick leave,long workings hours,using abussive languages by all seniors, hr is only for name"
582,Bajaj Finance,Great Organization,2021-06-06,4.0,RSM,"Great work environment, complete freedom to operate, excellent remuneration",Hustle at times becomes too extreme to handle
583,Bajaj Finance,OK,2021-06-05,2.0,Product Manager,"Good for Salary, Nothing much","Lot of pressure 
No personal life"
584,Bajaj Finance,Good company,2021-06-03,3.0,Associate Engineer,Best work Culture and opportunities.,Work life balance and working hours
585,Bajaj Finance,Great Place to work,2021-06-03,5.0,Senior Product Lead,"Great compensation
Learning opportunity
Great Team
Value to your ideas
Transparency","less work-life balance
Long working hours"
586,Bajaj Finance,Great working here,2021-06-02,4.0,Associate,"Good learning experience 
Steep growth curve","Hectic work hours
Work culture is not so great"
587,Bajaj Finance,Ok to work as fresher,2021-06-02,3.0,Sales Associate,All ok to start your career with,need to increase the basic pay
588,Bajaj Finance,Bajaj,2021-06-02,3.0,Manager,"Pros :- helpful team, Good environment.",Cons :- Work life Balance.
589,Bajaj Finance,It was greate working culture.,2021-06-01,4.0,Credit Manager,Management of company were very good,Flexible working hours are to much hectic
590,Bajaj Finance,Worked As Operation Support Associate,2021-06-01,5.0,Operations Analyst,Great Work Envirnment. Cooperative Team,"Timing, work load, calling, Hectic"
591,Bajaj Finance,Good for freshers and Workoholicks,2021-05-31,3.0,Cluster Manager,"huge learning opportunities...you get to own big projects in very short tenure
Good incentives when company is doing good",HR policies are are baseless and HR department is useless here. Actually nothing is in their control.
592,Bajaj Finance,I won 12 contests in bajaj finance toper in banglore,2021-05-31,1.0,Senior ASM,Every month done 150 percent of the target,Working hrs from 7am to 12 pm every day no leaves
593,Bajaj Finance,Nice company,2021-05-31,4.0,Senior Sales Executive,Good place to work. Nice environment,No more time for family.
594,Bajaj Finance,Good experience,2021-05-30,5.0,Area Credit Manager,Ok recommended to all good place,No cons as per my exp
595,Bajaj Finance,Good workplace,2021-05-29,3.0,Assistant Manager,"Smart salary ,Good working place and Responsible Employees.",Everything  good but Boss good behaviour  is must to concentrate  in work.
596,Bajaj Finance,Good salary but no working hours,2021-05-29,1.0,Sales Executive,They'll provide good salary and incentives.,They'll provide good salary and incentives but no working time and week off and holidays at all.
597,Bajaj Finance,Worst company to work at,2021-05-28,1.0,Manager,There’s nothing like ‘pros’ here,"No work life balance
Foul language on calls
Unachievable targets
Too much pressure
Cheap politics"
598,Bajaj Finance,Lot of hard work required,2021-05-28,4.0,Senior Manager,"Compensation is good, lot of initiatives for employee care, fast growth","Demanding culture, highly competitive, result oriented"
599,Bajaj Finance,Lots of learning opportunities for freshers,2021-05-27,4.0,Senior Software Engineer,Good place to learn best practices,Work hours can be long at times
600,Bajaj Finance,Great Company,2021-05-26,4.0,Senior Manager Human Resources,"Great leadership, Salary, Benefits and Culture","Favourism, NA, NA, NA, NA"
601,Bajaj Finance,Oom,2021-05-26,4.0,Senior Area Manager,Good company to work with,Work life should be taken care
602,Bajaj Finance,Good place to work,2021-05-26,4.0,Digital Strategy and Product Manager,Lots to learn. Independent work culture,Long hours including weekends. 6 days a week job
603,Bajaj Finance,Fast growing company,2021-05-24,4.0,Project Manager,Plenty of opportunity for growth.,Some growing pains due to integrating mergers and acquisitions.
604,Bajaj Finance,BFL Review,2021-05-24,3.0,Territory Sales Manager,I am working with this company from more than 3 years. A very good organisation for them who wants good Perks and ladder of more opportunities for career.,Too much Pressure and ork-Life Balance is not there
605,Bajaj Finance,Ok company to work with,2021-05-24,4.0,Assistant Manager,Company provides with Good incentives to the employees,No work life balance in company
606,Bajaj Finance,Working at BFL,2021-05-23,4.0,"Senior Manager, Underwriting","Great Team Engagement, Senior Leadership is very attentive. Overall Good Company to work.",Timing Issues but generally people gets used to it.
607,Bajaj Finance,"A lot of politics, NO work-life balance, average incentives.",2021-05-22,1.0,Sales Manager,"Gives you work experience
You can learn to work under high pressure situations
Pays on time
They will never fire you","Non existent HR
Won't give you the Clearance Letter unless you threaten lawsuit
No work-life balance. Work 10 hours a day, 7 days a week. 
Work even if you're sick. No way you can get 1 day off, no Saturday no Sunday, work everyday. If your mother/father/wife is sick doesn't matter.
You are the Bajaj family's SLAVE.
No promotion unless the business is doing good 
Call your senior ""Sir"" like its the 19th century
Very low level learning
Pandemic, Riots, Field officer sick, they dont care- business has to run 
They cut field officer salaries whenever they feel like, many times don't give salary at all, no holidays for them either, fire them when business goes down
Introduce ramdom unprofitable cross sell items/ sales activities
Extremely Verbally, mentally and emotionally abusive environment.
Manipulate sales numbers if you've got friends in the HO team and claim to be a good manager
No lunch timing- regional managers happily eat lunch while u dont get a break to even eat lunch 
False promises of promotion but it doesn't happen"
608,Bajaj Finance,Fiance Controls and PMO,2021-05-21,5.0,"Senior Manager, Finance",Employee Friendly company it is,too much HR centric they have become
609,Bajaj Finance,Growth,2021-05-21,5.0,Credit Manager,Contineous growth for hardworking employee,Every day long concall will hampered the business
610,Bajaj Finance,intern,2021-05-21,4.0,Internship,friendly people in the office,long working hours in the company
611,Bajaj Finance,Ok company to work with...lot of unnecessary  pressure,2021-05-18,3.0,Senior Unit Manager,incentives are good which are given on quarterly basis...,No work life balance....extreme work load
612,Bajaj Finance,Nice,2021-05-16,4.0,Sales Executive,Some family issue so revele,Good company of Bajaj finance
613,Bajaj Finance,Not worth it,2021-05-16,2.0,Manager,Too much pressure. Micro management. Hostile work culture,Money for your efforts beyond CTC.
614,Bajaj Finance,Good Experience with EK,2021-05-15,3.0,PSA II,Improve English and Learn new people and cultures,Night shift cause tired and Work Load
615,Bajaj Finance,Work culture is bit too hectic,2021-05-12,3.0,Product Manager,"Good Pay, Good Growth, Good Learning","No work-life balance, Toxic language usage."
616,Bajaj Finance,Great Place To Work,2021-05-12,5.0,Senior Lead,"Salary, Incentive & Career Growth",Work Life Balance & 6 day working week
617,Bajaj Finance,Good Company to work with,2021-05-12,5.0,Senior Regional Sales Manager,High incentive paid by the company,No work life balance in company
618,Bajaj Finance,Hectic work schedule and not at all friendly work environment,2021-05-12,2.0,Collections Manager,Considerably good salary and hike,"Unsupportive  upper management 
Hectic schedule (7 days a week around 12-13 hours each day)
Awful work environment"
619,Bajaj Finance,Great learning experience,2021-05-12,4.0,CREDIT and SALES MANAGER,"Objection handling,
Dealer handling,
Analytical skills,
Business development,
Relationship development.","Dealer staff,
Customer handling,
DCC collections,
FEMI collections,
No incentives"
620,Bajaj Finance,Worst Company Ever,2021-05-09,1.0,Manager,Cannot think of any. I guess just adds a renowned organisation's name to your resume.,"No work life balance
Pathetic work culture
Politics at managerial level
Concall anytime of the day (even on weekends)"
621,Bajaj Finance,good,2021-05-09,4.0,Sales Manager,good finance company for emi options,all servive are good in market
622,Bajaj Finance,A Place to work,2021-05-08,5.0,AREA SALES MANAGER,✔️ no pros huge growth opportunities,❌ no cons need to be dedicated
623,Bajaj Finance,Good for freshers,2021-05-06,4.0,Data Collection Executive,I am currently working as collection executive in bajaj finserv limited.good environment and our manager supports very well at tough times.they are motivate to me on everyday.Overall job was little tough at month day.otherwise it was good.,Cons:Salary was good but salary depends on ur performance .Fixed salary is very low in this field.but incentive is more than fixed.the salary was not credit on time.
624,Bajaj Finance,None,2021-05-06,1.0,Sales Manager,Salary and job security nothing other than that,Heavy work pressure no leaves
625,Bajaj Finance,Lead,2021-05-06,4.0,Senior Lead,Growth is good. Internal Job Switch,No work life balance. Can't take leaves. Have to work on weekends and holidays
626,Bajaj Finance,This company gives a lot benefit who is fit for the company role which they are provides.,2021-05-05,4.0,Assistant Manager,Companies policies related to the employees very very good.,Companies Environment should be more better as compared to the present.
627,Bajaj Finance,Great company to work,2021-05-05,4.0,Senior Product Manager,Lot of ownership and exposure,No cons found during 6 years
628,Bajaj Finance,good,2021-05-04,4.0,Territory Sales Manager,do more earn more a,you cant afford to be average
629,Bajaj Finance,ok,2021-05-04,4.0,Sales Manager,"crosell incentives
good for beginner
fast growth
easy to shift department
employee retention","Timings
No holiday
undue pressure
worst worklife balance
business rigidity"
630,Bajaj Finance,Good Company for Experience Employees',2021-05-03,3.0,Anonymous Employee,On time salary and incentives were added for all the employees.,"Company should also think about their employees health, work life balance"
631,Bajaj Finance,Excellent company to work with,2021-05-03,5.0,Senior Lead,Lot of opportunities to learn in terms of accounting and systems,Not as such till now.
632,Bajaj Finance,working as credit manager,2021-05-02,5.0,Assistant Manager,good work culture with cross sell opportunities,work life balance not good
633,Bajaj Finance,Good for experience,2021-05-01,3.0,Sales Executive,"Good salary scale, best for earning incentive in sales","Sunday working, never give you holidays"
634,Bajaj Finance,Company Overview,2021-05-01,3.0,Senior Lead,"- Best pay package in the city
- Rewards & Recognition
- Internal job opportunities (inter departments)","- 6 working days a week
- Ambiguity & constant state of change
- Hard driving & sometimes stressful"
635,Bajaj Finance,Average Work Culture,2021-04-30,3.0,Senior Software Engineer,High Paying job with average efforts,"Work Culture is not good, No Innovative work"
636,Bajaj Finance,Sales,2021-04-29,4.0,Anonymous Employee,"Good working environment, Managers are supportive",there are no as such cons
637,Bajaj Finance,No good environment,2021-04-28,1.0,Anonymous Employee,You can earn good incentive,"Long hours, inappropriate atmosphere and immense pressure."
638,Bajaj Finance,Good company,2021-04-24,3.0,Manager,"Ctc and benefits
Tablt tennis
Food at pantry
Location is good
Define company",Work life balance is really good
639,Bajaj Finance,Fair,2021-04-23,3.0,Sales Manager,"Decent opportunity
Good pay and benefits","Poor Management 
Very corporate structure
You don’t get Friday after thanksgiving off as a holidsy"
640,Bajaj Finance,"The groups and politics within in ZSM,RSM other parties are destroying Bajaj Finserv",2021-04-22,3.0,Assistant Manager Consumer Durable Finance,Good support from the HO operations,"No support from senior managers, RsM/ZSM towards Assistant Managers who are actually working on ground, getting things done, and taking the branches allocated to him to their desired position by achieving and over-achieving targets."
641,Bajaj Finance,Working in Centralised Credit Operation & Managing the TA/RF Portfolio,2021-04-21,3.0,Manager,"Good Salary, Better Growth, Learning Opportunities","No work-life balance, Holiday Working, Extended Working hours culture"
642,Bajaj Finance,Good incentives and money but no work life balance,2021-04-21,3.0,Product Manager,"Good incentives, excellent career growth","No work life balance, highly insensitive"
643,Bajaj Finance,Na,2021-04-20,5.0,Senior Regional Sales Manager,"Do more earn more
Employee friendly 
Best practices 
Great place to wotkrj",Great place to work for
644,Bajaj Finance,Sales,2021-04-20,2.0,Sales,Good works for some but Jalal,Works some time but on this jamal
645,Bajaj Finance,Ambitious and fast,2021-04-20,5.0,Deputy National Lead,"- high salary and perks like paid foreigner trips
- ambitious aims with view to learn multiple disciplines
- focused growth path
- horizontal team structure","- high expectations and competitive
- fast paced"
646,Bajaj Finance,2 stars,2021-04-20,2.0,Sales Support Representative,Made many friends working there,No longer a fun place
647,Bajaj Finance,Good company,2021-04-20,2.0,Officer Administration,"Only benifits to onrole employees, 
No growth to offrole employees
Use and throw offroll employees",No growth for offroll employees in administration
648,Bajaj Finance,Combination of establishment & growth,2021-04-19,5.0,Senior Manager,"Growth opportunity
Agile and professional environment
Highly recommending the Senior Management",Company is maturing towards establishing culture of repute
649,Bajaj Finance,Great workplace,2021-04-19,4.0,Cluster Manager,"Salary & Incentive, growth, carreer options","Work life balance, work life balance"
650,Bajaj Finance,Do more earn more,2021-04-19,5.0,Human Resources Manager,More Income more incentive more money,"No personal life , No weekly off , 7 days working"
651,Bajaj Finance,Excellent Learning Platform,2021-04-19,4.0,Product Manager,Great Place to learn and horn your skills,Low work life balance here
652,Bajaj Finance,Saturday working,2021-04-19,4.0,BAJAJ FINSERV,Good exposure to all technology,"Saturday working, low salary increment"
653,Bajaj Finance,NA,2021-04-17,5.0,Credit Manager,Good work culture business oriented company.,Depends on he business behaviours.
654,Bajaj Finance,Do More Earn More,2021-04-16,5.0,Digital Marketing Manager,You will get rewarded if you do hard work,"6 Days working, Heavy Targets"
655,Bajaj Finance,Bsbsh,2021-04-16,5.0,Manager,Good company to work with,Not that good company to work with
656,Bajaj Finance,3 years complete experience at Fino payment Bank,2021-04-16,5.0,Branch Operation Manager,I want to careers groth,I will smart and hard work
657,Bajaj Finance,Worst Work Environment,2021-04-14,1.0,Credit Wholesale,Good Pay and good challenging environment.,"Abusive work culture, too much pressure. Management is only for money"
658,Bajaj Finance,Good Company,2021-04-13,5.0,Data Entry,Bajaj Finserv gave a very good experience,Great platform to leann and to work
659,Bajaj Finance,Nice job,2021-04-13,5.0,Assistant Manager,Sales communication is must and enjoy,No holidays and more pressure
660,Bajaj Finance,Good to work from home as it matches the salary.,2021-04-12,4.0,Collection Agent,Salary increment as per the work.,Salary depends upon no. of cases you are alloted.
661,Bajaj Finance,Growth Oriented Company,2021-04-11,3.0,Finance,Growing company with steady financial stability,Lack of Work Life Balance
662,Bajaj Finance,Good company,2021-04-11,4.0,Product Manager,Salary and incentives. Good challenging roles. You can diversify your skill sets,"Work life balance, needs to be more process oriented"
663,Bajaj Finance,Good place to work for freshers,2021-04-08,4.0,Manager,"Good learning opportunities 
Good salary and incentives
Good growth path financially and professionally","Working Saturdays
Work life balance for married"
664,Bajaj Finance,Good Company to work for,2021-04-08,4.0,Manager,"Good pay packages
Flexible Timing- No sweep in - sweep out",Bring your own laptop and aggressive culture/agile culture
665,Bajaj Finance,Nice place to work,2021-04-08,4.0,Manager,"Better salary, incentive framework, monetary rewards",Work pressure apart from it everything is ok
666,Bajaj Finance,Very good company to work with,2021-04-07,5.0,Software Engineer,"Great work environment, usage of latest technology",No cons as such in work
667,Bajaj Finance,Company review,2021-04-07,5.0,Manager,Good company to work with.,No cons as of now
668,Bajaj Finance,God job..,2021-04-06,3.0,Sales Officer,Good place to learn. Lot of work,Talking and behaviour with junior members is not adequate
669,Bajaj Finance,Numbers will speak about you,2021-04-06,5.0,Senior Area Manager,Numbers will decide your future,some managers will attack on family grounds
670,Bajaj Finance,Great experience,2021-04-05,4.0,Anonymous Employee,Work env is Good for women,No such as but have some good stuff
671,Bajaj Finance,Decent paymaster,2021-04-04,2.0,Senior Manager,"-good pay scale
-challenging work
-decent incentive payout","-Poor work culture
- limited scope of hands-on experience"
672,Bajaj Finance,Agency executive,2021-04-04,1.0,Sales Executive,Good work culture easy to work,Some of the CROSS selling
673,Bajaj Finance,Mixed feelings,2021-04-03,3.0,Anonymous Employee,"Good Salary and incentives, Competitive environment",Work Life balance goes for a toss
674,Bajaj Finance,nice,2021-04-02,5.0,Assistant Sales Manager,"good communication, better working environment","timings and leaves , office hours , work pressure"
675,Bajaj Finance,Good company,2021-04-01,5.0,Manager,"Good salary, best working culture",Not hing to say here
676,Bajaj Finance,GOOD COMPANY,2021-04-01,3.0,Sales Representative,GOOD COMPANY AND HELPFUL NATURE,Good manager and good employee
677,Bajaj Finance,Good to work as fresher,2021-03-31,3.0,Associate Software Engineer,Best to start career for fresher. If you work hard you'll play hard when you get on-role offer.,Nothing to tell about cons.
678,Bajaj Finance,Pay Master,2021-03-31,4.0,Cluster Manager,"Salary best in industry
Learning opportunity","Work life balance is compromised
Working Saturdays"
679,Bajaj Finance,Do More Earn More,2021-03-30,5.0,AREA SALES MANAGER,Job security/ Multiple Skills knowledge/Hard work and Team Management,How to grow in YOY - Sales growth
680,Bajaj Finance,Excellent,2021-03-28,5.0,Deputy Manager,"New Technologies exposure, startup environment","saturday working, small teams, no team gatherings"
681,Bajaj Finance,Complete Business & innovative oriented Organizations,2021-03-28,5.0,AREA SALES MANAGER,"I worked in both BFL & BHFL

BFL management is 1000% good  BHFL

Salary & Incentive structure 

Have humanity  to understand  situation of sales drop.

But in BHFL worst management by sinors 

Higher Fire culture","But Only work life no family time 

Pressure as same as sales organization"
682,Bajaj Finance,Good,2021-03-25,1.0,Assistant Manager,A lot of thing will come to learn,No cons according to me
683,Bajaj Finance,Good,2021-03-25,5.0,Equity Research Analyst,Time are flexible and adjustable,Nothing is bad about this company
684,Bajaj Finance,Faculty good in bajaj finance,2021-03-24,4.0,Sales Associate,It seems good looking and hard working job in bajaj finance,There is no cons to say
685,Bajaj Finance,Good,2021-03-24,3.0,Project Manager,Good to work at Bajaj,Extra workload or no work at all
686,Bajaj Finance,No Work Life Balance,2021-03-24,3.0,Unit Manager,"- Huge learning curve
- Great Scope of Professional Growth","- No work life balance
- No set working hours
- No flexibility in terms of taking leaves"
687,Bajaj Finance,Good company,2021-03-22,3.0,Sales Executive,You get lot of chance to earn in terms of incentive as compared to salary.,No time schedule for the work. You have to work whenever or whatever time it takes
688,Bajaj Finance,Okay,2021-03-22,2.0,Assistant Manager,Pros here Not at all,Cons their is no work life balance
689,Bajaj Finance,Very Good Working Environment,2021-03-22,4.0,Customer Service Representative,Salary & Incentive on time .,Have to work During festival.
690,Bajaj Finance,about work environment,2021-03-21,2.0,FOS,Apart from basic pay incentive slabs are ananymous compared to other competitors.,Management won't treat there employers well . They are not responsive towards customer queries.Obviously basic pay is also too low.they will get more work than that what they are paying for u.
