,company,headline,date,overall_rating,author_position,pros,cons
331,Kiya.ai,Gives you a stable career,2020-01-17,5.0,Anonymous Employee,"Well, i have been here for more than two years, and i truly believe that this is one of the best companies, that will give you the right environment to work, and offer you the freedom to express yourself, you will be encouraged to do something new. A range of facilities are provided here. I happily recommend it to all, looking for a better career.",There is no transport facility for employees
332,Kiya.ai,A professional organization,2020-01-16,5.0,Anonymous Employee,"Infrasoft provides a great platform to the employees, allowing them to work on new cutting edge technologies. If you are a fresher then, Infrasoft offers training sessions, that build the overall personality of an employee. A professional company where all the employees are treated equal, no favoritism, open culture.","There is nothing to complain, all facilities are good."
333,Kiya.ai,Friendly environment,2020-01-16,5.0,Systems Analyst,"1. Friendly office environment.
2. Seminars are held to develop skills.
3. Good learning opportunity.
4. Good work-life balance.","No such cons, if you ask me."
334,Kiya.ai,Good place to grow,2020-01-16,5.0,Software Engineer,"1. HR's are very cooperative
2. Project managers are helpful
3. You will have an opportunity to work on various projects.
4. Your knowledge will be improved
5. Timely salary",Cafeteria needs to be improved
335,Kiya.ai,One of the fastest growing IT company,2020-01-15,5.0,Consultant,"Learned new cutting edge technologies here, lot of global clients which gives you onsite opportunities to work. One of the fast paced organization and helpful for career growth.",Lesser no of outdoor activities
336,Kiya.ai,Glad I have joined Infrasoft Technologies,2020-01-15,5.0,Software Engineer,If you have worked anywhere before joining Infrasoft then your involvement towards the company will be deep as this place will utilize your skillset and will allow making impactful changes in the process. Your suggestions will be heard out from leaders and if it is good for the organization you will be given responsibility for it.,Some processes takes longer time than usual.
337,Kiya.ai,A growing company with skilled employees,2020-01-15,5.0,Anonymous Employee,"Colleagues play a vital role in our professional career, and there in infrasoft, everyone is so polite and kind, whenever you need help in work they are always there for you. Senior people will always be ready to hear you out and guide you through it. Great atmosphere and work ethics.",Need to provide training on more technologies because of various projects
338,Kiya.ai,One of the best I have worked with,2020-01-14,5.0,Senior Software Developer,Me as a fresher I am fortunate to complete 5 years as of now and I am glad to gain experience in different roles. Seniors always encouraged me to learn something new which will help the organization. Management team is always ready to help if you reach out to them.,Need better infrastructure and parking space needs improvement.
339,Kiya.ai,Fun loving and stress free environment,2020-01-14,5.0,Java Developer,Management tries to take steps to improve work-life balance. Fun activities are conducted to take the workload off from the employee's shoulders. Culture is strong and more focused on employees.,Nothing actually worth mentioning till date
340,Kiya.ai,Truly one of the companies that offers good scope,2020-01-14,5.0,Software Engineer,"One gets good scope to grow in their career.
Culture: work together as a family
Pay: well deserved pay",Needs better cafeteria and food quality
341,Kiya.ai,Open work culture,2020-01-14,5.0,Presales Consultant,Infrasoft gives importance to it's open work culture and core values. Open culture is one of the best things I have liked here. The hierarchy is such that everybody is easily approachable.,You will not find any major cons here
342,Kiya.ai,Place where one can learn and grow,2020-01-13,5.0,Business Analyst,"In Infrasoft, you will be surrounded by the best minds from the industry who always strive for something new so that they give you the best learning experience and also help you to grow professionally and personally.",Sometimes you will feel the work environment is fast-paced
343,Kiya.ai,Helpful colleagues and a better work life balance,2020-01-13,5.0,Associate Consultant,"Colleagues are always ready to help you. Good salary packages, lots of growth opportunities. No politics and micro management. Flexiblity in working hours.",Sometimes office support staff are less cooperative.
344,Kiya.ai,Good for quick career growth,2020-01-12,5.0,Software Developer,"Good salary hike. Management team is very focused towards the employee welfare. The seniors are approachable, transparent and always helpful to the subordinates.",Need to improve the infrastructure
345,Kiya.ai,I like working here,2020-01-12,5.0,Anonymous Employee,"Working with Infrasoft has been an amazing experience so far! We are working in a small team, and everyone gets recognition for their work. I loved to deal with new challenging tasks daily.",No pickup and drop facility
346,Kiya.ai,Loved this company and its culture,2020-01-11,5.0,Anonymous Employee,"As an intern, I have joined this company, from that very moment I have learned lots of new things, new technologies, and seniors have played a very important role in this as they have been helpful in providing guidance throughout.",Fast paced environment so you have to adjust quite frequently
347,Kiya.ai,Dynamic and positive work environment,2020-01-10,5.0,Senior Software Developer,"Infrasoft does provide you a great atmosphere and environment. Seniors and managers are quite supportive and guide us. One if the trasperant companies I have worked with, promotions are performance based.",Nothing to mention at this time
348,Kiya.ai,Decent company that gives you a corporate experience,2020-01-10,5.0,Anonymous Employee,"I can say, there are many positive things here. I have been here for 2 years now and still enjoy coming daily to the office. It's been a great place to work with such trained minds who are very helpful. They have trust in their employees.",I haven't come across one
349,Kiya.ai,Driven by new ideas and hard work,2020-01-09,5.0,Software Engineer,"As they believe in implementing new ideas, much challenging and competitive work goes around. A lot of positive and creative energy flows around. This is what makes this company stand out from the rest.",Food quality not up the mark
350,Kiya.ai,Proud to work with infrasoft technologies,2020-01-09,5.0,Software Developer,"Infrasoft is a great place to start your career. Four years back, I started my journey with this company and I am still going strong. Learned new technologies here, they give you the freedom to improve your skills and arrange a training session, whenever required.",Sometimes you will get exhausted by the meetings.
351,Kiya.ai,"Genuine place to work, work friendly culture",2020-01-09,5.0,Senior Associate,All folks and the management team are good.  They respect your values and believe in their ethics and moral values. I admire the way they treat their employees that makes a great work culture around.,Need to improve cafeteria a little
352,Kiya.ai,Professional folks work around here,2020-01-09,5.0,Software Engineer,"Company invests in offering the best work culture with better work and professional life balance, along with ethics and moral values. Another positive side of the company is, here a number of benefits are given to employees. Very talented and techno savy people work here.",No specific con to mention. Great place to invest your hard work
353,Kiya.ai,You can discover your true potential here,2020-01-08,5.0,Business Analyst,"If you want to unleash your true potential then infrasoft is a place for you. It is one of the company that demands and gives liberty to present creative ideas, and seniors are always ready to help Juniors and will guide you through.","Sometimes you will feel little bit pressure, but you will face that elsewhere too"
354,Kiya.ai,Management is approachable,2020-01-08,5.0,Consultant,Management and seniors are easily approachable and give very much freedom to the employees to show their potential. Helpful office staff and a  healthy work environment.,"Not much of a con, but sometimes too many meetings to attend"
355,Kiya.ai,Good place to work,2020-01-08,5.0,Anonymous Employee,Provides a flexible work environment and an opportunity to work on various projects. Good for shaping your career. The company will give you moments to shift your interest area within2-3 years. You will enjoy the fun events arranged by the company.,"No major ones , you will enjoy ur working here"
356,Kiya.ai,Opportunity to improvise with your own skill set,2020-01-06,5.0,Software Engineer,"Everyone here is great and open to you, being a potential coworker and friend. Well, a lot of known clients which are beneficial, if we mention in a resume. You will get an opportunity to work with multiple clients, which ultimately results in improving your skillset.",More flexibility in time is required
357,Kiya.ai,Had an incredible experience working here,2020-01-06,5.0,Senior Associate Consultant,"You will have an incredible experience working with a variety of clients and talented people. Friendly culture, and a lot of training sessions to enrich employees skills. You get to work with genuine and compassionate people.",Some facilities are not employee friendly
358,Kiya.ai,Highly recommend,2020-01-05,5.0,Business Analyst,Infrasoft is a company where the team spirit is strongly encouraged. Everyone is always available to give a helping hand when needed. A lot of interesting and passionate colleagues.,Nothing significant to be mentioned
359,Kiya.ai,Enjoyed working with good hearted people,2020-01-05,5.0,Senior Consultant,Company offers a very comfortable working and peaceful environment. You get lots of opportunities to get involved and contribute. You learn a lot as a young professional with an entrepreneurial mindset. Overall open and professional approach.,Less variety in terms of food available
360,Kiya.ai,Enriching experience to work with infrasoft,2020-01-03,5.0,Associate Consultant,"People are very skilled and friendly,  and you get to work on multiple domains. It provides responsible job roles that helps in professional growth at infrasoft.",Project deadlines  are tight at times
361,Kiya.ai,Infrasoft provides a corporate culture,2020-01-03,5.0,Software Engineer,"There are many career advancement opportunities for current and future employees at Infrasoft, which results in company growth. Good work and personal life balance, team spirit, and ambiance.",Lesser fun activities are held
362,Kiya.ai,Fastest growing company with lot of opportunities,2020-01-03,5.0,Anonymous Employee,"Infrasoft works on interesting projects with a lot of responsibilities. The company offers great professional opportunities with diverse outlooks. They are available always, trying to find the best solution for its clients.",No company transport is available
363,Kiya.ai,A workplace to boost your professional career,2020-01-03,5.0,Software Developer,"Management is always open and approachable. The company has many interesting projects, many of which are at the forefront of knowledge. They are always looking for opportunities and progress.",No cons and highly recommend it without hesitation
364,Kiya.ai,Accounts & Taxation,2019-12-26,3.0,Anonymous Employee,Good Company & Good working environment,"Less Growth Opportunity, No Motivation and appreciation at work"
365,Kiya.ai,Good Company,2019-12-12,5.0,Anonymous Employee,Good salary and friendly environment,not proper care about employee
366,Kiya.ai,Dont join,2019-12-12,1.0,Java Developer,This company is worst don't join.,"politics, bad pay, overwork, worst management"
367,Kiya.ai,Good Company for talented people,2019-12-04,3.0,Senior Consultant,Initially they pay good salary,comparatively less projects with MNCs
368,Kiya.ai,Poor Leadership,2019-11-26,1.0,Anonymous Employee,Only if an onsite opportunity is offered,"Bad Leadership and executive team
Poor Management
CEO and company without vision
Very poor HR
Bad canteen
Operates more like family business with most people friends and relatives of management"
369,Kiya.ai,Don't join,2019-11-19,2.0,Anonymous Employee,Nothing much ... everything is a con,Almost every thing ends up with con
370,Kiya.ai,Good company for Experienced,2019-11-18,2.0,Implementation Consultant,"Salary is good.
Can Learn Banking Domain Well.
Can also learn Java Development Environment.","Fun Event was not conducted.
Cafeteria is not  there.
 They are took a employee from third-party for low salary but beauty is that employee was doing the same work as well the direct employee did."
371,Kiya.ai,conditions at work place,2019-11-04,5.0,Anonymous Employee,superb at the company work place fully enjoyable,there i nothing to tell about consequences
372,Kiya.ai,Associate consultant,2019-10-23,4.0,Anonymous Employee,Gud place to work and good environment,Nothing bad about the company
373,Kiya.ai,Work culture and salary,2019-10-21,2.0,Associate Technical Consultant,It's good place for those who can polish people and play games and politics,Worst company to work with because they are not giving good salary and not even hike with worst excuse. Full of pressure for work and noone will appreciate you. They need robots not humans
374,Kiya.ai,Not bad,2019-10-18,2.0,Anonymous Employee,Its an average staff outsourcing frim,Nothing much per se but job security is an issue.
375,Kiya.ai,Implementation Engineer,2019-10-14,3.0,Associate,"MNC, Work, Projects, Exposure, Reside in many countries","Packages, High Productivity least employee management, Opportunities"
376,Kiya.ai,Good company,2019-10-10,4.0,Anonymous Employee,Good company for learning and grow up carrior,No cons all things are good
377,Kiya.ai,Good opportunity,2019-09-29,4.0,Anonymous Employee,"Learning never stops, onsite opportunities","Old stack used,  salary not compatitive"
378,Kiya.ai,Company review,2019-09-22,3.0,Associate Consultant,"Timely salary.
Good compensation if u can negotiate while joining.","No management at all
Do not expect hike 
No communication with contract employees"
379,Kiya.ai,Good Place For Sometime not for Career Growth.,2019-09-17,1.0,Senior Technical Consultant,BFSI Domain knowledge is only positive area.,Management doesn't have vision and Specially old Employees are eating company wealth.
380,Kiya.ai,Contract with CITI,2019-09-16,3.0,Anonymous Employee,"CITI WORKPLACE IS GOOD
GOOD TEAM
GOOD LEARNING","Worst appraisal
Worst salary
Worst benefits
Worsttttt policies"
381,Kiya.ai,Good company,2019-09-06,4.0,Senior Consultant,"worked in client location where you can learn new technologies.
Good salary package.
Opportunity to convert your payroll to client company.
Anand from hr team was supportive and helpful.
Friendly environment.
Opportunity to travel on-site.","Increment and variable pay was not on time.
No additional benefits for people working in client location"
382,Kiya.ai,Worst company you will never grow here.,2019-08-30,2.0,Software Developer,Team is good and helpful. Events are managed good.,"Management is not good. All politics is happening.

You will always be sent to client side whatever your problem is.

Employee is not treated good.

Working since 2 years salary is not incremented.

Increment cycle is also not on time.

Company Policy changes according to their requirements.

Suggesting you not to join."
383,Kiya.ai,work culture,2019-08-28,3.0,Employee,Good environment to work with,increments and promotion are less
384,Kiya.ai,Sales Manager,2019-08-03,2.0,Sales Manager,"BFSI segment, good mgmt. good cultural value, average compensation, peaceful approach","Lesser opportunity. Great care,good career, Good peers, great concern"
385,Kiya.ai,Worst company ever I have worked with,2019-07-23,1.0,Associate Consultant,There is no Pros than salary day here at all.,"Worst company ever.
No worklife balance.
They also make you work even on saturday and sunday.
If anyone refuse to do they threat they will fire you especially AVP of the company.
Worst management he has you even cant escalate this to uper level as well because uper level AVP is the main who put you under pressure without consulting with developers whether its possible or not give due date.
Because such bad treatment to employee and make them work more than 14 hrs a day feels like you are in jail.

Don't even go if they are offering you big salary  after one month you will realize money doesnt matter only donkey work matters..no time limit to working hours."
386,Kiya.ai,Good place for freshers,2019-07-22,3.0,Senior Java Developer,Great place for freshers.  good exposure to banking products and development life cycle,"Experienced professionals should not join this company
since most of the clients are public sector units they treat u as crap. Ur manager will not help you in case a client starts mistreating you. they will say just deal with it."
387,Kiya.ai,Project Lead,2019-07-04,2.0,Anonymous Employee,Good client exposure.  month end celebrations to award good performance,No new technology still with old technology. Few resources and multiple projects.
388,Kiya.ai,Good,2019-06-27,5.0,Consultant,Friendly work environment in office.,work is good but every time on pressure
389,Kiya.ai,Average company,2019-06-26,1.0,Principal Consultant,". Onsite opportunity
2. Pay as you ask at the time of joining
3. Monthly birthday Celebration
4. Free snacks if you are sitting later than 9pm (packaged snacks)
5. Free lunch if you are asked to work over weekends
6. Some of team members are very helpful
7. Good admin department","1. Job insecurity. Hire and fire culture. If you don't have project and you are not in good books of managers and top managers you will be fired on the spot without even giving consideration
2. Micro management
3. Poor and unhygienic cafeteria
4. Your job is saved only if you know how to butter up your bosses
5. one of the worst HR policies
6. HR is very unkind
7. Very bad leave policies
8. Majorly UK clients.
9. Infrastructure is also average
10. Some top management people use swear words in the office only."
390,Kiya.ai,Senior associate consultant,2019-06-26,3.0,Senior Associate Consultant,"-work culture is friendly
-career growth
-good pay","-minimal projects 
-tech Dependency
- less growth for experienced person"
391,Kiya.ai,CRD Lead,2019-06-25,3.0,CRD Lead,"Flexibility, No control, health care, support , talks","VISA issues , no help , no promotions"
392,Kiya.ai,Very Bad Experience: Think thrice before joining,2019-06-13,1.0,Presales Consultant,"Infrasoft offers you a good compensation which is above market standards. Additionally, if you perform well; you would be given more responsibilities which will ultimately lead to more learnings. They are quite a niche company which focusses on just BFSI industry.","The more you perform, the more work you will get; no matter that your other teammates are sitting idle. Once you have proven yourself, only you will get the work while the rest of the team members will enjoy their gala time.
There is lot (seriously lot) of politics in Infrasoft. People who are dear to the management will bully you like anything, even publicly. The type of language used there is very un-professional & it is sometime non-tolerable. Few people sitting on top will treat you as they have done a big favor to select you in the company.
Lastly, their infrastructure is very dated. Do not expect much here. Canteen is just for namesake."
393,Kiya.ai,Senior associate,2019-05-29,4.0,Senior Systems Engineer,"Good so far, meal pass and LTA arevgood","Appraisal not in time
No transparency on the process"
394,Kiya.ai,Senior developer,2019-05-28,1.0,Anonymous Employee,Onsite opportunities good in products,"No process , no work life balance"
395,Kiya.ai,Bad management,2019-04-08,2.0,Senior Consultant,"If you get (rare) lucky, you may get to work what you want.","no work life balance
Appraisal and variable payout never come on time.
Managers are always ready to take credit for others work."
396,Kiya.ai,Network security engineer,2019-04-02,3.0,Network Security Engineer,HR are good process is also good,Nothing  no cons. Just learn and leave forward.
397,Kiya.ai,Experience,2019-03-20,4.0,Anonymous Employee,"Friendly environment
Good place to learn",No cons as such .
398,Kiya.ai,Technology is outdated,2019-03-19,2.0,Associate Consultant,Nice package for freshers to start with,Technology are so old that some time experience is useless
399,Kiya.ai,"Worst company ever, don't join ever",2019-03-13,1.0,,"No Pros, only you get salary on time that's it.",One of the worst company ever all they have is job of support. Don't ever in your right mind join this useless company.  The team leader there gives job which can be done by 10th fail student. So if you have such pathetic work hire a unemployed 10th fail and not an engineer.
400,Kiya.ai,Automation Testing,2019-03-12,3.0,Anonymous Employee,"They have a proper follow up in their project.
They have a learning environment.
They are open to adopting any new technology.","They pay scale is low.
Work and resource management is very weak"
401,Kiya.ai,For fresher gud exposure,2019-03-06,4.0,Fresher,Lots of learning with banking domain,Don’t get stuck into single project
402,Kiya.ai,Good place to work,2019-03-05,5.0,Anonymous Employee,Friendly environment and every one will respond timely manner and good rapo with employees,I don't feel any problems in a company
403,Kiya.ai,Good Company,2019-02-20,3.0,Anonymous Employee,"Supportive Team members, good company for freshers",Lack of project execution in time due to limited resources
404,Kiya.ai,Worst company,2019-02-18,1.0,,No pros . You will loose your all self respect here . Then what's the use of earnings.,"No Project and all . Managers politics is very bad, if you go against them they make them sit to bench saying no Projects . Manager takes personal grudges .
Manager don't have the decency to talk with employees . They keep insulting you like anything .
Worst management . No Action taken of your any complaint . Management support managers politics after  knowing all their complaints .  Worst policies .
People keeps on complaining but no action taken. 
Never ever work in this firm ."
405,Kiya.ai,good for freshers,2019-02-18,3.0,Anonymous Employee,"flexibility, good guidance, good salary",no proper structure in company
406,Kiya.ai,Anonymous,2019-02-11,3.0,Anonymous Employee,Lot of new things to learn,"Lot of work pressure
No personal life"
407,Kiya.ai,Had good time on client site,2019-02-07,4.0,Senior Associate,"1) Good salary
2) Good banking clients
3) Good company to start your career",Appraisal is not good from past one year
408,Kiya.ai,"Good starting for freshers ,but limited growth for  experienced",2019-01-26,3.0,Senior Associate Consultant,1.Good compensation  for experienced in latest technologies,"1.No corporate culture
2.Prefer local language speaking people
3.Appraisal is very biased  
4.People fights internally for a small work
5.Most of the Managers won't highlight  your achievements  if you are  from another state, but will utilize you completely."
409,Kiya.ai,software manual and automation test engineer.,2019-01-25,4.0,Software QA Engineer,good company with global client,on roll job process is quite lengthy
410,Kiya.ai,overall experience,2019-01-11,3.0,Anonymous Employee,good work culture and cooperative teammates,at some places you will feel political environment
411,Kiya.ai,Worst company to work with,2019-01-08,1.0,Anonymous Employee,"- The guts to say that they are the market leader
- Telling lie with conviction 
- Know better how to trap people showing big dreams","- Worst HR practices. They threaten employees to terminate if not put paper. 
- Donkeys are being made horse but they still remain donkey
- Newly appointee e Senior Mangers are paid like anything but they are clueless about what to do
- Employees are treated like animal or worse. No work life balance. 
- There is Vision and Mission but no clear way of reaching there"
412,Kiya.ai,This company should be last option,2019-01-04,1.0,Java Developer,nothing good to say about them that is a pro,"bad pay , overworked , unethical management , long notice period"
413,Kiya.ai,Manager,2018-12-04,1.0,Assistant Company Secretary,"5 day working , still surviving somehow","Poor Corporate Governance, no knowledge of corporate  and secretarial work, worst HR practices,"
414,Kiya.ai,Good company to.work both as Fresher and Experienced,2018-11-24,4.0,Anonymous Employee,"Get Learn new technologies
Work Life Balances
Friendly Environment
Supportive Management","Poltics at the Project level

Appraisal is not on time"
415,Kiya.ai,Good For freshers,2018-10-23,3.0,Anonymous Employee,Colleges are supportive and friendly,selective Senior Mangers are having no idea that what they are doing and how they are doing
416,Kiya.ai,Good opportunity for learning,2018-10-22,4.0,Senior Associate Consultant,Depends on your capabilities how far you can go,Join the company and find out.
417,Kiya.ai,Not a blooming career,2018-10-03,3.0,Associate Consultant,"Good Package
Good compensation structure
 Nothing else to say","No Benefits 
No opportunities 
Stuck here"
418,Kiya.ai,dhdhdhhdhhdhhdd,2018-09-26,1.0,Anonymous Employee,Onsite Opportunities are offered to senior employesss,Worst Work Culture and worst management
