,company,headline,date,overall_rating,author_position,pros,cons
144,Old Mutual,Great Company !!!,2021-06-21,5.0,Financial Advisor,"Great Company, Great Culture, and Great career development opportunities",Not really any major cons just that some managers/directors get promoted based on appearances.
145,Old Mutual,Excellent,2021-06-21,3.0,Business Intelligence Developer,Good benefits as well flexibility,Little growth and recognition as well as big organization
146,Old Mutual,Big lumbering giant,2021-06-16,5.0,Investment Analyst,Comfortable as opposed to competitive/innovative culture,"Values and rewards employees 
Excellent job security/brand"
147,Old Mutual,"It has been the best challenge ever, i get to compete with my self everyday.",2021-06-16,4.0,Financial Consultant and Sales Distributor,"I learn something new almost everyday, get to make a difference in someones life but most importantly my clients leave my desk with a smile on their faces","A financial institute is a challenge on itself, having to meet your monthly targets and also deliver the best service possible to clients."
148,Old Mutual,accountant,2021-06-16,2.0,Accountant,great company culture for career growth,too much company politics within
149,Old Mutual,Too much work to do but the working environment is good,2021-06-13,4.0,Financial Advisor,Fair treatment and good working environment,"Vague salary, it’s not fair"
150,Old Mutual,Too much work to do but the working environment is good,2021-06-13,4.0,Financial Advisor,Fair treatment and good working environment,"Vague salary, it’s not fair"
151,Old Mutual,Amazing Place to work,2021-06-10,4.0,Executive Assistant to the President & Chief Executive Officer,"The company was inclusive, and the work was challenging",I have no cons about my experience at OMAM
152,Old Mutual,Insightful,2021-06-08,3.0,Claims Representative,Great work environment and facilities,Workload and no support for staff
153,Old Mutual,Finances,2021-06-02,3.0,Finances,"Flexible time , own practice","Commission payment
Stressful
Demanding
Off time is little"
154,Old Mutual,Decent pay package for senior staff,2021-05-31,2.0,Human Resources,Work life balance is a main attraction here,Best practices and attempted but so mich inflexibility does not make them employer of choice.
155,Old Mutual,Amazing place in terms of diversity and inclusion,2021-05-31,4.0,Solutions Architect,Alot to learn and unpack,Slow process of certain  management decisions
156,Old Mutual,Great culture,2021-05-31,5.0,Personal Assistant,"great culture, family oreinted
flexible working hours
great benefits",Pay may not be competitive
157,Old Mutual,Process designer,2021-05-27,4.0,Functional Analyst,"Medical aid
Pension fund
UIF 
Work from home",Compulsory pension and medical aid
158,Old Mutual,Managing ITIL disciplines with Service Delivery,2021-05-27,3.0,Head Service Delivery,Good team dynamics within teams,Still old mindset and in-equality
159,Old Mutual,Feeback,2021-05-25,3.0,Senior Accounts Administrator,Lovely company to work for,lots of opportunites to develop
160,Old Mutual,Great opportunity,2021-05-25,3.0,Investment Analyst,Good benefits offer at this place,I have nothing negative to say
161,Old Mutual,.,2021-05-19,5.0,Workforce Manager,"Flexible
Uplifting 
Remuneration 
Enabling with tools","None, all good. No Cons."
162,Old Mutual,Would not recommend,2021-05-18,2.0,Personal Financial Advisor,Get certifications as you work,Structured commission that you won't even get. Empty promises
163,Old Mutual,Great.,2021-05-17,4.0,Financial Advisor,The autonomy and flexibility of the position.,Low Basic salary and no free coffee.
164,Old Mutual,Average,2021-05-11,2.0,Financial Advisor,"Average support is provided.
Training given.","No leads given.
Too many meetings."
165,Old Mutual,Great company,2021-05-11,4.0,Financial Adviser,"Benefits are really good, onsite gym, quarterly incentives and management is really mature.",Base salary is not market related.
166,Old Mutual,Salary,2021-05-09,1.0,Customer Service Adviser,People you work with are nice,Salary is awful for the amount of stress put on you and managers are awful
167,Old Mutual,Good job,2021-05-08,4.0,Personal Assistant,Great work environment at Old Mutual,Salary too low at Old Mutual
168,Old Mutual,Great Company to work for,2021-05-06,3.0,Team Leader,work from home is a plus,Minimal growth within the inter departments
169,Old Mutual,Welfare,2021-05-06,3.0,Office Manager,Great Medical Package for staff,Set Roles - No promotion excerpt a roles open up
170,Old Mutual,Call center agent,2021-05-06,4.0,Call Center Agent,Work from home; policy training; incentive,"Sometimes the clients, brokers and financial advisors are rude"
171,Old Mutual,Admin,2021-05-03,1.0,Administration Officer,It was OK not too bad,Little pay you need to pay more
172,Old Mutual,Great place to work,2021-04-26,5.0,Corporate Finance,"Collaborative working environment, very professional co-workers, great opportunities for professional development",Head office in London is now closed
173,Old Mutual,Old Mutual Finance,2021-04-24,3.0,Branch Manager,Client interaction and working environment,"Old Mutual Finance cutting jobs, making positions redundant"
174,Old Mutual,Processing and Calling Clients,2021-04-19,4.0,Customer Service Administrator,Overtime Pay is good and often available.,Feels like you are being micromangement.
175,Old Mutual,Financial Advisor,2021-04-19,3.0,Financial Advisor,"Can generate your Own Income
in charge of your own time",You need to work on commition
176,Old Mutual,100,2021-04-17,5.0,Financial Advisor,Hiring inexperienced advisors. Training them to be the best,This company offers Great advice
177,Old Mutual,Good enough,2021-04-15,4.0,Personal Assistant,"Not too fast paced, good place to work if you’re looking for work- life balance.","Slow processes, rigid, lacking in innovation. Industry follower, never leading the pack. No remote working for all roles, hopefully COVID has changed that for good for roles that can work remotely."
178,Old Mutual,Working for in Financial Services,2021-04-14,4.0,Senior Financial Accountant(Team Lead),Lots of exposure within the company,no room for growth (career progression)
179,Old Mutual,Work and career at OMNigeria,2021-04-11,3.0,Risk Manager,Good brand to work for,Hierachical organisation. Promotion is slow
180,Old Mutual,bad,2021-04-09,1.0,Financial Advisor,nothing better in there to be honest,bad salary and they just care about their sales
181,Old Mutual,Lovely place to learn and  grow,2021-04-01,4.0,Business Program Manager,"Vast opportunities abound for anyone with a growth mindset to learn, develop and grow skills",one can easily feel stagnated given the absence of promotions
182,Old Mutual,Old Mutual,2021-03-31,4.0,Financial Advisor,Culture and environment is pleasant,Can be to meet targets created based on commission sliding scale
183,Old Mutual,Great,2021-03-29,5.0,Accountant,Lots of those there yes,None of those there yes
184,Old Mutual,Salary,2021-03-28,5.0,Office Administrator,They look after their staff,"Nothing at the moment, they are really a good company to work for"
185,Old Mutual,Salary,2021-03-26,5.0,Customer Service Representative,Awesome company to work for,Nothing I can think of
186,Old Mutual,Bureaucratic and uninspiring,2021-03-26,2.0,Head of Digital,"Security, bonus, very chilled pace of work","Apathy of the general workforce, senior management only play politics, glacier pace of work, no risk appetite, no understanding of digital at a senior level."
187,Old Mutual,Great Company,2021-03-23,4.0,Financial Advisor,They give you absolute freedom over your time. You create your own salary.,Freedom over your time as you will find that you tend to work long hours submitting applications at night after seeing clients during the day. Also the salary you create is subject to clawbacks if clients stop paying premiums.
188,Old Mutual,good,2021-03-22,5.0,Life Insurance Underwriter,Good employee working environment and balance,beaurocratic process of growth with in the orgaisation
189,Old Mutual,Diversity and professional development,2021-03-21,5.0,Risk Manager,Diversity and robust human capital developmental strategy,Huge corporate with bureaucratic structures
190,Old Mutual,Old company stuck in its ways,2021-03-20,3.0,Actuarial Analyst,Good salary and benefits mostly,"Old technology, old company structures, toxic culture"
191,Old Mutual,a,2021-03-16,3.0,Customer Representative,None there is none guys,"Over worked, under paid and left stressed"
192,Old Mutual,Financial advising,2021-03-10,1.0,Financial Advisor,"Diverse, opportunity, inclusion, growth in the industry","Limited, less benefits, no fulltime employment for financial advisors"
193,Old Mutual,Job review,2021-03-10,4.0,Risk Officer,Lots of growth oppurtunity and career advancement,Alot of work for the role
194,Old Mutual,Agile methodology work from home,2021-03-09,1.0,Consultant tax,Company assesses employees weekly to see if coping,Work life balance not existent
195,Old Mutual,great teams,2021-03-08,5.0,Senior Analyst Programmer,great people to work with,there are none at this company
196,Old Mutual,Worst company to work for,2021-03-07,1.0,Talent Specialist,I can’t think of any positive reasons to work here,"Lack of direction 
Oblivious to the fact that they need to change
Not open to challenges and advice from experts in the field"
197,Old Mutual,Old Mutual,2021-03-04,4.0,Financial Advisor,Best company to work for.,Working longer hours some to reach yoir target
198,Old Mutual,Brilliant company,2021-03-03,5.0,Business Analyst,Good working environment for IT,No real cons i can think of
199,Old Mutual,Great Company,2021-03-02,4.0,Portfolio Manager,Fast growth progression and exposure,Slow promotion into senior roles
200,Old Mutual,Great people,2021-02-25,4.0,Product Specialist,A great mix of UK and South African employees,A lot of restructuring while I was there
201,Old Mutual,Great,2021-02-24,5.0,Administrator,Management is very supportive and encouraging,"Still a full time Student, no cons on my side"
202,Old Mutual,Beware of the Employment Contract,2021-02-22,1.0,Financial Advisor,You seemingly have uncapped Income potential,You are Remunerated with a loan. How can this even be legal?
203,Old Mutual,Good opportunity for growth,2021-02-20,3.0,HRC,"Growth
Learning and development
Salary and benefits",Management culture depending on the area you work
204,Old Mutual,Being at old mutual,2021-02-18,4.0,Telesales Agent,"Big Company
Room for improvement 
Supports education",Too much company politics really slows down career
205,Old Mutual,Exciting and complex work,2021-02-15,4.0,Senior Development Engineer,Learn new cloud based tech,The politics is over bearing
206,Old Mutual,3,2021-02-15,3.0,Financial Adviser,Providing advice based on clients needs,"Prospect, cold calling, face to face selling"
207,Old Mutual,Great company to work for,2021-02-15,5.0,Office Administrator,Great organization with so much flexibility,Nothing i have noticed up to so far
208,Old Mutual,My Old Mutual Experience,2021-02-12,3.0,Customer Service Agent,You get to decide how much commission you make on top of your basic salary. There is no overtime and you work monday to friday.,"When you put in extra hours to your work, there is no compensation."
209,Old Mutual,Unbiased,2021-02-11,3.0,Executive Assistant,Training offered to some extent and compensation,Insufficient support provided to staff in terms of salary increases and promotions
210,Old Mutual,Unbiased,2021-02-11,3.0,Executive Assistant,Training offered to some extent and compensation,Insufficient support provided to staff in terms of salary increases and promotions
211,Old Mutual,Great company to work for,2021-02-11,4.0,Technical Specialist,Great exposure across the business.,Long hours and no overtime.
212,Old Mutual,Financial Adviser,2021-02-11,5.0,Personal Financial Adviser,"Good work life balance
Medical Aid
Pension",I work for purely commission
213,Old Mutual,Great Place,2021-01-29,4.0,ICT Engineer,Great environment for growth and career development,200% expectation but I feel that falls on an individual to manage themselves
214,Old Mutual,iWYZE experience,2021-01-28,4.0,Human Resources Administrator,"Recognition you get when you out performed
Advanced in technology
Working from home
Big space and clean environment
Free staff access to the clinic","Expensive Medical Aid
No Gym
Company doesn't contribute towards the Pension fund 
Managers are not equipped can't conduct interviews or performance appraisal
Retrenchment"
215,Old Mutual,Good,2021-01-27,5.0,Independent Financial Adviser,Good service at the Company,"Long hours that we work at, but it's for the best"
216,Old Mutual,Great place to work,2021-01-25,4.0,Analyst Programmer,"Good salary
Relaxed office culture
Many opportunities for further education/certification","Long hours
Not many benefits for employees"
217,Old Mutual,The green machine,2021-01-25,3.0,Chief Financial Officer (CFO),"Fast paced environment, high performance culture. Excellent learning opportunities.",Depersonalisation and values although pronounced were not lived.
218,Old Mutual,Working at Old Mutual,2021-01-22,3.0,Technical Specialist,"Communication, Benefits, Employee wellbeing, People","Bureacracy, Red tape, slow to change"
219,Old Mutual,Good,2021-01-20,3.0,Investment Associate,It was a good team at AIIM,Very administration intensive organization that was slow moving
220,Old Mutual,Old Mutual Review,2021-01-19,4.0,Marketing Manager,love their staff and take care of them,slow to innovate and usually behind
221,Old Mutual,Old Mutual,2021-01-17,3.0,Data Scientist,Great financial benefits and lovely people to work with.,"Legacy systems, they use old systems and are slow to adopt new technology."
222,Old Mutual,Good,2021-01-16,4.0,Insurance Sales Agent,I was happy working for the company,Commission had a cap to it.
223,Old Mutual,Interesting work,2021-01-15,3.0,Quantitative Analyst,Good culture and flexible working environment,Limited resources and support from senior management
224,Old Mutual,Great employer,2021-01-13,4.0,Analyst,Company has a very good culture,OM is a great company
225,Old Mutual,All-round good experience,2021-01-13,5.0,Investment Associate,High performance culture. Accountability. Family-orientated. Good work-life balance. Great recognition for work.,Bureaucratic. Slow pace of decision-making.
226,Old Mutual,Nice Place,2021-01-12,5.0,Client Relations Officer,"Awesome place to work, great culture",Growth takes too long....opportunities for growth are not well defined
227,Old Mutual,Great company to work for,2021-01-10,4.0,Internal Auditor,Vast experience for the financial service industry,None that comes to mind
228,Old Mutual,Good company,2021-01-07,3.0,Senior Commercial Advisor,Excellent company. Well established and respected brand.,Not enough support. Poor pay and perks.
229,Old Mutual,It is a nice place to be just when your responsibility increase the salary become a problem,2021-01-02,4.0,Financial Advisor,U are given a chance to learn and grow more of it builds ur inner confidence  and you learn how to face different challenges,It's only the salary and a chance to grow
230,Old Mutual,Good employer,2021-01-02,3.0,Team Leader,"Multinational corporate environment
International standards
Good benefits","Salaries less competitive
Because of size, things get bureaucratic"
231,Old Mutual,Life at old Mutual,2020-12-27,3.0,Innovation Manager,They care about their employees welfare,There is too much bureaucracy and execution is slow
232,Old Mutual,SPM,2020-12-25,3.0,Senior Portfolio Manager,"Shares and company car, petrol card","Working conditions, micro managing, salary"
233,Old Mutual,"Good, but not great",2020-12-20,3.0,Actuarial Analyst,"Work life balance
Competitive study benefits","Poor Remuneration package
Poor Company culture"
234,Old Mutual,great place to work,2020-12-19,4.0,Solutions Architect,have the freedom to innovate and do great things,very long hours because employees are few
235,Old Mutual,Good,2020-12-16,4.0,Customer Support Manager,The working hours were good.,The work environment was average.
236,Old Mutual,Great place to work,2020-12-10,4.0,Sales Support Associate,The great and forward-thinking work environment,More transparency would be nice
237,Old Mutual,Great Company,2020-12-03,5.0,Business Analyst,"Benefits I.e. Studies, pension, times",No Cons. Company is great
238,Old Mutual,Great business,2020-12-01,5.0,Group IT Security Manager,"Fantastic, diverse and open minded organisation",Sometimes a little slow moving
239,Old Mutual,Actuarial Analyst at Old Mutual,2020-11-29,3.0,Intermediate Actuarial Specialist,Culture is very diverses and welcoming,Invariable pay and take long to increase salary
240,Old Mutual,Actuarial Analyst at Old Mutual,2020-11-29,3.0,Intermediate Actuarial Specialist,Culture is very diverses and welcoming,Invariable pay and take long to increase salary
241,Old Mutual,"High hopes, disappointing experience",2020-11-26,2.0,Sales Manager,"Decent work hours
The benefits
Multinational brand","Low willpower to execute 
Poor leadership
No promotion unless a new role opens up
Archaic manual processes"
242,Old Mutual,Risk Management position is mostly report driven.,2020-11-18,3.0,Operational Risk Manager,"Good Salary, Good bonuses, flexi hours",Duplication of reports within the system; resulting in time wasting.
243,Old Mutual,Good company to work for,2020-11-16,4.0,IT Manager,"Competitive salary
Loads of new software being implemented",Focus on the young new recruits more than the existing staff
244,Old Mutual,Work experience,2020-11-09,5.0,Administrator,Many opportunities for young people,Allow people to grow and help them reach their goal
245,Old Mutual,Office culture,2020-11-06,4.0,Human Capital,I found the office culture truly amazing,"The workload at times can be overwhelming, but you get used to it. Work hard play hard"
246,Old Mutual,..,2020-11-03,5.0,Anonymous Employee,good benefits good working conditions,hard to get into management
247,Old Mutual,Who you know,2020-11-02,1.0,Senior Financial Consultant,The overload of work teaches you to become multiskilled,Over worked under paid. Work people out. It’s who you know to get a promotion
248,Old Mutual,Rampant Racism,2020-11-02,1.0,Senior Human Resources Consultant,"Good opportunity a the organisation
Salaries are comparatively good in comparison to the market","Company bases almost every decision for advancement base on the race or gender of the person. 
Company takes not steps to improve the lives of young parents."
249,Old Mutual,Best company to work for,2020-10-29,5.0,Junior Business Analyst,Best company to work for,There are no cons for me
250,Old Mutual,Great company,2020-10-28,5.0,Vice President,OM takes good care of employees.,The office environment is boring.
251,Old Mutual,Best company,2020-10-25,5.0,Senior Software Test Analyst,Great company to work for,They need more leaders than bosses
252,Old Mutual,Personal Financial Advisor,2020-10-21,4.0,Personal Financial Advisor,All relevant resources are given to you to ensure that you perform to the best of your advantage,If young meet target you don't get paid
253,Old Mutual,Clinical,2020-10-21,3.0,Finance,Opportunities for growth within the company,Poor culture and corporate hierarchy
254,Old Mutual,working at OMI,2020-10-19,2.0,Data Analyst,work-life balance is very good.,Not ready for new ideas
255,Old Mutual,good security,2020-10-16,3.0,Digital Marketing Manager,"great benefits, secure, no work stress","slow pace, general apathy, not industry leading work"
256,Old Mutual,financial planner,2020-10-15,5.0,Financial Advisor,"work at your own pace
growth",none that i can think of
257,Old Mutual,Old Mutual,2020-10-12,4.0,Executive,"Progressive, African giant, impact and ESG minded","Bureaucratic, slow moving, not best paying"
258,Old Mutual,Great company to work for,2020-10-08,4.0,Financial Advisor,"medical Aid, Pension, free life cover.","Commission, own vehicle (all costs on you)"
259,Old Mutual,Great place to work for the most part,2020-10-06,4.0,Investment Analyst,Great place to work for the most part including decent benefits and a nice campus.,Transparency in salary engagements is lacking as employees are in the dark as to how this is set. Especially when it comes to bonus calculations.
260,Old Mutual,Trainee Underwriter Salary,2020-10-01,3.0,Trainee Underwriter,"Good working environment, Co-workers very helpful","workload, a lot of information to take in at a short space of time especially whilst you on training"
261,Old Mutual,Actuarial Product Development Specialist,2020-09-21,5.0,Actuarial Specialist,Old Mutual has created an office environment that allows for wellbeing of employees while also ensuring that work is professional and of high quality,"Difficult to innovate and implement new ideas due to the size of the company, various departments involved and levels of management."
262,Old Mutual,great company,2020-09-12,5.0,Senior Manager,"good culture, good management, great team work",Brand less well known in some cases
263,Old Mutual,Ok employer,2020-09-10,3.0,Pensions Technician,Some really great social aspects,"Progression is very limited, only one promotion possible unless going into management."
264,Old Mutual,Employee Headline,2020-09-09,3.0,Financial Advisor,"Flexiblity
Meaningful advice
Unlimited income potential
Creativity
Exciting work prospects","Stressful
Continous prospecting
Regulatory requirements
Too much upfront work
Need discipline and willpower to succeed"
265,Old Mutual,None,2020-09-08,5.0,Advisor,Flexible. Good salary. Training provided. Sound financial advice. Medical aid.,Commission based. Clawbacks. Not getting paid. Working long hours. Uncertainty.
266,Old Mutual,none,2020-08-26,2.0,Sales Consultant,no reasons can be shared,No compassion for retrenched employees
267,Old Mutual,Zero work life balance,2020-08-20,1.0,Anonymous Employee,Learning opportunities and some benefits,"Zero work life balance; very stressful; you could not afford to be sick in this place or take your well deserved annual leave days because you would suffer big time afterwards. A company laptop and a phone given to employees to possess them ideally 365 days a year.
Don't be fooled by the benefit of being able to buy or sell holidays, you will barely have time to eat your lunch!"
268,Old Mutual,Amazing People and Good Remuneration,2020-08-03,4.0,Lead Analyst Programmer,The salary is really good. The people are amazing. Opportunity to work with cool tech.,Lots of politics in upper management levels. Trying to implement new projects and solutions is slow.
269,Old Mutual,Old Mutual - a large insurer with the pros and cons of a traditional large company,2020-07-17,3.0,Actuarial Associate,"* option to take lots of additional leave (up to 32 days)
* job security
* lots of areas to work in","* bureaucratic
* high pressure / understaffed
* not at the cutting edge of innovation"
270,Old Mutual,Old Mutual - a large insurer with the pros and cons of a traditional large company,2020-07-17,3.0,Actuarial Associate,"* option to take lots of additional leave (up to 32 days)
* job security
* lots of areas to work in","* bureaucratic
* high pressure / understaffed
* not at the cutting edge of innovation"
271,Old Mutual,Ok,2020-07-13,5.0,Actuary,"Flexible, good training, nice staff, multinational, launching pad","Can be boring, not easy to move up"
272,Old Mutual,Good Work life balance,2020-07-07,3.0,Analyst,Company has good working hours,The Career progression path is not great
273,Old Mutual,"no review, the part I worked for is closed",2020-07-03,1.0,Business Development Representative,"None, they made me redundant","see above, the section I worked for is closed"
274,Old Mutual,Very stressful working conditions.,2020-06-22,1.0,Clerk,They offered share benefits for employees.,"The working environment was extremely stressful. Certain departments were much worse than others, and the team leaders were he'll-bent on getting their unrealistic goals met with harsh working conditions."
275,Old Mutual,Great place to work,2020-06-21,4.0,Marketing Consultant,"Multinational
Great work life balance
Benefits
Training
Exposure to foreign markets","Slow decision making
Low gross income
Market follower
Limited opportunities for career growth
Too top heavy"
276,Old Mutual,Old Mutual Top of the log,2020-06-09,4.0,Personal Financial Advisor,"Forward thinking company, value their employees",Difficult to move out of sales
277,Old Mutual,Bad work ethic from lower management,2020-05-04,1.0,Financial Advisor,Getting good medical aid and Pension benefits,Management lures potential candidates with the hopeof good incentives
278,Old Mutual,Life underwriter,2020-05-04,5.0,Systems Administrator,Its the employer of choice,Very large organisation hence personal growth is slow.
279,Old Mutual,Good start,2020-04-29,5.0,Intern,Management genuinely care and lots of social opportunities.,Offices could do with a revamp.
280,Old Mutual,Decent,2020-04-21,3.0,Customer Service Representative,"Lots of social and recognition events. 
Friendly staff. 
Professional qualification support.",There can be favouritism.
281,Old Mutual,Old Mutual - OLD,2020-03-06,3.0,IT Senior Project Manager,"Flexible working arrangements, including leave and working hours",Autocratic management with little ability to adapt to change.
282,Old Mutual,Great Company to work for.,2020-02-24,5.0,Anonymous Employee,"Good benefits, Good people and work space",None that I can mention right away.
283,Old Mutual,Great company!,2020-01-31,5.0,Commercial Loan Consultant,"Nice benefits, good pay, great work environment",Not many I can think of
284,Old Mutual,Eh,2020-01-15,3.0,Administrative Assistant,"Free parking on weekends and after 3:30pm
24 days holiday","Low wage
No structure to pay or promotions"
