,company,headline,date,overall_rating,author_position,pros,cons
285,Old Mutual,Business Development Consultant,2020-01-13,4.0,Senior Business Consultant,Just an all round great company to work with. The convenience of supporting facilities is fantastic.,Legacy systems stagnates the rapid speed of innovation.
286,Old Mutual,Career at Old Mutual,2020-01-11,2.0,Agent Manager,Has the ability to engage best and newer technologies and be a leader in the Financial Services world.,Too much red-tape and bureaucracy. Silo mentality between divisions in the group. Company progress is heavily constrained by unrealistic and unfair BEE initiatives.
287,Old Mutual,investment,2020-01-02,3.0,Investment Banking Associate,People culture and networking is really good,there is a lot of politics and bureaucracy
288,Old Mutual,Culture and work conditions,2019-12-15,4.0,Fund Administrator,The pay is decent and the overtime is not bad. There is a strong culture of teamwork. The benefits are decent.,It's huge so you can feel like a cog in a machine. There are still a lot of manual processes which slows down the workflow.
289,Old Mutual,"Decent training, bad politics",2019-12-10,3.0,Analyst,"Small company, therefore wider remit. Decent work life balance.","Lots of politics, favouritism . Slow salary growth"
290,Old Mutual,Great place and people,2019-11-11,5.0,Chief Financial Officer,Able to grow and develop skill set,Our business unit was in run off so no future after office closed
291,Old Mutual,Financial Adviser,2019-10-19,5.0,Financial Adviser,Friendly working environment.Good teamwork. Open door policy,Monthly targets and strict deadlines
292,Old Mutual,Market Risk Manager,2019-10-09,5.0,Market Risk Manager,"Innovation. 
Good management
Good work life balance",Silo working environment. Communication not ideal.
293,Old Mutual,Management,2019-10-08,3.0,Financial Planning Advisor,Reputable company with a international presence,Poor management styles and remuneration
294,Old Mutual,Not for someone young,2019-09-23,3.0,Software Developer,Very good benefits - Medial Aid/Retirement funds,Very limited in learning potential
295,Old Mutual,Good company to work for,2019-09-17,3.0,Senior Administrator,"Opportunities
Organisations like OWN and OMAPA",Uncertainties in BU's  and slower progression.  No 13th cheque.
296,Old Mutual,Good for starting career in IT,2019-09-15,3.0,Technical Support Engineer,Very flexible working  hours  which is good,low to adopt IT Technologies
297,Old Mutual,Highly toxic work environment - political and siloed,2019-09-02,2.0,IT Manager,"Good food court,
Ample coffee shops and free coffee vending machine","Performance management process flawed
Favoritism.
Multi domain projects are not are not properly managed end to end."
298,Old Mutual,Mixed feelings,2019-08-19,3.0,Credit Controller,"It was mixed feeling to be honest, I had no job other job offers so I had to stick with them even though their salary wasn’t very good",You get breakfast from the office ( not really) but at least you can have coffee
299,Old Mutual,Good culture,2019-08-07,4.0,Customer Service Adviser,"Culture, reward, benefits package & team",Lots of change and not always delivered very well
300,Old Mutual,Ok place to work,2019-07-17,3.0,Credit Risk Officer,"Good company benefits
Stimulating work
In Cape Town","Bureaucracy and process orientated organisation
Overstaffed so cost cutting likely"
301,Old Mutual,Great Company,2019-06-18,4.0,Sales Support,Great Culture and fair treatment,Not  too Transaprent
302,Old Mutual,A great place to work,2019-05-27,4.0,Human Resources Manager,"Culture, people, practices and location","Hierarchical, not very agile, lengthy decision-making"
303,Old Mutual,Manager,2019-05-15,5.0,Anonymous Employee,Collaborative working culture. Responsive management. Excellent opportunities. Very good pay and benefits,Limited career opportunities because of size / structure
304,Old Mutual,Thoughts,2019-05-03,3.0,Anonymous Employee,Strong brand and opportunity to work in other countries due to good global presence,Rigid on policies and culture
305,Old Mutual,Work place,2019-04-24,2.0,Anonymous Employee,Place to meet new people,"Poor renumeration, no staff benefits"
306,Old Mutual,Great company,2019-03-23,5.0,Investment Administrator,"Good salary scale
Great people to work with",can take a little longer to get promoted to other position
307,Old Mutual,Research Analyst at Old Mutual Securities,2019-03-14,4.0,Research Analyst,Good work-life balance with flexi-hours available,Non-competitive salary at the lower range
308,Old Mutual,Sales Consultant,2019-03-07,2.0,Sales Consultant,the best moments is that they teach you to be money driven and you get taught how to deal with clients,employees are ill treated and employees hardly have time to spend with their families.
309,Old Mutual,Customer Service Professional,2019-02-18,3.0,Customer Service Professional,Company invests in its people through skills training. Customers come first. Proving excellent service to clients whether it is internal or external.,Too much back-stabbing amongst staff.
310,Old Mutual,Integrated financial services giant which provides huge exposure.,2019-01-19,4.0,Agriculture Underwriter,"Professional environment 
Salary always comes on time
Social facilities like gym","Median income 
Slow to market with innovation"
311,Old Mutual,Customer service,2019-01-13,3.0,Customer Service Representative,Good pay and great perks over all,Awful managent. Arbitrary decisions and no career opportunities
312,Old Mutual,Lead Risk Analyst,2018-12-28,4.0,Lead Risk Analyst,Caring company for its employees,talents can be hidden and need to be unlocked
313,Old Mutual,Financial advisor,2018-11-15,2.0,Anonymous Employee,"Flexible hours
Free coffee and tea
Medical aid
Pension fund
Working with different people","Poor commission structure
Forever changing admin structure therefore cases take forever to load"
314,Old Mutual,Pfa,2018-11-15,3.0,Financial Advisor,Flexi hours and being your own boss,"No basic. Commission only, not bad if you are a hard worker"
315,Old Mutual,"My experience at old mutual was great , old mutual has groomed me a lot in terms of being the best sales person",2018-10-20,5.0,Sales,"You manage yourself , you push yourself, and the salary and benefits are good.",Working overtime but I believe when you want to be successful you need to put more time and effort in your work and not forgetting to work smart.
316,Old Mutual,Great company to work for,2018-10-16,5.0,Anonymous Employee,"Salary, benefits, work-life balance. Altogether a great place to develop your career and get exposure to great leadership",Complex organization with many moving parts
317,Old Mutual,It is a pleasant environment to work in. They won best company to work for award.  It is a complex company to navigate.,2018-09-26,4.0,Programmer Manager,The people are very pleasant.  The work is interesting while challenging.,Decisions can sometimes take time due to complexity and many people to be consulted.
318,Old Mutual,Two worlds - legacy and digital (unfolding),2018-09-24,4.0,IT Business Specialist,"Growth , established processes , large enough organization to develop in","Salary lower than market expectations , weak hr"
319,Old Mutual,Stable Job,2018-09-06,3.0,Anonymous Employee,"- Well paid
- Friendly people
- Can have a life
- Not too challenging mentally (not necessarily a pro)","- Older generation
- Unclear growth opportunities
- Mild complacency"
320,Old Mutual,Supportive environment,2018-09-04,5.0,Anonymous Employee,"Supportive of work/life balance
Good friendly, environment",Internal politics at senior level
321,Old Mutual,Alot of opportunities,2018-08-26,4.0,Anonymous Employee,Various business units to work in and great opportunities to broaden experience in different units,Need to understand the nature of the business and the products in order to thrive in IT.
322,Old Mutual,Okay job,2018-08-15,3.0,Anonymous Employee,"Good people
Interesting work
Room for progression","Lack of support from seniors
High turnover of staff"
323,Old Mutual,Working at Old Mutual,2018-08-11,2.0,Anonymous Employee,There is a good work-life balance,One of the downsides of working at Old Mutual is bereaucracy
324,Old Mutual,Actuarial Trainee,2018-07-29,5.0,Actuarial Student,Exposure and Work life balance,The pay could be better. Mentoring could make the experience more valuable.
325,Old Mutual,Financial advisor,2018-07-23,5.0,Financial Advisor,Good benefits and healthy environment,Excellent system and enjoyable working conditions
326,Old Mutual,ACtuarial Analyst,2018-07-18,3.0,Actuarial Analyst,"Multinational, Training  and Secondment Opportunities,","The work can be too routine, Managers not as competent"
327,Old Mutual,Good place as a first job,2018-07-13,3.0,Anonymous Employee,"Flexi working hours 
work life balance depends on your boss","Too much internal politics
management takes long to make decisions"
328,Old Mutual,Pensions Analyst,2018-06-21,3.0,Pension Analyst,"Big Organization
Stable
Good learning and Experience
Great Training","Bureaucracy
Traditional
lack of Innovation
Remuneration a bit average"
329,Old Mutual,Analyst,2018-06-02,5.0,Anonymous Employee,"Study support, financial benefits, relaxed environment, help with pro development",Difficult to obtain a significant raise by staying within the same role
330,Old Mutual,sad to be leaving,2018-05-25,4.0,Anonymous Employee,"problem solving, collaborative atmosphere, fun",london head office team are leaving due to managed separation
331,Old Mutual,Old Mutual,2018-05-10,4.0,Anonymous Employee,I enjoyed working at Old Mutual,There were some downsides to working at Old Mutual
332,Old Mutual,OLD MUTUAL GHANA,2018-03-16,4.0,Premium Administrator,good bonus when the company performs well,"no allowances.
unwilling to adapt to fit Ghana's society"
333,Old Mutual,Ops,2018-03-15,5.0,Sales Operations Specialist,Amazing company  to have worked for.,Its not the company but people that affects this culture
334,Old Mutual,Great company,2018-03-12,4.0,Anonymous Employee,Wonderful benefits and a real can do culture,Management can seem out of touch at times
335,Old Mutual,Great place to work,2018-02-26,4.0,Finance,"Friendly staff, great opportunities, free fruit",More faith needed on lower level staff
336,Old Mutual,Current employment,2018-02-19,5.0,Financial Advisor,To put people in a better financial position and improve their lives.,Not always being able to help due to clients affordability
337,Old Mutual,Overall good place to work,2018-02-13,5.0,Anonymous Employee,"Good culture, busy but manageable",Information sharing is not always the best between teams
338,Old Mutual,Internship role at old mutual,2018-02-11,5.0,,Great people and company. Very enthusiastic,"The company has no cons, such a great place"
339,Old Mutual,Stable but slow,2018-02-03,3.0,Senior Human Resources Consultant,"Old Mutual provides a very stable environment, with lots of perks and growth opportunities. The overall culture is respectful and good, and by South African standards they pay reasonably well.","The business moves slowly and is very out of touch with the development of technologies in the world, so it is not the best place to go to if you work in the technology sector."
340,Old Mutual,Stable but slow,2018-02-03,3.0,Senior Human Resources Consultant,"Old Mutual provides a very stable environment, with lots of perks and growth opportunities. The overall culture is respectful and good, and by South African standards they pay reasonably well.","The business moves slowly and is very out of touch with the development of technologies in the world, so it is not the best place to go to if you work in the technology sector."
341,Old Mutual,marketing and communications consultant,2018-01-19,3.0,Anonymous Employee,Great organisation to learn from the bottom up,"Bonus structure is unfair
Flexi-time is not an option for those who are not managers
No career growth opportunities
Increases are below average for lower role sizes"
342,Old Mutual,I am currently and administrator at Old Mutual and I would like to explore other fields and learn more and explore.,2018-01-08,3.0,Office Administrator,"With a team, and in an open plan office",The office I currently work at is in the rural areas and one is not exposed to growth.
343,Old Mutual,A career at Old Mutual plc,2017-11-27,3.0,"Senior Manager, Treasury",Good pay and a great working environment,Due to a corporate restructuring any opportunities are likely to be short term
344,Old Mutual,Project manager,2017-11-06,4.0,Project Manager,Old Mutual is a top employer in Colombia they worry about the employees well being and the financial planning for customers and employees.,People in this company stays for long time so the career opportunities are not clear.
345,Old Mutual,CAREER PROGRESION,2017-10-20,1.0,Administrator,"career progression is there if you are in management 

ex poser when you are in managerial post is there( training both locally and abroad)

salaries and fringe  benefits ( i.e car loans , travels, training ) are very good in managerial positions","salaries are very low making it hard for one to upgrade studies and growth is not promising in clerical positions.

more work load give higher demands ( dress smart upgrade studies ) and the are no opportunities to support the expectations"
346,Old Mutual,Financial Planner,2017-10-18,4.0,Financial Planner,You can  develop your career as fast as you want,The resources to do your job are limited
347,Old Mutual,Old Mutual Wealth,2017-10-09,3.0,Anonymous Employee,"Strong company, poor culture not investing enough in staff",technology costs spiralling out of control
348,Old Mutual,Working at Old Mutual,2017-10-06,4.0,Communications Consultant,"Competitive salary in some areas
Good provident fund
Possibility of flexi-hours 
Great Group Life Cover",Company does not contribute to medical aid
349,Old Mutual,Could be better run,2017-09-13,3.0,Anonymous Employee,"Good environment promoting team work
Solid for actuaries",New set of leaders absolutely poor.
350,Old Mutual,What happened,2017-09-08,4.0,Anonymous Employee,Old Mutual plc was a great place to work - interesting work and great people. Fantastic to be part of a global group.,The dissolution of the company was a surprise and the initial steps were not planned well in terms of impact on staff and morale
351,Old Mutual,great company,2017-08-30,4.0,Anonymous Employee,great culture at head office,large global footprint across very different business models
352,Old Mutual,Exposure,2017-08-30,3.0,Anonymous Employee,great exposure; big company to learn anything; allows one to make a mistake; encourages further development,one is just a number
353,Old Mutual,Financial Advisor,2017-08-18,3.0,Personal Financial Planner,"Good Corporate Environment, Employee Benefits, Flexible Hours, Managerial Support","Poor Commission Structure, Too many meetings"
354,Old Mutual,financial Advisor,2017-07-19,5.0,Financial Advisor,Client face to face inter action and meeting new people on a daily basis and gaining their trust,Time spent on travelling
355,Old Mutual,Good when you need to gain experience but hard to progress,2017-06-21,3.0,Anonymous Employee,Good for younger people looking for experience in the industry,Tends to not be much chance to progress further
356,Old Mutual,Good employer,2017-06-19,4.0,,"Generous pay and benefits
Strong corporate culture
Clear goals and objectives
Commitment to training and development
Commitment to work/life balance and employee wellbeing","Group is umbrella for disparate divisions and sometimes the organisation feels fragmented.
So big can be slow to make decisions and implement change."
357,Old Mutual,FINANCIAL PLANNER,2017-06-16,5.0,Financial Planner,It´s a nice company,The salary were not that good
358,Old Mutual,"Service owner for EUC, AD, Messaging and SCCM",2017-06-05,2.0,Anonymous Employee,Nice people in my team,Very huge EE driven. This is for both internal and external candidates.
359,Old Mutual,Customer Service,2017-05-29,3.0,Customer Service Representative,"Lovely Work experience
very ethical especially with how they deal with their customers.Its a customer oriented company.",lack of growth and presence of organisational silos.
360,Old Mutual,Customer Service,2017-05-29,3.0,Customer Service Representative,"Lovely Work experience
very ethical especially with how they deal with their customers.Its a customer oriented company.",lack of growth and presence of organisational silos.
361,Old Mutual,Not a Bad Company,2017-05-23,3.0,IT Security Engineer,Had very good benefits and  management was helpful at times.,Some nepotism involved and  did not like promoting from within
362,Old Mutual,Summer intern,2017-05-19,5.0,Summer Intern,Brilliant company to work for. You feel as though you can make a difference and feel valued within your team. I felt encouraged to pursue my own goals/projects as long as it did not interfere with my work.,"Maybe some of the IT equipment could be upgraded, I was stuck with some old monitors with low resolution, which ended up straining my eyes after long periods."
363,Old Mutual,INTERNATIONAL ORGANISATION,2017-05-14,3.0,Anonymous Employee,"quite an interesting organization, excellent rewards",too big & too slow in certain countries.
364,Old Mutual,Old Mutual Corporate South Africa Review,2017-05-09,3.0,Sales Consultant,"Access to knowledgeable colleagues
Job security
Client and market brand confidence and loyalty","Employee tenure valued above employee competency and education which creates potential for bad managers put into position for dedication to company and not on earned merit
Lack of clearly defined vision
No continuity planning
Confused strategies"
365,Old Mutual,Lost its way,2017-05-04,2.0,Anonymous Employee,"Big budgets so money to spend on travel perks, entertainment and projects
Good education bursaries and development
Good work life balance","Very bureaucratic, heavy processes which waste time, decision making slow, lack of innovation
Poor leadership at the top - big egos and little diversity
Technology antiquated and poor customer service
Top management been there forever an set in their ays - dictatorial especially HR"
366,Old Mutual,My best job ever,2017-04-26,5.0,Test Manager,"Great working culture
Best in industry salary
Employees taken care of
Frequent team outings
Celebrate project successes",Absolutely none that I can think of.
367,Old Mutual,Wealth Account Manager,2017-04-26,3.0,Anonymous Employee,Social responsibility programs are amazing; internal events and functions for staff are spectacular! Teams work well together,Set in their ways and not staying with the times in terms of promotions.  Internal politics are a massive problem within South Africa
368,Old Mutual,Highly organised hard-working team,2017-03-29,5.0,Systems Administrator,Professional hard working team. Plenty of work experience different departments and systems.,None I can think of at the moment
369,Old Mutual,Good Company,2017-03-13,4.0,,"Room to increase your salary, have more flexibility than other jobs so can do it well whilst studying.",Not having a fixed salary is tough especially in current market conditions.
370,Old Mutual,Great company and team,2017-03-03,4.0,Customer Service Representative,Everyone was really friendly and supportive,From my position at the time I didn't see a huge potential to develop
371,Old Mutual,Quite a mixed bag,2017-02-27,3.0,Anonymous Employee,Fantastic organizational culture and benefits. You're guaranteed a raise every year while bonuses are paid based on company and personal performance,very slim career growth opportunities
372,Old Mutual,Investment ana,2017-02-15,3.0,Anonymous Employee,excellent working atmosphere and opportunities,Salaries not in line with responsabilities
373,Old Mutual,OM review,2017-02-13,3.0,Anonymous Employee,The Commission from sales is uncapped,Incredibly high paced and highly stressful environment
374,Old Mutual,Great Company,2017-02-05,5.0,Vice President,Generous pay and benefits for its employees.,Should place greater emphasis on making workforce as diverse as possible.
375,Old Mutual,"Great, but won't be there for long",2017-02-02,4.0,Project Manager,"Great people, interesting work available during enormous organisational change.",Strategic change means the Plc will not exist for much longer
376,Old Mutual,Great Place to work.  They care about their employees.,2016-12-23,5.0,Anonymous Employee,"Awesome company.  Great vision, even during rocky times. Excellent benefits.  They spend money on their employees. Strong salaries. Friendly environment. Great office location.","Very fast paced, but you are rewarded if you keep up.  Projects can be tough, but rewarding when complete.  OMAM only hires the best.  It's a great company, so finding cons isn't easy."
377,Old Mutual,Regional Sales Manager,2016-12-12,4.0,Regional Sales Manager,Very long in integrity and systems,Lacks a broad culture and best practices being witnessed in other corporate institutions. Still relies on goodwill of olden years.
378,Old Mutual,Financial Planner,2016-12-12,5.0,Economist,Great place to work and play the role that I had in the financial sector alive the day to day the relationship with our customers to provide support and financial advice that require,I don´t have cons in my company
379,Old Mutual,Things have changed,2016-12-01,3.0,Anonymous Employee,"Great work life balance, competitive pay and benefits, culture used to be great","Strategic decisions had impacted on staff morale, limited internal movment"
380,Old Mutual,Senior Lead Business Analysis,2016-11-03,2.0,Anonymous Employee,They help you study with bursaries and loans,"Slow to change, process heavy."
381,Old Mutual,Liaision Specialist,2016-09-22,5.0,Liaison Specialist,"First Class Company to work 
Excellent Benefits",Not always the right people doing a specific or specialised job
382,Old Mutual,Old Mutual,2016-09-08,5.0,IT Manager,"Culture, work/life Balance, pay and benefits, colleagues",Not the most exciting work
383,Old Mutual,Old Mutual Financial Adviser,2016-08-30,4.0,Anonymous Employee,"Great Training,
Good earning potential  
Best products in the market","A lot of pressure
Hard work"
384,Old Mutual,Underwriter,2016-08-21,3.0,,"Great medical benefits, 401k match and pension.",Lack of career development and advancement
385,Old Mutual,Massive Opportunities abound,2016-08-19,3.0,Anonymous Employee,Great place to work. long-term and has massive opportunities.,Legacy issues and cronyism
386,Old Mutual,Old Mutual plc,2016-08-17,4.0,Head of Group Systems,Great Culture - Nice friendly place to work,Federated business - getting Businesses to co-operate is difficult
387,Old Mutual,Nearing the end...,2016-08-02,3.0,Personal Assistant,"Great people, great location, good pay/benefits",Closing down!  Communication and treatment of remaining staff (and those that have left recently)
388,Old Mutual,"A good place to work, but a little too safe.",2016-07-29,3.0,,"Friendly, polite culture. Integrity and genuineness. Some flexible working.",Paternalistic and hierarchical. Culture can be conservative and slow to change.
389,Old Mutual,Some departments are nicer than others,2016-07-28,3.0,Anonymous Employee,"Big international organisation that offers potential opportunities to work overseas via internal transfer, good training ground, good pay once you reach senior management level",salary below industry average before reaching senior management level; promotion is very slow and difficult
390,Old Mutual,looking for permanent employment. contract expired,2016-07-25,3.0,Senior Technical Administrator/Projects,good company to work for. They look after their employees,career opportunities very limited if you stand up for yourself
391,Old Mutual,Fixed income Analyst,2016-07-13,2.0,Anonymous Employee,Provides an enabling environment for employees,It is a big corporation and an individual quickly becomes statistics
392,Old Mutual,Area Manager,2016-06-29,5.0,,"Excellent Benefits, great Remuneration for dedicated work",Complexity in that the Insurance Industry is growing rapidly due to Legislation
393,Old Mutual,Intern,2016-06-14,5.0,,The management team is fantastic and all the employees really care about your development. Great place to work.,"A little difficult to get involved with all the teams, but you do get a lot of exposure to teams other than your own."
394,Old Mutual,Some of my happiest working years,2016-06-07,4.0,Bank Reconciliation Accountant,"I felt more valued as an employee and taken care of, than I have in any of the smaller companies I worked in.",Very hard to get positions because of racial preference. I was in line to get a position but I was taken off the shortlist be HR because of colour. I wasn't even allowed an interview.
395,Old Mutual,Solid company - let down at times by staff.,2016-05-30,3.0,,"Fast-paced, dynamic environment in which there was always work available for those who wanted it.",Some of the staff didn't seem keen on focussing together as a team. Longer-term strategies may also benefit the company
396,Old Mutual,Memorable Times,2016-05-25,5.0,Client Service Representative,I enjoyed my time working in the organisation.,none come to mind right now.
397,Old Mutual,Personal assistant,2016-05-09,3.0,Personal Assistant,"The company is stable as its a member of the Old Mutual group which is a leading multinational long-term savings, protection, investment and banking group which has been operating for 171 years.
Very customer centric.","Little collaboration between departments
Mediocrity amongst staff
Poor leadership and bureaucracy
Lower reward and benefits as compared to rest of market"
