,company,headline,date,overall_rating,author_position,pros,cons
0,Brookfield Asset Management,Great place to work,2022-04-20,5.0,Anonymous Employee,"Good Growth opportunities, diverse roles and experiences",Long hours and sometimes turnover/lack of continuity
1,Brookfield Asset Management,Nice place to work,2022-04-09,4.0,Vice President,Very strong in real assets management,Not as much diverse leadership
2,Brookfield Asset Management,"Good pay, growth opportunities",2022-04-02,4.0,Business Analyst,"- good base pay, rrsp contribution, and bonus structure
- no micro management but dependent on team 
- lots of autonomy and opportunities to work with senior leaders","- office politics
- cannot work remotely"
3,Brookfield Asset Management,"Intelligent colleagues, interesting work, low sharp elbows",2022-04-01,4.0,Managing Director,"C-suite, challenging work, diversity of Board","No summer hours, lower cash comp."
4,Brookfield Asset Management,Flat structures,2022-03-31,5.0,Anonymous Employee,Good people to work with,Low pay and high stress
5,Brookfield Asset Management,underpaid,2022-03-29,3.0,Private Wealth Management Summer Analyst,Great on the institutional side. Great history and track record,Still a baby in wealth management. Underpaying sales people
6,Brookfield Asset Management,meh,2022-03-24,3.0,Senior Analyst,pay and benefits were good,culture could use some work
7,Brookfield Asset Management,"Low pay, passive aggressive",2022-03-20,1.0,Senior Vice President Finance,They used to be a big player but Blackstone has doubled in AUM over covid and trounced them.,Will have you move countries just to keep you from getting too powerful in your role. Constantly harassing and firing senior people so no one can compete with Bruce. Very low pay with incredibly long equity vesting schedule (9.5 years). Boring culture with passive aggressive communication styles. Based in the most boring part of Manhattan downtown. Open layout and 5 days in the office - so out of touch with what employees want. No diversity especially none on the investments teams.
8,Brookfield Asset Management,Beware of Brookfield,2022-03-16,1.0,Planner,They pay their employees on time.,Long hours. Unrealistic expectations. Poor communication / borderline harassment from superiors.
9,Brookfield Asset Management,good company,2022-03-13,3.0,AVP-IT,"nice people, environment overall not hectic",average to slow career growth
10,Brookfield Asset Management,Professional Company,2022-02-28,4.0,Anonymous Employee,"Extremely professional, long hours, lots expected of you, learn a lot, will give you opportunity to grow.","Very old school, need to evolve with the times. People want work life balance and flexibility."
11,Brookfield Asset Management,Rigid Return to Office Policy,2022-02-22,3.0,Associate,"A lot of smart individuals at the firm. Depending on the team, you can have a lot of autonomy over your work. Benefits are generally very good.","Brookfield shows little to no empathy for its workforce. One of the first firms back to office full time, and they see each individual as replaceable. Pay is below average. Company is turning into a toxic environment. Losing talent fast to other firms."
12,Brookfield Asset Management,Great company overall with strong progression opportunities,2022-02-03,5.0,Accountant/Financial Analyst,"Progression opportunities, global impact, good salary, bonus scheme",Strict working from office requirement
13,Brookfield Asset Management,Great place to work,2022-02-01,5.0,Director,"I loved working there. Great place, great people",growing at a rapid pace can create challenges
14,Brookfield Asset Management,BAM,2022-01-18,5.0,SVP- Investment Banking,Great leadership with analytical focus,"Large organization, not always easy to navigate"
15,Brookfield Asset Management,"Terrible culture, toxic management",2022-01-14,1.0,Anonymous Employee,Free lunches. That’s about it.,"No culture. Toxic management that will micromanage you to a point where it will destroy your mental health. You will be lucky, and of select view, if you end up reporting to someone who isn’t a bully."
16,Brookfield Asset Management,Great place to develop if you are motivated.,2022-01-13,5.0,Anonymous Employee,Great place to develop if you are motivated.,sometimes working hours can be long
17,Brookfield Asset Management,A nightmare.,2022-01-11,1.0,Executive Assistant,The view is pretty. Theres a food court downstairs.,"Brookfield uses an ARCHAIC hierarchy system when it comes to their employees. Those in administration and office team receive the worst treatment - being forced to come to office during rampant numbers and offered WAY below market compensation. After losing family to covid I received zero compassion, being forced in office 5x a week, received no time off, no mental health check ups or anything of the sort. The management for administration is authoritative and keeps people stuck there with no room for growth until 3 years after initially hired. An absolute nightmare to work there. Anyone interested in administration: do NOT work there. Brookfield is a capitalist machine that does nothing for their employees, has zero diversity, and everyone is a worker robot."
18,Brookfield Asset Management,Good exposure but unnecessarily long hours,2022-01-10,3.0,Analyst,Opportunity to work on unique opportunities and learn from some of the best minds in this industry,"You have to be proactive in developing yourself, lack of formal training or education.
Culture of long hours, leaving on time with work complete does affect bonus."
19,Brookfield Asset Management,Good people,2022-01-01,5.0,Analyst,"Good working environment, good team atmosphere",No bonues for entry-level analyst
20,Brookfield Asset Management,Great company,2021-12-27,5.0,Investor Relations Associate,Brookfield is a great place with an unparalleled culture and a lot of room for growth.,None to note this company.
21,Brookfield Asset Management,Not for everyone,2021-12-26,1.0,Manager,"Central location, resources easily accessible",People were forced into the office during Covid
22,Brookfield Asset Management,NA,2021-12-15,3.0,Finance Manager,"Good salary, good bonus, good office, good parties, growing company","Long working hours, no work life balance, no trainings,"
23,Brookfield Asset Management,Great company,2021-11-26,5.0,Anonymous Employee,Interesting challenges and excellent coworkers. Strong culture.,Often stressful. Tolerates difficult people.
24,Brookfield Asset Management,Good company to work for,2021-11-16,4.0,Corporate Accountant,"Very structured line of reporting and huge company, plenty of learning opportunities with secondment and transfers to assets",Can be long hours during quarter end
25,Brookfield Asset Management,Good Pople/Knowledge,2021-10-28,4.0,Anonymous Employee,"Smart People
Lots to learn
Good work life balance",Pay could be better for employees
26,Brookfield Asset Management,"This is a career, not a job",2021-10-18,5.0,Manager,"It is great experience to be working with the best of the best! Everyone at Brookfield is extremely hard working, passionate for what they do, and believes in succeeding together.","We are never going to be a 9-5 shop or be WFH majority of the week. Working at Brookfield, I don't see this as a negative. If you are someone who is really career focused and wants to learn, this is the place for you! This is not the environment for everyone. You are either hardworking or not."
27,Brookfield Asset Management,Great place to work and learn,2021-10-16,4.0,Operations Manager,Large corporate environment where you can meet great people,The approval process is very robust
28,Brookfield Asset Management,Engineer Review,2021-10-06,4.0,Software Engineer,Dedicated infrastructure to supporting needs.,Distributed departments could hinder communication.
29,Brookfield Asset Management,Not everyone’s cup of tea,2021-09-29,3.0,Senior Financial Analyst,"I worked out of the Toronto office

- You get to work with a smart and hardworking team
- If you really put in the work, you can climb the corporate ladder very quickly
- The target bonus is higher than most companies
- You get fed, lunch is provided and during the busy periods, dinner as well.","- This is not a workplace for you if you have other commitments in your life, whether it is kids, a significant other, friends, or after-work activities. You will be working 13+ hour days Mon-Thu for about six months out of the year. Everyone on my floor seemed to be young with no kids, which is why this culture works.
- There is no flexibility, you are expected to work from the office 100% of the time. If you aren’t there, you basically aren’t working at all!
- You are required to dress formally everyday, and on Fridays, men are allowed to take their tie off
- For some teams, it is not the norm to take breaks. My manager never left their desk, they brought lunch back to their desk, never took a single break, and worked past midnight everyday 
- Socials were always held at a bar for drinks, and never really anything else"
30,Brookfield Asset Management,Nice company - lots of attrition,2021-09-24,3.0,Anonymous Employee,"Everyone you work with is very smart, easy to work with, and the tone (at least in my role) was always polite and respectful. Very good promotions from within.","The company requires everyone to work out of the office, 100% of the time (and brought people back to the office multiple times during the pandemic).

Since it's an employee's market, many colleagues left for better opportunities (with remote work option) and many more are trying to do the same.

The skill level on various teams is going to go down which is a real shame."
31,Brookfield Asset Management,Great Company,2021-09-24,5.0,Intern,Lots of work and long hours but the perfect place to start a career in AM,Longer hours and a bit of corporate politics but nothing more than the usual
32,Brookfield Asset Management,Working cultural,2021-09-24,5.0,Project,Good working culture for friendly environment,Nothing to say .. overall good
33,Brookfield Asset Management,Great place to work,2021-09-15,4.0,IAM Analyst,"Excellent management support, Benefits are good. Walking distance from Union station.",Super busy environment. Need to be on your feet.
34,Brookfield Asset Management,Great company and culture,2021-09-14,5.0,Anonymous Employee,Flat organization in which management cares about the well being of its employees,Not very flexible in terms of working remote vs being in the office
35,Brookfield Asset Management,Senior accountant,2021-09-06,5.0,Senior Accountant,Positive environment and culture with diversity,Lots of turnover and internal shifts throughout my time.
36,Brookfield Asset Management,Needs a cultural change,2021-09-06,2.0,Anonymous Employee,"- Due to the size of the Company, you will get to work on interesting deals and get exposure to many different parts of real estate
- There are some good people here that make the day to day better","- Below market pay, which employees are starting to catch on to
- Really showed their color during covid. Employees had to come into the office everyday with no flexibility and little safety protocols in place
- Long work hours and structured now where everyone feels like a cog as opposed to an individual. People are quitting and HR shrugs it off as if everyone is replaceable. 
- Overall, bad culture. People are overworked, with poor management, and below market pay."
37,Brookfield Asset Management,Good people,2021-08-24,5.0,Executive Assistant,"Great benefits, no drama, nice people",Don’t really have any to give
38,Brookfield Asset Management,Great company,2021-08-19,5.0,Assistant,Collaborative and inclusive. Big company with room for growth. Beautiful office. Great staff and perks.,Location. Deep downtown Manhattan. No many cons. Great corporate job with great benefits and growth potential.
39,Brookfield Asset Management,Great company to work,2021-07-27,5.0,Asset Manager,"Great culture, nice senior team, helps with career, like working here to be in industry and have success in industry in US","Hard work but it’s worth it. Word word word word word word. word word word

Word is word then good going on words used."
40,Brookfield Asset Management,Great company,2021-07-26,5.0,"Assistant Vice President, Marketing","Smart people, excellent pay. Constantly growing which is an opportunity for employees to take
On more responsibility","Can be bureaucratic at times. since it expanded in such a short time and there are so many new people/roles, there can be a lot of hoops to jump through"
41,Brookfield Asset Management,MNC,2021-07-21,5.0,Anonymous Employee,"Growth and opportunities
Highly motivated teams",Requires high degree of adaption
42,Brookfield Asset Management,Asset management company with investment banking culture,2021-07-13,1.0,Anonymous Employee,"- Nice office and amenities
- Good stepping stone for other opportunities if you can stick it out","- Toxic workplace environtment with intimidation culture, bullying and obvious gender bias. Senior management and their 2IC's are clearly protected as their bad behaviour is swept under the carpet. 
- No work life balance, difficult to make plans after work as you never know when you will be able to finish work.
- No flexibility with working from home which was really shown during the pandemic where you were still expected to come into the office despite the city having multiple COVID expososure sites. 
- Not a personable experience, you are just another number working for a big machine. 
- High staff turnover. 
- Processes are not documented and there are no real IT systems in place (most work done in excel, word & powerpoint)."
43,Brookfield Asset Management,Management,2021-07-11,3.0,Anonymous Employee,"Good location, easy to commute, nice office","poor management, micro-management, not easy to get along with"
44,Brookfield Asset Management,Great people to work with but unsustainable business model due to toxic culture from above,2021-07-08,1.0,Anonymous Employee,"Smart people, interesting work and looks good on a resume.  If you get in, plan an exit strategy as well.","Opaque leadership, employees are generally treated poorly except for a select few, zero consistency across business units, let alone specific teams.  During COVID true colors really showed of how little executive management cares for its people.  IT is an absolute joke and so many people are beaten down that they just don’t care anymore."
45,Brookfield Asset Management,analyst,2021-07-02,3.0,Process Analyst,the company has a good work-life balance,The company does not value the employees
46,Brookfield Asset Management,Great company with good knowledge to learn,2021-06-23,5.0,Senior DevOps Engineer,Can do Later because this is good company.,Can inform this later on call
47,Brookfield Asset Management,Bam,2021-06-22,4.0,Chief Financial Officer (CFO),Remuneration is very aggressively worked,Challenges. Low level of internal opportunities.
48,Brookfield Asset Management,Great Company,2021-06-21,5.0,Vice President,"Autonomy, challenging, great place to work",Decentralized but not in a bad way
49,Brookfield Asset Management,Great place to work,2021-06-18,5.0,Anonymous Employee,Flat organizational structure allowing junior employees wide range of experiences that similar peers at other firms do not get,Pay not quite as much as competitors
50,Brookfield Asset Management,You would do well to stay away from this place,2021-06-16,1.0,Anonymous Employee,Honestly can think of any.,"Old boys club, and you do not advance unless you are of a certain hue or you're a favorite of someone."
51,Brookfield Asset Management,Good Team,2021-06-14,4.0,Accountant,Good benefits and nice place to work,progression is limited dependant on team
52,Brookfield Asset Management,n/a,2021-06-10,2.0,Accoutnant,good place if you are in the right dept.,some departments arent too great
53,Brookfield Asset Management,Great company,2021-06-09,5.0,Office Coordinator,Collaborative environment. Surrounded by the best,None that I have seen
54,Brookfield Asset Management,Looks good on resume,2021-06-02,3.0,Executive Assistant,"Overall smart and nice colleagues, nice location, beautiful office, great reputation, opportunities to grow, great place to gain experience, solid benefits and vacation, good professional development and volunteer opportunities","Low compensation based on market, no bonuses, admins overworked and under appreciated, stuffy culture, upper management doesn’t care about employees, bureaucratic, old white boys club, lacking in diversity, no transparency"
55,Brookfield Asset Management,General,2021-06-02,2.0,Accountant,"Employee social event
Central location
Easy to commute","Politics
Work load
No Work life balance"
56,Brookfield Asset Management,Modern Slavery,2021-05-31,1.0,Financial Analyst,Above Market Pay (Still not worth it),"-Long Work hours
-Overtime without pay
-Senior management ONLY cares about returns and see employees as objects"
57,Brookfield Asset Management,none,2021-05-28,1.0,Anonymous Employee,"benefits, location, office, benefits, location, office,","toxic people, double standards, no remote working,"
58,Brookfield Asset Management,"Fast paced, high growth organization",2021-05-27,5.0,Manager,"Dynamic, merit-based, fast paced, high growth organization offering a lot of development opportunity","Organization is full of highly motivated, driven individuals making development based on merit challenging."
59,Brookfield Asset Management,.,2021-05-17,5.0,Asset Manager,learned a lot amazing job,limited growth bad job ha
60,Brookfield Asset Management,Toxic place to work in. Avoid at all cost,2021-05-06,1.0,Former Employee,Free snacks and opportunities to learn fast,"- Toxic environment
- Extreme hour so direct managers can benefit from all the hard work
- No team sense at all
- Outdated systems and a culture that tries to make thing as much ineffecient as possible
- Zero work life balance. Expect to be working super long hours and during your holidays.
- Senior management only care about their career plan therefore ignoring anyone below
- Very cut throat approach
- During Covid they were the first to bring people back to the office cause first they don't care about their employees well-being and second they think they do a critical job
- Expect to have zero training and guidance but be expected to know everything from day one
- Almost zero diversity. Very white male environment

Overall a very toxic and awful place to work in. There are better places to go for with higher salaries"
61,Brookfield Asset Management,Senior Manager,2021-05-06,4.0,Senior Manager,"Growth Opportunities, Streamline teams, Access to leadership and strategy","Old school management team, lack of diversity on leadership and BoD"
62,Brookfield Asset Management,Now is not the time. Wait until 2025,2021-04-29,3.0,Anonymous Employee,"Great locations, good pay, a large portion of the employees are great to work with","The next 4 years will be a bad place to work as the company shifts again to outsourcing. It should be a good place again in 5 years (2026) 
With COVID, Sr management team is forcing everyone back to the office. 
A small portion of the management team are terrible people.
Most higher positions are reserved for unqualified consultant type people who will fire qualified and seasoned employees if they dare to speak up. 
If you speak your mind, you will not last"
63,Brookfield Asset Management,--,2021-04-28,5.0,Business Analyst,great to work good environment,should have option of working from home
64,Brookfield Asset Management,Great company,2021-04-28,5.0,Senior Analyst,Overall smart team and good opportunities,There are no cons to working here
65,Brookfield Asset Management,Good,2021-04-27,3.0,Investor Reporting Analyst,"Good culture, good people, growing","Prefer Canadians, not best on comp; penny wise pound foolish"
66,Brookfield Asset Management,Great global corporation,2021-04-26,4.0,Assistant Vice President,"Global reach, very good pay.",some management executives do not have real leadership
67,Brookfield Asset Management,Decent,2021-04-19,4.0,Anonymous Employee,"Flat culture, smart people, collaborative",My boss was not very helpful
68,Brookfield Asset Management,Good,2021-04-16,4.0,Manager,Room for growth in the company,Long hours; Lack of flexibility
69,Brookfield Asset Management,Great and Growing Company in AU,2021-04-11,4.0,Senior Financial Accountant,Many opportunities to learn and get involved in different projects.,Too many office politics and sometimes the valuable persons are not seen.
70,Brookfield Asset Management,Review,2021-03-16,5.0,Senior Analyst,"Amazing management 
Collaborative team environment 
Lots of opportunities 
Great benefits",No downsides at the company
71,Brookfield Asset Management,"Good Pay, Lots of Work",2021-03-11,3.0,Business Analyst,"Good Pay, friendly team, lots of opportunities to grow","lots of work, corporate politics"
72,Brookfield Asset Management,Good place,2021-03-10,4.0,I T Manager,"Salary, bonus, technology, location, many companies in portfolio",Hours can be quite long and time zones for support is global
73,Brookfield Asset Management,Good style,2021-03-02,5.0,Senior Vice President Finance,Good style and good people,Good approach and good values
74,Brookfield Asset Management,Great company,2021-02-28,4.0,Exectuve Assistant,Great location. Great people to work with,None at all highly recommend
75,Brookfield Asset Management,Great,2021-02-24,4.0,Coordinator,"Culture, benefits, progressive work environment",Silo's and chain of command
76,Brookfield Asset Management,Brookfield,2021-02-24,3.0,Manager,"Pay, culture, nice office space","Management structure, a lot of work"
77,Brookfield Asset Management,Well Known Company and Great Place to Start Career,2021-02-23,4.0,Investment Analyst,"Respected company within RE, good exit opps, great experience for early career",Very unpredictable environment and work flow
78,Brookfield Asset Management,Decent Place to Work Run very lean,2021-02-23,3.0,Associate,"Decent Pay, Interesting work, Good people","long hours, teams run lean, burn out happens, wish we had a better way of appreciating employees, Felt a bit unsafe during covid"
79,Brookfield Asset Management,n/a,2021-02-23,3.0,Manager,Work with smart and hardworking team,Long hours and very little work life balance
80,Brookfield Asset Management,No title,2021-02-20,3.0,Chief Financial Officer (CFO),Your questionnaire is too intrusive,"If you want real data, you should not be asking for the name of the firm. Perhaps group the companies into buckets"
81,Brookfield Asset Management,Baseline Job,2021-02-10,3.0,Finance Manager,"Good Pay, Challenging environment with room to grow, snacks and dinners included.","Not a lot of work-life balance, long hours, office is open and pressure to stay and continue working."
82,Brookfield Asset Management,They are good and very efficient,2021-02-04,4.0,Customer Service Manager,It is a good place to start a career,Sometimes employees should be give some free time
83,Brookfield Asset Management,Nothing but good things,2021-02-03,5.0,Financial Administrative Assistant,"Very friendly working culture
Willing to answer any questions
Looking after the safety of employees first during Covid",I'm only part time and have been waiting to move full time for a few months
84,Brookfield Asset Management,Can be better,2021-02-03,3.0,N/A,Room to grow and professional environment. Good benefits.,Highly bureaucratic environment and no culture. All work no play. Some staff in senior management are arrogant.
85,Brookfield Asset Management,"Great Work, Long hours",2021-02-02,5.0,Accounting,Provide you with a lot of work,Month end is long hours
86,Brookfield Asset Management,Okay place,2021-02-02,3.0,Senior Associate,"* good pay
* good benefits","* long hours
* not flexible"
87,Brookfield Asset Management,Terrible Culture,2021-02-01,1.0,Vice President,Nice office and some free snacks,Toxic culture; managers who don't know how to manage people; weak HR department that doesn't have employees' back; long hours; requirement to come to office during COVID despite weekly COVID cases; women are not encouraged to speak up especially around senior management.
88,Brookfield Asset Management,Would not recommend,2021-01-30,1.0,Associate,- Exposure to senior staff,"- Horrible culture and hours, turnover is very high because of this
- Hierarchy is everything 
- HR function is useless"
89,Brookfield Asset Management,"Good work, little valance",2021-01-26,3.0,Senior Analyst,"- interesting work
- challenging 
- smart people","- Very little work-life balance
- little company culture"
90,Brookfield Asset Management,Nice but complicated,2021-01-20,5.0,Anonymous Employee,"Friendly people
Growing with lots of paths for career growth",Complicated structure and related incentives
91,Brookfield Asset Management,"Interesting work, respectful culture",2021-01-12,4.0,PMO Manager,"Diverse workforce, interesting business domain, great teams",Can be a bit hard to understand strategic targets
92,Brookfield Asset Management,Great Company,2021-01-05,5.0,Vice President,Culture built on ultimate meritocracy,Technology can be significantly improved
93,Brookfield Asset Management,Solid Company,2021-01-04,3.0,Acquisitions,The NY headquarters is a great place to work. Close group of people,Management is lost. Purchased by Brookfield
94,Brookfield Asset Management,SVP,2020-12-17,5.0,Senior Vice President Business Development,Teamwork is really good and people like the company,Hierarchy is getting higher as people increase
95,Brookfield Asset Management,Very good place to work,2020-12-03,5.0,Specialist,Great work culture and amazing management,There arent many cons to list out for discussion
