,company,headline,date,overall_rating,author_position,pros,cons
96,Brookfield Asset Management,"Great culture, growing organisation",2020-11-27,5.0,Senior Associate,"Great culture, growing organisation, good perks",Really hard to think of any
97,Brookfield Asset Management,Poor culture,2020-11-26,2.0,Legal Associate,Good salary and benefits package,Lack of direction and support from senior members of staff
98,Brookfield Asset Management,"Good for learning if they like you, terrible for being happy and for expecting some balance",2020-11-23,3.0,SFA Senior Financial Analyst,Smart folks to work with,"Passive aggressive environment, tone from the top is not conducive to healthy working environment for folks who wants some balance in their personal lives.

Communication structure is horrible. Reminds me of how companies used to operate in the 80s / 90s with authoritarian culture with little regard for personal sensitivities"
99,Brookfield Asset Management,Excellent environment for growth and learning.,2020-11-13,5.0,Director,"Surrounded by brilliant people who will push you to be at your best. Great environment for learning, and growth.",Challenging (although for many that can be a good thing)
100,Brookfield Asset Management,An organization of old school thinking,2020-11-12,2.0,Executive Assistant,"There were a few perks such as a convenient location. My direct manager and team were fantastic, but the cons outweigh the pros.","During COVID, they demand that everyone is in office. They won't allow working from home at all - Its so brutal. This is the straw that broke the camel's back for me. Brookfield needs a fresh start with leadership at the top. Its an old (white) boys club, with a select few women at the helm who are generally just not good people and make me and most people cringe. Brookfield couldn't careless about us little minions.

Brookfield is in no way, shape or form an essential service. Benefits are weak, Vacation is weak. Employee perks are non-existent. Compensation is weak...so I left. Get with 'the times' to retain the best people."
101,Brookfield Asset Management,Detailed oriented concierge providing luxury service on a day to day basis.,2020-11-06,5.0,Hotel Coordinator,"Able to challenge my ability to tackle any challenge, constant training and updates, interaction with people from all around the world","Long hours, fast passed work setting so that demands you to utilize your multitasking and time management skills"
102,Brookfield Asset Management,Good,2020-11-04,4.0,SFA Senior Financial Analyst,lots to learn and room for growth,competitive and very formal environment with long hours
103,Brookfield Asset Management,Strong work culture,2020-10-26,5.0,Anonymous Employee,"Amazing exposure, great work culture, global practice",Limited structures on career progression
104,Brookfield Asset Management,It's a toxic sweatshop! Every negative thing you've heard about Brookfield is true!,2020-10-15,1.0,Finance,The company has been very successful.,"Leadership couldn't care less about the employees so long as they make money! The culture is toxic and degrading. Managers don't provide recognition for work well done, just more work and very long hours. Burnout and stress leave are common. HR is the worst - they don't represent the employees, they only focus on pleasing their bosses. Leaders pay lip service to Diversity but the reality is that the company is run mostly by rich white men and a handful of white women who enable them! STAY AWAY!"
105,Brookfield Asset Management,Great company with a few challanges,2020-10-13,4.0,Business Analyst,"Global opportunity, growth potential for staff",Challenges with technology in the organisation
106,Brookfield Asset Management,There are better companies to work for,2020-10-09,1.0,Finance Department,"Great staff perks such as  free snacks and drinks.
Office is very modern and bright (Canary Wharf) with great views.","My team had a high staff turn over mainly due to the bullying culture and toxic management style and a general lack of organisation.

HR here are very poor at dealing dealing with the very obvious. If there is a team with a constant constant changing staff then you'd expect that to ring alarm bells. They just turn a blind eye. 

Very old fashioned such as formal dress and dress dowm meaning don't wear a tie. It's like they can't accept its 2020 and not 1920 anymore. 

Very long hours expected, almost felt as if I shouldn't make after work plans because if I said I needed to leave time I would get a funny look. You shouldn't be made to feel bad for leaving work on time."
107,Brookfield Asset Management,Yes,2020-09-25,5.0,Senior Accountant,Work life balance is great,Formal attire Is the dress code
108,Brookfield Asset Management,Brookfield,2020-09-23,4.0,Investment Analyst,Very capable employees. Opportunities for quick career growth.,Not always a team environment.
109,Brookfield Asset Management,Excellent Place to work,2020-09-15,5.0,Business Analyst,"Great hours, perks, teams and helpful people","Low pay, very formal, low sick days"
110,Brookfield Asset Management,Excellent Company to work for,2020-09-15,5.0,Anonymous Employee,"Great Hours,Great people, Great Location",Pay less as per industry standards
111,Brookfield Asset Management,Great place to work,2020-08-19,5.0,Accountant,"Good work environment, beautiful office, nice coworkers",None. The culture is amazing.
112,Brookfield Asset Management,No culture,2020-05-12,3.0,Anonymous Employee,"Big firm, room to grow","Long hours, no culture, no flexibility"
113,Brookfield Asset Management,Great,2020-05-04,5.0,Associate,"Work environment, Opp for advancement, Learning","Comp, Bonus structure, occasional long hours"
114,Brookfield Asset Management,Toxic environment,2020-02-20,1.0,Executive Assistant,Good pay and benefits package,Toxic environment and horrible work culture
115,Brookfield Asset Management,"Under the Radar, Hidden Gem of Asset Management",2020-02-01,5.0,Analyst,"Culture is incredible. Everyone is smart, cares about their job and the firm, works hard, is professional, and KIND. You definitely pick up on the strong Canadian influence in the culture.","Benefits package is fairly basic, nothing extraordinary to write home about. And their parental leave policy is not fair across the board regionally--a little disappointing considering they're a Canadian firm, you would hope they extend the same policy to their US employees."
116,Brookfield Asset Management,Great place to work,2020-01-31,5.0,Coordinator,The people are very friendly and there is a good energy in the office.,Long hours but that is too be expected
117,Brookfield Asset Management,Good smart people,2020-01-29,3.0,Senior Trader,Some very smart friendly coworkers,Foreign owned.  Certain businesses lines don’t communicate well with each other
118,Brookfield Asset Management,"Great company, great people",2020-01-17,5.0,Senior Software Developer,"People, culture, collaborative, perks, office location",You'll never want to leave
119,Brookfield Asset Management,"Civil, but centralized",2020-01-17,4.0,Agency Support,civil culture with likable coworkers,centralized and opaque decision making process
120,Brookfield Asset Management,Great company to work for,2020-01-15,5.0,Controller,Work environment and great people,Long hours And long commute
121,Brookfield Asset Management,You are lucky to work here!,2020-01-13,5.0,Analyst,"Amazing Company, perfect corporate feel","cant think of anything, maybe too large"
122,Brookfield Asset Management,"Great perks, smart people, but longer hours",2020-01-01,4.0,Senior Financial Analyst,"Everything was great, very career driven people, teams are tight-knit, rewarding","Long hours, very demanding timelines, the usual accounting issues for a publicly-traded entity."
123,Brookfield Asset Management,Great Company That Values Its People,2019-12-13,5.0,Vice President,"Unmatched Capabilities,  Humble Culture Talented People",So many Talented People that you feel not so talented
124,Brookfield Asset Management,Great Place to work,2019-12-03,5.0,Analyst,"Great learning environment, very entrepreneurial.",None stand out to me.
125,Brookfield Asset Management,Fun place to work hard,2019-11-16,5.0,Director,"Real estate group is fantastic. Tons of very smart, motivated people who are great to work with. Good mix of interesting US and non-US deals going on. Hours vary, but are not unreasonable. Location is pretty. Free snacks.",Not all the senior managers are the greatest at managing people/advocating for their team. Make sure you have a good sense of this before you jump on board. Brewed coffee could be used to strip paint and should be avoided at all costs.
126,Brookfield Asset Management,"Great company, terrible culture",2019-11-15,2.0,"Manager, Finance","Pay/bonus is great
Everyone is sharp and the company has done very well","Had a micro manager as a manager for 2 years. 
You're expected to work ridiculously long hours even though multiple requests were made for resources. Most people work 11-13 hour days
Terrible culture"
127,Brookfield Asset Management,SA,2019-10-24,4.0,Senior Financial Analyst,"good, great, not bad, awesome","not good, not easy, hard, very hard"
128,Brookfield Asset Management,"Great People/Culture, Long Hours",2019-10-15,4.0,Senior Accountant,The culture is great and you learn a lot very quickly,Learn a lot very quickly = long hours worked
129,Brookfield Asset Management,"Great place, great culture and drive",2019-09-30,5.0,Analyst,"culture is great
philosophy of investing
prestige is huge","hours can be long, but if you like the job you're fine"
130,Brookfield Asset Management,very good benefits and healthy enviornment,2019-09-26,4.0,Senior Consultant,very good benefits and healthy enviornment,long hours on quarter end
131,Brookfield Asset Management,Awesome company with great people,2019-09-23,5.0,Data Analyst,"- Good environment with great talented people all around
- Lots of internal development and expansion going on, so good opportunities
- Your work is valued and appreciated","- May require some very long work hours (9-night) at quarters
- Pay isn't that high for junior positions"
132,Brookfield Asset Management,Bureaucratic nightmare,2019-09-22,1.0,Decline to State,They are very large so it gives them competitive leverage.,Everything takes forever and legacy employees are super bureaucratic and the new ones that join either learn to mimic that behavior or leave quickly.
133,Brookfield Asset Management,Senior vice president,2019-09-11,5.0,Senior Vice President,Great and challenging work environment,Long hours  and hectic schdule
134,Brookfield Asset Management,Good,2019-09-03,4.0,Operating Engineer,"Overtime, overtime, overtime, overtime, overtime",You can find cons in anything
135,Brookfield Asset Management,"Although It is MNC Company, But Management Personnel in India are having Attitude more than a Lala Company",2019-09-01,1.0,Anonymous Employee,Work life balance is the only Pros,"Typical Lala Environment..
They do have HR, but things driven from One Person
They call candidate despite seen there expectation
Even they can offer 10 LPA to a person who is on 12 LPA package"
136,Brookfield Asset Management,HORRIBLE ENVIRONMENT & MANAGEMENT - STAY AWAYYY !!!!!,2019-08-08,1.0,Analyst,"- Good Pay 
- Good Benefits","- Toxic environment with politics 
- Management monitors your washroom breaks 
- They expect you to work overtime without additional pay 
- Management looks down on their team and treats them like trash who are worth nothing !
- The culture is horrible 
- They do not care about their employees !"
137,Brookfield Asset Management,A worthwhile venture,2019-08-07,3.0,Coordinator,Great opportunity to meet others and stretch your ability to empathize and resolve concerns.,Staffing could be better managed and workloads managed more appropriately.
138,Brookfield Asset Management,Great Company,2019-07-30,5.0,Audit Director,"Supportive, empowering and huge. So you can move around, do various different roles without leaving.","None, its really a great company to work for."
139,Brookfield Asset Management,Chief Security Officer,2019-07-09,5.0,Anonymous Employee,"Well compensated. Terrific internal opportunities. 
Amazing culture.","Long hours, downtown commute"
140,Brookfield Asset Management,Very Busy,2019-06-01,3.0,Executive Assistant,Room to move up in company,"Long hours, intense work load"
141,Brookfield Asset Management,Challenging work but poor culture,2019-05-29,3.0,Finance,"The work is challenging, with new problems needing to be tackled each day. You will learn a lot here by being a part of complex problems in the asset management space.","The culture was toxic, with a poor tone at the top that permeated throughout the ranks. It's a 1980s mentality to managing people that works for some, but not for all."
142,Brookfield Asset Management,Not so bad,2019-05-03,5.0,Benefits Coordinator,"Lots of opportunity if you're a hard worker
People care about you, even if it's to save face
Above market rate salaries
Very competitive benefits package
Lots of opportunity to meet with and work with others within the organizations","Too many hands in the pot
Too much turnover
Not everyone is on top of their work
People pretend to know what they're doing"
143,Brookfield Asset Management,lots to keep you busy,2019-04-10,4.0,Anonymous Employee,a lot diverse and interesting projects due to the size of the company,if you work in outside of headquarters you are not likely to get noticed
144,Brookfield Asset Management,very demanding and not very flexible,2019-02-22,3.0,Corporate Accountant,working with persons all over the world,very steep learning curve at Brookfield
145,Brookfield Asset Management,Amazing company!,2019-02-07,5.0,Managing Director,"Great people
Competitive but fair
Strong culture
Good compensation",No real complaints as of yet
146,Brookfield Asset Management,Great company,2019-01-05,5.0,,Great environment and supportive team,Can't think of any. It's great
147,Brookfield Asset Management,Very toxic environment,2018-11-21,1.0,Anonymous Employee,They pay well if you do not calculate your hourly rate.,"Cultural is very toxic, long hours, unprofessional interaction on a regular basis.   Outright bullying in many cases. Expected to be available 24/7.  Heaven forbid if you take a vacation!!!"
148,Brookfield Asset Management,BAM,2018-10-18,2.0,Anonymous Employee,Great Benefits. CEO Super down to Earth,"Everyone has anxiety, small mistakes can get you fired, the way lower level employees are treated is disappointing."
149,Brookfield Asset Management,Good company,2018-10-14,4.0,SAP Basis Administrator,Good company to work at all,nothing bad to say about this company
150,Brookfield Asset Management,Brookfield,2018-10-11,4.0,Analyst,"Great experience, good pay, a well-respected company","Long hours, little appreciation"
151,Brookfield Asset Management,Procurement,2018-09-26,3.0,Anonymous Employee,"downtown Toronto, great location, benefit is good","poor management, poor leadership skills, no motivation always negative thoughts. micromanage"
152,Brookfield Asset Management,"Big company, big problems",2018-09-17,1.0,Anonymous Employee,"salary, location (if close to you), opportunities (if management likes you)","back staving, terrible culture, you are just a number with hundreds of number waiting to get through the revolving door"
153,Brookfield Asset Management,Ridiculous hours and political setting,2018-09-14,2.0,Anonymous Employee,"You meet decent  folks
Open office concept","Extremely political
Cut throat management
No work life balance"
154,Brookfield Asset Management,Analyst,2018-09-06,4.0,Anonymous Employee,"Great pay, full benefits included.","Long hours, early start time."
155,Brookfield Asset Management,Great company to work for,2018-08-06,5.0,Anonymous Employee,Great company to work for,No cons in working at this company
156,Brookfield Asset Management,Very bad work culture & strict management,2018-07-25,1.0,Financial Analyst,"- Good Christmas parties
- Pay rate is slightly above the market","- Management is very strict and prefers micro managing
- Working hours are at least 10 hours a day and they do not encourage any flexibility 
- Project managers are very demanding and are rude most of the time. 
- Leadership takes advantage of their power and at times they bully their staff. If you complain to HR than they do nothing about it. 
- Employees have to get use to lots of work pressure to survive"
157,Brookfield Asset Management,Good company,2018-07-20,4.0,Anonymous Employee,"Work life  balance, opportunities to learn and develop","Location of office, and senior management was interfering in business"
158,Brookfield Asset Management,Director,2018-06-10,4.0,Anonymous Employee,"Supportive culture, smart people, great benefits",None I can find yet
159,Brookfield Asset Management,Property Manager,2018-05-09,4.0,Property Manager,"Very nice staff, and management is responsive to concerns. Good benefits and the work environment is always very clean and safe.","Hours can be long, and managing vendors can be difficult. But these are par for the course in property manager roles."
160,Brookfield Asset Management,Positives and Negatives,2018-05-07,3.0,Anonymous Employee,Great opportunity to learn and get experience,You must fit in with company culture
161,Brookfield Asset Management,"Lack of leadership, direction and effective management",2018-04-12,2.0,Anonymous Employee,"Great CEO 
Nice office
Good pay and benefits","The company has grown too quickly and the people in management positions have no idea how to lead or motivate junior people. Certain people in manager level positions get away with mistreating others and people turn the blind eye.

The culture is very fake and passive-aggressive. In general, people seem nice on the surface but are in fact are not very helpful and do not like to be disturbed.

In terms of getting things done, this is the most inefficient places I've ever been at.  Too many meetings after meetings and useless call. People love setting up meetings instead of doing any real work. Too many cooks in the kitchen with no one to make the ultimate decision."
162,Brookfield Asset Management,SFA,2018-03-31,3.0,,Lots of learning and exposure,Busy seasons can be pretty long
163,Brookfield Asset Management,Solid experience,2018-03-30,5.0,Anonymous Employee,"Growing AUM
Solid management
strategic decision making and company positioning
fair salary and bonus
In New York Brookfield Place is accessible, beautiful and with plenty of food options.","headquarters in toronto which can seem remote if you prefer to work at headquarters
various silos tend not to communicate, which is fine is you're specialized in your own field and seek not to change teams"
164,Brookfield Asset Management,Client Conference Centre,2018-03-20,3.0,Anonymous Employee,Free Pizza! Lots of snacks around the office and mostly pleasant people.,Not a lot of room for free thinking or growth.
165,Brookfield Asset Management,Pretty decent place to work,2018-03-05,3.0,,"Good environment, reasonable hours, ok benefits",Pay was a little low
166,Brookfield Asset Management,Management,2018-03-04,4.0,Anonymous Employee,Long hours and demanding but overall great company to work for,Company provides opportunities for growth and learning - not too many cons
167,Brookfield Asset Management,Overall review,2018-01-20,2.0,Anonymous Employee,Good compensation and benefits package,"Business units operate in silos. Some of them have great leadership, some don't. The IT area within BAM to avoid!"
168,Brookfield Asset Management,Financial Analyst,2018-01-14,5.0,Anonymous Employee,"Good people, interesting work, merit-based",Workload is more than normal company
169,Brookfield Asset Management,Great place to work,2018-01-03,5.0,,Excellent work life balance.  Company genuinely cares about its employees. Benefits are great and pay is within  or beyond industry standards.,Can’t think of any cons. The office is in a great location. Building is well kept and beautiful. Everyone looks like they are happy and enjoys coming to work.
170,Brookfield Asset Management,"Good company, very corporate",2018-01-02,4.0,Facilities,"Beautiful office, good benefits, global company","Very corporate, can be a bit stuffy"
171,Brookfield Asset Management,Good company smart people,2017-12-25,3.0,Anonymous Employee,"BRES was fun to work at. Their real estate brands are Royal Lepage, Via Capitale and Prudential.  They were fair to employees overall, paid a decent wage and were very friendly and approachable professionals.",As a part of Brookfield they seem to relish restructurings and change.  Too many good staff & management leave the business for no good reason.
172,Brookfield Asset Management,Don't do it!,2017-12-14,1.0,Anonymous Employee,Offices are close to the CBD,Very very very anti women
173,Brookfield Asset Management,What was I thinking coming to this ridiculous place?!?  They are run like a small shop.  They should just stick to RE.,2017-11-05,1.0,Vice President,Not much that I can think of other than a fancy office.,"Where do I begin?!?  They are a Real Estate owner/operator/manager that decided to get into the private fund business.  Not sure how they were able to amass the amount of AUM they currently oversee, but they are truly run like a small shop.  I have seen leaner and smaller shops run and managed better than Brookfield.  If you like long hours, little recognition, being isolated and dealing with a lot of personalities, then this is the place for you."
174,Brookfield Asset Management,Market Analyst,2017-10-24,2.0,Anonymous Employee,"Exposure to range of markets, financially stable","Long hours, no growth, poor leadership  and direction for CI"
175,Brookfield Asset Management,Audit Intern,2017-10-19,4.0,,Great office to work in.,Can get a little dry.
176,Brookfield Asset Management,My Experience,2017-10-18,5.0,Anonymous Employee,Amazing company with amazing people. Everyday teaches me something new.,Very little opportunity for growth.
177,Brookfield Asset Management,Brookfield Private Equity,2017-09-18,2.0,Private Equity,"Modern work environment
Opportunity to work with senior management directly","I worked in the Private Equity Group in New York. From my experience I noticed that although the group overall managed $4 billion the New York team has failed to do a major deal in the last 3+ years. In fact most of the major deals seem to happen outside of New York. This is largely because the New York team is led by ineffective leaders at the VP to MP level, which lack sourcing and execution experience. Additionally, the VP level employees typically run the deals and are generally younger employees in their late-twenties, who treat the juniors like they are analysts in banking. Expect long hours, weekend work (reporting in at 9AM on some days) and limited recognition. To top it all of Brookfield pays ~30% below market. If you are looking to get real deal experience I would recommend looking elsewhere. 

Limited ability to move within the organization as well."
178,Brookfield Asset Management,Former Employee,2017-07-04,2.0,,"nice work, complex deals, good learning , good perks, intelligent people","selfish people at top, lot of egos and insecurity, dirty politics"
179,Brookfield Asset Management,Very Disappointing,2017-06-10,1.0,,Lunches provided.  Monthend dinners provided. Team building events held.,Very long hours expected once on board.  Last minute changes/adjustments made to systems.
180,Brookfield Asset Management,Awesome,2017-05-17,5.0,,Great People and great place,None at all for me
181,Brookfield Asset Management,No work life balance,2017-05-09,3.0,,"interesting deals, good learning opportunities, good location, opportunities within the org","Heavy hours, high turnover due to lack on work life balance"
182,Brookfield Asset Management,Learning Experience,2017-05-04,3.0,Anonymous Employee,First job out of college.  Able to learn from team members.  Everyone willing to help.,Need to better allow for mobility internally between teams.
183,Brookfield Asset Management,Corporation that behaves like disorganized mom & pop,2017-03-05,2.0,Anonymous Employee,Great exposure to many business lines,Each business line has their own way of operating - little coordination
184,Brookfield Asset Management,Associate,2017-01-20,4.0,Analyst,"- Great work environment
- Steep Learning curve
- good culture","- late working hours
- not so great work life balance"
185,Brookfield Asset Management,Pros and Cons,2017-01-19,3.0,,Okay pay and good benifits,Some people there are un professional
186,Brookfield Asset Management,Analyst,2016-12-24,5.0,Anonymous Employee,"Good leadership, autonomy from early on",None really; work culture can be very demanding
187,Brookfield Asset Management,Finance analyst,2016-10-23,3.0,,"Good name of the company, great office location, interesting job and you see most deals go through","Awful hours, teams are much too competitive and degrade each other"
188,Brookfield Asset Management,Analyst,2016-09-19,3.0,,Good people and nice office,"Way behind in technology, kind of uninspiring"
189,Brookfield Asset Management,denver,2016-09-06,5.0,Central Operator,The management was top notch.,shift work some times and working holidays.
190,Brookfield Asset Management,Internal Auditor,2016-08-17,4.0,Internal Auditor,Great plate to gain knowledge and improve your skills.,You have to be good at multitasking.
