,company,headline,date,overall_rating,author_position,pros,cons
191,Brookfield Asset Management,Terrible place to work full of wannabes and egos.,2016-06-27,5.0,Anonymous Employee,"Nice/fancy office space. Pizza on Fridays and snacks, if you can call that a pro (gets old).  Not much else.","Egomaniac as a Chief Compliance Officer in Private Funds Group.  Holds himself to a different set of rules than others.  Awful place to work.  It's truly a mediocre place to work, full of wanna-bes who want to work at top-tier firms.  Full of senior management who don't really care about employees.  A lot of attrition in all groups as managers don't ensure that their employees feel fulfilled or content with their work.  Technology and IT support is non-existent as everything is outsourced.  Terrible resources and a company that doesn't like to invest in itself.  Second tier shop.  Job-seekers beware."
192,Brookfield Asset Management,Decent place to work,2016-04-26,3.0,Analyst,Decent salary. Summer hours. Good snacks. Pizza Friday. Good benefits. Decent people.,Your only as good as the people who like you at Brookfield. Build a rapport with upper execs and hope for the best.
193,Brookfield Asset Management,Corp Accountant,2016-04-24,1.0,Anonymous Employee,"-good team work evironment
-co-workers are friendly and helpful","-very limited growth opportunities for non-CAs
-bad hours"
194,Brookfield Asset Management,HR Manager,2016-03-18,5.0,Manager,"Great people, innovative, great location",no comment at this time
195,Brookfield Asset Management,Very stable job,2015-12-11,4.0,Anonymous Employee,"The job itself is very stable and is high paying. I enjoyed the people you get to work with, everyone is civil and friendly.",I found it kind of funny how they keep pushing the notion of no script to ensure that people do not keep bored of the job. The reality is that you get pretty bored with this job. I also find very slow career growth.  You are also very very micromanaged.
196,Brookfield Asset Management,Great Place To Work,2015-12-02,4.0,,Positive and welcoming environment to work in.,Not much room for growth.
197,Brookfield Asset Management,Supervisor,2015-11-15,4.0,Pegasus Race & Sports Book Supervisor,One of the best places to work in the word,Unexperience managers in some areas
198,Brookfield Asset Management,Great Company,2015-10-24,4.0,Operations Manager,Smart people to work with,Long hours expected for little monetary return
199,Brookfield Asset Management,Executive Assistant,2015-10-01,5.0,,"Great environment, great people, given ability to grow.",No cons as of yet.
200,Brookfield Asset Management,Good company,2015-09-10,3.0,,"Good compensation, high earning potential.",Very structured and demanding environment.
201,Brookfield Asset Management,Excelent Company,2015-08-20,5.0,Anonymous Employee,Collaborative and dynamic environment in a growing company.,No specific negative aspects to comment.
202,Brookfield Asset Management,Positive or Negative Experience Depends on Team,2015-08-15,3.0,Accountant,"Depending on what team you work with, your experience will either be blissful or dreadful with very little in between. Some of the most intelligent and personable individuals I've ever met are employed by this company.

The office and surrounding location is so beautiful it's almost unbelievable. The futuristic all-white, brightly lit office keeps you upbeat even are your groggiest days. The setting on the Hudson with the Statue of Liberty in clear view allows for some pleasant daydreaming when your brain needs a much deserved break. There is also a 24 hour Rite Aid located within the building, which has been clutch so many nights when working late and have no other stores open in the area.

There is tremendous opportunity for advancement within the company, as management works to keep their talented employees. There is always a new challenge to be tackled and individuals willing to teach as long as you're willing to learn.","For every rockstar employee that you meet here, there are at least two stiffs with an inflated sense of self-worth that you hope you never have to work with. It creates a true team-specfic company culture, rather than a general one.

The hours can be a drag, although steps are being taken to mitigate some of this through more efficient processes. Although management is very flexible with time off when requested, there is still a feeling of no true work/life balance due to the sheer volume of work and many late nights needed to complete it.

The compensation is below the industry standard in New York.

The open environment and see-through glass conference rooms, although helpful when it comes to exchange of information, leads to too much unwarranted, noise, nosiness, and butting in from those around you.

Inefficient processes and too many layers of review for some of the simplest of tasks."
203,Brookfield Asset Management,Enjoyed Working Here,2015-08-07,4.0,Anonymous Employee,"Worked at Brookfield Corporation Operations, a service organization under BAM.  Initially a great place to work, options available to develop skills and contribute to growth of company.","Accounting and Technology Services were outsourced to other countries.  The change management process was not well handled.  Management plays favorites, so if you're not part of that inner circle there is no opportunity for advancement."
204,Brookfield Asset Management,Nice people,2015-07-12,5.0,,Great company culture and beautiful office,Organizations structure can be confusing
205,Brookfield Asset Management,"It's not what you know, but who you know.",2015-06-30,2.0,Associate Compensation Analyst,"Abilities to work from home, friendly approachable people for the most part, beautiful office with nice ammenities.","Blatant favoritism, poor management, very hard to get promoted, and not a good sense of team. Not all co-workers are held to the same standard of work."
206,Brookfield Asset Management,Watch out for bullies,2015-06-03,2.0,,Opportunities for incentive compensation and standard annual raises,"Certain dispicable managers bully their employees and intimidate their bosses, so they remain the most powerful, yet are completely incompetent.  This makes for a culture of intimidation and bullying.  Very difficult to remain for very long."
207,Brookfield Asset Management,PFG,2015-05-20,3.0,,Very smart people in all departments,Not the best work-life balance
208,Brookfield Asset Management,Culture,2015-04-01,2.0,Anonymous Employee,people are friendly and approachable,"people do not want to go beyond their day to day responsibilities, they do not want change"
209,Brookfield Asset Management,Satisfactory,2015-03-26,3.0,,"Often times reasonable hours
Good work culture
Friendly and often agreeable co-workers
Variety of transaction exposure","Below market pay
Below market bonus
Can be terrible, grueling hours"
210,Brookfield Asset Management,Chief Compliance Officer - Broker-Dealer,2015-02-03,1.0,Chief Compliance Officer,Anything other than working for Private Fund CCO in NYC.,"Private Fund CCO based in NYC treated me like an entry level analyst. I had to go on medical leave to escape this overbearing boss.  DO NOT WORK FOR HIM.  The rest of the organization is great, but he should be let go.  He has a Napoleonic complex and is incredibly pushy and rude.  He may be a misogynist."
211,Brookfield Asset Management,Ever changing environment,2015-01-27,3.0,IT Profession,"Good people,  dynamic,  challenging and globally focused.",Unsettled structure and appear to be doing lots of trials and errors strategy.
212,Brookfield Asset Management,Growth opportunity,2015-01-06,4.0,,The company offers room for improvement and career growth,Recent management decision had prevented some employees' growth
213,Brookfield Asset Management,Great company to work,2014-10-20,5.0,Senior Architect,"values ​​the employee
great view of the market
career growth",no negative comments about the company
214,Brookfield Asset Management,Analysr,2014-10-17,4.0,Analyst,"Good pay, open culture, one open space with low dividers which induces better communication","lacking in training, no control in the hierarchy chain (if you have a mean boss, it goes unnoticed),"
215,Brookfield Asset Management,none,2014-09-10,2.0,Systems Analyst,"Toronto centric , global brand name",IT dept got outsourced . Poor management
216,Brookfield Asset Management,Good coworker,2014-09-01,3.0,IT Service Desk,Very nice interactive with all areas and levels.,"No career upgrade, no manager abilities to lead a team."
217,Brookfield Asset Management,Unstable,2014-04-01,2.0,IT Professional,"The benefits and salary are standard.  If you want the run of the office business/office type job, this is great.","In IT, this were very unstable and you cannot really trust anyone.  Things are always changing."
218,Brookfield Asset Management,Satisfactory,2014-02-22,4.0,Operations Analyst,Large company with many benefits.,"Very large company, They outsourced their IT dept. To many hours. Not a good ballance between family and work!"
219,Brookfield Asset Management,"I had a long and satisfying tenure, learned a lot and enjoyed the people.",2013-11-04,4.0,Controller,Large stable company with a good working environment. Senior management is very capable and willing to share responsibility.  They are involved in many different businesses.,I received very little feedback on my job performance.
220,Brookfield Asset Management,"Okay, but a lot of improvement needed",2013-10-28,3.0,,Good quality of life as hours worked are not too much. Brookfield also sponsors several arts initiatives for which employees may be able to receive free tickets.,Work is not very challenging in the back office. Management is not in tune with the employees. Salary is not up to NYC standards.
221,Brookfield Asset Management,Great organization with no boundaries for growth,2013-10-07,4.0,Director Corporate Audit,Share options. Breath of work ensures continuous learning,Possible to many accountants at the senior level
222,Brookfield Asset Management,Micromanagement Capital of my Career,2013-09-06,2.0,Accountant,"-Learned a ton, this is one thing I will give them during my time there.
-Incredibly smart people, perhaps the smartest I have worked with, and they know it.  
-Nice location at World Financial, but then again it could be better since they own the freaking complex.
-Good starting salary, expect it to last a few years.","-No work-life balance whatsover if you would like to succeed at your job. 14 hour days, weekends, etc.
-Management acts as if they are paying you out of their own pocket.  My entire team was treated like children despite dedicating our lives to the job.  
-Zero privacy: open work envireonment is the most intrusive I have ever encountered.  The CFO of one of their public companies was sitting in a cube, nuff said.
-Raises/bonuses/promotions are treated like you are gaining the keys to the kingdom.  Like the old saying, if you are not on the inside, you are on the outside.  Better make a friend of a key executive, or you will be left out in the cold.  
-If you never open your mouth or express an opinion, you will be their ideal junior employee."
223,Brookfield Asset Management,A good place to work.,2013-08-29,4.0,Lead Hand,"Committed to advancing within, education and a respectful workplace. Supervisors are mostly aware of life-balance needs.",Mediocre pay. A large and fluid corporate culture that spends limitless energy reinventing the wheel with ideas that have been tried and failed.
224,Brookfield Asset Management,Good company to work for,2013-08-23,4.0,Anonymous Employee,Good company to work for. Great pay and benefits. they do a lot of arts and events and a high on social responsibility,Some departments are run as fiefdoms by people who shouldn't be running them
225,Brookfield Asset Management,"Bad place to work, especially if you work in Brookfield Corporate Operation",2013-04-29,1.0,Anonymous Employee,"Hardly any. 401k is best in the industry, but that wouldn't matter because you wouldn't like to stay.",No team work. Most work is done by external contractors. Middle managers just want to climb the ladder and don't think twice before throwing you under the bus.
226,Brookfield Asset Management,Trade Support Associate,2013-03-11,3.0,Trade Support,"Some great coworkers  across several internal teams.
Great work life balance - rarely work more than 40.","Poor leadership, lots of politics with little results.
Below average pay.
Office has clique's like a school cafeteria, this leads to terrible communication.
No sense of ownership for anyone's work ethics or decision making.
Office is mostly AVP, VP and Directors - about 70% of employes have this sort of title (including the entire front office which has no associate on the team). This creates inflated egos.
Wasteful - money only goes to misguided projects and old leadership."
227,Brookfield Asset Management,"It is a great place to work, many employee benefits.",2013-01-15,5.0,Anonymous Employee,Employees are always willing to help one another.,Lower starting pay rates compared to other companies.
228,Brookfield Asset Management,Great learning experience,2012-10-01,3.0,Analyst,"Qualified team, strong focus on improvement in the Australian market, strong brand reputation in Australia",Far removed from head office in Canada. Sometimes felt like it was managed like a private equity portfolio company and constrained financially at times.
229,Brookfield Asset Management,"Laid back, friendly corporate culture.",2012-09-15,3.0,Investment Analyst,"Laid back and friendly senior management.
Helpful and hard working colleagues.","Too Toronto / North America centric.
Corporation is still run like a small club controlled by the senior Managing Directors, and not like a Fortune 500 / 1000 company."
