,company,headline,date,overall_rating,author_position,pros,cons
105,Allianz Global Investors,Fairly good asset manager,2020-02-05,3.0,Anonymous Employee,"Qualified, diverse staff, quality product line","Increasingly politics, not very transparent promotion decisions"
106,Allianz Global Investors,Nice company to work,2020-01-30,4.0,Construction Security Technician,"International company, interesting challenges and projects",Lack of transparency and communication
107,Allianz Global Investors,Fantastic place to work for open minded people. You can combine family and work!,2020-01-24,5.0,Vice President,Very good culture and very international.  You can speak up and come with ideas to make things different and simpler.,Sometimes too much on the plate.
108,Allianz Global Investors,Great place to work,2020-01-21,4.0,Anonymous Employee,International work environment with strong collaboration across functions and great opportunities to develop for those who take ownership of own career.,"Some managers still need to adjust to the modern way of work, allowing for more flexible work models. But in general this has improved a lot over the past years."
109,Allianz Global Investors,Department Head,2020-01-04,5.0,Senior Manager,Humanize and  Career development,Everything focus on performance and process
110,Allianz Global Investors,Good place to start your career in asset management.,2019-12-06,3.0,Analyst,Great work/life balance and healthcare benefits.,Difficult to be recognized or to promote from within.
111,Allianz Global Investors,"Was a great place to work, but things change.",2019-12-02,3.0,Vice President,"Great Benefits, good payout, good management","Huge turnover in management and employees, cutting top products, consistently changing territories."
112,Allianz Global Investors,Great place to work!,2019-11-08,5.0,Communications Specialist,"Job opportunities 
Work Culture
Transparency 
Access to management
Diversity 
Work life balance 
Sense of accomplishment",I cannot think of at this moment
113,Allianz Global Investors,-,2019-11-05,4.0,Graduate Trainee,"- great opportunities, like rotations abroad",- hiring without proper planning of available positions after the program
114,Allianz Global Investors,Good Place to work,2019-10-28,5.0,Anonymous Employee,"People are nice and helpful
The company provides lots of bonding activities
Very good work-life balance",Everything is so far so good
115,Allianz Global Investors,Awesome TIme,2019-09-17,5.0,Intern,"Work with really smart people, and learn a lot.","Not any significant cons, really."
116,Allianz Global Investors,Product Manager,2019-09-17,3.0,Product Manager,Good atmosphere and well paid,Traditional structure and slow promotion
117,Allianz Global Investors,they try,2019-09-04,4.0,Executive Assistant,"Progressive, Positive Culture in UK office,",Can be to process orientated
118,Allianz Global Investors,Worst experience in my professional career,2019-08-26,2.0,Anonymous Employee,"Nice colleagues who try to do their best every day
Strong corporate brand","Chaotic, poor feedback culture, strong, cliquism, very politic, poor and slow processes in many ways, hire-and-fire mentality, etc."
119,Allianz Global Investors,Mitigated feedback,2019-08-25,3.0,Investment Operations,"Several advantages: multiple reorganizations leading to new opportunities, flexible work, benefits package","Weak points: Inclusion and diversity, rewards, salary"
120,Allianz Global Investors,Good to start,2019-08-21,4.0,Anonymous Employee,Amazing work culture and environment,"Nothing Specifically,  Its really good company to work"
121,Allianz Global Investors,Allianz Global Investors will never succeed in US,2019-08-20,2.0,Vice President Marketing,Allianz generally offers high salaries and good benefits. Enjoy it while you can.,"There is less stability here than at any other company I’ve worked for. There were heavy layoffs each year and constant personnel and management changes. They just can’t seem to get it right.  I, along with many others, felt like temp workers. It’s only a matter of time before your number is called."
122,Allianz Global Investors,"Good work life balance, career potential limited",2019-08-09,4.0,Analyst,"Work life balance, friendly atmosphere, strong contributors on the PM and analyst level","Upward mobility limited, senior mgmt."
123,Allianz Global Investors,Good place to Learn,2019-07-25,4.0,Insurance Specialist,"Friendly working environment, learned a lot,",Rotation shift and working weekends
124,Allianz Global Investors,Account Technician,2019-07-20,4.0,Account Technician,"Great benefits, hours and people to work with",Pay could be better
125,Allianz Global Investors,Good culture,2019-07-09,3.0,Anonymous Employee,"Very friendly culture, great work life balance",Limited development and very focused on europe
126,Allianz Global Investors,"Demeaning, hurtful experience",2019-07-05,1.0,,"Good benefits such as 401k, health, family leave etc","I am unable to recommend working here to any person who is not European or at least white. It is an open secret within the firm that there is a hierarchy: Europeans on top, white Americans second and non-white groups at the bottom. I have experienced put-downs, retaliatory behavior, treatment below seniority, being berated for small lapses (very common!) and denial of recognition despite high quality work. I have also noted other excellent colleagues (who are not white) ill-treated by managers often with the aim of beating them “into line” and showing “who’s boss”. 

People are frightened of certain senior managers who have used bullying and public bashing to make an example of subordinates who speak out. It is not a secret who these managers are, but people are afraid to risk their position by complaining. 

I sincerely hope the reader has a better experience at this firm. But if you have options, *absolutely* do consider working elsewhere."
127,Allianz Global Investors,"Nice Colleagues, Visionless Boss",2019-06-13,1.0,Anonymous Employee,Colleagues are very knowledgable and professional.,"Steven J Berexa, aka Global CIO Equity: for years no investment in real equity research, just wants to be a free rider. Undecided on AI and robo advisory. Big bets on theme funds."
128,Allianz Global Investors,Great place to work,2019-06-11,5.0,Vice President,"extraordinary corporate culture, flat hierarchies, great work-life-balance, truly global, multi-cultural environment, innovative","bureaucratic, consensus driven decision making processes makes things slow"
129,Allianz Global Investors,Challenging job with a truely global player,2019-06-11,5.0,Senior Project Manager,"- Truely global investment manager
- Backed by insurance company enabling seed money for new investment ideas
- Management trusts in its employees and empowers them so I can make my own and independent decisions
- many corporate benefits
- family friendly","- It's a large player, so not all decisions/processes go as quickly as they could"
130,Allianz Global Investors,Nice working place for the beginning,2019-05-23,2.0,Student Worker,"- not the worst salary
- they pay in time
- mostly good working atmosphere
- good working package
- flexible","- no development
- typical office"
131,Allianz Global Investors,working student during master of Finance,2019-05-07,5.0,Working Student,Company playing with the biggest cap,"Very structured, difficult to evolve quickly"
132,Allianz Global Investors,Good employer,2019-05-03,4.0,Anonymous Employee,"profit sharing, bonus, christmas gifts, nice people","not dynamic, too heavy to move fast"
133,Allianz Global Investors,Great Benefits,2019-03-29,4.0,Anonymous Employee,There are great co-workers at the company.  It is a team spirited organization for those in the NY Office.  The firm is very focused on diversity and inclusion which is good to see,The senior management is primarily European and don't always understand the business approach in the US and what we need to do to stay competitive
134,Allianz Global Investors,Nice firm,2019-03-09,4.0,Anonymous Employee,less politics. pretty chill ppl,People are in general not very ambitious
135,Allianz Global Investors,Great culture,2019-02-27,5.0,Anonymous Employee,A very nice place to work with nice people.,"A very complex structure, too much beaucracy."
136,Allianz Global Investors,Empty Pit,2019-02-14,1.0,Anonymous Employee,None since Germany took over,Don's waster your time here
137,Allianz Global Investors,Great company,2019-02-13,4.0,Lead Developer,Great company to work for,No major cons stuck out
138,Allianz Global Investors,Research Intern,2019-01-15,5.0,,understand the overall knowledge about public fund with various asset categories.,more limits from head quarter
139,Allianz Global Investors,Firm,2018-12-18,4.0,Anonymous Employee,"Good culture, quality people, stimulating work, supportive management, truly global","Some processes can be slow, some outsourced services could be slow, more opportunities for young people, nothing else, nothing particularly"
140,Allianz Global Investors,Bit too bureaucratic and political,2018-10-22,3.0,Anonymous Employee,Good staff benefits. Stable environment,"Very slow,  bureaucratic and above average amounts of office politics"
141,Allianz Global Investors,AVP,2018-10-17,2.0,Anonymous Employee,"medical benefits is alright
Strong parent company","Structural change all the time
Work life Balance policy exist but not really practical, you have to work even during holiday"
142,Allianz Global Investors,Great company!,2018-10-12,4.0,Anonymous Employee,Flexible work schedule and great benefits,Large firm which can be difficult to navigate
143,Allianz Global Investors,Good company,2018-10-04,4.0,Anonymous Employee,"Friendly, intelligent people. Good to have the backing of Allianz as parent. Embracing change, particularly around sustainability.",Many chiefs. A little bureaucratic on the compliance side
144,Allianz Global Investors,Good employer,2018-08-29,5.0,Anonymous Employee,Intellectually stimulating and friendly environment,No major cons in my opinion
145,Allianz Global Investors,Company Review,2018-08-15,4.0,,Comfortable and safe working environment. Friendly environment. Plenty of travel and company benefits.,Not very dynamic. A lot of dead weight. Sales driven organisation. Unlikely to make a fortune.
146,Allianz Global Investors,Challenging environment with many opportunities to learn,2018-07-17,4.0,Anonymous Employee,"Learning, understanding financial markets, creative","Big organization, not transparent decision making"
147,Allianz Global Investors,Research analyst,2018-07-10,3.0,Anonymous Employee,Good resource and high autonomy,Promotion prospect is very limited
148,Allianz Global Investors,Portfolio Assistant,2018-07-10,5.0,Anonymous Employee,Great oppotunity with the team,Too big of a company
149,Allianz Global Investors,Hervorragend,2018-07-05,5.0,HR Director,"International Set-up, agile & fast moving organization, very collaborative environment, top notch investment approaches",Global functional matrix set up requires some alignment efforts
150,Allianz Global Investors,I used to love my job until I reported up into Germany,2018-06-26,2.0,Anonymous Employee,"Good Benefits (this is one of the reasons why I haven't left yet)
Competitive Salary
Offices are in great locations for those who commute","Where do I start....

Management in Germany has proven to believe that if you are an American (which I am) that you know nothing.  If you have an idea, if they like it they will take credit for it and give you no credit for your ideas or you work around the idea. 

I'm treated like slave labor.  I'm regularly on calls at 4:30-5:00 am and then expected to come into the office after because Germany refuses to take calls that will work in the US time zones and hide behind the German workers council. 

There are so many things we can do to make our systems and processes better that will cost little to no money but Germany will not listen because those ideas are not German ones, they are American ones. 

It is considered offensive and a faux pas if you bring up how a process/system can be improved that Germany designed, invented or implemented.  

There is a ton of micromanagement especially from Germany. 

If you like technology and expect to be working with tools that are from the 21st century, don't work here.  They love antiquated technology. 

Allianz Global Investors talks the diversity talk but does not do the diversity walk.  I've watched several female colleagues run for the hills from this company based on the way they were treated and HR did nothing to resolve.  

The US is a revolving door of turnover.  I'm on my 3rd manager in 3 years due to reorganization and managers leaving."
151,Allianz Global Investors,Intern review,2018-05-30,4.0,Intern,"good to employees
good benefits
many training opportunities",managers are too busy to spend time in entertaining interns
152,Allianz Global Investors,Good company to work for,2018-05-14,3.0,Anonymous Employee,"AllianzGi is a reasonably good employer, and pay staff relatively well.",Company doesn’t really encourage enough interaction with other teams around the office. Could do with hiring permanent staff for IT ops. Way too many externals who come and go within the company. Difficult to build internal relationships and know who to speak to when staff are rotating out the door all the time.
153,Allianz Global Investors,Good employer,2018-04-23,5.0,Anonymous Employee,The culture is relaxing while intellectually stimulating. Management sets clear goal but allow room for employee to work on their own pace while encouraging independent thinking.,A time zone that is 3 hours behind New York make it difficult for people who cover domestic equities and European equities.
154,Allianz Global Investors,"Great people and culture, but losing out to competition on pay and promotions",2018-04-19,4.0,Anonymous Employee,"Great people, global organisation, great diversity of nationalities and cultures,  a good place to be if you like what you are doing and are not overly ambitious, but also reasonably good on job mobility.","Can be very slow and bureaucratic, decision making by committee is still present,  although the CEO is working to change that. 
Once you are in, promotions and pay rises are slow. Poor transparency around promotion process, particularly at a more senior level, creates uncertainty around career progression for aspiring and talented people.
Very slow in getting rid of “dead wood”. This impacts overall productivity."
155,Allianz Global Investors,Good company,2018-03-24,5.0,Anonymous Employee,Good and enjoyable  place to work.,Nothing! Everything is good in allianz
156,Allianz Global Investors,A very good place to work,2018-03-12,4.0,Anonymous Employee,"Very collegial atmosphere, good pay & benefits, staff taken care of","Slightly old-fashioned in adherence to hierarchy, very strong influence from German offices especially Frankfurt."
157,Allianz Global Investors,Great place to work,2018-03-04,4.0,Anonymous Employee,"Very international culture, very ambitious company, smart colleagues",Sometimes can be slow to make decisions
158,Allianz Global Investors,Great place to work!,2018-02-23,5.0,Anonymous Employee,"Allianz Global Investor's people are truly what makes it a great place to work!  I have been at AllianzGI for nearly 10 years and while the environment is intense, I also describe as work friendly.  Whether within the same office, across the country, or around the world, AllianzGI colleagues work and support and encourage each other consistently.  We are all in this together and I personally have seen significant positive change over the course of my time here.  There aren't many global organizations that can say that particularly during this past decade!","It has taken some time for AllianzGI to operate as a global company, and it has made great strides in the past few years."
159,Allianz Global Investors,Company culture from internal view,2018-02-22,5.0,Anonymous Employee,"A truly global company, great company culture of inclusion and diversity, provide excellent talent and development opportunities",Faster pace on digitalized service to clients
160,Allianz Global Investors,Given fair autonomy but...,2018-02-12,3.0,Marketing,"Fair amount of autonomy
Seeks feedback and tries its best to address it
Fair work/ life balance - in HK, early off at 4pm once a month","Political 
Too many changes within a short span of time
Does not really walk the talk
In-fighting among different offices within a region"
161,Allianz Global Investors,Intern,2018-01-01,4.0,Anonymous Employee,"- lots of insight into different Departments
- good work climate",- to some degree bland administrative tasks
162,Allianz Global Investors,Engages colleagues from around the world,2017-12-28,5.0,Anonymous Employee,"Truly global company
Very diverse culture
Collegial atmosphere
Flexible working and mobility","Like in any bigger company, decision making is at times a bit slow."
163,Allianz Global Investors,Looking to the future,2017-12-11,4.0,Anonymous Employee,Global business.  Good corporate culture.,Business is challenged in U.S.
164,Allianz Global Investors,Portfolio manager,2017-11-10,4.0,Senior Portfolio Manager,Stimulating and pleasant work environment. Recognized player on the fincial markets.,Complex organization spanning different OE with a limited degree of investment autonomy
165,Allianz Global Investors,Used to be a great place to work,2017-11-09,3.0,Anonymous Employee,Very good pay and benefits,"IT departments outsourced, starting with the server/storage/infrastructure teams in 2016."
166,Allianz Global Investors,Former employee,2017-10-18,4.0,Anonymous Employee,"Global, professional, bright colleagues, and stable","Limited career upside/movement/flexibility, below market pay"
167,Allianz Global Investors,Opportunities for those prepared to grasp the nettle,2017-10-07,5.0,Director,"Ambition, solid parent company, diversifying fund ranges, good culture .",Change management slow due to legacy boutique structure
168,Allianz Global Investors,Just a number,2017-10-04,3.0,Anonymous Employee,Large asset manager with some good investment Funds. Pay is reasonable although lack of trust is created as there are no set salary scales and discretionary bonuses seem to be disproportionately allocated.,Employees under lots of pressure from superiors. Lack of trust between departments and across workforce which starts from senior management downwards. Senior Managers see themselves as part of a special group and above others.
169,Allianz Global Investors,PM,2017-09-26,5.0,Anonymous Employee,"A good company to work for, with attractive career opportunities that generally rewards talent. 
Good opportunites to travel
Many talented people within the organisation.","Slow to innovate, as is the case for many large organisations"
170,Allianz Global Investors,Summer Analyst,2017-09-19,4.0,,Great place to work!! Well-rounded internship program,summer program does not directly lead to full-time opportunity
171,Allianz Global Investors,Allianz,2017-09-14,3.0,Anonymous Employee,Good place to work for when you have a manager who knows how to manage people.,Lot of disconnect when it comes to policies
172,Allianz Global Investors,AGI Review,2017-08-31,4.0,Invetment Consultant,"Great culture, benefits, work life/balance",There has been limited career advancement
173,Allianz Global Investors,Slow & Steady,2017-08-08,3.0,Anonymous Employee,Benefits from the stability of having a very large parent company. German culture so people value professionalism and employee rights are taken very seriously.,"Below average compensation. Somewhat bureaucratic, particularly in Germany & France. The firm has always struggled in the UK market as the brand isn't as strong as it is in Germany."
174,Allianz Global Investors,"Great company, Conservative team mindset",2017-08-05,4.0,Anonymous Employee,"Great company spirit
Embrace diversity and difference
Fair employment package","Senior management mindset very much different from middle management, creating an inconsistent and sometimes confusing vision and goals for teams, new joiners."
175,Allianz Global Investors,Not so great,2017-07-09,2.0,Assistant Vice President,Decent benefits and salary. Most of people had professional attitudes at work.,"Too frequent reorganizations.
Management was not transparent about company's directions/strategies.
HR appeared to lax on policing abusive behaviors of few people."
176,Allianz Global Investors,Working Student Account Management,2017-05-22,3.0,,"Highly professional atmosphere, many insights on a high level, on-the-job trainings; very good canteen!","Very numbers-driven and stressful working atmosphere, market conditions have been attributed to colleagues as personal failure"
177,Allianz Global Investors,Research Analyst,2017-04-24,5.0,Anonymous Employee,"Great comp, good company, good benefits",Lots of red tape - can get in the way
178,Allianz Global Investors,Very professional and consistent culture,2017-04-05,4.0,Vice President Operations,Great company to work for - most employees think long term and most do  great job partnering.,"Company takes a stand against bullying in principle and acts with HR training, but bullying behavior is accepted unfortunately."
179,Allianz Global Investors,Ambitious,2017-03-03,5.0,Anonymous Employee,Business with real growth ambitions in active management,Some legacy boutique structure management issues still to be discarded
180,Allianz Global Investors,Multi Asset,2017-02-20,2.0,Portfolio Manager,Growing Business as the Need for Multi-Asset Solutions is obvious.,"In Multi Asset Most People are overqualified and therefore demotivated as the Investment process is extremely standadized and there is no openess for new ideas. The best Young People are willing to leave, the Older colleagues Seem to have resigned. Management does Not care. Career-Perspektives and Salary improvements are very Limited. Management is too old for changes."
181,Allianz Global Investors,Firm does not inspire loyalty or comraderie,2017-02-02,2.0,Director,"Good way to break in the business
Pay can be attractive 
Good benefits 
Good access to market informational flow","Turnover is high
Organizational structure changes constantly and so it's hard to know who one answers to"
182,Allianz Global Investors,Company with a good culture and strategy,2017-01-04,5.0,Anonymous Employee,"- collaborative environment and skilled colleagues
- clear strategic positioning as active Investment Manager
- addressing the right issues to prepare for the future
- takes career development seriously
- Management with deep understanding of Asset Management and long term view","- high workload due to high number of projects and initiatives
- structure can be complex due to intensive cross regional work"
183,Allianz Global Investors,Good but you can find better.,2016-11-13,4.0,,This firm fair and understanding of employees personal needs,They ae old school and slow paced relative to the industry.
184,Allianz Global Investors,Power in their People,2016-11-07,3.0,,The people of the company are extremely passionate and want success. All employees are willing to help each other.,senior management lacks a vision and strategy that makes people feel engaged. Culture changes have been frequent but none have with their passionate people in mind. Under compensated and over worked with limited success to feel motivated
185,Allianz Global Investors,SF office is a shell,2016-11-01,1.0,Analyst,"Free coffee, water, and soda. 
Support staff are friendly and caring; they go out of their way to be helpful","- Very hierarchical - promotions are given based on seniority rather merit or performance. In other words if you want to be promoted someone has to die, get fired, or quit.

- A lot of in fighting and politics among the portfolio managers and within teams. Backstabbing and power plays are not uncommon.

- Compensation is below average."
186,Allianz Global Investors,Great experience,2016-10-21,4.0,Anonymous Employee,The colleagues are nice and helpful. It is a place suitable for people who seek a stable life. They won't fire you even if your mistake causes a huge amount of loss. Office political applies here as well.,They don't care much about personal performance. Much like a team work and might have free riders. Some of the colleague might not be that competitive. But they are nice.
187,Allianz Global Investors,An organization in the midst of re-invention,2016-10-20,4.0,Global Program Manager,"If you are a change-oriented, energetic person, then this is definitely the right time to join.
Great opportunities to learn and be involved in global projects
An organization that rewards talent and drive with responsibility","Can at times be typically German, without sufficient top-down goal setting (too many committees)"
188,Allianz Global Investors,Great Company!,2016-10-17,4.0,,"Really nice culture, all of the employees are very helpful and insightful. The company host a lot of different events to get all of the employees involved in networking. Great place to start your career in asset management.",None as of right now.
189,Allianz Global Investors,nice,2016-10-16,5.0,,the best place to work,nothing nothing nothing nothing nothing nothing
190,Allianz Global Investors,Team Coordinator,2016-10-13,4.0,,They are a global company with numerous offices world wide.,"Many individuals who are ""managers"" do not necessarily know what that means; they do not know their own job responsibilites never-mind the job responsibilities of the individuals they supervise."
191,Allianz Global Investors,NY Office,2016-10-03,3.0,Administrative Assistant,"Great NY Cafeteria, solid company and brand.","Some poor management that hired only their friends.  Luckily, they eventually were let go for incompetence."
