,company,headline,date,overall_rating,author_position,pros,cons
0,Allianz Global Investors,Great People,2022-04-21,5.0,Human Resources Business Partner,"People, benefits, management, team and culture.",I have no cons to share
1,Allianz Global Investors,Great company,2022-04-11,5.0,Working Student,"Good culture, interesting company, great colleagues",not encountered any so far
2,Allianz Global Investors,Working Student,2022-04-07,5.0,Working Student,"Good company, nice colleagues, good perks","Nothing at the moment, everything is fine"
3,Allianz Global Investors,Good employer,2022-04-05,5.0,IT Project Manager,"Flexible working 
Nice colleagues
New technology to work with",the management is not always aligned to the current technologies
4,Allianz Global Investors,Mostly positive experience,2022-03-31,4.0,Analyst,Staff are generally approachable and collaborative. Nice working environment.,Internal decision making can be overly political and thus limiting.
5,Allianz Global Investors,"Great workplace, smart people",2022-03-31,5.0,Business Manager,"Clear corporate strategy, good performing products and meaningful connections.","Stiff organizational structure overall, but improving since CEO change."
6,Allianz Global Investors,Nice performance,2022-03-28,3.0,Investment Banking Analyst,Nice benefits for good employees,It ‘s always not OT
7,Allianz Global Investors,Is Allianz Global Investors a good place to work,2022-03-20,4.0,Anonymous Employee,The benifits and discretionary bonus are not bad.,you have to due with politics sometimes.
8,Allianz Global Investors,Good company but limited career progression in AP,2022-03-14,4.0,Business Analyst,"People are friendly, managers are understanding",Limited career progression in AP
9,Allianz Global Investors,Review,2022-03-07,4.0,Analyst,Friendly atmosphere and people. Great benefits,High turnover. Too many systems.
10,Allianz Global Investors,"Big place to work, but good place to work",2022-02-14,5.0,Sales,"- Great work life balance
- Execellent, respectful culture
- Good colleagues","- slownesss to market for new ideas
- recent high turnover"
11,Allianz Global Investors,Great place to work,2022-02-02,3.0,Executive Assistant,nice people to work with.,Certain departments have exceptional managers while others have absolutely horrible managers.
12,Allianz Global Investors,Working student,2022-01-26,4.0,Anonymous Employee,"Small, international team. Everyone is pleasant to work with.",The normal cons that come with working for corporate.
13,Allianz Global Investors,Wonderful,2022-01-26,5.0,Sales Representative,Wonderful wonderful wonderful good good,None none none none none
14,Allianz Global Investors,Great,2022-01-18,5.0,Investor,"Fantastic people; thoughtful, considerate, friendly",Some dead-wood due to labour laws in continental Europe
15,Allianz Global Investors,...,2022-01-17,3.0,Senior Release Manager,"Salary, salary, salary, salary, salary",Home office only during COVID.
16,Allianz Global Investors,Frustrating Operating Systems,2022-01-08,4.0,Business to Consumer Sales Representative,"Nice people, management is very nice. Maybe it's fake, but they are still nice.","The operating systems they use are clunky, outdated, and hard to learn with lots of weird glitches that it seems nobody sees. If they do they never outwardly say how inefficient the OS for the dept is. No other complaints, per se...however be forwarned they are SUPER BUSY."
17,Allianz Global Investors,Good co-workers,2021-12-20,3.0,Senior Information Management Specialist,Good co-workers. Friendly place to work.,"Priorities change often, projects often work at cross purposes."
18,Allianz Global Investors,Great,2021-12-13,5.0,Anonymous Employee,Amazing place to work great,Not many consumers about working here
19,Allianz Global Investors,Unrealistic Expectations,2021-11-14,1.0,Managing Director,Very concerned with social / political correctness.,Expectation to sell average to below average products.
20,Allianz Global Investors,Great working environment,2021-11-10,5.0,Anonymous Employee,"Environment driven by respect, good communication and friendly atmosphere. 
Very interesting tasks and growing",Working times sometimes very long
21,Allianz Global Investors,Very Nice Working Environment,2021-11-10,5.0,Associate Portfolio Manager,"Nice people, nice company culture",a bit slow paced in general
22,Allianz Global Investors,Great Place Overall,2021-11-04,5.0,Working Student,"good starting opportunities, global team exposure","management could improve, no clear communication"
23,Allianz Global Investors,Great companz to work for.,2021-10-31,4.0,Portfolio Manager,Great work-social life balance. Interesting projects,No comments on this section
24,Allianz Global Investors,Work Culture,2021-10-29,2.0,Portfolio Manager,Not a lot of pros,Culture is very hierarchical and bureaucratic
25,Allianz Global Investors,AGI,2021-10-21,3.0,Managing Director,Family type environment which is good,Lots of egos seen there
26,Allianz Global Investors,AGI New York,2021-10-13,2.0,Senior Attorney,"Nice people, good work/life balance","Senior management, Compensation, Retaining top talent"
27,Allianz Global Investors,Depressing,2021-10-12,1.0,Anonymous Employee,Fairly nice offices and some nice colleagues,How does it grow? So many headwinds.
28,Allianz Global Investors,Good culture but below average pay,2021-10-11,5.0,Anonymous Employee,Good culture and nice and smart people to work,Below average pay. However decent benefits package
29,Allianz Global Investors,"Solid asset manager, great people",2021-10-08,5.0,Client Service Associate,"Great teams, competitive investment strategies",Still struggling to create a brand in the US
30,Allianz Global Investors,Analyst Operations Allianz Global Investors,2021-10-08,5.0,Operations Analyst,"- Dynamic environment
- Supportive team",- sometimes long working hours
31,Allianz Global Investors,good company,2021-10-06,4.0,Analyst,"great facilities, friendly staff, good working infrastructure","compensation could be improved, hierarchical structure"
32,Allianz Global Investors,So so,2021-10-03,2.0,Manager,Would give it 2.5 stars but system doesn’t allow. Colleagues make this place a bearable. Most are competent & professional. Medical coverage is ok.,"Work load can be overwhelming at times. The structure is confusing and managers have bark but no bite because the ultimate decision maker is in EU. Title sounds great and important but don’t be deceived, no one is actually reporting to you. Good luck mobilizing resources on the ground because working level needs to get the nod from their global leaders first. Lots of political under currents because of this. Precious time spent navigating land mines, ie, too many emails and calls to reach an agreement when it can be a quick / reasonable / practical decision by a local manager who understands situation on the ground."
33,Allianz Global Investors,Corporate Idiocracy at Play,2021-09-26,2.0,Senior Portfolio Manager,"International colleagues and team work 
Good employee benefits due to being part of Allianz
Friendly colleagues","Unfortunately, the current management embodies perfectly the „Trumpian“ Model to business management. People get promoted mostly due to loyalty than to competence. Critical voices are systematically not welcomed. Due to strong links of the current CEO to the Allianz CEO, decisions are made regardless of possible business and own people interests. Restructurings follow very naive, simplistic and outdated accounting and personal rules regardless of business impacts or multi-level systematic dependencies. Managers with horrible track of failed projects, little business acumen, little technical know-how and high people turnover are promoted instead of being replaced. For example, examples can be found in the Data and Technology and Investment Business Management areas."
34,Allianz Global Investors,Progressive Organisation,2021-09-16,4.0,Anonymous Employee,Collaborative working environment and people are friendly,Nothing I can think of
35,Allianz Global Investors,Nice company to work for,2021-09-09,4.0,Senior Risk Consultant,You can work in a truly multicultural team and in a very stable industry.,"Unfortunately the company is full of processes and internal requirements, and decision making is not as fast as it should be."
36,Allianz Global Investors,Working Experience,2021-09-03,4.0,Associate Product Manager,"-Organized company structure 
-Clear responsibility for different department
-Investment teams are normally willing to collaborate with colleagues in other departments and have discussions on the adjustment of investment strategies","-Relatively lower wage for entry level employees compared with other asset managers 
-Bonus accounts for a large proportion of annual payment"
37,Allianz Global Investors,Good company,2021-08-20,5.0,Client Service Representative,Provide suitable career path and reasonable pay,"Changed the CEO, need time to prove future development"
38,Allianz Global Investors,"Great for salary and benefits, big room for improvement for CSR and Diversity and Inclusion",2021-08-16,3.0,Anonymous Employee,"Global, great place to work for salary and benefits, good work-life balance.","Top management not really inspiring, 100% focused on business, old style management practices based on face time culture. Employees do not come first and not even second. Corporate social responsibility currently inexisting. A pity there is no interest in making a positive impact in the society and in the world where we live and operate."
39,Allianz Global Investors,"Engaging, rewarding but undercompensated",2021-08-13,4.0,Associate Portfolio Manager,"People are the best asset. Great culture and offers all the necessary tools, trainings and infrastructure to achieve professional aspirations",Certainly underpaid (relative to peers in same locations and positions) and somewhat outdated internal systems
40,Allianz Global Investors,Very good experience,2021-07-30,5.0,Valuation Intern,"- Quite good environment
- Pretty friendly co-workers
- Promising learning opportunities","Cannot name even one kontras, everything seems quite fantastic"
41,Allianz Global Investors,"Good products, bad culture",2021-07-21,2.0,Associate,"Leadership on my team is great., but corporate HQ being in Frankfurt leads to a major disconnnect.",Don't value lower people too much and don't seem to have employees best interest in mind.
42,Allianz Global Investors,"Great place to work if you like taking ownership and collaborate across borders, cultures and functions",2021-06-29,5.0,Project Manager,"Truly global structures, teams set up across the world, lots of collaboration opportunities and still within a size that you really feel and see the impact of your work.","I don't see any. There is lots of benefits, employee stock purchase programmes, insurance products, pension offers, family service and a work environment where people really want to get stuff done. Not a place for those who prefer a slow pace."
43,Allianz Global Investors,Culture is hypocritical,2021-06-28,2.0,Managing Director,In general very nice colleagues,"Loyal non performers will be rewarded.
CEO is more thank short seighted and lives and forces a hypocritical culture."
44,Allianz Global Investors,Great colleagues and working atmosphere,2021-06-28,5.0,Business Analyst,"-Good corporate culture which really works as a team
-People managers are good and always motivate team members to accomplish our goal
-Provide sufficient training for employee development","-salary increment is slow 
-relatively gard to get promoted
-have night calls if you supports global team"
45,Allianz Global Investors,Active is... driving your business of a cliff.,2021-06-27,1.0,Front Office,Some intelligent people to work with.,Every senior management change over the last 5 years has resulted in a worse replacement. Every replacement has tried increasingly radical (even reckless) methods to turn around the business. Every decision ranges from the peculiar to the downright ridiculous. Some terrible decisions are passive (letting great and vital people leave) and others are active (head scratching promotions).
46,Allianz Global Investors,More focus on the business,2021-06-26,3.0,Assistant Vice-President,Pays good. Good work life balance,Did not come out with any block buster products.
47,Allianz Global Investors,Sustainability Leader,2021-06-25,5.0,Portfolio Manager,Taking a leadership on sustainability. Great colleagues,Could benefit from improving structure to create a better culture. Sometimes the left hand doesn't speak to right.
48,Allianz Global Investors,New management is shocking,2021-06-25,3.0,Associate,"Generally good people, very international environment.",Bureaucratic. New CEO is very poor. Incredibly demotivating and short-sighted
49,Allianz Global Investors,Great Company to Work,2021-06-24,5.0,Technical Support Engineer,Work culture is excellent.Inclusive meritocracy,i dont think there are any cons
50,Allianz Global Investors,Get out whilst you can - unless you're in private markets,2021-06-21,2.0,Equity Research Analyst,Used to be nice people who believed in the firm,The new CEO and CIO have ruined the company culture and have restructured all public markets. They are preparing to be sold or merged.
51,Allianz Global Investors,International employer with a great culture,2021-06-15,5.0,Operational Risk Manager,"Great culture, international colleagues, transparent communication, 
friendly and respectful interaction, trust in employees, open for ideas, work-life balance.","Since everyone gets the chance to be heard, there are sometimes more meetings than planned on some topics. However, this could also be a pro-argument as everyone has the opportunity to express themselves and to be heard."
52,Allianz Global Investors,Overall a very good company,2021-06-07,4.0,Portfolio Manager,Good work-life balance (in most teams). Interesseting tasks. Socially responsible employer. Excellent Reputation,Medium payment. Internal competition more relevant than external. Working in silos.
53,Allianz Global Investors,Good,2021-06-03,3.0,Legal Assistant Intern,"Big Company, many learning opportunities.",each person focuses on their own work.
54,Allianz Global Investors,Agile,2021-06-01,5.0,Semi-senior Accountant,Strong focus on process improvements,Sometimes management decisions could be taken quicker
55,Allianz Global Investors,Salary,2021-05-31,2.0,Associate,"work is normal and smooth, nothing too surprising","pay is pretty subpar compared to competitors, bonus rate is below average, not competitive"
56,Allianz Global Investors,Good working conditions but too hierarchical,2021-05-27,3.0,Anonymous Employee,"Good working conditions, i.e. flex work options, benefits, location","Very hierarchical, not enough diverse, risk adverse"
57,Allianz Global Investors,Not a good place to be,2021-05-26,1.0,Analyst,Relaxed work/ life balance but it is reflected in comp.,Underpays. Germany is the whole focus. Has been going through big changes forever. Currently taking a big gamble with HR and has sold a product to many investors it doesn't really offer due to headcount reductions. Morale goes from bad to worse.
58,Allianz Global Investors,good compensation,2021-05-13,3.0,Client Account Manager,"excellent salary and bonus, very good benefits",weak company culture and possibility to speak up
59,Allianz Global Investors,Great medical benefits,2021-05-07,4.0,Business Analyst,"Medical benefits, 401k great matching",Not much...depends on department but can be longer hours in some and in others there is a balance if you create it. It all depends on what your willing to give.
60,Allianz Global Investors,AGI,2021-05-06,3.0,Senior Programmer Analyst,Comprehensive benefits package and excellent time off policy.,Organization constantly in flux with rolling lay offs over years.
61,Allianz Global Investors,IT Department,2021-04-26,5.0,IT Service Delivery Manager,Great company to work and good working ethnics,nothing at this moment in time
62,Allianz Global Investors,Many good employees leaving,2021-04-22,2.0,Anonymous Employee,"Good benefits, nice colleagues, international environment",Bad management without clear strategy for future of the firm. Nepotism and lack of meritocracy is causing many good employees to leave the firm
63,Allianz Global Investors,Great benefits but not many opportunities for growth,2021-04-20,4.0,Investment Associate,Excellent 401K plan and benefits,Unstable US business caused a lot of layoffs in the last couple of years
64,Allianz Global Investors,buy side associate,2021-04-20,4.0,Associate,"good people, good working hours","below market salary, unmotivated workers"
65,Allianz Global Investors,Faded Glory,2021-04-14,1.0,Asset Manager,Struggling to find something positive,Management does not know how to run an investment business
66,Allianz Global Investors,Great Benefits,2021-04-12,4.0,IT Manager,"Great Benefits Package, Compensation, Culture, People","business model, senior leadership not local, matrixed management organization, upward mobility, opportunities,"
67,Allianz Global Investors,Excellent work-life balance with top-notch benefits,2021-03-26,5.0,Associate,"Overall a great place to work. Great compensation, benefits, company events, etc. They treat you like a person, not an employee. Opportunity to meet people from all over the world.",Sometimes limited career progression (London office)
68,Allianz Global Investors,Vice President,2021-03-25,5.0,Vice President,"Easy job
Good work life balance","Not cutting edge.
Slow pace of work"
69,Allianz Global Investors,Strategic decisions killed the US business,2021-03-19,1.0,Vice President,"Previously a good place to work, no longer","Poor strategic decisions 
Bad management
US business is dead"
70,Allianz Global Investors,Great place to work,2021-03-18,4.0,Anonymous Employee,"- Smart colleagues
- Friendly culture
- Global atmosphere",- Lots of management change recently
71,Allianz Global Investors,good employer,2021-03-10,5.0,Credit Research Analyst,well established asset management institution,transitioning in line with the rest of the sector
72,Allianz Global Investors,Nice Place to work,2021-02-23,4.0,Anonymous Employee,"Great project experience, exposure to deals",Repetitive. Hierarchical. Nothing other than these two
73,Allianz Global Investors,Good employee benefits,2021-02-21,5.0,Anonymous Employee,Treasure interpersonal ties and have good employee benefits,requires proactive attitude and work hard
74,Allianz Global Investors,Average,2021-02-09,4.0,Customer Support Specialist,No delay in salary and bonus;tho it was less,quantity vs quality.Very little time to complete task. and targets are to high
75,Allianz Global Investors,Bad management,2021-02-08,1.0,Portfolio Manager,"Nice people, international environment, good work life balance",Uninspiring management with bad culture
76,Allianz Global Investors,global asset manager,2021-02-07,3.0,Portfolio Manager,leading active asset manager with global footing,resource allocation sometimes is not merit-based
77,Allianz Global Investors,Great company if you’re a chill person,2021-01-27,3.0,Anonymous Employee,"Great company culture, very friendly and supportive team members","Work is not that challenging, too chill."
78,Allianz Global Investors,Great family oriented work place,2021-01-26,5.0,Senior Administrative Assistant,Amazing teams and friendly co-workers,There was a massive layoff after merger.
79,Allianz Global Investors,Great place to work,2021-01-14,5.0,Portfolio Manager,"Great people - thoughtful, supportive and interesting people to work around.
Company is finding its feet again after some personnel changes",A lot of international collaboration can make things complicated. This could be a pro to some
80,Allianz Global Investors,Legal & Compliance,2021-01-12,4.0,Senior Counsel,"very international company. good team spirit, nice office",Less diverse as AGI thinks they are. Especially in the legal department are very similar background is preferred.
81,Allianz Global Investors,Gone downhill in 2020 for US,2020-12-30,3.0,Associate,Flexible working arrangements. Good benefits.,"US business and Americans are looked at less- than the Europeans. The company was a wonderful firm, with great culture and great people. When the new global CEO started, it all changed. Avoid working here."
82,Allianz Global Investors,OK but not much opportunity,2020-12-16,4.0,Internal Audit Manager,"Flexible working arrangement, Value employee","small team, slow career progression"
83,Allianz Global Investors,Allianz Global Investors review,2020-12-03,3.0,Valuation Manager,The colleagues are very bright and driven,Management needs to be innovative to keep its talent pool
84,Allianz Global Investors,"Good company, professional and long term thinking leaders!",2020-11-23,4.0,Anonymous Employee,"Professional environment to work in, nice colleagues",Not the most social office but a nice place to work in general
85,Allianz Global Investors,Great company to work for,2020-11-20,4.0,Business Analyst,Fantastic company who treat employees well.,No significant cons to mention.
86,Allianz Global Investors,US Business Closing,2020-11-16,2.0,Director,Global company encourages cross-regional collaboration,No career development opportunities; all decision made in EU;
87,Allianz Global Investors,na,2020-10-28,4.0,External Wholesaler,good benefits and great 401k matching,lack of direction for overall firm
88,Allianz Global Investors,Leaving San Diego,2020-10-23,3.0,Associate Vice President,"Excellent Benefits, Worklife Balance, Global Firm",Closing US Offices with exception of NYC
89,Allianz Global Investors,Good Place to Start,2020-09-15,3.0,Analyst,Big company with many opportunities for newly grads.,Lack of name reorganization in US. Bureaucratic and lack of directions.
90,Allianz Global Investors,Great company,2020-09-09,4.0,Investor,"Good work life balance, good infrastructure to learn, friendly atmosphere",not much to report on the negative side
91,Allianz Global Investors,Project Manager,2020-08-31,4.0,Vice President,"Work / Life balance, Good Benefits",Limited job growth for advancement
92,Allianz Global Investors,Confusing at times,2020-08-29,4.0,Marketing Manager,Great people. Built long lasting relationships,Organization was constantly being reorganized with people coming and going.
93,Allianz Global Investors,Great collaboration across a talented global team,2020-08-28,5.0,Anonymous Employee,"Friendly colleagues, good collaboration and team work. Emphasis on work life balance.",401k Investment options are limited
94,Allianz Global Investors,lost direction,2020-08-23,1.0,Manager,great benefits. great 401k match,never willing to commit to the United States
95,Allianz Global Investors,Lack of cohesion,2020-08-08,2.0,Anonymous Employee,"Nice people, good resources, good benefits",All strategic and functional decisions are made by management in the EU. The US has very little control oversight on its own processes and local functional. Teams are often managed globally which makes things very inefficient and overly complicated. Consistency is processes is prioritized over efficiency; making the company ineffective and slow to adapt to change.
96,Allianz Global Investors,Business analyst,2020-07-27,4.0,Business Analyst,"Working International company, increasing income, improving my skill, and join to the new network with different nationalities","Language, culture and new country"
97,Allianz Global Investors,lackks direction,2020-07-21,3.0,Distribution,"good work life balance, easy workplace",there is a lack of direction from senior management.
98,Allianz Global Investors,Make sure to learn about the systems in place to be successful.,2020-07-19,3.0,Anonymous Employee,"Global brand recognition and good work life balance, pre-covid.",Lack of industry technology and segment infrastructure.
99,Allianz Global Investors,Very good place to work,2020-07-12,5.0,Assistant Vice President,"Capable people
Truly global company
Quick reacting management
Good atmosphere",Work life balance could have been better
100,Allianz Global Investors,Good people; poor company,2020-07-09,3.0,Administrative Assistant,There are many smart talented and genuinely good people that work at Allianz. The work life balance there is also amazing.,"Poor communication from the top down, constant restructuring and career growth for some can be stagnant."
101,Allianz Global Investors,marketing,2020-07-02,5.0,Vice President Senior Business Leader,good culture and good people,process is not robust and too bespoke.
102,Allianz Global Investors,A good company for starting your career,2020-06-29,3.0,Customer Service Representative,"good salary, flexible program, nice colleagues","too many calls, and sometimes you won't get enough help"
103,Allianz Global Investors,Incompetent people. Bad performing company. No leadership.  No HR.  No IT.,2020-03-29,1.0,Anonymous Employee,"decent hours, nice people, decent benefits","Bad performers that get a free ride for years; most smart workers leave after two years. Bad performing funds and products;
MDs that cant manage funds; no investment in equity research. Leadership lacks direction, strategy, ability and execution;
Lack of decision making, too bureaucratic; HR has no business, thinking or strategy skills; old technology makes work take too long;
Unqualified people get promoted; constant layoffs;  Lower pay then other asset management firms; Favoritism, bullying and discrimination and HR seems to not care"
104,Allianz Global Investors,"poor pay, nice people, good hours.",2020-03-27,3.0,Analyst,"Nice people, good hours but focus is only on alternatives at the expense of the other asset classes.","Focus on the bases. Fixed Income, Equities. There is low feelings in investment and no-one seems to care. You are successful if you are in the favorite group."
