,company,headline,date,overall_rating,author_position,pros,cons
192,Allianz Global Investors,AGI,2016-09-28,2.0,,Decent office location and cafeteria.,"The company doesn't make an effort to keep valuable employees, particularly in investments which is the true product. At the same time, they over spend in marketing and operations."
193,Allianz Global Investors,Dynamic Company,2016-09-27,5.0,Intern,The company has great structure. From the bottom to the top it is in great shape. It really cares about its employees. It also has great co-workers who have great knowledge within the industry.,"There is not really a lot to criticize. Maybe that to some extend that team discussion are to long. To make a specific important decision, it might take three to four meetings until it finally is resulted."
194,Allianz Global Investors,Change is a constant,2016-09-25,3.0,Vice President,"flat hierarchy, great place to be independent and create your own job.",very political place. career opportunities limited - unless you know the right people. Buddy principle very much in place. Organization is build around people not topic / jobs.
195,Allianz Global Investors,poor local leadership,2016-09-20,2.0,Anonymous Employee,Majority of the people are nice; Good resources for work,"Turning into cut-throat hedge fund culture with a below-average mutual fund paid; 
Slow increase in salary and bonus every year; 
Continuing shrinking funds under management;
Low employee morale;   
Overall confusing infrastructure;
Poor local leadership;
New local leadership is lack of transparency"
196,Allianz Global Investors,Great culture,2016-08-30,4.0,Associate,"Solid benefits, flat management, room for growth, strong parent","slow increase in salary and bonus every year, products not performing well in market"
197,Allianz Global Investors,Underwriter,2016-08-15,4.0,,"Great benefits, little micromanagement, professional atmosphere","Mixed messages from department managers, not a lot of room to move up career wise."
198,Allianz Global Investors,analyst,2016-08-13,2.0,,"stable, friendly working environment, work life balance",no upside potentials; seniors are conservative and not very open to new ideas/changes
199,Allianz Global Investors,I enjoy working at Allianz GI,2016-08-09,5.0,Human Resources Systems Expert,"-Global career opportunuities
-Personal development opportunities
-Frendly colleagues
-Competitive salaries
-More and more drivers of innovation and change within Allianz GI",I dont made negative experiences while working here
200,Allianz Global Investors,Manager,2016-08-04,4.0,Manager,"Allianz Global Investors has an excellent company culture and strong values which consist of respect, Integrity, excellence and passion. You can see these values clearly in the people that work at AGI.",Some challenges facing Allianz Global Investors can be seen as they continue to bring the business together from multiple smaller entities to a singles global company.  Though tremendous progress has been the past few years.
201,Allianz Global Investors,Good culture,2016-07-18,4.0,Anonymous Employee,"Nice people, top talent, meritocracy culture",Need to grow faster to provide more opportunities internally
202,Allianz Global Investors,Good Company,2016-07-08,4.0,,"Allianz Global Investors is a good company to work for. Although it's an international company, there's still a sense of community and closeness with employees. It's also a growing company. The company has a decent history, but its final form is yet to be realized. You can still work for a large company, but yet make a difference as if you were working for a smaller firm. This is unique!","Globalization means things can change. The company can change and there's a real sense of downsizing and rightsizing of this company, so expect change. However, the expectation of change is everywhere, not just at Allianz, but in the asset management industry itself."
203,Allianz Global Investors,good work environment,2016-06-29,4.0,Anonymous Employee,"nice benefits, pleasent work environment and good work/life balance","some employees are seen as incompetent by many in the firm, work late hours during busy times"
204,Allianz Global Investors,About the company,2016-06-14,4.0,,"Great corporate culture top down. Clear mission and strategy. Excellent talent retention, diversity, etc. Excellent benefits & pay. Top asset management firm with global footprint and opportunity for mobility.",Can't think of any relevant cons.
205,Allianz Global Investors,Perfect place to work,2016-06-08,1.0,Receptionist,"great environment
perfect location
good benefits
relaxing 
money driven",no opportunities to develop your skills
206,Allianz Global Investors,Operations generalist II,2016-05-09,4.0,,"Great environment, great people, great benefits",Not much room for advancement
207,Allianz Global Investors,Very good company to work for,2016-04-25,4.0,Anonymous Employee,"Benefits are great (401k, health coverage, tuition reimbursement, vacation time, etc.).
Growth opportunities are available.
Friendly environment with a lot of talented employees.","Certain departments do not have internal transparency which frustrates employees within that department.
Although growth opportunities are available, they tend to be filled externally which questions whether internal applicants are applying at all or if the company is not promoting from within.
A company should always retain talent when possible but it is ultimately the responsibility of the employee to grow and apply for those opportunities."
208,Allianz Global Investors,Great People,2016-03-26,3.0,Paralegal,"Never work weekends.  All my coworkers are great people.  Super friendly, helpful and very welcoming to new employees.  The cafeteria is cheap and convenient.","Poor communication and a lot of inefficiencies.  Responsiveness and organization are big problems.  I've been give a lot of pointless, time consuming projects."
209,Allianz Global Investors,Mutual Fund Admin | Executive Administrator,2016-03-02,3.0,Mutual Fund/Executive Administrator,Great learning experience and Mutual Fund group was a great team to work with while I was there.,too many chiefs not enough indians
210,Allianz Global Investors,web designer,2016-03-02,4.0,,very good comany to work fr,nothing is bad for this company
211,Allianz Global Investors,Good company for people willing to work hard,2016-02-11,4.0,Anonymous Employee,"Good compensation in case of extraordinary performance
Nice place to work
Flexible working arrangements possible for people that deliver","Rewards mainly via Bonus, only poor increase of base salary if staying in the same role
Bad car allowance
Very complex set up, changes require approval of many stakeholders - sometimes long decision processes"
212,Allianz Global Investors,Progressive and Efficiency workforce environment,2016-01-25,4.0,,There are many opportunities of reallocation across departments. Workers are very adaptable and maintain a high level of proficiency.,There are not many communications among front office people. Mainly because they have so much work to do on their own.
213,Allianz Global Investors,Excellent place to work,2015-12-29,4.0,Anonymous Employee,"Great benefits - 401k match up to 5% plus 5.4% contribution to pension plan
-great PPO and HMO plans with low cost premiums.
-tuition reimbursement 
- generous vacation accrual and sick time. 
-Lots of opportunity for career growth. 
-Great office location in Newport, right next to Fashion Island 
-people are very friendly and intelligent","-Annual salary increases are below average. 
-Working long hours during peak busy times of the month/season"
214,Allianz Global Investors,"Overall good employer, but heavy interference by internal politics",2015-12-08,3.0,Vice President,"Good canteen, good work / life balance, international exposure, well known brand in Germany. Some colleagues are top notch professionals.","No meritocracy, company values are not lived by many managers. Just the Yes-Sayers are promoted, and many employees are afraid of their managers"
215,Allianz Global Investors,A confusing infrastructure with poor leadership,2015-12-02,3.0,,"Good Benefits
Good work-life balance
Strong parent company","Poor leadership
Confusing infrastructure
Nepotism
Lack of clear marketing and sales goals
Poor communication across groups"
216,Allianz Global Investors,Associate,2015-11-06,4.0,Associate,"- Great 401k + Pension plan
-Awesome subsidized cafeteria
-Global firm with 17 offices around the world
-Numerous strategies that perform well
-Flat management structure
-Lots of room for career growth","-Pay sometimes does not increase consumerate with promotions
-Investment teams have too much power over business management
-weak reputation in the US"
217,Allianz Global Investors,good,2015-10-15,3.0,Worker,it provides the best facilities compared to any other company.,you may be able to get into different domain of working if you are lloking at this job
218,Allianz Global Investors,Sub standard,2015-10-14,1.0,Risk Consultant,Good engineering practices within team,Poor management across entire company
219,Allianz Global Investors,Desktop support,2015-10-08,2.0,Credit Analyst,"Good benefits, great location and nice people",Management doesn't recognize hard work
220,Allianz Global Investors,Decent,2015-10-05,3.0,,Global company with many locations,Career opportunities not that good.
221,Allianz Global Investors,Graduate Program,2015-09-16,4.0,Graduate Program,Very diverse place to work. With people from all parts of the world working together,Interview process is quite challenging especially that for another country
222,Allianz Global Investors,Just another body in a large firm,2015-09-15,2.0,Anonymous Employee,I worked at Allianz Global Investors for about a year and was really excited about the opportunity when I first started. The benefits were pretty good and apparently there were some people happy there...,"However,  as I soon started to see, I really didn't have the opportunity to make an impact or have much say in anything. My entire job revolved around putting together Powerpoint presentations to make executives happy. No real thought process or choice, just plug in numbers to make presentations look a certain way..."
223,Allianz Global Investors,Really good internship,2015-08-08,5.0,Risk Manager Assistant,"Well known and recognized company, Good integration of new workers, interesting work as described in the job description, Munich is a lovely city.","I would have liked discovering even more during my internship, participating to meetings... but it is not easy to give too many responsabilities to an intern."
224,Allianz Global Investors,You are nothing more than a number and a body,2015-07-09,1.0,Technology Executive,Chosen offices have nice amenities.,The portrayed corporate values are for show.  HR is useless for legitimate personnel issues.
225,Allianz Global Investors,Market Analysis,2015-05-15,5.0,Mutual Fund Research,very good life and work balance,less carrier chance in Germany
226,Allianz Global Investors,Hong Kong Internship,2015-05-05,5.0,Summer Intern,Great corporate culture and I learnt a lot on the internship. I was given interesting projects to work on by myself and conducting my own research and presenting these to the team at the end was a useful experience for my future career.,"The internship itself could have had a bit more structure and formal teaching. Much of the time I was working as part of the team and had to learn everything on the job as it was new to me. This was useful, but I feel some structured learning would have been better."
227,Allianz Global Investors,Analyst,2015-04-26,3.0,Anonymous Employee,"nice people, globally respected name to put on a resume","Slow moving internally, bureaucratic, still seems to be trying to find its footing as ""one firm"", the talk and aspirations of senior management are a lot loftier than the reality of day to day life, very little opportunity for internal growth, promotion or movement - it seems that the default choice to fill an open position is to bring in an outsider"
228,Allianz Global Investors,Administration,2015-04-14,3.0,,Great people!!  Everyone at AGI works hard with best interests maintained,The company seeks to be the very best at what they do - not always possible
229,Allianz Global Investors,Complex structure in the US,2015-02-15,4.0,Anonymous Employee,"Global player, diverse asset-classes, new products, centers of competence","Disconnect between business and operations, long-lasting decision making, protectionism from the very south office,"
230,Allianz Global Investors,Very friendly culture and reasonably good pay,2015-02-10,5.0,Summer Intern,Friendly office culture and perfect work-life balance,"Non challenging working atmosphere, seems like people are here to wait for retirement."
231,Allianz Global Investors,Portfolio Manager,2015-01-14,4.0,Portfolio-Manager,"Reasonably good pay and staff friendly environment, quality and value of the fund products are highly acclaimed in Taiwan.","Some demands from the team head, long hours."
232,Allianz Global Investors,Come here to retire,2014-11-28,1.0,Research Analyst,"Work hours, Job security, responsibility.","The company in Hong Kong is very political. Merit doesn't matter. The CIO is not aware of games being played by the next lower level of management. Pay is bottom among asset managers. Promotions are  based on number of years in the company, and slower promotions vs. rest of the companies. Salary increment in promotions is minimal. Internal politics in the investment team is killing all productivity. Head of that team doesn't perform well and shows favoritism without results. There is no accountability in the team, you can be wrong all the time and still continue.
There is no culture of giving more responsibility to people within, so no one is motivated.

Stay away."
233,Allianz Global Investors,Nice boutique asset manager,2014-10-01,4.0,,Culture is very strong and encourages a healthy work/life balance.,Senior leadership could be better. Their hearts are in the right place but they often fail to execute.
234,Allianz Global Investors,Excellent benefits + great enviroment,2014-09-12,4.0,Associate,"Awesome benefits 410k and pension
Large asset manager 500 WAUM and other half of Allianz Asset Management w/ PIMCO",Bagels every monrning not just friday
235,Allianz Global Investors,A place to be,2014-07-13,5.0,Sales,"A great work environment, real work life balance (a day care centre in the building), competitive compensation, global reach, and a strong parent company. Strong values. Strong and visionary senior management, and excellent career development for talents. The list goes on and on!",Unnecessary hierarchy and a little conservative. But nothing major. Management working on streamlining it.
236,Allianz Global Investors,Large firm with various opportunities,2014-07-07,4.0,Financial Analyst II,"-Allianz as a whole is a very large firm with many international opportunities.
-In the Newport Beach office you have the opportunity to work alongside PIMCO management.
-Excellent Financial benefits (generous 401K matching, ESPP, institutional shares)
-Flexible work hours","-Long work hours during the busy seasons (Quarterly-Close, Summers, and Year-end-Close)
-Annual Bonus and Merit Increases are lacking"
237,Allianz Global Investors,Overall good company if you're not driven by salary,2014-04-29,2.0,Anonymous Employee,"The people are great, there are advancement opportunities, the management is fair in areas they can control, the work is very interesting.","The hiring salary is fair. But the increases, especially for promotions, are CRAP. Sometimes, they don't give any salary adjustment for upward movement/transfers.  Many disgruntled transfers because you don't learn about the salary adjustment or lack thereof, until AFTER you've already expressed interest in a position.  How does it look if you turn it down because of the little/no money after you've sold yourself on being excited to join the new team?  Then, because we are all told not to discuss salary with peers, the cycle continues.  
I feel bad for all the people I've seen move jobs excited about a higher level position only to see them disappointed to learn of the very small promotion increase in salary. This needs to be fixed."
238,Allianz Global Investors,"Low pay, little room for growth",2014-01-06,2.0,Analyst,"Great employee benefits, great office location.","Pay is below industry standards, not enough room for growth"
239,Allianz Global Investors,"Great reputation and stable business, new product development improving",2013-12-11,4.0,Portfolio Manager,"Compensation, work life balance, global outlook","Too big, too many superfluous layers, sometimes slow to respond to market changes"
240,Allianz Global Investors,"Great colleagues who are very supportive and approachable, who encourages inquisitiveness.",2013-11-19,4.0,,"Friendly work environment, weekly company presentations which you could attend to meet other colleagues and to learn more about the firm.",There is no negative experience in working
241,Allianz Global Investors,Solid company,2013-11-08,3.0,Director,"Good product portfolio, strong on the institutional and retail side",Not diversified in geographic terms
242,Allianz Global Investors,Interesting,2013-10-25,3.0,Portfolio Manager,"Salary, Working hours, Colleagues, Location","Atmosphere, Content, Managers, IT, Salary"
243,Allianz Global Investors,Working environment has deteriorated.,2013-09-27,1.0,Manager,Smart people who used to care about the work being done.,"Since the company started managing everything from the global headquarters the region has lost functionality, reduced the quality of output, and discouraged independent thinking.   Regional offices have little control over anything now and employee morale is at an all time low in all the years I've been there.  Everyone has given up, and is just punching a clock in and out."
244,Allianz Global Investors,Previously worked at Nicholas Applegate. Was Awesome. Now Allianz (AGIC) has taken turn for the worse.,2013-08-20,3.0,Operations Associate,"- Very elite firm. Class A office space high in the sky of San Diego. (Floors 29-34)
- Lots of excellent and valuable people here. (but many just got laid off recently)
- Very high tenure (many people had stayed for 10+ yrs... some 20+)
- Good pay. Maybe not top pay, but not lousy either.
- Excellent benefits all around.","- Big wigs of upper Management don't understand the value of their people. They outsourced their best of the best in class Operations group. That was a poor decision.
- They don't pay for employee parking on site. $190/mo. Like seriously wtf?
- When it was Nicholas Applegate, there were a lot of great things to say about this company when Marna Whittington was the CEO. She was supremely top class. New senior management has come in and done the tired old cliche of ""re-organizing"" a great (and highly profitable btw) operation."
245,Allianz Global Investors,"Very active, but limited expansion.",2013-07-22,4.0,Anonymous Employee,"Great benefits, great  location (San Diego), great work life balance.  The company does a great job at giving all the resources and learning opportunities to employees.  The office is full of very capable and intelligent employees.","Limited mobility as the company is somewhat top heavy.  Many managers due to expansion and contraction over the years.  The stress level of the office, obviously, ebbs and flows with the tides of the market."
246,Allianz Global Investors,Good company,2013-07-12,4.0,Anonymous Employee,"As a German AM, promising development.","Complicated organizational structure, too conservative."
247,Allianz Global Investors,Stable but frustrating,2013-05-11,2.0,Asset Management,"Stable, solid platform.
Access to sellside, systems, etc. is good.
Also ok to travel.
Mild, comfortable atmosphere.
Good for a German to internationalize.
OK for an intern/junior to learn (although Tier 1 firms even better).","Politics are widespread. Decisions making is slow and often nonsensical...unless it's due to politics. This also makes it bureaucratic.
Comp isn't great either. Lots of valuable senior people end up leaving. It's moving more and more towards pay-for-performance, but it's still early days. Upside seems limited by culture/German civil servant attitude though.
It's not considered Tier 1 among asset managers (which might surprise them).
Very limited interaction among investment teams.
Pimco (sister co) reputation looms large..."
248,Allianz Global Investors,Too many managers patting each other on each others backs for having a great meeting(especially among AGI).,2013-03-29,2.0,Anonymous Employee,"Salary, medical benefits, coworkers, locations, vacation allowance","50/50 of good and bad mangers.
Procedures and decision making are inefficient."
249,Allianz Global Investors,AGI,2013-02-25,2.0,,There is a strong product line up,the organization has terrible communication across departments
250,Allianz Global Investors,Company ruined by merger,2013-02-22,2.0,Marketing Support,"Some good people work there, benefits and pay are good.","Allianz purchased Oppenheimer Capital in New York, NFJ in Dallas, and Nicholas-Applegate in San Diego and merged them together. After the CEO from New York took over, the company went right downhill. People were indiscriminately laid off, despite performance. Financial products with excellent performance were closed, while products that haven't beat their benchmark in months were kept open. It was very obvious that the CEO wanted to protect jobs in New York, and sacrifice everyone else."
251,Allianz Global Investors,"Good company, bad management, off course in San Diego",2012-10-31,3.0,Anonymous Employee,Benefits are awesome; some advancement oissible. Coworkers are great. Can be a good learning experience. The office is nice and has a gym.,Management doesn't make a decision easily...ever. Things get done by committee; achievements not always appreciated.You can get pidgeonholed and then frustrated. Too much politics.
252,Allianz Global Investors,"Allianz Global Investors is the red-headed stepchild next to the favored son, Pimco!",2012-06-23,1.0,Vice President,Global brand and name recognition. Institutional heft when dealing with the sell-side. Generous pension and health benefits.,Horrible senior management. Lack of vision and imagination on the part of senior management. The senior management of Allianz SE don't understand how to build a strong global asset management business.
253,Allianz Global Investors,Great opportunity to work in a prestigious financial environment.,2012-02-23,4.0,Data Analyst,Firm is know world wide. They have a strong balance sheet and run a wide variety of businesses. People there were very friendly.,May not be as well know in the United States and therefore you may not get the type of recognition one may be looking for.
254,Allianz Global Investors,"If you're looking for career growth, this is not the place",2011-12-14,1.0,,"Decent vacation days, good health benefits, people aren't in your personal business. Fairly young crowd. Work hours stick to a 9-5 parameter.","Internal job postings are for show, they prefer outside candidates. If you're not upper management, your opinion doesn't count. Each department is its own fiefdom & there's no office integration nor unity."
255,Allianz Global Investors,Good company if you are a German willing to get international exposure,2011-09-14,4.0,,"Global reach, strong brand, increasingly international staff, diversity of careers to take, international opportunities",German part of the organisation still needs to do a better job in rewarding smart hard working people and excellence rather than tenure.
256,Allianz Global Investors,I would recommend anyone to work at Allianz. The company has made a dedicated choice in building our business.,2011-04-13,4.0,,"People, Management, Idea sharing, Growth potential, Structure",Product diversity into the fixed income arena
257,Allianz Global Investors,great company to work for,2011-02-22,4.0,,"-surrounded by smart people, very friendly and helpful",- IT could do a better job
258,Allianz Global Investors,generally a positive place to be,2011-02-19,3.0,,Firm is focused on growing their business and have some very good investment portfolios,Similar to all other large financial services firms with lots of politics and favoritism
259,Allianz Global Investors,A good place to start a carreer,2010-01-02,4.0,Associate,Large Company. Good pay. Very International,too hierarchical. the evolution paths are too restricted
