,company,headline,date,overall_rating,author_position,pros,cons
198,Dimensional Fund Advisors,Interesting transition period,2016-05-30,2.0,Regional Director,"very successful and strong brand, place to be in if you want to see academic rigor get translated into investment solutions, about to become a corporate firm, global opportunities","very sleepy, occasionally overwhelmed and biased management, employees are seen to be a commodity, leadership team seems not always to be on the same page, has not arrived in the digital age yet, very political environment, the strong value system that made it successful started collapsing, everyone is struggling to make decisions, very centralized and controlling"
199,Dimensional Fund Advisors,Meh.,2016-05-29,3.0,,"Great people, lots of camaraderie and talent.
Smart People, focused on clients.
Still has the feel of a small, close knit company.
Good work life balance.","Leadership/management is opaque, not very dynamic.
Compensation structure isn't clear and is inconsistently applied.
Compensation is below market average for skills and responsibilities required.
Firm is still run like a small company, but no longer is .  This introduces a political dynamic, as senior management still wants to call all of the shots and won't trust their management teams to make sound business decisions."
200,Dimensional Fund Advisors,Stifling Micromanagement,2016-04-23,1.0,Anonymous Employee,highly educated workforce; good salary,"highly educated people with many years of experience get micromanaged which results in fear of making any decisions at all; high turnover in many departments; least cheerful work environment I've ever been exposed to; no flextime for most employees; no business casual dress or jeans Fridays; leadership by fear in the legal department; work environment will not change unless the top managers are willing to address the cause of the retention problems in various departments, i.e. the inability to manage people well and effectively"
201,Dimensional Fund Advisors,Great,2016-04-12,5.0,Senior Associate,Good group of people to work with.  The Clients are engagement.  People care what you have to say and listen,Sometimes can be slower paced at certain times.  Tough to keep younger workers focused on how great the work life balance is.
202,Dimensional Fund Advisors,Micro Management,2016-03-30,1.0,,"Good work life balance
Not in downtown Austin","Micro management
No performance review. They call it talent talk but this equals to nothing
No exposure if you are not in the right position
Managers hog all the important projects
Promotion not transparent at all"
203,Dimensional Fund Advisors,Sales,2016-02-19,3.0,Regional Director,"Surrounded by smart, capable people.  Emphasis on doing right by our clients.  Well documented philosophy and process for building portfolios makes it easy to discuss with clients.","Tendency towards micro-management from the highest levels of the firm.  No transparency on comp, which is below industry avg.  Political promotions far outstrip merit-based promotions.   Senior leaders are very smart and capable, but are not strong businessman.  Need to hire a real CEO who knows how to run a business and deal with people.  Many opportunities to build positive morale are overlooked (celebrate a milestone by having a 1 hour happy hour on Friday at 5pm?  Why not do it at 3pm and let people go home a bit early?  Costs you nothing, but employees are thrilled!)"
204,Dimensional Fund Advisors,"A good firm in theory, not so much in practice.",2016-02-13,1.0,,Strong intellectual baggage. Good people up to the level below senior management. Good story for the financial advisory community (e.g. high quality conferences for advisors).,"Weak leadership, in particular from the new generation (e.g. new co-CEO / co-CIO). Too much centralisation from the head office in Austin, Texas. No transparency in promotions. No transparency in total compensation. Story does not add up for the institutional community (e.g. markets are not efficient)."
205,Dimensional Fund Advisors,Accountant,2016-01-24,1.0,Accountant,Prestigious and intelligent company to work for.  Great benefits.,"Management too easily looks away or even allows upper management to badger their employees and create hostile intimidating environments.  if you weren't in the clique, then you don't get promoted.  Bonuses were mediocre and raises ranged about only 2%"
206,Dimensional Fund Advisors,Senior Associate,2015-12-31,5.0,Anonymous Employee,Dimensional is an ethical company who puts clients first.,It would be difficult to work for another asset manager after working for Dimensional because Dimensional does a great job for clients.
207,Dimensional Fund Advisors,Decent job,2015-11-18,4.0,Research Associate,"This was the best dead end job I ever had. The work was easy, the benefits were good, nothing was too stressful.",It got really boring after I learned how to do my job and there wasn't much incentive to take on additional responsibility. Not very much room for growth. The only way to move up is to have an MBA or PhD and then move into a client facing role. Only sales is really valued.
208,Dimensional Fund Advisors,Frustrating as hell,2015-10-22,1.0,,"Plenty of smart, capable people who want to do well for the firm's clients and for the firm","Political environment is awful. Wealth is highly concentrated - chairman makes more than $150 million & Co-Ceo more than $20 million p.a.  ""Merit increases"" are between 1.5-3% (i.e. inflation) and ""merit bonuses"" are fixed % targets regardless of contribution. They intentionally hire at lower half of industry comp because ""Dimensional is such a great work environment.""  You have to fight for everything - even the best ideas are assumed to be wrong/stupid if they don't originate from a handful of people, in which case they are assumed to be brilliant/gospel."
209,Dimensional Fund Advisors,"Great Ideas, Great Execution, Horrid Company",2015-10-21,1.0,Anonymous Employee,"- Great brand reputation
- Products are solid in terms of low cost and investor focus
- Nice office building and cafeteria
- Above market-rate compensation","- Very distracting office layout
- Horridly political/back-stabbing co-workers. 
- No feedback to employees in any place in the system
- Value face-time over actual work performed"
210,Dimensional Fund Advisors,"Honest to a fault company, but stagnant and low wages",2015-10-17,2.0,Anonymous Employee,"Company is honest to a fault. Their index products are very low fees and arguably have better exposure to the market factors that produce outsized returns over time.

It is run extremely efficiently, a lean company, and costs are cut ruthlessly to ensure investors pay low fees.","Not a good place to start work if you have ideals for change and want to make significant impact. Not entrepreneurial and discourages creativity. Financial advisers were recently over-hired and so there is lack of meaningful work to go around. Portfolio management is a misnomer, call it glorified operational management doing repetitive tasks. 

Salaries are below industry average, especially at the portfolio management level or post-MBA level (150k). Bonuses effectively nonexistent. Nearly impossible to advance to middle management without an MBA."
211,Dimensional Fund Advisors,Dimensional Fund Advisors,2015-08-17,2.0,,smart likable people at the bottom,"political, finger pointing, game playing"
212,Dimensional Fund Advisors,Great place to be,2015-08-10,5.0,Senior Management,"So many smart and talented people, the most beautiful offices I've ever worked in, huge focus to grow globally and in the US (opening Charlotte NC East Coast office this year), winning in the marketplace and consistently gathering client assets, unique and ethical business approach with advisors and clients, great brand reputation in the market.","Growing too quickly has had its challenges, co-CEO structure is a bit awkward, wearing suits and ties is a challenge (especially in the Austin Texas summer heat)-although the professional environment is unique these days, internal communication could be better, health benefits and 401K matching could be higher."
213,Dimensional Fund Advisors,Associate,2015-08-02,4.0,,"People, location, workload, building, international company","Communication, location, workload, some people"
214,Dimensional Fund Advisors,Company with No Corporate Values,2015-07-27,2.0,,Good approach to managing  money and investing,No Corporate Values.  Poor morale
215,Dimensional Fund Advisors,Associate,2015-07-23,2.0,Sales Associate,"Lots of qualified, friendly, intelligent people to work alongside. Competitive, good work-life balance","Promotion structure defies logic; Would rather hire over existing employees than promote within.  Many will take the job due the great perks, beautiful office and great track record. But there is great turnover in all groups when you realize politics, not perfomance matters most."
216,Dimensional Fund Advisors,"Good for some positions, not for others.",2015-07-23,3.0,Anonymous Employee,"The company is solid and growing.  The sales and trading groups have good salaries, bonuses, and recognition.","However, the support organizations like IT, office admin, etc. Lack the recognition, raises, and appreciation.  Choose a company that values the support groups."
217,Dimensional Fund Advisors,Addams family,2015-07-18,1.0,Operations,"Good colleagues mostly, good transport links","One of the reviews here said that Dimensional treats employees like family. Ye right... if you want to talk about a family, it was more like the Addams family. Seriously. 

They're creepy and they're kooky, 
Mysterious and spooky, 
They're all together ooky, 
The Addams Family.

Sometimes it was nearly as bad as the Manson family since it was boardering on a cult. Not kidding. It was like a cult."
218,Dimensional Fund Advisors,Summer Intern,2015-07-08,4.0,Summer Analyst,"Great work environment, in a cool location on the beach in Santa Monica CA. Really nice people, very cool work environment. Lots of effort put into employee development","Lots of grunt work in VBA and SQL, skills are not very transferable. The work is not terribly interesting although the overarching strategies are. The compensation is not that competitive. This is partially offset by a great work life balance."
219,Dimensional Fund Advisors,Former employee,2015-07-03,1.0,Anonymous Employee,"Great investment philosophy but people here believe in it like its a religion. Food in the building is good, benefits are okay as well.","-Management is terrible, very political and play favorites. They will be passive aggressive, slowly isolate you if they don't think youre toeing the line, dont value employee development much.

-The pay here used to be good, now it sucks. Associates/Analysts get paid poorly, as does anyone promoted within. Only way to get paid well here is to come in as RD or PM from elsewhere.If they can take advantage of you somewhere they will. Oh and Austin isn't that cheap, if you don't believe me check housing prices. Pay increases in record years were nonexistent, bonuses are shrinking and they will probably eliminate one of the twice-yearly bonuses soon.

-Hours are terrible in PM, IAD but good in FAS. You dont learn much anywhere after the first couple months, everything is task oriented because they want you to be as replaceable as possible. Development is not a priority here.

-Austin is a tiny city. Thats how they lock in a lot of people, by moving them to a city where they dont rub elbows with any finance people. If you dont get promoted or get a pay bump, you cant walk down the street to a different firm like in a real city.

-David Booth and Eduardo Repetto. Booth has done a brilliant job of taking research and making himself money off of it, then touting some higher purpose. Higher purpose isnt making hundreds of millions of dollars a year in dividends while nickel and diming employees. Eduardo is alright but is really abrasive, he doesn't inspire confidence and regularly yells at employees in public. 

-Everyone who hasn't been here for a long time wants to leave or will leave if they ever got decent offers.

-If you dont believe in the investment philosophy completely, which is ludicrous since finance is not physics and thus has no absolutes, you wont fit in with the cult. 

-Oversraffed and underpaid sums up a lot of this.

Want money? Go elsewhere. 
Want career opportunities? Go elsewhere.
Want to develop a good foundation for future opportunity? Go elsewhere. 

Want to get paid ok money and have good time to spend outside of work in some departments in a small city? Come here"
220,Dimensional Fund Advisors,Regional Director,2015-07-02,3.0,,They pay very well and never have layoffs.,The company is highly political and does not promote based on merit.
221,Dimensional Fund Advisors,Great place to work,2015-06-24,4.0,,Great benefits and staff...location is amazing....the office is beautiful,Hot summers and dress code could be better for non-client facing employees
222,Dimensional Fund Advisors,DFA,2015-05-13,2.0,Anonymous Employee,"Nice people, if in sales quality of life pretty good.  In other dept PM, Research it is horrible","Complete disconnect on who does the work and who gets rewarded.  Everything is sales driven.  Can't sell, don't bother coming in.  Comp well below market.  Mass exodus already starting as upper management benchmarks raises at 1-2% as the firm is growing 15-20% in revenue and profits per year"
223,Dimensional Fund Advisors,Associate,2015-04-30,1.0,,"-Great state of the art facilities. Update with all the technology.
-Everyone in the client services group is a people person (These are sales guys)
-Free drinks and coffee","-Management is horrible and do no treat some of their employees right. This was multiple managers
-There are tons of favoritism. 
-Culture is much different from Austin to Santa Monica Office.
-There was a clear HR violation in regards to pay and VP said it was just how it is. HR found out and there were no violations said."
224,Dimensional Fund Advisors,Pros and Cons,2015-04-06,3.0,,"Great facilities, clever people, solid continued growth of the company, great investment philisophy","Silo mentality, small-company drawbacks, career path"
225,Dimensional Fund Advisors,Great company,2015-01-30,4.0,Associate,"Intellectual stimulation, smart people, great office locations.",If you don't buy into the investment philosophy then you're in the wrong place.
226,Dimensional Fund Advisors,"Good starting salaries, not great if you actually want a career...",2015-01-28,1.0,Anonymous Employee,"-Nice office
-Relatively easy interview/to get hired initially if you have a good academic background (solid degree subject, top uni)","-Poor personal growth ops...in reality as a junior you are going nowhere slowly
-Without an MBA (pref Chicago), you have very little/no chance of ever making it to the top, or anywhere even close
-Pay progression is not good (and frankly nor should it be - job is really easy/simple in reality if you are good)
-Basically they hire academically smart, hardworking people who can output what is quite easy, boring work without errors, glorified secretaries in essence. So little development/personal satisfaction it’s incredible."
227,Dimensional Fund Advisors,"Long term employee who experienced numerous executive and managerial changes, and one office move.",2015-01-20,2.0,Manager,"Friendly people, 
nice office, 
opportunities to travel,
growing emphasis on supporting entry-level staff.","Poor compensation,
poor work/life balance,
most aspects of work dictated from Austin HQ, 
micromanagement rife within all departments of the company, 
jobs becoming more specialised, 
few opportunities for progression as more senior hires made compared to internal progression, 
overbearing management requires all employees to learn history of the company for little commercial merit - treated like being back at school, 
few resources for professional development (e.g. qualifications). Expect to have an MBA to progress in any department in the company,"
228,Dimensional Fund Advisors,It was like working in a cult!,2015-01-05,1.0,Investment,"- Working hours are very good
- Atmosphere is relaxed","- Ineffective management structure
- No professional or personal growth
- Poor quality work
- Very little responsibility given
- No opportunities for initiative or distinction
- Lack of options outside DFA
- Compensation is good for job, but low compared to industry
- Office was like a cult - you are not allowed to have your own opinion, you must learn the market efficiency beliefs (which is fine), but you have to speak in a certain way and are only allowed to answer client questions with approved answers which you memorize .... no need to think for yourself!"
229,Dimensional Fund Advisors,Cares About Their Employees,2014-11-21,5.0,,"Unlike many organizations, this one considers their employees to be a family.  They nurture you and reward you.  The only reason I left is due to the fact that they moved their headquarters out of state.",They moved out of state.
230,Dimensional Fund Advisors,It doesn't 2.3 stars for nothing,2014-11-06,1.0,Senior Associate,Base pay is higher than industry average. Great Austin office with free soft drinks.,You pay for that higher salary. The culture is one of finger pointing and CYA. Toxic with a high turn over rate.
231,Dimensional Fund Advisors,"Extremely successful company, great people, lots of opportunity.",2014-08-11,5.0,Anonymous Employee,"There are so many intelligent people in one place, lots of people to learn from.
The company really cares about its employees. The benefits are great, there are lots of activities throughout the year that are fun and over-the-top (holiday party). The office is exquisite, the people are great. My team had a great attitude, and everyone seems to be hard working but never too stressed. The work-life balance is good, they never require you to stay over-time and there are always enough people so that no one is over worked. 
The cafeteria is by far the best in town. 
Pay is high and fair, the training is really thorough. There are many training and learning opportunities throughout the year where you can participate during your work day to further your education in the field. These are great to take advantage of.","There is little cross-over between departments. Sometimes as a worker in one department you feel closed off from the since they are on different floors. It does make for a close team, though."
232,Dimensional Fund Advisors,Despicable Company - should be shut down,2014-07-10,1.0,Anonymous Employee,"If you are a corporate psychopath you will fit in nicely with the management, who are nasty, pure and simple","The best people in this company are either sidelined or pushed out by a nasty little bunch of long time employees. The CEO stands charged of either being unaware of this or else condoning this, either way guilty as charged. If this was a publicly traded company the shareholders would have forced out the current management (globally) a long time ago. Getting rid of the London CEO was a good idea at the time but nothing has changed unfortunately. 

ps: some of the reviews here are positive PR from HR, such as ""nice place to work"", ""great company to work for"" etc. I know that for a fact. When a HR department of a company has to revert to writing their own reviews on Glassdoor it's a shocking indictment of the company."
233,Dimensional Fund Advisors,Great if you're a Chicago MBA,2014-07-03,3.0,Anonymous Employee,"A percentage of your annual salary went into a bonus and the rest into your DFA 401k, which was very nice.  But 3% of $18,000 ain't much.  I didn't have a degree and worked my way up (a tiny bit) from a bagel toaster technician and coffee maker to the mail room to a very junior Marketing position.  I asked a lot of questions and learned an awful lot about asset allocation and diversification. Plus I had access to a lot of software that I learned and took to my future jobs. The experience helped me a great deal.","Academic is putting it lightly.  Unless you had an MBA from that school without a football team, your only other way in was through fall-back choices like Harvard, Yale, etc.  Many undergrads I worked with acted as if getting hired meant their work in life was over and they were semi-retired. And management let them get away with it. Not wearing a necktie was looked upon as if I'd joined ISIS, even though I never, ever met a client. Some PMs were patient and helped me learn, others were NASA-types and acted like I was scum. Be prepared for endless gym talk and frat boy mentality."
234,Dimensional Fund Advisors,Avoid at all costs,2014-06-30,1.0,Anonymous Employee,"The pay is high compared to other fund managers
The office is nice
Easy to travel to London Office
Benefits good","Politics in the office 
Only sales seen as important
Cult environment
Unable to make any decisions unless you are in US
All heads of department are US
Would rather employ someone from US than get someone with local knowledge
Only look after those that they like is definitely a popularity contest
Low holiday entitlement"
235,Dimensional Fund Advisors,knowing yourself first!,2014-06-16,3.0,Senior Associate,"a typical financial company, it's easy to find your place here if you have:
1) connection to the top in this company; whether through personal or suck up to the top
2) ability to bring in money","you will have hard time understanding company's decisions if :
1) you do not understand money
2) you do not want to participate in the game"
236,Dimensional Fund Advisors,Decent private firm with a focus on client satisfaction.,2014-02-04,4.0,Anonymous Employee,"The pros of this company definitely lie with the compensation and benefits. As a private firm they offer above average health insurance and salary; 401(k) match up to 5%, gym reimbursement, great health insurance. Additionally, all the locations of the firm are excellent work locations and they are located and available in all parts of the world, and there is always an opportunity to transfer to any pf the locations.","The cons come mostly if you are not a finance/economic person, basically if you don't buy into the money first culture of a private funds firm, then this might not be the place for you. 
The culture is definitely money dominated, which for me was always a problem. Also, as the company has expanded, the focus on client satisfaction is also a bit of a problem as it drives the employee satisfaction lower."
237,Dimensional Fund Advisors,Not a good move if you are not in sales,2014-01-28,2.0,Anonymous Employee,"Beautiful building, good pay, nice perks",No career path if not in sales or research
238,Dimensional Fund Advisors,"Interesting, challenging and fun.",2013-12-05,4.0,,"People, strong academic research and good work ethic.
Hold annual summer and Holiday party. 
Nice offices with reasonable facilities.",Easy for opinions to be ignored.
239,Dimensional Fund Advisors,"Used to be an enjoyable place to work, but the morale has gone down quite a bit.",2013-12-04,1.0,Senior Associate,"Good pay and benefits, smart employees, beautiful building facilities, living in Austin","This company used to do more internal promotions, but has changed. They have been hiring a lot of external candidates and providing little to no career development for current employees. Since Eduardo took over, the company has been micromanaged from the top down. At all levels, people feel they cannot or do not have the authority to make decisions without his input. Yet he has no background/experience in marketing, management, sales, etc.
The company monitors who gets to work by 8am and who doesn't. Not that other companies don't, but this company only seems to care about what time you arrive, not that you put in a full day's work."
240,Dimensional Fund Advisors,Intern,2013-12-02,4.0,,"Everyone is bright, fun to be around, and overall good people",Apparent tension between management and employees regarding corporatizing the company
241,Dimensional Fund Advisors,Worst Management I have ever seen,2013-11-12,1.0,Anonymous Employee,"Peers are nice, however they can't keep good people, one year is a long time there.","Too much politics, Managers don't know how to manage, People come and go"
242,Dimensional Fund Advisors,Great if you are an investment professional.  Everything else...not so much,2013-10-29,3.0,Anonymous Employee,"Best product set and philosophy in the industry
Incredibly smart people, with Nobel laureates regularly in house
Dedication to client service in the sales groups
Entrepreneurship is encouraged
Beautiful office","Few (if any) long-term career paths--senior leaders are lifers
No internal respect for marketing or technology, which makes culture there miserable
Zero employee focus beyond tepid and frequently ignored HR efforts
Despite academic environment there is a hostility to debate and questioning of authority"
