,company,headline,date,overall_rating,author_position,pros,cons
0,Dimensional Fund Advisors,Review Headline,2022-04-23,5.0,Anonymous Employee,"- Great work life balance
- Smart people",- sometimes takes too long to make decisions
1,Dimensional Fund Advisors,Used to be good … not anymore,2022-04-17,2.0,Sr. Associate,"Not much anymore. Used to be a good IT organization in the company. 
As a business they stick to the academic principles the company is founded on.","Directionless IT organization. The IT mgmt is pretty haphazard. Many instances of knee jerk reaction by IT mgmt. 
People are leaving left and right. IT is at least 5 years behind in terms of technology and processes. IT folks have low morale. 

Lot of lip service is given to concerns raised by employees but nothing is actually done."
2,Dimensional Fund Advisors,Tenure over talent,2022-04-08,3.0,Business Operations Associate,Workplace environment and perks are superb.,Promotion schedule is based on tenure over performance.
3,Dimensional Fund Advisors,The People are Great,2022-04-07,4.0,Analyst,the people are wonderful and the office environment is amazing,finding a clear career path is very challenging - you may put in a lot of effort with little to look forward to
4,Dimensional Fund Advisors,Not for a career in finance,2022-04-02,3.0,Investment Analytics and Data,"Friendly colleagues, work-life balance, generous PTO","For IAD: If you are thinking about working on industry/company research and valuation models, this is not the place for you. IAD folks are much more like software engineers and database managers who maintain or streamline existing data processes where the new streamline work barely affects investment outcome at all.

For the company: The morale is low and clients are pulling out money due to the poorly performing factor investment strategy. We underperformed the market regardless of whether the market was in good or bad condition. The company is so stuck on the one ""true"" investment philosophy as if it is the one true God."
5,Dimensional Fund Advisors,"Boring Work, Great Work-Life Balance and Benefits",2022-03-30,4.0,Associate,"- great work-life balance
- great benefits and in-house dining options
- smart employees","- slow to adapt to change
- work can be very repetitive, unfulfilling, and boring"
6,Dimensional Fund Advisors,"Great work life balance, not exciting work",2022-03-22,4.0,Research Analyst,"1. great work life balance, no overtime 
2. nice culture, very collaborative.","1. the work is kind of repetitive and not exciting
2. the research part is not in depth 
3. not very technical"
7,Dimensional Fund Advisors,Portfolio Management,2022-03-16,4.0,Analyst,"Good team, smart people. Generally non toxic amicable collaborative environment.",Pay and rigid investment philosophy that doesnt change
8,Dimensional Fund Advisors,Company review,2022-03-12,5.0,Anonymous Employee,"Opportunities to work across developed markets, programming responsibilities.",Transition for senior roles takes a good amount of time.
9,Dimensional Fund Advisors,Good place to work,2022-03-11,4.0,Vice President,"Job security, work life balance","Deliberate, organization is strategically conservative"
10,Dimensional Fund Advisors,Notes,2022-03-06,4.0,Associate,"- Great work/life balance for investment management 
- You work with friendly, intelligent individuals
- World class investment solutions",- Niche investment approach that doesn't perfectly translate to other opportunities in finance
11,Dimensional Fund Advisors,Good Place to Work,2022-02-19,4.0,Associate,"Good people, work can be engaging,","Diverse work, could be more ambitious in some ways."
12,Dimensional Fund Advisors,They need to get with the times,2022-02-14,2.0,Associate,Chef Jim makes great food.,"No work from home flexibility 
Just let us know that we are going back into the office even though we are still in stage 5 for Covid. Not a good look."
13,Dimensional Fund Advisors,Great people and environment,2022-02-08,4.0,Associate,"Competitive pay, benefits, education, room for growth.","Any cons I can think of are too specific to me, and overall this is a great place to work."
14,Dimensional Fund Advisors,Very cut throat,2022-02-03,3.0,Sales Associate,"Beautiful office, great location, amazing cafeteria.",Elitist people coming from the top schools. Lots of undercutting and climbing on.
15,Dimensional Fund Advisors,Depends on Manager,2022-02-02,3.0,Anonymous Employee,Beautiful work environment only if you are in Building One. Great perks.,"They say they want you to help with building career and skills but I found that not to be true. Also, depends on your manager - some are flexible with being able to work at home when sick, etc. but don't expect it. They are old fashioned and like people present exactly at 8am through 5pm. I hope they realize that employees need more flexibility."
16,Dimensional Fund Advisors,DFA,2022-02-01,4.0,Analyst,"Great culture, great people, awesome location, great office, great work life balance","Inability to adjust to market prices or salaries, no promotion structure for younger employees"
17,Dimensional Fund Advisors,bob,2022-01-29,5.0,Software Engineer,Allow exposure to money markets,Not accessible to every day retail
18,Dimensional Fund Advisors,Nothing amazing,2022-01-04,2.0,Manager,"Good on-site restaurant, cheap meals, great facilities. People are generally good, especially on sales side.","They haven’t adapted to WFH culture and are not willing to budge on in-office requirements. Very low pay relative to industry - if you are 1-5 yrs out of college, you’ll be underpaid vs peers. If you come up within the company, you’ll be underpaid vs peers that are hired into DFA at your level. Extremely political between departments, particularly Investment Solutions, Marketing, and Technology. Not willing to work with sales to grow business, they just want to protect their fiefdoms. Not willing to change with the times, people that are lifers are protected, and don’t do much for the newer employees. 

Investment thesis has become incredibly boring and probably won’t change in the next century. DFA will still be profitable, but you won’t see any of that unless you’re a founder.

2 week parental leave if you’re not the one that gives birth - that’s not even a joke, that’s just sad."
19,Dimensional Fund Advisors,Good companh,2021-12-29,5.0,Anonymous Employee,Good people and good work culture,Need to work from the office 3 days a week
20,Dimensional Fund Advisors,Great place to start a career,2021-12-03,4.0,Regional Director,Rigorous academic approach and intellectually honest perspective,"Pay is far below market, many great people have left because of this; lots of tenured professionals waiting to cash in on their stock"
21,Dimensional Fund Advisors,Stable but slow,2021-11-22,3.0,Regional Director,Great approach stable base of core clients. Expanding solution set.,Underestimated volotlity of premiums impact on business strucutre.
22,Dimensional Fund Advisors,Don't join unless you are desperate,2021-11-16,1.0,Senior Associate,Does not treat employees well. There are not much growth and upward mobility.,Access to leading academics and research
23,Dimensional Fund Advisors,Great place to work but pay limited,2021-11-01,5.0,Anonymous Employee,"Great atmosphere 
Good management
Great benefits",Pay is not as much as other companies
24,Dimensional Fund Advisors,Pros and cons,2021-10-25,3.0,Lead Analyst,Great people - overall kind atmosphere. Ethical company overall.,"Pay is not competitive anymore, there is little diversity in leadership and it seems that isn’t a priority for the company."
25,Dimensional Fund Advisors,Needs to adjust with the times...,2021-10-25,2.0,Anonymous Employee,The food and art was cool.,"- A company not willing to change with the times. 
- Willing to release employees due to Covid, but the owner is a multi-millionaire who wasn't willing to put up his salary for the employees that needed the salary during Covid.
- Everything had to be approved - even the smallest change."
26,Dimensional Fund Advisors,DFA,2021-10-24,1.0,Applications Database Administrative II,"Good company, higher salary plus benefits.","Management issues, leadership in IT is severely insufficient."
27,Dimensional Fund Advisors,Good Company,2021-10-13,5.0,Anonymous Employee,Great colleagues and excellent benefits.,Lack of flexibility but improving.
28,Dimensional Fund Advisors,Overall Great Place to Work,2021-09-15,5.0,Analyst,Awesome and talented people and the benefits are great.,Not the best work-life balance.
29,Dimensional Fund Advisors,Very decent place,2021-09-11,4.0,Associate,"I just rolled off of a rotational program at DFA and the experience was a mixed bag. There are certainly inspiring, intellectual people within the company. The pay is quite good if you're living in Austin or Charlotte. Work-life balance is the best draw, in my opinion.","I have my reservations about some of the higher-ups. It seems the promotion path is much slower, relative to the industry."
30,Dimensional Fund Advisors,Portfolio Management Analyst,2021-08-27,5.0,Portfolio Management Analyst,Everyone is extremely smart and helpful.,Sometimes challenging work but nothing too bad
31,Dimensional Fund Advisors,Portfolio Management  Analyst,2021-08-20,5.0,Portfolio Management Analyst,Awesome company to work for. Everyone is extremely smart. Hours aren't too bad for traditional finance. Team like atmosphere.,No cons that I can think of at this time. No cons that I can think of at this time.
32,Dimensional Fund Advisors,Not anything different to say,2021-08-16,1.0,Administrative Assistant,Not really any pros other than you have a job. Most people are friendly. They are located in 3 US cities.,"Terrible Benefits, High turnover, not flexible, the executives at the top are arrogant and self-centered. No incentives and they are very hierarchical. I see so may people not working."
33,Dimensional Fund Advisors,Continuous education,2021-08-12,3.0,Senior Associate,"Emphasis on continuous education
Great company to start your career","Not many promotion opportunities
Little flexible in working hours"
34,Dimensional Fund Advisors,Your experience depends on your team,2021-08-07,3.0,Anonymous Employee,"Gorgeous offices in all locations, Austin HQ is located at the highest point in the area and you can see for 20 miles in each direction.
The Charlotte office is brand new and stunning. Santa Monica office is on Santa Monica blvd. I can't say enough about our offices as a geek for architecture. I feel this is why there is a big push to come back to them after covid, because they've spent so much money on them.
Technology for the most part is up to date.
Most of of low and mid level employees are great to work with. 
Lately the firm seems to be pushing to hire tons of young people which has really changed the feel of the company over the last few years.
Benefits-wise, insurance is good. We have a HSA/High Deductible option that is great. Both 401k and HSA can be vested with the company, 401k match is below average and caps at 4% I believe.
Onsite cafeteria in Austin and Charlotte with an excellent selection of foods. Comp sparkling water, fruit and coffee/tea on every floor.
ETF launch seems to possibly be pushing the company upward a bit.
Upward mobility seems possible for nearly every department. Company is relatively large at ~1600 worldwide so there is the possibility of movement to another location if you want it and there seems to be decent push to promote from within.","Dimensional is a company that has one foot in the past and another in the future, and is urinating on today. David Booth is old school and until he retires from the board, nothing will change. I'm sure you've already read other reviews below that mention our ancient dress code, the lack of a good work from home policy and the insane amount of overly paid white dudes, and all of that is definitely true. But I do feel the firm is starting to realize that and has started a few initiatives to diversify our employee population. It's a lot better than when I first started.
Because the company has spent so much money on offices, they want you to be in them. This also points back to the firm's old school thinking. Top leaders feel that in-office collaboration is still the way to be productive. Before Covid, employees were NEVER allowed to work from home. That all changed of course.
Currently we have been told that we'll be moving to a hybrid WFH/office situation where some days you are required to be in office, and other days you can work from home. But that will be evaluated at a later date according to our HR. 
This is not the company for you if you think you're going to be working from home 5 days a week in the future. I really hope that changes soon.
I am a support employee, meaning I'm not directly involved with the money-making activities like RDs, PMs, associates, etc. My group deals with building maintenance, event coordination, project management, video/audio systems, etc. I feel for the type of work our group does, the pay is a bit below average to average considering how well padded the company is. It seems most managers are obstinately overpaid, and everybody under them is paid mediocre despite doing an excellent job. Our group is so great at what they do and we really take pride in our work and work hard! 
In doing research of firms similar to us, it seems that our investment philosophy is quite unique and some even feel is foolish. I don't pretend to know a ton about finance but I do feel that we are stuck in the past in a lot of ways, especially in employee experience. The saying goes: take care of your people and your people will take care of you, and I do not feel that Dimensional is an employee-first company.
I love my team because our team lead is just awesome, but others don't have the same experience. I suppose this is true of any company but it seems more pronounced here.
LGBTQ diversity/inclusion is virtually non-existent and was not even recognized until 2020.
The way the marketing department is structured in this company is comical and I don't understand how the bosses over there still have a job. Who are we even marketing to? Our clients have to go through an advisor to access our funds. The marketing team is extremely overpaid and overstaffed to basically do nothing."
35,Dimensional Fund Advisors,Great general work atmosphere and culture.,2021-08-07,4.0,Analyst%2C Desktop Administration,"Compensation, culture, diversity, advancement, benefits(great PTO & tuition reimbursement), nice work environment.","Certain Senior managers were able to advance their careers off the hard work of their under appreciated, under resourced, and under manned service desk team. While the vast majority of the company culture is great, it was unfortunate that the team I was on had a very poor manager with unreal expectations. We went through a few supervisors in just 2 years and other employees left because our manager was living in a different stratosphere."
36,Dimensional Fund Advisors,"Solid Career Start, Relatively Quick Burnout",2021-08-02,3.0,Anonymous Employee,"Dimensional is a great place to start your career
Lots of very knowledgeable, nice employees
Really good work life balance
Good compensation","Lack of long term career growth paths
General inflexibility on strategy, workplace standards, etc
Seems to be a lot of tradition and change is at a glacially slow pace
Lots is dictated by the personal preference of the CEOs and chairman, which can be a little out of touch with the employee desires
Some talk about diversity and inclusion, but very little tangible action on that front
Cash flows seem to be an ongoing issue, and employee retention issues seem to be on the rise"
37,Dimensional Fund Advisors,Love it,2021-07-27,5.0,Anonymous Employee,Great people and benefits. Salary is good too considering I’m in an entry level position.,Not many cons. Hoping to move up the ladder and become an RD.
38,Dimensional Fund Advisors,Limited Pay & Opportunity,2021-07-20,2.0,Associate Portfolio Manager,"The people. Majority are intelligent, humble, reasonable","- Low comp relative to industry
- 401(k) match is poor at 4%
- Benefits below average 

- Limited upward mobility 
- Bureaucracy; advancement is highly political"
39,Dimensional Fund Advisors,Storied history but inflexible and slow to evolve,2021-07-20,3.0,Senior Associate Automation Engineer,Attract top talent and treat the workforce very well with its benefits and policies.,"Very principled, but its inability to evolve with the changing times will lead it to sink to mediocre status."
40,Dimensional Fund Advisors,Outstanding Workplace,2021-07-19,5.0,Associate,"Scientific and evidence-based values
Emphasis on work-life balance
Gorgeous offices
High character of coworkers - great people
Very Good pay and benefits 
Admirable firm mission gives you purpose",Some teams have a notable lack of diversity that can make it a little intimidating if you are not a straight white male. Other teams are a lot more diverse. It’s improving overall.
41,Dimensional Fund Advisors,Rigorous,2021-07-16,3.0,Associate,"Nice office, nice view, nice pay.",People kinda walked over each other and it was pretty cut throat
42,Dimensional Fund Advisors,Great company,2021-07-12,5.0,Analyst,"Awesome culture, great investment philosophy",Can be hard to progress your career quickly
43,Dimensional Fund Advisors,Reasonably good company,2021-07-02,3.0,Data Analyst,"- Easy work hours. 
- cruisey work environment",-skills don't translate into other roles or the industry norms
44,Dimensional Fund Advisors,Lack of development,2021-06-26,2.0,Project Manager,"Location, Cafeteria food, Little else","Management, Beauracracy, Low pay, Terrible IT team"
45,Dimensional Fund Advisors,Great Company,2021-06-25,4.0,Regional Director,"Able to progress quickly, ability to move around organization",Length of time to get to shares
46,Dimensional Fund Advisors,Technology Department Needs an Overhaul,2021-06-14,2.0,Information Technology,"The business itself is healthy, even after a very tumultuous and precarious year (pandemic, 2020-2021).","The IT leadership team is comprised of ineffective managers, most of whom have been employees at DFA for many years. They’ve grown roots and now refuse to budge. They place themselves above anything else and never seem to hold themselves accountable for fostering secrecy and narcissism instead of creativity and cohesion. Also, be ready for some really frustrating discussions about tech advancements...they continue to think and operate within the year 2010. Although, if you can speak in modern catch phrases, key terms and acronyms and you also know Agile terminology, you’ll do well here even if you can’t put it into practice. Don’t worry, the IT steering committee will never notice. Your shortcomings will be obscured by layers of misinformation and confusion for years, during which time you’ll be promoted. The gaps you leave will then become someone else’s problem. Speaking of confusion, they continue hiring more IT project managers but can’t seem to establish real synergy. Lots of short-lived pats on the back when things happen to go well and weeks/months-worth of finger-pointing and hushed conversations when things fail. As a result, the latter has created an atmosphere of gross stagnation where there is absolutely no propensity and no appetite for sweeping change. Using a very traditional and top-heavy management structure, the Technology department lacks the flexibility needed to be ultra-responsive to business needs. There are just way too many personal agendas in the way."
47,Dimensional Fund Advisors,Increased flexibility,2021-06-14,4.0,Sales Associate,The firm is recognizing some need to let employees work from home. Only had good experiences with sales management.,Unclear compensation and career trajectory
48,Dimensional Fund Advisors,"Good company, nice ppl",2021-06-01,4.0,Analyst,"Culture, people, benefits package, office environment",Salary prospects is not as promising
49,Dimensional Fund Advisors,The most rewarding working experience,2021-05-31,5.0,Analyst,"You can’t find nicer people elsewhere. Super friendly and helpful.
Endless learning opportunities. You can become an investment guru as long as you want to learn.","A bit bureaucratic. 
Better compensation"
50,Dimensional Fund Advisors,"Great people, low pay",2021-05-27,3.0,Associate,Great people working there. Challenging but fun job.,Extremely low pay compared to competitors in Santa Monica
51,Dimensional Fund Advisors,Good company to work for,2021-05-18,4.0,Anonymous Employee,"Good people, good benefits too",Not necessarily a lot of room for growth
52,Dimensional Fund Advisors,good company to work for,2021-05-17,5.0,Anonymous Employee,"great company, innovative leadership, lots of potential to grow",not a lot of downsides
53,Dimensional Fund Advisors,Toxic Culture,2021-05-09,1.0,Regional Director,"Nice offices, decent comp if you can settle in for long haul.","Perfect case study where high IQ does not equal high EQ, territorial environment, outside or prior experience not valued, company policies usually instituted on a whim, out of touch with the rest of the financial services industry."
54,Dimensional Fund Advisors,Funny people,2021-05-06,3.0,Senior Software Engenier,Nice funny people. Felt at home,Far from home. Too much work
55,Dimensional Fund Advisors,Overall good place to start career,2021-05-04,3.0,Analyst,Fair benefits and hours required to work enable work/life balance.,Compensation is lagging. Work can get a bit monotonous.
56,Dimensional Fund Advisors,Could Be Worse,2021-05-03,2.0,Anonymous Employee,Good benefits (on-site health clinic is great),"- Resistant to change, still using same technologies and solutions from 10 years ago
- Consistently over-sell positions and place over-qualified people in them leading to high turnover
- Lack of middle management unless you're one of a lucky few
- Only promote once a year and not based off of merit"
57,Dimensional Fund Advisors,Love DFA,2021-04-30,5.0,Senior Associate,"Great people, opportunity, work life balance, polished work force","value premium performance, slow moving to make change"
58,Dimensional Fund Advisors,That's my quant,2021-04-29,2.0,Junior Quantitative Analyst,The cafeteria had pretty good food,"Second in that math competition.

Run if you are technically inclined. You are a prop for David Booth and his cadre of managers and clients. Clearly that is not the core business."
59,Dimensional Fund Advisors,Great Company to Work at,2021-04-26,5.0,Research Analyst,"Nice people, collegial culture, nice office",pay a bit low; the work is also not that interesting compared to some of more risky funds
60,Dimensional Fund Advisors,Beware,2021-04-25,1.0,Regional Director,There are not any pros,"Pay, culture, chance of upward"
61,Dimensional Fund Advisors,Wrong direction,2021-04-20,1.0,Vice President,Dimensional Fund Advisors isn’t what it used to be.,Poor firm and departmental leadership
62,Dimensional Fund Advisors,Great Culture,2021-04-14,3.0,Associate,There is a lot of emphasis on entrepreneurship spirit.,Management could use to update their dress code policy. There are very few firms holding true to a more traditional dress code. Business casual when non client facing is becoming industry standard.
63,Dimensional Fund Advisors,Sham of a Workplace,2021-04-04,1.0,Anonymous Employee,"There are no pros; people are petty. I was told ""women don't do well here."" They brag about their cafeteria but anyone who has been in any nice office building has seen just the same. What a joke -- the food isn't even good and the chef thinks he is god.","Mismanaged employees; CEO quoted as ""not liking change."" HR is NOT confidential. People are jealous, petty, downright evil. Marketing is a joke. All their internal documents had TONS of mistakes. Sales team is treated like gods which only serves to baby them and keep them from learning. Company is like a scary cult from the stone ages. Men comment on what women are wearing. There is NO diversity. They treat their janitorial staff like invisible beings. VP's steal other's ideas. Some work a menial 8 hours doing nothing either because they are incompetent or they have nothing to do. Others work for 13 hours a day and no one offers to help."
64,Dimensional Fund Advisors,"If you are decent person, stay away from this place",2021-04-02,1.0,Information Technology,"Great staff at cafeteria, good food, good office buildings, excellent exposure to workplace politics.",Incompetence is appreciated. Intelligence is insulted. Too many bad people.
65,Dimensional Fund Advisors,Great place to work,2021-04-02,5.0,Regional Director,Awesome culture. Company treats its people well. Lots of opportunity to learn and grow,Starting to feel increasingly corporate as the company grows
66,Dimensional Fund Advisors,Great products and smart people - Management needs improvement,2021-03-28,3.0,Manager,"Smart people 
Great investment philosophy and products","Lack of diversity in leadership
Career advancement depends on ""likeability"" more than skill
Only a few people actually make all the decisions
Not all are paid fairly compared to peers"
