,company,headline,date,overall_rating,author_position,pros,cons
67,Dimensional Fund Advisors,It isn't 1981 anymore,2021-03-26,2.0,Technologist,"- The company has deep pockets and if you're able to convince leadership why they need to invest in something you're gonna have a good time. Good luck with that.
- Great people 
- A fancy office with all the accoutrements (but nobody goes there anymore nor should they be expected to)","This is a good boys club and if you aren't a rich, white, privileged male, you aren't in the inner circle where all the decisions get made
- The culture encourages employees to operate with moral hazard and not challenge the status quo (or do anything at all in some cases)
Even small change is too jarring for most people and you will be met with resistance
- Bureaucracy and apathy undermine progress
Senior leadership doesn't understand how the business operates beyond what happens on the trading floor
- Technology is poorly understood and getting investment in solid people, processes, and technology is incredibly difficult"
68,Dimensional Fund Advisors,It is OK place to work,2021-03-19,4.0,Associate,"It is OK place to , solid benefits","Compensation, comp, money paid, etc."
69,Dimensional Fund Advisors,Great company and reputation,2021-03-18,5.0,Client Services Associate,"Great atmosphere, great people, competitive pay & benefits. Work life balance is a company priority.",Takes a while to climb the ladder.
70,Dimensional Fund Advisors,Professional and Ambitious Employees,2021-03-12,4.0,Associate,I've met some of the most professional and hard-working colleagues at Dimensional. The employees care about each other and treat each other with respect. Dimensional has a beautiful campus. It is well maintained and very clean.,Salary and bonus standards were not met
71,Dimensional Fund Advisors,"Great company, chaotic management",2021-03-06,2.0,Information Technology,"Days off, public holidays, employee benefits. Great office workspaces and amenities.","Recent management changes within the past 2 years have caused a toxic work environment. The company does not seem interested/willing to listen or act even after multiple employee surveys clearly point at these issues, again, no actions nor improvements attempts have been made to 'fix the issues', in fact, the issues continue to deteriorate on a daily basis. We continue to hire professionals who then are restricted from doing what they were hired to do due to internal politics, misinformation, confusion, lack of good leadership and decision making. With the lack of guidance and future roadmap, each team works in their own silos, none of which are on the same page or working toward the same goals. Very often it comes down to the same few employees taking on the majority of the workload as others are content getting by collecting a paycheck while contributing absolutely nothing. Many times, decisions are made by the least experienced, least knowledgeable members who then knowingly relay misleading or false information to upper management for purchasing decisions."
72,Dimensional Fund Advisors,Great place,2021-03-04,5.0,Financial Analyst,Smart people and great location. Interesting work.,Pay below market average and hard to advance
73,Dimensional Fund Advisors,Very good company to work for,2021-03-03,5.0,Analyst,"many smart people work here, great support for career development, heaps of learning opportunities","too many Chicago MBAs, not enough diversity"
74,Dimensional Fund Advisors,"Great culture, missing many opportunities internally and externally, poor middle management",2021-03-01,3.0,Vice President,"I’m mid-career and have been at Dimensional for 3+ years. Compared to other firms, the people at Dimensional are great. They are smart, hard-working, nice people. There are few bad eggs. Generally I find people to be humble. 

Compensation isn’t bad. Not top tier, but definitely not bottom either. As a graduate (either undergrad or MBA), comp is on the lower end, so negotiate. 

Benefits package is okay. Onsite health clinic is a nice perk. 

Work life balance is great. Get your work done-type attitude.  Food cafe was nice when we were at the office.","No structure for mid or end of year reviews.  Despite being promoted, there is no logic to promotions.   There is no start of year objective setting. 
 General lack of caring about your career/career path and skill development. Completely manager dependent and I have had both types.

Senior management play favorites.  Some people are “in” the club and some aren't. Nepotism is also present, either in the form of UChicago/Booth, or family/friends giving people a leg up

401(k) match is below average at just 4%, especially when Vanguard, American Funds, TRowe are offering 3x as much.

Our long-term incentive program is not good now. A few years ago it was better. 

Middle management is poor. They/We aren’t trained on how to manage properly and most of us have no experience at an outside firm. Generally middle management is only concerned about their own careers, not about the teams that they manage

CEO’s have missed the boat on many things, but the consistent party line from senior management is that we are “being thoughtful”. 

Firm is experiencing growing pains despite being 40 years old.  Firm/management is resistant to change."
75,Dimensional Fund Advisors,good place to work,2021-02-19,5.0,Trainee,really really good infrastructure there,no cafe nearby the office
76,Dimensional Fund Advisors,Good to get your feet wet,2021-02-19,3.0,Senior Associate,"- good academic rigor
- overall nice/kind people to work with
- good pay for entry-level type positions","- difficult climbing the ladder without political connections
- sales/PM/Research have hard time going off-script"
77,Dimensional Fund Advisors,Portfolio Management,2021-02-09,5.0,Anonymous Employee,Hours are way more structured than most finance firms,The firm is resistant to change and can be very political
78,Dimensional Fund Advisors,Only place I want to work,2021-02-04,5.0,Investment Solutions,"I am a 13-year veteran of Dimensional who started straight out of grad school (and yes, that grad school was Booth). Every year I’ve been here, I’ve seen my responsibilities and impact grow. This has been a wonderful place for me and I consider myself quite lucky to have found a rewarding and challenging career with people who I deeply respect.

We might as well start at the beginning. Did I have a leg up because I went to Booth? It certainly helped connect me to the right people and put Dimensional on my radar. I don’t think they were actively recruiting folks like me in 2008, so my Chicago resume helped get me in the door. But that’s where the advantage ended. I was surrounded by exceptionally smart people, who would have quickly figured out if all I had to offer was my alma mater. 

I have always felt that my career has been determined by my willingness to learn, work hard, and be creative and flexible. I have had many mentors throughout my time at Dimensional who challenged me to grow. I have learned so much about finance, about our industry and about being a leader from those I interact with every day. There are plenty of ways to grow at Dimensional, they just don’t always fall into your lap. 

There are many things in motion here, which is what you’d expect at a company that is innovating and pushing boundaries. In turn, there is a lot of work to do. This also means there are many ways people can contribute and be recognized for their efforts. Within my specific team, many people have a long runway to show what they can do, and be recognized and rewarded for it. And that includes people without advanced degrees from Chicago! 

I am part of “management”, but I was once a junior level employee. My Dimensional story is not unique. I have witnessed many people with many different backgrounds flourish here. It isn’t necessarily easy, and you definitely cannot coast. But if you are smart and work hard, Dimensional is a place where you can tackle challenging work with smart and kind peers while building a rewarding and successful career.","The work distribution seems like it can be quite uneven. While that is being worked on, I observe we still have some ways to go."
79,Dimensional Fund Advisors,Good company poor middle management,2021-01-27,3.0,Internal Wholesaler,Pays well and has a cool HQ,People are stuck up and back stabbing
80,Dimensional Fund Advisors,Great Time and Great People,2021-01-19,4.0,Portfolio Manager/Analyst,Great on the resume and great network that comes from DFA.,Hard to have upward mobility
81,Dimensional Fund Advisors,It's What You Make of It,2021-01-17,3.0,Anonymous Employee,"Good People, Great Food, Excellent Work-Life Balance, Decent Compensation, great 401k match, good products, ethical company","Can be political at times, decision making could be faster, some managers are better than others, some employees work harder than others"
82,Dimensional Fund Advisors,Good place to start a career,2021-01-09,3.0,Associate,"Good benefits, some perks when actually in office","Slow to make changes, no transparency with employees"
83,Dimensional Fund Advisors,"Effort and talent aren't rewarded here; cliquey, schmoozy, political behavior is.",2020-12-27,2.0,Anonymous Employee,"There are a few really great people working here. You will just have to work to find them (and then watch them jump ship, as everyone good here eventually does).","Effort and talent aren't rewarded here; cliquey, schmoozy, political behavior is. The hardest-working introverts at the firm get completely overlooked in favor of the loudest, smarmiest extrovert in the room without fail. Managers either micromanage or are totally MIA and are generally completely useless either way. If you get a rare good one, hold on to your seat because they won't be around for long. If they don't quit they'll get caught up in the constant restructuring that is DFA's grapple for a foothold on the cliff they are hurtling down. Other reviewers' comments about diversity & inclusion are SPOT ON, also. This used to be an OK place to work, but in its current state I would avoid if you have 2 independent thoughts to rub together."
84,Dimensional Fund Advisors,Coastcity,2020-12-08,3.0,Associate,"don't have to work hard, have job security",they do not reward you for how hard you work
85,Dimensional Fund Advisors,"Solid career path, little flexibility and diversity",2020-12-01,3.0,Senior Associate,Established and well respected firm with very strong leadership. Impressive ties to the academic community. Tons of resources for advancing your development as a working professional. Kind coworkers.,"Little flexibility in terms of working remotely (including during COVID). Most policies are designed around the belief that there is one stay-at-home parent, which makes things difficult for single parents and households with two working parents.
Definitely one of those “meetings to plan meetings” atmospheres."
86,Dimensional Fund Advisors,Review,2020-11-28,2.0,Regional Director,Nice buildings  and nice cafeterias.,Unclear career paths.  Seems to be playing catch-up with other innovators in investment field.
87,Dimensional Fund Advisors,Great Place to Work,2020-11-24,5.0,"Manager, Software Development & Engineering","Clear company objectives
Company takes care of its employees
High value is place on being ethical and doing what is right for the end investor.","Highly regulated industry
Little slow to adopt enterprise technologies"
88,Dimensional Fund Advisors,good company,2020-11-22,4.0,Data Analyst,good life and work balance at this company,not much job promotion opportunity here
89,Dimensional Fund Advisors,DFA Review,2020-11-22,4.0,Associate,"- Work-life-balance
- People
- Nice office","- Not much career growth
- Not much meaningful work"
90,Dimensional Fund Advisors,Smart people but too political,2020-10-12,2.0,Vice President,Lot of smart people who have impressive educational background.,Too political. Aggressive and unpleasant personalities seem to get rewarded.
91,Dimensional Fund Advisors,Great Company with Great Employees,2020-10-05,5.0,Anonymous Employee,All the employees are extremely helpful and willing to go out of their way to make sure everyone feels comfortable. There is a big emphasis on learning and there is a lot of time set aside to learn about the academics behind the strategies. Overall has been really great so far. Pay is also very solid for the hours.,Seems unlikely that they will have much of a work from home policy even after everyone returns from the office. Would be nice to have a flexible policy where people can work from home a few days a month.
92,Dimensional Fund Advisors,Proceed With Extreme Caution.,2020-09-17,1.0,Associate,"--Fair work/life balance 
 --Beautiful office","--Company Outlook:
The mere fact that DFA continues to exist, in and of itself, is mystifying. The basic investment strategy has been replicated countless times over and offered to investors at far lower prices by many competitors. Nonetheless, unwitting investors continue to hand over their assets to financial advisors who, in turn, transfer these assets to DFA at an exorbitant fee -- for the false promise of higher returns beyond the benchmark. These higher returns are utterly illusory. The financial advisors know this of course -- but are themselves compensated by DFA -- so the machine continues forth. This, in some ways, is a form of white collar grift. The victim here is, typically, a high net worth individual or the crime is spread thinly over many thousands of investors -- so no one really cares. The point is, if DFA existed in a more transparent and competitive context -- it simply would not exist by tomorrow morning. 

--Career Development:
You will develop little to no transferable skills over the duration of your employment here. This cannot be stressed enough. Every year you stay, the fetters grow ever tighter and the walls ever higher. Your relevancy to other companies dwindles while your sink even more entrenched into mire of DFA. They know this and will always use it against you. 

--HR:
Truly, some of the worst human beings I have ever encountered over the course of my life. 

--Pay:
Well below industry average. Do not be fooled -- Austin is a very expensive city. 

--Culture:
Because the entire organization is process-driven and has no interest in change, career advancement consequently revolves around political in-fighting and scarcely anything else. This also cannot be emphasized enough. If you haven't kissed the hand of every possible relevant human being within your organization, then your opportunities will be severely curtailed. Correspondingly, I also witnessed appalling employees swiftly ascend the corporate ladder simply by virtue of the fact that they had flattered and flirted the requisite egos. The latter was not the exception -- it was the norm. 

--Work Life Balance:
Previously, I would have said that DFA might actually be a decent place to work if you led a life deeply enriched by things beyond your career. It used to be fairly easy to come, complete your work, and go as you please. Now, however, your movement is meticulously tracked and this data is presumably provided to your manager and any other individual in the organization who might use it against you. 

--Overall:
The sun has set on the glory days of DFA. The company will continue to pedantically adhere to their processes until the company gently fades into oblivion. As resources are constrained and funds are tightened, I imagine the political quarrels will only grow more aggressive and more treacherous. Another procedure to follow, another colleague to betray -- until the last portfolio's last assets under management finally sinks to zero. Nothing will be lost.


Also, an unknown assailant repeatedly defecated in the breakroom."
93,Dimensional Fund Advisors,Comp/Benefits make it hard to complain too much,2020-09-15,3.0,Senior Marketing Associate,"Compensation and benefits are great
Nice offices - clean, comfortable, good cafeteria
Work-life balance is good","All the cons of working in a corporate-feel environment - little to no flexibility in processes, leadership provides little insight into firm direction, stifled creativity, no investment in career development, visible lack of diversity."
94,Dimensional Fund Advisors,Asset management Firm,2020-09-09,5.0,Analyst,"Good culture, work closely with different teams",The location would be better if in NYC
95,Dimensional Fund Advisors,Person of color? Degree from anywhere other than UChicago? Don't bother!,2020-08-22,1.0,Senior Associate,"Nice cafeteria, low expectations, polite people","Whatever respect you had for the firm or excitement about joining you have will disappear within 4-6 months on the job. The Warhols on the wall will lose their color; you'll start avoiding the cafe and eating in the parking lot just to get out of the building. If you hadn't already, you will come to see you've joined a firm that prides itself on resisting change until it becomes unprofitable or untenable to do so (see for example, remote work, growing focus on ESG, D&I), at which point it pretends to be a pioneer and champion of whatever trend can no longer be denied.

Primarily, if you are ambitious and impact-driven, you will come to realize (or be sternly told) that, even as a graduate of a top graduate program with years of industry experience, your opinions don't matter. Unlike consulting/banking or even equity research or whatever field you were considering, there are no required skill sets, work products or career trajectories for post-grad hires in most departments at DFA. While your classmates are leveling up, it will be explained to you why there's no budget for a 2% cost of living raise. Hint: you're in a dead-end job. 

The only way to build a career at DFA is to curry favor with those who themselves have curried favor with higher-ups. Ways to do this include: belonging to the right country club, having a kid in the right preschool, and just plain old kissing butt. It helps to be white. There are no job descriptions, development expectations, or performance reviews. People two years out of school are routinely hired at the same title as people with a decade of experience at top AM firms. The jobs are so easy and promotions so haphazard, these types generally advance faster. Or maybe they know someone. The type of background most likely to succeed here mirrors upper management -- PhD (in finance... optional), never worked anywhere else, drink the EMH Kool-Aid, no concept of how ridiculously micro-managed the company is, and remains grateful for below-market wages.

DFA can best be described as a reactionary firm in a conservative industry. Ironic given it prides itself on innovation. Just take a look at the composition of the board (six white males) or senior leadership of the sales team (3 white males overseeing 12 white male channel heads, 1 white female. Even the head of the Japan office is a white male! Nothing to see here.

The internship and recruiting process are extremely disingenuous, yet succeed in achieving the goal of finding warm bodies to fill seats for the year or two it will take most to realize they've been duped. Whatever 'strategic project' and firm practices you are told it's up to you to improve will never change and your ideas will never see the light of day. If they do, it will be because your boss stole credit for them. Your day to day work as an employee will be even more mind-numbingly dull than you could imagine, and no one will care about your input or development. There were months at a time I had absolutely nothing to do. Get up, put on business professional attire, go to work, and pretend to be busy in an open office floor plan 9 hours a day. It's a bad sign when your manager is showing up late and clocking out early every day. 

The way people end up surviving in this environment is by taking 2 hour lunches, long walking laps around the campus, gossip sessions over coffee etc. Management response: require scanning ID card in and out... get back to your desk! Probably the best thing I can say about working there is that I've never been paid more to do less.

DFA is also remains strongly against working remotely. Despite successfully having had the vast majority of employees working from home, they continue to refuse to let employees know 1) when to expect to return to the office and 2) whether the demonstrated success of the COVID experiment will mean any change in the draconian work from home policy (you can't).

A firm that always puts its owners first, clients second, employees last."
96,Dimensional Fund Advisors,Positive culture,2020-06-12,5.0,"Associate, Global Client Group",Collaborative and positive culture. Salary-based sales positions so people like to work as a team.,Firm can be slow to promote and acknowledge high achievers.
97,Dimensional Fund Advisors,Animal Farm - Some pigs are more equal than others...,2020-04-28,1.0,Anonymous Employee,Er...the cafe is pretty good and the people who work at the cafe are decent human beings.,"I would give this place negative stars if I could. Where do I start? Animal farm (George Orwell) really sums up DFA.  Basically, senior management tells their employees how everyone is replaceable and dispensable so that you would feel small as an employee and be eternally grateful for the below market rate they are paying you. The senior managers and some high-level VPs ensure that they get all the best, “most visible” useless projects that would bolster their positions in the company and allow them to put more resources (read: employ people who don’t have actual jobs) into their fiefdoms. By the way, almost everyone there is a VP; the less you do, the higher the likelihood that you would get VP.
As one reviewer puts it so eloquently, if you curry favor with the flavor of the moment (employees who are having their moments in the sun and are on a rising path), you are more likely to be deemed a rising star… And those are definitely “more equal than others”. There is no basis for how some people get Chosen. I believe it’s sheer luck. If you have read the “Luck versus Skill in the Cross Section of Mutual Fund Returns” paper by FF, you will understand that the same logic applies to DFA managers and Chosen Employees as well. Most of them are there by random luck and not because of talent, intelligence or integrity. For example, one of the Senior Management personnel may take a liking to a certain employee because he or she likes what that employee was wearing that day and simply say that person should be promoted. And indeed, that person will get promoted. There is just no rhyme or reason for why someone gets promoted and others are not. There are some good managers but those are few and far between.
Decisions are mostly made by the top echelon of PM and Research. The deputy heads of PM would be considered Administrative Officers in other companies because they execute the desires and wishes of the few 0.1% who hold true power in the company. Everything is micro-managed. Email to clients to answer really generic questions are overseen by the CEOs and the various heads of department. This is probably why the company hasn’t come up with real research or innovation in a long time, the management and the Research department are too busy scrutinizing responses to generic client questions.
Let’s talk about the Human Resources Department. The letters “I, N” should be added to form “Inhuman Resources”. This department is there to make the employees’ lives as miserable as possible and offer little support. If you have a problem, they would add to it. If you are facing discrimination, instead of listening to you or helping you, they are more likely to remind you that you cannot sue the company because you have signed an Arbitration Agreement. I believe the department is there to protect the management and the shareholders (really, just one shareholder who mostly owns the company) and to make their employees feel as weak and powerless as possible.
Are markets efficient and do prices reflect all available information? DFA will tell you that they think so unless the market you are talking about is the labor market. They don’t believe in paying fair market rate wages and when they saw that there was significant turnover in the ranks because of better pay or better work culture at other companies, they decided that instead of paying more and improving work culture to retain staff, they would rather put in a No-compete clause so that they can continue to make their employees’ lives miserable even after they have left. Isn’t it, er, the opposite of efficient markets?
What about this new push for Diversity and Inclusion? Well, this was pushed by the rank and file and denied by senior management until they realized that clients actually care about fund managers’ efforts to increase D&I. DFA then did a complete switcheroo and put the same people who have denied the need for D&I initiatives all along to head up the D&I committee. And are these committee members qualified? Are they passionate about the cause? Nope, these are the same Chosen few. They are on all the committees. Only them and no one else.
There is so much more but I will just conclude with this: I would rather go on unemployment than work in this toxic environment."
