,company,headline,date,overall_rating,author_position,pros,cons
0,Legg Mason,Confused dying company,2022-04-21,2.0,Sales Associate,"Decent pay, free Snapple, next to train station","Confused management, frequently changing identity"
1,Legg Mason,Great company and culture.,2022-03-08,5.0,Software Engineer,Flat organization and have good managers. The comp is attractive and as per the market standards.,Legg Mason is a great company to work for.
2,Legg Mason,Meh,2022-02-17,3.0,AVP-Finance,Good work-life balance and low bar,Not a very inspiring place to work
3,Legg Mason,Manual outdated ways of doing things,2022-01-27,2.0,Compliance Officer,"Good people, large global exposure.","Poor culture, manual outdated processes,"
4,Legg Mason,"Great culture, but tenure-ocracy.",2022-01-14,3.0,Analyst,"Great flexibility, culture, and benefits, especially PTO.",The best talent isn't recognized quickly enough and so it predictably leaves to places where it is. Tenure is valued above talent.
5,Legg Mason,Great team and strong company culture,2022-01-11,5.0,Anonymous Employee,Great team and strong company culture,None I can think of
6,Legg Mason,Great place to work,2022-01-02,5.0,Salesforce Administrator,Great Place and Employee Friendly,Nothing as far as I know
7,Legg Mason,None,2021-11-15,3.0,Senior Financial Analyst,There were many great people to work with.,The company was been bought/
8,Legg Mason,Well rounded,2021-11-10,4.0,Senior Investment Risk Analyst,"Good company, great learning opportunity, lots of advancement opportunity.",Pay is low and competition is steep
9,Legg Mason,OK,2021-10-19,2.0,Paralegal,Work life balance is good,Bad management and lack of training
10,Legg Mason,Nice company to work with. Sad to see them close.,2021-09-25,5.0,Technician,Very nice company to work with,No complaints at all. I really enjoyed working for Legg Mason
11,Legg Mason,great,2021-09-17,4.0,Anonymous Employee,"great team, salary, people, hours","poor management, lack of transparency, no training"
12,Legg Mason,"Mostly positive, before the merger",2021-09-13,4.0,Data Analyst,The people were great and the work was decently varied,Changes were very slow to be enacted and strategy plans could be setback or completely abandoned when there was short term performance
13,Legg Mason,Terrible,2021-08-13,1.0,Anonymous Employee,sucking up will get your way in this place which is terrible,"Its a big shop of old white males. If you aint old, aint white and aint female sucking up to these old whites. good luck"
14,Legg Mason,Great Company,2021-05-14,5.0,Paralegal,Great place to learn and grow. Supportive teams.,Merged with Franklin Templeton as of July 2020
15,Legg Mason,Great Firm to work for,2021-04-27,4.0,Human Resources Business Partner HRBP,"Really lovely team in London and across the European offices, felt like a small firm but with Global clout. I had a really lovely manager who I considered a more of a mentor.
Great benefits",Sometimes a little bureaucratic - at the time I was leaving their was a push to get a lot of the HR work centralised in the US. In a small local HR team there was limited room to progress.
16,Legg Mason,Great Job,2021-04-23,5.0,Sales Associate,Great culture and everyone is willing to help,Low communication with employees about company
17,Legg Mason,"Great company, lean on resources",2021-04-19,4.0,Regional Director,"large AUM, name recognition for SMAs, powerful value add program","rotating manage, management with less field experience, unequal territory opportunities"
18,Legg Mason,poorly managed,2021-04-09,1.0,Internal Wholesaler,"coworkers were great, very friendly",management has no idea what they're doing. Most managers have little to no experience managing
19,Legg Mason,Friendly and professional culture with job satisfaction.,2021-04-07,4.0,Anonymous Employee,"Professional, friendly and supportive colleagues.",Acquired by Franklin Templeton which may change culture.
20,Legg Mason,Good Company,2021-04-01,4.0,Anonymous Employee,Good working culture and environment,"very lean structure, you will need to be all rounded"
21,Legg Mason,Great company to work for,2021-03-24,4.0,Accounting,"Transparent, good communication of goals to lower levels",Lack of career development opportunities within the company
22,Legg Mason,Great work life balance,2021-03-22,4.0,Accountant,Work life balance and nice working environment,The hierarchy is very flat so promotion opportunity is minimal
23,Legg Mason,Great experience,2021-03-21,4.0,Web Producer,"Small, productive teams.
Diverse group of employees.","Poor project planning.
Upper management unsure of daily operations."
24,Legg Mason,"Good company, bad politics",2021-03-06,4.0,Accountant,"- good training and support from the company
- good atmosphere 
- clever people 
- good work life balance
- good compensation and benefits","- highly political 
- career progression can be stuck and hindered if you don't play the game"
25,Legg Mason,Great work environment,2021-02-22,4.0,Senior Analyst,Compensation was low compared to competitors,The people were really great. Management provided opportunities for learning and development.
26,Legg Mason,"Good people, bad organization",2021-02-16,2.0,Portfolio Manager,Great people among the affiliates,Organization is unwieldy with too much overhead
27,Legg Mason,One Legacy joins another...,2021-02-11,3.0,Director,Flexibility and work from home options,The culture among employees was going downhill due to job security
28,Legg Mason,Sales and Marketing Associate,2021-02-03,3.0,Sales and Marketing Associate,Good benefits and great work life balance,Too much politics and not enough promoting from within
29,Legg Mason,Great!,2021-01-25,5.0,Analyst,Great company that cares about colleagues,None that I can think of
30,Legg Mason,Struggle to find its place,2021-01-20,3.0,Anonymous Employee,Good benefits and nice people,Management constantly struggling to find its way in how to structure the affiliate model.
31,Legg Mason,LM,2021-01-14,5.0,Analyst,Great benefits and culture at LM,Internal conflict between affiliates and corporate
32,Legg Mason,Great Place to Work,2021-01-13,5.0,AVP-Project Manager,Exposure to multiple projects and technology,Got sold to Franklin Templeton
33,Legg Mason,Close up shop,2021-01-12,1.0,Internal Wholesaler,Snacks were free and nice chairs,Smart people not encouraged here
34,Legg Mason,Good place to work,2021-01-11,4.0,Vice President,"Diverse culture, knowledgeable and helpful colleagues, collaborative environment",Workload can be overwhelming in a lean team
35,Legg Mason,Senior Analyst,2021-01-11,5.0,Senior Analyst,Good environment. Good local. Lean organization.,Not much growth opportunity at firm.
36,Legg Mason,Sadly acquired,2021-01-07,3.0,Anonymous Employee,"Work/ life balance exists unless you want to progress, average to above average benefits","Below par salaries, Lack of genuine diversity, toxic environments. Grow quickly & quietly with management in denial"
37,Legg Mason,Great Company,2021-01-07,4.0,Analyst,"Team spirit, long term growth",Not as innovative as competitors
38,Legg Mason,Good company,2020-12-29,4.0,Senior Auditor,Good benefits and good pay. Company performance lagged in the final years,Due to lagging company performance. Experience a few company job cuts to cut cost
39,Legg Mason,Great company,2020-12-28,4.0,Administrative Assistant,Grew professionally in my time there,Wish they had better talent management processes in place
40,Legg Mason,Great culture,2020-12-22,5.0,Financial Analyst,Great culture and very diverse,They got aquired and many people were laid off
41,Legg Mason,Legg,2020-11-28,3.0,AVP-Analyst,Great group of people to work with,Not a clear path to get promoted
42,Legg Mason,Solid Company,2020-11-17,4.0,Web Developer,Legg Mason offered great pay and was truly a great group of people.,There wasn’t much room for growth. I was stuck in my same position for almost 7 years.
43,Legg Mason,Great Company,2020-11-17,4.0,Sales Service Associate,"Great people, training and overall company","Hard to think of, it was a pretty fair company... perhaps some more growth opportunities"
44,Legg Mason,Great culture,2020-11-17,5.0,Programmer Analyst,Everyone I worked with was super knowledgeable and very skilled at what they did. Felt like a family,Company no longer exists unfortunately
45,Legg Mason,Great job,2020-11-10,5.0,Managing Director,"Exciting job , great learning experience",location is not in a big city
46,Legg Mason,I liked working there a long time,2020-11-05,4.0,Senior Analyst,It was ok. Good people to work with,Have to be in the know
47,Legg Mason,Sad to see it go,2020-10-15,5.0,Technical Manager,Great company to work for!,"Sadly, They are no longer in business"
48,Legg Mason,Good employer,2020-10-12,4.0,National Account Manager,"Good People, Breadth of Products, Competitive Compensation, Great Benefits","Challenges with investment affiliates, too much debt on balance sheet"
49,Legg Mason,"Some good, some bad",2020-10-03,2.0,Internal Wholesaler,"Good pay and benefits, great coworkers",Not a lot of upward mobility. Very political
50,Legg Mason,Just ok,2020-09-24,3.0,Senior Analyst,good values; flexibility and understanding,slow growth and inability to move around
51,Legg Mason,Environment,2020-09-22,4.0,Financial Analyst,"Great working environment
Employee Resource Groups
Management","Growth opportunities
Communication
Lack of Training
Poor collaboration"
52,Legg Mason,Too much politics,2020-09-10,3.0,Marketing Associate,"Started out great, many perks and good people to work with",Too many politics if you want to move up the ranks
53,Legg Mason,A good place to learn,2020-08-27,4.0,Assistant Vice President,You’ll have a good work life balance,Challenging to find upward mobility
54,Legg Mason,great,2020-08-14,5.0,Anonymous Employee,good pay nothing bad to say,i have no cons for this job
55,Legg Mason,Great Company,2020-07-23,5.0,Executive Assistant,"Good structure 
Great people
Career progression",Not applicable for this company
56,Legg Mason,Great local firm,2020-07-14,5.0,Junior Trader Corporate Fixed Income,Very diverse employee base . Very involved with promoting Baltimore city events,They merged with Citigroup and Western Asset.
57,Legg Mason,Legg Mason,2020-06-01,3.0,Senior Analyst,PTO is great and a competitive benefits package overall,Unstable job security with the company doing 3 large re-org/staff reductions over the past 5 years.
58,Legg Mason,Employee engagement,2020-05-21,5.0,Senior Professional,LM values employees be providing a host of support and resources to achieve their best version of themselves,Sometimes can be US centric
59,Legg Mason,Solid company,2020-05-01,5.0,Regional Director,"Good comp, decent culture, very lean",not more then anywhere else
60,Legg Mason,Here come the wholesaler layoffs!,2020-03-16,1.0,Wholesaler,"Backstabbing is very easy. 
Coffee machines are delish.","HR is a joke. 
Portfolio managers underperform benchmarks consistently. 
HR is a joke. 
There is no leadership. 
HR is a joke. 
Great for politics and brown nosing. 
HR is a joke."
61,Legg Mason,Not Sure,2020-03-10,3.0,Vice President,Lot's of learning opportunities. If you are willing to learn and go an extra mile. you'll be unstoppable.,"Management sucks.

If you are of any specialized skill set, then do not expect growth.

If you are a peoples manager expect lot of growth."
62,Legg Mason,"Don’t work here, it’s a political wasteland. Especially in the Finance department.",2020-02-04,1.0,Finance,PTO is generous. Nothing else.,"Politics is rampant
Poor collaboration - everyone is trying to protect their position so most people are rowing the boat in opposite directions
Managers focus on figuring out who to blame when something goes wrong instead of trying to solve the actual problem
Employees constantly stabbing each other in the back
Technology fails when it’s needed the most"
63,Legg Mason,Too much to overcome,2020-01-17,1.0,Marketing Analyst,"Paycheck, medical/dental coverage and 401(k)","Dysfunctional leadership, low pay, no raise, cut bonuses.  Disrespectful team leaders, low morale.  Work life balance only offered to a chosen few."
64,Legg Mason,Limiting career specturm or professional development,2020-01-09,2.0,Marketing,Nice work life balance and people are friendly and kind,Global company with global reach but locally very bureaucratic and inefficient
65,Legg Mason,Workplace,2019-12-01,3.0,Finance Analyst,Great atmosphere and coworkers,Management does not take initiative to help develop their employees.
66,Legg Mason,"The best products, but...",2019-09-29,2.0,Anonymous Employee,"Great benefits 
Co-workers
Best money managers and products
Affilaite manager structure","No direction
No communication 
Inexperienced leadership
Consistently restructuring/layoffs
No job security 
Promotion structure based on favoritism
Limited opportunities 
Below industry pay
Stock hasn’t moved in years
Compensation continually cut
Consistently adding unsellable affiliates"
67,Legg Mason,Overall a great company to work for,2019-09-22,4.0,Finance,"- People are great to work with
- Opportunity to travel to other offices and work
- Benefits
- Systems and openness to change","- Salary
- Opportunities to progress"
68,Legg Mason,Constant changes,2019-07-17,2.0,Senior Product Marketing Manager,"other than the people, can't think of many pros in the current environment","can't seem to get the structure right, seems like a revolving door with middle management, layoffs are now are regular thing, and now the future of the entire company seems in jeopardy"
69,Legg Mason,Sad,2019-05-21,1.0,Financial Analyst,it is a really nice office,"everyone is pretty unhappy, worried about future of company"
70,Legg Mason,Good place to work but....,2019-05-16,4.0,Vice President,"work life, telecommute, pay, people",constant reorgs and layoffs please stop
71,Legg Mason,Lack of direction and Inexperienced Management,2019-05-04,1.0,Anonymous Employee,"Decent pay (but anywhere in the asset management industry you’ll get the same pay more or less), nice locations, some great people","Inexperienced management, CEO that lacks direction/experience, situation where the affiliates dictate how they want things done and CEO just follows, horrible marketing organization (they just don’t get what the clients wants/needs), sales management who has never even held the position of the folks they manage, no sense of direction, lack of focus, too many things to focus on so everyone just does their own thing, they promote “diversity” and i guess that means keeping someone in their role because they’re black and disregarding the fact they were arrested for being a sexual deviant WHILE ON THE COMPANY DIME (pathetic and completely false claim that they “value” diversity - they just jumped on the bandwagon so they don’t look like they’re the only company that doesn’t care.. trust me, they don’t care), HR that is the anti-HR (they are the most gossipy and cliquey part of the org - you cant trust them - they like the attention they get from their male buddies so if you’re even thinking of going against any of them because of serious issues, you’ll be the one screwed in the end)"
72,Legg Mason,Great company to work for before retiring,2019-04-24,2.0,Anonymous Employee,"Life balance
Great Time flexibility and hours","No raise for over 4 years
Flat bonus for over 5 years
No promotion opportunity
No carreer opportunities
Denied multiple attempts to get professional certifications"
73,Legg Mason,Company progressing in the right direction,2019-03-16,4.0,Client Relationship Manager,"The people, benefits, and products are great.  I look forward to going to work every day. It is nice working with people who are proud of their work.  Management is working to streamline the company which will bring tremendous benefits to employee sanity and overall client service.  Also, ESG in all aspects is ahead of the competition.",Changing a culture that was hierarchical in the past is proving to be a slow process.  The ingrained deference to authority makes accomplishing even simple items that are important for your line of business a painful process.
74,Legg Mason,Worst manager ever,2019-03-06,3.0,Marketing Manager,Work life balance and nice colleagues,"When you resign, beware if you have any trips booked because Stacy Fontana will ask you to reimburse the company for any leftover funds that was caused due to your cancellation. Signs of a petty manager and one that is not great to ever work for.  Luckily, HR said that wasn’t an issue and at the end of the day we are talking about a refund of less than $10"
75,Legg Mason,Good Company but bad management,2019-03-02,1.0,Anonymous Employee,"Good Benefits
Flexible Time to work from home","Bad Management. Can’t execute strategy.  Only strategy management do well is cost cutting. Do not spend time develop talents. 
Favoritisms over merits.  
If you are a Minority do not expect any major career advancement."
76,Legg Mason,Great Company to work for,2019-02-06,4.0,Developer/Analyst,"Great people
Innovative
Agile/Nimble with development changes",A lot of the developer opportunities are no longer in the area
77,Legg Mason,Employee,2019-01-18,5.0,Anonymous Employee,This company has a great work environment,Not too much room for growth
78,Legg Mason,Not Recommended,2018-12-28,2.0,Sales,"Coffee machines-Good Products

Confusing business model-worse execution

Benefits","People are always leaving 

No sense of management- Toxic Culture

Early 2000s IT Technology 

Favoritism over merit 

No advancement"
79,Legg Mason,Software Developer,2018-11-20,3.0,Software Developer,Relaxed Culture and generous employee benefits for new employees,Technology is lacking based on what the direct competitors are doing and there is a severe lack in communication between the different departments.
80,Legg Mason,"Wonderful benefits, great people",2018-11-14,4.0,Senior Specialist,"Amazing benefits, lots of time off, great pay. Performance was definitely acknowledged and rewarded with salary and a yearly bonus.","Not the most interesting job, lots of meetings and unnecessary conference calls, technology definitely lagged behind."
81,Legg Mason,Wholesaler,2018-07-17,1.0,Anonymous Employee,"coffee machines, glass building, mediocrity",company struggling to find identity
82,Legg Mason,"Good Strtategy, Needs to be executed",2018-05-24,4.0,Anonymous Employee,"Good culture
Good work life balance
Management has strong vision , but needs to be executed","Affiliate structure hard to manage
Thinly resourced in some areas"
83,Legg Mason,Great company,2018-05-22,5.0,Anonymous Employee,"Great culture, people and location",Stock price hasn't moved much
84,Legg Mason,"No strategy, poor management = bad stock performance",2018-05-20,2.0,Product,"Solid comp, convenient Fairfield county commute, good cafeteria, free coffee, clean restrooms, active community involvement, moderately educated workforce, close to train station","Poor leadership and management, no direction or strategy - other than holding on. Horrible culture, divisive interactions across business units and affiliate managers,"
85,Legg Mason,The Only Constant is Change... and a Lack of Strategy,2018-05-04,2.0,Sales,"Above average compensation, flexible hours and you can coast if that's what you're really looking for in a career. The employees (in pockets) - overall the culture is pretty toxic with divisions between the Baltimore and Stamford home offices, as well as the nine affiliates.","Constant changing of deck hands and grappling for power by ""leaders"" gets in the way of real progress and feeling like you're moving forward. Morale is very poor at the moment. 

Within last three years added three new investment shops, an ETF build out, and a FinTech vertical. All of which have been handled in mediocre fashion. Diversification is good, but have a strategy."
86,Legg Mason,LM Review,2018-05-03,3.0,Anonymous Employee,"Work / Life Balance
Culture
Benefits
Work Space","Compensation
Career advancement opportunities
Not many opportunities to move around within the company"
87,Legg Mason,Traditional Global Asset Management Firm,2018-05-01,3.0,Anonymous Employee,"The people at this organization really make this company. The CEO seems to be committed to improving the organization, but this must come from all levels of leadership and this does not always happen.","Undergoing lots of change management, the workload can be challenging at times given a ""do more with less"" mentality, little opportunity for advancement"
88,Legg Mason,Specialist,2018-03-19,3.0,Anonymous Employee,Competitive Salary and learning new areas through job rotation,More employees with titles of manager or higher.  Some managers do not even have any employees reporting to them.  Virtually no room for career advancement.  Micromanagement of work by managers who have never even sat down to understand what the job entails.
89,Legg Mason,LEgg Mason,2017-11-29,4.0,Anonymous Employee,"Great culture, fun, friendly people, customer focused","micro managed, intense pressure to perform"
90,Legg Mason,OK,2017-11-21,3.0,,"Competitive salary, good work-life balance","Lack of progression, silos within the team, lack of learning and development"
91,Legg Mason,good company great benefits good culture,2017-10-10,4.0,Programmer Analyst,"good company great benefits, nice and friendly atmosphere",very difficult to progress outside of the USA in shared services
92,Legg Mason,Work Exp,2017-10-07,3.0,IT Engineer,You can to gain lot of functional knowledge,"Horrible mgmt (IT), politics, favoritism"
93,Legg Mason,Sales Service Associate,2017-10-06,4.0,Sales Service Associate,"Great work environment. work at home when needed,  great benefits",company is constantly changing layoffs have been happening
94,Legg Mason,Great place,2017-08-30,5.0,Anonymous Employee,"Good people, good location, good products.",Cafeteria could be improved.
95,Legg Mason,Too little progression,2017-08-11,1.0,Anonymous Employee,"good hours, good money and simple manager",poor progression as my manager who is poor quality still gets promoted but not me
96,Legg Mason,Run run run,2017-07-25,1.0,Portfolio Analyst,"getting paid, lunchtime, hometime, travel, paid entertainment","working here, working here, working here"
97,Legg Mason,Overall highly recommended,2017-05-16,4.0,Anonymous Employee,"Great people with a high level of engagement and passion.

CEO has energy and vision, he is down to earth and approachable.

Great benefits, lots of PTO.","Not as much room for mobility or advancement as it was in the past when the company was larger.  Could change if the company grows, but the push seems to be toward doing more with less rather than growing.

Too much work!  If you are good and motivated, you are usually pushed into doing more.  These opportunities can lead to advancement, but they can also lead to burn out, or a work/life imbalance.

Internal politics trumps logic sometimes.  Best example is the random corporate title process.  People with contribute less get regular title promotions, over people who get more done, but are not engaged in the internal politics.

Too many internal departments / too hard to understand what each other does

Parent company relationship with affiliates can be hard to understand."
98,Legg Mason,staff,2017-05-11,3.0,Anonymous Employee,working conditions are pretty good.,Pay could be higher than it is
99,Legg Mason,Friendly work environment,2017-04-30,4.0,Anonymous Employee,"Work life balance is important to the company
Friendly co-workers lead to a collaborative atmosphere.","Silos
Limited room to grow in some areas"
100,Legg Mason,Good Company to Work For,2017-04-27,3.0,Anonymous Employee,"Great benefits
Integrity
Flexible work arrangements
Good company performance
Clear messaging","Support areas very flat
Company struggles to develop employees"
101,Legg Mason,Run don't walk away,2017-03-25,1.0,Client Services Manager,Horrible management that have no idea what they are doing. Completely clueless as to what it takes to move the office forward. Not willing to listen.  This place will suck the enjoyment of coming to work. It's hurts just to wake up on Monday's.,If you want to grow professionally don't look here. Management only promote within the trusted circle and are easily influenced by what they are told by others not by what you actually do.
102,Legg Mason,Good if you are content with coasting,2017-02-28,2.0,Anonymous Employee,"-Extremely friendly co-workers
-Generous PTO
-Ability to work remotely
-Above average pay
-Fantastic work/life balance","-Very little room for advancement
-Hard to drive new changes. People are very content with the status quo.
-Coworkers who are perfectly content with coasting as opposed to striving to be the best"
103,Legg Mason,Great place to work if you want to coast...,2017-02-23,2.0,Marketing,"Great place to work if you want to coast, but not if you want to do your best work
There are some wonderful people to work withGreat place to work if you want to coast, but not if you want to do your best work
There are some wonderful people to work with
Great work/life balance
Great work/life balance","Poor resource planning and time management.
No effective collaboration between departments, everyone does their own thing.
Consistently cut corners resulting in sub-par quality of product.
Set arbitrary deadlines without any input from the teams performing the work.
Experience can vary greatly depending on who your team or manager is.
Not a meritocracy, very political, mediocre employees promoted.
Rife with democratic committees that derail projects.
Repeatedly make the same mistakes resulting in days of lost productivity.
No accountability."
