,company,headline,date,overall_rating,author_position,pros,cons
104,Legg Mason,Absolutely Outstanding Global Employer!,2016-12-25,5.0,Anonymous Employee,"Well rounded senior leadership team 
Head of HR smart, thoughtful, and truly cares about LM and associates 
Beautiful office
Leaders walk the talk with investing in community and affinity groups",Must be a team player to thrive here so if only playing for the name on the back of the jersey vs front you won't do well
105,Legg Mason,Not the most welcoming culture,2016-12-12,2.0,Anonymous Employee,None to right Mom about it,"Company Culture is not the most welcoming, If you are a new employee and not part of the good Old Boys Club you will have a hard time getting used to.  A lot of the full time employees have over 10 years with the company so they are often not teaching you everything you need to know about your role"
106,Legg Mason,Review,2016-11-24,2.0,Anonymous Employee,Multi manager allows for diversification,Difficult Model to maintain affiliates and unity of brand
107,Legg Mason,Review Title,2016-11-10,5.0,Director Technology Support,Great company due to the great management.,No cons. Very healthy company.
108,Legg Mason,Company with great values,2016-10-17,3.0,,The people here are good to work with. This is a company with a great culture and values and it reflects on its employees.,Not a lot of growth opportunities available and compensation is not great.
109,Legg Mason,Portfolio manager,2016-10-11,5.0,Portfolio Manager,Great company with good service,Purple Friday is not good
110,Legg Mason,Project Analyst,2016-09-30,5.0,Anonymous Employee,Great managers and processes in place. Great place to work and lots of fun even with the changes. Great cafeteria on site.,Downsizing of the Red Run Office . Traffic and commute to go back and forth between offices.
111,Legg Mason,Good experience,2016-08-09,4.0,Executive Assistant,"Legg Mason was a great place to work.  My colleagues were bright, hard working and enjoyable to be around.",Nothing I can think of.
112,Legg Mason,Good Company to work for,2016-06-20,4.0,Anonymous Employee,"Collaborative, family friendly environment, the company prides itself on good work/life balance.","The company has ambitious plans, which is very exciting but resources are limited."
113,Legg Mason,Great Flexibility,2016-06-01,2.0,Anonymous Employee,"Flex work arrangements 
Open door policy
Good benefits",Lack of growth and development opportunities.
114,Legg Mason,Manager,2016-05-29,5.0,Finance Manager,"Good remuneration, interesting markets, good work life balance. Good support from head office.","The mid 2000's were rough. Downsizing, restructuring, outflows all caused drop in morale in administrative segments."
115,Legg Mason,Backstabbing recent college graduates,2016-05-25,1.0,Data Analyst,"Nice cafeteria, gorgeous building, walk to the train station.","Backstabbing recent college graduates who lie about who made improvements are who got the work done. Moreover, many people use Christian phrases and not very politically open minded. My worst experience was when my bosses were not in the office and the recent college graduates blamed work errors on me and even said ""Well, it is two verses one, it doesn't matter what you did or say"". *cough *cough, was later let go.
DO NOT WORK HERE."
116,Legg Mason,Experience,2016-05-15,3.0,,Nice working environment and pantry,Not too attractive compensation and benefits
117,Legg Mason,Senior Operations Manager,2016-04-20,3.0,Vice President,"Expanding Product set, forward driven, where the industry will be going. Flexible working. Good pension plan, ok benefits, but you need to pay for the from base salary.","To many silos, lack of oversight/accountability. No pay increases. Small bonus. Complicated product set that is not reviewed to see if it's fit for purpose. Risks not appropriately monitored."
118,Legg Mason,"A good, solid place to work",2016-02-19,4.0,Systems Engineer,"Great people, healthcare, and work atmosphere.",The work can get boring as the company is very practical in its application of technology.
119,Legg Mason,Great company,2016-02-06,4.0,Anonymous Employee,"Great people, strong culture, and the management team was always looking out for their employees.  Provided continuous opportunities for career growth",No strong cons for LM
120,Legg Mason,Analytics,2015-11-12,4.0,,"Very friendly people, very inclusive, good opportunity for advancement as long as you show that you can handle the job.",Very slow when it comes to interviews and on boarding process. Like to drag their feet.
121,Legg Mason,Good working environment,2015-11-08,4.0,Anonymous Employee,Allows operational independence in the subsidiaries. Good environment,Decision making is a bit slow
122,Legg Mason,Great company to work for,2015-10-21,5.0,Operations Associate,excellent company to work for excellent benefits,nothing bad to say overall a great company that promotes continues learning
123,Legg Mason,LM Review,2015-09-28,3.0,Risk Associate,"Great working environment, communication and flexibility","Very long commute, high turnover and company wide lay offs"
124,Legg Mason,Needs better management & streamlined business operations,2015-09-22,2.0,"Risk Associate, Risk Department","Stamford, CT Office: Reasonable salary & benefits, Good medical benefits; Coworkers are generally pleasant; Nice amenities in office & office park",Corporate structure leads to confusion and lack of cohesion because there are so many separate divisions/partners within the company; Some managers are very self-serving and unprofessional; Difficult to take vacation time because of workload & politics; Major in-office politics & power-plays
125,Legg Mason,Legg Mason Stamford Overview,2015-09-19,5.0,,Work life balance and lots of flexibility,Depends on your area but the firm is really growing and expanding. Left to be relocated so nothing to say negatively about the firm.
126,Legg Mason,Great place,2015-08-19,4.0,,Cool benefits and lots of great volunteer and learning opportunities. Also a very flexible work environment in technology.,Politics politics politics. Also a lot of bureaucracy and slow decision making. Don't expect projects to fly seamlessly.
127,Legg Mason,Senior Network Analyst,2015-07-02,4.0,,Great company to work for really care about having a family,No cons every job has con but I haven't found one het
128,Legg Mason,"Good company, good benefits",2015-06-16,4.0,Anonymous Employee,"Great place to work, decent work-life balance",Decentralized organization creates some confusion for centralized processes
129,Legg Mason,Fund Expense Analyst Intern,2015-06-04,4.0,,"great corporate culture
Easy going pace",Some bad managers who made work life harder
130,Legg Mason,Horrible,2015-04-07,1.0,,There are no pros.  Don't work here.,They work you long hours and hardly pay.
131,Legg Mason,Great place to work,2015-03-30,4.0,Accountant,"Paid time off 
Extra curricular activities 
Generous vacation time
Great reputation in the industry and region 
Ethics are front and center","Management favors specific people 
Salary below market
Not many opportunities to grow
Maternity leave below average"
132,Legg Mason,Legg treats their employees well,2015-03-23,5.0,,"Great benefits (especially leave time), competitive salary, opportunities to work from home, great people.",Lots of downsizing and layoffs (I worked here from 2007 to 2014).
133,Legg Mason,Legg Mason Global Asset Management - 3 month Summer Finance Intern 2014.,2015-03-13,5.0,Summer Finance Intern,"Extremely friendly team who are keen to help you learn wherever possible. There was lots of opportunity to learn about different areas of finance from looking at AUM data, completing reconciliation and learning about company tax. I left the internship with a developed skill set.",Lots of time spent doing accounts payable (which was made clear during the final interview). If you don't like (or aren't very competent) with excel then this role probably isn't for you!
134,Legg Mason,No way to move up,2015-03-02,3.0,,Good coworkers. It has many ptos. People are there very friendly. They had cross training. Easy jobs. Everything just review from third party.,Culture is old fashioned. No energied workplace. They don't have any places to move up since there are too many managers level there.
135,Legg Mason,Legg Mason is a company dedicated to providing products to make people's lives better,2015-02-03,5.0,Marketing Intern,Employee Resource Groups.  Encouragement to get involved in philanthropy.,Work can be a bit dry.
136,Legg Mason,Amazing,2014-12-06,5.0,,"Family, friends, people, loyal, trustworthy, fetting is gone","Nothing, Chip stepped down, Layoffs,"
137,Legg Mason,Team lead,2014-08-19,4.0,Team Lead,Work work work work work,Commute traffic work night shifts
138,Legg Mason,Great people to work with,2014-08-10,4.0,,Very nice culture and good work-life balance environment yet still efficient. Very few political issues within the parent company. Generous on salary as well.,Communication between affiliates and the parent isn't so well sometimes and the multi-affiliate model brings in some conflicts. Products' poor performance is the biggest challenge for growth.
139,Legg Mason,Legg Mason affiliate structure doesn't deliver,2014-08-04,1.0,Anonymous Employee,"Generally good people trying hard to perform
Compensation is OK overall and may even be generous to some non-performers","No common culture across the group
The affiliate approach has not delivered results 
Weak internationally
Company values not followed
Lack clear strategy
Poor distribution"
140,Legg Mason,I gained extensive experience here and learned a great deal.,2014-05-08,4.0,Anonymous Employee,"Good remuneration, good benefits, some training opportunities.",At times it can be challenging to feel connected if not working out of either the head office or one of the other main campuses.
141,Legg Mason,Business analyst in technology,2014-05-08,5.0,,"Great benefit, competitive salary, friendly people, flexible schedules",Little or no room for advancement. Career path planning nonexistent.
142,Legg Mason,May be turning a corner...,2014-05-04,3.0,Anonymous Employee,"Stability - if you're happy to settle, and are not overly ambitious you've found your spot. Work/life balance - legg is very pro-family and have good benefits that back that. The appointment of Joe Sullivan seems to have re-galvanised the company which is good. Some good people.",Very siloed: if you're not in sales it's made clear that you're one or more rungs below. Stability also means a lack of career progression in most cases; lots of people in 'protected' positions regardless of their skills. Senior management very detached from staff. Lack of cohesion between US and UK.
143,Legg Mason,My time at Legg Mason was a learning experience.,2014-04-21,5.0,Global Investment Analyst,"I enjoyed the flexible working hours, as well as the ability to telecommute. The pay was great with excellent benefits.","The word transparency was used a lot, but it was anything but transparent. There were too many ""clicks"" within the departments. Employee privacy was an issue, as HR was apart of the clicks."
144,Legg Mason,Legg Mason Internship,2014-03-10,5.0,,The environment was very friendly and the supervisors are happy to teach employees.,"Nothing substantial. The location is pretty good for Baltimore, but its still Baltimore. Not the safest city by far."
145,Legg Mason,Shadow of its former self,2014-03-05,2.0,Anonymous Employee,"Interesting work, interesting people.","Unstable, inconsistent and uninspiring leadership.  Inter-affiliate politics is stifling and the troops lack of respect for upper management leaves the firm rowing in circles."
146,Legg Mason,Too much change,2013-08-22,3.0,Anonymous Employee,"Flexibility, great office space, convenient (but expensive) parking, great location in Baltimore, good training and development opportunities (although it may be different depending on the department)","The culture and values have changed for the worse over the past few years. It's not Chip Mason's old company where employees were valued, rewarded and felt part of a family in a culture of ""no chalk"".  De-centralized environment and communication with affiliates can be challenging. AUM outflows continue."
147,Legg Mason,Business Analyst,2013-07-06,4.0,Project Manager,"Great people to work with, ability to work from home at least once a week, positive growth.",Successive lay-offs created a negative work environment. People stopped working together and conflicts formed within work teams. Management had no direction. They were too focused on meeting a project deadline/milestone instead of rolling out a quality end-product.
148,Legg Mason,Great company but constant changes at top level,2013-06-18,3.0,Anonymous Employee,Great company and good work life balance,Too many changes at top level
149,Legg Mason,Worked as an intern and absolutely loved it! Everyone was really nice and helpful.,2013-05-06,5.0,,"great work environment, nice employees, good company culture",I was very satisfied with my time at Legg Mason.
150,Legg Mason,Financial Analyst,2013-04-08,2.0,Financial Analyst,Work Environment. Culture. Hours. Benefits,Pay. Lack of advancement. Raises.
151,Legg Mason,Not bad,2013-03-12,3.0,Anonymous Employee,"Large company, international presence, well recognised",international offices may have radically different culture
152,Legg Mason,Interviewed and ignored,2012-12-21,1.0,,I was treated courteously before the final interview.,"I had a phone interview and an in person interview that both supposedly went extremely well and was told that they would contact me in the next week for a second in person interview.  It has been about a month and they filled the position, while ignoring two follow up emails inquiring about the status of my application."
153,Legg Mason,Great experience,2012-12-19,4.0,Anonymous Employee,"Good benefits, good people, good support from managers (depending on department you work in)","Lay-offs, raises, bonuses, lack of career development"
154,Legg Mason,Awesome place to work,2012-12-10,5.0,Senior Developer,"Good company, interesting work, excellent people. Good company, interesting work, excellent people. Good company, interesting work, excellent people. Good company, interesting work, excellent people.","I only got to work there for a year and a half before the recession hit and they had to lay a couple of hundred people, including me, off."
155,Legg Mason,Good people with a lack of leadership,2012-11-28,3.0,Anonymous Employee,The benefits were above average,Senior management lacks leadership qualities
156,Legg Mason,Stasis,2012-11-10,3.0,Supervisor,"Benefits of mid-size, established company with exposure to global market and relationships with other major firms within the industry. Depending on function, stress level is generally kept low.","Future of business model in question post-recession, company execs don't seem to have a definitive plan for moving company forward which has ripple effect on employee moral and career outlook."
157,Legg Mason,A global company that needs a new vision,2012-08-25,2.0,,"Great people, flexible work schedules.
Access to a global network that offers new ideas and new perspectives.","Don't get a sense of strategy or plans to move forward, except to lay off employees. This creates a negative morale loop where people no longer want to make an effort as it's not appreciated, and therefore results don't materialize."
158,Legg Mason,Enjoyed my time at LM,2012-08-04,4.0,Anonymous Employee,"Interesting assignments
Reasonable pay
Work life balance",Improve communication from the top
159,Legg Mason,Quality Corporate Environment,2012-07-15,3.0,Executive Assistant,Very structured corporate culture that allows growth and values hard work and committment.,Management does not seem to have a clear vision for the company.
160,Legg Mason,Disappointing,2012-06-23,2.0,,"Very nice people at the London Office
Exposure to Global Mutual Fund distribution","Poor communication and management by the US office since re-structure of London operations
Extremely understaffed with certain teams working late nights and weekends
Lack of experience by US office in managing the International business 
Poor client service by US office in servicing the International business
Lack of basic investment knowledge by certain US offices
Efforts by US staff in being extra nice to London staff comes across as unsincere and at times insulting given their actions and results do not match their nice promisses."
161,Legg Mason,"Early years of growth were exciting, later years of consolidation were difficult but we were treated with respect",2012-03-23,4.0,,Legg Mason is a smaller corporate center that has outsourced responsibility to its investment affiliates and others.  This has resulted in a more efficient corporate center that is focused on distribution and risk reduction activities.  Individuals with relationship building skills are greatly valued.,Direction of the firm seems less certain. Entrepreneurial skills that were extremely valued in the 90’s and 00’s have become less important.
162,Legg Mason,My experience at Legg Mason is above satistaction,2012-03-03,4.0,Production Services,Competitive compensation package with stock option and profit sharing.  Senior management is supportive.  Opportunity for advancement.  Jobs related classes are avaiable for employees.,Experience difficulty with inter groups/departments transfer.  Had to look for one's coverage to get time off work.  Outsourced IT infrastructure resulted in laid off.
163,Legg Mason,Positive,2011-12-03,4.0,,"Nice facilities, work spaces, free beverages and occasional free lunches","Expensive cafeteria, unavailable senior management"
164,Legg Mason,Very average with a below average market rate,2011-12-02,3.0,,"Very nice group of people and the working atmosphere is relaxed with the exception of some sales roles. hours not to long, some departments are distinctly understaffed!",Good support in training however development into specific areas can be limited with not many people moving role without being at the company for at least 3 years.
165,Legg Mason,People are nicer comparing to other buy side shops.,2011-11-13,4.0,,History legacy; big organization with large network; strong sales pipeline; culture is not that aggressive comparing to other shops; nice work environment.,Sluggish recovery from the recession; doubtful organization structure; sometimes people could be too laid-back. Location might not be as desirable as other firms. Not strong internationally.
166,Legg Mason,Interesting,2011-11-11,4.0,Applications Developer,I got to work with a lot of intelligent people that are hard working. I was able to learn a lot at my time there.,Challenging because of the hard times the company had. The company at the time was going through many changes that made it hard to work..
167,Legg Mason,"It was the best of times, it was the worst of times.",2011-10-24,3.0,Data Analyst,"some good upper management people. diverse group of employees, not overly competitive",bland work environment. A lot of people just seem to be their for a paycheck. Not invigorating to work for.
168,Legg Mason,A great place for work life balance,2011-10-12,5.0,,Legg Mason is an outstanding place to work.  Management is very good with helping employees balance work-life and they treat employees fairly.,"Unless you live in the Baltimore metro region, career opportunities may be limited. One of the best companies that I've ever worked for!"
169,Legg Mason,OK place to work,2011-09-03,2.0,,"good salary and benefits for the financial industry
lot of good employees who try hard to do their job properly","poor planning or foresight - direction of operations not thoroughly thought out
not very adaptable to change
lack of overall teamwork"
