,company,headline,date,overall_rating,author_position,pros,cons
91,TPG,Executive Assistant,2018-06-15,4.0,Executive Assistant,"Great company, great benefits, feed you lunch everyday","long work hours, no room for growth for assistants, hierarchy structure"
92,TPG,Loved working for this firm.,2018-06-05,5.0,Anonymous Employee,"Full of creative, go-getters who were solutions-oriented. High energy and entrepreneurial. Still had a small company feel despite its size.  Your voice will be heard and you are encouraged to offer thoughts and ideas. Senior management will speak with anyone, no feeling of hierarchy.  Fascinating business always moving forward. You are expected to be fully dedicated and are compensated very well for doing so.",None. Best working experience of my career.
93,TPG,Excellent place to work,2018-05-24,5.0,Anonymous Employee,Great people and experience at TPG,I can't think of anything to note
94,TPG,Good for starter in job market,2018-05-23,3.0,Customer Service Representative,"Entry level good for graduates, or working while studying. After that, better apply for higher roles. Ok environment as there are multiple cultures","Salary a bit low, not much chance of outdoor activities, no incentives"
95,TPG,Hired,2018-05-15,3.0,Anonymous Employee,Good company from what i was told,Have not had any so far
96,TPG,Great learning,2018-05-07,5.0,Anonymous Employee,"Good people, collaborative culture, lot of learning",Deal activity was quite volatile
97,TPG,review,2018-02-12,5.0,Anonymous Employee,great experience for young person,can't think of a thing
98,TPG,The Very Good and Very Bad to work in,2018-02-01,4.0,Anonymous Employee,"Good package , employee benefits and working environment.",Weak management and organisation structure with no professional advancement prospect for mid-level employees.
99,TPG,Analyst,2018-01-10,3.0,Anonymous Employee,"Great people, positive workspace, a lot of room for growth, beautiful building in a great location","Very quiet office, everyone keeps to themselves which can be both good and bad"
100,TPG,Hopeless in customer service,2017-12-06,1.0,Anonymous Employee,Mid range price in comparison with other Service providers,"Terrible customer service,
Unreliable service even in Sydney
unable to help if something goes wrong,"
101,TPG,Consultant,2017-12-05,4.0,,Good company. Some great advisors to work with,Quality of some people (not all) and their knowledge to run a company they acquire or merge.
102,TPG,Good pay but under staff,2017-12-02,3.0,Anonymous Employee,Good Pay and bonus. Good insurance.,"Under staff, Office culture and internal politics not good."
103,TPG,Poor benefits and poor management,2017-11-27,2.0,Anonymous Employee,Work life balance was great for part time employees,Company does not promote from within and negates to recognize hard work from full time employees that have been with the company for years.
104,TPG,"Good Pay, but No Life",2017-11-16,2.0,Anonymous Employee,"Good pay, plus excellent benefit and bonus.","- all seniors (no matter they're just a supervisor, VP, or very senior MP) expect  you to read their whatsapp, email 24x7, and provide respond within few mins.

- if you're a lady with a family, I highly recommend you not to join because no one in the company will care about you need to look after your family after office hours.  They all assume you have 10 helpers to take care of your house work."
105,TPG,"The good, the bad and the ugly,  they got it all",2017-11-07,3.0,Front Desk Agent,The love bombing in the beginning is incredible. They rather torture you than fire you. There are some really nice people working there. Fosse is easy to learn.,"No breaks at the front desk except to use the bathroom quickly.  No empathy, no compassion, no humanity, no matter what happens, just say your sorry and that it will never happen again. No, shush, stop! They don't care. It's your fault. Your making a mountain out of a mole hill. Probably because your a dumb blonde or a woman as I've been told."
106,TPG,Product configuraion and test automation,2017-10-10,3.0,Anonymous Employee,great team. great learning curve. They will teach you everything you want to learn,way below market rate salary.  They are pretty bad at holding back employees. Too many people including managers have been resigning over the last couple of months.
107,TPG,Very catty EA's and chauvinistic male Sr Executives,2017-09-28,2.0,Senior Executive Assistant,They supply great bonuses to their EA Staff.,"The SF Office is a fashion show. If you are an EA with a family, they look down on you. You are of more value when you are young and fresh or older with older children that need less attention. They work you long hours and through lunch, so have it catered daily, but with no breaks. Its like a cattle call when its lunch time. They also pile work on you and don't ask how you are doing, and will continue until you go under with no remorse. Very cold environment. Not a great place for work/life balance."
108,TPG,The FW Office is a fraternity not a place of employment,2017-09-27,2.0,Manager,- Know the right people and you'll be praised for photocopying,"- Talented employees leave because of managers with limited 'TPG' only experience.
- Politics trumps product no matter what you do.
- Not sure they've heard the terms diversity hiring and glass ceiling. A few minority (both gender and race) hires don't make you a diverse workplace."
109,TPG,Working for TPG,2017-07-14,1.0,Finance Manager,Large company. Perhaps too large for its own good,"Don't fool yourself, you're just a number"
110,TPG,Associate,2017-07-06,1.0,Associate,"Fast pace, and good pay","Bureaucratic, lack of work life balance, incompetent back office"
111,TPG,supervisor,2017-05-30,5.0,Supervisor,"Good employment opportunities, a wonderful company to work for",working with public is not an easy task
112,TPG,Associate,2017-05-28,5.0,Private Equity ­ Associate,"Working at TPG gave the the chance to work side by side with some of the brightest investors in the Private Equity industry, as well as the chance to lead significant deal processes. The firm is truly global, and gives exposure to every relevant world economy. The firm also possesses an unparalleled Senior Advisor Nework which allows the deal teams to access relevant industry intelligence.",None that I could recall
113,TPG,Enjoyed my time there,2017-05-25,3.0,Anonymous Employee,Smart people. Interesting challenges. Good benefits. Philanthropic activities.,Elitist. Break down between front-office and back-office.
114,TPG,Great place,2017-05-11,4.0,Anonymous Employee,Really liked most people I worked with. Good amt of autonomy and can manage your own time for the most part. Great perks and travel policy.,During busy spells the hrs are very tough.
115,TPG,Good on building Network Career,2017-05-06,3.0,Anonymous Employee,"*Good training ground for starters
*Certification is necessary but hiring managers will evaluate on what you know
*Offer is quite high compare to other ISP's that hire newbies
*You got tons of online web page that you can read during free time
*Morning shift Mon-Fri
*People are approachable","*Workload is quite high
*Only short training are provided to newbies (Learn as you go)
*The salary can support maximum of 2-3 people."
116,TPG,Good pay and vacation and benifits,2017-03-20,3.0,Anonymous Employee,Sick time accrued and benifits,Take vacation time off if you take unpaid leave in previous year
117,TPG,Okay,2017-03-13,3.0,Anonymous Employee,"Nice perks, some nice people","Culture stinks (secretive, total lack of diversity - white male dominated, no visible leadership)"
118,TPG,Very good,2017-02-22,4.0,Graphic Designer,Good working environment  good benefits good work station nice food good location is very easy to get there from Bart or Caltrain,No room to grow in a short term ( years ) people stay in the same position for a long time  and projects are monotonous
119,TPG,Working culture at TPG,2017-01-04,5.0,Director,"TPG has great working environment, empowerment of the employees, project discipline, team support factors are just excellent.","Administrative processes are managed from one place, which sometimes takes longer than it should."
120,TPG,Analyst,2016-12-27,5.0,,"Compensation, smart people, perks, culture","Hours, learning curve, lack of training"
121,TPG,Accounting Manager,2016-12-04,4.0,,"Great opportunities, compensation and benefits",Intense and demanding workload.  It is easy to get burned out.
122,TPG,TPG EA,2016-10-20,3.0,Executive Assistant,"Daily catered lunch, team oriented work place.",Private Equity company so everything was very confidential making it difficult sometimes to perform EA job functions. Not much recognition for good work and super high turnover rate. Very little loyalty.
123,TPG,TPG Loves its Employees,2016-09-12,5.0,,Tons of perks outside of pay and bonus including sports tickets and fun team building events. TPG makes sure to keep its employees informed about what the firm is doing.,"Sometimes the hours are long, but management still has a lot of respect for family/work balance"
124,TPG,Partner,2016-08-27,3.0,Partner,"Great people, good values, nice offices",No transparency and lack of visible leadership
125,TPG,Best training ground,2016-08-25,3.0,Network Engineer,"best training ground for network engineer who has just started and for those who have experience that would like to dig in further. Since this company has massive multi-vendor equipment, advanced technology and complicated internetwork connectivity, Engineers who have left the company has a higher chance of getting higher pay due to their extensive knowledge","Since this company has been acquiring a lot of smaller and bigger companies abruptly, management is having trouble making things in order."
126,TPG,Employment,2016-08-22,4.0,,Good money; can work independently,Work you to the bone
127,TPG,Ok job,2016-07-19,3.0,Behavior Analyst,Great people to work with.,Management changed allot through my employment.
128,TPG,Assistant,2016-06-26,3.0,,"Good perks, vacation time, benefits.",All Management is terrible.  Secretive to the point where you are guessing all the time if you are going to have a job the next day. HR department is a joke. They keep hiring friends of friends.
129,TPG,Dysfunctional organization to avoid.,2016-03-25,1.0,Director,"Catered Lunch and Parking is nice.  Pay is  generous for Texas, but the bonus structure is erratic and political.  Good opportunities for admin and personnel not directly tied to the PE function but in ancillary jobs.  Good job for green grads first two years.","3billion + PE firm Still using Excel 2010. No IT leadership.  Resistant to outside ideas or persons from Wall Street.   Very silo'd, political place to work where it is forbidden to speak to anyone outside your work area without sanction from direct supervisor.  

Decision authority at TPG is concentrated in the hands of a few persons with zero ""street"" experience, who in turn reward loyalty over ability.

Empty IPO promises since 2008.  Run by limousine liberals and trial lawyers whose political agenda take precedence over employee advancement.  While you can get paid, you are at the mercy of lawyers whose instinct in disputes is to sue first, manage later.  Not for FW outsiders or industry experienced pros.  TPG has become insular and employees from similar PE firm are seen as threats.   Avoid TPG if you are an established PE pro."
130,TPG,Amazing corporate culture with excellent direction from senior leadership,2016-03-01,5.0,Manager,"Great pay, free food/drinks daily, excellent corporate culture, great direction from senior leadership, lots of people driving efficiency and change, amazing projects that take advantage of the newest techology",Lots of work that cuts across multiple functions and business units to coordinate all of the changes
131,TPG,Accountant _ FW,2016-02-26,5.0,Accounting Manager,Always something new and exciting. Compensated based on drive and work ethic - you have to put in the work to get the awesome compensation (and it is awesome)!!,"There are long hours and demand of excellence is high, however this helps build soft skill set that can help you be successful as you move up the ladder at TPG."
132,TPG,Executive Assistant,2016-02-09,5.0,Executive Assistant,Great Company! Take care of their employees,more opportunity for the assistant to grow
133,TPG,Good company,2016-01-13,4.0,Executive Assistant,"Great benefits, great pay, best holiday parties, excellent office",There is absolutely no room for growth as an EA. If you're hired as a EA they will never promote you beyond EA.
134,TPG,Great place to work,2016-01-13,5.0,,"Incredibly talented people, strong work ethic, honest.","High stress environment, lots of busy work."
135,TPG,architect,2016-01-08,1.0,,"none, none, none, none, none.",underhanded and evil.  this place sucks
136,TPG,VP,2016-01-05,4.0,Anonymous Employee,very smart people and interesting work,long hours and sacrifices made for the job
137,TPG,Working Environment,2015-10-12,5.0,Service Assurance Engineer,Fun working environment. Good training.,minimal benefits. minimal benefits. minimal benefits.
138,TPG,Operations Manager,2015-10-10,1.0,Operations Manager,"Friendly company
The staff are nice and aprocheable","Very stingy with money
Owners worried about saving the last penny
Only provided the basic to work with: computer, printing, printing paper, pens
You have to buy your own stationary
Very conservative company 
Bad customer service"
139,TPG,Great company to settle down with,2015-10-05,4.0,Executive Assistant,"You'll never go hungry, kitchens are stocked with snacks and lunch is catered every day. They reimburse your monthly parking if you drive to work. Excellent fully paid benefits. Job duties are clearly defined and pretty straightforward.","Don't expect any variety in your day-to-day tasks. I supposed some departments may have more variety than others, but generally speaking, the EA role at TPG is limited to booking travel, scheduling calls/mtgs, and preparing expense reports. It's good place to be if you don't need to be challenged and don't mind feeling like you're in a rut after just 2 weeks. Most Admins can expect to help out at the front desk answering phones and greeting guests when the receptionist needs to take breaks. This can be disruptive to your day when you're trying to get things done but keep getting called up to reception for bathroom breaks. As far as upward mobility goes, there isn't much. If you're a rockstar and put in the time, you may get to work for a partner."
140,TPG,Intern in Fort Worth office,2015-08-27,5.0,Summer Associate,"Free, catered lunch every day.  Super smart people.  Opportunity to learn a ton.","Highly motivated people and high expectations.  Not always a lot of direction, so best for people who are self starters and ""have get it done"" mentality."
141,TPG,Great benefits but...,2015-08-18,3.0,Anonymous Employee,"In general, people are very nice if you talk to them (don't expect people to go out of their way to get to know you though)

High quality company benefits:
Top notch healthcare
Lunch provided every day
401K
Salary + bonus","No corporate culture.  At all.

Very hierarchical.  Administrative staff at the very bottom of the chain and indirectly, made to feel that way.  Perks abound at all levels but not if you are an admin (firm conferences, new hire dinners, team building retreats...not if you are an admin).  Huge dichotomy between investment teams and administrative professionals.

Very little (almost zero) training.  A few sessions are offered here and there for new technologies, but don't expect any new hire training as an admin.  You'll receive an administrative handbook, desk, computer and access to all the supplies you need, but there is no ramp up and no formal new hire training for administrative staff.  None.  As a result, people are left to sink or swim and sadly, some good people leave b/c they weren't afforded the resources or time to find their feet.

High turnover.  Mostly admins seem to be fed up or find something more interesting, in light of all the benefits and pay.

Senior management doesn't seem to know anything about what the administrative staff experiences and they don't inquire about it either.

Some tenured administrative assistants have moved up the chain in to interesting roles, but that is few and far between.

Overall, if you are an admin and corporate culture is important to you, then this is not the place. I cannot speak for the investment teams that seem to bond and get together frequently at sponsored events."
142,TPG,great company,2015-08-12,4.0,Anonymous Employee,Great company that takes good care of its people.  Lots of smart and hard-working former big-4s - good learning source.,"You need to love Cowboys, Rangers and TCU Frogs to be ""included"" in the ""club"".  Top management seems to be nice and friendly, but could make you feel they're a bit flaky."
143,TPG,OK,2015-06-29,3.0,I Work Here,"It's a job with benefits,  base pay is decent,  overtime is discouraged,","Work hours are set, no flexibility whatsoever, no work from home option.
Too much stress with too little appreciation.
Line management is frequently abrasive.
No perks, lame health insurance, 401k match is only 1/4th, PTO is at the minimum.
Dress code !!??"
144,TPG,Good Company with Great Potential,2015-06-05,4.0,Anonymous Employee,"Good pay once you prove yourself, great benefits, and Regional/Corporate Executives are visible and offer assistance as needed,","Training is up to you, and they sometimes fail to recognize great employees until they are walking out the door"
145,TPG,Accountant,2015-06-02,3.0,Anonymous Employee,"Great benefits. Hours are good. Catered lunch, vacation and sick days. Great office setup. Nice people to work with.",Training is not well thought out. Typical office politics. Not a lot of upward movement. Systems are all over the place.
146,TPG,Amazing place with great opportunities,2015-05-19,5.0,Anonymous Employee,"Some of the smartest people I know work here and the culture of the company is one of the best in all of private equity. Great salary, benefits, and nice work environment",As the company grows it is beginning to lose of some of the culture that made it such a special place. But I have faith in the management that they will fix this
147,TPG,"Great perks, no growth",2015-04-09,3.0,,"Great benefits, smart people, good pay.",Limited opportunities for growth if you're an assistant.
148,TPG,Don't be too ambitious,2015-01-28,3.0,Executive Assistant,"Great pay, decent people, reasonable time-off policies. IT and office facilities teams are very easy to work with, which is important for admins since we're always shifting rooms, ordering catering, and assisting the higher ups and their guests in setting up equipment. This company also knows how to throw a party.","No opportunity for growth from an admin role. If you start at this company as an admin, you will always be an admin. They are very old school in regards to ""secretaries"", not incorporating technology, and any change in general. Also be prepared for everyone in your life to have to file compliance paperwork since you may come across big deals daily."
149,TPG,Poor work/life balance,2015-01-27,2.0,,Good pay and lunch is provided,Lots of turnover. Terrible work/life balance.
150,TPG,Great place to work,2015-01-22,4.0,,Compensation is decent but not best in PE,Hierarchy is really rigid.  Hard to get anything done unless in senior role
151,TPG,good job,2014-09-22,4.0,Night Audit,"good job 
pay alright 
work late night","no sleep 
boring after getting work done"
152,TPG,Poor overall experience,2014-08-27,1.0,Executive Assistant,"comp and bonus, free lunch","no personal growth
no work life balance"
153,TPG,Good place for Executive Assistant,2014-08-07,4.0,Executive Assistant,"free lunch, nice offices, decent pay","executives can be curt, they see through the EAs. It's too bad because they do have a lot of quality people working with them."
154,TPG,A Great Company that needs MUCH improvement locally in the HR Department,2014-05-07,3.0,Executive Assistant,"My experience here was unique as I was able to support a very bright, very busy, but supportive high level executive.  We had a very good working relationship. The company offers many perks, including great pay, vacation allowance, health benefits, etc.",The local HR department head (if you can call it that) undermines everything good about working for this company.  They let many undeserving people take complete advantage of the company.
155,TPG,Very much a mixed bag,2013-12-05,3.0,Anonymous Employee,"Great employees, benefits, learning curve",Lack of career progression in every area of the business
156,TPG,OK place to work,2013-05-07,3.0,Anonymous Employee,the only thing i can think of ( and the management keeps bringing this up as first point) catered lunch.,poor managment. you will always be guessing on whats coming next.
157,TPG,"Good place to work -- high stress, but high rewards.",2013-04-30,4.0,Senior Associate,Strong focus on integrity and accountability.,"Job stagnation, Burn-out.  Extremely long working hours during parts of the year."
158,TPG,Great place to work,2013-03-06,5.0,Manager,Great people and fun environment,No cons that I can think of
159,TPG,Associate,2013-03-03,4.0,,"One of the best cultures in large cap private equity.  Very smart, hard working group of people.  People expect you to work long hours but are understanding of a life outside the office as well","It's a great private equity firm, but a very large one - not a good fit if you are looking for a smaller team environment.  Hours are normal for private equity but long for any other profession"
