,company,headline,date,overall_rating,author_position,pros,cons
447,Houston Methodist,Great Company to Work,2021-03-11,4.0,Supply Chain Specialist,"Good Benefits
Great Community
Awesome place to grow","Get ready to walk
Terrible Cafeteria Food"
448,Houston Methodist,Best place to work,2021-03-10,5.0,"Registered Nurse, BSN",Management always listen to employees,Too much micromanagement in every level
449,Houston Methodist,Good,2021-03-10,3.0,Worship Pastor,Best place to work all the time,Maybe a little too intense for the fainthearted
450,Houston Methodist,Great company,2021-03-10,5.0,Patient Access Representative,EVERYTHING. I love it here,"NOTHING. So far, everything has been wonderful"
451,Houston Methodist,Awesome Job,2021-03-10,4.0,Registered Nurse,"Great pay, treats employees great!",some of the staff were very judgey.
452,Houston Methodist,Job,2021-03-09,3.0,"Registered Nurse, BSN",People you work with are nice and professional. Hospital seems to care about employees. Bonuses for hand hygiene.,"Hospital culture seems to be kind of cult like.

Sometimes patients get left behind. 
For example ER MDs only have to see a certain number of patients during their shift so if a patient comes in at end of their quota with a long tedious work up the doctor will put them off until relief comes in. Most of the time it’s not during an emergency but I’ve seen it during times in which the patient may have cauda equina and that is a medical emergency that can have serious implications on a patient’s ability to void long term. It’s not as serious as a heart attack or stroke but still has long lasting effects on the patient if not dealt with quickly. Methodist also has a special program for big donors so they treat some people better than others in medical care, which is definitely not right. They even have special customer service individuals that meet with these high paying donors during their stay and are alerted to this fact when they enter the hospital which seems like it may be a violation of HIPA.
Management doesn’t understand mandatory overtime laws in Texas and hold over against their will with meetings after their shift but before report can be given."
453,Houston Methodist,n/a,2021-03-09,4.0,Registered Nurse,its good place to work and very friendly,i cannot find any negative about this institution.
454,Houston Methodist,Great Culture and Stable Organization,2021-03-09,5.0,Administrator,Wonderful culture and group of people to work with and for,Salary appears to be lagging behind other organizations in the area
455,Houston Methodist,Registered Nurse,2021-03-08,5.0,"Registered Nurse, BSN",Great team and workplace culture,Working holidays is not the most fun
456,Houston Methodist,General Review,2021-03-07,5.0,RN-1,"Great health insurance, benefits, opportunities for growth","Must either pay to park in a parking garage, or park in an offsite lot and take a shuttle"
457,Houston Methodist,Compassionate Place of Employment,2021-03-07,4.0,RN Case Manager,HM is an excellent company overall. Put patients and customer service first in delivering quality care. Great team and leadership. Try to make a healthy work-life balance.,"For the size of hospital they are in Baytown, it seems behind on advancing in higher care needs to patients. I hope they consider adding higher quality care in Baytown."
458,Houston Methodist,Phenomenal company,2021-03-06,5.0,Occupational Therapist,"Great benefits, learning opportunities, great leadership. They really care for their employees",They are short staffed and desperately need employees but can only hire a set number of full time employees
459,Houston Methodist,Unprofessional HR,2021-03-06,2.0,Prefer Not to Say,"Great organization, hard work is being rewarded, amazing teammates, good work life balance.","This review is about HR function of our otherwise great organization. HR may be doing a satisfactory job with the technical side (FMLA, STD). However, the disaster comes when HR generalists try to do everything: from the job codes cleaning to trying to be a middle man in conflict resolution. The latter is a farce and “dog and pony” show. Even if middle management is 100% wrong, and it’s obvious as day and night to many, HM generalists will side with the management and will not stop management’s obnoxious, insulting behavior. They will not follow up, they will not provide strategies for the parties as promised. They need education and training on conflict resolution. But most of all, they need to have integrity and accountability that they lack. People who work for HM for 30+ years are wise to note that the role of HM HR is only to protect HR. 
Is it time to restructure the processes that are not working?"
460,Houston Methodist,"Excellent place to work, but long hours",2021-03-05,4.0,Business Development Consultant,"Benefits are excellent, and ICARE culture","Worked long hours, high stress and fast paced."
461,Houston Methodist,Great,2021-03-05,5.0,"Registered Nurse-OR, Operating Rooms",Many good things to say,Only few bad things to say
462,Houston Methodist,Good overall,2021-03-04,4.0,RN-2,"Good resources, updated technology, bonuses, strong charge nurses and managers, welcoming seasoned nurses.","none until COVID, always short staffed but that's a nationwide problem currently."
463,Houston Methodist,Great Organization!,2021-03-03,5.0,Project Specialist,Great benefits package; very employee-oriented.,Resistance from seasoned employees when it comes to change.
464,Houston Methodist,Nice company,2021-03-03,5.0,Anonymous Employee,Good management and good policies,I did not see any cons
465,Houston Methodist,Work environment,2021-03-03,4.0,Patient Care Assistant (PCA),They care about their employees and offer good bonuses.,Can be short staffed at times and work environment can be stressful.
466,Houston Methodist,Awesome place to work for career and personal growth,2021-03-03,5.0,Anonymous Employee,Great employee engagement; leadership cares about you!,Leadership positions are hard to obtain; no one leaves.
467,Houston Methodist,Great Place to Work,2021-03-03,5.0,Senior Human Resources Generalist,Love the ICARE values the company has.,"None, it is a great place to work!"
468,Houston Methodist,Work,2021-03-02,5.0,Registered Nurse,"Everything, nothing is wrong here",Cant say there is anything wrong
469,Houston Methodist,Good Employer,2021-03-01,5.0,Registered Nurse,"Good institution, Good Collegues, Excellent place to work","Busy environment, travel downtown, better management"
470,Houston Methodist,One of the best places to work!!!,2021-03-01,5.0,"Registered Nurse, BSN, MSN",Great environment to work in! Definitely at the top of the list for Healthcare in Houston,"None, that I can identify at this time"
471,Houston Methodist,nurse,2021-02-26,5.0,Registered Nurse,awesome place to work at,there was no cons about this job
472,Houston Methodist,Well-run organization,2021-02-26,5.0,Physician,"Good leadership, proactive, thoughtful, good at crisis management",Not very many low points here
473,Houston Methodist,Great place,2021-02-25,5.0,Registered Nurse,Respectful great people always willing to help,Nothing negative to say about working here.
474,Houston Methodist,Excellent company,2021-02-25,5.0,Staff RN,Treat employees very well. Pay out bonuses quarterly.,I don't have any negatives overall about Methodist
475,Houston Methodist,Love it here,2021-02-24,5.0,Senior Secretary,great benefits and quarterly bonuses,none that I can think of.
476,Houston Methodist,Great hospital,2021-02-24,5.0,RN II,"Great retirement plan, and health insurance.
Constantly getting raises and bonuses.",Always being called to work extra on days off.
477,Houston Methodist,Great place!,2021-02-20,4.0,Anonymous Employee,"Good benefits, salary is fair. Supportive of staff!",Parking in the medical center is expensive
478,Houston Methodist,HMB,2021-02-20,5.0,RN I,Great place to work. Team work and management willing to help.,Clinical latter can be overwhelming to move up but managers assist.
479,Houston Methodist,Micromanagement,2021-02-19,4.0,"Registered Nurse, Critical Care","Great bonuses, benefits, and overall job satisfaction.",There is some serious next level micromanagement.
480,Houston Methodist,Registered Nurse,2021-02-17,5.0,"Registered Nurse, BSN",Good over all hospital culture,Houston Methodist The Woodlands is not magnet
481,Houston Methodist,Nursing,2021-02-17,4.0,"Registered Nurse, BSN","Great Interprofessional teamwork 
1:4-5 nurse to patient ratio
Competitive salary",Holiday schedules aren’t very flexible
482,Houston Methodist,Company review,2021-02-16,4.0,Paramedic,Benefits were good for company,location and parking for mid shift was unsafe
483,Houston Methodist,Great,2021-02-12,5.0,Research Assistant I,"Good environment, helpful staff, fun",Can be competitive at times
484,Houston Methodist,Very good company,2021-02-10,5.0,Lead Mental Health Tech,"Great Pay and Benefits, very competitive training",Stressful environment at times but It’s manageable
485,Houston Methodist,Houston Methodist,2021-02-09,5.0,Anonymous Employee,Growth oriented environment with personable and kind leadership.,There are no cons here.
486,Houston Methodist,Great place,2021-02-08,5.0,Anonymous Employee,"PTO Rollover, Bonuses, Holidays, Family and great management",If you dont know anyone then you are not moving up.
487,Houston Methodist,Good,2021-02-07,5.0,Health Screener,"Nice coworkers, good management, adaptable schedule","Boring, dealing with patients and family can be emotionally taxing"
488,Houston Methodist,Methodist is great,2021-02-06,5.0,Registered Nurse,Great hospital. Treat their employees well.,None. The work can be stressful.
489,Houston Methodist,rn,2021-02-04,3.0,ICU RN,"supplies available, can find policies",tripled once a week at least in icu
490,Houston Methodist,Excellent Hospital,2021-02-04,5.0,Registered Nurse,"Rewarding environment, feel appreciated by corporate",Ratios can be difficult at times
491,Houston Methodist,great,2021-02-03,5.0,Nurse Practitioner (NP),supportive hospital to work for,none that I can think of
492,Houston Methodist,Takes care of us,2021-02-03,5.0,Certified Surgical Technologist (CST),Makes sure we get paid during disasters,"Not many, I can’t think of any at the moment"
493,Houston Methodist,Great Place to Work,2021-02-02,5.0,Clinical Research Coordinator II,Top of the line medicine.,Have to pay for parking.
494,Houston Methodist,Best Place to Work,2021-02-02,5.0,Operations Manager,Job security (no layoffs/furloughs during pandemic); consistent; value-oriented,Only located in Houston (would love to find career opportunities within the organization in other cities)
495,Houston Methodist,The best hospital. #1,2021-02-02,5.0,Certified Nurse Assistant,"We highly believe in patient satisfaction , self scheduling , tuition reimbursement , empower values",I do not have None at this time
496,Houston Methodist,Below Average Experience,2021-02-01,2.0,HR-Admin,Lunch options nearby with modern facilities,Neither diverse nor inclusive at management level or higher
497,Houston Methodist,Good,2021-01-31,4.0,Food Service Worker,Good co workers good medical benefits,Monotonous and too much work for one person
498,Houston Methodist,Good place,2021-01-31,3.0,Collections Specialist,"Pay, holidays were good and due to COVID-19 we were spaced far a part from each other",Mgmt a bit disorganized at times
499,Houston Methodist,Great place to work as a team,2021-01-31,4.0,Network Security Architect,Collaboration and no micromanagement allows you to thrive. Many opportunities to move up in IT based on the projects you are involved in.,Teams run lean and work weeks extend over 40 hrs.
500,Houston Methodist,RN,2021-01-30,5.0,"Registered Nurse, BSN",Wonderful system to work for.,Great system to work for.
501,Houston Methodist,great place to work,2021-01-30,5.0,Unit Secretary,"great pay, sign up pay",not so good insurance benifits
502,Houston Methodist,Registered nurse,2021-01-30,5.0,Registered Nurse,"good pay, good culture, support",lower pay than some surrounding hospitals
503,Houston Methodist,n/a,2021-01-29,5.0,Student Professional Nurse,"helpful management, good pay, good benefits","understaffed units, adjustment to new contracted nurses"
504,Houston Methodist,Great place to work,2021-01-29,5.0,Registered Nurse,"culture, benefits, teammates, senior management",better career growth opportunities within your department
505,Houston Methodist,great hospital to work for,2021-01-29,5.0,Registered Nurse,"benefits, co-workers, management, schedule, resources",there aren't any cons about this hospital
506,Houston Methodist,communication NONE,2021-01-28,2.0,Patient Access Representative,none communication with management sad,horrible communication favoritism sad company
507,Houston Methodist,Transporter,2021-01-27,4.0,Curbside,"trains work under pressure
repect throughout","great workers
great hours
great pay
great managment team
friendly inviroment"
508,Houston Methodist,Umm,2021-01-27,2.0,Dietary Aide,"Good benefits 
Starting pto
That’s about it","Management 
No work life balance 
Unable to progress"
509,Houston Methodist,I left due to Covid cases,2021-01-27,4.0,ER Nurse,Coworkers are friendly and the break-room is nice,Very fast-paced and difficult to get to
510,Houston Methodist,Great Culture and Strong Values,2021-01-26,3.0,Medical Staff Specialist,Benefits and flexibility. Allows for great work life balance.,Mindsets of some leaders do not fully align with those of executive leadership when it comes to growth and innovation of staff.
511,Houston Methodist,Great Company,2021-01-26,5.0,Practice Lead,"Houston Methodist takes care of their employees. Great pay, great benefits... CEO and President Dr. Boom are awesome and they actually interact with the employees",Some of the managers in certain departments are not as fully knowledgeable. It’s who you know that gets you the management jobs and not your experience
512,Houston Methodist,professional,2021-01-25,5.0,Patient Care Technician,very good job and great breaks.,very bad management and very stressful service
513,Houston Methodist,No longer leading Medicine,2021-01-25,4.0,Staff Nurse (RN),The care given is patient centered. Before covid they had an annual company party for all the nurses during nurses week. Pay is competitive.,Covid has been very challenging. Nurses are burnt out and administration is focused on cost cutting measures. Nurses aren't being paid hazard pay and travel nurses make triple our pay to do the same job. There is not much of an incentive to stay.
514,Houston Methodist,Benifits,2021-01-24,3.0,Registered Nurse,"Great experience, life work balance",Understaff and management in some other areas
515,Houston Methodist,Great,2021-01-23,5.0,Registered Nurse,"Takes care of employees, encourages further studies","Too much micro management, requires a lot of tasks from nurses"
516,Houston Methodist,na,2021-01-23,3.0,Nurse,its a very good place,its very stressful sometimes. pt load heavy
517,Houston Methodist,Cool but short staffed,2021-01-22,3.0,House Keeping,"Working on your own, great pay for the job, shift differential","Working during the pandemic being exposed to covid, don’t like to pay you if you’re out on leave or get hurt on job"
518,Houston Methodist,awesome,2021-01-22,4.0,Volunteer,it is actually really very awesome,i can not think of any cons
519,Houston Methodist,Houston Methodist,2021-01-22,4.0,Registered Nurse,Wonderful hospital with great nurses and co-workers. Doctors are some of the best in their field. Good benefits.,Top heavy in management. Overload of patients per nurse. Better now than when I worked there.
520,Houston Methodist,Review,2021-01-22,3.0,Registered Nurse,They have really good benefits,They are always short staffed
521,Houston Methodist,work life,2021-01-21,5.0,PCA II,good place to work best job,no comment live my job at the time
522,Houston Methodist,Awesome place to work,2021-01-20,5.0,Patient Access Scheduler,"Great environment, benefits are awesome, competitive pay, bonuses",At this time no Cons
523,Houston Methodist,Great,2021-01-20,5.0,Anonymous Employee,"Patient focused, compassionate, benefits, culture",I cannot think of any cons.
524,Houston Methodist,Rehab therapist at Methodist,2021-01-19,5.0,Physical Therapist,Support for growth and learning,big team with many personalities. Can find yourself working with strong personalities
525,Houston Methodist,great,2021-01-19,5.0,Registered Nurse,This is wonderful system to work for.,Always trying to better environment and employee satisfaction
526,Houston Methodist,Analysts,2021-01-18,4.0,Revenue Cycle Analyst,Great place to work in,Management can be a little difficult
527,Houston Methodist,HMSL,2021-01-18,4.0,Registered Nurse,"Beautiful Hospital, good benefits, love the patients","Coworkers, poor staffing, biased management"
528,Houston Methodist,Great hospital to work at! Staff is all friendly and team work is a priority.,2021-01-17,5.0,Patient Care Associate,Friendly staff and diverse group of individuals.,PRN staff do not receive benefits.
529,Houston Methodist,Great Company,2021-01-17,4.0,Clinical Research Coordinator,Nice people to work with,delay in getting the promotions
530,Houston Methodist,My experience,2021-01-17,4.0,RN II,"Good work environment, nice benefits",Pay not commensurate with one’s experience
531,Houston Methodist,Excellent place,2021-01-15,5.0,"Registered Nurse, BSN",There are amazing benefits and they are magnet.,Nothing stands out that is negative.
532,Houston Methodist,Great place to work,2021-01-14,4.0,Registered Nurse,"Lots of opportunities, OK benefits, frequent continuing education offerings, reputable institution",Pay could be more competitive
533,Houston Methodist,Disorganized,2021-01-14,3.0,Admitting Representative,"If you get under a good manager, it is worth it.",The department is majorly disorganized. Always short staffed.
534,Houston Methodist,Good job with good benefits,2021-01-14,4.0,Registered Nurse,Multiple bonuses throughout the year,Did not give hazard pay during COVID
535,Houston Methodist,Really cares about their employees !,2021-01-12,5.0,"Registered Nurse, BSN","I’ve worked at 4 different hospitals as a full time nurse prior to being employed by Houston Methodist. Our Walter Tower surgical suites are beautiful and state of the art. This is hands down the best place to work, they really care about their employees and my worst day here is still better than most days at the previous hospitals I’ve worked at! We get a quarterly bonus, Hero bonus, and we’re also getting a bonus for taking the covid vaccines! Dr. Marc Boom is incredible, we’ve been getting daily emails from him to update us on the covid status, he always keep us in the loop as best as he can. During the Capitol riot, he even sent out an email prayer. I’ve never experienced a CEO like him in my career.",Christmas decorations are gone too soon
536,Houston Methodist,Administrative Assistant,2021-01-12,5.0,Administrative Assistant,"Great benefits, work life, cash bonuses","Parking, location was busy with traffic"
537,Houston Methodist,Okay job,2021-01-11,3.0,Patient Care Technician,"Benefits, salary, time, co worker","Covid, stressful, limited working hours"
538,Houston Methodist,Good,2021-01-11,5.0,Registered Nurse,"Good company, great benefits, good schedule","Poor ratios in pandemic, no other complaints"
539,Houston Methodist,Lovely hospital,2021-01-10,5.0,"Registered Nurse, BSN",High patient satisfaction and very professional staff,"Low nurse satisfaction, and overwhelming expectations of staff"
540,Houston Methodist,Top rated hospital,2021-01-10,4.0,"Registered Nurse, BSN","Good benefits, pro nurses, magnet recognized hospital",Always under staffed. No hazard pay for covid floor
541,Houston Methodist,Houston Methodist Clear Lake,2021-01-08,5.0,Registered Nurse,"Overtime available
Frequent bonuses and pay raises",Bad management on Med Surg floors
542,Houston Methodist,Benefits,2021-01-07,2.0,Scheduler Ll,"They pay for parking, and school reimbursement.",No room to grow you try to apply for different positions but everything is a lower pay with more duties. Beware of management.
543,Houston Methodist,Awesome,2021-01-07,5.0,Physical Therapist,Great mentors and understanding management,I can not think of any!
544,Houston Methodist,Was great until COVID.,2021-01-07,4.0,Imaging Representative,"Great pay for the area
Fantastic company culture
Great benefits
Charge card for cafeteria and gift shop
Opportunity for advancement","Poor management and a lack of structure in some departments
As of COVID, they are still doing outpatient and non emergency procedures to get money. We should be focused on the crisis."
545,Houston Methodist,Okay,2021-01-07,1.0,Postdoctoral Fellow,Good name in the field,No one cares about postdoc
546,Houston Methodist,okay,2021-01-07,4.0,Health Screener,-pay is okay for amount of work done,-leadership wont allow for development
547,Houston Methodist,Amazing,2021-01-07,5.0,"Registered Nurse, BSN","Benefits are really good including pay 
Culture 
Resources","Management is disorganized 
COVID led to many changes in unit structure"
548,Houston Methodist,work,2021-01-07,4.0,Ultrasound Technologist,good balance in work and life,it is a kind of competitive
549,Houston Methodist,Excellent company to work for!!,2021-01-06,5.0,Diagnostic Medical Sonographer,They really value their employees.,No cons that I can think of.
550,Houston Methodist,It’s good for learning,2021-01-06,4.0,Sterile Processing Technician,It’s always busy so you will learn quickly if you are new.,They let employees who have been with the company for many years talk and treat newer or not employees poorly.
551,Houston Methodist,good,2021-01-04,3.0,Pharmacist,very good I liked it,busy and management was unreasonable
552,Houston Methodist,Great Company,2021-01-04,5.0,Senior Patient Access Representative,Methodist is a great with compensating their employees. They have great benefits as well. They really treat their employees with value.,It's hard to transfer within the organization. It like running into a glass window.
553,Houston Methodist,Great Benefits,2021-01-04,4.0,RN II,Great benefits and competitive pay,"Take a long time for change
Too many policy changes"
554,Houston Methodist,Great,2021-01-02,5.0,Registered Nurse,"Health insurance, pto, culture, continuing education",None that I can think of
555,Houston Methodist,Good company but underpaid,2021-01-02,4.0,Clinical Dietitian,"They are a very culturally diverse and inclusive company. There is good communication between disciplines. Good PTO program. From what I hear, pay is good for many disciplines such as nursing, just not dietetics.",Underpaid and under appreciated. Dietitians are often overlooked and aren’t compensated for what we’re worth and management won’t budge on salary or benefit negotiations.
556,Houston Methodist,Great Place to Work,2020-12-30,5.0,Patient Access Supervisor,Houston Methodist really cares for its employees. I enjoyed my time with the organization. I was able to grow professionally and build meaningful relationships.,The last department I worked in needed an overhaul. Lack of structure and processes made coming to work a challenge.
557,Houston Methodist,AWESOME!!,2020-12-29,5.0,Liaison,"Great place to work at, very caring and genuine people","Nothing to mention, hope stays like this forever"
558,Houston Methodist,Good place to work at,2020-12-28,5.0,Clinical Project Specialist,"competitive salaries, Good work Culture,",If your boss is good you will grow.
559,Houston Methodist,Great,2020-12-25,5.0,Patient Care Assistant (PCA),It is great at this job,It's not bad at this job
560,Houston Methodist,Great company to work for,2020-12-23,5.0,Patient Access Representative II,Receive quarterly bonuses from patient surveys,Lack of consistency; management is not open to suggestions
561,Houston Methodist,sr supply chain tech,2020-12-21,5.0,Gerente Senior Supply Chain,benefits and compensation like the bonus's are very good perks,a lot of work and can be overwhelming but it is ok. just make sure you are not late.
562,Houston Methodist,RN,2020-12-20,5.0,Registered Nurse,"Good benefits, good company to work for",Parking in the medical center and traffic
563,Houston Methodist,Unparalleled Culture,2020-12-19,4.0,Director of Public Safety,"Fantastic leadership support, collaborative teams, innovative mindset, great employees, and exceptional incentives.","Too many meetings, too many administrative tasks which take away from the freedom to focus on employee development and stifle creative thinking."
564,Houston Methodist,Actually a good company to work for,2020-12-19,4.0,Transfer Coordinator,"They are known for excellent patient care, they also take care of their employees...","Time for breaks, and lunch..."
565,Houston Methodist,Great,2020-12-16,5.0,Oncology Nurse Navigator,Great I love working there,I do not have any cons
566,Houston Methodist,Long term employee,2020-12-15,2.0,Sheduler,"Transfer to other departments, different locations.",Working there for a long term is not good. Need better benefits for employees.
567,Houston Methodist,GN,2020-12-13,2.0,Registered Nurse,-great nurse residency program at main campus,"-very short staffed
-maxed out on pt load every shift
-management does not help with being short staffed 
-charge nurses who do not help
-not able to advocate for self
-only cares about patient satisfaction but not well being of staff"
568,Houston Methodist,great place to work,2020-12-13,5.0,Anonymous Employee,check it out.  there is something for everyone.,none to speak of directly
569,Houston Methodist,ICU,2020-12-13,4.0,"Registered Nurse, BSN","Lots of bonuses, raises, resources","Insurance isn’t great, malignant culture, care more about audits than nursing retention, work 2 whole weekends, work 2 major holidays, and on call for another"
