,company,headline,date,overall_rating,author_position,pros,cons
809,Houston Methodist,good organization to work for,2019-05-29,4.0,Medical Lab Scientist,They care about their employees.  Good work/life balance.,I personally felt like I didn't have a voice.  Opportunities to grow are limited because there's so much competition.
810,Houston Methodist,Good Place To Work,2019-05-25,3.0,Anonymous Employee,Good coworkers; quarterly bonuses; nice facilities,NO WEEKEND DIFFERENTIAL FOR ANY LOCATION
811,Houston Methodist,Nurse practitioner,2019-05-24,5.0,Nurse Practitioner,"You are exposed to learning at the maximum level,",The drive can be difficult
812,Houston Methodist,None,2019-05-21,4.0,Sterile Processing Technician,Good Benefits and work life balance,Clock in system needs improvement. Can be recorded as late even if your not.
813,Houston Methodist,a good company in general,2019-05-17,4.0,Postdoctoral Fellow,"good health insurance, flexible working hours, plenty of PTOs, multiple bonuses every year","salary is low, promotion space is relatively low"
814,Houston Methodist,Work life balance,2019-05-17,5.0,Patient Care Assistant,Working as a PCA at HMH medical center location is great.  The upper management takes into consideration if you have a family or have to pursue your dreams such as going to school,They are always short staffed
815,Houston Methodist,It's a nice hospital,2019-05-11,5.0,Mammography Technologist,Nice staff and newer hospital.,Management  is not so great.
816,Houston Methodist,Awesome inside and out!,2019-05-11,5.0,Patient Care Technician,"Benefits, bonuses, salary, flexible schedule","As with any company, dealing with different personalities"
817,Houston Methodist,Strive to Lead Medicine,2019-05-07,5.0,ICU RN,An excellent place to work> They have a lot of continuing education programmes. Safe nurse-patient ratio.  Ensure that employees have adequate resources.  They look after their employees and at the same time ensure that their patients get the best care.  Best place I have ever worked.,Tuition reimbursement could be higher. Too much out of pocket for health insurance.
818,Houston Methodist,Best Hospital to Work With,2019-05-05,5.0,Clinical Nurse Coordinator,"Team Work, Really pay attention to employees concern","HR is horrible, take way to long to reach out to potential amazing candidates"
819,Houston Methodist,"Good Place to work, bad place to grow your career",2019-05-03,3.0,Histology Technician,Stable Job with good benefits,not room for professional or financial growth
820,Houston Methodist,Don’t do it,2019-05-02,3.0,Food Service Assistant,"Guaranteed 40 hours
Employee discount 
Good cafeteria food","women in the kitchen are messy, jealous & bitter
Management is horrible
No consideration of others feelings or grief 
Want you to do more than is in the job description...WAY MORE
Just flat out horrible
Should be a mans job"
821,Houston Methodist,Promotion within sucks - You have to know someone or kiss butt to be promoted.,2019-04-26,3.0,Senior Patient Affairs Coordinator,"Great Benefits! I love the docs I work for, they are the BEST!!",Management treats staff unfair and shows favoritism.
822,Houston Methodist,Good job for extra cash,2019-04-25,4.0,Patient Transporter,"Benefits, pto, coworkers were nice",Busy all the time with no breaks
823,Houston Methodist,Parking is the WORST,2019-04-24,2.0,New Grad RN,"Great collegues and immediate management, diverse workplace, competitive pay","Parking is unacceptable.  I am forced to park in extension parking lot and take a bus to and from my car. This whole process adds about 30 minutes each, coming and going that I am not getting paid for. This alone has me job hunting. Also, the new grad program forces you to get up early/come to work extra days for no real benefit, wish I could stay on my unit but opt out of the new grad program. I get nothing but annoyance out of it."
824,Houston Methodist,Stable Company,2019-04-14,4.0,Security Officer,Good Benefits. Better to use in-network providers.,Management sometimes is unaware of tasks and responsibilities of employees
825,Houston Methodist,Patient Access,2019-04-09,5.0,Patient Access,Nice place to work everyday,There are no cons its awesome
826,Houston Methodist,New employee,2019-04-06,5.0,Pca,"Great orientation, informative and benefits are great","None so far, I just started"
827,Houston Methodist,Does not promote from within,2019-04-03,4.0,Registered Polysomnographic Technologist,"Great benefits including tuition reimbursement.
Certification and training options available as well.",They look to the outside instead of from within when a management position opens.
828,Houston Methodist,Great company,2019-04-02,4.0,Dietary Aide,The company was amazing! Benefits were good too and get bonuses often,Management at each location
829,Houston Methodist,RN,2019-04-01,4.0,Anonymous Employee,"- Great benefits
- Worked alongside great physicians
- Cutting edge technology",- Too much focus on patient satisfaction survey.
830,Houston Methodist,Awesome,2019-03-24,5.0,Patient Care Technician,Wonderful Experience and allows you to practice your skills,Sometimes very overwhelming but none the less awesome
831,Houston Methodist,Methodist Willowbrook,2019-03-23,4.0,Registered Respiratory Therapist,"Teamwork, PTO, Workload, Staff Recognitions","Salary, Insurance benefits, Parking, Advancement"
832,Houston Methodist,Management,2019-03-22,5.0,Patient Access Coordinator,Great challenging experience in management and as a team lead,This job is very Stressful
833,Houston Methodist,"Good place to work, not so good for career advancement",2019-03-22,4.0,Anonymous Employee,"Great benefits, great pay, lots of perks",Can be hard to move to different departments or positions
834,Houston Methodist,Great Place,2019-03-22,5.0,Anonymous Employee,One of the most kindest place to work,The cons are that its no cons
835,Houston Methodist,Best Job I've Ever Had,2019-03-21,5.0,Patient Sitter,The culture is great- really a positive work environment.,Parking is a little annoying- but that is my only con!
836,Houston Methodist,Great job,2019-03-19,4.0,Anonymous Employee,"Bonuses, room for moving up, opportunities for education","Texas Medical Center Parking is not the best, very congested"
837,Houston Methodist,Huge work load,2019-03-18,3.0,Staff RN,Decent benefits including bonuses. etc,"micromanagement from HR, but managers are awesome"
838,Houston Methodist,No Growth here and Heartless,2019-03-06,1.0,Security Guard,"403b 4% match, quarterly bonus, I have a job so that should count for something, right?","careless security managers, low pay, security don't carry weapons to protect themselves or others, insurance is expensive when you don't make much and insurance benefits lacks, human resource don't help with anything, complaining/rude nurses who talk bad about patients (yes u read that right), lack of empathy from managers, people here don't value the I care values don't be fooled by these reviews. it is hard to transfer to another facility within houston methodist, favoritism is alive and well here. it isn't what you know, buy WHO you know. I have been looking for another job and I am ready to leave here. no work life balance. people work overtime because houston methodist willowbrook dont want to pay for more security personnel. yes we are short of staff. and lots of people are planning on quitting since this new security manager came."
839,Houston Methodist,Great culture at Houston Methodist,2019-02-28,5.0,Patient Care Assistant,Great place to work. Opportunities for growth.,"Very busy, that is with all hospital PCA jobs."
840,Houston Methodist,It's okay,2019-02-26,3.0,Customer Service Representative,"Pay its okay, 1 hr lunch, some OT","Micromanaged, have to answer over 70 calls per day to meet quota."
841,Houston Methodist,Culinary dept. contracted through Aramark,2019-02-21,3.0,Culinary,"good benefits, bonus and perks.",Dietary Department is contracted through Aramark and has unbearable working conditions. They have their quotas to fill for Houston Methodist and will break your back and the back of your families to get it done.
842,Houston Methodist,Houston Methodist,2019-02-20,4.0,Anonymous Employee,A great place to work,Med Center traffic and salary
843,Houston Methodist,Great Benefits,2019-02-16,5.0,Manager,Great Benefits in the organization.,HR needs to be more available to all employees not just staff level.
844,Houston Methodist,Eh,2019-02-13,3.0,Pharmacy Technician,Benefits are the best part,Management a bit unruly
845,Houston Methodist,Great place,2019-02-13,5.0,Clinical Dietitian,The workload is reasonable and everyone is very kind and helpful. I really enjoy the work environment.,Don’t have any at this time
846,Houston Methodist,Comparative Medicine Department in Houston Methodist Research Institute,2019-02-11,5.0,Academic Coordinator,"Houston Methodist provides excellent benefits such as health insurance, PTO, and 403b.","Houston Methodist itself is great, however depending on which department you work for, the management there can not be so great
Reduced title from Project Specialist to Academic Coordinator"
847,Houston Methodist,Leading Medicine,2019-02-09,4.0,CT Technologist,A continuously evolving organization that stays at the cutting edge of medicine,Staffing is lacking in most departments
848,Houston Methodist,Great Company,2019-02-04,4.0,Health Care Specialist,"Good benefits, Good place to work","You don't get along with everyone, tightening department budgets,"
849,Houston Methodist,"One of, if not the best hospital system in Houston",2019-02-04,4.0,Staff RN,"very competitive pay, quarterly bonuses",No major cons at this moment
850,Houston Methodist,Clean Hands Saves Lives,2019-02-02,4.0,Housekeeper,Wonderful company to work for! People who work here  are awesome! They truly care and have a heart for their patients and staff,nothing to my knowledge in this field
851,Houston Methodist,Great place to work,2019-01-27,5.0,Anonymous Employee,They love their employees and have many incentives. There are  bonuses multiple times a year.,I have no complaints so far.
852,Houston Methodist,Amazing,2019-01-25,5.0,RN Staff Nurse,Enviroment is really nice place to work,Pay is not as competitive as other areas
853,Houston Methodist,Patient centered hospital,2019-01-22,4.0,Anonymous Employee,"It is a patient centered and value driven hospital. ICARE value is the key and foundation to everything. We got ICARE training at orientation and boost training every year. In general, it offers very high standard patient services and clinical treatment with good qualities. Employees are proud to be part of it. Offers reasonable benefits.",parking at TMC site is at a remote site which is not convenient
854,Houston Methodist,Fortune Best Place to Work,2019-01-20,4.0,Patient Care Technician,"Quarterly Bonuses, Great Work Environment, Cross-training opportunities,",Could pay a bit better to keep valuable employees
855,Houston Methodist,Facts,2019-01-20,5.0,Courier,"Great health benefits, treat employees very well.","One minute late you might as well not show up because your tardy, & 11 tardys in 365 days your fired!"
856,Houston Methodist,Best hospital system in area,2019-01-19,5.0,Anonymous Employee,Hospital System takes care of all employees best benefits in Houston,Working for Physician Organization needs better communicaiton
857,Houston Methodist,overall good,2019-01-17,5.0,RN Staff Nurse,good pay for the most part,"micro managed, but still ok"
858,Houston Methodist,Great Place for Volunteers,2019-01-15,5.0,,"Benefits are great, free parking, food is discounted, employees genuinely want to help you learn.",There are no paying opportunities.
859,Houston Methodist,HVAC Technician,2019-01-12,3.0,HVAC Mechanic,Large healthcare with decent benefits.,Too much micromanagement from supervisors and managers.  No concern for excessive turnover.
860,Houston Methodist,Sick time,2019-01-11,2.0,Nurse,They have good health insurance.,3 sick days out of the year and you have to wait until your sick day falls off to asks for another sick day. People come in sick to work because they don’t have sick days left and get others sick.
861,Houston Methodist,LVN,2019-01-09,4.0,LVN,Work environment is good and stable,Long hours impatient and sometimes mean patients
862,Houston Methodist,Great atmosphere,2019-01-04,5.0,Patient Affairs Coordinator,I love going to work every day that my spare is amazing and the benefits are great!,I wish the benefits were paid time off we’re a bit different.
863,Houston Methodist,Intern,2019-01-03,4.0,Anonymous Employee,"Pleasant to work with, Great people","Nothing bad, can't say much"
864,Houston Methodist,Former Employee Specialist,2019-01-03,4.0,Anonymous Employee,"Great work environment, culture and values.","leadership favoring others, low pay, no follow-through on projects"
865,Houston Methodist,Leading medicine through innovation,2018-12-24,4.0,Anonymous Employee,"Great benefit and bonuses throughout the year
Leading innovation in medicine",My department could be more efficient
866,Houston Methodist,Dietary clerk,2018-12-19,2.0,Anonymous Employee,Benefits relationship with hospital patients,Low pay not much advancement and unfair management
867,Houston Methodist,Nursing Student,2018-12-14,5.0,Student Nurse,Love the care and enthusiasm that the staff has,Depends on people you meet if its bad experience
868,Houston Methodist,Great place to work,2018-12-05,5.0,Anonymous Employee,Great benefits and bonuses. Competitive salaries.,Parking is awful at the medical center location.
869,Houston Methodist,Nice place,2018-11-26,4.0,Staff RN,Leadership is great. Accessible and friendly.,Too much focus on patient satisfaction is making the hospital like a hotel.
870,Houston Methodist,Good Company,2018-11-19,4.0,Anonymous Employee,"Benefits, perks and good culture",Slow advancement opportunities and feedback from-HR
871,Houston Methodist,Admin,2018-11-06,5.0,Administrative,Teamwork and clients are the pros,Scheduling and some micro managing
872,Houston Methodist,Specialist,2018-11-02,4.0,Anonymous Employee,"Great place to work, great coworkers",Not much training and development opportunities
873,Houston Methodist,RN,2018-10-29,4.0,Staff RN,"State of the art technology
Work culture","work life balance
Understaffed
inadequate paid time off"
874,Houston Methodist,Nurse,2018-10-24,5.0,Registered Nurse,"Great teamwork, company values are excellent, colleagues in all departments are the happiest I’ve encountered in a hospital setting, they love to promote their own employees over outside applicants",Benefits are lacking compared to other local hospitals
875,Houston Methodist,Cardiac Technician,2018-10-22,5.0,Monitor Technician,there are great benefits for this company,the are hours not flexible
876,Houston Methodist,Accounts Receivable Rep II,2018-10-17,5.0,Anonymous Employee,Benefits were awesome! The people in cardiology were amazing.,It’s not as easy to transfer as one would think.
877,Houston Methodist,Great benefits,2018-10-17,5.0,Anonymous Employee,"Benefits, tuition reimbursement, great communication",24 hour facility which means you work weekends
878,Houston Methodist,The Very Best in Healthcare,2018-10-17,5.0,Anonymous Employee,Care and loyalty to patients and employees,None really couldn’t get better
879,Houston Methodist,Good,2018-10-15,4.0,,"Laid back environment, respectful, feels valued as an employee. Alot of companies could learn from Methodist. This isa  huge hospital system that has retained employees because they allow employees to feel valued and treated with respect. Many companies just think they should treat employees like manual labor because they are paying them and have alot of loss revenue because of it.",None that i can think of.
880,Houston Methodist,Scheduler,2018-10-09,3.0,Scheduler,Facility cares about the employees and their wellbeing. Offers quarterly bonuses,Management team within the department is not on the same page.
881,Houston Methodist,OVERALL REVIEW,2018-10-07,3.0,Anonymous Employee,"Employee engagement
Mission driven
Culture
Team environment","Pay compared to competitors
Career opportunities"
882,Houston Methodist,Great place,2018-10-06,5.0,Evs,I love the people the pay is great the hours are good and management listens,I have no cons I can gove
883,Houston Methodist,meh,2018-10-04,3.0,Anonymous Employee,the department does have a family type atmosphere,constant pay adjustments to bring you up to the bottom level of everyone else?  lack of communication. medical keeps rising and getting worse. 403b is ok.
884,Houston Methodist,Overall a great place,2018-10-04,4.0,Radiologic Technologist,"Excellent working culture, workload and environment",A bit lower pay and pricier benefits
885,Houston Methodist,employer,2018-10-02,5.0,Anonymous Employee,Good working environment and benefits.,nothing as such coming to mind
886,Houston Methodist,Great Place to work,2018-09-30,5.0,Staff RN,"Great benefits, great values, supportive and positive",I cant think of any
887,Houston Methodist,Fantastic Organization,2018-09-27,5.0,Manager,Great organization to work for - opportunities to move up with the right attitude.  Benefits are good.,Travel time to work at times due to construction everywhere.
888,Houston Methodist,Sr. Research Tech,2018-09-16,3.0,Anonymous Employee,"Nice work environment, additional bonus,",depends on whom you work for
889,Houston Methodist,Current PCA ll,2018-09-15,3.0,PCAll,"Reputation Stands by there name, For the most part, some people are courteous , and friendly. nice cafeteria food choices.parking is free from a distance, and free nearer on some days.  salary is competitive if only you have experience. they have bonuses ive heard which is a plus at the end if the year.","understaffed,overworked, long hours.going home is tedious.need new beds. sometimes its broken."
890,Houston Methodist,Good place to start,2018-09-10,3.0,Anonymous Employee,"Benefits, diversity, bonuses and location","Not much employee interaction, always micromanaged, tedious work"
891,Houston Methodist,RN,2018-09-09,3.0,Anonymous Employee,Methodist has a good nursing culture.,Benefits are poor. Health insurance is expensive and has poor coverage.
892,Houston Methodist,pca,2018-09-08,3.0,Anonymous Employee,houston methodist offers great benefits,The management is no so supportive
893,Houston Methodist,placement,2018-09-06,5.0,Director,excellent place for location in Houston,too much work for the job
894,Houston Methodist,Pca,2018-09-03,3.0,Anonymous Employee,Good benefits. Cafeteria. Free parking at some locations.,"Rude nurses. Long shifts, not full 80 hrs."
895,Houston Methodist,Employees truly care for patients,2018-09-03,4.0,Staff RN,Co-workers are team oriented and truly care for patients.  Organization does a good job recognizing employees in various ways both small and large,Suburb branches of Methodist do not seem to pay as much per hour as Houston Medical Center.
896,Houston Methodist,Special Projects Coordinator,2018-09-01,2.0,Anonymous Employee,Flexible hours and some computer classes in the past.,No advancement if you don't have a bachelors degree or above. They do bend the rules for those that they want in a position.
897,Houston Methodist,Foundation,2018-08-28,5.0,Anonymous Employee,Employer that cares! Everything HMH does is first class.,"At this point, they are few and far between. The only cons are that the hospital systems in the med center are in a very crowded area."
898,Houston Methodist,An exciting time to be with the organization,2018-08-28,5.0,Anonymous Employee,"Organization gives back to employees, the only growing hospital system in Houston",Can not think of any
899,Houston Methodist,Employees,2018-08-27,2.0,Anonymous Employee,I can find nothing good to say,The atmosphere towards new nurses is hostile and unwelcoming
900,Houston Methodist,Athletic Trainer,2018-08-27,5.0,Anonymous Employee,Great hospital that cares about employees,"Can be long hours, but that’s typical for Atheltic training."
901,Houston Methodist,PCA I,2018-08-25,4.0,Pca,This company takes the time to invest and properly train their employees.,Pca’s are overworked and NOT appreciated. A lot of the Nurses are lazy and management does nothing about it.
902,Houston Methodist,Project Coördinator,2018-08-24,3.0,Project Coordinator,"Co workers 
Job 
PTO accumulation","Office Politics are heavy
Slow to promote even if qualified , they choose to go outside of the org rather then promote up."
903,Houston Methodist,RN,2018-08-24,4.0,Anonymous Employee,"Great company overall, best equipment in the industry.",Some locations do not have the support from management.
904,Houston Methodist,RNs,2018-08-17,4.0,Rns,"Great Benefits, competitive pay, room for career advancement, tuition reimbursement, educational opportunities","-Educational requirements can be a bit much, must have been BSN (Magnet status), TNCC/ENPC but they aren't a trauma facility
-It kind of feels like you're getting ""brain washed"" when first hired; they culture here is definitely different"
905,Houston Methodist,Great place to work,2018-08-17,4.0,Anonymous Employee,friendly employees and nice managers to take care of you,low pay and no higher raise annually
906,Houston Methodist,CASH APPLICATION SPECIALIST,2018-08-17,4.0,Cash Applications Specialist,Great company takes care of their employees.,some departments need to be examined no organization
907,Houston Methodist,Senior Applications Analyst,2018-08-15,5.0,Senior Applications Analyst,Really take care of their employees!,Upward mobility is limited  because employees have a tendency to stay for a long period of time.
908,Houston Methodist,Recruiter,2018-08-15,1.0,Anonymous Employee,It’s a good place to work.,Lots of politics not room for growth.
909,Houston Methodist,Top Hospital System to Work For,2018-08-15,4.0,Anonymous Employee,High pay. Good benefits.,Work/life balance. Middle management could be better.
910,Houston Methodist,Going on 4 years in the company.,2018-08-11,5.0,Anonymous Employee,Great people. Bonuses. PTO that rolls over so you can save up as much as you want. Secured employment.,Pay does start lower than everyone else but there is so much room to move up that you will be in a competitive salary later.
911,Houston Methodist,Clinic Lead,2018-08-06,3.0,Anonymous Employee,The benefits are excellent.,The pay is not as great and you do 8 different jobs for one paycheck and it feels like you are not getting paid enough for all you do for the company. I feel if you have a high degree you should get paid for a high degree that is what we went to school and paid all of the money for and not compensated for on the job is a disappointment. Some of the higher ups show who their favorites are. The promotions are there but the pay is not there and that is discouraging. Its almost like saying ok you went to school to  make  more money but we are not going to pay you for it.
912,Houston Methodist,"I had an amazing experience through the interview process, dealing with HR, and orientation process.",2018-08-06,5.0,Registered Nurse BSN,"Insurance is great and really affordable. 403b is awesome, they’re willing to give you a lot of free money. Nice competitive starting base pay. Offer a lot of incentives to be healthy and reap other rewards from it. Regular bonuses for patient satisfaction and hand hygiene.","No differentials for weekends, specialties, Charging, or precepting."
913,Houston Methodist,Senior Medical Assistant,2018-08-05,3.0,Senior Medical Assistant,"Bonuses, PTO and location of ofgice",Things were good at first until a new manager came onboard..she had no mgmt experience and knew less then anyone in the office. She talked about everyone and would throw you under the bus to save her own butt.
914,Houston Methodist,Good benefits. The End.,2018-08-03,3.0,Patient Care Technician,Benefits are good. Not too expensive compared to other companies. 4% match on 401K. 6 hrs of PTO per pay period in my salary range ($13hr). Plenty of opportunities fpr growth within the company but must be outside of this location.,"Small hospital. LOTS of drama, gossip. The directors and managers have a clique and stick together, if they don't like you for whatever reason, or their friends on the floors don't like you, good luck requesting transfers to better positions or units. They will also favor their people with scheduling. You can put in your 2 weeks notice and they will STILL say you didn't when other companies call to check on that. Make sure you write it down and have them sign a copy. For tuition reimbursement they will look for any little excuse to not give it. I was in school 3 years and never managed to get it. Also, they skipped me when applying for a m RN position over someone new to the company, with NO EXPERIENCE."
915,Houston Methodist,Great but not perfect,2018-07-21,4.0,Anonymous Employee,Great Benefits. Has a family style employment. Can work with your schedule if you have some wiggle room.  Opportunities to move up,Sometimes management can be an issues. If you are lower on the totem pole some staff members will not treat you with respect.
916,Houston Methodist,Fellow,2018-07-20,5.0,Fellow,"Well appreciated and looked after, congenial work environment, very helpful, warm, friendly and happy","very busy, and getting a hold of other providers is cumbersome"
917,Houston Methodist,RN,2018-07-20,4.0,Anonymous Employee,They are truly the definition of icare value.,"None, I have no complaints"
918,Houston Methodist,rn,2018-07-16,4.0,,good hospital with good managment,"no additional incentive to be charge nurse, preceptor"
919,Houston Methodist,Respiratory therapist.,2018-07-12,4.0,,Busy work environment and competitive pay.  Positive coworkers and core values.,Hard to advance with little incentives.
