,company,headline,date,overall_rating,author_position,pros,cons
1092,Houston Methodist,Compliance,2017-02-13,4.0,Anonymous Employee,Compensation and benefits are fair,Management can be hesitant to change their ways.
1093,Houston Methodist,pharmacy technician,2017-02-13,4.0,Anonymous Employee,"get atmosphere to work in, great ppl,",poor growth opportunity within department
1094,Houston Methodist,RN,2017-02-12,5.0,Anonymous Employee,There is company team work,MD not doing their part
1095,Houston Methodist,Patient Affairs Coordinator II,2017-02-09,5.0,Anonymous Employee,"great insurance, medical and dental",department managers dont value their employees
1096,Houston Methodist,All is Not Well,2017-02-06,1.0,Anonymous Employee,There are some amazing leaders & many good dedicated employees.,Good employees are getting burnt out quickly.
1097,Houston Methodist,Clinical Coordinator,2017-02-05,5.0,Project Manager,nice patient load LEARNING A LOT,TRAVEL TO NH IS DIFFICULT AT TIMES
1098,Houston Methodist,Great Place to Work,2017-01-25,5.0,Anonymous Employee,"Great work balance life, nice benefits and pay.",Catching the shuttle to work everyday.
1099,Houston Methodist,Needs lmprovement,2017-01-23,3.0,Anonymous Employee,Opportunity to grow and magnet status,"Understaffed, unable to keep best nurses"
1100,Houston Methodist,Senior Applications Analyst,2017-01-20,3.0,Senior Applications Analyst,Top hospital in Texas in world's largest medical center.  Excellent patient experience.  Culture of caring and compassion.,"Highly competitive work environment.  Difficult to be noticed for more than one day even when managers in other teams or executives have commended you to your manager or you've been asked to stand in a room of 400 department members to be recognized for great work. Difficult to move up unless you happen to work for a manager who cares about their people, which is rare."
1101,Houston Methodist,great benefits,2017-01-18,3.0,Anonymous Employee,they have the top health insurance next to Exxon Mobile in Baytown Tx,not the best pay rate
1102,Houston Methodist,Great Hospital,2017-01-16,5.0,,Nice place to work. They really care about the patients.,"As in any hospital, operations often tend to be inefficient,"
1103,Houston Methodist,Admitting Representative I,2017-01-09,3.0,,"Bonuses, awesome coworkers, great working environment",Management for patient access is very poor. This is dragging down the department and employee morale.
1104,Houston Methodist,Okay,2017-01-05,3.0,Anonymous Employee,"Great benefits, even for part time. Tuition reimbursement, paid time off, health plans, free gym",Management isn't great. They have some unrealistic expectations and the morale of the staff in general is pretty bad. It makes it an exhausting environment to work in
1105,Houston Methodist,Poor management n No communication,2017-01-04,1.0,PCA II,"Little bonuses, access to the fittness equipment","Poor management n no communication, no common sense, the patients aren't always right, most nurses are lazy."
1106,Houston Methodist,Great place to work,2017-01-04,5.0,Anonymous Employee,"Fantastic employer, great benefits, great coworkers, really cannot say enough nice things.",Parking in the med center is expensive and often inconvenient.
1107,Houston Methodist,Clinical Nurse,2017-01-02,4.0,"Registered Nurse, Cancer Center Infusion","Work/Life balance
Very supportive of advancement in education","Slow to implement change
Very political and Hierarchical"
1108,Houston Methodist,Unit Administrator,2016-12-26,4.0,Anonymous Employee,Great hospital system and great coworkers to work with,They say they offer multiple opportunties but when you want to move up its like pulling teeth.
1109,Houston Methodist,I love working here!,2016-12-26,4.0,Unit Secretary,"Great benefits, company cares about employees, great schedule, tuition reimbursement, 401k",The drive to the med center
1110,Houston Methodist,Great culture,2016-12-19,5.0,Anonymous Employee,People 'walk the talk' here! It's like no other hospital system I've seen.,Hard work and high expectations!
1111,Houston Methodist,Applying for Jobs,2016-12-16,3.0,,"I have been applying since 2014, how does one get an interview or some type of feedback? Is there a temp agency I should go thru?  This is crazy.",No feedback or a response is given when applying for jobs online.  Wouldn't hurt for someone to reply or respond back to you.
1112,Houston Methodist,No room for growth,2016-12-15,1.0,,"The name when you mention you work here you get a lot of perks, but to work there is another story","There is no growth unless you are a nurse, everyone else is nobody"
1113,Houston Methodist,Bad HR department.,2016-12-13,2.0,Anonymous Employee,"HMH does some truly AMAZING work, which will truly make you proud to work there. 
PTO is accrued from the first day that you are there.
The cafeterias are awesome, though a bit over-priced.
Amazing benefits, including cell phone discounts and pet insurance (pet insurance can be taken out of your paycheck). 
Several bonuses per year for an array of things, including basic hand-hygiene. 
When I was there, there was a program in place for extra bonuses and incentives for those employees that logged the most ""steps"" on their FitBit per quarter.","Perhaps my experience was specific to my research department, but it was (in the end) handled by HR. The regular procedures for employee discipline were not followed in my department, my requests and complaints were repeatedly ignored, and I was never granted an exit interview. Even after I raised serious concerns about the operations in my department, I was encouraged to quit my position, and was black-mailed by my manager. I expressed this to HR, and while I was told someone would look into it, I was ignored. 
Again, this may have been specific to my department."
1114,Houston Methodist,Accountant II,2016-12-08,4.0,Accountant II,A job that offers stability and good work-life balance.,Not much opportunity for growth.
1115,Houston Methodist,SR Billing Specialist,2016-12-07,5.0,Senior Billing Specialist,Methodist has great ability to learn and move up,Methodist doesn't really promote from experience. Recently they started looking for degrees vs promoting per experience.
1116,Houston Methodist,Manager,2016-12-05,4.0,,Bonuses are nice and so is work life balance and employee benefits,Bureaucratic leadership system can often times be discouraging
1117,Houston Methodist,registered nurse,2016-12-03,4.0,,nvery good place to work for,short staffed and mamangement problems sometimes
1118,Houston Methodist,RN,2016-11-30,4.0,Anonymous Employee,Methodist Hospital Sugarland employees provide excellent care to their patients most of the time. It is a good  hospital to get medical care.,"Methodist Hospital Sugarland has been expanding  greatly to accommodate the high demand from patients around the community and surrounding areas, busy."
1119,Houston Methodist,Wellness,2016-11-27,5.0,,Everyone is friendly and you have the opportunity to meet many different people,There's a lot of driving
1120,Houston Methodist,GOOD,2016-11-26,5.0,Security Supervisor,Excellent place to work for.,none for the moment at this time
1121,Houston Methodist,RN CVICU,2016-11-13,3.0,Anonymous Employee,"Fast paced, learning environment, exciting/critical cases, good experience for pre CRNA school, supportive management, opportunities for overtime, MAGNET facility",Bad/unhelpful attitudes among some midlevel practicioners/intensivists/seasoned staff. Hard transition for new employee
1122,Houston Methodist,ok,2016-11-13,4.0,Pca,"Great employees, team work oriented, decent bonuses, ok management","authoritative leadership, somewhat disorganized ,"
1123,Houston Methodist,Release of Information,2016-11-12,5.0,Anonymous Employee,"Great company, excellent benefits, paid parking via bus & metro.  Offices are clean and well supported. On site fitness center, lots of places for lunch and breakfast.","Located downtown, so the commute takes time.  Advancement with in department is limited."
1124,Houston Methodist,Love my job!,2016-11-11,5.0,,"- Self scheduling
- Competitive pay","- Shift work
- Holidays and weekends are mandatoru"
1125,Houston Methodist,Houston Methodist Hospital,2016-11-08,5.0,Solid Organ Transplant Pharmacy Resident,Good company. Good benefits for employees. Focus on employees growth.,Competitive nature of the medical center.
1126,Houston Methodist,cna,2016-10-30,5.0,CNA,"good salary,really patient -family centered care",too much pressure and too much work
1127,Houston Methodist,Office Clerk,2016-10-26,4.0,Front Office Clerk,the patients that come to the hospital are amazing and wonderful to take care off.,Terrible management masks it very had to work in a professional setting
1128,Houston Methodist,Horrible Management,2016-10-26,1.0,A/R Billing Representative II,There are no pros at this point,"Management here do not follow I-Care values. In the CBO, management do not communicate with staff in a professional manner. When any issue is brought up management to some managers, they seem to take offense to the staff asking them certain question. Before I started working here 2 years ago, I heard nothing but positive things about working for Methodist. At this point I would not recommend anyone to work at Methodist. Management has created a negative work environment but instead of them trying to fix the problem, they seem to flips things and it always end up being the employees fault."
1129,Houston Methodist,management,2016-10-26,4.0,,some great doctors to work with,Some management think they are better than you.
1130,Houston Methodist,Management,2016-10-22,5.0,,Wonderful place to work  - everyone very dedicated,work life balance can be a challenge
1131,Houston Methodist,Scheduler II,2016-10-21,4.0,Scheduler II,"Great benefits, family like environment",Some members of management are not very personable.
1132,Houston Methodist,PostDoc,2016-10-21,5.0,Postdoctoral Fellow,"Houston Methodist Research Institute (HMRI) is a non-profit, academic research institute that provides a unique translational research opportunity. HMRI is located in the Houston Medical Center, adjacent to Rice University, Baylor College of Medicine and MD Anderson Cancer Center, providing ample opportunities to interact with researchers in diverse backgrounds. Great place for biomedical research with good facilities.",Not a lot of advancement
1133,Houston Methodist,Medical Director,2016-10-21,4.0,Breast Radiologist,"Great people, nice working environment, comparable pay.","Disorganized, difficulty changing with times"
1134,Houston Methodist,A great place to work,2016-10-21,4.0,Anonymous Employee,"Job is stable with a reasonable amount of freedom.
Provides the opportunity to assist patients in a variety of ways",Career paths are somewhat narrow
1135,Houston Methodist,Unit Administrative Assistant,2016-10-17,3.0,Anonymous Employee,"Benefits, Tuition Reimbursement ,  and nice staff","Not enough pay, management"
1136,Houston Methodist,Average Experience at Best,2016-10-16,2.0,,"Very flexible schedules, Fair benefits","Management is does not value employees as much as they should, HR is impossible to get in contact with"
1137,Houston Methodist,Police Officer,2016-10-13,5.0,,"Consistent work, fair pay, takes out taxes.",This is a great extra job
1138,Houston Methodist,PCA II,2016-10-12,3.0,,The employees are very nice.,HR is not the best.
1139,Houston Methodist,"A Good Name, Good Work, Difficult Management",2016-10-11,3.0,,"--Decent work environment
--Good Benefits
--Promotions encouraged
--Most managers are willing to work with your schedule","--Shady, even Corupt Management
--Corporate attitude depersonalizes the patient care process
--Too much top down and micromanaging"
1140,Houston Methodist,"They treat the staff AMAZING, but pay is middle of the road for a high ranked hospital",2016-10-10,4.0,RN I,"The hiring process was very smooth and they work very hard to satisfy their employees. Benefits packages are amazing, especially for those with families","Pay seems to be middle of the road, especially for a hospital that has been ranked so highly and spends so much on advertising"
1141,Houston Methodist,"11 years, multiple promotions, plenty of pay increases, love it here!",2016-10-05,5.0,,"What sets Houston Methodist apart from other organizations is the culture. The I CARE values of Integrity, Compassion, Accountability, Respect and Excellence permeate everything we do. We do strive to be the best - the best employer, the best patient care provider, the best patient experience provider - and sometimes that push for excellence is overwhelming to new people. But for those of us who thrive an setting and achieving high expectations, it is incredibly rewarding. I started as a non-management employee and have worked my way up through a few promotions. My salary has increased proportionate with the new challenges I have taken on and my benefits continue to grow with tenure. The benefits package is so rich for tenured employees it is hard to even consider making a change. Good pay, good benefits, a flexible schedule, opportunities for growth - what is not to love? Oh yeah - $millions in investment of extra PTO when we flooded in May - what other company does that? None that I know of!","If you want a job where you can just show up and exist, but not contribute with passion and expertise, you will not survive here. Parking in the med center is a known challenge not just for Methodist, and is a tradeoff you have to live with to work in the world's most innovative medical center. But parking is free, which is better than a lot of companies in the Houston area's condensed business centers."
1142,Houston Methodist,HR & Leadership - what a joke!,2016-10-04,1.0,Nurse,"Reputation
Doctors are the best - they will support you but very political
Patients 
Perks 
Great resume builder
Co-workers 
Research Institute 
Diversity is valued",Med Center HR team is horrible.  They are unresponsive and always side with management team.  I escalated problems to Manager & Director with no follow up...can't get past secretary and won't respond to emails! Consensus on the floors is why bother filing a complaint you just get the run around and your manager will find out and write you up.  Do NOT trust HR - they are only loyal to VPs. How do our problems get heard or resolved?!
1143,Houston Methodist,RN,2016-10-02,4.0,Anonymous Employee,"Pay, benefits, insurance, career and education opportunities","Staffing, revolving staff, issues with staffing, parking"
1144,Houston Methodist,"No room for growth, subpar retirement, cost cutting everywhere",2016-09-29,1.0,Anonymous Employee,"*Most people here are friendly (the actual workers - not management, not the CEO, or higher ups).
*Bonuses (small - but there nonetheless)
*Job Security
*EPIC was a good decision, even if the OLDER employees hate it. They only hate it because they hate change, but it was a good move.","* ""New"" CEO is cutting costs at the expense of good employees. The first thing Marc Boom did when he came in was lower pay, I kid you not. I have never heard of a GOOD company ""lowering pay"", but Marc Boom has done that. He has gone through and actually lowered the evening and overnight shift difference for some departments. He says its to ""make it fair"", which is the biggest cop-out ever. To make it fair, he supposedly gave people raises to compensate for it, but raises were given out in sporadic fashion, and many people were not given the proper raise to compensate, and others who didn't even work evening or days were given bigger raises. What a mess. What a way to bring up morale. Also, the old CEO gave out Kroger gift cards periodically to employees, and it was always such a nice surprise. It was more about the compassion behind the cards, not about the amount. The new CEO has never given a single extra bonus out, except the usual small ones they give to keep us on our toes. The new CEO Marc Boom does not seem compassionate, he seems like a cost cutting maniac. They continue to build new buildings, but they can't seem to keep decent staff (which is why they are always having hiring fairs for nurses).

*The pay is OK, but not up to par for a ""best place to work"". That is one of the reasons they no longer win best place to work - it started under Marc Boom - once he came in, we stopped winning best place to work. Compensation always says they are trying to make us ""even"" to other places, but it takes them years to give the raises to do it - and you would think if you want to be the best in the nation you would actually pay MORE not that same as other places. If you just want to ""keep up"" with other places, then you can't expect to be the best. 

*Retirement is mediocre. They only match to 4%, and no pension. 6% should be the minimum.

*They make really unintelligent decisions sometimes. They raised parking rates in garages because they said too many employees were parking there. Well, there are a lot of employees with certain disabilities (especially employees with transplants) that cannot park in Smithlands, because the light rail is literally covered in urine and homeless people. Methodist does NOT offer contract parking for these employees, they leave them to their own devices, so they have to park there. Also, there are loads of construction people parking there. Your building a new building after all. Stop blaming employees, and actually do your research please.

*You have to jump through hoops to get health insurance. They make you take a yearly biometric, which I'm actually ok with. I hate it, but I understand it. However, even if your healthy, they make you take a class throughout the year to keep your rate low. It's ridiculous. If you have kids, and have to work a second job like me because Methodist doesn't pay enough, you don't have time to take a class. Especially if your working out already, you don't have time to jump through their hoops. It makes no sense. If your healthy, theres no reason to do a class. Its annoying, and no one else does this. They have one online class throughout the year, but if you miss a time, your screwed. I don't understand why they don't just leave the online classes up all year, so we can do it on our own time. We HAVE LIVES and FAMILIES and SECOND JOBS...we don't have time to go online checking to see if this class is up or not. Have some compassion for your employees."
1145,Houston Methodist,Great Place to Work in any department but HR,2016-09-28,3.0,Anonymous Employee,"Great benefits, culture, and job security
Great colleagues",Leadership is only concerned with the bottom line not their staff
1146,Houston Methodist,Good hospital and good research institute,2016-09-26,5.0,Postdoctoral Fellow,Good hospital and good research institute,high cost on medical insurance plan
1147,Houston Methodist,Patient care Assistant,2016-09-26,5.0,Patient Care Assistant,Every thing  was good patient performance,At that time salary was very  low
1148,Houston Methodist,Good company,2016-09-25,5.0,,"Great company with great benefits, pay was good starting out, quarterly bonuses, and accrued PTO",Not much room for growth
1149,Houston Methodist,"Foundation has a good name for your resume, but not the place if you want to build a career.",2016-09-24,2.0,Development,"Ample procedures so you always know what to expect, the people - coworkers not management - for the most part are amazing, good benefits. You can learn a lot of hypothetical Best practices here and see some Good ideas come to life.","They bring people in for promotions and overlook those already in the organization; hr is HUGE and act like they can/will help you however they report back to your management if you complain; no exit interview when I left even though I requested one upon resignation - hr blamed outside consulting firm; pay is below market despite annual reviews; annual performance based raise is toted my management as up to 3.5 percent but I got a ""4"" which is one grade above your average good job of a ""3"" and got 1%. You have to give them the moon, work the load of two jobs, and stay content where you are. In the end, it's just a blame game when you ask management to explain discrepancies. If you want to get what you earned as far as promotions, you MUST leave."
1150,Houston Methodist,System Quality Improvement Analyst,2016-09-17,5.0,Service Quality Improvement Analyst,Methodist is a great place to work,I have encountered alot of politics at Methodist
1151,Houston Methodist,sitter /pca 11,2016-09-15,2.0,Sitter/Pca 11,"I care values ,job satisfaction",As a flex staff we don't have benefit
1152,Houston Methodist,Great place to work,2016-09-14,5.0,Medical Collector II,"New employee incentives, overtime offered, on the job training, great coworkers.  Houston Methodist has a great reputation and a very well known name.  When you hear the name Houston Methodist, you automatically feel a sense of pride and assurance.  I will always take my family to Houston Methodist Hospitals because they sincerely do care about their patients and employees.","There are times when management did not listen to their employees and we had a serious, constant change in management leaders. Once the infrastructure of the management team was set in motion, the employees felt more at ease and ready to give 200%."
1153,Houston Methodist,Things have changed dont work here in IT right now,2016-09-08,2.0,,"The people! The best and brightest work here. You will make life long friends. Management used to be the best I ever worked for. Their Epic project (former Epic Analyst at Methodist) changed that for the worse. Employees are ignored, not listened to and treated unfairly. Work is not evenly distributed and people are leaving in exodus. Pay is low, and raises and market survey increases are peanuts. Wait till this project is over a d things return to normal.","Long hours with no concern for work life balance. No concern for the stressful environment. Employees crying, quitting and going on leave due to stress and workloads. No defense of employees against users who demand customization for personal reasons. One person may be constantly over worked while another may not be. Bring these issues to management is seen as a complaint and you are told to be a team player."
1154,Houston Methodist,OK,2016-09-04,3.0,,Just OK. not much excitement.,There are n o cons working for this company
1155,Houston Methodist,Worst place,2016-09-04,1.0,Anonymous Employee,"The doctors are the best and knowledgeable,good care when you are white.The nurses are overwork the  place is a joke . The administration is a joke",The place is a facade it's not leading medicine rather antiquated. HR are liars when you complain they turn the tables on you. They PTO  is 5 hours every two weeks . Salary is the lowest in the area. Administration hire blacks for quota do not promote them . It's a racist environment .
1156,Houston Methodist,Great company to work for!,2016-08-30,5.0,Receptionist,Great camaraderie. Working with new patients everyday was rewarding. Coworkers really cared for each other and pushed each other to do better and learn new things. It was great being able to share ideas on how to ensure great patient quality care.,"The workload was sometimes overwhelming but the team would come together to figure it out and get things done. Also, promotions are very rare but it may just depend on which department you are in."
1157,Houston Methodist,Geat place to work!,2016-08-24,4.0,Monitor Tech/PCA,"Good place to work.Good people, IF YOUR ALLOWED TO  FIT IN !",Not so great if you don't fit or accepted in the clicks.
1158,Houston Methodist,Current Employee,2016-08-24,2.0,,Competitive wages are offered here.,"No sick days - SO, if you call in due to illness for you or your children, then you must take UNSCHEDULED PTO which IS held against you as an occurrence. Even if you have a doctor's excuse.

Also, loss of a family member that is not listed in the Bereavement Policy IS held against you as an occurrence as well if you choose to call in to be with famil

In addition, if you are at work and become gravely ILL and have to leave this will be held against you as an occurrence as well. As will being late if there is a wreck, etc. that is beyond your control. So basically, if you receive 8 occurrences in one year, you will be terminated.

Thanks for the COMPASSION Methodist. (ICARE) remember??"
1159,Houston Methodist,Houston Methodist:  NUMBER ONE IN PATIENT CARE AND NUMBER ONE EMPLOYER,2016-08-23,5.0,,"Excellent benefits, care about employees, supportive of continuing education with great reimbursement benefits, always keeping in touch on matters that are significant, best employer I have every worked for.",None that I know of
1160,Houston Methodist,RN,2016-08-23,5.0,Anonymous Employee,"work culture, compensation, management. Best place to work for",stressful at times. other than that nothing to say
1161,Houston Methodist,Great experience,2016-08-19,5.0,Texas,Great nurse family I just wish they would keep the older more experienced nurses.the doctors are top notch  good opportunity for further degree advances,Poor management turnover large  lots of new business managers no nursing experience makes for short staffing shifts  lots of new ban nurses with lots of book time no practical experience
1162,Houston Methodist,Terrible Transport Managers,2016-08-19,3.0,Patient Transportation,Good experience in learning all areas of health. Picking up new methods to help patients.,Terrible Transport Managers that do not care much about their workers. They focus more on productivity then workers morale.
1163,Houston Methodist,Great Place to Work!,2016-08-17,4.0,Anonymous Employee,"Great benefits, great coworkers! Transportation is paid for",Far location! In the busy part of Houston
