,company,headline,date,overall_rating,author_position,pros,cons
1451,Red Hat,Human Resources,2018-10-11,4.0,Anonymous Employee,Open source nature is a plus.,Memo list can suck the energy right out of you.
1452,Red Hat,I have been working at Red Hat full-time (More than 2 years as Principal Data Engineer),2018-10-11,4.0,Principal Data Engineer,"Get a new chance to learn
Nice workplace and office
Work time flexibility - can do work from home",As as team we need work on data intensive enterprises products or applications in the Data Era!
1453,Red Hat,QE engineer,2018-10-10,5.0,QE Engineer,"No pressure
Work life balance is perfect 
Time to study and be best in the industry.
Remote positions are available and part of the organization working method.","Promotion includes being a ""loud"" employee"
1454,Red Hat,Support Engineer,2018-10-10,5.0,Anonymous Employee,Awesome place to learn and collaborate.,None that I can think of.
1455,Red Hat,Good learning experience,2018-10-09,3.0,Anonymous Employee,"* For someone who takes initiative, this is a good place to work. 
* Flexible to an extent wrt to work times","* Does not recognize introverts for their contributions. The more outgoing people get noticed and get ahead. 
* Salaries are quite low.. not according to the market value - be sure to have a chat regularly."
1456,Red Hat,Working here is a mixed bag,2018-10-08,1.0,Anonymous Employee,Salary and benefits are good but not a lot else.,"Politics are getting quite bad. Especially as the old guard is getting ready to exit and the upcoming crew starts jockeying for position and stabbing each other in the back. If you're low enough on the food chain to avoid this great, otherwise watch your back. They talk about openness and meritocracy but don't actually practice it no matter how much they preach it."
1457,Red Hat,A bloated company with an abusive culture,2018-10-05,2.0,Senior Global Product Marketing Manager,"- Lots of opportunities 
- There are some remnants of the old Red Hat culture (Open Org) but they are quickly disappearing","- Red Hat is turning into the IBM of Open Source software
- Work culture has become command and control, and abusive
- People are generally overworked and underpaid"
1458,Red Hat,Best Place I've Ever Worked,2018-10-03,5.0,Senior Software Engineer,"Been here for coming up on a year. First six months I thought it was too good to be true. I have excellent management, my team is very competent, work-life balance is taken seriously, remote work is obviously a huge plus.

Bonus program is great, benefits are great.
The company actually seems to care about associates. I haven't been at a place that felt like this in a long time.","Internal drama on some mailing lists is sometimes a bit silly. Not really a con, just unsub if it bothers you.

Remote work benefits could be slightly better -- no gym or office supplies allowance, etc. The Red Hat offices are awesome, so going remote means you miss out on some cool stuff every now and then, especially t-shirts.

Salary is very good, but obviously not competitive with FANG stock grants. No stock options as far as I'm aware. I've heard you don't get yearly raises."
1459,Red Hat,Good company to start you career,2018-10-03,5.0,Associate Software Engineer,"Flexible Work Hours and  work from home
open source technologies",Pay is low by market standard
1460,Red Hat,TAM,2018-09-27,4.0,Technical Account Manager,"- Have opportunity to learn emerging technology
- Lots of free online course
- Free certification
- Have chance to listen and talk to the great mind
- Free fruit and beverage","- Not very new hire friendly, you’d better be somebody or know somebody, otherwise, you have to be on your own
- Missing process to support associates, and some people think it is where the beauty lies
- Need to have a mature management team"
1461,Red Hat,Good Company,2018-09-26,4.0,Anonymous Employee,"Awesome work culture , amazing people",Pay is less than is standard at this level
1462,Red Hat,Great Place to Work,2018-09-26,4.0,Anonymous Employee,"- Dynamic environment
- Fast paced, lots to learn, high growth, high demand
- Collaboration across teams is high
- High energy amongst the team and a fun place to work","- Being fast paced, the workload / volume is high
- Many stakeholders to manage (many internal and external)
- With high growth, always pushing the boundaries (need to be able to take changes all the time)"
1463,Red Hat,Great Company,2018-09-25,5.0,Senior Technical Writer,International company with many opportunities worldwide.,You have to make your own destiny.
1464,Red Hat,Senior consultant,2018-09-22,5.0,Senior Consultant,"Collaboration,  Sharing , flexible time, friendly people and environmental
Company really take good care of their employees","Some times it's difficult to get people from different times to do something together , although we are getting better in doing this"
1465,Red Hat,Great place to work,2018-09-19,5.0,Anonymous Employee,Great group of people to work with,I felt like I had to manage my manager
1466,Red Hat,Solution Architecture,2018-09-19,3.0,Anonymous Employee,Flexibility with schedule and work:life balance.,Increasingly shrinking market; open source is not a 'thing' any longer and has been largely adopted by enterprises. No industry or business differentiation value-add on top of product offerings limits value prop for customers. Very limited solution-oriented focus within sales motion. With many public cloud options privately owned and managed infrastructure is increasingly decreasing in need.
1467,Red Hat,Excellent company to start your career,2018-09-16,5.0,Software Engineer,"Flexible Work Hours and work from home
Open culture",Compensation can be more competitive
1468,Red Hat,Channel Manager,2018-09-14,5.0,Anonymous Employee,"Excellent environment, management is helpful and open organization",Home office was not a possibility at that time
1469,Red Hat,To much politices,2018-09-13,1.0,,Work from home option. other than this nothing is good here,"IF you are hiring for frontend guys. dont join this company
Some of backend guys not respect the frontend guys."
1470,Red Hat,Great,2018-09-12,5.0,Principal Financial Analyst,"Freedom, Independence, ownership, growth, energy",It is very Stressful sometimes
1471,Red Hat,Not good anymore,2018-09-12,3.0,Sales Person,Can be a good stepping stone as the company still has some good reputation among customers as the leader of open source software.,"Red Hat became too much concerned of its performance against shareholders and then it forgot its real assets, which are its employees. Do not expect competitive salaries or benefits."
1472,Red Hat,"Great place to work, with some caveats",2018-09-11,4.0,Senior Software QA Engineer,"Culture, benefits, amenities, social events","Some cliqueness, big corporation issues, sometimes focuses on hiring Type-A candidates."
1473,Red Hat,I wish I had been told!,2018-09-11,2.0,Anonymous Employee,"If you come from a small company, Red Hat offers things like Employee Stock Purchase Programs, 401K matching and a variety of healthcare options. Your work life balance is exceptional and really good if you have kids and want to work a basic 9-5 job. You'll get 15 PTO days and the week between Christmas and New Years off without having to use PTO.  Majority of the people are very nice and genuine.","Red Hat calls themselves a startup but are far removed from the scene with 25 years of Dot-com experience. You'll often be tasked with using programs that are long deemed as archaic. My department alone used 30+ programs to be what they considered ""functional."" Some of these programs were last updated in the 90's and were not considered to be obsolete. You have no say in trying to offer opinions on how to improve processes but will be put in groups where you waste your time weekly on coming up with ideas of how to improve processes without the ability to make a real difference. 

The majority of employees at Red hat have never worked another job and are unaware the opportunities out there for them elsewhere. This encourages group think and a lack of innovation since few people have an outside perspective. As a manager, if I had someone apply to work with me and I see they previously worked at Red Hat for more than a year, I would not even consider looking at them knowing how little them likely grew while working there. 

Business outlook is always questionable. Ask anyone who works there what direction they see Red Hat heading, most will have no idea. The majority of the company runs on the belief everything is going fine(who knows why) so it should continue that way. If you're looking for a company who tasks risks that create payoffs, this is not the company for you. 

If you've been acquired by Red Hat, start job searching asap."
1474,Red Hat,Business Development Manager,2018-09-10,3.0,,"Collaborative, flexible, growth potential, excellent benefits","Too much company growth, too quickly."
1475,Red Hat,Business Analyst,2018-09-10,5.0,Business Analyst,"Great company, team oriented, excellent product portfolio, expansive customer base, managers that truly care, support and nurture employees",None I can think of
1476,Red Hat,Salary,2018-09-07,4.0,Senior Solutions Architect,Good innovative open source very good,Small less employee minimal products
1477,Red Hat,Excellent place to work,2018-09-05,5.0,Technical Support Engineer,"Strong positive culture, good organizational philosophy, Open Source, work environment is productive and fun (as much as work ever is). Very good training available. Excellent benefits package.",Compensation usually below market rate for support engineers. High prevalence of swing shifts.
1478,Red Hat,Good Company,2018-09-04,5.0,Devops Engineer,It is a good company,Work environment is sometimes hectic
1479,Red Hat,Review,2018-09-03,5.0,Solutions Architect,"Good direction, growth, strategy, culture.",Growing a bit too fast.
1480,Red Hat,Diversity is a joke at Red Hat,2018-08-31,1.0,Anonymous Employee,"Past Culture, leadership was amazing.  Work Hard Play Hard, dedication and loyalty.","The hoopla around diversity is a joke.  You need to be white or white male to get anywhere in this company.  Quotas and MBO's are increased arbitrarily. Favortism is blatant, leaning on men and specifically white men.  Even our logo is a white man.
Not the company and culture it used to be.
Once I was a proud employee now I could not even recommend this place to my worst enemy."
1481,Red Hat,Quality Engineer,2018-08-29,2.0,Anonymous Employee,"Diverse job responsibilities to choose from according to interests. Good work-life balance. (No work-overtime, a few chances to work from home if you have urgent things to handle)","The salary is way lower than other same level companies. I worked for Red Hat several years, but I didn't get a raise in salary even once."
1482,Red Hat,Great Company Culture if You are Looking for a Retirement Home,2018-08-29,2.0,Anonymous Employee,"Open Culture: communication here is open and encouraged. 
Flexible work schedule: most team allows flexible work schedule and environment to accommodate personal needs
Nice people: people here are nice in general","Middle Management: layers on top of layers of management, sometimes very incompetent once. RH keeps people around simply because they have been here for 10+ years, but not for their capabilities. Very inefficient management style
Complacency: people around you are most likely ambitionless and have no drive to go above and beyond. They are okay with taking the paycheck and raise their families. 
Lack of innovation: if you are looking for somewhere with innovation and do research, RH is not it. 2 thirds of the company is sales and marketing. Very few people are actually on the product side. There is no true agile product management because the products are developed upstream, RH is merely a downstream package center to put on a quality assurance stamp on for enterprise level customers."
1483,Red Hat,freedom but responsibility,2018-08-29,5.0,Talent Acquisition Specialist,"Great freedom, but you are still motivated to do your job. Seeing all the motivated people around is a great motivator. Also the company culture is great. So are the breakfasts.","For a beginner it's a bit overwhelming to learn all the things about company strategy, differents teams etc., but everyone around is a great help."
1484,Red Hat,Good company,2018-08-29,4.0,,"Good benefits, great and smart people, Open Source","Large company politics, some weak upper management with a 90s mindset"
1485,Red Hat,Best place to work ever!,2018-08-28,5.0,Senior Software Engineer,"You can work from home, respectfully disagree with management decisions and let your voice be heard.",There are no cons so far
1486,Red Hat,Open source leader,2018-08-26,5.0,Anonymous Employee,"Open leadership culture, global career opportunities, competitive pay and benefits","High expectation to collaborate between teams and have a global outlook is not for everyone, essential to be motivated and own your career"
1487,Red Hat,Great Company,2018-08-26,5.0,Anonymous Employee,Flexible company with great benefits and openness to associate opinions,Lack of organizational direction
1488,Red Hat,OSS company,2018-08-25,5.0,Technical Support Engineer,"For engineers, Red Hat is one of the best company to work. You can view source code for all products. In other words, you can fix issues, discuss it and develop your skills by yourself.",I am working in APAC region. Many engineering are based in other regions so that APAC region is something like sales sector. You may be sometimes disappointed how engineers in APAC are treated from other regions.
1489,Red Hat,A great place to work!!,2018-08-24,5.0,Senior Systems Administrator,"The company really does a great job using meritocracy.  They are very open about decisions being made, and when they forget the employees remind them loud and clear.  I even witnessed the CEO apologize when it was called out that they should have been more transparent about a change that most were happy about.  You don't see that often anywhere else I have worked.",A lot of opinions and ways to voice them sometimes make it noisy about really minor things.  Salary adjustments/raises are not clearly planned and seem to be an after thought.
1490,Red Hat,Best work culture,2018-08-23,5.0,Anonymous Employee,"culture, freedom to express your ideas",the average pay is slightly less than industry standards
1491,Red Hat,HR,2018-08-22,5.0,Anonymous Employee,The culture is outstanding and everyone can impact success.,At times communications can be lacking and take time to cascade
1492,Red Hat,Fantastic environment if you are self motivated and know your stuff.,2018-08-22,5.0,Senior Principal Software Engineer,"I work with a lot of smart engineers with great ideas. The company genuinely cares about your happiness and career growth, and you feel like you are part of something.","Those same engineers are highly opinionated about the ""right"" way to do things, and so getting anything done across teams can be a challenge."
1493,Red Hat,Good Place to work,2018-08-20,4.0,Sales Representative,"Great Culture, terrific CEO, interesting portfolio of products that are relevant to IT transformations","Engineering  and Open Source centric... meaning not a sales/marketing centric culture. Leadership talks the talk, but won't walk the walk to get deals done unless its a complete off-the-shelf solution. This is VERY difficult for reps that cover accounts in the West... tech companies that are moving fast, in markets that are growing fast. Red Hat is geared towards conventional Enterprise companies, which are more concentrated in the East."
1494,Red Hat,Customer Success Manager,2018-08-19,5.0,Anonymous Employee,Transparency is what i like about this company,Nothing as of now which i can think of
1495,Red Hat,Might be good employer depending your role / location,2018-08-19,3.0,Account Manager,"- Company has a good reputation amongst customers
- New innovative products on the lineup are promising
- Top management is very approachable which is very different from other enterprises
- There's very talented people in the team (reason on the cons)","- Regional management is far from effective and not up to their roles
- There is no real focus on GTM, each reg is deciding what to do
- There is no career development path and the CPO is proud to announce this, problem is that the hiring manager promised a lot when in the recruiting phase
- They make a lot of promises when hiring which they don't have any intentions to keep (hence the talented people in the pros)
- If you are working outside of a major office you'll have zero changes for any kind of career"
1496,Red Hat,"Open source, open culture; thus freedom, collaboration and responsibilities.",2018-08-18,5.0,Associate Software Engineer,"Open source projects,
Unlimited work from home (depends on manager sometimes)
Amazing culture
Friendly environment
Snacks",Lesser pay scale (compared to other big companies)
1497,Red Hat,Great employer & a good office culture,2018-08-15,4.0,Principal Software Engineer,"Plenty of career opportunities besides the predominant mobile dating back to the FeedHenry acquisition.
Great benefits package, salary, bonus, stock options.
A lot of great people that are always up for a chat.","The Red Hat culture definitely has its own flavour in this office compared to working remote or in other offices. Probably a throwback to the startup days and senior leadership. It's certainly improving.
Needs some more food places nearby, and a pedestrian crossing."
1498,Red Hat,"So much good, but plenty of bad also",2018-08-15,3.0,Software Engineer,"- Some great benefits: reasonably good pay compared to local competitors, company share purchase scheme, pension scheme, good health care, beautiful office, opportunities to work from home, Tea/Coffee + snacks and breakfast provided daily/once per week, regular office events (gaming night, cinema night) and team building, chatty office whatsapp groups and even bbq nights!

- The office is full of great competent and passionate people and working here you get to access the wider Red Hat, open source interesting technologies

- Opportunities to travel for conferences and the other Red Hat offices to collaborate with team mates.

- Depending on the team, the work can be very interesting and rewarding","- Can easily be boxed into a role, attempts to get out have been known to be met with reminders that you were hired to fill your current role.

- There are many instances of selective knowledge sharing and even some knowledge hiding (mentality remnant from its startup legacy perhaps). There is still a very clear divide between who is ""Red Hat"" and who is ""Feedhenry"".

- Red Hat is very USA centric, there is much talk about the Red Hat culture, but it is nebulous and difficult to relate to.

- Far too many extremely senior staff (principal engineers and even product architects) virtue signalling and arguing non work related subjects during work hours on internal mailing lists. In detail. On a daily basis."
1499,Red Hat,Good Work Culture,2018-08-14,5.0,Anonymous Employee,Open source ideologies help to share the knowledge and some level of transparency.,There is no fixed increment cycle which at times is a little frustrating.
1500,Red Hat,Nice place to work,2018-08-13,4.0,,"* nice facilities
* very nice people
* good benefits like health insurance
* fairly interesting work
* Ability to work from home and get of work/life balance",There aren't many places to go for lunch near the office but this isn't so bad.
1501,Red Hat,"Great company, unrealistic expectations",2018-08-13,3.0,Sales,"Competitive Pay
Wonderful CEO
Innovative, well-positioned technology company","Unrealistic and unattainable sales goals
Ineffective and unpractical enablement
Paper thin on available, technical resources"
1502,Red Hat,Awsome Place to work,2018-08-13,5.0,Anonymous Employee,"Open Organization
Competative pay
Company is growing
It's a place to make a difference in the world with OpenSource
Everyone's voice counts(Bottom up company)",A bit Chaotic - Bottom up Open Organizations are a bit messy(see pro for bottom up)
1503,Red Hat,Excellent Company,2018-08-10,4.0,Programmer Analyst,> Lot of scope for growth opportunities if you work beyond your roles and responsibilities and bring the significant improvements in the process,The work becomes monotonous at one point and employees won't have strong back up
1504,Red Hat,Great for remote-lovers.,2018-08-07,5.0,Anonymous Employee,A great place. Good managers permit remote work.,Main engineering office inaccessible by public transit.
1505,Red Hat,Great open culture company,2018-08-06,5.0,S S E(Senior Software Engineer),Great and passionate open source work culture,Did not found any cons so far
1506,Red Hat,Good company to work,2018-08-03,4.0,Anonymous Employee,Friendly environment with good management team.,Promotion is a question mark. HR doesn't help for your individual development so don't expect  much... Compensations not applicable to all countries so understand well.
1507,Red Hat,Specialist,2018-07-28,1.0,Anonymous Employee,"Red Hat in Singapore is basically Not global company. If you really want to work with local people, join here! You can have experience with them.","Become older generation - The old people of the administration level has No passion for work. 

Above senior positions insist their opinion. No collaboration with their team."
1508,Red Hat,Red Hat Review,2018-07-26,4.0,Anonymous Employee,Nice and enthusiastic people to work with . Great culture.,Salaey can be on the lower spectrum.  Workload can be an issue at times.
1509,Red Hat,"Awful culture, struggling to grow cohesively",2018-07-22,2.0,Anonymous Employee,"Decent name recognition, leading Linux and Kubernetes products","No quantitative KPIs for performance as a business, which of course makes it impossible to determine how you’re performing as an individual to support the business. This in turn makes for a lack of transparency in performance evaluations, compensation, and promotions, placing reliance on gut-driven, biased practices rewarding those in the old boys’ club. 

Mansplaining appears to be the de facto practice at this company.

Rapidly growing company without structured objectives also means lots of teams are fighting for overlapping responsibilities, driving distrust between would-be colleagues and wasted efforts all around. Newer leadership does not work well with more tenured leadership, trickling down to poor relationships between individual contributors on different teams and dramatically differing expectations. Fractured relationships between said teams drive different practices and infrastructure, making it impossible to drive maximum impact across the company and industry."
1510,Red Hat,OSS based business model with no innovation,2018-07-12,3.0,Anonymous Employee,"If you want to be an OSS developer, this is the place to be. This company truly believe in it.",RH live out of innovative ideas of other brilliant individuals in the community. Lacks innovation.
1511,Red Hat,cool place to work,2018-07-12,4.0,Software Engineer,open culture.. not limiting growth,Every body has opinion and authority. Sometimes these opinions and authority get in your way.
1512,Red Hat,Good balance,2018-07-08,5.0,Anonymous Employee,Excellent opportunity to gain varied industry knowledge.,High growth environment which keeps you very busy.
1513,Red Hat,Director,2018-07-08,5.0,Director,"Great Culture, Good perks, work life balance","Recently joined, more time to figure out"
1514,Red Hat,Very nice place to work at,2018-07-04,5.0,Software Maintenance Engineer,"Learn a lot
On a regular basis I don't have flexible schedule but I can have it occasionally
Work from home
Challenging and fun problems","Not as well compensated as other departments with similar skills requirements
Depending on the team can have more work than reasonable
Occasionally have to work on weekends (I think this depends on the team)"
1515,Red Hat,"Technical Account manager, Sr, customer success manager",2018-07-03,5.0,Anonymous Employee,work with people all over the world to help them succeed with their business goals. While at the same time promoting open source,can be stressful when customers feel  a negative  impact from a bug or an issue with the software not expected and it blocks them from their final goals.
1516,Red Hat,"Great people, terrible management",2018-07-02,2.0,Senior Technical Writer,"- Great coworkers
- Fun office in general with a healthy work-life balance (YMMV by department)","- Low pay
- Transparent only when advantageous to the corporation/management
- Toxic management as a result of promoting people not suited to the job for lack of better alternatives
- Extremely US-centric company and values"
1517,Red Hat,Channel Manager,2018-07-01,5.0,Anonymous Employee,"great culture, people, career path",growing pains and management is aware
1518,Red Hat,Good,2018-06-30,3.0,,"Good, growth potentially, team player, positive environment, best features","No problem, no problem, no problem,no problem"
1519,Red Hat,Inside Sales Representative,2018-06-28,4.0,Inside Sales Representative,"no micro management,  great company culture,",long process for approvals
1520,Red Hat,Former Intern,2018-06-27,3.0,Software Engineer(Internship),"It was a nice place to work. Very friendly coworkers, supportive, hard working and very smart people.",There are not really many cons. One is definitely that most of my team members were not in the office so it made it pretty hard to communicate at times.
