,company,headline,date,overall_rating,author_position,pros,cons
0,BetterHelp,"Plenty of Clients, Low Pay",2022-04-10,3.0,Licensed Professional Counselor,"I've never had a problem keeping a full caseload, they send clients at your pace","Low pay, no benefits unless you maintain an extremely high caseload"
1,BetterHelp,Impossible to manage caseload in order earn a living,2022-04-08,2.0,Mental Health Counselor,Flexible schedule. Set your own hours. Reliable in-flux of new clients. Responsive support team.,"VERY low pay, and you aren't compensated for time with clients beyond 45 minutes per session, regardless of time actually spent. In order to reach a decent wage, you must manage a massive caseload of messaging-only clients, no-shows and inconsistent participation, to get enough reliable patients to earn decent pay. There is also no autonomy over discharging patients and the system doesn't always allow you to select clients suited to your clinical strengths, they're automatically assigned and messaged on your behalf to your surprise."
2,BetterHelp,"Poor pay scale, disappointing , I left after 6 months",2022-04-08,2.0,Licensed Clinical Social Worker LCSW,"Fairly consistent Referrals
Good platform potentially","Extremely poor pay scale, They do not pay you hourly, you have to have two 45 minute sessions to earn the equivalent of an hour and a half of work.
No reimbursement for late cancellations or no-shows, while the platform is still getting paid whether or not the client makes use of their sessions.
Misleading advertisement, clients are led to believe that they have access to their therapist 24/7. In reality, this is setting a very bad precedent. Clients have difficulty accepting boundaries that therapist set on their time.
Clients also are allowed to believe that they will have immediate access to their therapists, some clients have complained because a therapist they were matched to did not respond within the hour. Completely unrealistic! Sometimes the match was made at one or 2 AM and the client expected an immediate response.
Therapists do not have access to the clients information, making it is very difficult if someone presents with suicidal ideation or thoughts of harming others. The burden is on the therapist to collect the clients information and often there’s quite a bit of pushback from the clients who expect the platform to be completely “private”. They do not understand at a therapist license is at risk if we don’t collect demographic information and ID, just like in a “real” office."
3,BetterHelp,"No one said Id be working for 90-100% free doing most back office, admin, off session client communication",2022-04-08,1.0,Therapist,"sign on bonus and referrals
quick and easy hire for onboard process
diversity of clients and global
platform entry experience for better one after","Onboarding was inept and lost my sign-on bonus due to their mishandling and lack of reply from customer service.
The calendar schedule is got major problems and reboots old schedule on top of a new one, continues to auto-populate inaccurately. 
customer service doesn't assist usually. They'll copy and paste template directions into emails and not respond to direct issues or not respond at all.
Pay is extremely low. Thought it might be an easy side gig while in pursuit of ither projects, but the admin, back office, off session communication and problems with system that require emails and chasing/begging customer service to help, fixing calendar autopopulate mistakes every day is atrocious and time wasting. I have no time for anything else and getting paid nothing.
The requirement to return messages that all clients can send anytime and each one requires return message within 24 hours or a big red banner and warnings are everywhere , causing stress and offense, as its taking advantage of the therapist while slacking on taking care of them.
Notes are disocuraged, any writing actually, as one gets 1-2 mintues of pay for 60 words. These words are not creative writing, they are professional and take thought and careful consideration, as its therapist rep, liability and influences a human being. This is most unethical. The therapist gets ripped off and the client is the one who will suffer. Its sad, because I like my clients and believe I need to get out quick, as most other offers are better and take care of me. Benefits are not readily available and hard to get to, as is a higher pay scale. Interface of system is insufficent and lack effective usability. Im resentful every day already, so I need it out of my life now."
4,BetterHelp,Steady work,2022-04-06,4.0,Licensed Marriage and Family Therapist (LMFT),"flexible hours, flexible scope to work as much or as little as you want, convenience","the pay is on a incremental scale: the more hours you work, the higher your hourly pay"
5,BetterHelp,I’m enjoying Betterhealth,2022-04-05,5.0,Licensed Marriage and Family Therapist (LMFT),I was able to see clients and begin getting paid very quickly.,"Pay could be a little better, but not terrible"
6,BetterHelp,Flexibility in schedule & Financial Incentive,2022-04-04,3.0,Contract Therapist,"Plenty of flexibility in the number of hours you’d like to work, the number of clients you’d like to see, and your schedule",Pay begins at $30 per hour for the first 1 to 5 hours worked that week then increases in $5 increments for each 5-hour Included Health is There can be significant amounts of time that are not “captured” within this payment arrangement.
7,BetterHelp,A dream come true!,2022-03-31,5.0,Talent Team,"I really enjoy working at BetterHelp. It is a tight knit group and everyone supports each other to succeed! You get tons of hands on experience and challenging problems to work with. The leadership is also very supportive of the team - I feel like I am genuinely appreciated and heard! Lastly, it is so refreshing to see such a diverse group of individuals!",Nothing as of yet - I will edit this comment once I get a better feel of the company.
8,BetterHelp,Great place to work for new graduates,2022-03-30,4.0,Data Scientist,"great teammates, great diversity of culture and amazing perks","The company is growing so fast, and now about more than half of the team joined within 6 months. The learning process is almost continuous all the time. But it's actually very helpful for career growth for new graduates like me."
9,BetterHelp,Great place to work!,2022-03-29,5.0,Marketing,"- amazing benefits and accommodations 
- supportive team
- lots of opportunities to grow professionally
- hands on work experience",- could invest more in DEI
10,BetterHelp,Mission + Management + Coworkers,2022-03-29,5.0,Full Stack Engineer,"- Support from seniors and other coworkers is strong, I'm learning a ton
- Engineering management is excellent, they provide the right amount of oversight without micromanaging
- Company culture is great, very relaxed yet fun to be part of
- Benefits are excellent
- Company is doing _very_ well, and it reflects in the treatment they return to the employees","- Tech stack is a bit antiquated, could hurt next job prospects if I had to leave the job with BetterHelp (This is being worked on though)
- Options to stay fully remote remain ambiguous, though it may work out that way as more and more waves of covid hit"
11,BetterHelp,Amazing company & work culture,2022-03-29,5.0,Product Manager,"This company is a silicon valley dream come true. 
Working at BetterHelp gives you an amazing opportunity to make an impact at a high growth tech startup. The company has an awesome work culture & a leadership team that is highly supportive of their team.

The compensation is pretty solid, and the perks are amazing.",The stock (RSU comp) is extremely volatile right now.
12,BetterHelp,Amazing place to work,2022-03-29,5.0,Full Stack Software Engineer,"Extremely helping people, diversified culture, and great service provided to the clients makes Betterhelp. I feel very fortunate working here. Great CEO, provides excellent benefits and perks, very comfortable work environment with flexible hours.",I didn't see any cons so far.
13,BetterHelp,An amazing organization,2022-03-25,5.0,Anonymous Employee,Extremely caring people who believe in the company's mission. BetterHelp has such a great culture despite many virtual employees such as myself. The new hire onboarding experience was seamless and I've had great mentorship. You will have great opportunities to interact and engage with all levels of leadership. You will have high-impact and high-visibility in any role at this exciting company.,None. It is such a great place to work.
14,BetterHelp,Job,2022-03-25,2.0,Behavior Therapist,Quick and easy to get started and easy to get a full case load as fast as you want.,"Low pay, takes long to get responses to your questions from the support team, do not have full control of how you manage clients in that you cannot discharge a client if the tell you they are stopping services, you have to wait for the client to terminate services in the meantime you keep getting notices the client has not responded to you and you have to message them in order and you will keep getting notices for at least 30 days. This is a good set up if you are looking to make some extra income or part time, but I have not been able to make enough to do this full time due to the pay scale and inconsistency with clients."
15,BetterHelp,Worst idea ever,2022-03-24,3.0,Therapist,"Easy to set a schedule, maintain a caseload, and the platform is relatively problem free.","Better Help will send a client an email, stating they are you, and engage the client in a conversation. I hate this. Typically you can look at the information and see if the client is a good fit for what you do, but when Better Help does this, you are left to deal with the mess they made. This seems inappropriate at best."
16,BetterHelp,Great Mission and Culture,2022-03-22,5.0,Anonymous Employee,"The team at BetterHelp is really passionate and bright. Everyone is a pleasure to work with and the overall culture is top-tier. It's still a pretty fast-paced, ""start-up"" environment, which I feel gives everyone a ton a room for growth. They prefer to promote internally. We're also pretty spoiled with all of our perks and team/company-wide events.","Leadership can be a bit too hands-on at time, which can slow things down."
17,BetterHelp,Cannot Believe I Landed This Job,2022-03-18,5.0,Marketing Administrator,"--The benefits and perks of working here are enormous! They definitely take care of their employees and prioritize the person over the work. This person-centric focus contributes to the overall culture.
--Unlimited PTO is recognized and used frequently by the employees.
--A culture that prioritizes community and togetherness. I value my coworkers as my peers, but also as my friends. 
--They are extremely conscious of workload. Consistently checking in to make sure I'm not overwhelmed, but I'm also definitely never bored. This does feed into a culture that values proactivity, however. You don't typically get assigned tasks, rather, you ask to work on the things that you're interested in. It's your responsibility to monitor your own workload and make sure you're not taking on too much.","I haven't been employed by them for too long, but, so far there haven't been any cons."
18,BetterHelp,They Spoil Us!,2022-03-18,5.0,Senior Therapist Recruiter,"The perks and treatment of their employees are way above and beyond anywhere I have worked.  I have had some pretty amazing perks with previous companies, but Betterhelp's is through the roof.  $550 a month in uber eats, free massages, fruit delivery, haircuts, its crazy how much they provide for their people.","They are owned by Teladoc, which is huge company and leads to communication issues.  Onboarding took an extra two weeks before I could access benefits and just be fully setup as an employee.   Also, did not get first paycheck for several pay periods.  I had money saved, but the guy that started with me was the only provider in his family and that was a little struggle for them."
19,BetterHelp,Therapist Onboarding Specialist,2022-02-27,5.0,Onboarding Specialist,"Great coworkers 
Nice work environment 
Benefits","A lot of work, they’re pretty short staffed"
20,BetterHelp,Chasing the next feature is slowly killing the organization,2022-02-15,3.0,Senior Systems Administrator,"Pay was decent, when everything went work from home the company honored the agreement to feed its employees with generous uber eats accounts.

Alon gracefully handles very hard, very pointed questions and answers to the best that can be expected.","The management has very little understanding of the current state of the art for security, application design, and technology innovation. Instead focusing on chasing feature after feature, they choose not to invest in paying down technical debt or improving the long term maintainability of systems or implementing basic security features such as MFA.

They also take a very lax approach to regulatory compliance and the advice of staff clinicians for what is clinically best; while correct to the letter of the law leaves employees with a strong sense of do-the-right-thing feeling left out in the cold.

Overall when I left there was also a feeling that Teladoc (parent company) was starting to exert its influence directly rather than keeping an arm's length from something that was working. Teladoc has less than zero idea how to operate in a startup environment and was asking for things that made no sense at a technical level and were harmful at an organizational culture level."
21,BetterHelp,flexibility,2022-02-07,4.0,Behavior Therapist,Good opportunity to work from home. People want help if they sign up.,Made me self employed which was an unexpected tax issue.
22,BetterHelp,Fast-paced startup culture with great perks,2022-01-25,4.0,Marketing Manager,"Betterhelp is a great place to progress your career in a fast-paced growth environment. The company has increased headcount 30% in the last half year which is a great sign. The people I've had the pleasure of meeting or working with cross functionally are brilliant, diverse and talented individuals. People culture and perks are great, however work can be grueling and demanding.","This might depend on the team, but despite all the headcount growth and the fact that we're over 200 people, it's still very challenging to track down the right person or team to help you with something, and it takes a while to execute on projects both small and large. Definitely startup culture. I find myself working over 40 hours/week consistently and will get emails and slacks from manager on the weekends. If work/life balance is your #1 important aspect of your professional life, make sure you set boundaries and vet this during interviews."
23,BetterHelp,Review,2022-01-22,4.0,Anonymous Employee,"Great perks
Great coworkers to work with",No room for internal growth
24,BetterHelp,Great place to work,2022-01-18,5.0,Junior Full Stack Developer,"- Amazing culture
- Great interview process
- Allowed for fully remote work
- Benefits are amazing
- People care about what they do here
- Inclusive environment that encourages questions and learning together",- Healthcare package is good not great
25,BetterHelp,conveyor belt therapy,2022-01-12,1.0,Licensed Professional Counselor,"Allows therapists to work from home, allegedly makes therapy ""accessible.""","BetterHelp was clearly developed by people who have no understanding of the mental health field, the therapeutic relationship, or the actual experience of working as a counselor. The screening process to work for BetterHelp is minimal. They incentivize taking on a huge caseload and meeting with clients for brief (30-45 minute) sessions, without the understanding that actual human beings simply don't have the capacity to do good therapeutic work with a high volume of people. For counselors, quality of work (and quality of life) goes down after a certain quantity on a caseload is met. BetterHelp also sends annoying messages to therapists pressuring them to respond to clients' messages, even in cases where responses are unnecessary. The platform feels impersonal and robotic. BetterHelp also advertises to counselors that they don't have to do paperwork when, in fact, keeping client records and notes is generally required by law. The starting pay is incredibly low for someone in private practice and increases $5/hour for every additional hour worked, but the platform doesn't accurately calculate the number of hours worked, thereby cheating therapists out of wages. The most a therapist can make for their hourly wage is still less than half the going rate of what most therapists charge in private practice, and far less than the weekly rate clients are paying for their sessions on BetterHelp. Therapists (and their clients) would be better off offering clients a sliding scale."
26,BetterHelp,Great company to work for,2021-12-29,4.0,QA Engineer,They care about employees. Good benefits.,Lower pay than other places.
27,BetterHelp,Great job,2021-12-08,5.0,Licensed Therapist,I enjoy working at home and the compensation and health stipend is great for me!,None that I can think of.
28,BetterHelp,Great Place to work!,2021-11-30,5.0,Software Developer,"1. Benefits and Perks are amazing
2. Great communication with management
3. Other departments are open to having conversation directly, no need to have managers involved",At times can seem very fast paced
29,BetterHelp,Not like other companies,2021-11-20,5.0,Customer Success,Management listens. Open door policy. Transparency. Great perks.,"Expectations are high, sometimes above what's needed IMO."
30,BetterHelp,Not like other companies,2021-11-20,5.0,Customer Success,Management listens. Open door policy. Transparency. Great perks.,"Expectations are high, sometimes above what's needed IMO."
31,BetterHelp,"Extremely Low Pay, Doesn't care about therapists",2021-11-04,1.0,Mental Health Counselor/Psychotherapist,"flexible schedule, work from home on own hours","EXTREMELY low pay
doesn't care about the therapists at ALL
doesn't screen patients before assigning them 
unethical work practices"
32,BetterHelp,Growth and culture,2021-11-04,5.0,Anonymous Employee,"- Opportunities for fast-paced growth
- Mission-driven company prioritizes mental health of employees","- Easy to get focused on work and not take breaks (this con is indicative of wider Silicon Valley culture, though)"
33,BetterHelp,Fabulous,2021-11-03,4.0,Therapist,"Great pay, very flexible, lots of clients",I wish that I could schedule sessions for a full hour
34,BetterHelp,Great people make a great company,2021-11-01,5.0,Principal Software Engineer,Every person I have encountered at BetterHelp has proven to be talented and extremely easy to work with. There is no perceivable management hierarchy to get in the way and there are no egos... everybody is accessible and focused on moving the platform forward.,There is no place to hide or progress by simply talking and making pretty charts. Everybody.. and I do mean everybody... works on real customer facing deliverables every day.
35,BetterHelp,Best work-life balance,2021-10-26,5.0,Marketing Administrator,"Community of people who care about the business and increasing access to mental health support.
Culture that is focused on making sure each employee is satisfied with the work they are doing, and have healthy work-life balance.
A start-up culture in a bigger, funded company. Best of both worlds","If you don't like start ups or aren't inspired by new ways to grow and expand, this probably isn't the company for you"
36,BetterHelp,Amazing Place to Work!,2021-10-12,5.0,Full Stack Web Developer,"Incredible company culture! This is a real team where everyone supports and values one another. Every single interaction I've had with a teammate has been positive -- even when I've messed something up, the response is always understanding and encouragement. The benefits and compensation are absolutely extraordinary, but you can't put a price on having a work family like this one.","No major cons. They are always working in improvements to their processes and systems, in a careful and thoughtful way."
37,BetterHelp,Excellent place to work,2021-09-13,5.0,Anonymous Employee,"- Cares about employees mental health as much and their clients
- Welcoming employees
- Open opportunities for engineering/career growth
- Great work/life balance","- Received higher compensation from other competitors, but culture and work/life balance greatly outweighed competing offer"
38,BetterHelp,Overall,2021-09-06,3.0,Licensed Clinical Social Worker LCSW,"Flexible schedule, autonomy is great.","Low pay - they tell you 30 per session for first 5 sessions then 35, then 40 and so on up to 70........but they reimburse for only 45 minutes; therefore, you get paid for 30 hours when you worked 40. Also, they have a rating system that can change by clients you never met."
39,BetterHelp,"A wonderful, meaningful place to work",2021-09-04,5.0,Anonymous Employee,"Wonderful mission, dedicated and creative team environment",I can't think of much
40,BetterHelp,Great opportunities here,2021-08-12,5.0,Manager,There workplace was pleasant and everyone was friendly there. You can move up fast.,There is alot of work and the it will keep you busy all day.
41,BetterHelp,"Engaged, welcoming workplace",2021-07-14,5.0,Data Science,"The team at BetterHelp is passionate about their work, and there is a real sense of purpose and camaraderie that comes from that. It's also a very talented team: expect to be challenged to keep learning and to continually improve.","It's a rapidly growing company, so sometimes there are signs of growing pains with such a high proportion of the workforce being fairly new. But that also makes things exciting and dynamic."
42,BetterHelp,"Some great people, but overall a toxic environment",2021-07-10,2.0,Software Engineer,"Some great colleagues
Perks were great, esp. the lunches
Compensation was competitive","Toxic office culture, coming straight down from the CEO. CEO is just plain rude to people at times, and is a bit of a narcissist to be honest.
They have a lot of technical debt, and there is no will to refactor. This means new features are hard to build quickly and reliably.
Tech stack is outdated."
43,BetterHelp,Great place!,2021-06-08,5.0,Anonymous Employee,"- Great benefits
- Great people
- Great management",Not too many cons overall
44,BetterHelp,Great company - great culture,2021-04-27,5.0,Data Science,"Great colleagues, fast face, mission driven",Pain associated with exponential growth
45,BetterHelp,Making the world a better place.,2021-04-06,5.0,Senior Therapist Recruiter,"A mission that makes waking up and getting at it very easy. 
Amazing leadership from the top down.
Part of a larger organization but feels like working for a fast-growing start-up. 
Very generous company.
Colleagues are smart, ambitious, and all-around great people.","Lots to do and not enough hours in the day to get everything done. But when you love what you do, it's all about having proper work boundaries."
46,BetterHelp,Great place,2021-03-31,4.0,Strategic Planner,Competitive wages and friendly workplace,Non that i can think of
47,BetterHelp,Great Place. Amazing People!,2021-03-23,5.0,Principal Software Engineer,Extremely welcoming company. Everyone is super nice and always happy to help. Management is focused on making sure our clients get the best help possible over making another dollar out of them. This is definitely refreshing!,"Still new in the company, haven't found any real cons!"
48,BetterHelp,Poor work/life balance,2021-03-09,1.0,Community and Support Manager,"*Good people: When I was there, there were a lot of quality people on many teams. They were friendly, hard working, and supportive","* Constant internal evaluations of work: Monthly or quarterly internal evaluations of ones work can be very beneficial. However, we were evaluated weekly across multiple points such as accuracy, time per ticket, customer satisfaction rating, content of reply, ect. So much evaluation creates constant pressure on a team and results in increased stress
*Individual contributor tickets completed per day goal far exceeded industry standards and promoted working off the clock
*More senior to the team coworkers were let go under vague circumstances leaving the team stressed about their own security 
*Leadership was unconcerned about the stress the team was under
*Leadership had no clear career growth for support team,"
49,BetterHelp,Great place to work,2020-12-28,5.0,Senior Software Engineer,"Very supportive team members, 
Great perks, 
401k match, 
Great healthcare +Teladoc online service for family and in-laws.
RSU, stock buy options.",Started few months back. None at the moment.
50,BetterHelp,Great opportunity if you're looking to work from home.,2020-12-20,4.0,Social Worker,"- Consistent referrals
- Flexible hours and scheduling
- Helpful support team and community
- Access to tools to assist clients in working through their challenges.","- You're only compensated for your time if there's a no show and not for late cancellations
- No PTO
- Low hourly rate per session"
51,BetterHelp,Great place,2020-12-16,5.0,Member Success Representative,Lots of room for growth,there are no cons here
52,BetterHelp,Great place for counselors to supplement patient load,2020-12-11,5.0,Independent Contractor,"Work from home
Lots of clients
No paperwork","Pay
Some clients are quite ill for telegram"
53,BetterHelp,Excellent,2020-12-03,5.0,Licensed Clinical Social Worker,Excellent excellent excellent excellent excellent,None None None None None
