,company,headline,date,overall_rating,author_position,pros,cons
54,BetterHelp,Great job for PT work!,2020-10-16,4.0,Licensed Clinical Social Worker LCSW,"If you would like to earn some extra money on the side, Better Help is a great platform for therapists to sharpen their skills by meeting with a wide variety of clientele. Easy to navigate platform.","You need to be able to implement strict boundaries with your clients because BetterHelp advertises itself that you will be on call and respond to messages quickly. Another thing is that unless you restrict your availability, you will be bombarded with clients."
55,BetterHelp,Creating a real meaningful impact,2020-10-15,5.0,Head of Platform Services,"- Hyper growth company
- Incredible perks
- Excellent compensation that rewards strong performance
- Lots of autonomy
- Tons of room for growth
- Very transparent from the top down
- Strong leadership
- Intelligent and caring colleagues
- Exciting work on a very important mission
- Your work matters
- Amazing people with a startup DNA","- If you don't learn to make the work life balance work for you, it can be exhausting. But you'll also be given lots of support with this if you ask for it
- It doesn't matter how good you are at your job, chances are you're going to be surrounded by a ton of other people who are just as good if not better"
56,BetterHelp,Amazing support!,2020-10-14,5.0,Member Success,"You are always heard and never judged. As they are a company under Teladoc, your health comes first! The manager within the support community is easy to talk to and extremely understanding. The whole team is willing to help and makes you feel at home.",There are no cons I have experienced within the time I have been been here.
57,BetterHelp,Super good company to work,2020-10-13,5.0,Senior Software Engineer,"Good people to work with, lot of good projects, very good work life balance",Healthy insurance is not that good
58,BetterHelp,"Great company, poor compensation",2020-09-30,4.0,Licensed Clinical Psychologist,"Management is supportive, warm, and helpful. The company handles ALL client referrals, fees, insurance, etc., so all therapists have to do is what they do best: provide clinical services. You can take on as many or as few clients as you wish, set your own hours, and work from home--very flexible! No overhead expenses of things like office rent, advertising costs, commuting, etc. Never any worries about not being able to find enough clients.","Literally the only thing I don't like about BH is the pay. For me right now, the flexibility and work-from-home aspects are so important and so positive that they make the job worth it to me despite the low compensation. But as an LP, I could make far more in a different setting. On the other hand, I'd be paying for overhead---office rent, marketing costs, the time and expense of filing insurance claims, etc.---if I worked at my own ""in real life"" private practice. So, there's a trade-off."
59,BetterHelp,Great employee support,2020-06-29,4.0,Support,"Great community, free lunch, great business mission",Work days can be long at times
60,BetterHelp,A company that cares,2020-06-23,5.0,Junior QA Engineer,"Quarantine Uber Eats, work from home stipend, and genuine interest from management about new ideas are just some of the reasons BetterHelp stands out as a great place to work. BetterHelp understands that its workforce is made up of individuals and treats them as such. Team morale always seems to be at the forefront of company decisions.

While I would expect nothing less from a company in this business, the mental health of BetterHelp's employees seems to be a priority.","I began employment in the middle of quarantine and if I had a problem, it was sometimes difficult to know who had the expertise to help me solve my problem. As someone fairly social for a software engineer, I can see this being a difficult process for new employees who are shy.

BetterHelp also doesn't have the highest salaries in the Bay and they know it. If a high salary is your #1 priority, look elsewhere."
61,BetterHelp,You want this!,2020-06-23,5.0,CISO,"The staff are all friendly and are close to each other. As a small company, it feels very intimate and your voice is heard. Everyone wants to help each other and act as a team to continuously improve the organization with so much pride. We have team activities such as video games that bring us closer. When first starting, I was able to meet everyone through these fun team building exercises. The business is in the perfect position in the industry due to the current shelter in place conditions. While other companies are reducing staff and production, demand for BetterHelp's platform has been very positive and incredible. I highly recommend joining BetterHelp as you will not regret it and wonder why you didn't do so earlier.","Only con is not looking into BetterHelp earlier. There are some growing pains as is typical for companies this size resulting in a very busy staff. However, this means that we are growing instead of the opposite direction."
62,BetterHelp,Highly recommend!,2020-06-19,5.0,Anonymous Employee,"Great team culture
Supportive Management
Plenty of opportunities if you’re looking to grow, or be able to share your ideas and feel heard
If there’s something you need to make your job easier/ more comfortable, they’ll provide it","Company is growing at a fast pace, and with that there is room for improvement in the structure for trainings, but it’s moving in the right direction"
63,BetterHelp,Great product and Work Environment,2020-06-18,5.0,Workplace Manager,I am new to the company but so far my experience here has exceeded my expectations. Joining a new company is hard-especially during SIP-but I can truly say that BetterHelp is doing their best to set up new hires to be successful. This extends to all their employees. Not just ensuring that we are productive but that we are able to navigate through this new WFH situation as best as possible. Benefits such as Uber Eats credits and WFH stipends are all great but taking time out of our company wide meeting to take a stretch and breathing course and giving an extra company wide holiday really depicts how they care for the well being of their employees. I am very excited to get to grow with BetterHelp!,Fast growing start up. There is no time for hand holding. Days can be long and fast pace. If you do not thrive in this type of environment I would reconsider.
64,BetterHelp,Great people with an important mission,2020-06-17,5.0,Anonymous Employee,"Fun people to work with, Meaningful work helping people get therapy, challenging projects","No cons, it's a great place to work"
65,BetterHelp,Supportive and Transparent,2020-06-17,5.0,Marketing,-great company culture -good perks -amazing coworkers -mission driven company,-sometimes can be too data driven
66,BetterHelp,Great company with an amazing culture,2020-01-07,5.0,Software Developer,"Great benefits, lunch provided, lots of fun events and working for a company promoting metal health care","None, great place to work!"
67,BetterHelp,Great place to work,2019-12-05,5.0,Community Support Manager,Great place to work! Wonderful company culture and the CEO and managers like to promote from within,Not many cons! Great place
68,BetterHelp,"Leaders who care, good work with perks",2019-10-09,5.0,Community Support Manager,"Great team environment, everybody works to achieve goals
Feel there is thought and effort to help me develop, I can see myself grow here!
Like my manager, they listen to feedback and work to develop solutions to concerns
Awesome perks, fully stocked kitchen
Lunch everyday","Still understaffed, I know the team is working to fix this!
Wish we had more standardized approaches, it's still a start-up and how to handle customer questions is sometimes unclear. I'm confident this will also improve."
69,BetterHelp,Community Support Manager Review,2019-09-19,4.0,Community Support Manager,"-Team is super open minded, helpful and supportive
-Work culture promotes growth within the individual and also to the company
-Operations team is ALWAYS so helpful and supportive 
-Great office perks!","-A lot of workload, super busy and fast paced environment"
70,BetterHelp,"Important mission, impactful work and good culture",2019-08-29,5.0,Employee,"Company has a great mission and really helps a lot of people. It's obvious from all the reviews that come in. Company also has a fun and friendly culture with great people. If you are self motivated and ok with fast pace and less structure, you can do very well.","Feels like a startup without a lot of structure which can be hard for some people. Depending on your role, it can sometimes be hard to know if you are doing well."
71,BetterHelp,Fulfilling yet fun place to work,2019-08-28,5.0,Anonymous,"Great company culture, challenging projects, positive company mission, opportunity to be hands on with aspects of the company outside your department, good benefits, get to experience the start up atmosphere while having the security of an established parent company","Some growing pains as the company grows, goals not always clear and defined, communication between teams not always the best"
72,BetterHelp,Satisfying place to work,2019-08-28,5.0,Software Developer,"- Great compensation and benefits
- Impactful product
- Great team culture
- Opportunities for professional growth","- Older technology (PHP, jQuery, MySQL), but that is changing as the company grows"
73,BetterHelp,Startup feel with public company resources,2019-08-28,5.0,Marketing,"Flexibility, ease of access to different teams, freedom within your role, opportunity to progress and learn.",Hiring can take a long time.
74,BetterHelp,counselor,2018-07-29,4.0,,"nice boss, great benefits, kind workers","low pay, no pto, low salary"
75,BetterHelp,Anonymous,2017-12-18,4.0,Anonymous,"Mostly fun/social place to work, incredible office manager that gives the environment more energy than you'd expect. Excellent perks, benefits, 401k, free GOOD lunches everyday.","Numbers/Data hold precedent to everything else, although you can work/explore other departments but not a ton of upward mobility"
76,BetterHelp,Better Employment,2017-11-14,4.0,Anonymous Employee,"Great office culture of work-life balance. This includes flexibility, understanding, and compassion. Management is made of real people that take into consideration that employees are also real people with real life issues outside of work sometimes. Plenty of office events, celebrations, and activities to keep us happy and motivated. Lots of things going on to remind us what a great service we are building. An environment is curated here that you feel heard, that your ideas amount to something, and the work you put in directly affects the platform.","When it rains, it pours. This isn't about BetterHelp specifically, but just start ups in general. When we're busy, we're really busy, meaning sometimes we work some long days/evenings. It gets really cold in the office sometimes."
77,BetterHelp,Enjoy getting up and going into the office again!,2017-11-13,5.0,Anonymous Employee,"-Amazing location (close to freeways/has Caltrain shuttle option) 
-Super friendly work environment (also dog-friendly!!)
-Office kitchen always has your favorite snacks in stock 
-Growing company with the opportunity to make an impact and share your ideas
-Focus on health and wellness in an office environment 
-Work/life balance with frequent team bonding outings","- everyone works hard so this won't be a good fit if you tend to blend in and slack, everyone pulls their weight and contributes to the team everyday
-sometimes the weather is bad so you have to sit inside and watch Tv with the company during lunch hour instead of sitting in the sunshine"
78,BetterHelp,Great place to work!,2017-11-13,5.0,Community and Support Administrative Associate,Great work environment. Everyone here is very friendly and great to work with. It makes coming in to work fun!,There are no cons to working here!
79,BetterHelp,Changing the world one person at a time.,2017-11-13,5.0,Anonymous Employee,"When I tell stories to my relatives and friends working outside silicon valley they can't  believe a place like this exists.  Betterhelp bends over backwards to foster community and keep it's exceptionally skilled team intact and pushing forward toward it's lofty goals.   This small but close knit group has accomplished more in the past year than competitors 10x our size and we have made meaningful impacts in countless peoples lives as a result of the platform and network of professionals  we've developed.   This is the place where you can have a real impact and grow both professionally and personally.   The work is challenging and there are moments of high stress but they are tempered with recognition and accomplishment in a balanced way.     We get free lunches daily, free door dash if you are working late,  we have hammocks and massage chairs,  a $2000 coffeemaker and all Chromatic coffee you can drink, beers are in the fridge, the break room snacks are never lacking and so long as you get your work done no one seems to care about the specific hours you are at your fancy standing desk.   It's a fantastic company and  you will be lucky if you make through rigorous interview process and onto the team.  It's worth the effort.","You have to be a self starter.  If you are someone that needs to wait to be told what and how to do things, then this is not the place for you."
