,company,headline,date,overall_rating,author_position,pros,cons
234,Criteo,Hard times but still a great engineering culture,2021-01-14,3.0,Senior Dev Lead,"- You'll work at a scale you'll rarely see in France
- Being mostly bare metal, you'll be in touch with concerns only a few people care about (hardware tweaking, network topologies and so on)
- The benefits are great (salary being one of them)","- It took the company two entire years to realise that cookie based AdTech was going nowhere and that it needed to pivot (since end of 2017, everybody knows that), It may be two late. TDD and some other competitors are far more advanced than Criteo.
- The stock price (at less than 20$, there's no way to retain anyone with RSUs).
- Besides HookLogic, all acquisitions have been a waste of money. At the same time, constant cost saving measures in the last two years did not only depress people but made delivering projects harder.
- LOTS of people left because of the three previous points, which starts a vicious cycle"
235,Criteo,"Great company culture, poor choice in management",2021-01-12,3.0,Creative Consultant,"work with energetic, international people, and take advantage of work exchange programs",Management is inexperienced and not vetted. Favouritism is evident and there is little opportunity for growth unless you rub the right shoulders.
236,Criteo,Great Company,2021-01-12,5.0,Sales Manager,"People, Company , Workplace Work-life Balance Salary","Targets, High pressure, nothing else"
237,Criteo,Good salary for unexciting work.,2021-01-11,3.0,Account Manager,"Payment is very good for local standards, especially as expat. Health benefits and ticket restaurant card make the package even more attractive. The people recruited are likely to become friends.","The company management promises a lot and never delivers. Talent is taken advantage of, but not valued as such, which is why the company has an extreme turnover rate.
The targets are normally too high and work can be very monotone."
238,Criteo,Criteo cares for it's employees,2021-01-10,5.0,Anonymous Employee,"- The culture is quite positive and you can feel the care Criteo as an organization has for it's employees.
- Organization is quite transparent in sharing the highs and lows with it's employees.
- The feeling of belonging to the organization is quite strong.",Nothing much to complain about.
239,Criteo,Great company,2021-01-10,4.0,Sales Associate,Good energy from a young country!,Limit options for carree progression
240,Criteo,Great Place to Work,2021-01-09,5.0,"Sales Area Manager DACH, Sales Central Europe","Location, Staff, Atmosphere is great",Product Portfolio is a bit narrow
241,Criteo,Good environment and nice co-workers,2021-01-09,4.0,Sales Manager,"good working environment, nice colleagues",management team is not really clear about the strategy and direction.
242,Criteo,Great experience,2021-01-08,4.0,Associate Account Executive,"You learn a ton, and this is a great place to learn how a good/great company operates.",Not much diversity in the organization
243,Criteo,Progressive benefits,2021-01-07,5.0,Anonymous Employee,"Really competitive benefits that include a 401k match, free healthcare, HSA contributions, mobile reimbursement, generous PTO, and now a permanent partial WFH policy rolling out post-COVID. Overall, the company has treated/accommodated employees really well throughout the pandemic.",Individual growth can be difficult depending on the team/division
244,Criteo,n/a,2021-01-05,3.0,Senior Marketing Manager,Good group of employees and staff,No clarity on company future or path forward
245,Criteo,Flexibility,2021-01-05,3.0,Anonymous Employee,Flexible to choose days to work from office,Prejutice can exist in certain area
246,Criteo,Enormous Potential But Managerially Challenged,2021-01-03,3.0,Vice President,Incredible co-workers; best retargeting tech out there; super-smart R&D folks in Paris; global presence; legit revenue generation; clients value the core product,"Unable to find a strategy if it hit C-level execs in the face. CEO and others sourced from largely old-school business, such as Neilsen. CEO hires contacts vs. actual industry experts, so you get a ""flight software guy"" hired to understand Sales in digital media. Wow! No understanding of how to engineer around Google/AAPL restrictions, Too much abandonment of performance marketing to be a ""SaaS platform"". Not much advancement outside of Paris / maybe NY."
247,Criteo,Security Engineer,2020-12-24,5.0,Security Engineer,"Respect, open, Impactful, Challenges, Team collaboration",A little pressure on some department
248,Criteo,Amazing,2020-12-23,5.0,Data Analyst,Very nice environment for working,Not very high compensation and opportunities
249,Criteo,good,2020-12-22,4.0,Software Engineer,"apéro, salary  vavation and a good spirit",a lot of work to do
250,Criteo,Great company,2020-12-18,4.0,Associate Account Executive,"strong learning program
good money
supportive and fun Boston team","grind
low base salary
can't think of anything else"
251,Criteo,Good place to work,2020-12-17,5.0,Account Strategist,Good benefits cool people can be a bit political,I work in a small regional office so not much room for career development
252,Criteo,good experience,2020-12-15,5.0,Account Manager,overall good experience at all,no cons to mention for now
253,Criteo,Great place to work,2020-12-11,5.0,Account Strategist,"People, Culture, and a very great teamleaders and managers",Sales Goals are too tough and overperformance is not highly compensated
254,Criteo,The kind of company I'd like to work at for the rest of my life,2020-12-07,5.0,Software Engineer II,"* Great culture
* Flexibility of a startup and stability of a giant corporation
* Great pay
* Lot of perks like gym membership, cellphone bill, parking, public transport
* Stocked kitchen with snacks and drinks including beer and Kombucha on tap
* Gifts and swags occasionally 
* Work with smart people who will mentor you and make you better at whatever you do
* Great work-life balance","* You will have to tutor people on what the company does and how to pronounce ""Criteo"" every time they ask you where you work."
255,Criteo,Bad strategy,2020-12-03,2.0,Product Manager,"Smart co-workers, the technology is interesting.",The senior management is incompetent.
256,Criteo,Great experience,2020-12-03,4.0,Associate Account Executive,"Opportunity to make good money, young office, great structure to learning the role - they really ease you into it","Starting salary is a bit low, working from home can be hard"
257,Criteo,Still Best place to work !,2020-11-24,5.0,Software Engineer,"- do the communicaiton in time
- work from home policy for corona and really put employers life at first
- work life balance
- talent r&d engineers
- salary","- comparing my previous mutuelle, the mutuelle is terrible 
- less benefits
- the communication bewteen R&D and Product is bad"
258,Criteo,Good Company,2020-11-20,5.0,Senior Manager,"Good people, Salary and benefit. Many chance of business travel depends on your position.","not really, if possible, I will work for Criteo again."
259,Criteo,"Great company, lots of growth, great comp+benefits",2020-11-17,5.0,Associate Campaign Manager,"I came to Criteo from an agency and I wouldn’t change making the jump from agency to media vendor. The culture at Criteo is great, most people are very friendly and willing to help/answer any questions you have.

The compensation and bonuses are really good. I feel properly compensated for my work. Also we don’t pay anything for health insurance, which is unheard of!",No real negatives stand out. My experience has been pretty positive.
260,Criteo,Good company,2020-11-15,5.0,Stagiaire,Very good atmosphere and everyone is so nice,can't think of anything really
261,Criteo,A collection of very talented people,2020-11-14,3.0,Operations,"Talent, work ethic, autonomy, friendly","Career growth, structures, incentives, expectations"
262,Criteo,Solid company with significant headwinds,2020-11-12,3.0,Senior Data Analyst,"Well developed tech, smart and caring people","Competitive landscape, industry challenges / dependence on other company's decisions, and regulation make the outlook grim. Hiring freeze, high attrition, and lack of upward movement means existing employees work harder for less reward."
263,Criteo,Great company,2020-11-12,5.0,Analyst,Fun to work at. Super level of professionalism. No stranglehold of short-term sales thinking. Invested a lot of time into training me.,"Working with Paris-based product team was sometimes challenging, but high quality on their part made it worthwhile."
264,Criteo,A great company,2020-11-04,5.0,Account Strategist,There are so many pros,Nothing in my mind and difficult to add
265,Criteo,Fun Culture,2020-10-26,5.0,Data Analyst,"Great culture and people, huge amount of data","A lot of change in org for no apparent reason, not enough head count in most teams, tough industry"
266,Criteo,Competitive but friendly,2020-10-19,4.0,Sales Account Executive,"Competitive, Performance based salary, multi-culural environment",Not collaborating well with the marketing team
267,Criteo,"Good work and life balance, competitive compensation compared to Japanese companiese",2020-10-15,4.0,Account Strategist,"Nice office environment, great internal tools to support your work, collaborative",Privacy regulation and Cookie restraint strike as a big challenge to business.
268,Criteo,Great entry level role,2020-10-06,4.0,Data Analyst,"Great flexibility, willing to take on less experienced people",Frequent changes in company structure and strategy
269,Criteo,Great place to work,2020-10-05,5.0,Adops,"Everyone is happy and friendly, awesome perks",There are no cons for this company
270,Criteo,Great entry position,2020-10-05,3.0,Team Lead Account Strategist,"Great benefits, very international, steep learning curve, great trainings",Management does not have enough soft skills & too little people focus
271,Criteo,"Used to be great, now not so sure",2020-10-05,2.0,Anonymous Employee,"- Used to have nice benefits, socials, team breakfasts, nice events
- Nice canteen
- Above average salaries","- Management is really worrying, lack of experience and works well only if you are friends
- Overwork some employees, but favour other employees who have been there a long time
- Lots of people stay just for the good salary, but do not pull their weight or practice supportive team work - the culture has become very selfish and arrogant"
272,Criteo,Experiences may vary,2020-10-02,3.0,Technical Solutions Engineer,"-Good benefits
-Learning courses offered 
-Good starting role for those wanting to enter the tech field","-Company isn't catching up to competitors
-Hiring and promotion freezes leaving employees frustrated
-Middle management is often disliked"
273,Criteo,"Great company, energy, and perks",2020-10-01,5.0,Account Strategist,"- There are a lot of very driven, intelligent people that work in every team in the office, and internationally. Many have specialized knowledge, which allows you to seek out individuals for collaboration, and makes getting to know people that much easier. Your individual teams are generally small, so you will really get to know these people and form a tight knit community among the strategy team.

- There is a very positive attitude created by the people you work with. It is likely from a combination of bright, intelligent team members, and a product/platform that is top-notch.

- Frequent opportunity to collaborate with analytics, sales, and products teams. While most are very busy, there's always someone willing to assist you.

- There seems to be a range of management styles at Criteo, which, depending on your working style, is a good thing. Managers push you to do your best, are very experienced themselves, and do a great job at staying connected and in-tune with your daily work (down to very minute details), even in the WFH environment during COVID. There's nothing worse than having a direct manager with little to no hands-on experience in your role. All of them at Criteo are true experts, and bring personal strengths to their relationship with AS's and helping you to develop client strategy.

- The work itself varies based on your team/clients, but the platform, data, and analytics team assistance allows you to get very granular when it comes to uncovering ways to help your clients grow. The role allows you to grow your interpersonal skills as well as in-depth data articulation.

- While it carries less weight in light of COVID, the office is beautiful. near 360 degree views in the heart of downtown Boston. Plenty of snacks and beverages. Plenty of corners to work quietly, or room to collaborate with team members.

- From what I know of the ad-tech/advertising scene in the Northeast, pay is very competitive.","- True to the semi-""startup"" feel of the business, many teams are often very busy. It's challenging (but not impossible) to collaborate with some teams who you'll often rely on. In light of this, most management is aware and working to make this better. In light of COVID, they're actually doing a great job maintaining efficiency in this area as we're all remote.

- The industry in general is entering some uncertain times in regards to data-privacy, and major players control the future of retargeting. There is certainly inherent risk as companies like Criteo are impacted the most if these sweeping changes are carried out."
274,Criteo,fine company,2020-10-01,3.0,Software Engineer,good cantine good food good people,overworked and the food is a bit expensive
275,Criteo,Great company to work for,2020-10-01,4.0,Managing Director,Positive and will do energy,Very risk-averse and no clear strategy at the top
276,Criteo,Great Company,2020-09-30,5.0,Senior Software Engineer,"Tech Savvy, wonderful co-workers, perfect place to grow",I cannot think of anything
277,Criteo,Great Place To Work,2020-09-28,4.0,Data Analyst,Very very good engineering team,"No cons, very good company"
278,Criteo,-,2020-09-25,4.0,Operations Manager,Good work life balance in Japan,Retention rate is not good
279,Criteo,Nice company with some structural inefficiencies,2020-09-25,4.0,Machine Learning Engineer,"Criteo is a fine place to work, I'm fairly confident it is the best tech company to work for in France. Criteo's culture is very performance driven, and engineers apply all the best practices in the field. Criteo also has a lot data to work with, which is a data scientist and machine learning practitioner's dream. Technologies used are fairly top notch, Criteo has its own data centers, its own SRE and Infra departments, and many tools to ease the development and deployment processes that rival those of cloud platforms.","The company is somewhat stuck in a limbo between a small startup and a big tech company. It's engineering department is concentrated in France (since it's SF branch has closed), which makes it rather close-minded and less open to the adoption of new and state-of-the-art technologies. The development processes are fairly slow moving, which have made the company fail to diversify its product portfolio in recent years (although it's going a bit better lately). There are several structural inefficiencies, starting from a very big pile of technical debt, that you need to circumvent and adapt to in order to make new products and produce value (it takes effort but it's possible)."
280,Criteo,An Excellent company,2020-09-21,5.0,Senior Data Scientist,"Criteo is an Excellent company with a solid foundation with its top principles. In an age where big tech treats employees like machines, Criteo had the human touch and really took care of its employees and invested so much in them. I really miss working at Criteo, and wish all of my former colleagues success in their journey, where it may taken them.",Only con I can think of is the time difference between the California and Paris
281,Criteo,Nice place to work,2020-09-20,5.0,Sales Associate,Multinational dynamic place to work,Hard to promote and become a manager
282,Criteo,High Burn Out - Decelerating Fast,2020-09-17,3.0,FP&A,"People are incredibly smart, and care so much to make things work/grow. Teaming up with Ax, Sales, etc was the best part of working for Criteo. If you can handle ambiguity, you’ll thrive here.","Not a lot of career advancement (even before COVID). As the business grew, they didn’t invest in supporting departments which left FP&A or SalesOps working night/weekends frequently without relief. You’ll work at 120% capacity your entire time there. The thrill will be enough at first, but burn out is inevitable."
283,Criteo,Great Community,2020-09-16,4.0,Data Analyst,The people there are great. Extremely capable people and great all around,The job can get stale at times. And there is some middle management where you question whether or not the position is needed.
284,Criteo,One of the best companies to work for in France.,2020-09-15,5.0,R&D Engineer,"- Relatively stress free environment
- Nice offices
- Good infrastructure","Maybe some managers can be clumsy, but overall no serious issue."
285,Criteo,Working at Criteo,2020-09-15,4.0,Account Manager,"Salary, team spirit, work life balance",Not drive by a strong top management team
286,Criteo,Great experience,2020-09-12,5.0,Senior Data Analyst,Challenging and positive atmosphere in the office and larger company,Fast changing business and environment
287,Criteo,Good people but due to external factor,2020-09-10,4.0,Sales Director,Great place to work. good benefit,Slightly tough situation to grow furthermore
288,Criteo,great company,2020-09-08,5.0,Sales,"good people, ambitious, smart and caring",bit slow to evolve to the market
289,Criteo,A mix of Good and Bad,2020-09-07,2.0,Account Executive,"Amazing team members, at least in Sales, even though we are all individual contributors, we feel very much connected and supportive of each other.

Good Covid-19 support in terms of home equipment, mental support. Though it would have been better to just get a stipend to buy the equipment instead of submitting receipts+get compensation for other expenses.","Disconnected top leadership, many internal blockers for execution, the job involves more moving the needle inside of the company rather than selling the product outside. The leadership likes to have many feedback sessions, where no comments are written by them, no actionable resolution is offered, no accountability or ownership of a problem/solution. 

The worse part - over-achievement is penalized in the long run, higher targets, and less desire of the management to promote top performers. Instead, mediocre employees that provide bad level of service and underachieve are promoted and/or get lower targets."
290,Criteo,"Headquarters good, local offices vary",2020-09-07,3.0,Anonymous Employee,Great company with a lot of resources and structure,Smaller local offices can be poorly managed or lack leadership.
291,Criteo,No,2020-09-01,5.0,Technical Solutions Engineer,International culture and innovative work environment,New hires job training is well planned
292,Criteo,Great people but changing leadership,2020-08-20,4.0,Anonymous Employee,The team and people that are at Criteo are incredible. There are a few bad apples but overall it's a strong team that has a mission.,Leadership keeps changing and direction is murky though there are a lot of opportunities.
293,Criteo,5/5,2020-08-15,5.0,Anonymous Employee,1. compensation 2. nice offices 3. nice people,1. no more cookies soon
294,Criteo,"Terrible work culture, poor management direction",2020-08-10,2.0,Anonymous Employee,Opportunity to work with key brands in the market,"Terrible work culture, no business or management direction during difficult times, managers don’t care about employees especially those joining from outside in these changing times. Toxic culture of me and my work, poor team spirit. Hierarchical approach to teams."
295,Criteo,Awesome Experience,2020-08-01,5.0,Chief Innovation Officer,"Team members were friendly, motivated and super smart",Was a very fast growing organization
296,Criteo,Good company and solid technical culture,2020-07-22,4.0,Anonymous Employee,"Big infrastructure
Good salary
Nice people
Well organized","Core business is ads :(
Some politics in R&D (don't know about other)
Still in R&D, there are tendencies to just promote a language or technology because someone high ranked or very valued likes it, without real technical justification"
297,Criteo,Great Opportunity for Junior Position,2020-07-20,4.0,Ad Operation Specialist,"Coming from the industry already, I was impressed by the management and how they are always pushing you to go for the best and reach the extra mile, still recognizing your efforts and performances. 
Atmosphere is very positive and you will be surrounded by brilliant people at all level of the company. 
The company is also providing many great benefits such as Health Insurance, Ticket Restaurant and Transport, but also Learning tools and modules with certifications.","The Ad Operation Role at Criteo is a junior position with no customer facing. If you already have experience in the industry this can be quite repetitive.
On a general base Criteo tends to hire overqualified people at every level of the company (at least in the technical team), which creates some frustrations on the long term."
298,Criteo,Pros/Cons,2020-07-17,4.0,Account Executive,"open space, high tech company in digital marketing world, very young people with different backgrounds",Local Leadership very new so dont know how to show perspectives for careers for example also stop to promote only people that works inside the box.
299,Criteo,Criteo as a worplace,2020-07-14,4.0,Senior Analytics Analyst,Dynamic workplace that invests in training employees,Too many org and reporting lines changes
300,Criteo,Shadow of its former self,2020-07-13,3.0,Senior Product Manager,Used to have many talented people across functions.,"Slow to innovate, lost dozens of the most talented people."
301,Criteo,Awesome place,2020-07-09,5.0,Technical Solutions Engineer,Treats employees very well. Great teamwork,The ad tech industry is a scary place to be
302,Criteo,cold calls / outreach,2020-07-08,4.0,Sales Development Representative (SDR),fun work enviornemnt and the people too,work from home makes it hard
303,Criteo,Opinion,2020-06-30,4.0,Data Scientist,"Working hours, People, Perks, Salary","Business travel reduced, No gym allowance"
304,Criteo,Perfect company to start a career in digital marketing,2020-06-25,5.0,Senior Data Analyst,"Really smart people, good data infrastructure, family atmosphere",Management can lack of leadership
305,Criteo,Great place to work!,2020-06-10,5.0,Enterprise Account Executive,"Besides all the things we know, such as having some good points of being a global company, what really impresses me is to see how much Criteo cares about people.",I don't have any thing wrong to point out at this very moment.
306,Criteo,Great place to work,2020-05-29,5.0,Account Executive,"- great product
- learning opportunities
- talanted people",There growth opportunities are not so big
307,Criteo,Good company,2020-05-28,5.0,Technical Solutions Engineer,"Strong product, open atmosphere, free culture",The privacy concern is challenging the business
308,Criteo,"Good money, messy organization",2020-05-13,3.0,Account Executive,"money, culture, office, autonomy, benefits","management, sales model, stress, difficult to connect to mission."
309,Criteo,"Good place to work, would recommend",2020-05-05,4.0,Anonymous Employee,"Good place to work. Upper management cares about the people, benefits are great, office culture is strong.",Not sure where we're headed long term with the regulations continuing to be tacked on.
310,Criteo,Low valued : warning lack of employee protection,2020-04-27,1.0,Sales,"Good integration especially when you come from outside Spain 
Friendly people aged 25 - 35 yo
Cultural diversity
Lot of personal-time (everyone is gone from the office at 6pm)","- Unexperienced management: lack of transparancy and rationality when taking organisational decisions , do not receive and apply feedbacks, low level of knowledge regarding their markets and sales methodology 
- No career path
- Low internal promotions
- No inspirational leadership
- Lack of employees protection: people dismissed within 2 hours notice, psychological strains (HR convocations without subject notice), temporal dissmissal for invalid reason regarding law (example: you broke the elevator screen and we've seen that in camera)"
311,Criteo,Good stuff,2020-04-14,4.0,Ingenieur,"You are treated like prince, very well",Not ure about the future of the company
312,Criteo,Family,2020-04-13,5.0,Senior Leadership Team,"Sense of family within the team, people-first approach, innovative product team.",Sometimes too inward looking in terms of development. This is changing though. New C-Level helping here.
313,Criteo,Worst company i worked at,2020-03-31,1.0,Anonymous Employee,The fake cool culture,0 diversity. You can tour an entire floor without one single women or person of color. The diversity they promote are fake numbers as they recrute people from eastern european countries aka other white fellows
314,Criteo,Account Strategist,2020-03-28,5.0,Account Strategist,"- has a great team
- good work benefits","- no structure 
- stressful working environment"
