,company,headline,date,overall_rating,author_position,pros,cons
421,Criteo,Are you looking for a fantastic job? Criteo is an answer!,2019-02-02,5.0,Anonymous Employee,"I began to wort at Criteo not so long ago, but from my first day I enjoy that.
There are several reasons why...
First and the most important reason for me is the atmosphere. My colleagues are not only great professionals, but also friendly and responsive.  They help me with any issue I have from the very beginning. 
Another reason is an international spirit of the company. Keeping in touch with other cultures usually leads to extraordinary solutions. 
Moreover, job itself contains various different tasks and challenges that help me to enrich my knowledge and always learn something new. goGoGO!
Work-life balance was also an important issue while looking for a job...And Criteo managed that:)
I am very happy to be a part of Criteo family!","I am very positive about Criteo, so no negative feedback."
422,Criteo,Fun place to work and learned a lot,2019-01-31,4.0,Associate Account Executive,"-relaxed environment
-casual work attire
-fun company culture
-useful training","-too many unnecessary restrictions
-political/cliquey
-attrition"
423,Criteo,Criteo is a fantastic place to work!,2019-01-31,5.0,Account Strategist,"Criteo is a fantastic company part of which I am happy to be. I have been working here for almost two years and every day 
I fall in love more with this place. 
Criteo does not stand still. The company is constantly improving offering high-tech solutions for its customers, a high level of service. Criteo especially appreciates its employees, supporting team spirit, providing excellent and comfortable working conditions, development opportunities and trainings and most importantly you can express yourself here.
What makes Criteo such a perfect place for me are people, people all over the world who work here. Despite the distance that separates us, the company regularly provides the opportunity to meet and share experiences, and also, once a year, organizes a global event, at which the power and spirit of Criteo is especially felt.
Locally each office has its own atmosphere with positive smiling people, cookies, yoga and the feeling that you are in the right place.","I proudly share with my friends about Criteo without any negative feedback, and I will certainly recommend to be a part of this company."
424,Criteo,"Smart People, great working conditions",2019-01-31,5.0,Data Scientist,"Great responsibilities
Work with smart people
Can easily move within the company","Sometimes obscure vision
Short term strategy"
425,Criteo,Opportunities are there if you push for it,2019-01-29,4.0,Senior Data Analyst,There is loads of data to work through.,Central teams feel controlling if you are not in the main hub.
426,Criteo,Humanity vs Machine,2019-01-29,1.0,Account Strategist,In Barcelona they pay a bit more than the average salary is,"The value for the individual person is going to be lost, it´s all about working as hard as possible without any rewards given - the appreciation regarding the employees is dropping constantly. Communication is not transparent and between the teams we have huge gaps in terms of granting Work from Home or Work from Another Office rules, the allowed days are also dropping constantly without official communication. We also keep bad Team Leads and Managers which are unable to show the needed skills - like communication and empathy. And instead of giving back, Criteo takes even more amenities from us as employees. We get less and less  money for Team Events, Client Travels - even our Targets are constantly increasing, what makes it even harder to archieve them and therefore to get our bonus payouts."
427,Criteo,Good ambiance and good salary,2019-01-24,4.0,Sales Director,"Good compensation (compared to the market) 
Good ambiance at work",No clear direction of the company
428,Criteo,Diamond in the dirt,2019-01-23,2.0,Sales Manager,"-great people
-free breakfast
-amazing health benefits
-good product","Well where do I begin? 

Two years ago Criteo was a different company. The company truly embraced ""go go go"" and you felt that you work for a true innovative and strong organized company. 

Now.... The company has abandoned their ""quality over quantity"" policy and have changed it to ""quantity over quality"". Hey, if you can hire people for the half price just because they've barely tasted the corporate world.. why not? 

Want a promotion? you better be best friends with the manager, oh and make sure you start a bunch of meaningless projects so that upper management sees you. 

Want a senior position? Got a french passport? 

Hey, let's just raise everyone's target when over 50% of sales reps can't reach their current target.. makes sense, right? 

The company begs for feedback from their employees almost on a weekly basis. you'd expect things to change and for the feedback to be taken seriously, right? WRONG."
429,Criteo,Looking for a data driven company? Look elsewhere,2019-01-18,2.0,Anonymous Employee,"Best office space in Barcelona
Fun social life","- Terrible mid to upper management. 
- Employees are evaluated on their networking merits, a large portion of the management is utterly incompetent.
- There is an obvious divide between the motto of Criteo ""go Go GO""and the reality of  the Company: any change, project or idea needs the full approval of management which can literally take years. Any project is wrestled by hangers on.
- Product development happens in complete isolation from commercial reality. As a result it is poor."
430,Criteo,Sales Manager Position,2019-01-15,3.0,Sales Manager,"Great product, nice company benefits","Poor unqualified management, getting worth year to year"
431,Criteo,great place to work,2019-01-14,5.0,Anonymous Employee,"great offices, good location, nice atmosphere",nothing to share from  me
432,Criteo,Used to be a great company to work for,2018-12-13,3.0,Anonymous Employee,"Great place to work, smart and dedicated people, the company has created a very fun place to work in with some great ethics and values enabling you to perform at your best.  The workplace experience team go above and beyond to ensure they create the best possible environment to work in with loads of team-building activities and social gatherings. This used to be one of the best companies to work for. It's one of the last remaining independent AdTech companies with an amazing reputation in the industry. It still has great potential if management manages to steer the boat around and go over recent hurdles.","Things have changed over the course of 2018. Dramatically. No clear vision, strategy, or direction. As a result, many great and dedicated employees, including key and senior management, have left the company across all divisions. Due to the recent changes, politics have found their way in, leaving little room for growth to non-politicians (promotions of the same employees every 6 months, promotions of people from specific offices, etc)."
433,Criteo,Great company to work for... If you joined in 2016.,2018-12-12,4.0,Team Lead,The team. You will work with a group of talented individuals. Leadership nowadays isn't as strong as it was in the past.,"The leadership team. Criteo grew up fast, as such, there are directors and leaders that bring little benefit to the organization."
434,Criteo,"Great company, great benefits, great people",2018-12-06,5.0,Anonymous Employee,"My experience with Criteo Barcelona isn't perfect, but it's by far the best company I've worked for. Yes we can improve things, but seriously for such a recent and fast growing company I'm quite amazed about what we're able to achieve. Criteo cares about people.

Reading some comments make me feel uncomfortable, specially people say being French is a requirement to be promoted. The fact is ; your nationality doesn't matter. Yes, you can be French and lead another market, exactly as you can be Dutch and lead UK. Or Italian and lead Spain....  We have so many examples ! Criteo is a French company, so it used to be almost 100% French some years ago.  The French employees who started 5 years ago and helped structure the huge growth are naturally in managerial positions now. I don't think there's any French conspiracy here  :-)

Work on your skills, be patient, be constructive. Criteo rewards hard work and maturity. Sometimes you need to be patient and wait for the opportunity to come. Focus on your skills, focus on what you can improve around you. You'll be rewarded.","Criteo is a Public company so yes numbers matters a lot and can create some level of pressure, specially on Sales people. 
Managers are stretched with important teams (a team leader can have 8 persons in his team + many strategic projects, which can make it hard to find the right balance). 
Some people with unrealistic expectations or lack of maturity not appreciative of all that is done for them (massage, breakfast, social events, coffee, free snacks, amazing office, promotion or lateral moves opportunities...)"
435,Criteo,Experiences people DON'T go,2018-12-06,2.0,Sales Manager,"- Breakfast
- View
- Office
- Location
- Salary ( Well not anymore apparently)
- The product is amazing.","OH GOD, where do I start?

Well, when you build a company based on the french management cover by some American startup management there will be a problem one day.

Here we are.

The middle management have to be fulfilled by competent people, not the people that have been here since the beginning and have created a kind of untouchable bubble. The fact is that if you want to manage sales team, prove yourself first instead of being promoted because you joined the company at the right time. 

This is where the problems start. 

Then when you hire people with skills, do not manage them like kids and do not expect that they are going to follow every single sales advice you give.
You have to learn as well from everyone.

You are not better because you're manager and you don't know everything about sales (please listen to people).

With this (French) management bubble,  people gravitate to being on their side, you can feel a real hypocrisy atmosphere.

IN CRITEO BE CAREFUL OF WHAT YOU SAY, the walls have ears and to be promoted, apparently is good to be a wall ;)

So there is a problem with a company that run a french management covered by an American management expectation."
436,Criteo,"Fast paced, market leading company with great benefits",2018-12-06,4.0,Sales Manager,"Great benefits including uncapped commission,  gym contribution, healthcare (for you and your partner) and breakfast (and snacks)","Promotion opportunities are lacking as a team leader/manager and their is currently no incentive to grow as a senior sales manager.
No annual salary review."
437,Criteo,"Professional and personal development, to the highest of their forms.",2018-12-04,5.0,Sales Manager,"1) Professionalism and fun in the right mixture. 
2) Learning environment - both for hard and soft skills.  
3) Dedicated and flexible management. 
4) Company culture that values people, Criteo invests on his people, Criteo wants to retain his people, Criteo loves his people.","1) Still monoproduct company. 
2) Big company, full of very knowledgeable and skillful people, hard to progress fast."
438,Criteo,Not a good place at any point in your career,2018-12-04,1.0,Anonymous Employee,"Boy oh boy, have I been waiting to write this review. I have been at Criteo for a sufficient amount of time to see the company go from a small BCN office where everyone was each others friend to the giant mess it became today. Only now I realise how many snakes there were (and still are) in the management, how necessary a French passport is to be promoted and how little I should have expected from this company at all.
Let me kick this off with a few positive points:
- You get well paid. Barcelona is a relatively cheap city (though getting more expensive), which Criteo knows very well. They pay you well so you don't complain, sit quiet and do your job without providing any sort of criticism.  Be careful - if you get relocated as a new employee and get fired within the first 6 months you have to pay back the relocation bonus. Happened to many times.
- Office is amazing. Great views, you get free breakfast (as you do in all Criteo offices), there is ticket restaurant (free lunch), by the beach.
- Some employees you can actually learn a lot from and become friends with. Enjoy while they're there - high probability that they will be leaving soon!","After working for a long time for a company you would expect to be the go to point in case of issues, be acknowledged and be promoted. Not at Criteo Barcelona, here you simply get ignored, nobody cares about your opinion if you are not in a management position (where you only get to if you are French of have French friends). If you intend to get promoted expect to be spending your after works at Barnabier on the ""management table"", the one where all the managers gather and only people who want to be promoted try to glue themselves on. If you  try to get promoted like in any normal company (working hard and being there for your colleagues), you get forgotten - they will do their best to make you get pissed off so that you leave yourself and they don't have to pay the golden handshake fee. 
To the juniors out there - stay home in your cold countries, do not be deceived by Criteo HR promising your amazing views and spamming their Linkedin profiles with it. It's all a nice cover for the mess that's actually happening inside and you will find out very soon after joining."
439,Criteo,Keep quiet and get your salary,2018-12-03,2.0,Barcelona,"Good salary and benefits

Easy to get promoted if you know how to play politics or speak French

If you don't have to be treated fairly and just get your paycheck, it might be the company for you.","-management is lacking professionalism in basic skills (although I do not blame them, as they never needed them)
- code of conduct does not exist in some teams
- team leads are given responsibilities but cannot make any decisions and yet still behave as managers and remind you about hierchy 
- no career path and no clear goals in most of the teams
- senior employees are leaving or are unmotivated to help other team members and care only about their jobs and targets
- lack of confidentiality in HR team, they are just gathering information for the managers (none of the meetings are confidential, if you are working in Criteo now, please remember this)
- lack of cooperation between teams
- employees are treated like children instead of professional advice and support
- feedback is not welcomed, specially if given to French employees and ignored in many cases
- employees who are the manager's friends are receiving special treatments everyday and nobody is reacting, because it is a closed circle of self-supporting and covering tracks (very visible recently - did you think we don't notice?)
- junior profiles are hired because it is cheaper and easier to control, people come to have fun in Barcelona and do not complain, after a while they leave
- specific people only are ""asked"" by the managers to add a positive review of the company (October)


Criteo is creating an illusion and a bigger lie every month. All employees are playing along and clapping as we all want to keep our jobs. Things are getting worse with each quarter, targets are unrealistic and there is no support from management.
People skills are missed, because what is important is ""projects"".

People are fired as if they did not mean anything. Meanwhile some managers can spend budgets on their friends and their needs or take sick days whenever they want without documentation."
440,Criteo,Obsolete,2018-11-28,1.0,Anonymous Employee,CEO with vision and business sense,"My manager didn't even say goodbye when I left. 

Extremely micromanaged environment - even small decisions have to be a approved by the manager and the level above. 

If you are not French, it's extremely hard to get a promotion. Backstabbing environment, where many people are just looking out to impress their managers."
441,Criteo,Just Amazing,2018-11-14,5.0,Anonymous Employee,"Amazing team, smart people, everyone is very friendly and supportive. Great benefits and people oriented company",Nothing negative on my side
442,Criteo,have you seen the stock price? its chaotic on the inside,2018-11-07,2.0,Anonymous Employee,nice benefits and snacks but nothing compared to big tech,massive attrition which is internally believed to be normal for big company
443,Criteo,"Challenging projects, great work life balance, multi-cultural environment",2018-11-06,5.0,Software Engineer,"Impressive tech stack.

Still a good mix of startup spirit and big company: 'No fear' approach on the one hand and all needed resources to try on the other (talents, infrastructure). If a project failed/late/killed - happens, keep moving (no blame/punishment).

Proactivity is encouraged and expected: no matter how junior you are, new ideas are welcomed (of course there is a challenge to get them planned). I.e. there is a Hackathon every year which gives the winners an opportunity to work on their projects.

Internal mobility: managers try to take into account engineers preferences and help to change the scope if a guy doesn't want to work on the topiс anymore (unfortunately not always possible, but the effort is away bigger than in my previous companies). Also, there is a cross-offices Voyager program: any engineer can join another R&D team for a few weeks to learn new stuff. 

Diverse environment: >10 nationalities for appx 100 people in the office. 
Work-life balance: no work during the weekends or late in the evening, flexible working hours (people can shift a bit their schedule when needed, can WFH occasionally; no official WFH policy though).

Reasonable management: most managers have regular 1-1s with their direct reports + occasional ones with the rest (i.e. anybody can request a 1-1 with any Director or VP); top management is open for discussions on any topic (even negative anonymous reviews are being discussed in a positive manner: 'lets brainstorm together what we can do better')","Working with HQ in Paris is challenging due to 9 hours difference + lots of technical dependencies (management tries to mitigate it by having isolated projects when possible, but it's still hard).
Less variety of projects than in Paris (natural for any non-HQ office and difficult to change).
Diving stock price (and no recipe to fix it so far)
Quarterly planning is heavy and takes lots of time."
444,Criteo,A change needs to happen,2018-11-04,2.0,Sales Manager Nordics,Fun environment and free breakfast.,As a sales manager you might be fired at any minute. You need to work very hard to pass probation but even then the company might not keep you if they don't like you.
445,Criteo,Criteo goGoGO!,2018-10-29,5.0,Anonymous Employee,"Criteo is a great company to work for! I've been with Criteo just over a year now and I've loved every minute. Criteo is on the cutting edge of e-commerce technology and we have the talent to prove it. 
There's a great office culture that includes smart innovative team members that work well together at work and play. With quarterly team events you have the opportunity to bond with your fellow teammates outside of your in-office projects.
Career opportunities are clearly defined and evaluations are biannual, allowing you to easily understand where you're at & what you're working towards. 
We have regular office yoga and massages on top of the monthly stipend to use for healthy living expenses!  Criteo seems to understand that happy/healthy employees do better work.  Work-Life balance is so important in our current fast-paced climate.
Criteo is doing great things and still continues to grow. I look forward to seeing the company continue to flourish and can't wait to see what's next.",I have been very happy with my Criteo experience and don't have any negative experiences to share.
446,Criteo,"Good company, worth it",2018-10-28,5.0,Account Strategist,"Competitive salary, good environment, good benefits, nice workplace","Salary could be a little higher, relocation bonuses could be more frequent for sales people"
447,Criteo,Software Engineer,2018-10-26,5.0,Anonymous Employee,"Innovative culture, tech leadership is open to adopt new ideas. Great place to learn & work with smart people, diverse culture but with european touch (HQ is in Paris).

Free breakfast (every day) & lunches (not every day), benefits are matching most of the Bay Area.",AdTech is changing day by day and it looks like company is trying very hard to find its place on the modern market - and it feels that in many cases management is overreacting which brings confusion
448,Criteo,Do not recommend,2018-10-26,1.0,Anonymous Employee,"* Golden cage - high benefits and salaries. 
* Nice offices and facilities. 
* Nice company events.","*It's all about people - that's how they sell it, but it's ALL ABOUT NUMBERS. You count to generate revenue, otherwise you're not valuable and you're out. 

*FRENCH OVER ALL! -  they promote even French people to Lead UK Market. All Leadership team is French....how strange taking into account that we're talking about an European Hub with many nationalities based in Barcelona, but on the Top, only French people. They speak french in meetings, even if there are people in the room who won't understand the language. Very rude environment. 

*POLITICS vs. CAPABILITIES - the better you're at politics, the higher you will get. Do not challenge the wrong person, or you will be left out. 

*RECRUITMENT is a SALES DEPARTMENT - 100000 of promises to attract people from many countries, cash in hand to make it more attractive to end up getting dismissed most of them for not selling. They don't care if you've just relocated from another country, or you're sick, they care if you sell, and this is why the recruitment team doesn't evaluate if you're suitable for the role, they sell you the role so that you can come and make sure they get their bonus. 

*PEOPLE MANAGEMENT? - WHATS IS THAT? - Top Management Team build all by promotions of (again) french nationalities, with very poor skills. They want to become Managers so that they stop having targets that put you on an Improvement Plan almost every 2 Quarters. The Middle Management Team is more human, but unfortunately, the culture and the Top Management won't support them. 

*DISMISSALS EVERY DAY - I've seen more dismissals in 1 year than anywhere else in my whole working experience (more than 10 years on the same sector). Specially if you join as Sales Manager, other positions are more lucky on that. Very high attrition. 

*CRITEO is FOR YOU IF: you LOVE POLITICS, are FRENCH or SPEAK FRENCH, DON'T CARE about TEAM WORK but only about INDIVIDUAL OBJECTIVES, your PRIORITY is MONEY and NOT PEOPLE."
449,Criteo,Software Engineer,2018-10-25,5.0,Staff Software Engineer,"A Silicon Valley company with european vibe

Diverse colleagues, unique problems to solve, great perks and location","Company’s direction may be unclear at times. 
Management takes reactive approach to deal with inside/outside problems"
450,Criteo,Excellent company to work for,2018-10-25,5.0,Data Scientist (Software Engineer),"- Many talents and experts specialized in Software Engineering, Machine Learning, AI and Statistical Modeling, 
- Criteo provides multiple events and training to make sure employees stay at the top of the industry and get the opportunity to learn a lot. I received a ticket for NIPS conference (sold out in 11min) after 6 months within the firm. We have weekly events to meet and discuss research papers and industry applications of quantitative methods,
- Criteo is constantly innovating, projects are extremely interesting and it is very easy to share thoughts within the team (managers are all good communicators - they are here to give you constructive advises), and across teams (Criteo also encourages mobility),
- Management is constantly looking for new product opportunities and is open to new ideas (via a formal established process, or unformal talks).

- Lots of free food, beverages, and social events,
- Great Culture (go check the video Criteo gogogo),
- Amazing work life balance, 
- The Paris office is extremely impressive, we go grab lunch on the rooftop with  a view on the Eiffel Tower and the Sacre Coeur, we have all kind of goodies, lots of space and light,

- Very generous vacation package, many small advantages (gym contribution, vacation contribution, transportation and other discounts) and strong compensation package.

- Recruitment process is extremely smooth and clear, every interviewer went though a long training process to make sure the assessment will be fair, and HR does its best to make the process pleasant and constructive.","Once you get in here, it's very hard to leave."
451,Criteo,"Reasonable and smart people, in general",2018-10-24,4.0,Software Engineer,"Truly multicultural and unique office in Palo Alto. Management is reasonable and perceptive, most of the time. Pretty flat structured company. 1x1 with colleagues 2-3 levels above are pretty common. You don't feel abandoned in a maze, people always want to help. One of the best benefits and pay in industry.","Like any live and evolving company, has it's own issues. When a project takes cross Atlantic teams involvement it may become a problem. Some processes are very slow.  Company is competing with major giants in the industry but this is also makes this a good challenge."
452,Criteo,Good Place to be for Mid Level,2018-10-24,5.0,Sales Manager,Great place to be if you are mid level.,Tough to grow within the company.
