,company,headline,date,overall_rating,author_position,pros,cons
631,Criteo,Overall a good company with a few unprofessional people,2017-06-02,2.0,Account Strategist,"Great Benefits
Good Compensation
Quarterly Bonus
Travel/Cellphone expenses are reimbursed","They are losing a lot of good people. Not sure if they are not being treated correctly.
The ""Art Directors"" in the Creative department need to stop forming personal relationships with junior employees. I have seen some inappropriate behavior in the office.
Coming from a non-technical background, my interaction with the technical solutions managers has been difficult. One of the managers looks down on  me every time I talk to him. I have also heard him boast about how this french company helps him evade NY taxes"
632,Criteo,"great salary, bad career path",2017-05-29,3.0,Anonymous Employee,"great benefits and salary, great colleagues","poor career path, management lacking people management skills, employees are just numbers and not people"
633,Criteo,Global company that has many challenging problems to solve with a scientific approach,2017-05-24,5.0,Software Engineer II,"International office, a lot of vacation​ days, travel opportunity, large amounts of processing power","Not free lunch every day,  limited empathy for the product,"
634,Criteo,SRE Lead,2017-05-13,5.0,SRE Lead,"Cultural fit, events and Summit are awesome",Performance is everything so you need to like that
635,Criteo,ad tech company with lots of talents in France,2017-05-10,5.0,Software Engineer,"1. good work experience
2. voyager program allows you voyage to another team whenever you want","based in Paris, not in SF"
636,Criteo,Sales Manager Nordics,2017-04-27,4.0,Sales Manager,"Global mobility
Upcoming company
International environment with nationalities all over the world
Best product","This is a brand new industry for me, so it is a fun challenge to learn the product and its features."
637,Criteo,Account Executive,2017-04-25,3.0,Account Executive,"Opportunity to make a lot of money
 Nice peer culture
 Company has clout and name recognition in the industry.","Managers vary drastically in ability
Hight internal competition - many reps fail simply because they cannot build a decent book of prospects
High attrition"
638,Criteo,AX,2017-04-25,4.0,Business Intelligence Analyst,"work with very talented people
free to use the tools you want (python, R etc)
You can have the a large impact on the company from the word go","Large work load
lot of pressure
Bad hr and recruitment processes"
639,Criteo,Great first two months at Criteo!,2017-04-20,4.0,Account Strategist,"- International company
- best in retargeting
- good benefits
- location of the office in Barcelona",- I don't have one
640,Criteo,Great company for those in ad tech,2017-04-17,5.0,Account Strategist,"Great benefits (snacks, time off), good culture",Not a lot of room for growth
641,Criteo,Salesmanager,2017-04-16,5.0,Sales,Fast start smart people empowerment,Culture same people mainly white males
642,Criteo,Not Just Another Ad Tech Company,2017-04-07,5.0,Manager,"* Great work atmosphere
* Excellent benefits
* Career opportunities
* Mobility (how cool is to work in Sydney, Tokyo, Singapore or Paris for a while?)
* You can really make a difference
* Management cares about you
* Some teams feel like family","Every family has issues :) so: 
* Cultural fit is a must - and might be a challenge to some.
* Fast growing business means fast-paced work - again, not for the faint of heart."
643,Criteo,Great place to work,2017-04-05,5.0,Anonymous Employee,huge responsibility to be successful,there is only single product
644,Criteo,Great Company; great product! Can do better on Culture and giving relative tech & R&D importance to  other key markets,2017-03-31,4.0,Anonymous Employee,"1. Overall the company has a great culture and work ethics
2. Strong product technology and market reach built-in
3. Amazing set of highly talented folks
4. High degree of empowerment
5. Great brand name to be associated with","1. Very Paris and US focussed w.r.t product innovation, proactive market approach and tech/R&D investments
2. Core work culture & ethics does not percolate to every geo/market"
645,Criteo,Market leaders,2017-03-29,5.0,,"Great company, lots of good benefits, market leaders, strong tech, performance focused, retargeting specialists, listed on NASDAQ","High standards expected, need to be a self starter, competitive by nature and ready to represent yourself.  Single product focus can become somewhat repetitive"
646,Criteo,Inspiring sales job,2017-03-28,4.0,Sales Manager,"Friendly office culture, young and dynamic coworkers, company parties, good circumstances to achieve goals, good career opportunities & good training program. When you work hard and take the advices you'll get here, you'll be able to achieve the companies & your own goals.",Focus is on performance. That means that coaching also is based on performance instead of the underlaying social coaching. For some people this can be demotivated. Make sure that you take advice not personal. Also the focus is more and more on quantity instead of quality.
647,Criteo,Good. Everything moves quite fast,2017-03-27,5.0,Anonymous Employee,Annual summit in France. Talented coworkers. Friendly office culture and lots of fun office/outing events paid by the company. You keep learning from your job too,Sometimes upward mobility might not be very clear. Times to times we have some changes in organization and reporting line moves. Also salary might not be the most competitive so many top workers leave to join competitors
648,Criteo,Senior Software Engineer,2017-03-25,5.0,Senior Software Engineer,Cutting Edge Technology at Large scale.,Main R&D base in only in Paris.
649,Criteo,Great place to work!,2017-03-22,5.0,Data Analyst,"Really enjoying my time here, perks are awesome, people are good. Travel is to France which is nice.",Workload and responsibilities between teams can vary greatly.
650,Criteo,Account Executive,2017-03-21,4.0,Account Executive,Good place to work for a short period of time,Too much work load. Difficult to maintain healthy work life balance
651,Criteo,Commercial intern,2017-03-17,5.0,Commercial Intern,"Amazing experience, amazing office and people.",I coudnt find one yet
652,Criteo,"Young Company, Great Potential, But Need More Training",2017-03-17,3.0,Anonymous Employee,"- laid-back work atmosphere
- great people
- good perks (free food, video game area)
- internal mobility possibilities
- opportunity for career advancement","- you can hear a pin drop
- clique-y
- lack of good training
- inability to localize business practices, lack of understanding of regional markets"
653,Criteo,Great Place To Work,2017-03-16,5.0,Anonymous Employee,"- Salary
- Benefits (food, transportation, health care)
- Frindly and Smart environment
- Workplace (ergonomic, clean, technological)
- People","- HQ in Paris is a disadvantage for many of the other EU offices
- HR - not on site and they do not knwo anything about the country you work 
- Carrer Path - not very clear"
654,Criteo,No Work life balance,2017-03-15,3.0,Technical Solutions Engineer,Got to learn a lot from experts,Local India office did not respect work life balance
655,Criteo,"Mid-Size company, Start-up feel",2017-03-06,4.0,Anonymous Employee,"Great people, work environment, and snacks",Pay could be better. It's not the greatest.
656,Criteo,Mass expansion in Asia with messy politics,2017-02-23,2.0,,"Decent benefits
Very young culture so good fit to start first job for those who may have little experience or expectation

Relocation mobility can also be quite fluid

Annual global employee summit in Europe, party like you're in college ( ideal for those who likes to be rewarded in that manner)","Poor leadership skills, people managers are promoted when they are not the right fit. About 70% of managers are first time managers and may have no clear direction on handling matters (Drill them with questions in your interview so u get an idea)

Rapid fire and hire culture in sales 

Lack of learning and development courses, Company do not nurture staff in personal development 

Start-up vibe with very messy internal re-org in Asia right now, so if you are looking for something stable and have commitments, it's not advisable 

Very very long working hours and Founders of the company do not encourage working from home policy ( maybe except for the US)

No clear career path for non-sales + technical roles

Depending on your role, decisions and control can be quite French centric"
657,Criteo,"Poor leadership, great perks",2017-02-22,3.0,Anonymous Employee,"Technology that works
Nice offices with free drinks and food  
Annual summer retreat that involved every employee 
Smart people 
Fun culture 
Solid benefits package and vacation time","Poor leadership especially within the mid-market team 
Some managers were promoted too early and have 0 leadership/management skills
Paris HQ can painfully slow things down
Lack of direction and resources 
Long interview process with too many people involved"
658,Criteo,Amazing,2017-02-19,5.0,Anonymous Employee,Best technology in the industry by a country mile!,Long Hiring process to get the job
659,Criteo,Great Company,2017-02-16,5.0,Data Analyst,"Beautiful location in major capitals around the world, amazing technology, driven by great people.
Work atmosphere is awesome.","Not much to say. 
All positions are not available in all offices."
660,Criteo,Great company with amazing employees around the globe!,2017-02-09,5.0,"Senior Director, Sales and Account Strategy",Growing company with strong product suite and amazing global reach.  Annual gathering in France.,HQ is in Paris which can slow things down.
661,Criteo,Sales Manager,2017-01-31,5.0,Sales Manager,"Dynamic, creative  and young company",I haven't experienced downside yet
662,Criteo,Data Analyst,2017-01-21,4.0,Data Analyst,Growing really fast and the team is very energetic. People are young and very motivated. Really enjoy working at this company.,The team is growing too fast and the some parts of the team etc are not yet well structured. That includes all the benefits and infrastructures.
663,Criteo,-,2017-01-19,5.0,Creative Support Specialist,"Best in working culture
Best Environment
Good opportunities
Nice interior",personally no disadvantage to work in this company
664,Criteo,Working at Criteo Munich,2017-01-15,3.0,Anonymous Employee,"good product; sports, massages, breakfast and fruits for free in the office; good location and office enviroment.","no flexible working time, no home office and this in 21th century...  micromanagement and a lot of manager levels. Unfortunatelly strong competition in teams (supported by management) and no team spirit as the result."
665,Criteo,Great Experience,2017-01-09,5.0,Human Resources Coordinator,"-Culture 
-Team 
-Growth Opportunities
-International Environment
-Challenging 
-Fast Pace 
-Benefits
-Work hard, play hard attitude","-sometimes too challenging
-complex recruitment process, maybe too complex, so they are loosing good candidates"
666,Criteo,A fantastic place to work.,2017-01-05,5.0,Associate Account Executive,"Great culture and teams- Management are awesome and everyone is more than willing to drop what they're doing to help aid a fellow co worker.

If you want more responsibility, you will get it. Management welcomes forward thinkers and loves to see people take on new challenges. This in turn leads to greater career opportunity.

Fun environment- Very cool office and plenty of fun things to do when you have some down time.",Fast-paced environment may be tough to adapt/handle for some
667,Criteo,Entry Level Dream,2017-01-05,4.0,Associate Account Executive,"Great manager support, salary, benefits and fun young culture.","Challenging, but this is definitely a Pro as well as a Con as you learn a lot here!"
668,Criteo,Not that great,2017-01-02,2.0,Anonymous Employee,"Usually nice colleagues 
Nice perks like snacks, gym memberships, free breakfast
Annual trip to France
Big company, good image, looks good on resume","I can only second what a couple of people have already posted before me.

1. Promotions have ABSOLUTELY NOTHING to do with skills or expertise. You can be the best performer in your team, popular among your team members and clients, extremely motivated - all doesn’t matter. If the manager doesn’t want to promote you then it’s not going to happen. If they see you as a threat then you’re out. Rules for promotions formally exist but can be bent according to the manager’s wishes.
2. Nationalism - There is one nationality which is preferred. Period. This is not limited to any specific department but a company-wide phenomenon and is well-known. This leads to extreme frustration and low morals among staff members. 
3. Managers are not held responsible for the performance of their team/market. This is probably the worst. I have seen managers repeatedly not hitting their targets. It was perfectly acceptable to having multiple team members being fired in the course of only one quarter instead of asking whether the manager was suitable for the job."
669,Criteo,Senior data analyst,2017-01-01,4.0,,Interesting topics and dynamic teams,Opaque process of evolution and career paths
670,Criteo,Data Analyst,2016-12-18,4.0,Data Analyst,"- Great atmosphere (office and people)
- Young and international
- Office growing fast","- Lack of vision of the data analyst team
- Limited possibilities of internal evolution in Barcelona office for data analysts"
671,Criteo,Interesting company for a short period of time,2016-12-09,5.0,Technical Solutions Engineer,Very good atmosphere at the office. Dynamic company. Correctly paid for Barcelona.,Repetitive tasks as Technical Solutions Engineer.
672,Criteo,TOP,2016-12-08,5.0,Recruiter,"Great environment, huge investment into workplace, brillant people, very challenging, Global company",Salary are a bit low for the market.
673,Criteo,Good culture,2016-12-04,4.0,Data Analyst,"- Friendly people
- Great culture
- Challenging problems
- Cutting edge technology","- Serious scalability challenges
- Little time to work on more interesting projects"
674,Criteo,Director,2016-11-30,5.0,Director,"Company doing very well, very strong technology, competitive compensation, very good benefits","Fast growing company leads to political struggles about owning business, career paths and promotions not always clear"
675,Criteo,Very good,2016-11-28,5.0,,"Very nice people,good environment, nice canteen, Friday afternoon tea",sometimes communication could be not easy because there's many people and departments
676,Criteo,Fun place to work but limited career growth,2016-11-17,3.0,,"Annual paris trip, smart colleagues, young & fun atmosphere","Not many options for growth, very specific options for mobility."
677,Criteo,Account Strategist,2016-11-17,5.0,Account Strategist,"Beautiful office in central London, Great benefits, Yoga, Pilates, Massage, nice colleagues",None I love it here
678,Criteo,Manager A,2016-11-14,4.0,Manager,Very good company with a lot of opportunities,Hard working and fast pace environment. Don't apply if you don't like challenges
679,Criteo,Turnover is high in some areas,2016-11-10,3.0,Anonymous Employee,"Company wide summit to Europe.
Company is profitable
Company is growing.
Cool Paris office.","Acquired companies are forced to move to Paris or Palo Alto.
Engineering culture is centrally focused.
Engineering talent in Palo Alto is not the best compared to other companies in the valley"
680,Criteo,Being a software engineer at Criteo,2016-11-03,4.0,Anonymous Employee,Employee empowerment. Merit-based promotion. Peer reviewing. Great spirit. Great events. Top-notch offices. Efficient management.,None I can speak of.
681,Criteo,We will always have Paris,2016-10-27,5.0,Business Intelligence Analyst,"It's French! The company was not founded in the US. It is therefore way more international and interconnected and culturally diverse than most other companies can even claim to be. This is a ridiculously excellent bonus. They also show respect and importance to offices in all regions. In the Palo Alto office, people work hard but are genuinely nice and helpful. You cohort with people cross-department. There is good food and a clean sink in the kitchen. People eat lunch together. Poker night, and of course in start-up culture fashion, there can be some alcohol in the fridge. That one fact is proof that adults are treated as adults. The location in Palo Alto is perfect (way better than the SF location). In Palo Alto, there is decent parking, te ability to get a parking permit for a garages and great places to eat at the end of the block.","Random shake-ups in management. In hindsight more visibility into why the changes happen - not just standard back-story during the announcement itself, would be helpful.
Some of my fellow Americans has issues with HQ being in France such as time lag, or feeling a bit less important, having less say. While time lag causes issues in any company, the other stuff is American bias. Offices are worldwide, US can't be catered to"
682,Criteo,Sales Manager,2016-10-21,5.0,Sales Manager,"6 month in, and I think it's time to make a review of Criteo. 

Criteo is overall a very good company. I work as a Sales Manager, in our wonderful Barcelona office. Probably the most amazing view from any office I've ever seen (and I've seen a few). 

What I really enjoy about Criteo is how well the product actually works. As a Sales Manager, this makes my day-to-day life soo much easier and helps me perform. In previous jobs, it was much more about selling the vision, while here with our super transparent setup, you can't really go wrong.  

In previous jobs, there has always been some distance between senior manage and the people below. This is definitely not the case here. Super friendly people, who have mostly all started their careers in Criteo, which says a bit about the career opportunities in this company.
 
Besides very friendly people, from all over the world, they company really tries to be creative in their social approach. We're not just talking summer and Christmas parties. Almost every week, there is a social event; that being team activities on the beach, cinema evenings or renting a boat and sail on the ocean.  

As mentioned previous, the Criteo product is really standing out within re-marketing, which makes it a joy to sell. But Criteo is opening up to new trends and products, that will for sure have an impact in the advertising space for the future. 

They really make sure to hire quality people, which makes the company really stand out, compared to my previous experiences. It's all about the people, and I think they got this right. 

The company is growing A LOT, which makes sense, as the product work. I had more inbound my first 14 days, that I had for a whole year in my previous role.     

So top remarks 6 months in. Hopefully this will only get better.","Obviously no company is picture perfect, but I do think Criteo is doing something right."
683,Criteo,Has the culture been lost through recent success?,2016-10-19,4.0,Sales,"Great product, Great management, Great work and play atmosphere.","Start-up, collaborative culture has somehow been lost in the process of becoming a big organisation. Values are not strong enough and not inherent to the management, recruitment,etc... A shame cause the rest is faultless. 

Also beware that in the mid-market department, you're meat to the management which has a rather macro view of the human resources there. As long as you're perform, great..."
684,Criteo,Great place to work !,2016-10-18,5.0,Software Engineer,"You might not heard of the company, but their ads are all over the internet. 
The office maintains a great startup culture without crazy long hours. Resulting superb work life balance. 
The compensation for engineer is at almost Google/Faceable level, I am not sure why it says only 90k here.","The stock price fluctuates with Europe stock, which is not doing so well lately.."
685,Criteo,"Hyper-growth, exciting place",2016-10-06,4.0,Analytics,Dedicated to performance marketing and results,"Inflexible systems, limited transparency for clients.  Frequent US leadership changes"
686,Criteo,Pretty cool and motivating,2016-09-26,5.0,,"- great atmosphere and still a bit of fun, quite important for such a big company
- people are not left behind, we're growing a lot but there are many projects available and good career opportunities
- amazing people and amazing offices
- ambitious vision","- challenges keeping the growth on mature markets
- getting harder to emerge and be noticed by upper levels and managers from local offices
- thappens to have more commercial pressure  near quarters ending, for obvious reasons"
687,Criteo,"Business Development Director, Moscow",2016-09-09,4.0,Business Development Director,"- Competitive salaries.
- Interesting challenges.","- Long working hours.
-"
688,Criteo,Criteo Review,2016-08-29,5.0,Account Executive,"Trip to Paris
Fast growth
Great benifts","High stress, high reward
lots of new poeple"
689,Criteo,Business Intelligence Analyst,2016-08-27,5.0,Business Intelligence Analyst,"Great people and environment. Not google, but still has a lot benefits in the offices. Global travel policy is awesome, and you visit any office around the globe.",Pretty good in all aspects
690,Criteo,Review,2016-08-25,4.0,Anonymous Employee,"Good business, good technology, dynamic",Can be long working hours.
691,Criteo,Data Analyst,2016-08-05,3.0,,"Great pay, great working hours.",Disorganized atmosphere and lack of vision
692,Criteo,"Interesting Work, Great People",2016-08-02,5.0,,"Great atmosphere, with constant changes to learn and grow in. Values life outside of work and connecting their employees. Managers genuinely want to have successes within their teams and listen and understand your direction.","Communication is lacking from the Paris headquarters to trickle down to local teams, and there seems to be a disconnect between internal teams that may have similar issues. This could be a growing pain, but would increase efficiency."
693,Criteo,Nice company,2016-07-19,4.0,Anonymous Employee,"- great team
- great people
- genuine willingness to develop people in responsibilities and careers (not necessarily in salaries though)
- powerful technology
- great benefits","- salaries are within average / lower band of the market
- hard to get an opportunity as a new hire vs. the old Criteo crew
- job mobility quite often means international mobility"
694,Criteo,Good place to work,2016-07-12,3.0,Account Strategist,Good function and working place,Poor sales order and skills training
695,Criteo,Marketing/PR,2016-07-01,3.0,Marketing/PR,"Depending on who you work with and meet, Criteo can be a great example of employee empowerment, that gave me a greater sense of achievement than any other company I've worked for in the past. The yearly summit where everyone from around the world gather in France (HQ) is a unique part of Criteo's culture and a great prop/motivation for employees. It's 2~3 days of drinking and partying (but no food, nothing informative from the C-level, JUST parties).","Too many young and unseasoned people who aren't quite ready to ""be empowered""- there's a great lack of responsibility and ownership. There are also a lot of grey zones around corporate guideline and policies. What made me ultimately consider leaving was the absence of  an actual corporate strategy. They really don't have one."
696,Criteo,Best company that I've worked so far.,2016-06-27,5.0,Business Development Manager,"Criteo is a terrific, fast-growing company that provides a great workplace experience.

- External training in Paris or US
- Experts everywhere
- Culture of teach & learn
- Extraordinary product, with huge positive feedback. Very easy to sell
- Above average paychecks for the Brazilian standards
- Exceptional leaders.","By being a very mature company, you can't expect a huge career uplift in a short term within Criteo."
697,Criteo,Great data learning,2016-06-15,4.0,Senior Data Analyst,"Extremely data driven company. The core product is a machine learning engine that predicts consumer intent. 
Largest Hadoop cluster in europe, with a large variety of data uses and tools. 
Awesome place to learn SQL, Hadoop/Hive, Tableau, AB-testing, etc. 
Friendly and awesome offices around the world. Respectful of individual differences.","Although Criteo is amongst the top companies that enable the Internet to be free (advertising fuels content creation and access to information), I find Criteo doesn't have a great focus on it's actual impact on the world."
698,Criteo,Global but family-like,2016-05-31,5.0,Sales Manager,"Brilliant local management (can't say much about global as I'm a manager and we never interact), working conditions are employee friendly, no micro-management, no overcontrolling, fair compensation and lovwly people.",Haven't noticed any for the half a year here.
699,Criteo,Getting bigger and bigger,2016-05-17,4.0,Anonymous Employee,"Lots of opportunities in a company that still grows. Also, very good atmosphere and environment in most offices.","HR are not on par with what one would expect from a 2000 employees company
Career management plans are weak and random outside of the Product and R&D teams."
700,Criteo,"Nice people but bad organization, centralized management",2016-05-11,3.0,N/A,Very good work & life balance. Global environment and diversity. Highly independent work style but on the other hand you don't know what some people are doing here.,Lack of transparency and career development. The best place for people who only wants to have a stable job but not for those ambitious ones. Politics happened everywhere and extremely centralize management.  French nationality or French speakers domain.
