,company,headline,date,overall_rating,author_position,pros,cons
0,MZ,They work you like a Dog,2022-04-04,1.0,Head of Live Operations,"- Good Perks
- Made some good friends","- Horrible hours
- No work/life balance
- Low pay
- No career advancement
- Once they know you're exploring opportunities at another company, they will fire you."
1,MZ,Awesome,2022-04-04,5.0,Director,Great everything no complaints at all,nothing to gripe about great place
2,MZ,Friendly and helpful team,2022-03-28,5.0,Art Producer,"The people are great to work with! They make everything super fun and engaging. 
PTO policy is very good. 
Flexible timings as can be. 
My manager is very thoughtful. 
I have full autonomy in my role which gives me room to grow and work on developing efficient processes.",I can't think of any at the moment. I'm happy at my job.
3,MZ,Not so good,2022-02-22,2.0,Director,Location. Cafeteria. Parties were great.,Everything. The management was awful.
4,MZ,salaries,2021-12-29,1.0,Senior Technical Recruiter,full time position onsite only,work hrs controlled to specific hrs
5,MZ,Great company,2021-07-08,5.0,Anonymous Employee,They are great to their employees,Sometimes you may be the last to know about change
6,MZ,Great people,2021-07-02,2.0,Production Manager,"some really smart people
hyper-engaged teams
lots to learn","bullying culture from snr snr management
crazy hours"
7,MZ,Complete Nightmare,2021-03-23,1.0,2D Artist,The pay was not too bad. It was the only way they are able to convince people to give up their soul.,Company was led by people who failed upwards.
8,MZ,MZ,2021-03-11,4.0,Senior UA Manager (Mobile),people caring culture of Machine Zone,"workload, we usually have to work overtime"
9,MZ,Poor Management,2021-03-10,1.0,Database Engineer,Start up culture and awesome perks,"Poor management, lack of work life balance, no vision"
10,MZ,OK company to work with.,2021-02-26,3.0,Senior Software Engineer,"The pay is good, the benefits are good. Free food and snacks.",The company lose their soul on building innovation games.
11,MZ,MZ sucks,2021-02-19,1.0,People Operations,"Pay, snacks, catered lunch, benefits","Management, leadership, over worked, under appreciated"
12,MZ,"Good Money, Bad Management",2021-01-31,2.0,Senior Artist,"Really good pay, solid coworkers, decent perks, rumor is it's gotten better.","Management was a mess, expected to work unreasonable hours, political bias affected managements decisions"
13,MZ,Gaming,2021-01-30,4.0,Analyst,Nice company to work with,Too mch work sometimes in the company
14,MZ,Legit,2021-01-14,5.0,Blog Writer,All good here at MZ.,"Nada, I love working here."
15,MZ,Former QA Tester,2021-01-10,5.0,Manual QA Tester,"Love the perks, free food",Sometimes had to work through lunch and after normal working hours
16,MZ,If you value your health do not work here.,2020-11-16,1.0,Product Manager,"- Free food(pre-pandemic)

- Some really nice people to work with and spend long hours at the office with.

- They pay really well.","- Horrible work-life balance: Expect to be working 50-80 hours a week if you are a part of the Design, Analytics, Live Operations, Product Management. You should also expect to be asked to cancel your time off, and be frowned upon if you refuse to do so.

- Extremely fast environment that focuses on reactionary tactics rather than solid planning and execution. Expect for plans to change every single day MULTIPLE times. This will increase the amount of errors every team makes and lead to a lot of post-mortem meetings that could have been avoided.

- Volume over Quality: If you're passionate about making GOOD video games, don't come here. They will make promises to you about your opportunities to build out and rebuild games. If you still aren't convinced, require your demands be written in your contract. They will refuse.

- Micromanagement: The everything needs to go through the CEO, even your time off requests. Team leaders have no say in how their team operates and Executive Producers dictate every single thing you do. That's not to say the Executive Producers are bad, they have to deal with the CEO looming over their shoulders at all times. Expect to be contacted on your days off.

- Discretionary Time Off = You're less likely to actually take time off. They say there's no limit to how much DTO you can take off, but HR keeps tabs on people the moment they've taken more than 40 hours of DTO."
17,MZ,From great to mediocre,2020-11-05,1.0,Software Engineer,"Fun culture
Great benefits for the family
Free food","Work on a lot of random gimmicks
No long term future
Tight deadline"
18,MZ,Too much P2W,2020-09-26,2.0,Game Designer,Lots of different stuff to do so you are always engaged and busy,"Too money focused. You have new gameplay idea? Does it milk players? Nope, then no thanks. Does it require engineering effort? Yes, then no thanks as well..."
19,MZ,Worked here for 3 years,2020-09-22,2.0,Quality Assurance,Great perks and health benefits,"Yearly layoffs. They lay off many employees EVERY YEAR. Unprofessional CEO, constantly saying offensive phrases, opinions and embarrassing staff during meetings."
20,MZ,Political Game of Thrones,2020-09-19,2.0,Engagement Specialist,"Compensation is pretty good. Decent bonus structure. 

If you're hourly, you'll reap the benefits. Ability to move up if you just put in the hours (not really about contribution or tangible impact).

HR leaves very nice reviews of what the company could be. I think it's a positive because we can all strive to be better.","Place is great for people who like politics and maneuvering through the corporate ladder. I've seen junior associates get promoted leaps and bounds because they were willing to put in the hours. It's not really about impact, it's more about perception, and how many hours you're willing to clock.

No one really even plays the games that work on the games or are even gamers. Designers only look at excel sheets and a person I worked with who ran an important team she barely even knew what the IP was about or games in general.

The work environment is terrible because everyone just puts in hours versus works intelligently. This means working on weekends and a culture that promotes this. This literally means weekends at 1am. You can choose not to do this, but your chances of moving up regardless of your tangible impact will be close to nothing.

They'll tell you things are getting better, but the leads here don't value it. Everyone on the team I worked on that were the leads pretty much worked all the time and super inefficiently. I've never seen so many people do things so inefficiently. Because everything is so inefficient everyone has job security which might be the intent.

I've worked at other companies where three people could run a game. This company has about 30 people run a game because it breaks up all the pieces so everyone gets their tiny slice. They're also majorly possessive about their little piece so it's impossible to garner any more efficiency. Literally if you do something because it's more efficient, but someone else was supposed to do it you'll hear an earful about overstepping your role."
21,MZ,Review so I can use Glassdoor,2020-09-17,3.0,Anonymous Employee,It was a company that paid people money,It was a company that made people work
22,MZ,Dumpsterfire,2020-09-10,1.0,Special Education Teacher,World class team running the kitchen. Breakfast was particularly good.,Leadership with extremely short term thinking.
23,MZ,"Imbalance in benefits, little potential for growth",2020-08-19,2.0,Customer Support Representative,"Well stocked snacks, nice coworkers.","Little room for advancement, management doesn't seem to care about career development or mentorship. Ever-shrinking benefits."
24,MZ,Needs leadership and vision,2020-07-11,1.0,Anonymous Employee,"Perks, pay and people. Good place for a boot camp.","Have a hard time learning from the past. Unorganized, every project had to go through at least one art direction change if not 2 or more. No vision for their games, design is developed alongside production causing massive rework. 

If you have a passion for making fun experiences I would think twice. Whenever the game is designed, how fun is not part of the discussion and the CEO explicitly said not to use that word, rather how fun the game is measured in how much the player spends."
25,MZ,Worst place I've ever worked - Seriously,2020-07-01,1.0,Anonymous Employee,"great cafeteria, solid health insurance, phone stipend, commuter benefits","I think it would be misleading to list many of the ""perks"" as ""pros"" since you'll never get to use them.

Permanent crunch mode. The game teams are disorganized messes and individual contributors make massive, costly mistakes without even a sense of regret (""Ooops, I just blew out a vertical and cost us tens of thousands of dollars with one keystroke.. Better luck next time!"")

There's no established way to get work done. By this I mean no real processes. There are reports and dashboards that people forget exist or don't care about where you find ancient bugs and logs of high impacting user issues.

The only thing you might learn here, if you last long enough, is how to recognize tons of red flags for your next job."
26,MZ,Mixed,2020-05-24,3.0,Senior Site Reliability Engineer,"cool technologies, large team, not too much micromanagement",business is poorly run by upper level management
27,MZ,Terrible place to work,2020-05-23,1.0,Engineer,"Good salaries, all round good people.","Clueless managers, upper management never cared about employees"
28,MZ,Good temporary experience but bad for your career,2020-05-19,2.0,Software Engineer,"Best food ever - seriously
Good campus - new buildings and plenty of space / parking
Great perks - phone/gym/laundry/personal grooming bills covered, yearly reimbursement towards new phone","Lack of direction - company copies gameplay ideas from other games (Crystalborne) / adds on their outdated ""pay to win"" and ""throw tons of content at them"" formula for new games. No original content. Games perform poorly.

Poor management - senior management used to regularly have 1-1 with everyone to collect feedback about managers. They stopped doing that and put incompetent managers into positions of power.

Lack of processes (quality control, automated tests, etc) - 2-3 live incidents EVERY DAY."
29,MZ,Unfortunate,2020-05-16,1.0,Product Manager,"Good people, Good pay, Good meals",Every thing else can go
30,MZ,"Excellent benefit, expect hard work",2020-04-24,3.0,Software Engineer,"Excellent medical/dental/perks benefit, unlimited three meals + fruit + snacks",On call happens frequently to resolve real time issues
31,MZ,Great culture.   Everyone is focused on shared success.,2020-03-27,5.0,Anonymous Employee,"People are not siloed which provides a lot of growth opportunities.  Very collaborative, supportive culture.",Fast paced.  Most people work 10-7.
32,MZ,"There's opportunity to grow, with a price",2020-03-13,2.0,Anonymous Employee,"- 3 times meals a day Monday to Friday
- The company covered health insurace cost, phone bill, laundry, dog walker, car wash
- In house gym facility
- EV charging (not free)
- Free annual Caltrain pass","Cons:
- Time off needs CEO approval that may take weeks
- Approved time off doesn't guarantee that it's approved -- yes, upper management can still cancel your time off anytime
- Mandatory video call when employee join an online meeting not from the office
- No work from home policy
- Work on weekends (not every weekends, but it happens a lot) on site"
33,MZ,Mechanical Design Engineer.CAD Design Enginerr,2020-03-06,5.0,Mechanical Engineer,good work and learn in the company,Notting to issue in this comapny
34,MZ,"Intense and Rewarding, but Needs More Checks and Balances",2020-01-23,4.0,Anonymous Employee,"Amazing, hardworking people on every level. Benefits that can't be beat. Great food. Comfortable environment. Good support. HR is quick to respond to issues. Loyalty is valued among lower level leadership and rewards are piled on you for good performance. Workflows are clearly documented and undaunting to step into.","Anyone who IS terrible (like some people I was forced to work with and under) had no checks for their behavior. It's almost like MZ just didn't plan to hire bad people, so there are no plans in place to address them unless they actually break a harassment policy. I was outright bullied by my team and my manager's advice was to QUIT and accept that I was replaceable, even though I was a dedicated and passionate employee who had been receiving constant praise for my contributions up til that point. And there was no one above my manager to bring an issue to without immediately branding myself as a weak link or tattletale."
35,MZ,Cool company to work for with talented nice people and challenging exciting work.,2020-01-19,5.0,,"Very Generous benefit plans, talented people who believe in the mission and vision of the company.  Unique culture, not the norm in a good way.  Amazing perks!",The quick decision making by leadership can be intense and not for everyone.  The company moves very fast.
36,MZ,You really need to know what you're getting into,2020-01-03,3.0,Senior Software Engineer,"Very competitive salary for engineers in games, similar to standard non-games tech companies in the area. Free meals and snacks on site with good selections. Competitive bonuses every year for some so far, and good perks for phone purchase, gameplay, and some life expenses. No-limit time off policy with manager approval and mostly flexible with working from home if needed.","Time off, even if approved, can be cancelled and forced into reapproval if the company is crunching for something, even unrelated teams, and a lot of pressure is sometimes applied to not take time off. ""Core hours from 10am - 7pm"" which means everyone stays later than they should. Not a lot of emphasis on fixing things that are breaking, just pushing out new things so there are constantly live issues causing some people to drop all their work with deadlines to handle what's breaking. Generally seems like there isn't a good sense of how to get out of bad months/quarters/years except to work the same people harder, which then leads to more mistakes."
37,MZ,Facility Technician.. Challenging learn something new every day,2019-11-12,5.0,Facilities Technician,"Life work balance , good management","Zero cons , can’t complain"
38,MZ,May the Moogle Be With You... Always.,2019-11-07,4.0,Senior Software Engineer,"MZ faces the same challenge that every single game company faces... how to stay relevant.

The games business has historically been the most forward-looking, risk-taking tech industry. And perhaps for that reason and many more, the most beloved. Every innovation hits games first. Every engineer wants to make a hit game.

Games make us go wow! They blow our minds. They connect us to our instincts to learn, compete, make friends, get lucky, and win. They are dazzling and baffling. Coin-Op. Console. PC. Web. Social. Mobile. And Beyond. MMO. Card. Shooter. Puzzle.

While the games business is vast, carving out a niche isn't easy. And carving out a niche while paying for Palo Alto real-estate is the most epic mongo baller of all wins. Video games were born in the Silicon Valley and Machine Zone is right in the middle of it. The buildings are brand new, clean, and beautiful on the former Facebook campus now in reconstruction.

Early into the mobile games market, MZ owned top slots on the AppStores for months coasting on innovative SuperBowl advertising and then diversifying into Ad Tech, AI, Crypto, Real-Time... God Stuff. But the universe ebbs and flows. Where are we on the tech adoption curve... who knows? One thing remains true... customers expect a lot as they economize their entertainment dollars.

So MZ has managed to win over a very loyal group of paying players. Every technology and community changes.  Will people still program on PCs one day? Who knows. Will people still play the MZ games we operate today ten years from now? Who knows. Will we all upload? Man. Big questions.

What's real is that MZ has been contracting over the last year and a half to focus on what it does best... developing and operating games. On the operations side we are embracing lots of new cloud technologies. On the development side, we have in limited release a beautiful new title that shows off our continued ability to innovate on the client, art, game design, and server. We have vast capital, intellectual assets, potential and good people.

Contraction isn't pleasant, but it is often necessary. Some of what you see on Glassdoor is a reflection of that. What are you gonna do? That's life and our individual experiences will very. Ultimately our personal outcomes are a direct result of the individual choices we make in the stream of choices we have available to us. We recently re-branded as MZ... 1. Which i think is cool. As per U2 we are not the same, but we ARE 1.

Culturally, I'd say we are aggressive for the games business. We lean toward core and blue. After all, we made Game of War. Teams naturally internalize their titles to some degree. But games also naturally attract fun-loving creatives. I feel that that is what we are at our core. And we are much more... Final Fantasy and brilliant technologists, artists, and game designers.

To be continually relevant we must continue to make good decisions, place good bets, and make the connection with more loyal paying player fans. All game companies share this mission.

MZ is a big game maker / operator by most standards. This is not just a few folks in a room. So we have teams and subcultures and thus your experience may vary. 

If you are into the games business and looking forward to a long-term career in it and you live in Silicon Valley or catch the Cal Train to California or carpool down 280 or live in Supertino from the SJC to the DMZ, I really think you should take a look at MZ. Perhaps you will be THE one young Jedi. Come say Hi. Take a look.","Lots of change and people re-identifying with a new mission and vision that is more focused than the broad vision of ""become a tech giant""."
39,MZ,It was a good ride,2019-10-20,3.0,Senior Manager,The company rewards great contributions with great pay,"Previous CEO failed
We're not factory workers"
40,MZ,Very Competitive Team,2019-10-10,5.0,LiveOp Manager,"This is a job that can help you grow your hard skills. This is my first month, and I feel like learning a lot of stuffs. I mean hard skills like SQL, python, which really help you increase your value in the market. If you are young and passionate about game industry, this is the right place for you. I would love more people join LiveOp team. This is best team for you to grow in MZ. Plus you have awesome teammates and super nice boss :)",You have to get used to game industry culture.
41,MZ,Positive creative atmosphere,2019-10-03,4.0,3D Artist,"The art team is full of talent but more importantly teamwork, even across multiple projects.  Art directors I've worked with have a lot of experience in the games medium here, and are able to set clear goals, they aren't ""idea guys"" with vague requests.  

Additionally for LGBTQ+ and allies, the environment here is very friendly.  Im a trans woman, and I never am misgendered by coworkers.  Additionally, even with racy characters in some games, the art team is very sensitive to treating their female coworkers well and not devolving into a ""boys club"".  Teams here also have very wide ethnic and national diversity, definite plus.

If you are a foodie, the food here is very very very fancy, but if you like more regular stuff like me, there are those options too.","I wish there were more women in the art department, but the company does too and definitely wants to recruit more.

Also...the commute in and out of Palo Alto can be absolutely brutal."
42,MZ,Horrible company to work with,2019-08-30,1.0,Marketing Analyst,Cannot think of any pros!,"Toxic culture, intensive politics, chaos management, sinking business, high attrition rate, the list goes on and on.

The company is also obsessed about hours everyone works instead of the results.
They enforce weird 10-7 working hours which is believed to be a way to drive away candidates with families.

If you have a family, especially if you have kids. NEVER EVER, NOT EVER, CONSIDER MZ!!!
If you don't have a family, also NEVER EVER, NOT EVER, CONSIDER MZ!!! Everyone around me are interviewing and leaving."
43,MZ,"Well funded, hard working, future hazy",2019-07-31,3.0,Engineering Manager,"Machine Zone has taken fantastic care of me financially, offering excellent opportunities for advancement, rewarding hard work and proposals.  It's enabled experimenting with management techniques.
It's well funded for future ventures and the board works to create a healthier road for the future.  The CEO visibly works to make sure that rewards for company success can be shared well with staff.
It's got 3 meals a day by a reasonable cafeteria crew that take good care of the group.  It takes care of a lot of out of pocket costs for benefits.","We don't know what builds success, but have succeeded a lot, leading to very painful patterns (Projects without staff or roadmap or pitch).  Decisions on major company timelines can shift quickly and multiple times a year.  Building a 6 or 12 month plan is an exercise in futility for the most part.

A lot of teams are understaffed from a constant drive toward shared service models.  Promotions often lack filling the gap promoted out of, leaving folks responsible for wider and wider spaces.   Accountability is so distributed as to basically have no accountability for almost all of our game products.

We brutalize our customers with buggy and poorly considered content, leaving them with the impression we don't care.  Off hours incidents are multiple times a month.  Some teams crunch excessively."
44,MZ,Never a Dull Moment,2019-07-26,4.0,Engineering Manager,"The single most prominent feature of MZ is that I am never bored. There is way too much to do and probably too little oversight, giving me enormous opportunity to do something new and make an impact. I often do things that are not my job and not part of a plan because they are the right thing to do, and I generally don't get in trouble for it, the times that it's even noticed. On another note, if you want to make games and make rent, come here - the compensation and benefits are great.","It's chaos, more or less. Schedules are aggressive to the point of being delusional and often our optimistic plans degrade into little plan at all. The company is great at operating and marketing and selling games, so once one staggers out the door it's going to do great. I simply recommend taking deep breaths and letting go of a lot of the craziness.

Other cons - I guess the hours can be long. This is a game company, and it doesn't excuse our planning missteps, but other game companies can be quite worse. Also, MZ seems to be quite wary of hiring junior talent, and I think would be well served to start doing so and giving leads and managers time and support to mentor those junior contributors."
45,MZ,Meh,2019-07-03,3.0,Game Designer,Abudndance of Food & Beverages,Not the greatest management and organization
46,MZ,Hard work pays off....#triumphtogether,2019-07-03,4.0,Anonymous Employee,"The impact you have, every person in the building is critical! CEO is really making changes that are up leveling us like never before and being more open and transparent, the pay, bonuses and equity...and working with REALLY smart and passionate people! The culture has definitely made a shift, and while we all still work extremely hard, it feels more flexible. There are growth and development opportunities for me and my team, and I learn something new everyday.  The #triumphtogether mantra is bringing the one MZ feeling back!","It is challenging to have core hours that are so late, but nice to come in later. I wish we had a little more flexibility there. The Game Production teams are working extremely hard, which means a lot of hours for them at month end. What makes MZ successful is the blood sweat and tears put in by everyone. That also means some teams have a window of critical crunch time, and we need to find creative ways to support them."
47,MZ,Cool Place to Work,2019-07-03,4.0,Concept Artist,"Location, Benefits, Perks, Food and Parties. Generally a pretty chill place to work. Even though it was not my choice to leave, I will always have a positive outlook for MZ for giving me an opportunity and helping me grow as an artist.",Housing/ apartments close by are pretty expensive ( Bay Area ) plus cost of living is high. But manageable with income earned.
48,MZ,Terrible work environment.,2019-06-11,1.0,Recruiting,Food. You get a LOT of food.,Constant churn  and revolving door
