,company,headline,date,overall_rating,author_position,pros,cons
176,MZ,Some matter of facts from small data analytics,2017-03-16,1.0,Software Engineer,"free food is the best one
and that's it","Out of the reviews here, Some matter of facts from small data analytics:

- Most reviews are on the 2 extremes: either 1-star or 5-star.

- Usually there's a series of 5-star reviews after a couple of 1-star reviews. 

- Those 1-star reviews have much higher number of ""Helpful"" votes than those 5-star reviews. Most 1-star reviews have around 30 votes while most 5-star reviews have nearly 0, for apparent reasons.

- Keywords in 5-stars: hyper-growth mode, best company ever to work for, smart people

- Keywords in 1-stars: bad management, firing, no work-life balance, no ethics, too much politics,

I'd say my opinion aligns with most, if not all, of the 1-star reviews."
177,MZ,The only thing you can trust in an offer is the base salary,2017-03-14,1.0,Senior Software Engineer,"base salary can sometimes match those from bigger companies, and indeed you can get the paychecks every half a month, but that's all.","Literally, the only thing you can trust in an offer, from any recruiters at this company, is the base salary. I hate to say that, some (or even most) recruiters are bluffing too much, sometimes UN-ethically.

They say that, the target bonus is 15% ~ 30% every year, but the fact is that, even for top performers (promoted), few could get even 20%, and on average, it is lower than 10%.

They say that, the current equity value is X per share, but it is at least 5 times cheaper on the secondary market.

They say that, the company is valued at very high and they're going IPO soon, but even the C-level already hinted publicly that's not the plan.

They say that, the company is at hyper-growth mode, but you can see politics everywhere.

They say that, the company culture is very laid back, but you can find all kinds of rules such as mandatory office time from 10 to 7."
178,MZ,Dynamic Place to Work,2017-03-12,5.0,Anonymous Employee,"This is the next megacompany that no on knows about. MZ's pace is swift and expectations are high, but the rewards seem to match the expectations and the technology is incredible. I have found the people to be great, there is an endless amount of food and drinks and management is sharing more and more about what is ahead. Culture and values are being reinforced which is also helpful. New campus on the way which should be a welcome upgrade to the physical working environment. Opportunities to step up for those who want it and show they can handle it.","The millennial whining is ridiculous.  If you see a negative review, you can almost bet it was written by someone who wants to sit and collect a paycheck or would rather be at pottery class.  This is a place for hard working achievers, which is fine with me.  The only con is if and when the whiners are allowed to stick around. Parking situation is not ideal, but shuttles are much better now."
179,MZ,A few bad ones ruin it for everyone else,2017-03-10,3.0,Anonymous Employee,"This would otherwise be a great company if t weren't for a select few of ineffective, and flat out rude, elitist employees. They're cutting down your branding efforts.","Stay away from marketing, recruiting, and HR. Too many horror stories from friends. Marketing is grueling. Recruiting directors except for one here always leave a bad taste every time I have to interact with them. The good recruiters end up leaving. The bad ones I have to deal with for interviews. The engineering teams are great though. Never a problem."
180,MZ,They will say anything to get engineers,2017-03-09,1.0,Anonymous Employee,"Free food and snacks. The food is actually pretty good.
They are raking in the cash","No career growth or mobility
Many sub-par engineers
Horribly disorganized codebase
The worst is that they will promise you anything to join if you are an engineer then fail to deliver on any promises
The compensation is also significantly less than other large companies in the area."
181,MZ,"Work Hard, Play Hard",2017-03-08,5.0,Anonymous Employee,"Free food, massages, 3 meals a day, lots of care to make employees feel valued, incredible parties and company-hosted events, hard work is rewarded, coworkers are some of the most brilliant and dedicated in the industry, flexible hours (really depending on your job / team / manager - this definitely doesn't apply company-wide), basically unlimited overtime if you're driven to go above and beyond","Little work-life balance (if you care a lot about that - personally, it doesn't bug me), the food is not awesome quality so after a while you'll end up eating after / before work or just grabbing snacks instead of getting whatever is served, demands are INTENSE and not rising to meet the demands will get you let go pretty quickly and without much warning. Basically, if you want to stay at MZ, you have to be the best you can be and stay on top."
182,MZ,"Best company I've ever worked for! 
Would be perfect if it weren't for some bad apples.",2017-03-03,5.0,Associate 3D Artist Generalist,"Great people, you're fed breakfast/lunch/dinner every day.  Overtime always available.  CEO is the best.  Summer parties are amazing.",Leads and Directors have little talent and/or experience.  Politics plague good people from not being taken seriously.
183,MZ,A company that is not very ethical,2017-03-03,1.0,Software Engineer,"free food
activities from time to time
unlimited vacation","This is a company without any ethics or principles:

Part of the job of the HR and/or recruiters is to write ""good"" reviews on glassdoor
They fire people for no reason
Recruiters are exaggerating the value of the stock options, and possibly the annual bonus to lure you in"
184,MZ,Great People Across The Company,2017-02-28,5.0,,"I wouldn't be where I am today if it weren't for the work I was doing, and the people I got to know at MZ. What I learned here in a year's time was more valuable than the 3+ years I spent at another company.

I'll keep it simple. You work hard here. They compensate you well. They take care of you with meals all day and employee perks here are better than any company I've ever worked for.

I knew people who left because they wanted more money to do less work. If this sounds like you, then please leave this good company alone.

I'll never forget the people here. The co-founders are such humble and hardworking people. Yes, there can be improvement with areas such as leadership, but that's an issue everywhere and if you've never been in leadership, you won't see how much they take care of so that you can do your job effectively. I'm so grateful for this place and many of the folks here have become close friends. It makes a world of difference to work with people who genuinely care about what they do. I only left to explore some of my other goals in life, but I'll always miss the people here.","Hard work, weeds out those who can't keep up. There are people here who aren't smart or hardworking, but that exists everywhere. You can make a decision based on interviewing with the team and seeing if they're a good fit for you."
185,MZ,Very High attrition rate,2017-02-25,1.0,Senior Product Manager,"Free food
Unlimited vacation
Very talkative recruiters","The average is definitely less than a year. Some examples:
1. The president of one big group left within 6 months after he joined.
2. For a single month (January) alone, for a group of around 30 people, 7 or 8 people left.
3. A director in the same group left within 4 months after he joined.
4. The above are voluntary leave, while the company fires 2 or 3 people on average every single week."
186,MZ,Only listing facts and thoughts,2017-02-23,1.0,,"Free breakfast, lunch, dinner, snacks
Spends a lot of money on holiday parties
Free massages
Very nice, smart people working","Ceo/leadership said in all hands, team meeting,
""If you want work life balance, go work at facebook, google. We do not want you at MZ""
""We are not a work from home company, we want you to be here""
""Family is important, but if you need to leave at 5 to pick up your kids, you would be better off somewhere else""
""We do not care how much effort you put into work, the only thing that matters is the result""
I am not listing any of my thoughts or perception on the company, and just listing some things they said. Those quotes well define the characteristics of the company. Maybe MZ is the right company for you. Not for me."
187,MZ,Great place to work at!,2017-02-23,5.0,Senior Database Administrator,"- Everyday you're challenged to think outside the box to solve problems.
- You're constantly forced to learn and pick up new technologies.
- Ton of food and snacks
- Work with really smart and experienced people. 
- Tech OPS works to create a safe and blame free environment. No finger pointing.",- Pace is very high.  Management do their best to slow down things as much as they can but just like any fast growing company there is a lot of work to be done.
188,MZ,a place to contribute and learn,2017-02-20,5.0,TechOps Engineer,"I enjoy working here. There are a lot of nice, friendly and professional people. I feel like I'm contributing a lot. I'm getting positive and some corrective feedback from my manager which helps me. I have friends among peers and I stay in touch with many ex-employees.

I'm not very experienced in Silicon Valley market and I can't compare with many other companies. From others gassdoor reviews I learned that in other companies you get more money, work less, and be cared for. That is ok.

I like demands and a little of stress of working in MZ. It lets to deliver a lot of value and keeps in shape. I've had a few different managers within short period of time and our team had many different initiatives. It's a challenge to get along with new people often and to learn new things often.

It makes me feel safe about my career, as I know that I can work with anyone and do whatever market demands to be done, and be happy doing that. It's unlike to very slow companies where you stay in the same project and in the same team for years and you don't really know if the market still needs you for real.

Besides contract terms, I get a lot of additional help from the company in form of perks, some legal support, trainings, business trips, bonuses.","Some people a frustrated working here. If you don't like working in a dynamic place and you wouldn't like to improve your flexibility, it may be not the best place to stay."
189,MZ,Amazing,2017-02-18,5.0,Senior Data Center Engineer,One of the best jobs I have ever had.  Have had the pleasure of working with one of the best PM's.  Data Center Manager has a spine and will fight for his team!  Great perks.  When you go hard you get rewarded!,Sometimes you have to realize that not everything is perfect but you will grow your career with this company!
190,MZ,Some teams are really going down,2017-02-09,1.0,Senior Product Manager,"The games are still doing well
Leadership team is very optimistic about the future
Salary is below bar but benefits are good","Some teams are really going down:

People are leaving at a rate much faster than new comers join and half of the team is gone within 1 year.
Chaos and re-orgs are everywhere.
Heavy politics are going on all the time, even within a group of 30 people.
People are fired from time to time to take the responsibility of the management.
Managers do not know what they're doing while products are still in prototype after 1 year.
You can join DP or RTM to experience all the above."
191,MZ,"Not Revolution, Evolution!",2017-02-06,4.0,Anonymous Employee,"- ""Don't dream it, be it!"" culture, with tons of opportunity to make a difference
- The nicest people I've ever worked with, and some of the smartest
- Company is trying to move ahead while fixing its greatest faults
- Company business strategy is sound","Improving employee retention means the company WILL have to eventually bend on its ""core hours: 10am - 7pm"" dictum. People grow up, partner off, have families. Respect them -- make better work-life balance possible -- and they'll stay. Disrespect that and ..."
192,MZ,A very unique company,2017-02-01,1.0,Senior Software Engineer,"but unfortunately not in the good sense
very good review writers writing good reviews with all the empty words;
games are making a lot of money
ok benefits and pay","very unique mandatory working hours of 10AM to 7PM within silicon valley
very unique hire-and-fire recruiting practices
very unique management who claims as a technology company but does not understand technology.
very unique reorg all the time (some team change leadership 4 times within a year - the DP team is one example).
very unique chaos where most people don't know where they're going"
193,MZ,Glad I Joined this Company,2017-01-30,5.0,Anonymous Employee,"Exciting technologies
Visionary CEO with Big Disruptive Ideas, and an Exceptional COO
Authentic, No Non-Sense Values
Great Growth Opportunities and Emerging Businesses
Smart, Hard-Working and High Caliber Colleagues and Talent
Great Time to Be Here as Company Experiences Accelerated Growth
Brand New Facilities Being Built and Ready for Move In by End of Year
All the Free Meals and Snacks You Could Want","Need to implement more scalable systems and methodologies -- no longer a small start-up
Free Meals are Nice, but sometimes Pretty Average"
194,MZ,"Great place to work, communication could be better",2017-01-27,4.0,Anonymous Employee,"I made the decision to come here a little over a year ago, and I have never regretted it. Everything I have been told that the company would do, they have done, albeit sometimes at a bit of a slower rate than originally planned, but everything has been done and has exceeded expectations. The everyday benefits are right on par with all the other major players in the valley, and the company truly takes care of us as employees. I find it very appealing that the company promotes a culture of performance and winning, and that we do win. However, it does take hard work to win, and we do work hard here to achieve that, which I love.","There could be better communication between the C-level, and even HR to the rest of the organization about policies.
There is not a written out growth structure. That needs to be materialized.
Bonus amounts are very wishy-washy, there is no clear rhyme or reason as to what to expect."
195,MZ,A company full of contradictions,2017-01-06,1.0,Product Manager,"Unlimited vacation but managers seldom let you go
Free lunch and dinner but I can cook better than them
There're smart people but leadership doesn't take them seriously
Fancy outside but messy inside","Management always claim they're still a startup, but they like playing politics all the time.
They claim they're a technology company, but few managers really knows the technology.
They use a lot of big data, but they cannot even guarantee data quality.
They say they're a fast-paced company, but many projects are still not working well after 1 year of effort.
Recruiters say the average bonus is N% before you join, but you can never get even N/2 after you join.
They claim they're at the level of google or facebook, but they cannot even match the compensation package."
196,MZ,"If you're looking for fast paced, this is the place.",2017-01-05,5.0,Database Administrator Engineer,"-Lots of cutting edge tech
-Interesting and fulfilling work
-Smart people everywhere
-Ability to learn new
-Compensation packages can be quite good. Though can sometimes be out shined by the big names in the area
-If you like to be challenged, apply here. If you rather work for a company that moves slowly whenever it makes a decision, lets you desk jocky and collect a paycheck without much engagement, don't.","-Long-ish hours, this is a con if you require strong work life balance. Of course more flexible hours would be great. But being in tech, and being on call comes with the territory. 
Techops also is allowing more flexibility now, which is nice. The main issue is the commute for many can add hours to the day. The base days are standard 8 (9 with lunch)
-The ""game"" is not great from a gamer perspective. Though in the end, that's not what is at the core of what we do. Con if you care."
197,MZ,"Good People, Terrible Management",2017-01-04,2.0,Anonymous Employee,"Lots of Perks
Breakfast, Lunch, Dinner","Long Hours and Weekends Occassionally (always crunch time)
Little Autonomy
Too many ""cooks in the kitchen"""
198,MZ,"Not flexible hours, lack of collaboration and very long days",2016-12-22,2.0,Anonymous Employee,"Free meals and equipments to allow me to stay productive. Lots of work to do and new challenges, product needs improvements. Good growth and company is moving quickly.",Not a typical tech company that gives flexible hours. You need to be there 10 to 7 and better not to be late. I feel they are watching our badge data of access to the building and feeling being locked in and clock in. Forget about work from home!  Not encouraged.  Obviously lots of junior managers and need more training.
199,MZ,Software Engineer,2016-12-03,5.0,Software Engineer,Great working environment for engineers; Company is the best in mobile gaming business; A lot of senior engineering that you can learn from; A lot of opportunities for contributing in a big project;,"Work life balance used to be bad, but it's most because at that time, the company is pretty small, and a lot of employees are young, and doesn't have a family yet. It's pretty OK now."
200,MZ,Great place to work at,2016-12-02,5.0,QA Tester,"Plenty of Benefits
Great Training
Great community, everyone is cool with each other
Understanding people
Growing Company","Full time commitment
Learning new names"
201,MZ,Ok to work at,2016-11-27,1.0,,"Good growth of company, amazing perks and benefits and good colleagues to work with. Bright future. Good CEO","Not much 
Not much ..Not much ...Not muchNot much  ...Not much Not much ."
202,MZ,project manager,2016-11-25,3.0,Project Manager,lots of talented people. the perks are outstanding. the company is pre-ipo and all the free snacks and meals make it easy on the wallet,management thrash is constant and seems to be lots of issues with timely decision making. lack of focus on new projects and constant rehash of the same thing makes for a shortsighted approach currently.
203,MZ,Turn back now,2016-11-15,1.0,Anonymous Employee,"Pay, benefits, and perks are great. 3 catered meals a day if you are there over 9 - 10 hours. Lots of excellent snacks and beverages.","There is no respect, collaboration, or trust at MZ among leadership and from leadership to their employees. Some teams experience power struggles and a lot of in-fighting. It's a shame because they do have quite a lot of good, trustworthy people in the ranks. Work-life balance is non-existent. If you can maintain emotional distance from your job and workplace and are a workaholic, then this might be a good place for you."
204,MZ,"Work hard, play hard! I love MZ!",2016-11-12,5.0,Site Reliability Engineer,"You want something that makes you comfortable at work, you'd get it without many questions.
They have this typical startup culture, feel like home.
Talented and helpful people which is pretty rare.
Occasional Parties, free food, beverages, unlimited snacks. 
Work culture is pretty much work hard, play hard.
Feels like the next big thing.
Not afraid to spend the money they make.","Very very fast pace.
Cannot accommodate all kinds of working styles of people.
Bad work life balance, not a problem to me right now."
205,MZ,Great place to work - on its way to be the greatest place to work!,2016-11-11,5.0,Manager,"The company has an incredible current market opportunity, and MZ leadership continues to make giant moves forward. Huge growth, which of course always has some growing pains, allows for great internal opportunities. Beautiful new facility being built, including lots of outside space and onsite gym. Onsite kitchen and micro-kitchens, onsite free massage, great benefits and perks.","This company requires full commitment, which is a preference of mine. While working, I'm fully engaged and expected to know my stuff. Wouldn't have that any other way. Time off is time off though, and as a Manager of people I don't feel I'm on 24/7. I get to enjoy time with my family."
206,MZ,Software Engineer,2016-10-14,4.0,,"Challenging problems to solve, smart people around and good benefits.","long hours, parking issue(temporary), unhealthy food"
207,MZ,SRE: Be afraid. Be very afraid.,2016-10-14,1.0,SRE,"Decent compensation.

The SRE team is (or was?) made up of great people on both the personal and professional levels.","Expect extreme hours during crunch time. But don't worry, it's crunch time just about year round. Not an exaggeration. 

Absolutely everything requires a ticket. Spend 30 minutes researching something? That's a ticket. Add a new monitoring check? That's a ticket. You love working on big projects? Well, you better love tickets. The most a ticket can cover is a day's worth of work, and even that's discouraged. 

If the above sounds like micromanagement, then that's because it is, at least directly according to the individual responsible for rolling out this model of work.

This all ties into a scrum approach. Scrum itself isn't bad (though is definitely an awkward fit at best for such an interrupt driven team), but I will say, after having worked with scrum across multiple companies, that it's an extremely poor implementation of scrum.

If you're excited to do some engineering work to improve the environment and make it more robust, this is not the place for you. The role is SRE in name only. If you don't keep up on the menial work you'll be pulled aside. The menial work is sky high and never ending. It's been acknowledged many times that things will improve Real Soon, and that SRE needs to focus on this menial work for now (as it has for the entire existence of the SRE team at MZ). However, come review time, you'll be dinged pretty hard for not doing the high level work too. What high level work? Weren't we just told we had to focus on the menial NOC work? This is called a double bind.

There is also an extremely pervasive culture of fear. Turnover is rampant, much of it voluntary, much of it not. People are called out all the time for mistakes, or more often ""mistakes"". If upper management hears you did something awful, they'll call you into a special meeting which will be a very unenjoyable experience. You won't get a chance to explain what actually happened. Instead, you'll have left a lasting impression with upper management, which to say at Machine Zone is a big scarlet for incompetence. I've witnessed this happen to multiple people, where management simply made assumptions and did not understand the actual situation, and blamed people for things that were not remotely their fault, or were unavoidable. But a scapegoat was found, that's the important thing!

While the culture of fear at Machine Zone comes from the top, most of the issues with the SRE team at Machine Zone are not so far removed. From the micromanagement to the double binds, these issues are directly SRE related, specifically the middle management. The team has lost 4 senior people this year already, and will be hemorrhaging more."
208,MZ,MZ is awesome!,2016-10-12,5.0,,"Interesting work, great people, room for growth",Don't join if you are lazy
209,MZ,Run.  Don't look back.  Keep on running.,2016-10-05,1.0,SRE,"MZ has great people on most of the non-management levels (Art, Animation, SRE, DevOps, etc).  Free food (breakfast, lunch, and dinner are served in house), snacks are constantly being filled.","Once you get past interacting with individual contributors, and start interacting with management, MZ starts to fall to tatters.  The SRE team is one of the most intense positions in the company, and has an alarming turnover rate.

As an SRE you will be instructed that regardless of the game's stability and availability being your priority, and that you are ensuring the game is up and stable, your top priority is to create as many tickets in jira as you possibly can, and close them.  That is how the company will attempt to measure your 'commitment' to the company.  Read an email and have to think about it?  Create a ticket.  Gathering information on one of the dozens of infrastructure pieces and projects?  Create another ticket.  Testing some changes?  Create a ticket.  *Every* *single* *action* ***requires*** *a* *ticket*.

At MZ,  SRE is another name for 'NoC'.  You will be required to deal with more monitoring tasks than actual Engineering.  If you hope to make an impact, you will be driven into a corner and told that you are not behaving like a model employee and you need to get in line.  Having an opinion, or forward thinking will get you nowhere here.

Pay is below average for the Bay Area.

Parking, due to the building being under construction, requires that anyone that is not an executive take a shuttle.  Prior to complaints from employees, the lot was not even patrolled regularly."
