,company,headline,date,overall_rating,author_position,pros,cons
0,Nearbuy,KAM@nearbuy,2022-01-27,5.0,Key Account Manager (KAM),"Superb work culture, duly reward performance.",Planning at senior management could have been better.
1,Nearbuy,Astonishing Organization,2022-01-26,5.0,Key Account Manager,"Stunning work culture 
Work life balance",Moderate salary is the only con
2,Nearbuy,Good to learn,2022-01-18,4.0,Senior Software Engineer,Latest technology and goof management,Can't think of any con.
3,Nearbuy,I'm operating computer from at the age 12.,2021-12-26,3.0,Computer Operator,I'm also good in software and hardware.,I will do my work efficiently.
4,Nearbuy,Salary of a SDE at Nearbuy,2021-12-02,4.0,Software Engineer,"Good salary, best environment with good space, Gets to learn Startup culture","Growth is less, No onsite opportunity"
5,Nearbuy,One of the Best work culture,2021-10-29,4.0,Research Analyst,"Supportive Team, Healthy work culture","Some times works become monotonous, which is some where not good ."
6,Nearbuy,Best place to work,2021-10-11,5.0,Business Head,"Freedom to take action
Passionate team members
Empowerment at every level
Transparency",lost focus for some time
7,Nearbuy,Good,2021-09-19,4.0,Associate,Cheerful place to work at,They no longer have their office in Bangalore
8,Nearbuy,great,2021-08-14,5.0,MLO-Senior Loan Services Specialist,great staff enjoy working with them fast response helpful nice supportive,slow responses could be better need improvements more staff and help
9,Nearbuy,Good place to work,2021-08-02,4.0,Marketing Consultant,"Good team, autonomy to make decisions",Can't think of any cons
10,Nearbuy,"Great culture, Great learning",2021-06-18,4.0,Senior Software Development Engineer,"Great environment,Positive vibe , Great people",There is nothing as cons
11,Nearbuy,Good organization to work with,2021-06-08,4.0,Marketing Consultant,"Great culture & values
There is a diversity in office
Team outing 
Team activities",Work hours are not set
12,Nearbuy,Good working culture.,2021-06-02,5.0,Relationship Manager,"Seniors are really helpful. 
No politics.",Less career growth in the company.
13,Nearbuy,Good,2021-06-02,4.0,Data Analyst,Good and nice for work,Not such known to me
14,Nearbuy,Overall good experience,2021-05-24,3.0,Designer,"- Active environment, enery-driven peers, good growth opportunites","Biased management, less transparency in decisions"
15,Nearbuy,I want rejoined,2021-05-22,5.0,Data Collection,This is amazing job and company,Nice job nice place nice people
16,Nearbuy,Great place to work,2021-05-19,4.0,Product Manager,Had a good experience working at nearbuy until the parent organisation decided to merge operations,Don't have many cons to share
17,Nearbuy,Great Place to Work,2021-05-13,5.0,Anonymous Employee,"Great team, great culture, Good learning opportunities",Not many options for Tax benefits
18,Nearbuy,They are nothing of what they claim to be,2021-05-11,1.0,Anonymous Employee,There's no pros for this horrible company,They are real good at being bad
19,Nearbuy,Great place to work,2021-04-28,4.0,Anonymous Employee,Great place to work at. Amazing team members.,I do not have any cons.
20,Nearbuy,Very Nice,2021-04-20,5.0,Anonymous Employee,"Friendly Environment , Good Learning Oppurtunity",None. Did not face anything bad
21,Nearbuy,Great place to work,2021-04-05,5.0,Writer,"Friendly colleagues, great learning environment",Nothing as such that I can think so
22,Nearbuy,Coolest people ever met,2021-04-05,5.0,Key Account Manager,"Learning at every stage, Most friendly colleagues who will spare time from their busiest schedule to help you out, CEO & CTO will go out of their way to make decisions for the well being of the employees",Pros outweigh whatever a little con the company has
23,Nearbuy,Nearbuy.com,2021-03-14,3.0,Key Account Manager,Good working environment for remote resources.,Variable pay is highly contingent
24,Nearbuy,Bad Culture,2021-02-22,5.0,Marketing Associate,"Flexible working hours
Good Environment and Infrastructure","No work-life balance
Bad compensation 
Bad behavior
Too much workload"
25,Nearbuy,Uncertainty,2021-02-17,3.0,Analyst,Easy going culture with nice environment,Not willing to understand new concepts
26,Nearbuy,I would like to work here again.,2021-02-05,5.0,Operations Executive,Working culture is best I have seen ever than any other organisations.,Currently no cons from my side
27,Nearbuy,Great upper management,2021-01-23,4.0,Key Account Manager,"- Chill work culture 
- Great leadership
- Work life balance","- Culture needed improvement
- Lacked diverse crowd
- More activities for employee engagement"
28,Nearbuy,Brilliant place to work,2021-01-05,5.0,Human Resources,"1. Great work culture
2. Will learn a lot.",Nothing that I can think of.
29,Nearbuy,Work is play here...,2020-12-02,5.0,Software Developer,"Work life balance , good environment , supporting peoples etc",Not as such found any cons.
30,Nearbuy,Good,2020-11-26,4.0,Marketing Intern,"Good experience, cordial mentors, certificate provided at the end","not a lot of responsibilities, don't pay much"
31,Nearbuy,Amazing company and culture,2020-11-25,5.0,Key Account Manager,The culture and respect for every employee working is amazing,There are no downsides in this company. Probably the best company to work for
32,Nearbuy,Good company,2020-11-18,4.0,Senior Software Engineer,Great Culture and engineering practices,"there are None, it was great"
33,Nearbuy,Good profile for the company,2020-11-11,5.0,Relationship Manager,Good profile for the company,HR’s are not well informed about everything
34,Nearbuy,Company feedback,2020-10-26,3.0,Key Account Manager,"- Chill work time/environment
- NO stress
- Understanding leadership
- No Politics
- Importance for personal time & work life balance is given
- Opportunity to give feedback is taken positively","- NO scope for growth or innovation
- No company culture 
- Mundane and boring work environment 
-Mundane JD based on department"
35,Nearbuy,Not bad,2020-10-05,4.0,Associate Product Manager,The team was motivated well,Too many layoffs. The org was always struggling
36,Nearbuy,Worked under a great team. Probably one of the best places to work.,2020-10-05,5.0,Portal Operations Analyst,"Supportive and Encouraging Leaders. 
Stress-free environment.",There were no major down sides experienced
37,Nearbuy,Great place to work,2020-10-01,4.0,QA Manager,Its a great place to work,"No cons, its a great place to work"
38,Nearbuy,Excellent Work Culture,2020-09-30,5.0,Anonymous Employee,Nearbuy has one of the best Work Culture,Nothing as such to mention
39,Nearbuy,Nearbuy,2020-09-01,4.0,Software Engineer,Good Work culture and environment,Not I can find any
40,Nearbuy,Not Good to start your career,2020-08-24,2.0,Image Editor,Evening snacks are free but not so good,Inexperienced and not so educated managers
41,Nearbuy,Employee Oriented Company,2020-08-17,5.0,Key Account Manager,They're really employee centric and the management is amazing.,None that I know of yet
42,Nearbuy,Company Culture & Worklife Balance,2020-08-11,3.0,Operations Analyst,Provide good amount of Worklife Balance . Management is Good,Somewhere lack transparency for taking decisions
43,Nearbuy,Great place to work,2020-08-03,5.0,Category Head,"Empowerment and autonomy
You ll get to drive your initiatives end to end",Nothing that is compared to the pros
44,Nearbuy,Great Learning Experience,2020-08-02,5.0,Internship,Great place to work at,"No cons really. Great team, great exposure."
45,Nearbuy,Think twice before accepting the offer,2020-05-15,1.0,Relationship Manager,"Decent office, work culture, mangers","As it is a start-up , u are never sure about ur job security, one day they are doing fine the other day they are laying off people.

Real terrible man management, What is the point of bringing in new people when you r just going to lay them off the very next moment. 

Dont get tempted by perks and salary when the utmost job security is not there."
46,Nearbuy,All Good | Great Place to work,2020-04-20,5.0,Visual Designer,"Proper Process within the teams.
Management Super Awesome & Understanding","Nothing as such, Everything was good in my tenure."
47,Nearbuy,Good,2020-03-22,5.0,Key Account Manager,"Ownership of work
Flexible work timings
Good compensation",Proper employee training needs to be given
48,Nearbuy,My very first internship.,2020-03-15,5.0,Data Collection Executive,The benifits I got from The job was very good,"None at all , its my opinion."
49,Nearbuy,Great Place to work,2020-02-21,4.0,Senior Human Resources Associate,"Great culture, Ownership, Accountability, Opportunity to work with Industry Leaders","Not as of now, should have a silence room"
50,Nearbuy,Gud place to work in nearbuy.com,2019-11-20,4.0,Anonymous Employee,"nice place to work as a fresher, we can learn lot of things from seniors.",nothing as much to tell bad about the company that we worked and got nice oppurtunities
51,Nearbuy,Business Development -,2019-10-30,4.0,Anonymous Employee,"Work Culture Awesome 
Good work life balance
Open door policy",Not much but poor management decisions
52,Nearbuy,Executive OPE Business Operations,2019-10-03,5.0,Business Operations Executive,"Best Work Life Balance
Stress free Environment 
Friendly colleagues 
Best in the class Salary & Benefits","Need to travel in the city when required
No career growth"
53,Nearbuy,Great Work environment,2019-09-30,4.0,Anonymous Employee,"The management is very approachable
Open to ideas
Transparent
Great work life balance
Great values","No job Security
The management has changed a lot of hands over the years"
54,Nearbuy,Nice environment,2019-09-02,3.0,Executive QA,"Nice environment, CEO, board, freebies.","However, certain people at managerial positions are not capable enough to even be allowed at basic level."
55,Nearbuy,Neither the best nor the worst,2019-08-07,2.0,Anonymous Employee,"- Good Work culture 
-  Work-life balance
- A better place for freshers","- Internal politics which you can not understand
- Biasedness"
56,Nearbuy,Senior executive,2019-08-06,5.0,Anonymous Employee,"Good environment, easy process no targets fun at work",Management is not transparent
57,Nearbuy,Good leadership,2019-08-05,4.0,Anonymous Employee,CEO is an inspiration to work with,Middle management is not as energetic as it is meant to be
58,Nearbuy,work is play,2019-07-25,4.0,Anonymous Employee,as one of my first jobs i was super happy at it being in nearbuy mainly because of the work environment,there are alot of up's and down's mainly is the sudden decisions to close down offices
59,Nearbuy,All that glitters is not gold,2019-07-23,1.0,Anonymous Employee,Good place to learn work,Extreme level of unfulfilled promises.
60,Nearbuy,Great Place to Work,2019-07-11,5.0,Graphic Designer,Good Work culture. Work-life balance.,No job security.  Lay-offs.
61,Nearbuy,Be Fire Ready,2019-07-09,2.0,Associate Manager,"Lot to learn if you are in the correct department. Super People friendly.
Culture is good. Everyone is approachable.
If the business is good, it's a hell of a place to be in.","Anyone can get fired anytime, whenever the company runs out of investor's money, the firing starts (which happens on a half yearly basis). Recently fired a lot of employees (PAN India). Feel they are burning money rather than making it."
62,Nearbuy,Account Manager,2019-07-01,4.0,Account Manager,Great place to work & the atmosphere is quite chill.,"No global exposure, so the growth is somewhat limited."
63,Nearbuy,Nearbuy,2019-06-24,4.0,Marketing,Its a great place to learn.,For me it was extensive field work.
64,Nearbuy,Best Place & Worst Place,2019-06-20,2.0,Anonymous Employee,"- Good Culture
- Talented colleagues","- Politics 
- CEO is a social butterfly (borrowing words from an ex-colleague)
- Salary compensation is not up to the standards
- Interns remain intern till fired
- There is no job security 
- Management is fickle minded
- Lack of vision/plan"
65,Nearbuy,Wonderful work culture,2019-06-03,5.0,Business Development Manager,"Flexible, Young, Dynamic, Proactive and care for their Hires",A little disorganized and lack of planning
66,Nearbuy,Unethical way of managing people,2019-05-29,1.0,Senior Manager,"Anyone who doesn't want to work and chill can join this company for short periods.
worst company to work here. Management doesn't have money to run a business and pay salary on time.","If the employee reaches the high salary and eventually the unnecessary expectations arise to poor category heads of SNS. immature category heads who insults all employee more during the notice period times. Any employee working here leaves a company with a bad experience and a bad note. 
Not worth company to work.No respect to anyone in the team who performed well and gave the hard efforts."
67,Nearbuy,Why work there,2019-05-29,4.0,Anonymous Employee,"Great work culture,  superiors are accessible","No job security, Management is hap hazard."
68,Nearbuy,Nearbuy is a Gud company for freshers...,2019-05-28,4.0,Systems Administrator,"Friendly atmosphere.. 
gud management
Gud company timings",Nothin to say about it..  only disadvantage in this company is to work in contract basis for min of 1 and half year
69,Nearbuy,Amazing,2019-05-21,4.0,Anonymous Employee,"Open environment, free to give out opinions and ideas",No cons as of now
70,Nearbuy,Associate content manager,2019-05-15,2.0,Anonymous Employee,"Flexibility, no dress code, close to home","Weak management, lack of trust and confidence in leadership"
71,Nearbuy,"Cool Company, Nice Colleagues",2019-05-15,4.0,Software Engineer,"Work culture
Work Quality
CTO is very cool and nice","Job Security, Be prepared to get fired any time."
72,Nearbuy,Administrative Manager,2019-03-23,5.0,Administrative Manager,"Always Progressive, Very Supportive, Engaging, Every day is a new day,","None, None, None, None, None"
73,Nearbuy,.,2019-03-18,5.0,Anonymous Employee,Great/Best place to work. Everything is so cool here.,Nothing as such. I feel there is no job security as its a start up
74,Nearbuy,Rosy talks from Ankur Warikoo but everything is falling apart,2019-03-15,1.0,Senior Marketing Consultant,Great culture and fun environment,"Ankur Warikoo always works on his personal brand. He sweet talks everyone to a level in which they fall for his tall tales and plans and generally, assume that everything is going on well. One fine day, you receive a mail saying that your contract has been terminated! I was lucky to leave a few months before this happened and I used to feel bad that I left such a great company. But now when I look back, I was glad I made the decision!"
75,Nearbuy,work review,2019-03-14,5.0,Anonymous Employee,very professional company and they know what they are doing,their prices are cheaper than their rivals and they should be more profitable
76,Nearbuy,Assistant Operations Manager,2019-03-08,5.0,Assistant Manager,"There are so many, starting from the colleagues around to the culture, and everything.",There is none _ everything is too good to be true
77,Nearbuy,great,2019-03-04,4.0,Anonymous Employee,culture is really very good,no stickiness in projects leads to lack of focus
78,Nearbuy,Nearbuy- to be or not to be,2019-02-23,3.0,Digital Marketing Consultant,"GREAT environment, people, Infrastructure, location","No Job security, Appraisal takes time, very few growth options"
79,Nearbuy,Quality,2019-02-23,3.0,Quality Analyst,"Growth,  team work,  exposure ,learning and rewards","Politics, favouritism, a few irresponsible managers who spoiler the reputation t"
80,Nearbuy,Test Consultant,2019-02-21,4.0,Anonymous Employee,"Good Environment for Work , Need technologies and challenges to work on.",Stability is not up to mark
81,Nearbuy,analyst,2019-02-17,4.0,Analyst,Great place to learn Excellent CXO's,"Translation of vision and thought process Top down is limited. 

Figuring out way to grow further. But Since PayTm is Backing them they have little to worry in short term but a lot in long term( for Employees )"
82,Nearbuy,Great Place to work,2019-02-12,4.0,Anonymous Employee,"CEO, The Ankur Warikoo is most intellectual person i have seen. Good culture to work, easy accessible to management","Lots of work, Layoffs , Target"
83,Nearbuy,Unsatisfactory,2019-02-10,1.0,Anonymous Employee,"Good culture
Some semblance of work-life balance","No growth
Politics
No long term vision that benefits employees in any way"
84,Nearbuy,Quality Analyst,2019-02-04,5.0,,"Work Culture, learning, interactions, oppurtunities, management","Hustle porn, Not that much transparent"
85,Nearbuy,Work is Play at nearbuy!!!,2018-12-27,5.0,Anonymous Employee,"Awesome culture
Excellent Management
Fun Activities
Work-life balance",Quite dynamic since its a startup - it isn't a con btw
86,Nearbuy,Culture,2018-12-25,5.0,Anonymous Employee,"Very open culture, the upper management including the co founders are very approachable",nothing solid comes to mind
87,Nearbuy,Great product company to work with,2018-12-23,5.0,Software Development Engineer,"Great work culture & environment and wonderful work-life balance
Great tech stacks to work in and great learning opportunities
Any suggestions and ideas that can grow the company are valued
Employees' opinions regarding 'anything' are invited and well-respected
Great management team and Managers, HRs & CXOs listen to you
No micromanagement and switching among the teams is pretty easy
Lots of perks like free beers every Friday, office parties every month, discounted office meals, etc.",No cons as such when it comes to working in the engineering team at nearbuy. Not sure about the other teams.
88,Nearbuy,Management,2018-10-28,5.0,Anonymous Employee,"Easy accessible,  Passionate and Goal Driven Management, Good work atmosphere, work culture, Very friendly and helpful.",Keep improving. You are the Best.
89,Nearbuy,Excellent Company to start the career,2018-10-03,5.0,BDM,"1. CEO The Ankur Warikoo is the best person, One can learn so many things from him.
2. The current growth is awesome.
3. Nearbuy Culture is awesome, especially respect one, which keeps all attached with Nearbuy.
4. Great friensly atmosphere
5. Loved to receive the mails directly from CEO every week","Lots of work, although we loved to take the responsibilities but its huge."
90,Nearbuy,Smooth as butter,2018-09-20,5.0,Anonymous Employee,"The culture that runs in the company is seen the employees. All the interviewers made me feel very comfortable and that’s exactly what I was looking for, comfort level.",Sorry got nothing for now.
91,Nearbuy,Very Good Work Culture,2018-09-05,4.0,Associate Product Manager,Good management and  great opportunities,Management works on old school thought process
92,Nearbuy,Great place to work at,2018-09-03,5.0,Anonymous Employee,"culture, timings, salary, managers, management","recognition, appraisal, layoffs, targets, food"
93,Nearbuy,BEST PLACE TO WORK,2018-08-28,4.0,Visual Designer,"Here, I understand the real meaning of ‘To Enjoy your Work’. 

Management perceive their employees very comfortable & colleagues are very supportive and friendly in nature. 

You never feel weary even after long travel of Delhi Metro as office environment is so cool …. Here, work is equal to ""MASTI"" …Best place to Work. … and yes, here you will enjoy variety of foods and free evening snacks…I just love this workplace and work process. Thanks Nearbuy Team!",I think it will get more awesome if  there is some play Area also.
94,Nearbuy,perfect place to work,2018-08-23,4.0,BDM,perfect place to work & enjoy the life,"np,  further to growth there will be a saturation in growth"
95,Nearbuy,No Work life balance. Flattery will lead you to success,2018-07-29,1.0,Anonymous Employee,Good environment. Cool CEO. great premise.,No faith on peers and on their work. People swank here a lot rather on work. No hierarchy. Based on your sweet connection with your boss you would grow.............flatter your boss and you rock..
96,Nearbuy,Work Is Play @ nearbuy!,2018-07-24,5.0,Business Manager,"We are a happy bunch of people , working as a supremely close knit unit where you want to go to work , every day that you wake up.","We are still fighting it out to make a space and position ourself. Not a Con , but a fact that we are changing , and trying to do so at a fast pace."
97,Nearbuy,Business Development,2018-07-18,5.0,Anonymous Employee,"The HR time is prompt, understanding and knowledgeable.",No cons in the system as such
98,Nearbuy,Intern's review,2018-07-17,4.0,,Working here is fun and activities are amazing.,Not any that i can recall of
99,Nearbuy,Good place to work,2018-07-01,3.0,SDE-1,"- Growing super fast
- Great independence to work
- Good culture",- Engineering managers are not well equipped with managerial skills
100,Nearbuy,Review,2018-06-29,5.0,Internship,"Free food
People are helpful",No such cons as I found it to be fun
101,Nearbuy,A really good place to learn and grow,2018-06-20,5.0,Software Developer,"Awesome work environment.
Flexible timings.
Really awesome people.
Lots of opportunities to learn.",Can't think of any .
102,Nearbuy,Atleast better than the others in the field of marketing,2018-06-19,4.0,Marketing,"No work pressure.
Targets are manageable.
Good guidance  from the manager (depends on your office)
incentives are appreciative.","A heavy procedure to be followed other than marketing.
Travelling allowance includes in the salary."
103,Nearbuy,Awesome place to work with,2018-06-19,5.0,Assistant Manager,"Good working environment. Flexible work culture, dynamic business environment, New age initiatives",Hectic at times because of the traffic around (the office is located in a high traffic area) but manageable
104,Nearbuy,marketing consultant,2018-06-18,4.0,Anonymous Employee,"work life balance
exposure, greater responsibilities
friendly upbeat environment
result driven
everyone is approachable, will guide you through everything you need
managers will discuss many opportunities from time to time
regular one on ones with manager","sceptical about growth/company future
office space"
105,Nearbuy,Work at nearbuy.com,2018-06-18,4.0,Operations,"The best reason to work in this company is the comfort zone, I enjoy coming to work every day.",I don't see any downsides now.
106,Nearbuy,Awesome Place To Work & Grow,2018-06-18,5.0,Associate Business Head,Every employee in the company is so dedicated towards his/her work that it motivates me to perform better than others. The Culture of Nearbuy is so amazing.,Can't think of any as such
107,Nearbuy,Quality over Quantity,2018-06-18,4.0,Operations,"1. Employee Friendly
2. Everyone in the organization is given respect.",We concentrate more on quantity than quality.
108,Nearbuy,Software Engineer,2018-06-18,4.0,Software Development Engineer,Work ethics and good environment,No specific cons as such
109,Nearbuy,Work is Play @ nearbuy :),2018-06-18,4.0,Senior Product Manager,"+ Amazing people to work with. If you want to be challenged, this is the place.
+ Great freedom and hence great responsibility (spiderman would be proud)
+ I personally feel the type of product management followed here is pretty close to how it should. Very structured & logical, multiple milestones & checkpoints, with focus on quickly reacting to outcomes, not output.
+ No hierarchical red tape","- Due to reacting quickly to stimuli, business priorities sometimes change faster than what I would be comfortable with"
110,Nearbuy,Review for nearbuy.com,2018-06-18,5.0,Head,"1. Transparency of Goal Setting and access to the leadership 
2. High Degree of Ownership",1. Work-Life Balance at times goes for a toss
111,Nearbuy,Interview process,2018-06-03,5.0,Key Account Manager,"Amazing atmosphere, fantastic people and positive",No cons as such
112,Nearbuy,Altoghter good experience.,2018-06-02,4.0,Anonymous Employee,Work Culture is remarkable and good coordination in between the teams.,Work pressure during monthly closing.
113,Nearbuy,Senior marketing consultant,2018-05-14,5.0,,"Work ethics , culture , salaries , incentives","TEam leads , higher management, office space"
114,Nearbuy,True to learning,2018-05-10,4.0,Anonymous Employee,Nearbuy is one of the few companies which has still retained its start up culture even after all these years. It gives ample space to learn and grow within the system,"The growth trajectory of the company has not been constant, which sometimes stalls individual aspirations"
115,Nearbuy,"Inspiring company to work - they'll make you feel happier, dynamic & spoil you with all good things.",2018-05-10,4.0,Engineering,"1. Makes you be Open & Bold, Focus on Impact.
2. Flexible timings.
3. Good hikes(whenever possible).
4. One can reflect company values in his/her personal life too!","1. Sometimes affects work-life balance &  gets hectic.
2. A little bit less in policies and processes."
116,Nearbuy,Excellent Work Environment with Lots of Learning,2018-05-10,5.0,Senior Technical Engineer,"Wonderful work culture 
This is a great place to learn and grow
Great people Everyone here cares about each other
Clearly Defined Structure",There is nothing to mention.
117,Nearbuy,The best Startup to work for,2018-05-10,5.0,Sales Manager,Healthy environment. The product we sell is truly beneficial to our clients. Genuine hard working and supportive peers. Ample scope for growth and incentives .,"None,  The company has sailed through all adversities in the past with diligence and hard work."
118,Nearbuy,Be Your Boss Culture - Flexibility comes with Responsibility,2018-05-10,4.0,Senior Software Test Engineer,"-Free and open work environment without any stupid rules and regulations.
-Cooperative management and HR
- Better growth opportunity",No negative aspect as such of working here
