,company,headline,date,overall_rating,author_position,pros,cons
212,People Group,Good company to work,2017-10-06,4.0,Anonymous Employee,Good company to work with HR & other team are very supportive,Everything is good nothing to say negative
213,People Group,Great place to learn & grow!,2017-09-13,4.0,Director,"1. Open culture, easy access to senior management
2. Young & passionat team, who work very closely 
3. Equal opportunity to grow and share ideas
4. Preference for existing employees to fill senior positions
5. Safe & great place for women",Nothing much except maybe office infrastructure could be better
214,People Group,"Great people,  work and a good environment for women.",2017-09-05,4.0,Associate Director,"1. Great people, good teamwork and good atmosphere.
2. A cohesive work environment.
3. Good direction and overall an understanding management.
4. Focus towards deliverables rather than maintaining task lists which add to the productivity and overall growth for the individual as well as organization.","Nothing much, ive had a good stint.
People Int. is overall a very good place to work  and the mgt makes efforts to ensure every employee is happy, from food to workplace to working culture and understanding of org goals.
They are even making the work place look cool now in synch with the digital age and times with the top mgt involved themselves which is very rarely seen. Ensures a personal touch."
215,People Group,software tester,2017-08-16,4.0,Software Test Analyst,"good place for beginners to learn
good salary
excellent friendly enviroment",no cons as company is really good
216,People Group,Bad culture promoted by management,2017-08-13,1.0,Anonymous Employee,Nothing good about the company except for free breakfast on Monday.,"CEO has his favorite managers.  Managers have there favorite reportees. They never attend office and don't work but are paid in full.

The HR says that this is going on since the time these people joined (3 years) . Everyone in the office is aware of them and employees are angry with the management for promoting this behavior. 

For the little time that these people attend office they are found in the smoking area chatting about there parallel business,  sports activities, interview experiences while away from office.  They gloat about there closeness with the CEO. They have told many people that no one in the company can remove them not even the founder as the CEO needs them. 

They are known to shift the blame of non delivery on their teammates, hence every team member they have ever worked with has been asked to leave the organization. 

All teams are complaining about these people : the work is stuck or delayed."
217,People Group,Good people good managers,2017-08-10,4.0,Anonymous Employee,"1.good company to work
2.cool cafeteria 
3.good manager and stakeholders 
4.best thing is flexible timings and 5 days 
working",As such nothing...good going
218,People Group,Employee experience working @shaadi.com,2017-08-04,1.0,Product Counselor,"Professional environment
Workaholic environment
 friendly  staff","Lot of work pressure
Lot of frustration 
Have to stretch working hours daily
No leaves is  a big issue
Compromise in week off also during month end
Lot of harassment at workplace related to work"
219,People Group,Awesome work place,2017-07-25,5.0,Senior Product Manager,"A great place to work with. Get to learn a lot as we work with smart people. Has good working culture & a lot of positive vibes all around. There is complete independence from top management. They are very supportive & approachable.  Other Pro’s: Nice people; Motivating, Flexible timings, individual ownership",Nothing to talk about in this section. The only con is no good canteen nor proper infrastructure for extracurricular activities. Constant changes in teams leads to chaos sometimes
220,People Group,Not a wow place to work at!,2017-06-11,3.0,,"Good working environment
Good visibility being a small company
Good location of office","Leadership and HR  team not effective
Office politics on a high
Low on hiring with too much pressure on the current employees"
221,People Group,Feedback,2017-05-28,4.0,Anonymous Employee,"People  are good, approachable, friendly, helpful here.",Training should be properly manage / organized.
222,People Group,"""Good Place to Work""",2017-05-24,4.0,Advisor,"* Good working environment
* Friendly people to work with
* Sat/Sun fixed off",*Career Opportunities are limited
223,People Group,Chilled out friendly workplace,2017-05-22,4.0,Manager,"Chilled out, friendly, people are really good and helpful","sometimes too laidback for your own good, management is not transparent"
224,People Group,Manager at People Interactive,2017-05-21,4.0,Product Manager,"Worked at People Interactive Full Time for more than 2 years
-Flexible timings
-Friendly Environment
-Good Learning",-Sometimes it is too chilled and takes a toll on the learning curve
225,People Group,Work environment,2017-05-19,5.0,VIP Consultant,Really very good environment to work. Good facilities for employees,It's all day seating job. Chairs are kind of stiff & hard.
226,People Group,It will change your outlook towards good companies,2017-05-18,5.0,Lead Engineer,"People are crazy about working with MNC considering the perks and benefits they offer but I personally think anyone who has worked with MNC earlier should atleast once work with Shaadi. It will change your definition of good company. Though it's not located in great premises but the culture inside is very encouraging.  You will be challenged to go beyond your potential everyday and that is the biggest learning you will have. Good / bad suggestions are both debated and discussed in detail. They have a tax friendly salary structure, benefits are decent, 5 day working and much more. While some reviews do mention that there was no increment for 1 year, true, but it was for larger good. Better have job for people rather than layoff. And this year it is well compensated atleast for those who deserved. Go for it, if you get a chance.","Not a great office, they have multiple offices in one premises
Balance work amongst people, the ones who are delivering are given more"
227,People Group,Great Culture to work with,2017-05-18,4.0,,"1. Great work culture
2. Chilled environment",Pretty much rigid higher management
228,People Group,Worst company for new employee,2017-05-07,1.0,Senior Software Engineer,Company is good for it's old employee only.,Worst company for new employee. Managers who are working here since long time are so dumb and don't fit in current technology era. And So they have created negative environment for new  employee and forced to leave with in 1-2 year.
229,People Group,Associate Product Manager,2017-04-29,4.0,Anonymous Employee,"Excellent work life balance, good work culture","Compensation benefits, lack of perks,"
230,People Group,Decent company to work with.,2017-04-05,4.0,Anonymous Employee,"Work culture
Shift time flexibility
No dress code
Different training programs by training team 
Great career opportunity (if you are passionate with your work)",No HR meet in regular intervals to address employee's concern.
231,People Group,Awesome Company to work with.,2017-03-31,5.0,Validation,"Awesome workplace Environment .
Flexibility in work timing and most people are cooperative.
One of the best working experience working here.
You have direct access to anyone in the company to approach if required.
2 days weekly off is good for work life balance","Salary is a issue.
Product involve emotions."
232,People Group,Amazing scope to earn if you are great in convincing people,2017-03-29,3.0,Relationship Manager,"good working culture, homely environment, friendly territorial manager",it's hard to convince the clients and sometimes you need to handle agitated clients over phone who hold a misconception about shaadi.com
233,People Group,Nice working Experinence,2017-03-27,4.0,Relationship Manager,"good experience, great atmosphere to work.",Can have better career opportunities
234,People Group,overall good company,2017-03-20,4.0,Senior Product Advisor,"salary on time, can earn good incentive",earlier good incentive schemes but now not so good work pressure in MP zone
235,People Group,Shaadi. com review,2017-03-19,5.0,Relationship Manager,Good work atmosphere!!! Managers are very helpful and cooperative towards new joinees.Achievable targets are set which can be achieved.,the time that i have spent here i havent found any cons.
236,People Group,Working with Shaadi.com is good*  *Conditions Apply,2017-03-15,3.0,Software Engineering Lead,I had the opportunity of reporting to CTO. Open Door policy. Great work life balance.,The work culture here is a little laid back. Doesn't function as a startup anymore I guess. They are very risk averse to try anything on their own.
237,People Group,All,2017-03-11,5.0,,Good company. Good atmosphere and work culture.,No bad thing I found here
238,People Group,Good Company to work with,2017-03-11,4.0,Associate Team Lead,"1. Friendly environment
2. Manager and TL are very helpful
3. Very Less work
4. Play option and flexi work timing",1. Not good exposure to new technology
239,People Group,Good but not good enough,2017-02-17,3.0,Anonymous Employee,"Located in the heart of the city
It is okay to come in late by few minutes","Mass exodus happening
Lack of leadership"
240,People Group,No Work life balance at all,2017-02-17,2.0,Senior Software Engineer,You can ask the money at the time of joining they will provide as much as you can.,NO work life balance and only late staying office is the only thing that matters not the actual work
241,People Group,Good organization to work with,2017-02-14,4.0,Great Oppurtunity to Work With Shaadi.com,Excellent work environment and motivation to the employees.,No flexible shift timings..rest everything is fine..
242,People Group,Its great place to learn and Growth ... !,2017-02-10,4.0,Human Resources,The reasons to work at people Interactive are : Very supportive coworkers and good place to learn lot of things.,No PF benefits for contract role .
243,People Group,"Good Company, not so good managers",2017-02-10,4.0,Product Advisor,We get salary on time and there has been no delay over that. Regular parties gives you the joy of working and we also get free snacks. These things keeps me happy.,"The managers are the biggest problems here. If the company ever reads this review, then do take steps to regulate the managers. They hide many things from the upper management."
244,People Group,Amazing Place to Work-Awesome culture.,2017-02-10,5.0,Senior Human Resources Executive,"Amazing Culture and a great company to work with.

Excellent and very helpful Management .

Excellent company to start a career with.

Amazing experience.",None that I am aware of.
245,People Group,Good company to work with,2017-02-07,4.0,Anonymous Employee,"Good exposure, on time payout, cool employee engagement activities, flexible",dual reporting for a few roles is bad
246,People Group,It was okay.,2017-01-24,3.0,Lead Social and Content,"Good team, timings, canteen, people","Monotonous work culture, not open to ideas"
247,People Group,worst people managers,2017-01-12,1.0,Senior Software Engineer,none in my experience so far,"The middle level managers are impossible to work with. They are liars and only care about shifting the blame on somebody else. Even they made a mistake, they would happily put the blame on a developer. They will lie to your face and only care about pleasing their managers. The senior managers are clueless about what whats happening. They are abusive and lack professionalism. Join if you have no self-respect .

salary : No hike for past two years."
248,People Group,Good place to chill and bad place to learn,2017-01-10,3.0,Trainee Software Engineer,"In my opinion, Good place to chill and minimal work pressure. So good work life balance. Pay is decent.","In my opinion, it's a bad place to work because Most projects are mis managed, the coordination between teams is improving with time though."
249,People Group,Trainee,2017-01-10,3.0,Maharasthra,"Very chilled out environment, minimal work pressure.",Mis-managed. The projects just go on and on without proper management.
250,People Group,Always understand what employees want,2017-01-03,4.0,Sales Trainer,"Everymonth party, salary on time, free snacks, timing are good, all festival se celebrated,",We want bus facility from station to office. Managers are good bt some manager play office politician
251,People Group,Shaadi.com,2017-01-01,5.0,Senior Executive,best place to work with. Shaadi.com has thought me many things and it is one of the best company which things about the employee.,"no cons as such.
Happy that I am a part of shaadi.com"
252,People Group,Great place to work with,2016-12-28,5.0,Anonymous Employee,Amazing and friendly management. If your manager is good then you will really enjoy doing the job,I had to leave as I wanted to marry and wanted 50% hike. So I switched
253,People Group,Sr. Team Leader - HR,2016-12-12,4.0,Anonymous Employee,"The work environment is quite casual and good, flexi timings.","Office location can be moved to better location, more free trainings (Internal / external)"
254,People Group,Empowering the potential in you,2016-12-04,5.0,Anonymous Employee,"Critical decision making is delegated to the appropriate stake holders
Very transparent and flexible environment
Collaborative team members, wonderful set of people to associate yourself with.","I think that the only con of working in people interactive, is the image of the overall online matrimonial space in the mindset of our people."
255,People Group,Senior Team Leader,2016-11-21,5.0,,The work environment is very good.,The office location could be looked upon for a change though the existing is good.
256,People Group,Process & Sales Trainer,2016-09-20,3.0,Process Trainer,"Interactive People, Employee Centric Company, Every quarter RnR Events & parties","Less facilities of admin provided,
No leaves on Festival or Holidays like 26th jan or 15th aug"
257,People Group,Good Company,2016-09-19,4.0,,"Flexi Timings
Good work-life balance
good culture",Technologies used are outdated a bit
258,People Group,Software Engineering Lead,2016-09-08,4.0,,Good work culture. People are willing to collaborate and work towards a common goal.,Company should have more opportunities for the employee on aspects of learning & Development and employee benefits.
259,People Group,Best Company to work,2016-08-19,4.0,Senior Team Lead,"Nice people around you. Always helpful
encouraging to use new technologies
lots of things to learn
good appraisal ..best of your performance 
Nice Hr
Lots of leaves and holidays",No. I have not faced any problems as of now.
260,People Group,good company,2016-08-15,3.0,Anonymous Employee,overall its a good and friendly company. technology head is nice. hr are very cooperative here,appraisal is not good. managers are less supportive.  no technology to learn. same type of work u do
261,People Group,Amazing place to work.,2016-07-30,4.0,Client Service Executive,"Great place to work.
Every one righ from HR to operations to IT were great.","morning Shift timings were painful.
no weekend offs"
262,People Group,Awesome place to work!!,2016-07-21,5.0,Associate Manager,Best company to work with!..Awesome culture.,- Infrastructure is little outdated! but manageable.
263,People Group,"From best, became the worst",2016-07-11,1.0,Anonymous Employee,"I am sure, most of the glossy reviews written so far about this company has been done by the people who work from the HO at Tardeo, Mumbai. They are the fat managers who dictate from that HO and turn a deaf ear to the employees who work at the hubs and centers. 

Two years from now, the company had many pros. Alas, all of that is gone now. Everyone now seems to be running away from the company; what else can the employees do when they are treated on the whims of the managers.","The company keeps shifting the employees from one place to another without any prior notice. This causes commutation problem for the employees. 
No respect for creativity.
Never listens to employees who work at the shop level.
Makes people work like machines.
Trainers need serious training.
What the auditors can't understand, they criticize. 
Some supervisor and managers are full of ego. Even if they are wrong, they will try to prove you wrong. They will even fire you to satisfy their ego.
The management is very impulsive and are never true to their promises."
264,People Group,Nice experience,2016-07-01,4.0,Senior Software Engineer,Excellent work environment and work timing is good and also nice salary. Adding new features to a product makes you understand more about it,"Nobody helps you here, all you have to do something is all by yourself. Get bored due to the same project"
265,People Group,"Amazing Company,Good culture, Great People",2016-06-26,5.0,,Great people and good culture to ensure fun at work and work life balance.,Nothing to say here as it's all good.
266,People Group,good,2016-06-23,1.0,Telesales,that company was goos very good envoirment there.,good company no very much pressur .
267,People Group,"Sr.QA ""Quality Work, Perfect Pay, Good Culture, Best Managers """,2016-06-08,4.0,Senior Quality Engineer,"- Good Work timings
- Managers don't pressure you to work work and work
- Great teams in Dev and Testing to learn new things
- Good appraisals happen every time excluding 2016
- Can interact with all other teams and importantly no Politics here 100%","- Product teams needs to gear up rigorously, stop following BM and Tinder and what so ever
- Team outings should happen at least once in 3 months instead of Boring F3's"
268,People Group,Good place to work,2016-06-06,4.0,Senior IOS Developer Since Sep,Good working environment and management is good,better for experienced people as freshers get more to learn in start ups
269,People Group,Excellent Work environment,2016-05-26,3.0,Team Coach,"Great work culture, yound and dynamic teams
Senior management is open to ideas and supportive
Global approach to work, cross functional teams bonding
Flexibility in terms of work timings, work from home policy","Low Salary, Increment  - there are not many cons of this organization"
270,People Group,Nice company,2016-04-28,5.0,Trainee Software Engineer,"Nice company, good environment, some seniors are good some are okay., parties and all are also good. over all a good company",this time no increment. this time means almost for 1-2 year. manager are saying to support company. but who will supprt us financially manager are getting huge salary. i knw that company situation is not good but even our financial status is not good. if their is no increment then i think their should be no KRA also why we achieve our target without motivation without increment. why will we perfomr
271,People Group,Product Advisor,2016-04-26,5.0,Customer Services Representative,"wonderful company with lots of opportunity . i am working here from past 2 years . employees, management evryone is good, holidays, parties everything is good",sometimes manager do behave rude bt i think thats impt bcoz sometime to maintain boss employee realtionship
272,People Group,An average company,2016-04-20,3.0,Anonymous Employee,"friendly work culture, no dress code, approachable management, tax friendly salary structure","though the senior management is approachable, it is not transparent enough, most of the decision are kept under wraps - even those that should ideally be shared with everyone, managers are not very good, training and development sucks - there are absolutely no inhouse trainings and company doesn't sponsor you for higher education or certifications"
273,People Group,Best Place to Work,2016-04-20,3.0,Product Advisor,"Supportive Seniors and Staff
Good Perks
nice Work Environment",Sometimes It Become Difficult to Manage Both Personal And Professional since working timings and schedule is quite rigid
274,People Group,The Manager will Move to anyprocess even if ur performance is  gd in current process they dont carewithout your approval,2016-04-06,1.0,Product Advisor Renewal,The company has a very good environment to work the staff members are good they are very helpful,They dont care about employee they move you from process according to their need and without your total approval even if you are very good in your current process They sometime create a scenario with employee in such a way that he has no option left other then resign The team leader and manager act as They can do anything without your approval
275,People Group,Great Place to learn,2016-03-27,3.0,Product Advisor HVM,Good place to learn and grow,Nothing much to point out
276,People Group,"Nice People, but incompetent Engineers",2016-03-06,3.0,,"- Nice People
- Nice benefits
- Lots of interesting work to do","- Incompetent Engineers
- People are easily influenced to make a bad decision
- Not very tech oriented"
277,People Group,Awesome to Work with,2016-03-04,5.0,,"best work atmosphere.Its a nice place to work with ..........best managers , team leaders",not come thru any as of now
278,People Group,Nice place to work with,2016-02-19,5.0,Quality Analyst,"Ohhh...its shaadi.com...People who gets placed are the luckiest,
Friday snacks,lots of Holidays,sat-sun off,flexi timings, Seniors are very supportive,
Parties every month..work environment is heaven.","Nothing as such...performing awesum, just treat the existing employees as the part of team, when any new employee comes into picture."
279,People Group,Great Place to work,2016-02-03,4.0,Maharashtra,"Analysis driven, customer focus , women friendly",No down side have learnt a lot
280,People Group,Excellent,2016-01-05,5.0,Relationship Manager,The work environment was excellent. Each n every member is so supportive. Two weekly offs which helps to create a good balance between social and professional life. Seniors are easy to approach and they do lend ears to our problems..I had to leave the job due to health issues or I would have continued for ever n ever... Waiting for opportnity to join again..,Cant think of any...Everything is good
281,People Group,not a good organisation,2015-12-05,1.0,Manager,Nothing as such cause they don't give importance to the talent and worst company,"bureaucratic, does't award hard work, and your smart work doesn't get noticed and worst senior management"
282,People Group,Great environment to work and an amazing place to work.,2015-12-03,5.0,Designation,"Great environment to work and an amazing place to work.
My favorite part about working at Indeed is my co-workers and the management. 
My Bosses & heads are very approachable and easy to talk to!
The challenges are daily and varied and leave me satisfied. 
I have grown a lot working here and see a lot of potential for more in the future.",Right now I didn't find any Cons.
283,People Group,Not Good to work. Lots of politics,2015-11-25,1.0,Anonymous Employee,Get a chance to learn new technology,Uses old technology and no body wants to upgrade. Lost of politics
284,People Group,nice envirnoment,2015-11-18,5.0,Sales Representative,"I recently join people interactive. Nice welcome. Nice hr coordination, I found company decent 1 day all formalities have been done by hr. they never force as to write only positve views. They were open to us that whatever is our experience we only mention that.. ihave completed my 1 month till now everything is   good",not yet everything is fine
285,People Group,Bad yet Learning experience,2015-11-06,3.0,Executive Software Engineer,Awesome product and design team,"unbearable higher tier Tech guys with no current tech knowledge at all.. so eventually u will be managed by guys with zero knowledge of your domain.
Lack of Full Stack guys in Higher Tier!"
286,People Group,Software Engineering Lead,2015-11-02,3.0,Software Engineering Lead,Good package and renowned company for its excellence in matrimonial business.,"Lack of knowledge in management about software development fundamentals. 
No respect for developers from managers management."
287,People Group,Why work at Shaadi.com,2015-09-13,5.0,Brand Manager,Regular interaction with top management and excellent learnings,Too many open opinions for one decision to be taken
288,People Group,Fun working,2015-09-12,4.0,Software Engineer,"Good policies & management , Transparent review process  , every month parties :)",No cons I have come across..!!
289,People Group,Balance of fun and work!,2015-08-25,4.0,Anonymous Employee,"Good growth opportunities. Good exposure and cross trainings. Plenty of fun activities like parties, outings, team lunches, celebrations and rewards recognitions are always an ongoing activity.",Lower payscale compared to the rest of the industry
290,People Group,It is an good circle start my carrier from here,2015-08-20,5.0,Anonymous Employee,It looks an wonderful environment to enjoy friends an we have to know the value of money,I have interest to work in such a company because they have providing a good opportunity to earn our self
291,People Group,A great learning,2015-08-18,3.0,Relationship Advisor,"It was my first job and here i learnt the meaning of job, working, selling, managing time, in all a great combo and a great start up.",I'll not say a behavioural issue from a company side because my seniors and other staff members were always supportive but the environment within the premise was not at all healthy.
292,People Group,"Awesome experience, Everyday is a learning for us",2015-08-11,5.0,Anonymous Employee,"Employee friendly, Growing company, parties , sat sun off","Growing company, Need hardwork and efficient planning."
293,People Group,“Workin environment ”,2015-08-03,5.0,Anonymous Employee,You will learn a lot that will help with the rest of your career,every org has a few cons. None too alarming and deviating to point at.
