,company,headline,date,overall_rating,author_position,pros,cons
294,People Group,“Lot of stuff to learn ”,2015-07-30,5.0,,Great learning opportunity on new technologies. Good pay.,Needs to improve on management a little bit.
295,People Group,“Workin environment,2015-07-27,5.0,,No work Pressure Decent salary Awesome work environment Freedom of work,every org has a few cons. None too alarming and deviating to point at.
296,People Group,“Amazing Work Culture ”,2015-07-26,5.0,Anonymous Employee,"Nice work Culture, Friendly environment, No dress code",Needs to improve on management a little bit.
297,People Group,“Great company to work at ”,2015-07-23,5.0,Senior Software Engineer,Great benefits very competitive good learning curve,None. Great place to work.
298,People Group,“Great Place to learn ”,2015-07-22,5.0,Anonymous Employee,"Open culture, Great Opportunities to learn.",No noticeable cons are present for this awesome company
299,People Group,“Good overall experience ”,2015-07-16,5.0,Anonymous Employee,"good work culture, fast moving company",You have to chase people to know how to do things when you are new. It helps but time is not best utilized in this way.
300,People Group,A great company to work for,2015-07-12,5.0,Anonymous Employee,"Amazing work culture and good learning environment , flexi time, decent working conditions",Salary wil be less compared to others.
301,People Group,“Great place to learn at the start of your career ”,2015-07-08,5.0,Anonymous Employee,"Open culture, Top Management is motivating, flexible time, parties, sat sun off",Distribution of work is not appropriate. other then everything is going great
302,People Group,Fantastic for me,2015-07-01,5.0,Anonymous Employee,"If you see something you want to change or take on, go for it!
VERY flexible work schedule
No dress code",It can be challenging sometimes figuring out where or how to get information needed for a project
303,People Group,Provide change to young talent.,2015-06-25,4.0,Human Resources Consultant,"Great  people to work with.
Give young talent  a chance. 
Love theflexibilty timings of the organisation.
Provide support from the Management.
sincere employees towards work.",Trust factor is lacking .
304,People Group,Happy to be part of this company,2015-06-25,4.0,,"flexibility, healthy atmosphere, cooperative, innovative, creative",yet to figure out cons
305,People Group,I have been working at People Interactive full-time (For 2 year)s),2015-06-25,4.0,Current Employee,"Learning, Innovation, Freedom to work independently ,
Very helpful and learning in terms of work ,","Good and helpful to everyone,"
306,People Group,Great place to find your partner,2015-06-23,5.0,GSM,You will meet good people here,I dont found any cons till now
307,People Group,wish it could be a good experience but not so,2015-06-18,2.0,,As far as good reasons to work with this organization there is no such.,"No co operation from seniors & management people inspite of highlighting the issues. Rather then solving it , wrong people in company are being supported. Seniors are biasi can say. After requesting same thing again n again there is no such solution & i don't know why wrong people are being supported & for what? I am sure nobody will answer this."
308,People Group,Awesome is the word,2015-06-16,4.0,Anonymous Employee,Shaadi is a very employee friendly organisation with awesome work. The senior management is extremely helpful- and when they say they have an open door policy- they truly mean it :) the organisational appetite for growth is immense- which is an amazing trait for an organisation online space,not too many for me to write here!
309,People Group,good company,2015-05-07,5.0,Graphic Designer,Nice work environment.Good work life balance,"lack of communication, maintain a flow for work"
310,People Group,Environment is good but they wont pay on resign,2015-05-04,1.0,Customer Services Representative,"being true to them is you are harming yourself .take the salary then leave ...dont follow the rules they will ask for proofs .they wont pay .
No quality services to customers 
Quantity matters not quality",good culture. timigs .day shift .friendly atmosphere .2 off in the week
311,People Group,Worth it,2015-04-23,5.0,Anonymous Employee,"environment of working is superb, flexible timing, canteen food, parties",seniors should know how to handle the situation
312,People Group,nice to work with this company,2015-04-21,5.0,Graphic Designer,"awesome people specially colleagues , flexible timing, canteen food",In some point of time managers are rude
313,People Group,QA,2015-04-15,1.0,Anonymous Employee,"nothing , dont even think of coming for interview u will be seduced into working here and trap u","Bad and rude  project managers
HR are servant of Project managers only
Long working hours
Even call for work in weekend and  whole night
Pathetic useless management"
314,People Group,Regional Manager West,2015-04-07,5.0,,"Extremely energetic, young and fun company",Perform or Perish is the mantra
315,People Group,Good place to work,2015-04-07,4.0,Senior Executive,"Learning, Innovation, Freedom to work independently , Salary on time","Work Pressure, Lack of clarity"
316,People Group,Decent place to work for in Indian Digital media,2015-03-29,4.0,Assistant Manager Learning and Development,Fast paced and allows creative freedom,"not systematic, chaotic, most times its disaster management"
317,People Group,"Fake promises, and commitment",2015-02-02,2.0,Team Lead Software Engineer,"Flexible timings, salary on time, good start for fresher for at least a year","Fake performance reviews, fake commitment, wrong hiring, lack of communication between hr and tech manager... Arrogant people... Leaving in their own world.  No version control in place... Have to work on windows xp.   Not place for guy who is experienced and love to work in startup environment"
318,People Group,Good To Learn for Software Developers,2015-01-02,3.0,,Many Things to learn about new technologies,Seniors are not helpful and GuuJu domination in company.Also Politics in cmpny.
319,People Group,title,2014-12-14,2.0,SSE,This company is Good for freshers.,"Not well organized, communication gap."
320,People Group,Nice working,2014-09-18,3.0,Senior QA,"Infrastructure, salary in time, helpful seniors.","Bit of Pressure, slogging, career growth,etc"
321,People Group,Good Company,2014-05-20,3.0,Software Engineer,"will get to work on large scale website , coding standard is high and with the help of code review you get to know more . So you start thinking all perspective points. 
Nice Employee Friendly Rules and Regulations . Flexible Timings and Nice HR Management. 
If you do want all this things its a best place to work.","Newer technologies are adopted only when there is bandwidth to explore & implement. 
Seniors like  TL , PL and up level are very arrogant not encourage, not Motivational Kind of people. 
Especially in Technology Team . Don't know about other departments. 
So better don't work here if the people are remain same."
322,People Group,good start for fresher,2013-11-10,4.0,,"will get to work on large scale website , coding standard is high and follow processes","it is software product based company , so most of the websites are all ready developed  , will not get chance to develop from scatch"
323,People Group,good enough....not bad,2013-02-11,4.0,Senior Software Engineer,"every month they organize party,
good environment,",work is limited to your designation
324,People Group,Good Company To Work For............,2013-02-07,4.0,Regional Manager,"Tere are many pros but I would like to mention a few like Brand Value,Culture,Job Satisfaction,Team,Compensations,Systems,",Would Not Like To Specify But They Need to Have Higher Transperency Levels.
325,People Group,Nice company to work,2013-01-28,4.0,Senior Software Developer,"NIce work environment, HIgh traffic website, monthly parties","All the guju people at senior positions, thats not a con though as they are sweet  :D !!"
326,People Group,Good,2012-11-08,4.0,UI Designer,Flexible work timing. Good coordination for wok.,"Nothing as down side, which I can mention."
327,People Group,Sharpen your Skills,2012-10-12,3.0,,"There is a constant push to bring the best out of you
Very dynamic approach towards marketing
Very Stable and growing in leaps and bounces
Focused in learning every curve whether its up or down","Micromanagement
Success should be rewarded
Bias doesn't take an organisation any where"
328,People Group,"Its well developed company, In this process we will get vry gud benefits",2012-08-27,5.0,Relation Advisor,"Good environment, Friendly with all & we have good benefits to work here",I don't find that in this process.......
329,People Group,Good to work. But not too happening,2012-08-10,3.0,User Interface Designer,Great work environment. Flexible timing.,Kinda dull for a dot com. People are friendly but reserved
