,company,headline,date,overall_rating,author_position,pros,cons
116,People Group,MY EXPERIENCE IN SHAADI.COM,2019-08-28,5.0,Senior Product Advisor,Its a wonderful experience..All my senior are very supportive in my place...Also my manager are very helpful.,Overall my experience is good..no changes to need.
117,People Group,Anonymous,2019-08-13,4.0,Anonymous,"- 5 days working
- Good place to work if you are able to manage politics
- Employee engagement activities on regular basis
- Get to work on latest tech stack",- Some managers are particular about everything you do and will interfere if things don't happen there way
118,People Group,A great place to work,2019-08-13,5.0,Senior Executive Quality Assurance,"Good work culture. Good senior management - Lots to learn from, Free breakfast on Monday and evening snacks on Friday.",Have not come across any such thing till date.
119,People Group,People group,2019-08-07,5.0,Sales Consultant,Amazing place to work good enviroment,Nothing bad about the company
120,People Group,Great Company to Work for!,2019-07-21,5.0,Anonymous Employee,"- Opportunity to work in CFTs and shift easily between teams
- Focus on employee's personal growth
- Transparency with the Senior Management and Low Power Distance aids the entire learning process",- Relocation Policy should be reviewed
121,People Group,good atmosphere,2019-07-10,5.0,Team Lead,"High incentive plans,good work environment, Friendly colleagues, supportive management. Can grow in career.",Rotational off and leave issues.
122,People Group,Shaadi.Com is the best in terms of earning incentives,2019-07-04,5.0,Associate Territory Manager,"Timely salary, incentive, growth opportunity for right candidate","Less leaves,and Sunday working also it makes compulsory working on national holidays by making the day pay double which is a hindrance for work life balance"
123,People Group,Sr. product specialist,2019-07-03,5.0,Senior Product Specialist,i groom my self in the organization and earned good incentive ..,i believe there is nothing which i feel
124,People Group,Software Engineer,2019-06-23,3.0,Anonymous Employee,"Career starting is good , good work","No facilities cab, and in some clients company work is not life balance"
125,People Group,Hits the sweet spot for challenging work,2019-06-17,5.0,Chief Technology Officer,"Huge scale, hard problems, great work life balance, amazing colleagues, office facilities too class, household brand",None at the present moment.
126,People Group,Good Company,2019-06-15,4.0,Software Engineer,Work culture is very good and chill. Equal opportunities are given to each individual and scope to present your own research that will benefit the company,Sometimes you get a lot of work and need to do extra time.
127,People Group,Think twice before joining this organization,2019-06-15,2.0,Anonymous Employee,"None,  people/team members are generally nice","Management is confused, they hire people but do not know how to utilize their skills"
128,People Group,Great Place to work,2019-06-03,4.0,Anonymous Employee,"- New Age Approach 
- Great Office Environment
- Great Leadership Team
- Great Employee Engagement Activities","- Owner Driven Approach
- Pushed Deadlines
- Limited Growth Options"
129,People Group,A matured young company,2019-06-03,4.0,Anonymous Employee,"Experienced Colleagues
Great Business Understanding
Good Analytical Decisions
Colorful Environment
Extra Circular Activities","Unrealistic Expectation
Not willing to experiment with new things
Too many meeting"
130,People Group,Best place to work,2019-05-28,5.0,Anonymous Employee,"Flexible work times, balanced professional and personal life culture, higher management easily approachable and open to talk",No cons as such found
131,People Group,i have been working for 2 moth n vip service but prior to this used to work with select shaadi for 2 year,2019-05-28,5.0,Anonymous Employee,its a good company to work with which give lot of experience and grow ourselves physically and mentally and to accept lot of chancel,nothing to share for now
132,People Group,One of the best place for UX Design,2019-05-24,5.0,User Experience Designer,"Career Oriented
Fast Growth 
Casual work environment
Better Opportunity
Flexible Timing 
Quality of peers
HR Policies 
Supportive team","Sometime project planning 

Nothing is too bad. Everything quite perfect"
133,People Group,Senior product specialist,2019-05-20,5.0,Senior Product Specialist,Their is very healthy environments for work as a girl or a very good opportunity to  build our career....,i think company should promote our self employees more then hire someone from out side the companies
134,People Group,I have been working at Shaadi.com full-time (Almost for 2 Years),2019-05-09,3.0,Senior Product Consultant,"Good learning opportunities
work friendly environment.",Need to work upon customer services better.
135,People Group,Employee Friendly organization,2019-05-07,5.0,Have Handled Multiple Role,"Healthy environment, flexible, employee friendly,equal opportunity provider",During month end need to strech
136,People Group,Awesome place to work at,2019-04-29,5.0,Anonymous Employee,"Good environment , colleagues are like family members",cant think of any
137,People Group,Administration 3,2019-04-26,4.0,Administration Manager,"Very free environment, 5 days a week.",Nothing to say. Don't remember any cons.
138,People Group,Awesome place to work,2019-04-17,5.0,Quality Assurance Analyst,"- Experience with the latest technologies
- No dress code
- Cool and enthusiastic co-workers",- Some employees lacking with professional skills
139,People Group,Balanced Working Environment,2019-04-15,4.0,Senior Software Engineer,"Good ambience.
Quick response to any kind of IT and HR queries
Nice approachable work location. Walk-able distance from Mumbai Central station.
Lots of eating options
Cafe with Lunch, Breakfast, Snack
Indoor game like Table Tennis, Board games, Fooseball* etc
Xbox too.
Lots of parties
Approachable management.",Paid Parking. There is no proper parking in company compound you are on your own
140,People Group,Good,2019-04-13,4.0,Center Head,"Good , free to innovatieve","Policy should be clear , personal life have no time"
141,People Group,Good place to work,2019-04-03,4.0,Senior Quality Assurance Engineer,Work culture is good. Got to learn new things. Friendly co-workers.,No cons as such. Happy to be a part of shaadi.com
142,People Group,Good Place to work,2019-04-03,4.0,Quality Assurance Engineer,"Great Environment to work , feasible timing , Friendly co-workers . Got to learn lot new things .",No cons as such till now
143,People Group,Great experience...!!,2019-04-03,4.0,Associate Team Leader,"Good work-life balance
Lot of things to learn
F3 parties every month","9 hrs mandatory
Not much other cons"
144,People Group,Great place to work.,2019-03-27,5.0,Anonymous Employee,"Good work-life balance, Good management.","Cannot find any, all good."
145,People Group,Worst Management and full of Politics,2019-03-15,1.0,Anonymous Employee,"The employees are really good and because of the management and HR (doesn't really exist), employees tend leave.",The management - Top management sucks.
146,People Group,Profile writing (Thane),2019-03-04,4.0,Profile Writer,"Really good opportunity for freshers.
Cooperative HR team
Pay on time",There are no consecutive week-offs.
147,People Group,Associate Territory Manager,2019-03-04,5.0,Associate Territory Manager,"Excellent environment,employee friendly,nice incentive structure",9 hrs should get reduced to 8 or atleast 8.5 hrs
148,People Group,Great Experience,2019-03-04,5.0,Anonymous Employee,"- A lot of things to learn
- Every month parties   
- good colleagues
-great work environment",nothing such
149,People Group,Awesome Work Experience..!,2019-03-04,4.0,IT/IS Systems/Network Administrator,Shaadi.com not only is customer-centric but also knows to take care of its employees. The company helped multiple people to succeed in their career life and giving opportunities to grow.,nothing as such
150,People Group,Good,2019-02-24,4.0,Manager,"For growth , to learn MNC culture","Social life totally go down ,"
151,People Group,Good Organization,2019-02-08,2.0,Senior Sales Executive,Can learn many things and also people get promoted with in company which is appreciated . People working around are more friendly it's almost like family it is .,Managers need to try helping employees and understand there concern . As well leaves are not given properly even if there is some emergency asked to work on weekoff we can't use SL or CL.
152,People Group,Awesome place to work at,2019-02-05,4.0,Anonymous Employee,"Awesome work life experience 
Operations floor is light and friendly",Tech needs to be more active for operational issues
153,People Group,Nice company with bad management,2019-02-05,3.0,Senior Customer Service Representative,"Nice place to work Monday breakfast, Friday snacks, Parties, Clean place Location available.","A lot of work pressure because of less staffing, management making it difficult to earn incentives, managers do not help employees in shifting to different location as they are under staffed.
Breaks are limited if you work in hands of certain managers."
154,People Group,Director,2019-02-04,5.0,Director Market Development,Organisation Culture is good.  Very Process Oriented.,"At Senior Levels like mine a bit more Data Sharing is desirable which will help in better decision making (data on leads by language which can help in hiring), Advertisement schedule, etc."
155,People Group,Great place to work for client servicing,2019-01-30,4.0,VIP Consultant,"Good environment,good office,good people,good canteen..chilled out work Atmosphere and culture..but lot of work pressure..2days off depending on your process..great boss..free breakfast every monday..good infrastructure..owner is very genial too...good seniors,bosses and manager.",No drop facility for women post 9pm.. 2 rotational weekday offs...work pressure is high as u get old...trainer is a very weird personality ...makes you feel a bit demotivated..rest everything is great...but incentives are a bit  tough to earn here...not so easy to earn as they make it sound..but still there are people who do make money  so beware..dont depend on incentives .. rather ask for a decent salary.. understand the system before getting in.
156,People Group,Overall quite satisfied with the company and policies,2019-01-29,4.0,Director,"Give importance to both  Internal and External customer and value their opinion,",Too much experimentation on a set process some time  creates confusion  specially at ground level
157,People Group,Good Company,2019-01-28,5.0,Senior Account Executive,good work and ever ting is good here,ever ting is good here and nothing i want to say
158,People Group,Good environment to work...,2019-01-23,5.0,Product Advisor,Good environment to work. Easily contact with managers. Support from colleagues and managers also. They are very supportive. Stress free environment.,Less holidays. No holidays on National Holidays also. No Salary Increment. Timing issues.
159,People Group,Good Experience,2019-01-22,5.0,Senior Team Lead,Good Work place. Opportunities are giving to grow & groom in professional life.,Sometimes follows too lengthy procedures
160,People Group,Great company to Work,2019-01-19,3.0,Team Coach,Help to learn different dimensions of Customer service experience,Having work in the Online/E commerce matrimony business promptness is extremely important
161,People Group,Good Company,2019-01-09,4.0,Anonymous Employee,Good Learning Experience. Flexible Office timings. Enjoying office events.,nothing
162,People Group,Nice company,2019-01-09,5.0,Anonymous Employee,"opportunities to grow and learn
Work Life balance is good.
employee friendly company",as if now nothing
163,People Group,Fun place to work,2019-01-07,4.0,Senior Team Lead,People Group is a fantastic organization to work for! Colleagues quickly become family and the culture makes you feel right at home! The work/life balance standard they have created is hard to find or even know of these days.,Management should get involved at the ground level
164,People Group,Needs improvement in management,2018-12-23,1.0,Anonymous Employee,"Company is really good  and growth in company is also good
Good learning platform","Unrealistic targets Expectations from manager.
Favouritism is biggest problem of this organisation.even though if your performance is not Upto the mark but you are favourite to your manager then you are safe.

Manager should learn to not getting into personal things of employees, not necessary to know personal reason for leave and holiday."
165,People Group,Good place to work,2018-12-16,4.0,Anonymous Employee,No chances of growth in centers because there no positions,Atmosphere is good work is normal not much pressure salary on time incentive is also good
166,People Group,Working as QA,2018-12-13,5.0,Anonymous Employee,"Great work environment!.
Great team work.
Daily Scrum meeting.",Work from home not available.
167,People Group,I have worked in shaadi center for almost an year.,2018-11-27,4.0,Executive Telesales,"Easy to work. Small work group

People are helpful. And like to teach you new skills

Higher management is very freindly.","Work pressure is high to meet targets. 

Not much to consider."
168,People Group,Great company to work,2018-11-26,4.0,CRM,Great company to work and grow,Not really .. .. .. ..
169,People Group,Nice to work,2018-11-24,3.0,Team Leader,Good for beginners to learn,"No transparency in management ,salary hikes."
170,People Group,Performance,2018-11-21,3.0,Anonymous Employee,Good working environment good management,"Infrastructure constraint ,  Lack of transparency between management and agent"
171,People Group,It is a great place to be,2018-11-21,5.0,Anonymous Employee,"Lots of learning, fantastic culture, great management","slow paced environment, slow business growth"
172,People Group,GOKUL PARTHIBAN Sr.Product Advisor,2018-11-19,5.0,GOKUL PARTHIBAN Senior Product Advisor,People Group (Shaadi.com). This is the right place to work and grow.,There is nothing to say so far
173,People Group,Decent place to work with,2018-11-16,4.0,Anonymous Employee,"Nice culture, benefits, salary structure","Not enough growth opportunities, no trainings, very few learning and development programs"
174,People Group,HR Executive - Recruitment,2018-11-15,4.0,Human Resources,"Good opportunities for learning, new challenges and great learnings. 
Best on job trainings, increased exposure and very good working environment.",Yet to find any cons.
175,People Group,Great Place to Work,2018-10-20,4.0,Quality Team Leader,Its a very employee friendly company. Provides good opportunity for growth.,Need to have a better communication system between different divisions.
176,People Group,Good work environment,2018-10-11,4.0,Anonymous Employee,"1.good company to work
2.cool cafeteria
3.best thing is flexible timings and 5 days
working",As such nothing....all good going....
177,People Group,Good Place to work!!!!,2018-10-05,3.0,Senior Executive,"Good Work Life
Flexible timing
friendly environment","No Growth
Salary is less as compare to status of company"
178,People Group,Good place to work,2018-09-17,4.0,,Awesome company Cool place to work,Not found any as of now
179,People Group,New age technology playground,2018-09-06,5.0,Anonymous Employee,"Tech setups is best in the class
Cool place to work and grow
Chill rooms to code in isolation",not found any as of now.
180,People Group,Unlimited  possiblities of growth,2018-09-06,5.0,Anonymous Employee,"Employee first attitude
Always updated tech stack
Open and transparent management",Struggling to find any since last 12 years
181,People Group,"""One of the Best Marriage Site""",2018-09-05,5.0,Team Leader,"Excellent company in all perspectives.
Good Work & Life Balance. 
Realistic in all its Products.",No Cons
182,People Group,Nice working with shaadi.com,2018-09-05,4.0,Anonymous Employee,"Good employee policy, good work life balance, Monday free breakfast, opportunity to grow",Decision making is slow.
183,People Group,"""Fantastic work culture""",2018-09-05,4.0,Anonymous Employee,"Awesome company, loads of opportunities to grow.",Salaries are less given the stature of the company
184,People Group,not so good not that bad,2018-08-19,2.0,Anonymous Employee,"friendly team members and very helpful, salary on time.",delay in projects due to the process
185,People Group,place to improve your leadership,2018-08-16,4.0,H R,"fast paced environment
company will value your ownership
work life balance and work flexibility,",nothing as such
186,People Group,Awesome place to be,2018-08-06,4.0,Associate Director,"1> Feels like family
2> Great place to do some good work
3> The culture is awesome
4> Pro experiment and learning
5> Outcome driven
6> Customer comes first in all decisions",1> Free food for all on all the days
187,People Group,Exciting projects to work on,2018-08-03,5.0,Software Engineer,"As a software engineer at the company, I get to work on challenging projects which allows me to become a better developer. And you know what's more exciting, working on a product that is used by millions.",I don't think there are any cons of working in the company.
188,People Group,shaadi,2018-08-01,4.0,Anonymous Employee,great place for fast learning,not a good pay master
189,People Group,company for freshers.,2018-07-23,3.0,Employee,"Good team management. 

Working environment",Not helpful and less transparency
190,People Group,Not so satisfying but ok,2018-06-28,3.0,Tech Lead,Environment is ok not like any MNC,Oh my god!! You need to be a good politician if you want to survive here.
191,People Group,less increment,2018-05-06,4.0,Anonymous Employee,friendly people,the increment is very low...as compare to competitors our increment is very low
192,People Group,good work environment,2018-05-04,4.0,Anonymous Employee,best working environment in an office,less salary  increment  yearly
193,People Group,Good Company to work with,2018-04-26,4.0,Anonymous Employee,"1) Friendly environment
2) fun-loving atmosphere
3) Great career opportunity provided if you are passionate about your work",no cons as such. Happy to be a part of this company
194,People Group,One of the best companies to work for,2018-04-03,5.0,Human Resources,"The best reason to work here is LEARNING.
The organization offers a lot of opportunities to the employees to learn and upgrade themselves along with an amazing work environment.",Haven't faced any such thing till now.
195,People Group,Nice Company to work with,2018-03-23,3.0,Team Leader,"Freindly environment, lots of unique incentive plans and growth",Miscommunication between the different centers
196,People Group,“I enjoy coming to work!“,2018-03-14,5.0,Operations Team Leader,": Flexible work schedules, suggestions for changes are received openly, easy to implement changes, great co-workers, friendly environment, lots of opportunities, senior staff seems to really care that employees are happy and motivated, plenty of celebrations and lots of reasons to celebrate, company has a good reputation.",There is nothing much to be mentioned here... work is fun
197,People Group,Good company to work,2018-03-13,3.0,Anonymous,"- Work life balance
-Employee friendly 
- Opportunities are given to grow in your career ladder
- Supportive manager
- 5 days working
- Employee engagement activities are good",None that i can see at the moment
198,People Group,"Wonderful company to work with, management - good.",2018-02-24,4.0,Centre Manager,"Friendly environment, very creative and innovative.",Work timings can be extended at times if required.
199,People Group,relationship executive,2018-02-09,4.0,Human Resources Assistant,people are very  good and boss are very supporting,asked them to get  good  back end team
200,People Group,Sr Software Engineer,2018-01-30,5.0,Senior Software Engineer,Its a good company to be part of,As such no problem I had ever faced
201,People Group,"Politics, partiality and pathetic management!",2018-01-24,1.0,Anonymous Employee,1. You do meet few genuine people.,"1. The entire leadership is partial and you will only get promoted if you are close to your manager on a personal front and share all your personal life drama and baggage. (Become the victim)
2. The management has too much expectations from the advisor level.
3. The policy changes according to the likes of the management and never benefits the junior levels.
4. The higher management who had worked hard to set-up the company have already left.
5. You will be allowed to chill out and not work if you take smoke breaks with the managers.
6. Too much pressure on both the sales and service teams.
7. More than half of their success stories are fake, which were created by the advisors themselves.
8. Too many negative people in the organisation.
9. Knowledge wise no upgrades done, all the training are repetitive and are outdated.
10. Growth is very restricted and many people are working on the advisor level for ages."
202,People Group,"Bad culture  - Marketing , design, product and Testing heads left out of frustration",2017-11-29,1.0,Anonymous Employee,"Top to down everyone is searching for a job. You will see everyone has opened a job search site on there workstation.

All old employees who helped build the company have left. Only the CEO's close people are left in the organization.

Freshers are unhappy as they do not have anyone to guide them. They get scolded for the incompetency of there seniors. Seniors do not have any knowledge as they have been promoted to positions they  cant handle and dont deserve. Product team is very weak. Employees dont come to office but are still awarded in annual functions as the management doesnt have a visibility of the work till the last level. The mid level managers take  away ideas and deliver them as there own. They are rude to everyone below them and use CEOs name for getting work done",The best is over for this company
203,People Group,Bad Management,2017-11-09,1.0,Anonymous Employee,The office stinks with dampness and leakage smell,"They will make a female employee wait till late and when she says its 11 pm i need to go home, they will give the credit of her work to some 1 else in the team"
204,People Group,Great for Product Folks,2017-11-07,3.0,Product Manager,A firm which is actually obsessed with numbers,unfortunately in a saturated sector
205,People Group,Wonderful place to work,2017-11-06,5.0,Senior Product Manager,"It's a wonderful place to work at. The company has a very open culture. People are very friendly and very approachable. You can walk into the CEO's office anytime and have a very open discussion about what's right and what's not. I have never seen a company which is so receptive to employees' opinions and thoughts. People are valued and respected which comes from the top and goes all the way down to other employees.
Gourav is one of the best leaders you will work with. He is always there to help anyone and is super sharp at work. It was a great learning curve for me working at People Interactive.",Can't think of any.
206,People Group,Worst People specially TECH MANAGERS,2017-11-05,1.0,Tech Lead,"salary comes on time, thats it","most of the people in the tech team are worst specially mangers and no one was happy in multiple team because of managers, all middle and now senior level managers are very worst they just know how to play blame games and politics, managers are very unprofessional and sometimes abusive too, they will overreact on your small mistakes, managers will lie on your face and they are also dumb in technology. my whole team was very frustrated with our manager and because of him everyone was planning to leave company in a year. almost everyone has bad experience with managers"
207,People Group,Best place to work!!,2017-11-02,5.0,Associate Manager,"Best work culture!

Good people to work

Best policies!",Infrastructure is little old.. but still small and sweet
208,People Group,Good Company,2017-11-02,5.0,Senior Engineer,very good Management and good environment.,Nothing found serious cons to change.
209,People Group,Poor Company to work with,2017-10-25,1.0,Anonymous Employee,Nothing as it is a rosy picture at the start and made to fill in glass door review at the induction hence the ratings are very good,"If you are in services domain you live for the customer die for the customer. No festivals nothing process requirement makes you work for all festive days. Process management is so worst that even if you are not well you are made to prove that before you are granted a leave. Even if some one is on death bed you will be asked for proofs before taking leaves. Any leave you take cannot be a CL or SL it has to be Weekoff and you are made to work weekend.
Premium product is not at all worth the money paid hence their is wrong expectations set at start and hence members will run behind you abuse you but customer is the king and respect the king and dump your self respect in a bin"
210,People Group,Good company,2017-10-23,3.0,H R,"salary package good, staff is good & co-operative, work environment is healthy","high work pressure, management does not have long term plannings"
211,People Group,Internet company with a human heart,2017-10-20,5.0,Anonymous Employee,"Most prefered consumer-brand in matchmaking
Super-sharp leadership team which will help you develop your skills  if you keep pace
Excellent HR team that takes employee engagement very seriously
An all-pervasive culture to do right by customer.
Reasonable WorkLife balance
Many opportunities for growth and reasonable annual pay-hikes","Legacy Tech-stack can slow down an otherwise fastpaced PDM. Despite having a highly capable tech-team, this is a challenge"
