,company,headline,date,overall_rating,author_position,pros,cons
159,trivago,Company changed a lot over the years,2020-05-04,3.0,Brand Designer,"- culture
- cool and ergonomic office space, amazing Cantine, gym, Library, Café nice meeting rooms etc. 
- in the past there were learning opportunities personal development and internal role rotation was highly encouraged - unfortunately not so much anymore","- very top down management recently
- big corporation attitude when it comes to processes
- for a creative mind the company is a bit too pragmatic and excel sheet orientated, not many opportunities for exciting creative work"
160,trivago,Front End Developer,2020-04-30,5.0,Front End,"Allowed to work sometimes from home.
Flexible schedule.
Insurance.
Food in the office free: fruit, cereals, coffee, beer, wine...
Family spirit.
Super nice setup: standing desk, latest desktop, and headphones.","The office is sometimes noisy, meaning that people are very open and friendly and we talk at any place. This is why sometimes it can become a bit hard to focus.
Even though the salary is good, there are other companies that pay much more. However, this office is special and you won't find this same spirit in other places."
161,trivago,"Good vibes, but no career development",2020-04-30,3.0,Backend Developer,Nice benefits and good vibes,No career development plan to keep growing once you reach a certain point
162,trivago,Great,2020-04-27,5.0,Technical Account Manager,Great place to work and live,Low salaries and rapid changes
163,trivago,"Its a great place to work but with less benefits, Good starting point for a career",2020-04-24,4.0,Technical Account Manager,Good work environment and great office,The salaries are low and review process not good
164,trivago,Lots of opportunities to learn,2020-03-31,4.0,Anonymous Employee,I find trivago very good company because it offers you possibilities to constantly learn something new. People are very helpful and open minded.,"The politics is quite present. It seems to me that who is friend with who works better in advancing your career then real expertise. Although this is typical for many companies, so it’s nothing new, but still it’s sad that it is like this, because the company’s culture is quite nice overall."
165,trivago,A great company,2020-03-22,5.0,Performance Marketing Associate,"Empowering working culture
High degree of autonomy
World-class office facilities
Great use of technologies in every part of daily operations
Combination of experienced and eager to learn workforce",To some extend rigid way of working
166,trivago,"Great to start, bad to grow",2020-03-11,2.0,,"- culture kitchen  - canteen with a good selection of subsidised meals that change every week
- free soft drinks and coffee in the office
- some sports classes for free in the office
- People are generally very relaxed. “Unlimited” holidays","- low salary 
- poor communication between teams 
- lack of support/guidance for career progression
- poor leadership
- constantly restructuring teams 
- speed over quality"
167,trivago,Good opportunity,2020-03-11,4.0,Junior Copywriter,Great multicultural team and good creative minds,"Nothing to mention.

They should invest more in the employee"
168,trivago,Great company to work for,2020-03-07,5.0,Senior Software Engineer,"At trivago there's a democracy of ideas; i.e. all ideas are judged on their own merits not on the speaker. A junior dev can come up with an idea for the business, pitch it to leadership and champion the idea. 
trivago also cares about the development of its employees, and invests in them through trainings, mentorship, access to a library, health and wellness programs, and more. Learning is a big part of trivago culture. Not just for the employees, but for the company as a whole. There's a genuine culture of feedback and learning from the feedback.
The company is very international and people here are generally very friendly. Work life balance is also really great and works well for parents who need to occasionally leave the office or work from home to attend to their kids. In the past, the company focused on hiring younger people who were just looking for a good time but over time the company has matured, along with its employees.","I've heard that the pay for none engineers is not great. I can't confirm that because I'm an engineer.
Also, things change rapidly so if you don't like a dynamic environment, then this may not be the company for you."
169,trivago,great experience,2020-03-02,4.0,Inside Sales Representative,"great culture, interesting people, lots of events and parties",lower salary and less paid holiday than average
170,trivago,"Great Atmosphere, Great People and average salary",2020-02-20,4.0,Product Owner,"The company provides a great environment for everyone, most of the people you will meet are so friendly and willing to share the experience they have in any field.
A great learning opportunity for people at an early stage of their career.
So many opportunities to grow and develop yourself","- The Salary is less than the average salary of the market
- Be ready for so many changes all the time"
171,trivago,Great company,2020-02-13,5.0,Anonymous Employee,Great culture What more can I say,Not applicable - no further comments
172,trivago,Good place to start,2020-02-13,3.0,Solutions Engineer,You can have the opportunity to work with some amazing people with excellent skills that are more than happy to assist you with anything.,"Salary.

Everything is pretty much ruled and ruined by politics, from your team to your salary and even the projects that your team should work on."
173,trivago,"One of the best culture I've experienced, but still lots of room to improve",2020-02-12,4.0,Data Analyst,"Good culture, awesome office with free fruits and drinks, diverse culture with friendly people, and lots of freedom at work. Also the possibility to switch to another role is quite interesting for those who'd like to try different role without having to apply to another company.","Culture kitchen could be cheaper. Career path is unclear.

In terms of strategy, while we do so many changes and try to keep improving, I feel like we've been really slow in moving away from status quo. Also product features could be better."
174,trivago,Top Company Culture & Growth Opportunities,2020-02-10,5.0,Marketing Manager,"- International & diverse talents
- Plenty of opportunities to grow, learn and change positions internally
- Amazing campus!",- LOTS of change
175,trivago,Best company to work for. Ever!,2020-01-15,5.0,Software Engineer,"Company culture is great. Environment of trust.
Employees are people and the company does the best for their well being and happiness at work.",I believe you can get higher salaries easily but there is a full package you have to weigh first.
176,trivago,Nice place to chill,2020-01-14,3.0,Agency Coordinator,"Free food, drinks, activities, once a year a trip to a secret location for 4 days, budget for conferences or courses, people are rather nice",No much growth opportunity needs more maturity
177,trivago,young company,2020-01-13,3.0,Corporate Planning Officer,"Very open atmosphere, good party",Sometimes management does not know where to go
178,trivago,Trivago’s life,2020-01-12,4.0,Commercial Sales Assistant,Ok salary - good potential commission- great environment - young company - benefits,Not fixed hours - training period not long enough
179,trivago,Good place to start,2020-01-10,3.0,Anonymous Employee,"Nice coworkers, good salary,  flexible working hours","Too stressful, processes change faster than waiting for the outcome"
180,trivago,Data Analyst,2020-01-08,3.0,Consulting Hardware Engineer,"Amazing people to work with, great place for people after school",Low salaries and all the secrets around them
181,trivago,"Great place for ambitious, young professionals",2020-01-07,4.0,Marketing,"- freedom 
- flexible working hours 
- almost no micromanagement 
- great office environment 
- lots of perks","- can be hard to advance 
- leadership team not always 100% aligned"
182,trivago,Tust and Passion,2019-12-16,4.0,Anonymous Employee,"Young and vibrant team
Flexible working hours
Great learning opportunity
Flexible holidays
Great company culture and values
4 big events yearly including 3 days company trip",Designers distributed across product team and missing a centralised design department that can tackle design topic on a global level make difficult to grow on the status quo and aim to UX excellence.
183,trivago,Some good people but severe underpay,2019-12-15,2.0,Data Scientist,"The atmosphere is great, colleagues are in general friendly and competent. Work-life balance is very good as well. The company culture and values are really positive.","Constant reminder that we 'have opportunities' and that 'money shouldn't be a motivator'; these are used as arguments to be paid in the bottom 5-20% of the market (within my pillar). The salary increase decision process is lacking any transparency and you're only informed of the result of some discussions that took place. We've been told that we used to calibrate salaries by using some EU averages (which include the Eastern states where payments are much lower). Well, we don't live in Eastern Europe and we expect salaries to match our residence."
184,trivago,Great place for a starting job,2019-12-11,4.0,Project Manager,"Flexible hours
Nice colleagues
You can have as much responsibility as you like
Annual trip & many parties","There's no clear growth path
There's only one salary increase per year
Salaries are below average
Many changes in structure"
185,trivago,Inside Sales representative,2019-11-26,4.0,Inside Sales,"nice office, colleagues, advantages, great for the first job","inexperienced leadership, decisions made by guessing. if there is something wrong, its always the employee fault  (trivago Hotel Relations)"
186,trivago,Funny place for a cheap workers,2019-11-23,3.0,Front End Developer,"People is open, Ontour is awesome","Old  tech Stack, salaries are LOW. There's a huge lack of  real Seniors FE  & BE & DevOps"
187,trivago,The best company I've ever worked for by far,2019-11-18,5.0,Account Executive,"a lot of learnings 
international colleagues
great environment
plenty of room for personal development",I enjoyed everything while being there
188,trivago,Software Engineer,2019-11-03,5.0,Software Engineer,"Great place to work, flexible working hours, they listen to your ideas and opinions, its a place where I felt empowered",Sometimes do freedom and flexibility it felt that some people did not take the job seriously.
189,trivago,absolutely great for development,2019-10-23,5.0,Associate Data Scientist,"Amazing co-workers, vibe, ability to develop skills and grow.",pay ... but this is generally a country problem not a trivago problem.  Switzerland and Luxemburg pay much more.
190,trivago,aa,2019-10-14,4.0,Software Engineer,"Good balance, between work and life",trivago Palma has a low salaries in general
191,trivago,A company that does try to live up to it's core values,2019-10-10,5.0,Software Engineer,"Quality is highly rated. Teams are self organised. Time to learn not only within your areas of current knowledge but you're encouraged to learn outside also. Trivago engages with their employees well and encourages lots of feedback and self reflection using their core values (pillars) as a guide of which, to my surprise, management and up also live to. It's been refreshing to work in a company that values their employees work life balance, education, and time.",Salary is low and cost of living in Mallorca as an expat is not that cheap.
192,trivago,Good first experience,2019-10-09,4.0,Product Owner,"As a first job, working for trivago is kind of cool :  great opportunities to grow, learning opportunities, international colleagues, nice culture, very nice offices and nice food in the canteen.","The low salary doesn't compensate for all the other advantages of the job (as in office infrastructure, free fruits, free drinks). Unfortunately, when you are not a lead, the salary is pretty none viable. It however grows with years, but after 4 years I was still earning 60% less than my next job"
193,trivago,A great place to get started! But beware of certain departments...,2019-10-07,4.0,Inside Sales Representative,"A great company from an educational perspective, support with learning german and the ability to get involved in projects outside of your job scope allows for great personal development. Support from HR is fantastic at trivago.","The salaries compared to other companies in the city are not so great (and the extra benefits do not equate to the cut in comparable salaries), and there is huge employee turnover - it's rare to find people that are making a long-time career at trivago. Also, some departments (from what I heard and experienced) are structured and managed better than others. There are also people in positions of mid-management that appear to only be there due to 'sucking up' to those above them, not always because of their skills, background or ability. I also found the sales department (now a separate company), completely uncomparable to the rest of the company, I was often shocked at how the department operated."
194,trivago,Software Engineer,2019-09-16,4.0,Software Engineer,"international, freedom, learning, technology, health","no seniors, disruptive, people don't stay, lack of leadership, take it or leave it mentality."
195,trivago,PM,2019-09-13,1.0,Anonymous Employee,"-this place is very suitable for somebody who wants to have their first job experience or you just finished your studies.
-if it's your first time in Germany or Dusseldorf, it wont be difficult to socialise as they organize many events.","-lack of consistency among the projects, they can change their mind very quickly withouth providing any guideline.
-some teams are run like feuds, you need to have your manager sympathy to progress, and even to feel integrated into the team.
-a permanent contract means nothing in there, as when they don't need you, they can easily get rid of you by ""performance"".
-the salary revision is just a joke, and employees can not participate in the process and depends on your direct manager decision.
-the contract topic: first you are offered a one year contract, with six months probation period, after that, instead to offering you the permanent contract, they will offer you another one year contract (without payrise or salary review) that can be terminated by the end of the year, so fire you its much more cheaper.
-they could improve the office security as people complains about thefts all the time."
196,trivago,Good place to start your career but not to grow,2019-09-12,3.0,Anonymous Employee,"Team spirit
Benefits (food, on tour, fitness courses etc.)
Office culture","Low salary
High pressure in sales
Unqualified team leads"
197,trivago,GOOD PLACE TO WORK,2019-08-14,5.0,B2B Sales,"great culture, lots of trips","long hours, sometimes anti social"
198,trivago,Great  workplace,2019-08-07,4.0,Account Manager,"multicultural enviroment 
company benefits
great teamwork and people to work with","salary distribution
lot of changes in little time constantly"
199,trivago,Amazing place to work and live,2019-08-01,5.0,Technical Account Manager,One of the rare places where you want to return. Everything is done with the thought about people - from work organisation to leisure activities. A lot of possibilities for development as individual and as a team player,"I can't find anything bad to say, it's a really great company"
200,trivago,Good work atmosphere,2019-07-30,4.0,Software Engineer,"Meet many new people from all over the world, relaxed work atmosphere.",Maybe not the most interesting product.
201,trivago,Inside Sales Representative - trivago Hotel Relations,2019-07-23,3.0,Inside Sales Representative,"Nice colleagues, good environment, international and multi-cultural, good work life balance","Below average salary, low to no career opportunity"
202,trivago,Low skill individuals,2019-07-20,1.0,Anonymous Employee,"Culture kitchen and the food scene is descent
Company events are alright","Low skill people all around the campus
Junior management wth lack of experience
Low wages
Potentially dying business"
203,trivago,Great place to learn and growth,2019-07-16,4.0,Software Engineer,"- Flexible hours 
- No management (no one is pushing you to work, you have to do it by yourself)
- Nice IT equipment (laptops, screens, etc)
- Best environment of work
- Family Spirit
- Events
- Free food / drinks
- Good coffee
- Feasibility to learn new stuff 
- Nice tech - frameworks (working in the right team, not all of them)","- If you join as a junior - mid, is almost impossible to earn more, 360 is bulls*it. 
- Family Spirit, as I put it as advantage and disadvantage for a some people, so have it in a mind (Same as events, if you don't wanna socialize)
- Bureaucracy and politics.
- Palma office is like 2nd level compared with Düsseldorf (benefits, salaries, etc is quite below)"
204,trivago,Many benefits and nice to start...nothing else.,2019-07-10,3.0,Customer Service Representative,"Many benefits as food, drinks ( water, juices, beer...), discounts, group activities and experiences as the "" trivago on tour"" where the company organizes few days in a secret location to stay together and create bonds. Internal activities as sports classes and workshops or courses and flexible time schedule are other pros of this company. There are also many internal opportunities in several locations in Europe.","I found my self incapable of learning from almost anyone due to the level of very low experience, integrity and maturity of the management.  
Most severe thing is rarely you feel free to express your opinion without consequences."
205,trivago,Great culture,2019-07-09,5.0,Full Stack Developer,"Good secondary benefits, great culture, lots of flexibility, interesting tech, international, internal job rotation opportunities.",Salary is not to competitive
206,trivago,Trivago Hotel Relations - work hard play hard,2019-07-01,4.0,Inside Sales,"Very good office space
Very good equipment/it support/infrastructure 
Very good parties 
Very good office perks (coffee, breakfast, fruit, drinks, beer, goodies, team lunches, team events, trivago on tour, company wide events)
Amazing people - people from all around the world, eventually become an extended family 
Great school for salespeople","Low salary for starters, gets better if you stick around 
Difficult to stick around, this is not an easy job, but you will learn a thing or two about yourself and your limits in the process 
Repetitive at times, high amounts of pressure 
Bad product
Bad CEO"
207,trivago,"Good for entry level to develop new skills, bad for mid level and growth",2019-06-25,1.0,,"- Opportunities to jump teams and technologies in case someone wants to learn
- Flexible working hours
- No restrictions on Vacation
- Ergonomic workplace, nice decorated campus and meeting rooms.","- Inexperienced mid and higher management in terms of long term plans , following the plans and leadership
- Politics is a core value (although unsaid)
- If alcohol and partying are the parameters for a workplace  being considered great then its a lost cause
- Unprofessional behaviour in meetings and discussions
- Employees can be easily manipulated using the 360 tool or feedback which emphasises on interpersonal relations only and not how much one is good at their job or what skills they bring to the team
- Many leads behave in a certain way and take wrong decisions to safeguard their 360s
- If you know how to party (with the right people) then you can go places else it doesnt matter how good you are at your job/how great an idea you have it will fall on deaf ears
- As mentioned by many salaries are low
- No utilisation of the experience of the lateral joiners
- No focus on technical excellence
- lack of accoubtability and responsibility for projects
- frequent changes of the team/pillar structures"
208,trivago,Super nice place where to work,2019-06-13,5.0,Customer Support Agent,"really nice vibes, freedom and many benefits",too rapid changes in team structures
209,trivago,Great place to work and develop,2019-05-31,5.0,Anonymous Employee,"- Great culture and people: an environment that respects opinions, challenges you, and allows you to develop in your role. Besides, you can have a great work-life balance with several benefits like flexible working hours. 
- Entrepreneurial passion: even though trivago grew a lot, it still keeps its start-up attitude by keeping small teams with the minimum hierarchy possible. This environment allows people to challenge the status quo, avoid long decision-making processes, and continuously try new methods and strategies to become better at every level.
- International environment and the new campus: People from several countries create a multi-cultural background that is unique for a German company. The new campus offers a ""Silicon Valley"" style environment as well as an international canteen with food from around the world","- It is not an actual negative but mostly a fact of similar companies. In a fast-pacing environment, a lot of changes can happen in a short time. For people that are resistant to change or search for a ""comfort"" position, it can be a challenge to keep up."
210,trivago,Good work life balance,2019-05-30,3.0,Designer,"work-life-balance, benefits, awesome office spaces, learning opportunities, trainings, values and feedback culture, flexible working hours","messy processes and communication, insufficient project management, insufficient career growth opportunities, insufficient communication between company pillars"
211,trivago,"Best Place to Work, With All The Benefits Thrown In!",2019-05-29,5.0,Sales Account Management,"Within the Sales and Account Management team, you are given an unparalleled level of responsibility from management. This enables you to make your own business decisions and map out the desired road for the growth of your account base. The team itself is a multinational, fun loving group of driven professionals who constantly challenge the status quo. We learn from each other every day. 

To top it off, the new trivago campus is spectacular! Kitted out with a Gym, plenty of sports, 5 star canteen, roof top terrace, the list goes on.",There are so many different internal teams it can be hard top keep track of them all.
212,trivago,Solid employer many benefits but some drawbacks,2019-05-26,4.0,Software Engineer,Amazing flexibility and freedom in technologies,Constant restructuring make it hard to do bigger longer projects
213,trivago,Best company culture I have experienced but...,2019-05-18,5.0,Senior Product Owner,"- Company culture: the company is based on young, ambitious talents. Plenty of team activities (team events every month, company parties 4 times a year and one company trip per year). Definitely the best company culture based on fun activities that foster connections and trust among the employees.
- Managing Directors: excellent team of young entrepreneurs with great sense of leadership and very inspirational mindset.","- Salary: below industry standard
- Leads: because of the young age, many leads are inexperienced. This led to many people leaving (including myself) not because of the company itself but for the unprepared leaders."
214,trivago,Run away unless you've just graduated!!!,2019-04-30,1.0,Anonymous Employee,"-Working flexibility but that depends on your responsibilities.
-Learning possibilities until some stage then stagnation.  
-Can be good for freshly graduated students not professionals.","-Modern slavery when it comes to compensation.
-Very shady remuneration (non) system.  -Employees are often hired from abroad with minimal paid salaries fixed by Germany to accept their work permits.  As the minimums are not the same and as for some countries, they don't even exist (Within the EU for example), this leads to situations where, for the same jobs, employees earn different salaries. Needless to say that these minimums are  ridiculousely low compared to the German mid size and big companies.
-360 evaluation system encouraging camaraderie and politics. Possible to gamr the system by reciprocating on good reviews. 
-A small secte of comfortable & incompetent middle managers doing the dirty work: Humiliating the employees to keep their salaries low. 
-Company is losing its most valuable assets: competent employees as they are refused any  possibility of promotion. Almost everyday somebody leaves.
-Executives infantilize employees with a set of values nobody believes in: trust...
-Story telling is much more important than progression in trivago. To be appreciated, you don't have to do but to say the right thing.
-Lack of responsibility of some employees: dirty toilets, stealing, unresponsible drinking...
- Knowledge getting lost with people leaving."
