,company,headline,date,overall_rating,author_position,pros,cons
0,WebMD Health,Good,2022-04-08,5.0,Associate Copyeditor,Good company to work for,None that are to be mentioned
1,WebMD Health,Good work culture,2022-04-06,4.0,Senior Software Developer,great place to work and they have remote work culture,tech stack has become a bit stagnant
2,WebMD Health,what its like to work there,2022-04-04,3.0,Account Exectuve,great support from Management and you feel supported,luck of the draw and hard to meet quota consistently
3,WebMD Health,Good company,2022-04-03,4.0,Marketing,Overall great company to work for. Good work life balance.,Management is not consistent and changes a lot
4,WebMD Health,I would not take an offer from this company,2022-03-31,1.0,Anonymous Employee,Nice people but this is the only positive,"Weak pay, lack of instruction, no life work balance"
5,WebMD Health,Poor Mangement,2022-03-28,2.0,Data Engineer,"Great team, but management disorganized and too many","Long hours, poor communication, poor pay"
6,WebMD Health,Best of Luck.....,2022-03-28,2.0,Project Manager,My manager was great! The benefits were also pretty good.,The turnover rate was extremely high. People were constantly coming to replace people who left the company and by the time a replacement was found another person decided to leave. Basically a revolving door within this department.
7,WebMD Health,"Great team, culture",2022-03-26,4.0,Intern,"Great team environment, good training",Disconnect due to working from home
8,WebMD Health,Wonderful colleagues!,2022-03-24,4.0,Anonymous Employee,"Great brand with integrity
Large traffic
strong content
Nice people","Ownership by Internet Brands, resulted in exodus of many good people."
9,WebMD Health,AMAZING COMPANY,2022-03-24,5.0,Anonymous Employee,"Amazing company, great coworkers, great location, great benefits. Cannot say anything bad about this company. The management is incredibly understanding and helpful, does not micromanage.",no compliants for this company
10,WebMD Health,Great work culture,2022-03-23,4.0,Software Engineer,You get to work on latest technologies around the tech world,The vendor team's are having a toxic work culture.
11,WebMD Health,Good,2022-03-22,5.0,Content Researcher,"work culture is good. 
management is good","Contract were not extend.
Slow Process"
12,WebMD Health,Inventory Analyst,2022-03-22,4.0,Inventory Analyst,good people on my team,do not really get promoted
13,WebMD Health,Great Place to Work,2022-03-21,4.0,Health Coach,"Benefits, Culture and the Work is rewarding.","Long days, not a lot of variety."
14,WebMD Health,Big Company,2022-03-17,4.0,Software Engineer,Good company with good benefits.,Too many business units with different structures.
15,WebMD Health,Onsite Health Coach,2022-03-15,4.0,Onsite Health Coach,"Autonomy, multiple sites and working with different clients. Active meetings such as group walks.",Distance between client sites was up to 75 minutes each way.
16,WebMD Health,Completely out of touch,2022-03-11,2.0,SVP-Technology,"Pay is decent
Hard to get fired","Lack of diversity
Lack of creativity
Only care about profits - employees are just resources to leadership."
17,WebMD Health,A bit deceiving,2022-03-10,3.0,Wellness Coordinator,"Promote well being, self care and mental health 
Employee appreciate emails, swag on occasion","What they promote to clients in regard to wellness and health is projected to be for employees as well but I have not found that to be accurate. Salary is a very wide range for the same position dependent upon the account a person is associated with and not based on their experience, education or prior contributions. Wage transparency among employees is frowned upon."
18,WebMD Health,Great work culture,2022-03-09,3.0,Market Research Specialist,"Good coworkers, great great culture","Poor leadership, lack of yearly salary increase"
19,WebMD Health,Great place to work,2022-03-03,4.0,Account Manager,Great people and always a ton of work to do,Not the best communication from higher ups
20,WebMD Health,Scam of a company to work for,2022-02-28,1.0,Manager,"Remote work is great and PTO is good if you actually use it in time. I learned a lot and gained experience, but that was thanks to my boss not WebMD. I should have left earlier.","I have never worked for a company that is so full of themselves and cares about money more than their people than WebMD does. WebMD originally interested me because I care about improving the overall wellbeing of people and their health. This was not the case in this company. Best advice if you are thinking about working here, don't. 

Here is a summary of my thoughts working here over the years so no one else experiences this:

1. Think you'll get your annual bonus? Think again. During Covid, business was booming and work was increasing. Due to unforeseen times and uncertainty they withheld our bonuses and merit increases from us for months. Then, they proceeded to inform us that business is better than ever and this was a record year. They are so money hungry they will work you and promise all sorts of incentives and will never follow through with their promises. 

2. Want that raise or promotion? They'll hire someone else before promoting within. If inflation wasn't enough, your 3% raise you get with the company is the only thing you'll be seeing for years. It's almost laughable that the company won't increase salaries to market average-Turnover is huge because of this. Meanwhile, you have the VP's sending company wide emails showing off their elaborate vacation trips and wishing everyone a great holiday, while you can barely afford your mortgage and working overtime. 

3. HR department is nonexistent. Need help or answers with company policies? Expect to get ghosted and not receive an answer at all. This company is so slimy. All they care about is money. If you work like a robot and never want an increase in your salary then this is the place for you.

4. People are so judgy here. In the office, do not expect to get a smile back from anyone working around you. It's more of an older crowd, and seems like they never developed small talk or social skills. No one cares to develop personal relationships with each other. You will never have a voice in the company unless you are CEO or a VP. All they care about is Internet Brands.

5. This company is definitely not an Amazon or Facebook. There are zero perks to working here besides the name. So many other companies have a better onboarding/incentives/work life balance/growth. All the employees here are miserable and the ones that stay are too afraid to leave because they still have hope the company will change. The company has gone downhill fast, don't feed into their lies and promises. Don't waste your breath offering advice to upper management either, It will never happen and the company is not changing."
21,WebMD Health,You will never feel less appreciated,2022-02-28,1.0,Marketing,The work you do is for a good cause.,WebMD does not appreciate their employees or pay them a decent wage. They will pay you as little as possible and do everything they can to avoid paying you benefits (lots of forever freelancers).
22,WebMD Health,A MNC with western outlook,2022-02-22,5.0,Medical Reviewer,"Flexible Timing
Great Work Environment
Excellent Management set-up
Managers are extremely professional, and skilled
HR Management is excellent",I do not have any specific comments for now. Hopefully not in the future too.
23,WebMD Health,Company Has Gone Downhill,2022-02-21,2.0,Director,"Dedicated, passionate employees who are true subject-matter experts. Tech and teams have good relationships with marketing and editorial teams.","Major culture shift since Internet Brands (IB) acquired the company and it went private. A reorg in 2020 has been a disaster and teams are more siloed than ever before. So many people are leaving the knowledge gaps are as wide as the Grand Canyon. Some people think the CEO, Bob Brisco, is a visionary but he's really an arrogant psychopath."
24,WebMD Health,WebMD Pros and Cons,2022-02-17,4.0,Manager,"Flexibility in working remote at times, Friendly environment",No upward mobility for no management team members.
25,WebMD Health,The Live Business Unit is a Dumpster Fire,2022-02-08,1.0,Account Manager,A colleague sent me candy once.,"The leader of the Live Business Unit, the arm that produces live IRL and virtual events for drug companies and continuing education virtual events, has such a poor handle on all aspects of his teams. He’s a rude and forceful manager with a knack for burning workers out."
26,WebMD Health,Great company,2022-02-07,5.0,Sales Associate,"Great atmosphere, learned a lot!","Everything was great, no cons"
27,WebMD Health,Good,2022-02-03,4.0,Anonymous Employee,Good job with good comp,Ok but definitely not to mention
28,WebMD Health,Great Place to Work!,2022-02-01,4.0,Human Resources,"Phenomenal, talented and brilliant staff",Stuck in the dark ages on flexible work arrangements
29,WebMD Health,good place to work,2022-01-31,4.0,Anonymous Employee,work condition is very good,sometimes work hours are very long
30,WebMD Health,not good,2022-01-27,1.0,WebMD Employee,IT great place who are interested to work 24/7 like a call center,Your bonus and growth is calculated based on number work you do on extra hours and paid holidays . They expect you to work on your sick leave also
31,WebMD Health,cheap,2022-01-26,3.0,Producer,Middle management is very kind and understanding and work environment is healthy.,Very poor raise increases company wide. No room for growth. Average annual wage increase is only 1% (not even keeping up with inflation). They make it impossible for anyone to stay and grow with this type of policy. They have record profits and continue to cut benefits and pay making you feel very unappreciated as an employee.
32,WebMD Health,Good company,2022-01-24,4.0,Sales Planner,"team, work life balance, office","pay, amount of work, growth"
33,WebMD Health,"Great Company to Work, But less exposure to Work",2022-01-24,4.0,Senior Software Engineer,"Work-life balance with the flexible working hours
Good pay-checks
Less work-pressure",Less exposure to new work
34,WebMD Health,Good,2022-01-23,4.0,Project Manager,Good People ; good culture,Salary is less; could be more competitive
35,WebMD Health,Senior management changes,2022-01-13,3.0,Associate Director,The company is located in NYC and provides employees the flexibility to work remotely,Company culture has changed. It was a publicly held company that was bought out by a private equity firm.
36,WebMD Health,Love the job!,2022-01-12,5.0,Account Manager,"Healthy work life balance, make own schedule with clients, if you’re organized and like working with people this job is for you!",I have no cons at the moment
37,WebMD Health,"Great Colleagues, Terrible Management",2022-01-10,3.0,Anonymous Employee,"Good, collaborative environment
Fun amenities
Relaxed office
Benefits
Pay","no support from management and they will find any excuse to ding you on yearly evals regardless of actual, quantitative or qualitative performance.

Petty"
38,WebMD Health,Fine place to work,2022-01-07,3.0,Director of Marketing,"Smart people
Engaged work force
Opportunity to have impact","Some management promoted beyond capabilities
Senior leadership out of touch with reality, not visible enough"
39,WebMD Health,Review,2022-01-04,4.0,Trainee,"Collaborative, good opportunities, good projects",No cons that I noticed
40,WebMD Health,"Push too hard, ignore boundaries",2021-12-18,3.0,Photo Editor,"Good pay
Some good people
Fairly relaxed day-to-day","The management act like if you're not busy every second of every day, you're skivving
They undercut evals for petty personal reasons
They don't value hard quantitative results and instead base every interaction and eval on how they feel about you that day 
They hold petty, unprofessional and unfounded grudges"
41,WebMD Health,Software Engineer,2021-12-17,4.0,Software Engineer,"Excellent work culture 
Average payscale",Not any that I can think of
42,WebMD Health,Work hard at work worth doing.,2021-12-16,5.0,,"Working at WebMD means that you can always see the tangible importance of what you do. Every day is meaningful. There's enough work to keep you busy but not so much that you're drowning. Great benefits and coworkers
coworkers.",Documentation is very hard to come by.
43,WebMD Health,liars and theives,2021-12-15,1.0,,"not any i can think of. no leadership no organization, taking pharma $$ and falsely giving ""guarantees"" bs","they are cons, pretending to be something they aren't. blaming other teams, I was given the worst pharma to manage it's a sham and a shame. making millions by providing false records. this place is a joke"
44,WebMD Health,Great place,2021-12-15,5.0,Anonymous Employee,Great place to work for all,"No cons here, lots of work but enjoyed"
45,WebMD Health,Run. This place is a nightmare. Lies in the interview.,2021-12-15,1.0,Anonymous Employee,"None. And I mean that. Absolutely none. The WebMD name is not what it was, and anyone in the industry will know its not impressive on the resume.","Wages are below average - you will make more elsewhere. 401k match is garbage. Medical benefits are alright. Good luck taking your PTO, and you can't roll it over.

This place is nothing like what is sold to you in the interview. They will tell you anything to get you in the door because this place is so understaffed and they have no idea how to sell any of their products efficiently. The products are half-baked and in no way compete on the same level as their competitors. The company is run like a jealous child who wants the toy the other kid has. Directions change with the wind because of this - sales teams lie and oversell capabilities to make sales with no thought on how it effects the relationships after they collect their commission.

Nepotism and cronyism is rampant. Senior leadership has no vision or ability to inspire workers. They take no responsibility or initiative - just pat their own backs during town halls despite the lack of real successes. They finesse the fact that our ""wins"" are flimsy at best. One of them is a known tyrant that everyone is afraid of. 

Many more but I'm honestly emotionally exhausted. They will chip you away slowly until you start gaslighting yourself."
46,WebMD Health,education,2021-12-13,4.0,Education,"flexible work, good team spirit",very fast paced environment can be challenging
47,WebMD Health,WebMD,2021-12-07,1.0,Financial Systems Analyst,Easy Going and Laid back,Low pay and no direction to move up
48,WebMD Health,Great work place,2021-11-22,4.0,Anonymous Employee,Felt connected with be outside my team,At times you feel like you aren't getting th attention you need to grow at a company like WebMD
49,WebMD Health,Not the best not the worst,2021-11-17,3.0,Customer Service Representative,"Benefits, working from home, opportunity to grow",Pay and stability of making a living
50,WebMD Health,A stepping stone,2021-11-17,1.0,Anonymous Employee,"Free coffee and baristas, lax work standards, decent WLB",Bad company culture and management
51,WebMD Health,Good company with better work life balance,2021-11-10,4.0,Team Lead,"Good work culture, helpful teams. Its been through acquisition and there is some shift in business direction. Company did hold up to covid job loss and did not do much hiring/firing.

Good stable company with decent technology exposure and work life balance.","Don't have anything specific. Over all, good company to grow your career with."
52,WebMD Health,Great team and rewarding experience,2021-11-10,4.0,Lead Web Applications Developer,Managers are on the right track to encourage growth and building skill set. Great people to work with—intelligent and friendly. Benefits are compatibles,Laptops are showing their age. A replacement program is needed to keep current.  401k match could be better.
53,WebMD Health,Great company,2021-11-03,5.0,Data Analyst,Love everything about this company,"No cons, enjoy everything about this company"
54,WebMD Health,Competitive Pay & Upward Advancement Opportunities,2021-11-01,5.0,Senior Sales Executive,"As a sales professional, WebMD offered resources in pre-sales planning, media support, post-campaign analysis, professional development and technologies that are rare in smaller companies.","As with all high-profile sales positions, there is a big focus on achieving sales goals."
55,WebMD Health,Helping others is its own reward,2021-11-01,4.0,Editor,I enjoyed knowing that my work was helping others with their health and medical concerns.,it's a big company and big companies move slowly
56,WebMD Health,Great,2021-10-29,5.0,Ad Ops Specialist,Great environment and people to work with,I do not have any
57,WebMD Health,Amazing Company,2021-10-29,5.0,Sales Planner,"Great team, amazing office culture",Job can be quite demanding at times
58,WebMD Health,Review,2021-10-28,4.0,Software Engineer,The company allows remote work.,Most software engineers are oversea.
59,WebMD Health,Information security analyst,2021-10-28,3.0,Information Sec,great team to work with,"average benefits, not so great 401k match"
60,WebMD Health,WebMD,2021-10-28,2.0,Anonymous Employee,Great colleagues. Very smart and hardworking.,Bad leadership. Focused on sales versus mission.
61,WebMD Health,a,2021-10-25,4.0,Quality Assurance Engineer,1 - Very helpful colleges,"As most of product are from US, hence shift timing will be fix from 2 to 11 pm"
62,WebMD Health,Awful place to work. Stay away.,2021-10-13,1.0,Anonymous Employee,Great coworkers. Remote work available.,"Upper management has no clue what they are doing. The new CEO likes to look up ridiculous studies online that he doesn’t even understand and then forces editorial to cover them. And don’t get me started on his stupid company-wide “inspirational” emails with videos of himself telling us why we have to work harder and longer with no pay raise, and love it while we’re doing it. All the good upper management left when the new CEO entered the picture, and now they are left with “leaders” who have had no or very limited journalism experience who are riding the coattails of their very talented and hardworking worker bees. These worker bees are constantly being given lofty, vague goals with no plan or guidance on how to reach them — because again, the leadership don’t know what they’re doing. 
 
 There is no consideration for work-life balance or even serious events in your personal life. Don’t count on coming here and finding any support if you need to take any time off for an emergency. If you can’t find your own coverage, sorry, you’ll be working through your emergency. The same goes for vacations. You’ll be bullied into working long hours every day and on weekends. 
 
 Promotions are completely arbitrary. If you’re the type of person to not complain, keep your head down, and work hard, expecting that your good work should speak for itself, tough luck — you will never get a decent pay raise or promotion. If you are the type to bring up concerns and give constructive feedback, you’ll be told you’re being too negative and should focus on the positives (basically meaning that at least you have a job), and that will be that. 
 
 People are leaving in droves, because we all know this is a sinking ship. Stay away."
63,WebMD Health,Challenging but rewarding,2021-10-13,3.0,Medical Copy Editor,"I learn something new each day that helps me grow professionally and even personally. It's a challenging work environment, but rewarding.","The departments seem understaffed, so everyone has a highly demanding volume of work."
64,WebMD Health,Great company to work for!,2021-10-11,5.0,Anonymous Employee,Great company to work for. Great work/life balance!,I can't think of any.
65,WebMD Health,not sure,2021-10-08,3.0,Senior QA Analyst,"easy work environment, interesting product","low company morale, unreliable managemenet"
66,WebMD Health,If you value your sanity... keep looking for other opportunities...,2021-10-08,1.0,Health Coach,Benefits such as PTO and health care coverage are good. You can get certifications.,"Everything else.

Prepare to be be put in the roulette wheel for calls. What you get no one knows. Your metrics will be held against you whether it is productive available work, or the busy work that can potentially be a greater part of the hour. 

Prepare to cold call for long stretches of time- and that will be held against you. In times of scarcity, prepare for layoff. In times of plentiful work, prepare for ""Mando"" overtime. This was ongoing for 10 months. If you do not do it, it is held against you. Even if the management was late to the game on the request in the month. 

Prepare to talk nonstop for your shift. You will be exhausted.

This company loves to micromanage to the fullest extent of the word. 

Hope you are competitive. Everything is a competition here. They pose it as friendly competition, but is it really friendly if everyone is scrambling for the available work.

This should be a great place to work. That is in theory alone as operated currently. 

I would have ranked things lower than 1 star, but the system wouldn't let me."
67,WebMD Health,good job siloed,2021-09-23,5.0,Deployment Engineer,good job very siloed environment and mandatory oncall,very siloed had place to fit in
68,WebMD Health,Salary,2021-09-21,3.0,Anonymous Employee,It was not good . No pros,Boring job. Low pay. Ride management
69,WebMD Health,"Fast-Paced, Good People",2021-08-31,4.0,Manager,Wonderful people to work with.,Cultural change underway due to acquisition by Internet Brands. Some staff are finding it hard to adjust.
70,WebMD Health,Look elsewhere if possible,2021-08-31,2.0,Anonymous Employee,Looks good on a resume,"Upper management and CEO are completely out of touch with the company and their employees. They make constant changes to company/department structure and the people who are left in charge to implement these changes have no idea what they're doing. 

Training for my role was non-existent and my manager (if you could even call them that) was a prime example of the worst type of manager you could be. Disorganized, lackluster, and did not make you feel as if you were part of a team. Also did not hold anyone to a standard as employees would make constant, detrimental mistakes and the manager wouldn't bat an eye. What type of message does that send to others who are working OT and executing their work to a high standard?

I could go on, but a few other cons are that salaries are below average, career development is tough and work-life balance can be tough."
71,WebMD Health,"Solid company, great opportunity",2021-08-15,4.0,Web Content Producer,People are generally nice and happy with their jobs. I'm grateful for the good pay and benefits at a solid company with brand recognition for my resume.,"The work can be monotonous, but in times like these, it's comforting to have a stable job. There isn't much room for moving up in some departments."
72,WebMD Health,Great,2021-07-30,5.0,Multimedia Specialist,"Lots of pros here, great people, nice place to work, more words so I can use Glassdoor",I wouldn't say there are many cons working at WebMD as a multimedia specialist or other multimedia roles
73,WebMD Health,Constant change,2021-07-25,3.0,Anonymous Employee,You work with great team mates who can help you bear deadlines and sometimes-unrealistic deadlines. Decent benefits.,Company is undergoing tremendous changes and upheaval. Lots of new folks at the very top lack true understanding of how the company functions.
74,WebMD Health,Good company,2021-07-25,4.0,Costumer Service Representative,Best manager in the industry,High pressure and extra work
75,WebMD Health,Do not recommend,2021-07-22,2.0,Associate Director,There are some fantastic people that are very committed and bright.,"Weak 401K
Not enough employees for the amount work to be done
Very stingy with merit increases
The awarding of merit increases and bonuses is unstructured. It puts too much pressure on managers not to have a clearly outlined process. 
Some employees are not eligible for bonuses - ASK before you accept the job. You'll be required to work just as much as everyone without the reward.
A lot of employee turnover"
76,WebMD Health,Nice Place To Work,2021-07-16,4.0,Multimedia Producer,Hybrid work from home and office. Positive team culture. Interesting and informative content.,"Career development is lacking, job mobility is limited, and salaries average a little below market rates."
77,WebMD Health,great place to work,2021-07-14,5.0,Health Educator,"great people, great pay that is hourly","communication could be better, periods of mandatory overtime"
78,WebMD Health,Excellent Company.,2021-07-14,5.0,Analyst,"- Great benefits. 
- Very supportive upper management. 
-  Opportunity to learn & grow.",None that i can think of.
79,WebMD Health,Not the best place to work,2021-07-13,2.0,Senior QA Engineer,Nice people and smart engineers,Toxic workplace. Management was sub par.
80,WebMD Health,Good experience,2021-07-12,4.0,Anonymous Employee,"Beautiful office, great coworkers. Room for growth within most departments, but not all.","Since being bought out by Internet Brands, corners have been cut to save money and it shows. Turnover seems to be getting slightly higher."
81,WebMD Health,Average at best,2021-07-07,2.0,Anonymous Employee,"Your team, though that's entirely up to luck depending on your function. Easy to coast by if you wanted to due to the size of the company.","Ever since the buy-out, it's been downhill. It seems like expenses are being cut left and right, whether that be in the form of amenities or people."
