,company,headline,date,overall_rating,author_position,pros,cons
240,WebMD Health,Management is disconnected from the subject matter experts.,2018-05-19,2.0,Anonymous Employee,There are very strong employees there who are great to work with.,"Management doesn't value WebMD Health Services. It is managed and budget controlled by executives who don't know or understand the business as they work for another part of the company.

There is little investment in WHS. You will not have much room or ability to bring in modern or needed products and solutions to make a difference.

WHS is managed as a cost center to keep costs minimal. There is little effort to solve problems with financial support. Instead employees will be asked or it will be implied that they have to cover multiple roles instead resourcing projects and efforts normally.

The people who control the budget rarely if ever actually visit the WHS office so they make decisions based on little personal knowledge of the business."
241,WebMD Health,employee,2018-05-15,3.0,Anonymous Employee,"Great co workers
people really make coming into work bearable
health benefits offer flexibility","401k nothing to brag home about
a lot of politics in meetings to move the agenda forward
More often then not best employees will get overlooked"
242,WebMD Health,Strategy,2018-05-12,4.0,Director,Good opportunity to work in a variety of therapeutic areas,Poor work life balance at this company
243,WebMD Health,Full of possibilities,2018-04-10,3.0,Anonymous Employee,Generous time off; flexibility to explore other roles/responsibilities.,"There's a lot of potential for what we could do, but there's high turnover and not much alignment in leadership. It's improving, slowly."
244,WebMD Health,Associate Software Developer,2018-04-10,5.0,Associate Software Developer,"Great coworkers. Lots of very smart people. I wake up every morning excited to come into work. They treat you like an adult here. No one is watching the clock to see what time you come in (as long as you're not abusing that privilege :P) Tons of perks as well! AMAZING view of Portland, kick-ass barista robots that make you free coffee, and tons of cheap vending machine options (subsidized, so everything is around $.25-$.50), AND free fresh fruit. Seriously, this place is amazing and I've loved every minute so far.","I haven't had this issue, but I hear parking can sometimes be a problem."
245,WebMD Health,Programmer Analyst,2018-04-04,4.0,Programmer Analyst,"java based test scripts, testNG, selenium has made life easier",networking and server bugs sometimes very hard to trace
246,WebMD Health,Downward spiral,2018-04-04,1.0,Senior Editor,"Very attractive open office space, some really nice people. Free cereal and fruit. Weights. Decent but pricey daily meal selections. Free coffee. Windows can be seen from most desks. People below management are good people.","Recent take over has killed the vision, integrity, quality, trust, morale and culture of this once-great company. They boost morale through silly fake efforts like free cheese and seminars, when the best path to good morale is not selling out."
247,WebMD Health,Straight Out Of The 90s,2018-03-28,1.0,Associate Director,If you plan to retire within the next 3-5 years and just want to mail it in everyday - this is a great place to work.,"Good old boy network - Was asked to secretly to give strategy advice to Board of Directors children to further their careers

Seniority based - you will be reporting to someone with no actual digital experience, but has made the right friends within the company and has been there for 10+ years

Completely Insular - they make up their own definitions & meanings for industry terminology and best practices

Delusional - firmly believe they are a cutting edge health tech company, when in reality they're just another publishing company (clearly evidenced by their recent acquisition) 

Secretive - it' common practice for different groups to work on the same projects in secret with the hopes they get a chance to present to the CEO and get a a pat on the head. Unless of the course the project fails, in which case, they already have scapegoats lined up.

Powerpoint hell - no communication can occur without a powerpoint. Powerpoints about powerpoint is quite common.

More layers than an onion - You could be working on a project for months and someone from some other department could say no I don't like that (usually this person will 0 experience in the field they are commenting on) and poof just like that your project is obsolete. No one really knows how it works over there. 6-8 weeks to get a color approved for a button is the norm."
248,WebMD Health,Global Content Supervisor / Senior Medical Writer,2018-02-27,5.0,Global Content Supervisor/Senior Medical Writer,"All digital, excellent people, great MD audience","No cons, all good, lots of work"
249,WebMD Health,"Director, Strategic Accounts",2018-02-22,3.0,Anonymous Employee,Great Brand  and excellent content,Very political with management and account structures.  I had 10 managers over 4 years.  One of the higher managers is verbally abusive and very unprofessional.  He is not being held accountable.
250,WebMD Health,Operations Director,2018-02-22,3.0,Sales Operations Manager,"Easy to work with people, good work/life balance, food/drink perks, can work remotely when needed, healthcare and wellness focused","Weak leadership, no team ""pride"", over-reliance of e-mail usage, prolonged timelines and ability to execute undertakings, workers are taken advantage of"
251,WebMD Health,Customer Service Representative,2018-02-14,5.0,Anonymous Employee,"great brand name, provides independent health information",no more cheese and yogurt
252,WebMD Health,Tech Lead,2018-02-07,4.0,Tech Lead,Good benefits and working environment.,Hard to work with other teams inside WebMD.
253,WebMD Health,Absolutely the WORST career experience ever!!!!,2018-02-02,1.0,Anonymous Employee,Decent benefits... I met some hardworking and good people. Unfortunately most of them left. The few that are still there should leave. I made a huge mistake taking this job...,"No work-life balance. You will spend hours into the night and get no support. Things constantly change every time you turn around because upper management is clueless and incompetent and never know which direction they want to go. Managers can not be trust AT ALL. They lie, backstab you and berate you in order to feel powerful and get ahead. They nitpick you for everything; you will never get any praise for all the hard work you do. Don’t bother complaining to HR either. They will ALWAYS take the managers side no matter what, even if they say they’re “neutral” It’s an extremely toxic environment that’s gossipy and childish. They will review you based on gossip, not performance. Your health will suffer here, physically and mentally. I had to start therapy because of this place. BEWARE!!!!"
254,WebMD Health,Health Educator,2018-01-29,4.0,Health Educator,"Great benefits, work life balance and great atmosphere","Long periods of sitting, not a lot of room for career advancement"
255,WebMD Health,Struggling to be seen as innovative but they follow not lead the industry,2018-01-29,3.0,Anonymous Employee,"- Great work life balance but that isn't universal. It varies by dept.
- Great name to have on your resume as it is highly recognizable.
- People are great and willing to help you out.
- Nice perks prior to the interbrands/KKR buyout. All those are gone now.
- Ability to learn different aspects of the business
- Bonuses, health plan and 401K","- Several people are comfortable hence they don't really put in 100%
- Lagging behind on innovation. They analyze the competition and adapt for internal use. 
- In all my time there I only received actionable feedback once the rest of the time management didn't bother to fill out their portion of the performance eval and feedback was ""keep doing what you're doing""
- Product development is based on what they want to sell versus based on client unmet needs
- Lack of vision on the senior leadership side. They love to hear themselves speak but don't leverage insights that mid-level staff can provide in terms of trends, unmet client needs, etc.
- Noncompetitive salaries and pitiful yearly  raises. 
- Zero to little commitment to career growth. They don't strive to develop or nuture their mid-level staff."
256,WebMD Health,Relax!! There's a light at the end of the tunnel!,2018-01-27,2.0,Engineer,"There's a non-zero possibility that we'll deliver on the new fancy product and that light is just going to be a blue sky summer day! Ah ....
- Nice folks
- Free fruit
- Team lunches every now and again
- We usually get a yearly bonus","Or maybe it's a freight train ...

The possibility of great severance pay is retaining a handful of skilled old timers that still know the legacy system. We're working on the new product with a skeleton crew trying to meet IB ""milestones"".  I wonder happens if we miss one?   :-)

What else ...
- We generally don't support the old product that makes us money because there aren't enough resources or someone is out of favors. Sorry, nope! The client department is also not allowed to communicate directly with engineering resources.

- Raises are generally less than cost of living.

- If you don't need a guaranteed income, and like to work under the gun, this is a great opportunity! Get ready to run!"
257,WebMD Health,"It's been rough lately, but the future is starting to look up.",2018-01-25,3.0,Anonymous Employee,"Good location, good people, opportunities to grow.",Lot's of change and rebuilding.
258,WebMD Health,A great place for the incompetent,2018-01-25,2.0,Publisher,"Great pay, relaxed atmosphere,","Garbage technology, idiots around every corner, 1% of the workforce does 99% of all work."
259,WebMD Health,Caustic and spirit killing environment,2018-01-23,2.0,Anonymous Employee,"It used to be a place that you worked at because you loved the people you worked with.  However, it isn't so much like that anymore.  Free snacks (unless that was axed by IB).   Benefits are just ok.  Pay is average to low.  Used to be a good place to get experience for a first job.  Because of the salary cap on promotions, they are usually happy to hire within up to a certain level, so they don't have to pay market value.","The majority of the pros are gone. Most of the really great talent was laid off and/or quit during and after the IB/KKR buyout.  They can't decide if they are an agency, a start up or a corporation - so they try to be all three at the same time, and it doesn't work. 
People were already overworked before buyout/layoffs.   Culture is not inclusive.  Teams/coworkers are ""clicky"" (including staff/managers having affairs with each other).

Technology is way behind, so you won't learn anything new here or get experience that will help you get a job going forward.  They cap salary increases for promotions, so the only way to stay at a market salary is to leave after a couple years.  They will hire someone outside of the company at a much higher salary than someone within.  They do not do anything to value and keep their current employees and/or invest in good talent.  Management has no interest in historical experience.

Mid to upper management is mostly a boy's club, and they take care of their own.  All that matters is being able to manage up and be a good ""talker"" to get ahead.  Most of the mid and upper management could care less about their employees and really don't care much to even manage across, much less down.  Actual hard work and action is not really appreciated.  Coworkers can be incredibly gossipy, competitive and back stabbing to get ahead.  Sadly, most of the good managers that were supportive of their staff were laid off."
260,WebMD Health,Need further support for employee growth,2018-01-15,3.0,Analyst,Great brand. Reputable and respected.,Not enough focus and support for employee growth and promotion
261,WebMD Health,WebMD Health Services - The people make it worthwhile...,2018-01-11,3.0,Anonymous Employee,Really amazing people.  Great community volunteering program and a focus on healthy lifestyle.,Business cannot seem to decide which direction it wants to move in.  The whims of the clients seem to end up driving most initiatives.
262,WebMD Health,Project Coordinator,2018-01-11,3.0,Anonymous Employee,"Great people, great  health insurance",No growth opportunity. New management flipped too quickly
263,WebMD Health,Anonymous,2018-01-10,2.0,Anonymous Employee,"Some of the best, most creative, and amazing coworkers I have ever had.  Great things like healthy snacks and lots of fun events. Flexible schedule and nice office","It’s a sinking ship and bleeding talent.  The products are very outdated and the sexy new product solution has been pared down to be nothing more than a repackaging of the old products.  Clients are terminating their contracts and there have been no real new sales in 2 years.  

If you work there now, start looking - unless you want to end up competing with everyone else when the inevitable happens.  If you are considering this as a new employer just know that it likely won’t be long term"
264,WebMD Health,Great experience,2018-01-03,3.0,Anonymous Employee,"Great employees, environment, pay, amenities, concepts, training, events.","Health Benefits, unstable executive management, restructuring, loss of tribal knowledge of product due to turn over"
265,WebMD Health,Soul Destroying,2017-12-19,1.0,Anonymous Employee,"Free fruit, subsidized vending machines.","Recently purchased = multiple rounds of layoffs. Clients leaving. Some great people but many (including ""leaders"") who are nothing but bullies. Hasn't produced a clinically-sound product anyone would want to use in 4+ years."
266,WebMD Health,"my experience as a black engineer,...",2017-12-12,3.0,Senior Web Developer,The company lives up to it's name with the amount of benefits offered.,"I have never been so racially profiled, and scrutinized in my lifetime. The Indian engineers were very jealous of me, and although I completed every task handed to me efficiently. I was followed, and harassed."
267,WebMD Health,Medical writer,2017-12-11,1.0,Anonymous Employee,It's a reputable company to work for,It can be a tough environment at times
268,WebMD Health,Run away as fast as you can,2017-12-07,1.0,Associate Director,"Decent benefits, though not much that stands out from other like companies.  Decent Summer and Holiday parties, though those may go away not that InterBrand has taken over.","Unachievable production demand. They recently went through a massive lay off  blitz (10% of the company) after the CEO stated earlier in the year that everyone was safe with the InterBrand purchase. 

Management is extremely cut throat and work to save themselves rather than to make the business better.  They've gone from bad to worse with the recent reorg, placing all of the snakes at the top, and everyone else is just a number. 

Very little room for growth, and there is absolutely no culture at all. Lowest morale out of any company that I've ever worked for.  No one is happy."
269,WebMD Health,It was good while it lasted,2017-11-30,2.0,Anonymous Employee,"free fruit, low cost snacks.  Brilliant and talented co-workers.","Requiring an individual to do the job of 3 people.  No direction. No transparency. 
Applications so far behind it is embarrassing.   Incompetent management, they do not understand the business or even what we do here and they don't care to.."
270,WebMD Health,QA Consultant,2017-11-24,2.0,,Great location in downtown Inside Google building. Chelsea location easy to get too.  Learned a lot about Offline testing challenges for the iPhone Allergy Application. A lot of other testers in own Q A department,Short term project was only three months long and did not have enough time to make the software perfect the Allergy App had some features that did not make it.
271,WebMD Health,Health Educator,2017-11-20,2.0,Health Educator,Good benefits and paid time off,No career growth.  Productivity has become almost impossible to keep up with since they keep raising it. Very sedentary job for being a health educator position. Most people here don't practice what they preach.
272,WebMD Health,Lead,2017-11-18,3.0,Anonymous Employee,Lot of good opportunity to learn and grow,Changing management and confusion from the changes
273,WebMD Health,Senior Program Manager,2017-11-13,2.0,Senior Project Manager,Exceptional smart people who are good at their jobs,Management tends to focus on the negatives instead of recognizing positives
274,WebMD Health,Lot of polictics,2017-11-12,1.0,Software Engineer,Some good managers recognizes your hard work and encourages.,Need to play polictics to get promotions. Hard work is not recognized by some new managers.
275,WebMD Health,Great Company,2017-11-10,4.0,Tech Support,Good mission. Nice people. Helpful team.,Slow to implement improvements.
276,WebMD Health,Not a Well Run Company,2017-11-08,1.0,Marketing Manager,Team members at my level were great and people are eager to help,Workload includes a lot of busy work that managers shouldn't have to deal with. Other teams are flat out unwilling to help get things accomplished unless you involve upper management. Almost no opportunity for advancement unless you've been there for five or more years and are willing to play the politics game with people with 10+ years of experience.
277,WebMD Health,"Dont trust the ""New"" amazing reviews",2017-11-01,1.0,Anonymous Employee,"decent bonuses, Great offices and good brand","absolutely toxic, back stabbing environment.
The upper management have ZERO care of employees and its made obvious in their flippant statements and attitudes.

total 70s style management.

The new reviews are coming due to HR requesting employees to do them for damage control....gotta get that Glassdoor score up."
278,WebMD Health,program manager,2017-10-25,3.0,Anonymous Employee,"great benefits, great brand.",The culture takes getting use to..... and not in a good way.
279,WebMD Health,Great place to learn and build your career,2017-10-22,3.0,Marketing Manager,The people you work with are some of the best in the business.,You come across a lot of situations where different teams are moving in different directions and there is a lack of communication.
280,WebMD Health,"Unless you are entry level, don't waste your time...",2017-10-13,1.0,Anonymous Employee,Free food & infused water. Great office (space & location). Company name on your resume will get you attention from recruiters.,"Upper management is horrible. Mediocrity is rewarded here, especially if you are in the ""cool"" cliques of the office. No real training, no real path for growth, & huge lack of respect from upper management. Watch out for sly & dishonest coworkers & upper management."
281,WebMD Health,Mismanaged and lack of vision,2017-10-08,2.0,Anonymous Employee,Snacks if you aren’t allergic to nuts or lactose intolerant. Fresh fruit and barista bar.,Upper management is too involved in the little work (links and text). Talent is walking away because nobody is listening and employees are put last. 4 & 5 star glassdoor reviews are clearly fake with generic pro and cons. This should tell you how the company runs from the truth.
282,WebMD Health,Positive experience,2017-10-07,5.0,Anonymous Employee,"Flexibility, ability to work from home, good work/life balance",Can't think of any at the moment
283,WebMD Health,Great Company,2017-09-26,5.0,Finance Intern,"incredible staff, incredible environment, incredible experience",I do not have any cons
284,WebMD Health,Health Services,2017-09-19,5.0,,"positive environment, great support from leaders",work hours are not the greatest
285,WebMD Health,Great first job,2017-09-17,4.0,Sales Operations Analyst,"Nice company atmosphere, very casual, lots of small in-office perks","Few opportunities to advance yourself and your career, management very slow to accept suggestions for change, some employees linger, even when no longer assets to their teams."
286,WebMD Health,"No strategy, no vision, no direction",2017-09-12,1.0,Anonymous Employee,"I truly enjoy some of my colleagues.  There are a few people left who actually care about the company and want to do their best. There are many talented people, passionate people, who are not given an environment to thrive to their fullest potential.","Top level leadership has no vision, no strategy. We are pimped out to the highest bidder for every shiny new object that comes into somebody's mind.
No business justification for taking on work, product team just says ""yes"" to everything. The product team is nothing more than order takers and they don't own, drive or innovate any of the products. 
People are not empowered, they are held down, held back. They are stifled.
Crappy people are hiring clones of themselves further polluting the organization.
Resistance to improvement or any kind of positive change. No learning opportunity, no growth."
287,WebMD Health,Good place,2017-09-07,4.0,Anonymous Employee,"Very fast pace place to work, everyone there was very easy to work with and get along with.",Need more staffing in IT
288,WebMD Health,Senior Staff Accountant,2017-09-07,4.0,Anonymous Employee,"Great work-life balance 
Young, tech feel in the office",No room for growth
289,WebMD Health,Unless you're desperate for employment look elsewhere,2017-09-06,1.0,Anonymous Employee,Maybe 5 years ago there were good things to say.....,"- Company is being sold
-If you're an engineer then this is not a place for learning. 
-Not cutting edge
-Managers are out for themselves and point fingers at there team and fire the employee rather questioning there own lack of management and direction"
290,WebMD Health,Worst career experience ever,2017-08-31,1.0,Anonymous Employee,Cool office space & location; some smart people,"The whole place was ruled by favoritism and working to the lowest common denominator. Leadership was by CYA and anyone who tried to really make positive strides forward was shot down hard. It was the most toxic and negative environment I had ever experienced in multiple decades in the workforce. Even with serious challenges presented to them, they were resistant to new ideas and VPs and up only seemed to like the folks who pandered to them instead of the ones who had actual ideas and experience to back it up. 
As a culture and what WebMD Health Services is all about, it gave nothing but lip service to it all. It did not cultivate its people in any way."
291,WebMD Health,Ehh....,2017-08-23,3.0,Anonymous Employee,Great office.  Nice People.,"Managers and supervisors are cliquey and clueless. No real training. Office politics. ""Do as I say & not as I do""- type attitude from upper management. No real path for growth."
292,WebMD Health,Sr. Financial Analyst,2017-08-22,3.0,Anonymous Employee,You might like working here if you're passionate about health & wellness.,"If you like a real work/life balance, this may not be the company for you."
293,WebMD Health,Physician Marketing At WebMD / Medscape,2017-08-21,4.0,Marketing,Unparalleled physician audience; strong sales team; opportunity for product innovation,Highly political environment and limited transparency
294,WebMD Health,Good While It Lasted,2017-08-05,3.0,Lead Quality Assurance Analyst,"Always plenty of work to do.
Open to doing things in new ways","Bad management
Spent WAY too much on the new office space
Upper level management is clueless"
295,WebMD Health,Strategic Account Director,2017-08-02,1.0,,"Well known company, but for the wrong reasons.","Horrible place to work.  Outdated platform.  No innovation.  Most employees are overworked and miserable.  Old school, used car salesman, selling style.."
296,WebMD Health,"The reviews from 2016 are spot-on, and it keeps getting worse",2017-07-27,1.0,Health Coach,"Health insurance is quite good, as is time off.  There are occasional opportunities to work OT and make some additional income.","Productivity increase of >35% in 3 years versus pay increases in the 6-11% range,
Having to be leashed to a chair for hours on end to make ever-increasing productivity requirements,
Very inept and unqualified management, 
""Quality"" assurance practices that are not focused on the participant and don't serve the business model well, 
A company that continues to contract instead of expand,
Advancement opportunities are limited to those who are friends of the boss (we recently had someone promoted to supervisor who was on a PIP) instead of people who are actually qualified,
New ideas are ignored and unwanted unless they increase productivity."
297,WebMD Health,Director,2017-07-26,3.0,Anonymous Employee,"Flexibility in schedule. Complimentary snacks, tea and coffee. Espresso bar is really nice.  Benefits are solid. Reimbursement for expenses is fast.  Name recognition can't be beaten, allowing for easier discussions with prospects and clients. Not a lot of micro-mgt in terms of travel to get the job done.  Finally, after years of neglect, making a decent run at upgrading technology to be competitive in the market.","Onboarding and initial training can be weak. Mgt can be, at times, indifferent towards the need for info and help, sometimes saying ""go get the info and do this."" Technology lag has hurt the business with prospects and clients and remains a problem for near-term."
298,WebMD Health,Editor,2017-07-22,3.0,Anonymous Employee,The benefits are decent enough.,"Over the few years , inconsistent management directives."
