,company,headline,date,overall_rating,author_position,pros,cons
512,WebMD Health,"Overall Positive, needs some improvement",2015-04-14,3.0,Senior Web Developer,"Great work life balance. I get my work done in a timely manner, and that allows me very flexible hours.",People like to try and do other people's jobs. A CEO shouldn't try and be a designer and a project manager should not try to be a developer.
513,WebMD Health,Publicly-traded company that is run more like a family business,2015-04-03,3.0,,"Known brand.  Pockets of good people as you'll find at every mid-to-large size company.  You can rationalize that you're helping people as you walk in the doors each day.  If you work under the right circumstances, it can be a good existence, e.g., remote employees who don't need to face commuting time or expenses.","Hijinks and arrogance start at the top.  CEOs eventually fall out of favor, and provide for ""you can't make this stuff up"" type of stories.  The only one from the outside lasted less than a year, and was the only one that would make eye contact, smile, or engage much with the rank & file in the hallways.  Executive ranks have always leaned heavily towards having to show both employees and customers that they are the smartest in the room.  HR is squarely in the transaction business. Mediocre health policies, e.g., maternity leave, for such a well-known health company.  Tough place for a middle-manager to come in and crack successfully.  Ten-plus company values are posted but you'd be hard-pressed to find anyone that can off-handedly name even a couple of them.  A 'morale' committee was formed several years ago but disbanded due to lack of morale.  Supposedly there is robust attendance at ""WebMD Survivor"" parties that occasionally happen.  A certain cluelessness is exemplified by this occurrence, when a politically-incorrect comedian was once flown down for a sales meeting to roast a sales executive about his arguable interpersonal shortcomings."
514,WebMD Health,"Great place to work, once upon a time",2015-03-26,1.0,Anonymous Employee,"The editorial team and editorial leadership are outstanding.
Wonderful, talented, collaborative developers, publishers, PMs and designers on the 21st floor.  This is a staff that can achieve the unachievable. I have the highest respect for the worker bees.","Real leadership on the 21st floor is nonexistent.  It's a perfect environment if you like to work 50-60 hours a week and not be rewarded or thanked for your efforts.  Beware of sharing an original idea.  If you do there are one of two outcomes that will happen.  The first you'll be punished for speaking up or two, if it's a really good idea it will confiscated and communicated as someone at a VP's level idea."
515,WebMD Health,I wouldn't recommend WebMD,2015-03-19,1.0,Anonymous Employee,"A great company to have on your resume so it makes a decent stepping stone. The office is in a cool building. Besides those, not a lot of other Pros.","The culture is abysmal and fuels constant turnover. Apparently this has been the case for years, which explains the low tenure across the entire organization."
516,WebMD Health,"Worked hard, learned volumes, yet have little to show for it",2015-03-18,3.0,Anonymous Employee,"Office culture can be relaxed and reasonable at times. Depending on your manager, there is flexibility with regard to schedules and telecommuting as long as work is done. Benefits are decent.","Lack of clear path of growth for many positions, and resistance to hiring from within the Company. There are many employees who do not feel valued or appreciated because of this. And forget about approaching HR for support. They are not your advocates."
517,WebMD Health,Company Review,2015-03-18,2.0,Anonymous Employee,"The people at WebMD Health Services are outstanding - very dedicated, hard workers who really care about the work they do.","Frequent layoffs, micromanagement by Corporate.  Seems like my peers lived in fear of being laid off on a regular basis."
518,WebMD Health,"WebMD is top-ranked in horrible management, abuse of its employees, lack of vision, and lack of execution.",2015-03-11,1.0,Manager,"There are some passionate, smart people who come to WebMD inspired by a mission to help people be healthier - almost all of them are new employees who haven't figured it out yet (but give them 6 months and they will get embittered and start looking for a new job).","Advice to people looking at jobs at WebMD Health Services: 

1)  Do not take a job at WebMD unless you really need to.  It is a very dis-spiriting place.  You will waste your talents here.
2)  If you do take a job at WebMD, do not stop looking for other jobs.  Virtually every manager and above is openly looking for their next career - many of them successfully so.  As proof, take a look at the turnover rate among senior management - it is incredibly high.
3) Once at WebMD, do not trust HR or senior management in Portland.  I've seen several people burned as a result. Glassdoor's editorial policy asks for no ranting... So let's just say that there are some in the senior management team who are in over their heads, and treat their employees in less-than-kind ways.
4) Expect layoffs.  There is a grand tradition of December layoffs.  It is WebMD's way of celebrating the holidays.
5) Expect revenue shortfalls (at least for the WebMD Health Services division).  There will be pressure on raises, bonuses, funding of projects, etc.
6) Expect disfunction between the division-level management team in Portland and the New York management team.  As a result, projects will get approved, then dis-approved.  Promises will be made and unmade because of poor NY-Portland communication.

Final piece of advice before taking a job at WebMD.  Find someone who has worked there for a few years first.  Buy them a drink, and encourage them to be open about the company's prospects.  Then make an informed decision (oh, and by the way... WebMD retains a reputation management firm that posts fake posts on glassdoor and other sites - you can usually spot them by their brevity and the fact that the ""con"" comments are vague or not really ""cons"".  Read some of the shorter posts with a critical eye).

It is a shame, really.  WebMD has been in a position to do great, meaningful work, but have time and again missed the opportunity.  Take your talent to a place that can use it effectively."
519,WebMD Health,"Upper management and HR are all about CYA (their own, not their employees)",2015-03-10,2.0,Anonymous Employee,"Don't get me wrong, there are some great people in leadership positions at the company, and they have been great mentors to me.
There are many people there that are very smart, dedicated, and extremely hardworking.","People don't get compensated properly, there's tremendous disparity in how people get paid, I've seen it as a manager, and tried very hard to correct it, but the company just doesn't have the money to bring underpaid employees up to market value, so if you're at WebMD and feel that you're underpaid, you probably are and shouldn't hold your breath.
Sales people sell things to clients without making sure the infrastructure exists to properly implement because they're so afraid of losing the business, and then when the implementation goes wrong, the implementation teams are to blame.
HR doesn't care about the employees.  They're extremely inflexible and are basically afraid that giving an inch will lead to litigation down the road.  It wasn't always like this..."
520,WebMD Health,"A good fit for some, but not all.",2015-03-04,3.0,Anonymous Employee,Salaries tend to be good.,Internal company politics were messy.
521,WebMD Health,This company has a great vision that many times is unmet by platform and technology constraints.,2015-02-10,3.0,Client Advisor,Everyone is open to lending a hand in asked and sometimes without even being asked.  Many employees have been there for many years and are very loyal.  The company as a whole is becoming more wellness-driven again and having more fun but for a while they did seem to be in a slump in this regard.,"The environment appears very collaborative but people, for the most part, keep to themselves.  It really depends on the part of the building which you work in how it might differ but this has been my experience overall."
522,WebMD Health,Great company to work for!,2015-02-05,4.0,Senior Project Manager,"People make this company unique.  Great benefits, work-life balance.  Management is interested to keep employees equipped with everything they need ( training, corporate business card, latest laptop, iPad - you name it).",New management brought a lot of distress and confusion where lots of people ended up being laid off for no reason. Business decision sounds strange to me if in few months you have the same openings available for hire.
523,WebMD Health,"The product was extremely valuable, but the pursue to sell it was demeaning to internal staff and customers",2015-02-03,3.0,,Market leader with tremendous marketing and services to health care stakeholders,Culture of blame and negativity
524,WebMD Health,no room to grow,2015-01-29,2.0,,You'll be rewarded in free food often. There is some flexibility to work from home. The company will pay for courses related to your job. You can speak to a health coach and do other healthy activities to save money on health premiums.,There's a lack of room for career advancement. Titles are bumped down so you are undervalued so if promoted you'll be back at your starting title. Tools are antiquated.
525,WebMD Health,Good as a stepping stone,2015-01-22,4.0,Community Manager,"Interesting programs, innovation, directly and peripherally helping people, strong company history and culture and name recognition. Good benefits and fair wage for the work done.",The upper leadership (Director/VP) churn was IMMENSE. The average time they seemed to last was 8-10 months before moving to a new position. This constant churn led to a lot of uncertainty for underlings and a lack of coherent focus. It also meant you could have worked on an excellent project with strong results that was completely unrecognized by the next person who came in. Most employees have a constant fear of being fired due to the churn.
526,WebMD Health,Upper management is disconnected with employees. Everything is a fire drill.,2015-01-20,3.0,Anonymous Employee,Everyone starts off with sense of purpose and helping people. Many employees still maintain that spirit.,Poor work-life balance. Many people don't use all their vacation days. Every project is treated like a fire drill. Poor leadership in upper management. People running around working like crazy to meet deadlines and then upper management decides to table the project or change it's focus. Difficult to move up if you are not chummy with the inner circle and threaten others with your potential
527,WebMD Health,"Great Place, Great People",2015-01-14,5.0,,A seriously talented and motivated group of people who are smart and fun.  Lack of politics - a real 'get down to business' feel.,NYC where there is a relatively high cost of living.
528,WebMD Health,Great Resume Builder.  Not a positive place to work,2015-01-04,2.0,RN Health Coach,"Brand Name 
Great frontline people 
Bonus
Good Entry level if you're fresh out of college.","Hours
Horrible management-Micro managers
Mandatory Overttime due to understaffing 
Poor morale
Doesn't care about employee rentention
Doesn't know how to manage seasoned smart professionals."
529,WebMD Health,Do not apply if you like communication,2014-12-15,3.0,Manager,Competitive Salary.  friendly co-workers,"Managerial communication skills are poor
Organizational changes are frequent and poorly communicated
Upper management is heavy.  Practically everyone is a director or manager (regardless of whether or not they have direct reports)
Teams are spread too thin so getting attention from other teams is fairly impossible"
530,WebMD Health,Great Benefits and Perks But Still Acts Like StartUp,2014-12-05,3.0,,"WebMD is pretty good at promoting Work-Life Balance and is always looking for ways to give employees perks, additional time off, company gatherings and a sense of community.","WebMD is held back by changing priorities, fire drills, and not much communication on vision that trickles down to the worker bees."
531,WebMD Health,worked there for 6 years,2014-10-24,4.0,Anonymous Employee,good work/life balance. Good growth opportunities. People take their work seriously. Looks good on your resume.,Strategy can change quickly. You have to be flexible and and quick thinking lest you get left behind. Sometimes disorganized.
532,WebMD Health,Former Employee,2014-10-24,5.0,Anonymous,Nice place to work. Occasionally work from home is allowed. Good life work balance,Some employees are not competent and don't know what they are doing.
533,WebMD Health,My experience after 6 years,2014-10-12,1.0,Manager,None that could be uncovered.,Benefits were very much appreciated by most employees
534,WebMD Health,Eventful,2014-10-12,3.0,Anonymous Employee,People are great.  I have received outstanding managerial support,Lots of tension over recent re-organization
535,WebMD Health,Analyst,2014-10-09,3.0,Anonymous Employee,Collaborative environment. Talented people. Recognize and appreciative of good work.,Pockets of company still act like start up and the others act like big shot insurance/pharmaceutical company. Challenging to grow new hire.
536,WebMD Health,Good for entry level,2014-10-06,3.0,,A good start if you're entry level,Massive turnover due to mismanagement.
537,WebMD Health,Above average place to work,2014-09-16,4.0,Director,"Work life balance, exciting technologies, nice office","Stiff executive management, benefits are so-so, lots of pressure from executive management but lack of acknowledgement for good work.  Office culture varies office to office."
538,WebMD Health,Great place - years ago,2014-08-17,4.0,Anonymous Employee,Flexible company that valued families and didn't pressure you for running home to get the kids or to care for a sick loved one.,"Promotional opportunities were rare  and at the time it was who you knew, not how well you performed"
539,WebMD Health,WebMD Review,2014-08-14,3.0,Anonymous Employee,Good place to start a career & get the company brand name on your resume.,I recommend leaving after no more than two years; chances of promotion are low and salaries are lower than industry standard.  There is a great deal of incompetence in middle management.
540,WebMD Health,Associate Project Manager,2014-08-12,3.0,Associate Project Manager,Very smart and talented group of people.,Senior management is very cliquish. If you do not fall in you will have a tough time here.
541,WebMD Health,Enjoyed my time here.,2014-08-06,5.0,Project Manager,Pretty laid back atmosphere. Individuals are great to work with.,"Nothing really, other than I don't think I was paid as much as I should have been."
542,WebMD Health,Health Educator III,2014-08-01,1.0,Spanish Health Educator,"Benefits are awesome, a lot of vacation offered that is about it. oh yeah and free coffee.",WebMD is more interested in making profits through numbers and not really how a health educator impacts a life.
543,WebMD Health,Ineptitude At Its Best,2014-07-20,1.0,Anonymous Employee,"The location was terrific! Being in the midst of Midtown is like no other working experience. The benefits are decent, and the working hours are flexible.","Inept senior-level management; favoritism between senior-level management and lower-level employees, regardless of their inability to complete simple tasks that generate revenue. This type of treatment harbors resentment amongst those who do a great job, but are overlooked in favor of the Best Friends Club."
544,WebMD Health,"great potential, horrible leadership",2014-07-15,2.0,Director,"company positioning and opportunity, work-life balance, small company ways of working.","sales-dominant culture, more back-stabbing than collaborative, unimpressive senior leadership, all blocking & tackling and no overall strategy.  uses strength of the webmd brand as a crutch."
545,WebMD Health,Good if you work on big pharma accounts,2014-07-14,3.0,Senior Sales Director,leader in industry - all pharma companies need to use,difficult to sell anything outside of pharma
546,WebMD Health,Account Executive,2014-07-13,3.0,Account Executive,My immediate manager was great; working for a company with a good reputation helped open doors in a new sales situation.,"The company rested on its laurels; it's best days were behind it. As such, it was afraid to innovate and bring new products to market. The technology platform was old and the company refused to invest in it."
547,WebMD Health,One of the best jobs I've ever had,2014-07-04,5.0,Anonymous,"Very friendly, smart, dedicated colleagues. No one is looking over my shoulder. Liberal with work from home days. Competitive salary. Very little overtime. Office closes early the day before holidays. Demonstrated value of work-life balance. If you show that you are responsible within the scope of your job, it is recognized and appreciated...I feel like my managers want to make sure I have everything I need. My colleagues were always available to me as a resource when I was learning the ropes. Everyone I've dealt with is eternally polite, courteous, convivial, and friendly.",I have no complaints at this time. Absolutely none.
548,WebMD Health,Lack of leadship and management,2014-06-23,1.0,Anonymous Employee,"People are generally friendly and want to help. Work-life balance is alright. Office location is pretty good. Everyone seems very aware that things aren't working well. If your manager is good (seems quite rare) or well positioned politically, things can be pretty good in your team.","Organizational alignment and strategic planning and action seem to be absent for many departments, with stock price per employee as the only mangement metric of interest. Many pieces of the technology stack are older solutions that have been shoehorned into newer requirements, and it shows. Data is bad across the organization, and while some of this has to do with general issues in medical data, there are clear gaps in data handling processes and technologies, particularly data import systems that also suffer from age.

Problems are compounded by a lack of organizational maturity. Business processes and procedures are almost entirely absent. Change management is not practiced outside of technology releases, which compounds difficulties in addressing organizational issues by making even tactical attempts to address strategic issues more messy and painful than they need to be.

Additionally, most senior personnel have been promoted from within the company. While this certainly shows dedication to the existing workforce, it has also meant that finding new (or even industry-standard) approaches can be difficult and implementing them even more so. This lack of fresh perspective is evident in repeated tactical approaches to solving recurring issues instead of strategic approaches to eliminate the cause of issues."
549,WebMD Health,"Great contributors, poor leadership",2014-06-14,2.0,Anonymous Employee,"Good work-life balance most of the time, somewhat flexible schedule with some WFH, skilled contributors, everybody in Atlanta office is very nice. Projects are enjoyable when NYC is not involved. Still a good brand somehow.","Technical stack is a joke and no one seems interested in taking meaningful action to improve it

Too many cooks in the kitchen. Execs are detached from day-to-day and swoop in at the end of projects to add input of questionable value. NYC PMO and engineering culture constantly throws their own people under the bus.

Atlanta is a satellite office and is frequently shut out of decision making"
550,WebMD Health,"Cares little about investing in employees or company, all about short-term gain",2014-06-09,1.0,Marketing Director,Great location and subsidized snacks,"The culture here is the worst I've experienced in my career.  The company has done very little to enable their employees to succeed. Innovation is stifled by too many cooks in the kitchen, diluted accountability and little investment.  To top it off, the benefits are horrendous.  The HR policy is to do the bare minimum and care little if employees raise concerns."
551,WebMD Health,Company is toxic for employees and completely lost,2014-06-06,1.0,Anonymous Employee,There are not many reasons to work at the company anymore besides for the sake of having a job and getting a check. WebMD did have a lot of smart and talented employees but many have left  for other companies.,"WebMD is completely toxic place for employees. There is no more vision and the consistent Org and departmental changes leaves one to wonder where the company is really going . Leadership keeps bringing in new management that is very sketchy, questionable and is adding more turmoil. Moral and work enthusiasm has been decimated by the management which is the type of atmosphere they foster and I severely doubt that it will get better anytime soon. 

There is no growth, advancement and do NOT expect to be rewarded for hard and good work. It is simply not appreciated, you may get a Pizza Party and a pat on the back.

Yes, the stock price went up but if you let go of half of your work force, free up the payroll, cut most of employees benefits and perks, dump the additional work load on the remaining employees, make them work double or triple and not having to compensate them for it. I would think the books should look pretty good but that business model is absolutely not sustainable and eventually will backfire.

It also says a lot if the COO/CTO of many years abruptly resigned to go somewhere else after giving employees pep talks reassuring that WebMD will turnaround and want to make things better. It is quite evident that it is not the case. If WebMD doesn't proactively change things they will lose the talent that has been shouldering all of the productivity that it has left. I didn't realize how bad it really was until I left and many others feel the same way."
552,WebMD Health,Great Place to Learn and Grow,2014-06-02,5.0,Anonymous Employee,"New Technology Adoption
Smart People
Open Environment","Time Off
Some cubes could be better"
553,WebMD Health,"Great people, great brand",2014-06-02,3.0,Associate Director,"Smart and dedicated people, trusted brand and great content","Lots of organizational and leadership changes, too many priorities without enough resources"
554,WebMD Health,Lack of growth,2014-05-05,2.0,,Coworker relationships and work life balance,Very little upward mobility for high performers
555,WebMD Health,Great Place to Work,2014-05-01,4.0,Anonymous Employee,"Sharp People, Cool Mission and well treated.",The PTO policy is not competitive and Raises are not competitive
556,WebMD Health,Not a bad company,2014-04-28,4.0,Anonymous Employee,"Compensation
Bonus
Laid back
Flexibility
Good manager
Descent time off with everything combined (starting 12 vacation, 10 sick, 10 holidays)
Free fruit, coffee","Low morale since the layoffs
Managers offsite
High turnover
Could be more vacation"
557,WebMD Health,Great Internship,2014-04-21,5.0,,Had a great experience interning for a summer with WebMD. Everyone was very helpful in making my time there valuable. Met many great people.,"No cons, working for them was a pleasant experience."
558,WebMD Health,Restructuring. Tough work environment.,2014-04-18,2.0,Client Services,"Location in Portland is great.  Many smart, dedicated people.  Decent initial salary if you negotiate effectively up front.  The content matter is genuinely interesting","Business plan and goals appear to be based on stock price rather than what is best for clients and employees.  
Upper management is moving chess pieces (employees) to keep stock price in order without a vision to manage the changes thrust into place.  Now that middle management in PDX has been eliminated, it will be interesting to see how services and implementations run.  
Some of the systems that support the health platform are really antiquated.  Dangerous for a technology solution set."
559,WebMD Health,Lost its soul and it's vision.,2014-04-16,2.0,Anonymous Employee,Many smart people who really care about the company and its success. Fairly flexible work schedule but varies greatly from team to team.,No longer cares about the people who work there. No career paths and dictates job changes to employees without thought to a match in skill set or people's desired growth.  No longer cares about the brand.  No one setting a company vision.
560,WebMD Health,"Good and bad, but depends on what you're looking for",2014-04-01,4.0,Software Development Manager,"Good work/life Balance. Medium sized company with good growth opportunities. Depending on your particular manager, they can be supportive of furthering individual career growth.",Crappy raises for existing employees. Younger employees that advance their career rapidly can have a hard time keeping up with salaries at other companies. Lots of gossip due to the size of the environment. Annual layoffs instead of firing obvious under performers through the year rattles survivors
561,WebMD Health,Back on Track,2014-03-29,4.0,Anonymous Employee,The executive management team is better now and seems to be more aligned.  Still has a good brand name.  You have to ability to get recognized for working hard.,The company still has pockets of ineffective mid level management in some key areas.  It could be a more exciting company if it embraced a more entrepreneurial spirit.
