,company,headline,date,overall_rating,author_position,pros,cons
285,ServiceNow,Working as a Technical support engineer,2021-08-24,5.0,Technical Consultant,Pros are a good working environment and a nice time,There are no cons as such
286,ServiceNow,Great place to work,2021-08-27,5.0,"Director, Program Management","High growth, awesome culture, great compensation","Can't think of anything that I don't like, honestly"
287,ServiceNow,Great place to work!,2021-08-13,5.0,Anonymous Employee,"Good benefits, company genuinely cares about it's employees, a great place to work!",Fast growing company means rate of change is higher than some places.
288,ServiceNow,Great company,2021-10-26,4.0,Associate Software Engineer,"Smart people
Good pay
Collaborative
People can be nice",First job out of college as far as I am concerned no real downsides.
289,ServiceNow,Amazing company,2021-08-10,5.0,Softwa,great company with great vision. Great teammates and amazing wlb in the tech world.,middle manager can be challenging at times. Learning can be restricted to serviceNow ecosystem.
290,ServiceNow,Decent pay,2021-11-04,4.0,Associate Technical Support Engineer,"Decent pay
Great benefits
Close knit team","Bad work life balance
Everyone is busy"
291,ServiceNow,"Good experience, lots of growth, sometimes painful leadership",2021-08-12,4.0,Engagement Manager,"ServiceNow is growing very fast, lots of opportunity for growth and trying new roles. Given lots of autonomy and the option to work from home.","Most of the growth is in customer-facing work, which can be stressful. Management can be rash in decision making and not always say the 'right thing'. Doesn't feel like you have your back covered."
292,ServiceNow,job review,2021-11-01,4.0,Anonymous Employee,it's a great all around place to work,no real cons here !
293,ServiceNow,Customer Service,2021-08-30,5.0,Customer Service Representative,"Friendly, Good salary, Great teamwork",Contract wish it was long.
294,ServiceNow,Absolutely awesome!,2021-08-05,5.0,Senior Business Process Consultant,"- Benefits are awesome
- Pay is very competitive / 
- Managers care, team is open to helping and teaching","- Really no cons so far, I am having a blast!"
295,ServiceNow,Great company on a path for enterprise software growth. The next big software company to take over the market.,2021-07-17,5.0,Advisory Solution Consultant,"Product is maturing
Hiring excellent talent
Focused on platform instead of point solutions
Excellent compensation and stock options","Legacy IT people that only sell to IT
Messaging is a bit confusing"
296,ServiceNow,Good place to work,2021-07-28,5.0,Anonymous Employee,Great environment. Feels like working for a startup in a large company.,"However, as a large company, it can be hard to feel like my efforts make a difference at the company."
297,ServiceNow,good,2021-08-03,5.0,Engineer,"good company
comp
people are great
office is very nice - great perks in office",none that I can think of. maybe comp could be better for Bay Area housing prices
298,ServiceNow,Best Career Decision I Ever Made,2020-04-07,5.0,Program Director,"A truly hungry and humble culture that values its people above all else. Seeing our CEO make a pledge that we would do no layoffs due to the COVID-19 downturn was inspiring, and a lesson in leadership. This is a company that knows it can and will change the world, and make the world of work, work better for people. And, it's people are so committed to doing so. I have never felt so proud or grateful to work for a company. Awesome product, kind people, unlimited vacation, and flexible workplace that truly works with employees to ensure they are happy, productive, and taken care of at all turns. Career opportunities abound internally for those who are self-directed and take responsibility for their own careers. I'm not sure what the lower Glass Door reviews were driven by previously - but there are no signs of trouble now. This is a company that has high accountability standards, which is a great thing.","The company is in a state of transition, moving from a  successful company to a rocketship led by a new type of leadership. Some employees are comfortable with increased levels of infrastructure required to grow a business, and others are not. You sometimes find yourself working with people who are stuck in their ways, and end up swirling before they're ready to come along on the maturity journey."
299,ServiceNow,Horrible inter office politics,2021-10-22,1.0,Contract Manager,Pay was ok at times.,"Horrible office politics, toxic environment, lack of support by management, gender discrimination, when asked by management to do something illegal I refused and from then on was set up for failure by him and ultimately pushed out."
300,ServiceNow,Great company,2021-10-25,4.0,Senior Software Engineer,"company , products, benefits and flexibility",WLB in some teams and cross country meetings
301,ServiceNow,Great place to work,2021-08-05,5.0,Software Engineer,"Great people, great culture overall a great place to work","pay could be better, benefits could be better as well"
302,ServiceNow,Fantastic Place to Work,2021-01-03,5.0,Senior Technical Writer,"Best CEO I have ever worked for.
Amazing go-go environment.
Rapidly evolving public visibility.
Outstanding work culture - great people to work with, senior management displays tremendous care for their employees.
Stock price keeps going up with the company@s continuing torrid growth.","Too much constant emphasis on DIBS, “wokeness” and political correctness, but given all the amazing qualities of this tremendous company, it’s not that big a deal. The idea behind is noble, but everyone should treat their fellow human beings with kindness, consideration and respect, regardless of who or what they are. This is simple common sense and decency."
303,ServiceNow,technical consultant salary,2021-10-18,4.0,Technical Consultant,room for growth within the platform.,evaluating worth based off time in platform rather than proficiency
304,ServiceNow,Fast moving,2021-09-22,3.0,Senior Sales Engineer,A lot of training on everything,Training is over the top. They train you and expect you to get certified at warp speed on products that you do not support.
305,ServiceNow,Great Company; Horrible Middle Management,2021-07-09,4.0,Anonymous Employee,"I truly believe this is a wonderful company to work for, they have great benefits and really put the work in as far as Diversity, Inclusion and Belonging.","I’ve heard from many people on different teams that they deal with ineffective middle management, myself included. Everyone at the Senior Director level and above is just focused on climbing the ranks and so they concentrate on bloating the levels beneath them rather than finding quality management."
306,ServiceNow,Awful work environment in marketing,2021-06-10,2.0,Content Strategist,Great pay. Solid technology company - products were in high demand,"Management was awful, changing their minds often on our initiatives and causing a lot of rework. They were competitive and fought with each other openly, teaching co-workers to compete with each other and making everyone feel anxious. Hiring was so fast-paced that a lot of people were hired into roles for which they had no competency. People often took credit for each other's work, creating an environment of distrust. It felt like a war zone."
307,ServiceNow,"Great people, great culture, great everything!",2021-06-07,5.0,Portfolio Manager,"Compensation, work-life balance, ESPP, RSU's, high growth company acting with speed while recognizing the need to build infrastructure for the future. Planning on working from home part of the week",Not enough remote work flexibility
308,ServiceNow,ServiceNow is 5 star,2021-08-01,5.0,Inside Sales Representative,Great company culture and benefits,There are no cons to working at ServiceNow
309,ServiceNow,Would recommend ServiceNow,2021-07-19,5.0,Account Executive,"Access to leadership, focus on employee wellness, career development",Can be difficult to get your foot in the door
310,ServiceNow,Nothing not to like!,2021-05-06,5.0,User Experience Researcher,"This company has it going on! The leadership team is very motivating and you can tell that they really care about each employee as a person rather than just as an employee. They promote well-being, work-life balance, and personal and career growth. Managers are also very engaging and caring. Very happy with my new SN family and role.","The learning curve can be tough, but everyone understands and is so willing to help."
311,ServiceNow,Excellent and very organized company,2021-06-29,5.0,Senior Technical Support Engineer,"1. Very organized and structured company.
2. Prepares new hires with excellent content training, and gives them confidence.
3. Strong values and customer-centric.",I have no cons at this moment.
312,ServiceNow,Good place to work,2021-07-26,4.0,Operations Manager,"Interesting projects
Lots of potential for advancement
Good pay and benefits
Co-workers are supportive and mostly open-books
Flexible time off","Leadership is chaotic and un-governed
Hero-culture that rewards for 'I saved the day!' instead of 'I worked with my team proactively and we all resolved the issue'
Initiative leaders jump into action and are rewarded for anything accomplished instead of modeling behavior to study the situation, develop a strategy, and action plan accordingly"
313,ServiceNow,Amazing opportunities,2021-07-30,5.0,Senior Sales Operations Analyst,Culture. Bill. Pay. Speed. Opportunity.,Tbd I just started. Will return.
314,ServiceNow,Good,2021-07-30,5.0,Cashier,"It’s a good job, recommend.",It Is okay I think.
315,ServiceNow,Excellent Work Environment,2021-07-23,5.0,Financial Analyst,Everyone lends a helping hand.,"Huge company, hard for a lot of growth."
316,ServiceNow,Great company and great leaders,2021-07-20,5.0,Stuff Software Engineer,"Great teams, great leaders, company in good shape.",Lot of work to do
317,ServiceNow,Stay away from the People Team for now,2021-06-07,3.0,Program Manager,"ServiceNow is chock full of the best and the brightest. Everyone is incredibly smart and hard working. An INCREDIBLE IT team that whips up cutting edge solutions in record time. Seriously, they're the best. If you work for ServiceNow, work for IT. Incredibly fast paced environment...which is good until it's bad (hello burnout).","The people team is pretty much a dumpster fire right now. During my tenure the existing CHRO left and a new one was hired...and then fired 2 months later (which of course caused a downstream exodus of leaders). While I'm glad they realized it wasn't a fit immediately, ServiceNow didn't have internal HR until 3 years ago so people systems are SEVERELY lacking with literally no leadership in sight. 

I've also truly truly truly never experienced so much workplace politics. I had to tip toe, bend over backwards, and even schedule separate meetings with two people who refused to get along. It was exhausting keeping up with who was fighting with who every week. This may not be the case in other departments but wow it was out of control within the People Team. 

The dept also skews older which isn't necessarily a bad thing in general (and I've been on other teams like this), except at SN I experienced age bias for being younger. It sucked and really made me feel like me and my ideas weren't valued. If the conditions on the People Team were different, I would have LOVED to stay with ServiceNow for several more years but ultimately decided that my mental health was more important than a paycheck."
318,ServiceNow,Good company,2021-06-22,5.0,Senior Product Manager,"Good company, good people. Work hard, decent WLB. Company is growing fast and moving fast.",Growing pains. Lots of B players have gotten promoted.
319,ServiceNow,Worst Culture Experienced in FP&A Team,2021-09-22,1.0,Finance Manager,"Decent Salary
Team members have good intentions","Worst Work Life Balance
FP&A VP Leader encourages to worsen the people culture
No space for Emotional Exposure"
320,ServiceNow,Great Company,2021-06-27,5.0,Technical Support Engineer,"Good products
Stellar CEO
Collaborative coworkers
Morale is good","Return to the office will be mandatory, although only 3 days per week will be required at first."
321,ServiceNow,Nice place to work with,2021-08-20,4.0,Staff Software Engineer,"Overall experience has been good, people are helpful and collaborative. Its a progressive company and if you share a great idea , you can see it getting implemented too",In some team not much of process is followed hence some time it create choas
322,ServiceNow,Great company,2021-07-01,5.0,Senior Vice President,Fast groaning. Fast moving. Certainly messy at times but exciting and challenging.,Fast growth means consistent change and looking for better ways to operate.
323,ServiceNow,Cook,2021-07-08,5.0,Senior Account Manager,Company was ok could be better,Not enough girls on the team
324,ServiceNow,Great company with excellent potential,2021-05-26,5.0,Financial Analyst,strong purpose and vision for the company that keeps me engaged,Not as competitive on pay as I would like. There are politics that come largely into play when it comes to promotions so it takes awhile to get to where you want to be.
325,ServiceNow,Love this amazing company!,2021-04-18,5.0,Support Account Manager,"ServiceNow is by far the best company I’ve ever worked for. Great culture, great people, and great management team. My manager and colleagues constantly check in each other to see anyone needs any help. When someone asks for PTO coverage, people are willing to help. The management team is the best team that I can ask for.",We may need more people.
326,ServiceNow,Great company committed to inclusivity,2021-06-15,5.0,Senior Content Designer,"Really just started, but the culture is fantastic and the talent is remarkable.","No cons so far, except for every company's bane: the ever-present silo between teams."
327,ServiceNow,Perfect place to start your career,2021-07-07,5.0,Designer,"Encourage the creativities, design inputs are heard","Complex problem, and limited explorations"
328,ServiceNow,"Innovative company, highly motivated people, still growing into it's own",2021-01-05,5.0,Senior Sales Consultant,"Our leadership is in touch with what's cool. There is a lot of excitement around our company and its a great feeling to be part of something that's growing, but already established and secure. If you're coming from somewhere like Oracle (for example) you have the opportunity to bring big-company mentality to teams that are still figuring out their sales territories, strategies, AE-to-overlay relationships, etc. People are encouraged to land-and-expand.","People totally drink the kool-aide and go a little overboard. Some admin stuff like time-tracking, CRM activity, etc. is still immature. When we were in earlier growth phases some customers got over-sold... dealing with those accounts is miserable."
329,ServiceNow,Ok,2021-09-14,4.0,Anonymous Employee,Good opportunities to grow if you work hard enough,"Awful work life balance, but depends on org"
330,ServiceNow,Decent place to work,2021-06-29,5.0,Software Engineer,"the stock price is raising, nice people",The base salary is low
331,ServiceNow,Good,2021-06-24,5.0,Technical Consultant,Good place to work. Stock keeps going up,Not sure if the growth its management aims at can be reached by organic growth
332,ServiceNow,Great culture and hard working,2021-06-14,5.0,N/A,"- lots of autonomy 
- diverse and fun culture 
- lots of benefits
- fast growing
- lots of connections","- high turnover
- disorganized structure, still figuring it out"
333,ServiceNow,Great culture,2021-06-29,5.0,Digital Sales Representative,A great culture with a caring CEO,Company changes at a high speed due to tech industry
334,ServiceNow,"I struggled with pessimism, but this company and CEO are the real deal.",2021-01-29,5.0,Success Architect,"Leadership challenges individuals, but empowers you to help the org grow. 13k strong, but still a startup atmosphere.","Startup atmosphere:) startups are not for the faint of heart. If you need defined parameters of “what to do” this isn’t the career stop for you. Lots of change, but this kind of exponential growth should experience nothing less. Diversity is abysmal, but keep being genuine in your effort to be better and you’ll get there. It is evident your desires go beyond news headlines."
335,ServiceNow,Great,2021-06-30,5.0,Software QA Engineer,Great benefits and overall professional development,Its hard to find something negative to say at the moment
336,ServiceNow,"Great People, Great Product",2021-08-12,4.0,Solution Consultant,"Fantastic culture and everyone is really helpful.
The product is excellent.
Customers really seem to like what we do and how we do it.",Huge learning curve to begin with but the training and ramp up services and support provided are really good.
337,ServiceNow,Choose carefully which Department/Leader you want to work for,2021-05-18,4.0,Program Manager,"The company is great depending on where you work on, and who you work with. Benefits are fair, there are career growth opportunities and stock is doing really well overall.","So many leadership changes that don't end in some departments. This takes anyone's ability from working at their best as they are constantly worried about losing their jobs. Some new leaders come in and don't want to understand any history and just want to change everything without understanding the implications of such changes. 
From a benefits perspective, I think our 401k match should be way higher."
338,ServiceNow,Growing but political,2021-09-13,2.0,Regional Sales Manager,Growing with client base that is loyal,Internal politics that make it hard to grow
339,ServiceNow,Best company!!,2021-05-26,5.0,Senior Product Manager,"- Amazing culture
- Leadership listens to employees and tries to address problems quickly
- Good benefits (minus 401k match)
- The people are awesome; almost everyone I have met is friendly, inclusive, and empathetic","- 401k match is pretty bad (only $2,000/year)"
340,ServiceNow,Sincerely Employee Focused,2021-05-24,5.0,Senior Business Process Consultant,"So many kind and intelligent co-workers. There is always a way, and an answer. You just have to ask.","A ton of apps and acronyms to absorb, but not impossible."
341,ServiceNow,ServiceNow is one of the best companies to work,2021-05-21,5.0,GTM Program Manager,"Committed to diversity, inclusion and belonging - every meeting is super collaborative and welcoming; People are awesome; Love the fast paced environment; lots of opportunity to grow",There is a lot to learn to ramp.
342,ServiceNow,"Good company, staying for the long haul",2021-06-06,5.0,Senior Solution Consultant,"-No micro-managing
-paid well
-good work life balance",-lack of structure for end of year review and path to promotion
343,ServiceNow,Mixed Bag,2021-05-06,2.0,Data Engineer,ServiceNow is a fast-paced growing company that more people are hearing about. Great salary along with generous RSUs. The CEO has a lot of energy and a great vision for the company.,"My time at ServiceNow had its ups and downs. ServiceNow operates like a really big start-up company. Since it is a big company, your experience will depend a lot on your manager and team. Its grown really fast to the point where the internal systems/processes haven't really had a chance to catch up. This makes the work days longer for employees. For example, the on-boarding process was pretty messy. I received my laptop a few days late and it also took several months to get access to systems I needed to use for my job. 

I worked in the IT group, and a lot of my co-workers were spread out globally in off-shore locations. It was normal to work around the clock and have multiple meetings at night since development was happening in off-shore. I would estimate that I probably had around 2-3 meetings every night during the week and stayed up late to help out with projects/tasks. Working here can be pretty demanding because of the high expectations and 12-15 hours required to collaborate with off-shore to get your projects done. I also noticed that a lot of people in my group were contractors, so they didn't have a lot of knowledge on the business and needed to have their hand held a lot of the times. I would say it was pretty normal to work or get urgent slack messages over the weekend to fix something in the system as well. There were also a lot of times where I had to fix code that was done by the off-shore team because they were causing issues in production and it was already late on their side. I think a lot of other groups might be better when it comes to balance, but a lot of people I talked to in other groups also felt that their work-load was way too demanding. I think it is just a combination of things moving really fast, without a sense of direction by middle management.

Overall, I learned a lot and gained good experience here, but decided to leave for a better paying opportunity with better WLB because of the demanding hours/workload, having to collaborate with off-shore, and having to work over the weekend here. I would say this is a good place if you are just out of college or new into the industry, but overall wouldn't recommend if you value your work/life balance."
344,ServiceNow,Thoughts After About 2 Months,2021-04-30,5.0,Advisory Solution Consultant,"Great Company, Interesting Company, Right Place in the Market. Additionally I have been impressed how (a) the company is always trying to improve (b) there seems to be a real focus on not working the consultants to death",Nothing major so far. Covid has made it more difficult to onboard.
345,ServiceNow,Very good company.,2021-06-24,5.0,Technical Support Engineer,"Great Management 
Good employee care features
Compensation is decent",Did not see any Cons
346,ServiceNow,Incredible culture,2021-01-04,4.0,Senior Designer,"Inspiring leadership: Our executives speak with such wisdom of technology, our industry, society, it's so inspiring. While they push us to excellence, they also lead with heart and aren't afraid to be vulnerable or compassionate.

Supportive team: I've worked at multiple tech companies now and this is the first where I truly feel like they're family. We care about each other, push each other's thinking, and are always striving to improve. At a higher level, our HR team cares about standing up for diversity, inclusion, and belonging, and always encourage work life balance.","Process: since the company's growing so fast, there's operational deficiencies and a lack of process. We've been working on it, but because the company started behind other newer tech companies, a lot of our practices are not best practices and feels rather dated."
347,ServiceNow,"Growing, growing, growing",2021-09-01,4.0,Anonymous Employee,- Growing teams with tons of opportunities.,- Have to deal with re-org and process challenges.
348,ServiceNow,Amazing place with great work/life balance,2021-04-19,5.0,Product Portfolio Manager,"Remote work culture to help facilitate work/life balance
Very challenging work
GREAT STOCK","The workload can get hectic at times
work/life balance forces you to work hours both a Pro and Con"
349,ServiceNow,"Good culture, meh benefits",2021-08-28,4.0,Software Engineer,"Unlimited vacation
Chill culture
Nice office
Fun people
Stock keep going up","Legacy code
6 month release cycles
Processes"
350,ServiceNow,Great place to work,2021-06-10,5.0,SRE/DevOps Engineer,Can't falul serviceNow. They seem to be doing everything right,too early for me to make any comment
351,ServiceNow,Great place,2021-06-10,5.0,SDR,"Great pay. Awesome culture, great ceo","-Being promoted takes longer than what they mention
more like 1.5-2 years before promotion occurs"
352,ServiceNow,Amazing team,2021-06-15,5.0,Senior Consultant,Great team and everyone is so nice.,Lot of information to learn and absorb
353,ServiceNow,Lots of growth = lots of change,2021-08-23,3.0,Anonymous Employee,"good pay, lots of opportunity",A lot of growth means higher quotas that are not sustainable.
354,ServiceNow,Excellent co-op/internship experience!!,2021-05-21,5.0,Co-Op,The internship program is well developed and it is clear they are invested in your future.,"Work life balance is sometimes difficult depending on the season, but very manageable"
355,ServiceNow,Building a strong design organization,2020-08-13,5.0,Staff Content Designer,"Culture - What I know is I've been welcomed and felt like a part of each team I've joined. This is on top of the fact that I was interviewed, hired, and am working remotely. 

Growth - This design team feels like it's moving into a maturing stage with exponential growth in product influence. They are building frameworks and standards that will be the foundation of design for years to come.","Still a sales and engineering-focused organization. 
I can see the shift to a more design-focused development lifecycle and that is actually where I think the opportunity is here. 
I haven't been here long enough to find additional cons. I'll update if anything jumps up."
356,ServiceNow,So far so good,2021-06-08,5.0,Consultant,So far so good. Good place,Lots of constant change. Not necessarily a bad thing.
357,ServiceNow,"Great company, great leadership",2021-08-02,4.0,Director of Sales,"exciting, fast growing company with top-notch executive leadership and culture, Focus on DIBs, mental health, physical well being and employee retention.","really poor process, but not any more than any other smaller, fast-growing companies."
358,ServiceNow,Decent place to start your career,2021-06-02,5.0,Senior Technical Support Engineer,Strong installed base which is tough to beat,Not up to date with market
