,company,headline,date,overall_rating,author_position,pros,cons
130,ServiceNow,Marketing versus Reality,2021-12-21,3.0,Senior Manager,"The platform/technology is fantastic 

Employee benefits

Growth projection","Middle management is self-serving 

What company leadership is more cheerleading and is out of touch with the true workers

Very little career growth and inconsistency of promotions 

There is very little of the culture that fueled its growth

Bureaucracy and politics dominate over getting work done and cooperation

Showing up as your authentic self if you don’t challenge middle management"
131,ServiceNow,Even the best technology does not substitute for genuine people interaction,2021-12-14,2.0,Confidential,"I’ll give ‘em this – they have the technology thing down. One of the best experiences I have ever had as a new hire. Unfortunately, this was only one of a few positives I have to say. With what I had heard about the company and the promise it offered, I had hoped my experience would have been longer term. Instead, I departed from the organization (and no, I was not fired) only having added to my list of the things NOT to do as a colleague and or manager. 
I give credit where credit is due and to round off my list of positives: the pay was excellent, and they said the right things from the onset. If you experienced a first day only, you would have been impressed. Where other organizations haven’t a clue as to how to get their new employees on-boarded this company has it down. I quickly became aware of the fact that the company wants to be diverse, inclusive and have everyone bring their “authentic” self to work. They also are super proud of their product, and their customers, and all of the employees that make the “magic” happen. But it is quickly apparent that their ability to execute on anything remotely close to what they describe as a purpose driven culture leaves much to be desired.","On the surface this is “the place to work” but when you get to the core it is far from magical. Leaders act as though they walk on water. Team members are anything but welcoming. Bringing your authentic self really translates into you have liberty to do anything you want with little or no ramifications. I personally had to find my own way. No one wants to do anything that isn’t in their own personal interest and when you step up and be “that person” you are instantly chastised- something that no one else initially wanted to do becomes a free for all for others to criticize. As a matter of fact, it seems like everyone avoids getting work done just based on the sole reason that every non-mission critical task gets opened up to vetting beyond nauseum. You could have someone from a completely different business function telling you how to do something that you have done your entire career, but no one has your back to end the nonsense. You are expected to ride out the politics without a clear path to success – in anything. 
To say that leadership is innate may be true and if so, they are not finding leaders with this innate capability. In my experience here leaders/managers live by a “do as I say, not as I do” motto. I am in the mid to late stages of my career and have held many leadership positions, and I am blown away at how uninspired the leaders at this company make me feel. I was in a meeting one time with a leader showcasing some up & coming bells and whistles that were to be rolled out. I asked the question how did they plan to inform colleagues about this? His response: This is a self-service culture. That’s the beauty of what we implement, it needs little or no introduction. And I’ll give him this… there isn’t anything that is full service at this organization especially in the leadership department. Leaders manage to computer generated “nudges” and have little or no interest in what motivates their team members. For a company that is in touch with the uniqueness of their workforce they should be intimately aware that everyone is wired differently and thus a little effort to get to know their staff would go a long way. No one gave a lick about me as a person. So believe it or not I’ll end this- here. If you want a job where you have almost every freedom you could possibly think of and decent pay- I would say hop on board. If you want a career experience that is going to make you feel a sense of accomplishment and feel respected for what you bring to the table, RUN AWAY as fast as you can."
132,ServiceNow,Great company!,2022-01-18,5.0,Director,Great technology and great people!,Volume of work can be high at times.
133,ServiceNow,All Star Team in an All Star Company,2021-12-01,5.0,Senior Staff Design,Everyone I have interacted with is genuinely there to help those around them. I greatly appreciate this trait in the culture as it drives me to do the same. Win win!,"If you are looking for a ""familia"", this is not the place for you. While you become tight with your team, this is a rapidly expanding global company."
134,ServiceNow,Love it - great leadership,2022-01-03,5.0,"Senior Specialist, Employee Communications","High growth, massive amount of opportunity for high performers, great leadership","Can be chaotic, mostly because high performers carry legacy deadweight. Immature processes."
135,ServiceNow,Best company to work for,2022-01-12,5.0,Senior Recruiter,Been here 3yrs. Been energized the entire time!,Nothing that I can think of. Love it here
136,ServiceNow,Great comapny,2022-01-19,5.0,Information Security Risk Analyst,"- Awesome benefits
- competitive pay","- All work, some play"
137,ServiceNow,Good company to work for,2022-02-03,4.0,Quality Engineer,The people are really great to work with. Management can be hit or miss.,Overworked in some departments because management doesn't understand controlling the customer (sometimes just other departments of ServiceNow) and allow them to flood QA with repetitive testing.
138,ServiceNow,Great Company,2021-12-22,5.0,Principal Success Architect,"company leadership, colleague support, winning as a team is a culture not a punchline at a cocktail part. Enablement opportunities, great purpose and customers that are excited to see me.",COVID restrictions and lack of seeing the clients face to face.
139,ServiceNow,Great Company to work for BUT ...,2022-02-10,4.0,Anonymous Employee,Culture is great and company is growing so fast,"Lots of Politics 
Advancement is not based on performance but rather its based on who you know"
140,ServiceNow,Great Opportunity,2021-12-23,5.0,Account Director,ServiceNow continues to grow its platform and is morphing into a true business solution. There is plenty of opportunity to grow here.,"Somewhat immature management structure because of fast growth, but great culture"
141,ServiceNow,Perfect place to work.,2022-01-13,5.0,Anonymous Employee,Nice benefits and company culture. Flexible work persona.,So far so good for me.
142,ServiceNow,Awesome Company,2022-02-15,4.0,Partner Manager,"Fantastic brand recognition. 
CEO is the best possible person to lead ServiceNow to the next generation",Internal promotions and capped raises with those promotions
143,ServiceNow,Culture is collapsing,2021-12-15,3.0,Anonymous Employee,Stock has been on a massive run.,"With the rapid growth, hiring managers didn’t protect the culture. Too many folks are joining, especially new managers who are coming from the outside, and instilling favoritism and focusing on managing up instead of leading their teams."
144,ServiceNow,Decent workplace,2022-02-01,3.0,Data Scientist,Good perks and work life balance.,"Salary and nit pick during growth conversations. Most common issue among people who leaves the company. 

""Very few opportunities to grow"""
145,ServiceNow,Flexible Time off,2022-01-06,5.0,Anonymous Employee,"No PTO bank, take time as you need",Can be hard to balance billable time
146,ServiceNow,Great Company,2021-12-27,5.0,Staff Software Engineer,Have a great opportunity to contribute. Also have a great chance to learn your technology.,"For a fast growing company, sync with other team's project is challenging."
147,ServiceNow,Great everything,2022-01-03,5.0,Senior Inside Account Executive,"Good mgmt, good resources that care, fair pay, good work-life balance",Complicated product that can be overwhelming
148,ServiceNow,Great leadership,2022-02-15,4.0,Senior Product Manager,Top level executive leadership is world class,Benefits could be better and more competitive
149,ServiceNow,Great place for a career,2022-01-06,5.0,Anonymous Employee,"Good work/life balance
Great compensation package",Work can be mundane at times.
150,ServiceNow,"Ambitious, ebullient, and welcoming",2021-11-09,5.0,Product Director,"This company has a very ambitious leadership team, and the rapid growth creates many opportunities. It is also earnestly dedicated to welcoming all types of employees and celebrating their diversity. People are very open with their opinions - at my first all-hands I was shocked at some comments made in the livestream - employees feel safe venting their feelings.","The organization is growing rapidly, and it isn't always clear who's responsible for what."
151,ServiceNow,review,2022-02-15,4.0,Sales Associate,solid pay here at servicenow,no cons as of now
152,ServiceNow,Very good work culture,2021-12-26,5.0,Anonymous Employee,Very well organized programs and awesome leadership team. Highly Employee friendly.,No cons so far . it’s all good so far .
153,ServiceNow,Great Work Place!!,2021-11-10,5.0,Product Success Manager,"The culture, product and continuous learning are to me the best assets for an employee! What else do you need?",Not much in the way of Cons. If I had to really pick I would say don't lose focus on work life balance and for New Hires allow the ramp up to be more specifically geared toward your day to day.
154,ServiceNow,SDR,2021-12-19,5.0,Sales Development Representative (SDR),"Culture, pay, benefits, leadership. Managers invest in your development",none. This is a great company to work at.
155,ServiceNow,Great company to work for,2021-12-14,5.0,Account Executive,"Good company, sales driven org, market adoption",Quality of leadership from a middle management standpoint
156,ServiceNow,"Great Culture, Process needs work",2022-01-09,4.0,Anonymous Employee,"Great teammates, great culture, great atmosphere. Day-to-day I'm happy to go to work.","Our process is pretty bad, and needs work. Everyone knows it, but it's hard to make big changes because of how many people it will affect. Hoping it gets better over time"
157,ServiceNow,Micromanage to point of suffocation,2022-01-18,2.0,Senior Marketing Leader,Good standard benefits and nice coworkers,"Horrible leadership in Marketing. When VPs have to control everything down to smallest details, either they are the problem or they don't know how to hire talented people."
158,ServiceNow,Excited to be at ServiceNow!,2021-10-02,5.0,"Senior Director, Solution Consulting","I am excited to be at ServiceNow for several reasons, but a couple are the people and the platform. I have been really impressed with the people I work with. ServiceNow strives to hire top talent, and it shows! And the platform is so powerful. The people and platform are combining to drive tremendous growth!","While I understand no workplace is perfect, I have not encountered significant issues or cons. In any growth environment like this, there will be challenges, but I believe the culture is such that we'll work thru them."
159,ServiceNow,So refreshing,2021-10-21,5.0,Design Program Manager,"Company give so much emphasis on diversity and inclusion, you will feel at home right away. Leaders are so easy to reach out to and create interpersonal relationships. Managers are hands-on to help the new employee settle down. The company energy is vibrant, that you feel like coming to work. Worklife balance is not only preached but also practised",I have not discovered any till now
160,ServiceNow,great,2021-12-25,5.0,Operational Excellence,Good pay. Great work environment and friendly,There is nothing negative I found .
161,ServiceNow,New Hire,2021-12-08,5.0,ServiceNow Architect,Unbelievable onboarding session - learning all end to end of all ServiceNow. Everyone is Extremely nice and helpful...,"Tons of reading material, classes and training"
162,ServiceNow,Great company - excellent culture,2021-11-15,5.0,Program Manager,"Building products that truly make a difference in the world. The culture is one of a kind, strong sense of belonging and commitment to the team and the world.","Not really a con, we are always growing so that means we are always going, the pace is fast but fun."
163,ServiceNow,Literally the best job ever,2021-12-02,5.0,Associate Technical Consultant,"Everyone really cares about your professional growth, the compensation is competitive, the ramp up journey is really well planned, and there is so much to learn","none so far, been great"
164,ServiceNow,Great place to work!,2021-12-14,5.0,Business Development Representative,"-Great management, sakes training, and company outings",Weren't always fair with comission packages
165,ServiceNow,Wow. They got it right,2021-11-22,5.0,Senior Performance Engineer,"Growing company that needs of talented persons to assist the growth. The training is documented, methodical and easy to progress through. Everyone is excited to have you aboard and eager to see you succeed.",i can't think of any
166,ServiceNow,Great Company,2022-01-28,4.0,Account Executive,"Awesome company and culture
Great leadership","Very bad CRM 
Internal employees make less than external"
167,ServiceNow,"Great growth. Great CEO. However, if you have a ""no @sshole rule"", look elsewhere.",2021-11-10,2.0,Design Manager,"- Great CEO
- Pockets of good leadership
- Some really great people working on the front lines
- Rapid growth and opportunities (if you can handle the stress and pain of it)","- I've watched sooo many managers end up quitting because it is just unmanageable
- Process gets in the way of innovation
- Engineering leaders not interested in innovating
- Fairly toxic Engineering org. This one element keeps the job from being enjoyable."
168,ServiceNow,amazing company to work for,2021-11-19,5.0,Senior Software Manager,"very engineering focused SaaS company
treats employees exceptionally well
very flexible in terms of work location, time off, etc
growing extremely fast, which leads to lots of opportunity for career growth","all the normal big company processes, not as nimble as a startup"
169,ServiceNow,Great Company,2021-12-13,5.0,Anonymous Employee,Great people and product at ServiceNow,Some disorganization in company culture
170,ServiceNow,Not too bad,2021-06-14,4.0,Software Engineer,"- My team is not overly busy
- Unlimited time off (1 month max limit recommended to managers)
- Manager is understanding of work life balance
- Coworkers are chill and fun
- Work from home is pretty allowed. Especially during and after covid","- There is not a lot of communication from VPs down to teams
- Managers arent very well at helping you move up through to your promotion
- Different teams have different work loads. Some times crazy busy loads. It depends on the manager, team and department. Unfortunately, work life balance is hit or miss depending on the team.
- Similar to getting help to be promoted, you dont really ever get assigned any new responsibilities or roles, everyone just has to wait or be in a good relationship with the director to get recognized for promotion.
- Entry level positions are only posted and given to interns. Very few are ever posted externally.
- Switching to a remote role is limited based department director and based on the destination being close to an SN office"
171,ServiceNow,Great place to learn,2021-09-17,5.0,Principal Curriculum Developer,"The learning opportunities are phenomenal. If you tend to get bored with a job after a while.... this will never happen. There is always something new to learn, and there are opportunities for movement within the company. They were very open to remote workers, long before COVID hit. The stock incentives and employee referral programs were nice too.","Due to the spectacular growth of the company, sometimes staffing levels didn't keep up with the incoming work."
172,ServiceNow,Great culture,2022-01-25,3.0,Anonymous Employee,"Great culture, encouraging environment, good work life balance",Pay not enough. Work is not valued
173,ServiceNow,Amazing Company,2021-12-08,5.0,Consultant,"Culture, people, technology; honestly everything. This company is doing everything right.",There are no cons at ServiceNow.
174,ServiceNow,One of the hottest tech firms in the world,2021-11-05,5.0,Assistant Vice President Sales,"Stock Growth
Exciting and challenging environment
Leadership team
Top talent to work with","Pace isn't for everyone
As with any hypergrowth firm, lots of process and logistical improvement required"
175,ServiceNow,Easy ramp up,2021-12-02,5.0,Anonymous Employee,"Routine jobs are easy due to full automation.
Colleague are open to welcome new comer.",I don't have any idea so far.
176,ServiceNow,Not perfect but close,2021-11-19,5.0,Software Engineer,Best manager in the Universe!,"Hard to innovate, iterate and get to market quickly."
177,ServiceNow,Great company,2021-11-27,5.0,Senior Business Process Consultant,"Great company to work for, compensation is better then most. Work balance is in check.",Working remotely can sometimes feel isolating.
178,ServiceNow,Exceptional Product & Exceptional Growth,2021-08-19,5.0,Senior Problem Manager,"Positive atmosphere. Encouraging growth. Good work/life balance. A top notch product supported by employees and leadership who truly believe in it. If our customers succeed, we succeed, and after many years of working in tech, it's exciting to be a part of a company who genuinely means that.","ServiceNow is just beginning to mature and grow out of their, ""start up"" phase. There's a large learning curve and not many resources available to assist new hires in navigating that - be ready for a trial by fire to get up to speed for some roles."
179,ServiceNow,Growing company with associated challenged and opportunities,2021-09-02,4.0,Anonymous Employee,"Products for each vertical
Growing real fast
Quite a few roles one can fit into","Newer Products are released with a first to market mentality that at times is counter productive
Moving across groups can be a challenge if your manager decides to hold you back.
Some really amazing and knowledgeable colleagues that make it truly a great company to learn and share
Cliquey in parts.
Becoming too much of a factory vs the innovative company it used to be"
180,ServiceNow,Software Engineer Review,2021-10-18,5.0,Software Engineer,"1) Awesome work life balance 
2) Great people and really good learning curve for developers.
3) Recognition to overall and inclusive for diverse culture. No office politics. Importance for each employee at its highest. 
4) Good amount of pay and stocks.",1) Not that i think off. I have been 3 months into the company and really love how well controlled and balanced everything is.
181,ServiceNow,Don't buy into the hype!,2021-10-19,2.0,ITSpecialist,Big company....great stock price...a lot of growth,"For being a workflow company their internal processes are horrible.
Too many salespeople in this company do not make the big money they talk about. If you are interviewing with NOW make sure you ask about 'Debooks' this is when a client does not renew their license and it affects your quota and commissions. Have you ever received a negative commission report? It is common here."
182,ServiceNow,Outstanding Culture and Sales first initial experience,2021-08-23,5.0,Account Executive,"It's only been 3 months, however the teamwork and sharing of knowledge is unparralled. The onboarding team is easily top in the industry and no one shy's away from helping. The compensation plan is geared towards retention, as well as growth. The people first and customer obsession is apparent.","As of now, things are great and depending on how fast the company grows, it may be very important to create your own career path as this is definitely not a place to sit for years on end in one role... This is NOT a CON but all I can come up with right now."
183,ServiceNow,Great company. Fun Job.,2021-11-24,5.0,Senior Technical Support Engineer,"Great compensation.
Great benefits.
Unlimited PTO (and they mean it)
Lots of company holidays
Bonuses for working holidays
Fun work
High energy teams",None that I can think of
184,ServiceNow,Great opportunities,2021-12-29,4.0,Sales Development Representative (SDR),energetic team and management encourage employees to have big dreams,"learning curve to get used to territories assigned and products you can sell based on your position designation. Also, time zone difference of your customers in west coast if you're working from west coast-"
185,ServiceNow,enough is enough,2022-01-31,1.0,Warehouse Packer,its a Job better than being on employment.,"Poor management, under staffed, unsafe environment."
186,ServiceNow,Great Company and Perks,2022-01-12,4.0,Data Analyst,The biggest pros are the compensation and perks. Offices look pretty great too!,The 401k and retirement benefits aren't the best.
187,ServiceNow,Best company on the planet to work,2021-09-28,5.0,Partner Enablement Specialist,"ServiceNow lives up to the hype. They are incredible. Every level of leadership is great. They push you to exceed and care about you all at the same time. Not to mention, the company is so innovative. 100% love it.",There is no 100% 401k match.
188,ServiceNow,Fast pace but has a lot of support from coworkers and managers.,2021-10-13,5.0,Anonymous Employee,Family oriented work space. Everyone is very supportive and will reach out to you to check up on any issues you may be experiencing.,None so far but I’ve only been with the company for a few months.
189,ServiceNow,NA,2021-11-30,5.0,Regional Sales Director,Great place to work and build a career,None that come to mind
190,ServiceNow,"LOVE, LOVE, LOVE this company",2021-11-16,5.0,Senior Recruiter Tech,"People, Process, Technology and the BEST in class Global People Team on the earh","None, this place rocks and will for a long time!"
191,ServiceNow,Culture and DIBs are a complete smokescreen in the Sales & Pre-Sales organization.,2021-09-06,2.0,Advisory Solution Consultant,"Technology is great
Company advocates for a better, more diverse world","Sales only cares about numbers and acts disgustingly against the company culture
Leadership turns a blind eye any time problems are raised

Managers do not support the culture, pushing their own, old boys’ school “culture” as being more important instead. People who are meant to be managers and leaders are simply fragile bullies, and the organization rewards that. Don’t get sucked into thinking that the ServiceNow culture is present one iota in sales, and don’t think for a second that you will be supported in the organization unless you’re a good old boy."
192,ServiceNow,It’s your average growing tech company,2021-11-15,4.0,Product Designer,"Benefits like unlimited PTO and RSU, handful of nice people to work with, inspiring leadership, a lot of intern to FT conversion","Design org is still maturing, a lot of growing pains, processes and documentation is unorganized, company doesn’t value legacy employees as much so there’s pay inequity. Middle management is not the best, but they try given the circumstances. Some leaders are not easy going and pretentious."
193,ServiceNow,Pass,2022-02-01,1.0,Digital Marketing,"Benefits are good, RSU's keep you there.","Leadership, toxic environment, lack of accountability, constant reorg."
194,ServiceNow,"Excellent company, great benefits, culture, product",2021-09-30,5.0,Solution Consulting,"Excellent company. Watched ServiceNow grow from 3000 employees to 14K this year and the product exploded. The right people, right culture. Customers love us. Work life balance. Excellent benefits & compensation. Dream job.",Moving very fast - not for the faint of heart.
195,ServiceNow,Exceeded Expectations,2021-08-23,5.0,Senior Solution Consultant Presales,"I have been with the company several months now and every day am thankful I decided to leave my previous company to join ServiceNow. The level of training and support you are given on day one never waivers throughout your journey. Everyone is supportive, collaborative, and top tier talent! The overall company culture is extremely inclusive and they go out of their way to communicate frequently.","There is a lot of training to take, which can seem overwhelming, but taking it all really does help prepare you for being successful at the company."
196,ServiceNow,great job,2021-11-18,5.0,Sales Development Representative,great culture and love everyone i work with,No cons I can think of right now
197,ServiceNow,Great Company,2021-11-23,5.0,Software Engineer,I love the company culture. It is the best.,I love it. no cons.
