,company,headline,date,overall_rating,author_position,pros,cons
0,ServiceNow,"Fantastic Company Culture, Structure, and Values!",2021-11-29,5.0,Advisory Solution Consultant,"Culture truly feels at the centre of leaders' priorities, creating a positive and motivating place to work. The company is successful, and there is a real sense of teamwork to continue achieving great results and recognising team/individual success stories.","Growing so quickly it is easy to feel like a small cog in a fast-growing company. I'd say this is managed very well, but a real risk if not consciously addressed going forward (i.e. ensuring people have a purpose, support network, pathways to grow)."
1,ServiceNow,Great place to work,2022-03-31,5.0,Senior Staff Technical Writer,"Great diversity, engaging work, flexible hours",Work to life balance not always as it should be.
2,ServiceNow,Great place to be,2022-03-07,5.0,Senior Software Engineer,"(My experience relates to the San Diego campus in Software Engineering)

I really enjoy working at SN, people are nice, the work is interesting and challenging. I've had very busy weeks but also some very light weeks. It seems WLB varies teams to teams but from my experience it has been good, and usually take more than 4 weeks for vacations per year. Company always has been remote friendly but since the pandemic it has been remote first. With that comes the good and the bad. If you like WFH, then this is great!

ServiceNow has tremendous future opportunities and if the execution keep on being successful, the quick growth will continue.","We have a big campus in India, although I always had good experiences working with colleagues over there, if a project needs fast paced collaboration you are needed to have meetings really early morning or late evening (California - India time difference)
Avoid being on those projects if that's not your cup of tea!

On the Engineering side, I've only worked on Platform teams but talking with folks from application teams it seems like working on the platform is more interesting/challenging. If you're looking for that, I'd go for Platform."
3,ServiceNow,Drinking from the fire hose is no joke,2022-03-24,3.0,Senior Manager,"The culture is real - the intensions, the care from leadership and the drive are all 100% ingrained in the ServiceNow DNA.","Drinking from the fire hose is no joke - I was told this over four years ago when I interviewed and the same applies today. Leadership pivots constantly - there seems to be no ability to put a PIN in it so you can get the job done and it affects your ability to be successful in your role. We are told 'this is what innovation looks like' as if that makes our stress level acceptable. It's not innovation, it's lack of leadership and the result of constant pivoting affects working relationships with partners and the customer experience.
DE&I remains a challenge, we talk the talk, but I am hearing we don't always walk the talk... equity matters."
4,ServiceNow,Mobile team management ruins the good parts,2022-03-16,3.0,Staff Software Engineer,There are lots of motivated and smart people that will help you grow professionally. No lack of work but usually it's not too much to handle and is reasonably scheduled. Apps have high daily user count and do complex things so lots of places to make big impacts.,Everyone in management is chasing promotions and doesn't care about the individual contributors. Management gets promoted a ton and developers get the shaft. Play the politics game if you want advancement and the good tasks. Everyone I talk to says the company is great but the mobile team is managed like garbage. Being available 24/7 is expected for most senior roles.
5,ServiceNow,"Miserable, hostile,political mess...but stock rewards",2022-03-23,1.0,Senior Manager,People are impressed by where you work when they google the stock price.,"The whole thing is smoke and mirrors. You come in and everyone is like 'sorry we tricked you, we know it sucks'. 

I even reached out to the recruiter to ask what was up, 'this is not the job you described', his response was the policy doc for transfering teams.

There is no data. SeriouslyAnd if there was, noone would share it anyway.

The most basic everyday operation tasks are bogged down by very angry and defensive middle managers, who are also fighting for their survival.

Landgrabbing is insane . 
Stay out of the way of empire builders.
Staff who have worked here for a while are afraid of metrics and accurate reporting as it will shine a light on underperforming assets etc. So they kill reporting at all times. Data driven or logic driven ideas are killed by managers worried by a zeitgeist before their four years shares vest. 
I wish I never took this job but I can't afford to leave."
6,ServiceNow,No longer “humble”,2022-03-25,3.0,Customer Outcomes,"ServiceNow has some of the smartest folks I’ve ever met. At the lower levels, it’s a very collegial group of great hires. There’s great salaries and benefits.","Getting way too top heavy with newly hired middle management, who are often unfamiliar with the Platform. Increasingly, it’s become very hierarchical and has lost the more democratized feel and energy that was there 5 years ago. Most concerning is the current culture which stifles any questions or innovation."
7,ServiceNow,Awesome company and culture!,2022-03-31,5.0,Customer Success Architect,"Growth trajectory is amazing
Live and breath teamwork (not just a saying thrown around)
Leadership is dialed in and supportive
Diversity and Inclusion is great!",Long interview process - so hang in there!
8,ServiceNow,Real work not recognized,2022-03-27,1.0,Anonymous Employee,"Company growth, for now
Some good benefits
RSUs average","There is no real review process and nothing is written, maybe deliberately, so that you can't complain or respond (not that it would make any difference). This is in line with the absence of modern internal tools and processes, which is beyond belief for a company that sells itself as the workflow leader.
Reviews are based on ""opinions"" rather than results.; this leads to the promotion of the ""in"" crowd, regardless of performance.
The review process is called ""360"" but in reality is unilateral, from the top down."
9,ServiceNow,A great company that is going places!,2022-02-17,5.0,ELearning Designer,"I started with ServiceNow three months ago and my experience so far has been positive. Here are a few pros:
- Excellent work/life balance
- Opportunities for professional development
- Fantastic speakers
- Above average compensation when factoring in salary, bonus, etc.
- Higher than average amount of holidays
- High morale for a work culture
- Great leadership that cares about their people. The CEO is awesome!","Very, very few cons that I can think of. But here are a few that might factor into your decision:
- There's a lot to learn, so you have to make the investment into your career.
- Unlimited PTO is only bad if you are expecting to cash out on PTO if you leave.
- The 401k match isn't as great as some other companies."
10,ServiceNow,Great onboarding process,2021-12-21,4.0,Account Manager,"As a new hire, I felt the onboarding process here was outstanding, both the company-specific onboarding and team-specific onboarding. The company is very organized and has an employee portal that you use to go through the process of being onboarded. My manager also organized a spreadsheet and coordinated meetings with other teams to onboard me as well as other new hires onto the team itself. My manager also established weekly 1:1 meetings from the start. Having 1:1's with your manager is highly encouraged here. 

The company has published a ton of internal content and has been effective in establishing processes around things which I greatly appreciate.

Benefits are great and they have a virtual assistant to help with getting you set up with health insurance. This was so amazingly helpful.","It takes a bit of time to figure out where to locate specific company-wide documents and information but it's all about getting comfortable using their system and portal. Anything new is going to take time getting use to. It can feel a bit overwhelming at first but you learn as you go. 

Working remote can feel a bit isolating. Although my manager does a great job with having a steady cadence of team meetings, I don't connect too much with my teammates. I wish it was more encouraged to check in on your teammates and how they're doing."
11,ServiceNow,Love it!!!,2022-03-28,5.0,Training and Sales Enablement Manager,"The culture, the benefits, the people, and the executive leadership are all wonderful. I love the DIBs community and its emphasis on career growth.",In the 2 1/2 years I've worked here I haven't experienced anything really negative.
12,ServiceNow,People Focused & Growing Fast,2022-03-10,5.0,Senior Manager,"This company has an incredible focus on employee health, wellbeing and development. I am continually receiving event invites to webinars that serve no other purpose than to educate on inclusion, mental health, personal development and more. Service now pays very well and that alone reduces stress on its employees, but they also practice what they preach in putting the employees first.","The company is growing fast, so employees need to be mentally ready for things to change often. This is only a con if an employee is more comfortable having things stay unchanged."
13,ServiceNow,Excellent focus on innovation and employees,2022-03-28,5.0,Senior Program Manager,"Inclusive leadership approach with an emphasis on innovation and the customer journey

Highly adaptive and considerate of the employee experience

Competitive comp and benefits package",Opportunities for exposure and promotions are vague
14,ServiceNow,"Quote ""Family"" but actions do not measure up",2022-01-12,2.0,Anonymous Employee,"Depending on the management they will treat you well. Also, if you follow the rules you will be fine. We still do not have to go back to the office due to covid, unlike others who are trying to make you go back.","I did feel discriminated when I was working here for the time. I mean look at the travel policy. People of certain rank gets certain privileges. I mean where is the equality in that and they claim we foster equality and diversity. The policies already embed these things base on your level as opposed to other companies where I worked where everyone gets the same treatment. Not so at ServiceNow. When things. do not follow the rules or processes they punish you pretty hard. In fact, only when you kick and scream do they take you seriously. A lot of times, if you don't escalate they think all is fine. So it takes people to aggressively fight back, and then people who fight back get taken off the project. Also, there are a lot of processes and still doing waterfall instead of Agile in software development. I feel like I haven't learned much the time I have been here. We are also being paid after the covid at the 25% tile compared to our competitors...They did not proactive do anything to raise our compensation, but instead actively hire outside. It is like what the ****"
15,ServiceNow,Truly Amazing Company!!!,2022-03-18,5.0,Senior Account Executive,"Too many
- Great culture 
- Learning
- Fast growth
- Dreams can come true here
- Work satisfaction
- Work life balance
- Others...","If at all one thinks it is else its an opportunity - 

""Live up the fast pace, hardwork needed to leverage flexible and challenging environment to keep raising bars"""
16,ServiceNow,Amazing company to work for,2022-03-23,5.0,Sales Manager,"great culture, and would highly recommend.","Work from home has been great, but potential to come back to the office once a week or so , which isn't as exciting"
17,ServiceNow,Great place to work,2022-03-25,5.0,Client Director,"Market leading solutions, great executive leadership, competitive salary and benefits, strong platform design and R&D.",Increasingly competitive markets and SN is the highest cost solution.
18,ServiceNow,Software quality engineer,2022-03-28,5.0,Software Quality Engineer,Lots to learn and progress in ServiceNow,Nothing as of right now
19,ServiceNow,Best onboarding and culture I have ever worked for,2022-02-11,5.0,Senior Executive Architect,"I am new (3 months) so I don't have much to say other than the onboarding process is outstanding. They really get how to scale hiring and onboarding to meet their corporate goals.
ServiceNow keep breaking my corporate intuition through the use of their product. You don't need to ask for help much--its all right there in the checklists and knowledge articles","This is exceedingly minor, but they really stress culture and diversity and this stands out: They do a lot of T-shirts and Sweat Shirts. 5 so far in just three months. They don't have Tall sizes available so I can't actually wear any. Leaves me a bit left out. This is literally the only negative I can think of."
20,ServiceNow,"Great culture, great company",2022-03-27,5.0,Anonymous Employee,"Smart, motivated employees
Value driven leadership
Great product with excellent growth oppty","Growing pains from very rapid growth, lack of processes"
21,ServiceNow,Nice,2022-03-29,5.0,Marketing Associate,good benefits and pays well,lack of direction and hand holding
22,ServiceNow,It's a movement!,2022-03-24,5.0,Top Account Director,Fantastic employee culture. Everyone willing to lean in and help. Seamless onboarding experience.,"Initial training is a bit overwhelming, especially when you're trying to be productive to your role quickly."
23,ServiceNow,Great work life balance,2022-03-21,5.0,Senior Support Account Manager,"Remote work, competitive compensation, stock price continues to rise, great benefits, freedom policy for PTO","Management not qualified in some cases, advancement opportunities are hard to come by"
24,ServiceNow,Great company if you’re on the right sales team,2022-03-29,3.0,Enterprise Account Executive,"Great leadership. Amazing, world-class products customers love. Ability to make very good $$$",Success is entirely based on how good your manager is and which accounts you get. Promising double digit YoY growth means if you’re in sales then territories shrink from added headcount.
25,ServiceNow,The grass is greener over here.,2022-02-03,5.0,Senior Solution Consultant,"Amazing culture, amazing product and amazing people. This is the first time I can say that the companies values truly show through the people and work they do. The company is growing and with that comes so much opportunity to grow along with it. Everyone in management (that I have met) is passionate about their job, great to work with/for but also doesn't take themselves to seriously. People here know how to work hard and have fun while doing it. With all that comes great pay and benefits that you would expect at an award winning company like this!",Company is growing fast which comes with a lot of change at times. This could be a con for some people.
26,ServiceNow,Great Organization,2022-03-25,5.0,Senior Analyst,"Compensation, Benefits and Work Life Balance",None I can think of for now.
27,ServiceNow,Amazing Culture and Purpose,2022-03-10,5.0,Associate Technical Program Manager,"ServiceNow is a fantastic company and I have only had positive experiences with management and other employees while working with the company. I joined in August of 2021 and they have provided me with guidance, mentorship, and numerous opportunities to learn grow in just a short amount of time.",No cons for me thus far!
28,ServiceNow,Dream Job - Incredible Company,2022-02-14,5.0,Staff Technical Writer,"ServiceNow appreciates their employees and it shows! They offer excellent pay, competitive benefits, fun perks, and lots of swag to get everyone fired up to meet company goals. It's the best job I've ever had. The people are supportive and kind, and the executive leadership makes an impact with their positive messaging and motivating calls to action.",The onboarding process is no joke. The material is relevant and presented in an organized way - it's just a lot to take in.
29,ServiceNow,Great entry level sales,2022-03-19,5.0,Sales Development Representative,"Great environment and people around, fair and attainable quotas",Incredibly complicated platform that takes new sales hires 6 months or more to understand
30,ServiceNow,I love this company,2022-02-16,5.0,Staff Product Designer,"A great leadership team that's engaged with the business and listening to the organization's needs.

Culturally the most inclusive and forward-thinking company I've ever been a part of.

The work is fulfilling and dynamic","Features and sales can sometimes be put over the pursuit of perfection as it relates to design and internal efficiencies.

Low accountability on missed deadlines or low-quality deliverables"
31,ServiceNow,Great Place to Work,2022-02-23,5.0,Associate Technical Consultant,"The atmosphere is phenomenal. 
The people are great.
The platform speaks for itself, truly moving forward.
Rapid growth.","If you like benefits this job isn't for you.
A bit of a learning curve if you aren't familiar with the environment."
32,ServiceNow,Forcing employees into the office is wrong! People are quitting.,2022-03-30,1.0,,"The salary is ok, but the 401k match could be a lot better.",THE COMPANY IS FORCING EMPLOYEES TO COME BACK TO THE OFFICE DESPITE RECORD PROFITS AND NOBODY WANTING TO RETURN TO THE OFFICE. I'm quitting and will not be returning to the office. Nobody wants to be around egotistical executives and commute 3 hours everyday to the office.
33,ServiceNow,Great company,2022-03-18,5.0,Service Desk Engineer,"Lots of growth, strong leadership, strong IT team, collaborative cross-functional teams.",None. One of the best companies I have worked for.
34,ServiceNow,Great Company - changes fast and political,2022-02-15,4.0,Account Executive,"Compensation, Team Spirit within ranks/peers, opportunities for advancement, great name in industry","Management is political and a lot of jockeying for position. Sales cycles are long and you better have a great relationship with your boss. Quota's can be unrealistic especially after having a great year - they jack it up pretty high. Company is getting too woke. Healthcare insurance providers are average at best, especially if you use any naturopathic doctors."
35,ServiceNow,Great place to work,2022-02-28,5.0,Anonymous Employee,Spent 5 years at ServiceNow. Culture has really improved to attract more diverse and global talent base. Company is firing on all cylinders with its Industry Workflows. Lots of upside for those willing to put in effort.,"all the same things that you'll find at any company growing 33% QoQ/YoY. More layers, longer decision times but overall good leadership at all levels. Company on good track."
36,ServiceNow,Past Results Do Not Guarantee Future Performance,2022-03-15,2.0,Engineering Manager,"Stock price from 2016-2021
Pat Casey, Joe, Davis, , etc... Still some cool/smart people at the top of Engineering 
Platform is pretty neat","Stagnant code base
Company has largely transitioned from product to sales focused
Hard work often goes unrecognized in Engineering 
Shady vibes from East Coast C-Level takeover, competent Engineering leaders seem frustrated and are often sidelined
Hardly hiring any American engineers"
37,ServiceNow,Amazing company culture; emphasis on personal/professional growth,2022-03-15,5.0,Anonymous Employee,"Culture, compensation, work-life-balance, career opportunities, strong management.","Work can be siloed in some areas, lots of organizational changes, lots of movement in leadership."
38,ServiceNow,Exceptional Place to work,2022-03-08,5.0,Senior Enterprise Account Executive,Exceptional deliberate and holistic training and support. Diverse and inclusive culture that emphasizes people as its # priority. Extremely grateful to work at ServiceNow.,No cons to date to speak of to date
39,ServiceNow,Best place to work!,2022-03-13,5.0,Senior Manager,"Unbelievable team, executive leadership, values driven organization, unlimited PTO, lots of flexibility, working with people who care, making the world work better!",United health care for health insurance is the worst!
40,ServiceNow,You need to leave and come back to get hire pay,2022-01-31,5.0,Senior Sales Trainer,"It's a unicorn company
Growing Fast, a lot of potential to build something as a legacy
Very friendly amazing people
Plenty of opportunities to leave your mark and work for a company that is doing amazing things","It always comes down to money, pay raises are strict so in order to keep up with inflation or even where you live you may have to leave the company and come back. They pay outside hires more money than internal promotions"
41,ServiceNow,It's a pretty good place to work for,2022-03-15,5.0,Technical Support Engineer,"Great benefits, Good pay, and unlimited PTO",Not that I know of so far
42,ServiceNow,"Great Financially, horrible psychologically",2022-02-10,3.0,Director,Comp was excellent. Technical people are excellent.,"Yes, the comp was great. Hard to watch executives get cheered on for plagiarizing your work. Especially when those praising them are letting you know that they know it’s your work product. HR there only to protect executives so good luck reporting anything. Thanks for the money, so glad I don’t have to deal with all the fake people anymore."
43,ServiceNow,Great Starts begin with Great Onboarding,2022-01-12,5.0,Advisory Solution Consultant,"Service Now fully leverages its own technology in every aspect of its own enterprise organization. Onboarding was as simple as it gets, the pace of my knowledge build is controlled by me and well laid out to follow effectively.
This organization is in tune with employee productivity through engagement, balance and belonging. The Service Now platform provides great career opportunity for anyone with an average, or above average digital acumen.","Due to the vast capabilities and resources within Service Now, the beginning is a lot to take in. If you join Service Now, know that organization recognizes this and is constantly evolving to make the onboarding better. My own onboarding has been flawless."
44,ServiceNow,Amazing - just Amazing,2022-03-04,5.0,Senior Executive Recruiter,"Leadership is supportive, motivating and trusting of employees to do the right thing.","Tools and process can be immature in certain areas, but even this is changing rapidly for the better."
45,ServiceNow,Amazing place to work,2022-03-16,5.0,Sales Development Representative,- The culture is amazing,There is nothing bad to say!
46,ServiceNow,ServiceNow is an awesome company to work (I have been here for few months),2022-03-22,4.0,Senior Staff Data Engineer,"- One can be part of the digital transformation journey that Service Now is working across the enterprises and within the company too 
- Good work culture
- Leadership that drives for excellency",- Interview process can be shortened and made more efficient
47,ServiceNow,The ultimate coroporate to work for,2022-03-29,4.0,Staff Engineer,"Benefits
Work-life balance
Colture
Market sucesses
True believers in Diversity & Inclusion","Hard to get promoted
Excelence is not rewarded
Treat egineers as dymanic resources"
48,ServiceNow,LOVE it!  Best decision I've made career wise,2022-02-18,5.0,Instructional Designer,"Unlimited PTO, Annual Bonuses, Stocks, Company Card, 100% Remote, LOTS of flexible, task-oriented, family-oriented, competitive pay",Currently no Kaiser option outside of Cali (This should tell you a lot about how much I like working for the company if this is the worst I have to say 🤣)
49,ServiceNow,Depends on what you care about,2022-02-20,3.0,Director,"- Compensation usually above market
- (Formerly) great equity grants
- Very high growth
- Excellent marketing
- Extensive training opportunities","- Internal culture at management levels ranges from non-existent to toxic and hostile
- Once fully vested, people leave almost immediately, which shows how little the environment actually provides past compensation
- Despite internal messaging there is a sense that the music will stop sooner rather than later and things will get worse quickly
- Customers are beginning to dislike the company as much as they like the product"
50,ServiceNow,Great Opportunity For Technical Growth!,2022-02-24,5.0,Associate Software Engineer,"- Really Interesting product code base
- Incredibly willing and helpful mentors 
- Easy onboarding procedure
- Wonderful work life balance and work culture","- Size of code base, teams, products, etc is large which can be intimidating for a first job out of college.
- Documentation can be quite outdated or non existent"
51,ServiceNow,I love it hear,2022-02-11,5.0,Senior Technical Program Manager,"Challenging, meaningful work. Awesome management and coworkers, everyone is willing to talk to you and help.

Great benefits and compensation.","High growth means people change jobs somewhat frequently. This can cause continuity issues on longer programs. Not a huge issue, but sometimes piecing together what happened can be difficult."
52,ServiceNow,Great Place,2022-03-13,5.0,Customer Success Manager,"Great place to work, excellent",Sometimes too hands on for experienced pros
53,ServiceNow,Great company to work for,2022-03-11,5.0,Senior Staff Software Engineer,"Great environment, awesome coworkers, great leadership",Long hours and sometimes early or late meetings
